Deborah is over 60 years old and works as a janitor. The building she was cleaning had a confirmed case of coronavirus—but no one told her of the potential exposure. “I felt as if I didn’t matter.”   It's unconscionable. Workers must be protected. https://t.co/2tlGdHAlIe,2020-03-19 15:19:02,Sprout Social,2703,9645,corona; 
This is Jennifer Haller mother to two teenagers and the first volunteer to receive the experimental coronavirus vaccine this week. A true hero.  https://t.co/drzFxC3gIm,2020-03-19 01:03:01,Sprout Social,1196,6009,corona; 
Our nation’s domestic workers and caregivers do physically demanding and important work often without paid sick leave. Chip in what you can today to the @domesticworkers Coronavirus Care Fund: https://t.co/IGWM7durqe https://t.co/aT5h6zuton,2020-03-18 16:45:00,Twitter Media Studio,742,2310,corona; 
Americans can’t wait. The Senate must pass the Families First Coronavirus Response Act now. https://t.co/34bNjVyXb9,2020-03-18 14:16:01,Sprout Social,2569,11728,corona; 
Domestic workers and caregivers are on the frontlines of the coronavirus pandemic. Many of them are women or people of color who do not have basic protections like paid sick days. Congress must make sure they’re supported during this difficult time. https://t.co/4w9zaCiGfk,2020-03-17 15:35:52,Sprout Social,2979,11108,corona; 
What is the Bureau of Prisons doing to protect vulnerable incarcerated individuals and staff from coronavirus? My colleagues and I are demanding answers. https://t.co/ILcXHtiq5w,2020-03-15 16:03:00,Sprout Social,2264,10028,corona; 
McConnell must immediately call the Senate back in session to vote on the House-passed coronavirus relief package. Families can’t wait.,2020-03-14 14:33:00,Sprout Social,17159,97560,corona; 
We’re in the middle of a public health crisis and it’s critical we all take it seriously.   —Wash your hands with soap and water as often as you can.  —Keep a safe social distance from people.   If we’re going to slow down this virus it’s going to take all of us doing our part.,2020-03-13 17:40:02,Sprout Social,1878,9143,social distance; 
As colleges and universities across our nation make changes due to the coronavirus it’s critical that we think about how this will affect low-income students.  https://t.co/Mn5UVRG2DM,2020-03-13 00:20:01,Sprout Social,1047,4423,corona; 
This is outrageous. We are in the midst of a pandemic and Senate Republicans blocked paid sick leave for those affected by the coronavirus.   Congress must take action immediately to help working families.  https://t.co/hA50TV2nZI,2020-03-12 14:30:09,Sprout Social,14536,42865,corona; 
Americans deserve transparency about what the administration is doing to confront the coronavirus. https://t.co/E5dj4n1eaW,2020-02-26 15:37:01,Sprout Social,1696,6860,corona; 
Yesterday we had a Homeland Security committee meeting to discuss the coronavirus. No current Trump administration public health officials attended.   Americans deserve public hearings as soon as possible to know what this administration is doing in response.,2020-02-13 16:11:04,Sprout Social,15029,47627,corona; 
