Small businesses especially Black and minority-owned businesses urgently need relief to survive the effects of coronavirus this winter. @JoeBiden and I are committed to helping these businesses during this pandemic and get them the support they need to thrive in years to come.,2020-11-28 23:17:41,Twitter Web App,4609,53693,corona; 
Earlier today @DouglasEmhoff and I called Talisa a registered nurse in Chicago and a few of our nation’s frontline workers to thank them for everything they have done in the fight against COVID-19. We won’t be able to get through this without them. https://t.co/YKdLK0IKi1,2020-11-26 22:32:00,Twitter Media Studio,4485,57158,covid; 
Food banks across our nation are struggling to keep up with the demand due to COVID-19. Know that when @JoeBiden and I are in the White House we’ll fight food insecurity and address this crisis.   No one should go hungry in America. https://t.co/EUOAuDAR3E,2020-11-26 00:14:15,Twitter Web App,4309,38627,covid; 
As we head into the holidays it’s important we are socially distant but not emotionally distant. Take some time to text a loved one you haven’t seen in a while check in on your single friends or write that letter you’ve been putting off. We will get through this together.,2020-11-25 17:33:01,Sprout Social,6565,69102,socially distant; 
This afternoon @JoeBiden and I met with @usmayors to discuss how we’ll work together to beat COVID-19. Our nation’s mayors are at the forefront of this pandemic and deserve all the resources and support they need to succeed. https://t.co/Xvm5zpUTSc,2020-11-24 02:14:24,Twitter Web App,3615,51446,covid; 
As we head into this holiday week please take every precaution you can to keep yourself your family and your community safe. Wear a mask wash your hands and practice social distancing. Coronavirus cases are spiking across the country so we must remain vigilant.,2020-11-23 14:26:25,Twitter Web App,11318,123103,corona; 
Absolutely devastating. My heart aches for Raiden and every single person left behind in the wake of COVID-19. Please stay safe this weekend. https://t.co/MB80XzoCaw,2020-11-21 14:57:14,Twitter Web App,6845,64431,covid; 
This pandemic has hit communities of color particularly hard. Black Americans Latinos and Native Americans are 4x as likely to be hospitalized for COVID-19 as others.  @JoeBiden and I are committed to confronting these disparities head-on.,2020-11-18 02:08:59,Twitter Web App,6411,80615,covid; 
The Biden-Harris administration will get COVID-19 under control by listening to the experts implementing nationwide testing and tracing and ensuring vaccines are safe and free for all.,2020-11-16 15:11:34,Twitter Web App,14177,201460,covid; 
Black and Latino Americans are 3x as likely to contract COVID-19 and more likely to die from it.  The Biden-Harris administration is committed to controlling this virus and confronting these glaring racial health disparities.,2020-11-13 19:43:54,Twitter Web App,7778,87736,covid; 
Too many people are grieving the devastating loss of a loved one due to COVID—many of whom were forced to die alone. It shouldn’t have to be that way. On day one @JoeBiden and I will act to get this virus under control and save American lives.,2020-11-13 02:27:16,Twitter Web App,11748,144478,covid; 
If the Affordable Care Act is struck down communities of color would be hit particularly hard. We are at a greater risk of preexisting conditions and three times more likely to contract COVID-19.,2020-11-11 01:32:00,Sprout Social,6316,70469,covid; 
Yesterday @JoeBiden and I met with our COVID-19 Transition Advisory Board comprised of distinguished public health experts. This team will help translate the Biden-Harris COVID-19 plan into an action blueprint that we can put into place as soon as we are sworn in on January 20. https://t.co/2ZSIu0nmHx,2020-11-10 18:15:07,Sprout Social,5354,70736,covid; 
As @JoeBiden said yesterday we are facing a dark winter if we don’t get coronavirus under control. Please wear a mask to reduce the spread and save lives.,2020-11-10 14:56:01,Sprout Social,29530,339056,corona; 
On day one @JoeBiden and I are ready to tackle the coronavirus crisis. Tune now for remarks after our first COVID-19 Council briefing. https://t.co/2ynh7aDXjS,2020-11-09 16:46:44,Periscope,3653,47547,covid; corona; 
.@JoeBiden and I are ready to get COVID-19 under control. We’re ready to rebuild our economy. We’re ready to meet the challenges of the climate crisis. We’re ready to act to address systemic racism. And we’re ready to fight for you.,2020-11-09 15:02:02,Twitter Web App,24268,335117,covid; 
COVID-19 is still here. Please continue to wear a mask and practice social distancing.,2020-11-08 18:54:36,Twitter Web App,53075,574498,covid; 
When @JoeBiden and I are in the White House we’ll listen to the experts when it comes to public health create a pandemic board that oversees testing and make COVID-19 testing treatment and vaccines free for all Americans.,2020-10-31 03:21:00,Sprout Social,12562,111479,covid; 
Donald Trump still doesn’t have a plan to defeat coronavirus—but @JoeBiden and I do. https://t.co/TEchzozvOj,2020-10-31 02:42:09,Twitter Media Studio,4263,29980,corona; 
I know @JoeBiden and let me tell you: he’s no quitter.  Unlike the current president Joe is actually prepared to fight COVID-19 with a plan that follows science and prioritizes public health—not politics.,2020-10-29 19:58:01,Sprout Social,8358,72732,covid; 
Instead of working to provide COVID-19 relief to struggling Americans Mitch McConnell and Republicans chose to jam through a Supreme Court nominee—when more than 62 million people have already voted. It’s despicable and they must be held accountable.,2020-10-26 22:50:22,Twitter Web App,17404,98834,covid; 
The COVID-19 pandemic has laid bare the harsh truth: we don’t pay teachers nearly enough for their time talent and skills. @JoeBiden will make sure our teachers are paid what they deserve. https://t.co/Bi4SNB5M4R,2020-10-24 01:58:00,Twitter Media Studio,4554,29602,covid; 
More than 223000 people have died from coronavirus. Trump still doesn’t have a plan. We need a real leader in the White House who will listen to the scientists &amp; protect Americans—that’s @JoeBiden. https://t.co/cNdq3U4TTq,2020-10-23 18:53:07,Periscope,3188,17943,corona; 
Let’s be clear: Trump knew in January how deadly and lethal coronavirus could become—and deliberately misled the American people.   Now more than 222000 people are dead.,2020-10-23 01:11:06,Twitter Web App,21309,131019,corona; 
More than 219000 Americans have died from COVID-19 and we've seen the worst economic crisis since the Great Depression. The stakes could not be higher in this election. Join me live from Florida. https://t.co/XfO5VX1tyw,2020-10-19 16:01:43,Periscope,2020,7574,covid; 
Black Americans are dying from COVID-19 at 2x the rate of white Americans.   This pandemic has further reinforced historical inequities in our nation—and it is clear that confronting these disparities is not a priority for this administration.,2020-10-18 01:35:00,Sprout Social,10948,57052,covid; 
Late last night I learned a non-staff flight crew member &amp; a member of my team tested positive for COVID. I wasn’t in close contact—as defined by the CDC—with either during the 2 days prior to their positive tests.  I've had 2 negative tests this week &amp; am not showing symptoms.,2020-10-15 14:35:15,Twitter Web App,11655,132544,covid; 
Amy Coney Barrett will admit that COVID-19 is infectious. She’ll admit that smoking causes cancer. But whether climate change is real?   Apparently that’s up for debate.,2020-10-14 22:00:52,Twitter Web App,21092,117980,covid; 
Donald Trump and Mike Pence don’t have a national testing plan for coronavirus or a national strategy for contact tracing. They failed to lead and now more than 213000 Americans have lost their lives.,2020-10-10 18:00:03,Sprout Social,13136,69578,corona; 
The science is clear: social distancing and wearing masks prevents the spread of COVID-19 and saves lives. As we head into fall and winter we must follow the guidance of medical professionals like Dr. Fauci. Lives depend on it. https://t.co/XnSarobgDy,2020-10-09 21:27:26,Twitter Web App,4813,23961,covid; 
How Donald Trump and Mike Pence handled the coronavirus crisis is the greatest failure of any American presidency.,2020-10-08 01:10:43,Twitter Web App,59770,417709,corona; 
The Trump administration failed to address COVID-19 and now our students are paying the price. @JoeBiden and I will be ready on day 1 with a roadmap for reopening our schools and keeping kids and educators safe. https://t.co/2SQJipqzBj,2020-10-06 00:49:48,Twitter Web App,2513,10117,covid; 
The Biden-Harris plan to get coronavirus under control includes: free COVID-19 testing treatment and vaccines for everyone.,2020-10-06 00:29:59,Twitter Web App,27423,185229,covid; corona; 
Both @DouglasEmhoff and I were tested for COVID-19 this morning and thankfully we tested negative. This virus is still very much active across our country please continue to wear a mask and maintain social distancing.,2020-10-02 17:47:11,Twitter for iPhone,18131,179931,covid; 
Trump knew.  He knew COVID-19 passes through the air. He knew it was deadlier than the flu. He knew it was dangerous to everyone.  Yet he purposely downplayed the pandemic—and now more than 205000 Americans are dead.,2020-09-30 01:27:24,Twitter Web App,10548,45976,covid; 
From the beginning Trump knew how deadly coronavirus was—but he lied to the American people about the threat it posed. As a result America now has more than 7 million cases. Over 204000 people have died.  We need a president who will take this virus seriously—that’s @JoeBiden.,2020-09-27 17:21:00,Sprout Social,17683,88701,corona; 
Stopped by Flint Michigan today with local leaders to visit Black-owned small businesses that are rebuilding from the coronavirus crisis. @JoeBiden and I will help Americans build back better in Flint and in cities across our country. https://t.co/osQt13Y3F6,2020-09-22 23:31:47,Twitter Web App,3028,16535,corona; 
More than 6.8 million Americans have tested positive for coronavirus. 200000 are dead. They aren’t “nobody.” https://t.co/UpMA3Ad0uQ,2020-09-22 19:33:01,Sprout Social,8233,31347,corona; 
When given the chance to address the coronavirus pandemic and save American lives Donald Trump failed. Now America now has 6.8M infections and nearly 200000 Americans have died.  We need a president who will take this virus seriously. That’s @JoeBiden.,2020-09-21 21:27:45,Sprout Social,7141,32896,corona; 
This is heartbreaking. Our children deserve a president who will propose real solutions to combat systemic racism within all facets of our society—including how we address coronavirus. @JoeBiden will be that president.  https://t.co/P1XBqrL8XC,2020-09-20 15:05:02,Sprout Social,8147,34576,corona; 
Donald Trump knew coronavirus was deadly yet he still brought thousands of people together for his rallies—and wasn’t concerned about whether they were wearing masks or socially distanced. https://t.co/Wilg6O1bnq,2020-09-18 17:27:01,Sprout Social,3779,15758,corona; 
Trump deceived the American people by downplaying the seriousness of the coronavirus.  He knew it was airborne.  He knew it was deadlier than the flu. He knew young people could get it.   He knew and he deliberately misled. In November we must vote him out.,2020-09-17 21:48:02,Sprout Social,15947,67058,corona; 
American's health depends on confidence in the safety of a coronavirus vaccine. Watch live as @JoeBiden delivers remarks on developing and equitably distributing a safe and effective vaccine. https://t.co/xnVxz8O8aZ,2020-09-16 19:52:16,Periscope,1180,4431,corona; 
During last night’s @ABC town hall when asked whether he could have done more to stop the coronavirus pandemic Trump responded: “I don't think so.”  It's on tape. Trump knowingly downplayed the dangers of the virus and nearly 200000 Americans have died. We must vote him out.,2020-09-16 14:13:21,Sprout Social,17534,75987,corona; 
Donald Trump knew the grave threat COVID-19 posed to Americans. He knew and deliberately misled the American people. Tune in as I join community leaders in Las Vegas to discuss this and more. https://t.co/tF24KTar16,2020-09-16 02:00:00,Periscope,1556,5739,covid; 
Donald Trump knew how deadly COVID-19 was—yet he prioritized himself over the American people. https://t.co/X44ywRdWR3,2020-09-14 22:01:00,Twitter Media Studio,3599,12816,covid; 
When Trump was saying young people couldn’t get coronavirus he knew they could.  When Trump was saying it was the same as the flu he knew it was deadlier.  When Trump was purposely downplaying the severity he knew it passed through the air.   He knew.,2020-09-11 02:03:01,Sprout Social,39955,169466,corona; 
As @JoeBiden said earlier today Trump’s choice to knowingly downplay the seriousness of COVID-19 was “a life or death betrayal of the American people.”  As we mourn the 190000 Americans who have died we must also act. Vote him out.,2020-09-10 00:09:01,Sprout Social,15749,70802,covid; 
Trump knew in February.  He knew that COVID-19 passes through the air. He knew it is deadlier than the flu. He knew it is dangerous to more than just our elderly and vulnerable.  He purposely downplayed the pandemic. And now 190000 Americans are dead.,2020-09-09 21:41:35,Sprout Social,47979,178221,covid; 
Trump has abdicated his duty and failed to lead on every significant aspect of our country’s COVID-19 response. We can’t let that happen with a coronavirus vaccine. The stakes are too high to not get this right. https://t.co/tdf296qPbp,2020-09-09 01:15:46,Twitter Web App,4316,20233,covid; corona; 
As we head into Labor Day weekend please wear a mask practice social distancing and wash your hands.  Coronavirus cases are still on the rise in states across our country and these simple acts can protect you the people you love and complete strangers.,2020-09-04 13:18:54,Sprout Social,11711,62143,corona; 
Absolutely heartbreaking. Across our country over 184000 American lives have been claimed by coronavirus leaving families and communities torn apart. It’s not like this in the rest of the world. All we needed was a competent president. https://t.co/yEfW8t4C78,2020-09-02 14:30:41,Sprout Social,10096,38180,corona; 
The coronavirus advisors Trump is surrounding himself with? One who has been called the “anti-Dr. Fauci” doesn’t have a background in infectious diseases or epidemiology.   We need new leadership. Lives depend on it.  https://t.co/fYdfFJrxCi,2020-09-01 17:56:53,Twitter Web App,5873,22981,corona; 
Nearly 183000 Americans have died from coronavirus.  More than 16 million out of work. Students across the country can’t go back to campus. More than 110000 small businesses closed for good.  This is Trump’s America.,2020-08-31 23:48:01,Sprout Social,18654,77892,corona; 
As President @JoeBiden will put his coronavirus plan into effect on day one: →Deploy rapid tests with immediate results →Manufacture the medical supplies and PPE we need →Implement a nationwide mandate to wear a mask—in Joe’s words not as a burden but to protect each other,2020-08-28 03:02:07,Twitter Web App,6606,29429,corona; 
Here’s the reality: the United States has nearly six million confirmed cases of coronavirus 180000 lives lost and more than 50 million claims for unemployment this year alone.  It didn’t have to be this way. https://t.co/ee61Zr9j2d,2020-08-28 02:18:32,Twitter Media Studio,4018,14155,corona; 
The numbers that define the crisis we’re facing today are staggering:  →Nearly 6M confirmed cases of coronavirus →180000 lives lost →More than 50M claims for unemployment this year alone  We need to see and hear what’s happening in our country.,2020-08-27 19:12:07,Twitter Web App,2604,8875,corona; 
The consequences of Trump’s failure to lead and combat the coronavirus have been catastrophic. Tune in now. https://t.co/BB4eVkk3yF,2020-08-27 19:03:59,Periscope,3540,9797,corona; 
Eight months into the coronavirus crisis and Donald Trump still doesn’t have a national strategy to protect Americans—but @JoeBiden does.  Tune in at 3pm ET today to learn how we can move our country forward. https://t.co/jTr6wDUNGz,2020-08-27 14:49:18,Sprout Social,4205,16848,corona; 
Trump minimized the seriousness of the coronavirus crisis. He muzzled public health experts. And misled the American people.  Now we’re all paying the price for his failed leadership.,2020-08-27 02:56:13,Twitter Web App,7984,37945,corona; 
Let’s be clear where Trump and Pence got us: millions out of work students across our nation who cannot go back to school and 180000 lives cut short by coronavirus.,2020-08-27 02:40:58,Twitter Web App,28482,135466,corona; 
Let's be real clear: Donald Trump failed to take coronavirus seriously from the start. His lack of leadership cost millions of Americans their jobs and led to more than 110000 small businesses closing for good.   Americans deserve a real leader to fix this—and that’s @JoeBiden.,2020-08-25 23:54:01,Sprout Social,18406,92889,corona; 
While coronavirus touches us all it is not an equal opportunity offender.  This virus has no eyes and yet it knows exactly how we ​see​ each other—and how we ​treat​ each other.   Let’s be clear: there is no vaccine for racism. We’ve gotta ​do​ ​the​ ​work​.,2020-08-20 16:55:02,Sprout Social,4383,27347,corona; 
Just look where Donald Trump and Mike Pence got us: more than 16 million out of work. Millions of kids who cannot go back to school. More than 165000 lives have been cut short by coronavirus many with loved ones who never got the chance to say goodbye.  This was preventable.,2020-08-14 01:35:43,Sprout Social,30958,162716,corona; 
This weekend we surpassed 5 million coronavirus cases in the United States.   ...And there is still no adequate national testing strategy. Trump and his administration have failed Americans.,2020-08-10 19:37:01,Sprout Social,6048,28061,corona; 
Over 155000 Americans have died from coronavirus and Trump argues it’s not so bad.  Let’s end this national nightmare in 91 days by electing @JoeBiden.  https://t.co/iOF9sm1Jp9,2020-08-04 16:03:07,Sprout Social,3345,12763,corona; 
One teacher already died from coronavirus. Two more are sick. And the new school year hasn’t even started.   A gut-wrenching read about the impossible decisions our educators are facing. They deserve so much better.  https://t.co/x2Ol9ccM55,2020-08-03 17:26:01,Sprout Social,2625,7547,corona; 
Trump’s repeated racist rhetoric tries to place blame for his coronavirus failures on anyone but himself. It’s dangerous and it’s wrong—and has real life consequences for Asian Americans and Asian immigrants. https://t.co/5XIwxivEcr,2020-08-02 22:41:00,Sprout Social,2667,8617,corona; 
In the next coronavirus relief package it's imperative Congress ensures people have basic necessities such as a roof over their head food on the table safe and affordable water and access to the internet. https://t.co/Zsj0r1CKuB,2020-07-31 01:51:00,Sprout Social,826,3433,corona; 
Republicans’ coronavirus relief plan sells out working families by slashing the expanded unemployment benefit to $200 and failing to stop evictions and foreclosure—all while loosening rules for Big Banks and putting a new FBI headquarters down the road from the Trump Hotel.,2020-07-29 23:23:00,Sprout Social,3322,9779,corona; 
Donald Trump ignored early coronavirus warning signs. Dismissed the seriousness of the threat. Attacked the advice of doctors and scientists. Failed to institute an adequate national plan for testing and contact tracing.  Now nearly 150000 Americans have died. This is on Trump.,2020-07-29 14:31:46,Sprout Social,9787,38284,corona; 
The Trump administration’s complete mismanagement of the coronavirus crisis has worsened longstanding disparities in our country. Tune in now to hear @JoeBiden discuss how we can combat systemic racism and advance racial economic equity moving forward. https://t.co/xzbsU07s3j,2020-07-28 19:21:41,Twitter for iPhone,498,1675,corona; 
The Republican’s coronavirus relief proposal released yesterday fails to stop evictions or foreclosures. People are hurting in America deeply hurting and they’re worried they’re going to lose the roof over their head. My RELIEF Act would help give them peace of mind. https://t.co/SzIGYWWa6H,2020-07-28 14:51:51,Twitter Media Studio,791,2871,corona; 
Yesterday the U.S. surpassed 4M coronavirus cases.  There's still no adequate national testing strategy. There's still no adequate national contact tracing strategy.  There's still no adequate national PPE strategy.  Trump can’t absolve himself of responsibility—this is on him.,2020-07-25 01:46:00,Sprout Social,5326,19966,corona; 
Yesterday Trump said “We’ve done much better than most” in response to coronavirus.   Reality tells a different story.  https://t.co/bICFSiuB3q,2020-07-22 19:38:01,Sprout Social,5456,14094,corona; 
Donald Trump has absolved himself of any responsibility when it comes to the coronavirus crisis that has left 142000 Americans dead—yet is willing to make the burden on cities worse by deploying federal agents. https://t.co/SNFZykN7qu,2020-07-22 14:40:58,Twitter Media Studio,1620,5455,corona; 
Trump is trying to incite fear and distract from his repeated coronavirus failures by sending in camouflaged federal agents. He must withdraw these agents from Portland immediately. https://t.co/uSht7xHlr9,2020-07-22 00:03:48,Twitter Media Studio,1885,6277,corona; 
The Trump administration burying their heads in the sand won’t make coronavirus magically disappear.   It’s here. It’s real. And unless Republicans grow a spine and stand up to this dangerous decision more Americans will die.  https://t.co/CjCIW4XR5a,2020-07-19 14:57:14,Sprout Social,2828,9364,corona; 
Five months ago when asked about coronavirus Trump said “We have it totally under control.” Yesterday we passed a grim milestone with over 77000 cases in a day.  This was avoidable.  https://t.co/vCXLm4BaqP,2020-07-17 15:47:05,Sprout Social,1582,5332,corona; 
To say this is alarming is an understatement. Trump has tried to minimize this crisis from the very beginning. He repeatedly said he wishes there were fewer cases. Americans deserve to know critical coronavirus data is free from political interference.  https://t.co/9FVnJusnvo,2020-07-15 18:09:02,Sprout Social,4387,13170,corona; 
There are more than 35M people living with a disability who are eligible to vote. But too often voting is inaccessible. This National Disability Voter Registration Week I’m calling on Congress to pass my VoteSafe Act to make voting in the age of coronavirus accessible for all.,2020-07-13 19:18:01,Sprout Social,2499,9326,corona; 
Tune in after #GetUpStandUp2020: I'm going to be on @TheLastWord with @Lawrence on @MSNBC at 10pm ET to discuss our nation's response to coronavirus and today's latest news.,2020-07-10 01:34:07,Sprout Social,490,2224,corona; 
African Americans and Latinos are 3x as likely to get coronavirus—and 2x more likely to die—than white people.  This admin tried to hide the disproportionate impact coronavirus has on our communities. This is exactly why I called for a racial disparities task force months ago.,2020-07-09 02:02:00,Sprout Social,4713,20224,corona; 
At a coronavirus testing site in New Orleans tests ran out 5 minutes after the doors opened. In Phoenix people waited in their cars up to 8 hours to get tested. It’s outrageous that in July we still don’t have enough tests for everyone who needs it.  https://t.co/tVWmXvJL9p,2020-07-08 23:50:02,Sprout Social,2859,8351,corona; 
Trump attempted to muzzle public health experts. Repeatedly said coronavirus was "under control." Refused for a long time to wear a mask to ensure people took this threat seriously.  At a time when Americans are depending on competent leadership Trump has failed again and again.,2020-07-03 19:21:01,Sprout Social,2880,12148,corona; 
Coronavirus doesn’t take holidays off. This weekend please wear a mask maintain social distancing and wash your hands. It can save your life the lives of the people you love and complete strangers.,2020-07-03 13:48:03,Sprout Social,7348,34568,corona; 
1 in 1500 Black Americans has died from coronavirus.  This pandemic is further reinforcing historic inequities we’ve had in our nation long before we ever heard the word “coronavirus.” Confronting these disparities must be at the forefront.,2020-07-02 22:47:02,Sprout Social,4632,17896,corona; 
The United States just hit 50000 new coronavirus cases in a day yesterday—and we were warned we could see 100000 per day.  Instead of taking meaningful action to reduce cases Trump is waving the white flag. https://t.co/ON6wzSIt6n,2020-07-02 14:44:51,Sprout Social,2092,6615,corona; 
This is absurd. No one in our country should have to jump through loopholes in order to get their coronavirus tests and treatment covered. It needs to be free. https://t.co/o1LdtYjv7H,2020-07-02 00:24:39,Sprout Social,1305,4613,corona; 
Coronavirus has killed nearly 130000 Americans. We were warned the U.S. could see 100000 new cases a day.  Yet there is still no adequate national testing strategy.  It could not be more clear: Trump has surrendered to this virus and abandoned Americans.,2020-07-01 17:41:01,Sprout Social,6018,23427,corona; 
Joining @CapehartJ tomorrow at 3:30pm ET to chat about what we’re doing in Congress to address police brutality and the ongoing coronavirus pandemic. Sign up now: https://t.co/wHdxhTLMYD https://t.co/v4fYJd4tFE,2020-07-01 16:27:02,Sprout Social,161,548,corona; 
