Mass unemployment crisis ➡ mass uninsured crisis.   COVID shows how much of a failure it is to link health care to employment. And remember 87 million were already uninsured or underinsured BEFORE the pandemic! Health care is a human right. Guarantee it with Medicare for All. https://t.co/fRDAHrq9Wa,2020-06-29 17:20:08,Twitter Web App,110,290,covid; 
This is NOT over. Whether it's putting predatory for-profit colleges over the students they cheated stealing COVID relief from public schools or working to privatize education DeVos must be stopped.  I won't stop fighting back. I hope you won't either. https://t.co/xWU0qIKXdS,2020-06-27 17:07:25,Twitter Web App,168,582,covid; 
COVID-19 is hitting the Latinx community particularly hard. Not unrelated to the fact that Latinx individuals are disproportionately the heroes working on the frontlines of this pandemic. Let's fight to ensure they have hazard pay paid sick leave and guaranteed health care. https://t.co/MCMQFIkXrd,2020-06-27 01:19:30,Twitter Web App,291,949,covid; 
COVID hasn't stopped. COVID relief shouldn't stop either. We must act now to get help directly to people in Seattle and across this country—so they can make rent pay their bills and put food on the table. https://t.co/lUn1akQcOs,2020-06-26 21:05:00,TweetDeck,73,282,covid; 
Donald Trump calling COVID-19 the “kung flu” is the same racist xenophobic bigoted fear mongering crap we've always heard from him.  We are so much better than this hate division and dangerous rhetoric. And we are going to defeat it. https://t.co/quJUZAZD1V,2020-06-25 03:20:51,Twitter Media Studio,93,501,covid; 
Raúl survived colon cancer. He survived a kidnapping. Now we must ensure he survives COVID too.   Immigrants should have full access to public health precautions. Let's pass my FIRST Act to immediately end the inhumane conditions at ICE detention centers. https://t.co/QCCRQF8JGu,2020-06-24 15:15:00,TweetDeck,20,57,covid; 
We must rapidly scale up production of PPE to meet current needs and prepare for the next wave of COVID-19.  @HerreraBeutler and I just led a bipartisan letter calling on Trump to invoke the Defense Production Act to jump-start domestic production of PPE. https://t.co/bscLCKJBME,2020-06-23 22:15:46,Twitter Web App,86,245,covid; 
At least 27 million people have lost their health care at a time they needed it the most simply because they lost a job during COVID.  During yesterday's @EdLaborCmte I argued that this has exposed the fundamental flaw of tying insurance to employment. We need Medicare for All. https://t.co/HKTNqg0DlV,2020-06-23 21:00:00,Twitter Media Studio,49,142,covid; 
ICE detention facilities continue to be tinderboxes for COVID but the Trump Administration has doubled down on its inhumane treatment of immigrants. We must pass my FIRST Act to ensure immigrants finally have access to crucial public health precautions. https://t.co/CUJzUgbW9l,2020-06-23 15:00:01,TweetDeck,72,216,covid; 
There are several instances of Trump Administration officials making money off our response to COVID-19. That is the definition of corruption.  I joined @SenWarren to demand accountability. It’s time to pass our CORE Act. https://t.co/9Hqb8M0tHz,2020-06-17 23:05:00,TweetDeck,187,585,covid; 
Racial disparities have long existed in our health care system and we're seeing it as COVID-19 disproportionately impacts Black communities.  Ensuring that data on race is included in CDC and health agency reports is crucial to ending these disparities. https://t.co/0oP7mPTpJR,2020-06-17 18:31:20,Twitter Web App,26,57,covid; 
This is so dangerous. More American lives have already been lost from COVID-19 than were lost during WWI.   We need to respond to this unprecedented public health and economic crisis head-on and with urgency.  https://t.co/HIBKZKlau7,2020-06-17 02:00:00,TweetDeck,74,168,covid; 
We've lost more American lives from COVID than we lost during WWI. As this crisis continues essential &amp; frontline workers continue to see their health put at risk. And that's particularly true for those who are pregnant.  We must prioritize worker safety. https://t.co/04RloCPoak,2020-06-15 23:45:00,TweetDeck,66,188,covid; 
We have now lost more American lives from COVID-19 than we did during the first World War.  This public health crisis has caused unprecedented economic devastation too. We still have the opportunity to respond at the scale necessary. But we must be bold and we must act right now.,2020-06-14 18:00:00,TweetDeck,301,928,covid; 
COVID-19 has exposed the fundamental flaws of our corrupt for-profit health care system. It's long overdue that we guarantee health care to everyone in this country.  We need Medicare for All. https://t.co/86SaFRR87g,2020-06-14 01:15:32,Twitter Media Studio,243,979,covid; 
An achievement gap that exists after decades of underfunding our public schools continues to widen during COVID-19. We need to fully invest in public education and target relief to ending the achievement gap altogether. https://t.co/oqOeDqUobc,2020-06-12 18:20:56,Twitter Web App,21,72,covid; 
🚨 In 15 minutes 🚨 Our corrupt for-profit health care system has long been broken but COVID-19 has made this situation a lot worse. At 9 PT 12 ET I'm hosting a panel with @RepDebDingell on why we need Medicare for All NOW. Sign up here: https://t.co/aqBmNyN9NC,2020-06-12 15:44:37,Twitter Web App,22,62,covid; 
Now let's get in formation for FREE drive through COVID-19 testing this weekend thanks to @Beyonce and Tina!  🚙Sat: 11-5 at HealthPoint 955 Powell Ave SW in Renton  🚙Sun: 11-5 at SeaMar 31405 18th Ave S in Federal Way https://t.co/ETjsCx8Aya,2020-06-12 01:00:00,TweetDeck,100,257,covid; 
.@NNUBonnie has been a fierce champion in our fight for Medicare for All and a crucial voice on workplace safety during COVID-19.  I am so proud to be in the fight with her to build a just health care system while fully valuing the work of nurses. https://t.co/DXnG5Xe9QA,2020-06-12 00:05:00,TweetDeck,21,49,covid; 
This at a time when minority-owned businesses were almost completely locked out from receiving PPP funds!   We must pass my and @SenWarren’s CORE Act to ensure stronger oversight accountability and transparency in the federal response to COVID-19. https://t.co/gqIXuH1Fz5,2020-06-11 20:10:07,Twitter Web App,254,701,covid; 
This at a time when minority-owned businesses were almost completely locked out from receiving PPP funds!   We must pass my and @SenWarren’s CORE Act to ensure stronger oversight accountability and transparency in the federal response to COVID-19. https://t.co/gqIXuH1Fz5,2020-06-11 20:10:07,Twitter Web App,254,701,covid; 
COVID-19 is not only an unprecedented public health crisis but it also added to a mass uninsured crisis.  I'm hosting a Medicare for All Caucus hearing with @RepDebDingell on why this moment demands Medicare for All. Join us tomorrow at 12 ET. RSVP here: https://t.co/aqBmNyN9NC,2020-06-11 17:30:00,TweetDeck,35,68,covid; 
Communities of color are not only at a greater risk of getting COVID-19 they're also more likely to be uninsured.  This crisis has highlighted what we’ve long known: our cruel for-profit health care system is a complete failure. We need Medicare for All. https://t.co/m9lXG3ALlR,2020-06-11 02:37:28,Twitter Web App,107,301,covid; 
The rate of people experiencing homelessness was already growing before this crisis but COVID has made the situation a lot worse.   My Housing Is A Human Right Act would authorize $300 billion for critical housing infrastructure. https://t.co/s1CWMPndOo,2020-06-09 18:00:01,TweetDeck,44,172,covid; 
As PPP failed to help minority-owned businesses the unemployment rate for Black workers continued to rise.   Our policy responses to COVID-19 shouldn't leave some workers behind. The Paycheck Recovery Act will get urgent relief to ALL workers. https://t.co/abrssOl29F,2020-06-08 17:50:00,TweetDeck,49,182,covid; 
Immigrants in ICE facilities have no ability to physically distance or stay healthy. Now COVID-19 is spreading like wildfire in these places. We must pass my FIRST Act to ensure immigrants have access to critically necessary public health precautions. https://t.co/asneJmuBXX,2020-06-06 20:05:00,TweetDeck,128,329,covid; 
During COVID-19 we've seen the many ways that environmental injustices leave communities of color disproportionately vulnerable.   This new order is not only dangerous for our planet but also cruel to the people who have been impacted the most.  https://t.co/0sBWLm79kX,2020-06-05 20:15:00,TweetDeck,49,95,covid; 
Workers shouldn't have to risk catching COVID-19 to get their paycheck. Businesses shouldn't have to risk closing permanently to avoid re-opening before it's safe.  The Paycheck Recovery Act is the solution—getting direct relief to workers and businesses. https://t.co/xEmTBWrkjc,2020-06-04 22:19:45,Twitter Web App,49,137,covid; 
▶2 million more workers unemployed last week ▶11 weeks straight of new jobless claims in the millions ▶43 million filing for unemployment during COVID-19  We need a policy response that matches the scale and urgency of this crisis. The Paycheck Recovery Act does exactly that. https://t.co/Rm5H7GYljQ,2020-06-04 15:56:14,Twitter Web App,43,132,covid; 
Our response to COVID must be intentional addressing the fact that this crisis has been worse for Black Americans: ➡️Higher positive testing and death rate ➡️Disproportionate levels of unemployment ➡️Lack of relief for black businesses ➡️Vast racial wealth and income disparities https://t.co/S80kbrJutJ,2020-06-03 20:59:13,Twitter Web App,23,79,covid; 
At least 27 million workers have lost their health care thanks to a for-profit system that ties insurance to employment.   Join me and the Medicare for All Caucus tomorrow at 4ET for a discussion about how COVID makes the case for Medicare for All. RSVP⬇ https://t.co/aqBmNyvyp2,2020-06-03 18:00:00,TweetDeck,44,109,covid; 
I'm glad to see the Governor take this step as the rate of people experiencing homelessness is projected to increase 40-45% during COVID-19.   I’ll also keep fighting to pass the Housing is a Human Right Act which would authorize $300 billion for crucial housing infrastructure. https://t.co/8vK8AEiXHj,2020-06-03 15:34:39,Twitter Web App,52,268,covid; 
To actually stand in solidarity with the Black community: ➡Stop selling face recognition tech that profiles Black people ➡Continue and increase hazard pay for workers during COVID ➡Allow for paid leave so workers don't have to choose between getting sick and getting a paycheck https://t.co/KeINO5OSHx,2020-06-02 20:16:10,Twitter Web App,248,743,covid; 
The positive testing rate for COVID-19 in ICE detention facilities is 51% with more than 1400 positive cases.   We must pass my FIRST Act to finally give immigrants the same access to public health practices as the rest of us. https://t.co/ijdnuf9W2h,2020-05-30 19:05:30,Twitter Web App,32,54,covid; 
DeVos is taking relief away from our public school classrooms and sending it to private schools owned by her wealthy friends. This is only the most recent dangerous effort by Trump and DeVos to privatize education. We need strict oversight on COVID relief. https://t.co/LJmnDQ5VmR,2020-05-29 02:00:00,TweetDeck,134,291,covid; 
The federal government’s response to COVID has not met the scale of the crisis &amp; Washington workers &amp; businesses are paying the price. We need bold solutions like my Paycheck Recovery Act to get relief directly to workers and businesses across the state. https://t.co/45OfUc5bVH,2020-05-28 22:30:00,TweetDeck,13,61,covid; 
It never needed to be this way. During COVID-19 other countries have stepped up to directly cover the wages of workers for the duration of this crisis. We must do the same with my Paycheck Recovery Act. https://t.co/yiXHwqG3Bt,2020-05-28 20:30:00,TweetDeck,41,194,covid; 
I asked OSHA if they're tracking COVID cases in workplaces.  Their answer was NO.  We're months into a crisis that puts workers directly in harm's way—yet OSHA is still NOT tracking infections. This is unacceptable and is costing workers their lives. This incompetence must end. https://t.co/dxbtFH2UYB,2020-05-28 20:05:00,Twitter Media Studio,110,288,covid; 
Even before COVID-19 our homelessness crisis demanded urgent government action. Now hundreds of thousands more could be housing insecure. Here’s how my Housing is a Human Right Act can help ⬇️https://t.co/fTMvKlcnf3,2020-05-28 18:45:00,TweetDeck,12,51,covid; 
Sheltering in place was a way of life for immigrants fearing deportation long before COVID19 hit. We must come out of this crisis with a more humane immigration policy that honors the contribution of immigrants like Antonio. https://t.co/4tmAyCey8W,2020-05-28 18:00:01,TweetDeck,11,47,covid; 
2.1 million additional workers filed for unemployment last week alone—bringing the total number of job losses during COVID-19 to 40.8 million.  We must pass the Paycheck Recovery Act now to stop the flow of mass unemployment and get urgent relief into the hands of workers. https://t.co/2qbN1kiW0B,2020-05-28 13:20:06,Twitter Web App,62,212,covid; 
➡A death rate 3X higher ➡A higher + infection rate ➡A larger uninsured rate ➡A disproportionate unemployment rate ➡A lack of access to PPP for businesses   COVID has exacerbated our profound racial inequities. Our policy response must be intentional. https://t.co/kvHh8AWyFp,2020-05-28 01:30:00,TweetDeck,45,140,covid; 
"The faltering health care system under the strain of this global pandemic is the single strongest argument for a universal single-payer health care system in our lifetime."   This for-profit system has made COVID-19 worse. We need Medicare for All now. https://t.co/PS3Ze6sMkG,2020-05-27 21:05:00,TweetDeck,87,238,covid; 
Our broken for-profit system has caused 27 million people to lose their health care during COVID joining the 87 million who were already uninsured or underinsured.  Health care is a human right. And this crisis has emphasized why we need #MedicareForAll. https://t.co/VFfmP5GuVO,2020-05-26 23:05:00,TweetDeck,63,209,covid; 
Today there are 1312 positive cases of #COVID19 in ICE detention facilities with a horrifying positive testing rate of 52%.  Immigrants need access to basic public health precautions immediately. We need to pass my #FIRSTAct. https://t.co/HFYP9VgpTy,2020-05-26 22:40:46,Twitter Web App,33,93,covid; 
“The greatest risk of this pandemic is that we’ll come out on the other side with an unchanged health care system.”  COVID has demonstrated how profoundly broken our health care system is. We need to fix it now—we must pass Medicare for All. https://t.co/frcjJAQDA6,2020-05-26 18:00:01,TweetDeck,113,380,covid; 
More than 4 in 5 Americans support monthly relief checks in response to #COVID19. The people understand that this crisis requires a response that delivers certainty. It’s time to pass @RepRashida and my #ABCAct. #MintTheCoin https://t.co/LSOOdlChi0,2020-05-23 21:00:00,TweetDeck,110,413,covid; 
Every country is impacted by COVID-19. But not every country is seeing a mass unemployment crisis go from bad to worse. They have stopped mass unemployment by directly covering paychecks.   My Paycheck Recovery Act will do the same.  https://t.co/unEBzu0H59,2020-05-23 01:00:00,TweetDeck,44,179,covid; 
While #COVID19 has demonstrated the confounding health effects of excess air pollution Trump's EPA refuses to respond with the urgency this deserves. I joined @SenDuckworth @RepLBR and 58 colleagues in sending a letter to @EPA that calls on them to continue air monitoring. https://t.co/vttD89JtMX,2020-05-22 19:55:10,Twitter Web App,15,48,covid; 
There are now 1181 cases of COVID in ICE detention facilities with a terrifying 50% positive rate. This indicates that there could be many more positive cases.   We can't delay passing the FIRST Act any longer. https://t.co/LaCpdX0Rcv,2020-05-22 17:42:17,Twitter Web App,32,74,covid; 
My thoughts are with the people of India and Bangladesh who were already facing a #COVID19 public health crisis and are now having to recover from Cyclone Amphan too. This crisis requires a collective global response. https://t.co/GRgEHAVMX4,2020-05-22 14:30:00,TweetDeck,21,103,covid; 
We’ve lost more American lives in a matter of weeks than we did during the nearly two decades of the Vietnam War.  COVID-19 has caused historic devastation while impacting all of us. How we choose to respond must meet the scale of this crisis. We must be bold and we must act now.,2020-05-22 03:00:00,TweetDeck,130,498,covid; 
COVID-19 has disproportionately impacted communities of color during this crisis. That’s in no small part due to inadequate access to health care. Medicare for All would change that. https://t.co/vrBsDH3OMz,2020-05-21 20:45:00,TweetDeck,30,99,covid; 
They're not even trying to hide the corruption anymore. The vaccine czar Trump appointed is a former pharma exec who holds millions-worth of stock options in a company working to profit off a COVID vaccine. We need oversight on the response to this crisis. https://t.co/zNFyYZ5IDb,2020-05-20 23:30:00,TweetDeck,333,795,covid; 
ICE detention facilities were warned to be a “tinderbox” for COVID-19 by public health experts. Now there are 1145 cases with a 52% positive test rate.  Immigrants need access to basic public health precautions. We must pass my #FIRSTAct. https://t.co/2Xe4HK0mzk,2020-05-20 19:15:20,Twitter Web App,28,91,covid; 
.@BetsyDevosED is at it again. Her decision to exclude DACA TPS DED and undocumented students from #COVID resources only exacerbates this crisis. ALL students should be able to access this critical relief. I applaud @AGOWA for fighting to make this right. https://t.co/jjZKk1TVlI,2020-05-20 17:35:33,Twitter Web App,30,75,covid; 
How COVID will put millions of older Americans retiring into poverty: 22 percent of middle-income workers &amp;15 percent of higher-income workers aged 50 to 60 will lose their jobs as a result of the COVID economic crisis.  https://t.co/TiVTrYAQyO,2020-05-20 15:03:24,Twitter Web Client,20,38,covid; 
At least 27 million people have lost their health care during #COVID19. That’s in addition to the 87 million who were already uninsured or underinsured. It couldn’t be more clear: We need Medicare for All. We’ve needed it for a long time. https://t.co/xlnzlmPLDt,2020-05-19 18:30:00,TweetDeck,98,283,covid; 
2⃣HR 6918 is not just an economic recovery plan; it’s a public health plan too. At a time when at least 27 million people have lost health care during #COVID19 this bill also covers the costs of returning workers to their employer-sponsored benefits including health insurance.,2020-05-19 17:31:17,Twitter Web App,77,241,covid; 
There are now 1073 cases of COVID in ICE detention facilities with a frightening 49% positive test rate.   ICE detention facilities are a public health disaster and every day that we don’t pass my #FIRSTAct more lives are put in danger. https://t.co/rmupnL9yvi,2020-05-19 16:17:29,Twitter Web App,26,80,covid; 
We can’t beat a pandemic if people are losing their health care or didn’t have health care to begin with.   COVID-19 has proved what we’ve known all along and what I’ve been saying for years: we need Medicare for All.,2020-05-19 01:00:00,TweetDeck,159,638,covid; 
We have seen a stark rise in acts of horrific anti-Asian bias and acts of violence in light of #COVID19. Proud to stand with @ActToChange and so many others in the #AAPI community to commemorate the 2nd annual #DayAgainstBullying. #APAHM https://t.co/qwKJkrEldL,2020-05-18 21:05:07,Twitter Web App,18,79,covid; 
With many unable to afford rent this crisis will force thousands more into housing insecurity unless we intervene. We must pass my #PaycheckGuaranteeAct and #HousingIsAHumanRight Act to ensure people get the support necessary to weather #COVID19. https://t.co/ovuJK7Gnuj,2020-05-18 18:15:00,TweetDeck,52,148,covid; 
People exposed to higher amounts of air pollution are seeing spikes in the number of deaths during this crisis.   #COVID19 is an environmental justice issue—and we must urgently meet the scale of this crisis with a massive investment in these communities. https://t.co/bfmAySHXQS,2020-05-18 15:15:00,TweetDeck,29,80,covid; 
It’s not a “may happen” anymore -- there are nearly 1000 immigrants in detention who have tested positive of #COVID19 at a 48% positive test rate. The more we delay in passing the FIRST Act the more lives there we put at risk. https://t.co/O1lAhx3s11,2020-05-16 21:00:00,TweetDeck,36,123,covid; 
As of today there are 986 immigrants in ICE detention who have tested positive for #COVID19 at a frightening 48% positive test rate.  Every day that we don’t pass my #FIRSTAct more lives are needlessly put at risk. https://t.co/5sKYirw7QF,2020-05-16 16:15:55,Twitter Web App,44,103,covid; 
As of today ICE has 943 confirmed cases. That’s a 53% positive rate. It’s clear that #COVID19 is spreading quickly in ICE facilities—leading to a shockingly high rate of positive cases. This is inhumane. More lives are at risk each day that we don’t pass my #FIRSTAct. https://t.co/Ly0UJuZTQo,2020-05-14 22:03:28,Twitter Web App,373,801,covid; 
Tying employment to health insurance is a threat to all of our public health. #COVID19 has shown us the worst of our current insurance system. We need #MedicareforAll. https://t.co/p95AkKoXbZ,2020-05-14 20:35:07,Twitter Web App,46,184,covid; 
ICE is keeping immigrants in inhumane conditions and it's leading to the rapid spread of #COVID19. We must pass my #FIRSTAct and put public health first. https://t.co/x70cuP1ioK,2020-05-14 18:55:05,Twitter Web App,47,166,covid; 
Immigrants locked up by ICE can't physically distance &amp; don't have access to hygiene materials. It's led to a rapid increase in the cases of #COVID19. We must pass my #FIRSTAct so immigrants have access to the same public health practices as everyone else. https://t.co/35YYltI5DQ,2020-05-14 17:15:00,TweetDeck,25,93,covid; 
Fear and misinformation about #COVID19 have led to an increase in acts of bias and xenophobia. If you experience or witness such an act report it to @SEACivil_Rights Anti-Bias hotline at 206-233-7100. You can also report online at https://t.co/O7zrdVB05T. #SeattleTogether,2020-05-14 15:00:01,TweetDeck,28,63,covid; 
Looking forward to hosting an online briefing about racial disparities during #COVID19. I hope you'll join the discussion on my Facebook Live at 5:15PM PT. https://t.co/t3Zl3MUSjw https://t.co/WoOLDLSQs4,2020-05-13 23:45:00,Twitter Media Studio,8,26,covid; 
#COVID19 has exacerbated many of the racial inequities that exist both in Washington and across our country. I’ll be hosting an online briefing about racial disparities during this pandemic today at 5:15PM PT. I hope you’ll join me for this important conversation. https://t.co/D38VrmiSUB,2020-05-13 21:45:00,Twitter Media Studio,21,61,covid; 
Instead of ensuring our public health is protected Trump is using #COVID19 to fulfill his draconian effort to close off this country from asylum seekers​. It’s time to end this inhumane policy and uphold our commitment to protect those fleeing violence. https://t.co/eWFCBP47fF,2020-05-13 20:30:00,TweetDeck,18,61,covid; 
State legislators across WA are witnessing the impact of #COVID19 on workers businesses and their communities. 44 of them wrote to our Congressional delegation urging us to pass the #PaycheckGuaranteeAct a policy solution that matches the scale of this crisis. https://t.co/n1RZiAxbe5,2020-05-13 19:50:03,Twitter Web App,26,74,covid; 
#COVID19 is disproportionately impacting the #Latinx community in Washington: essential workers who can’t shelter-in-place higher uninsured rates and receiving fewer PPP loans. Our policy responses must be equitable. https://t.co/XzVy7IgaLo,2020-05-13 18:00:00,TweetDeck,22,53,covid; 
Fear and misinformation about #COVID19 has led to a dangerous increase in harassment and acts of violence against our Asian and Asian-American communities. We’re in this together and must look out for one another. #SeattleTogether,2020-05-13 16:30:00,TweetDeck,61,219,covid; 
#COVID19 has exacerbated many of the racial inequities that exist both in Washington and across our country. I’ll be hosting an online briefing about racial disparities during this pandemic today at 5:00PM PT. I hope you’ll join me for this important conversation. https://t.co/2glsNRgUXx,2020-05-13 15:00:00,Twitter Media Studio,27,62,covid; 
During the last COVID-19 relief package Democrats took a bad Republican proposal and we made it better. Now we need to take today's proposal and make it better too.,2020-05-13 02:38:54,Twitter Web App,150,1142,covid; 
From mass unemployment to disparities in access to health care #COVID19 has exacerbated many of the racial inequities that exist in our country. I’ll be hosting an online briefing about racial disparities during this pandemic tomorrow at 5:00PM PT. I hope you’ll join me. https://t.co/Tk4xCKUIBo,2020-05-13 02:00:00,Twitter Media Studio,33,95,covid; 
Immensely proud to join @RepSarbanes @SenWarren @SenBlumenthal &amp; @SenCoons to #StopCOVIDCorruption,2020-05-12 20:31:02,Twitter Web App,10,90,covid; 
With an unemployment rate not seen since the Great Depression &amp; a President with a long history of giving favors to his wealthy friends it is crucial that every piece of #COVID legislation we pass includes strict watchdog protections. #STOPCOVIDCorruption https://t.co/HoXiR5yRRS,2020-05-12 20:31:02,Twitter Web App,75,352,covid; 
🚨 King County issued a new directive to begin wearing cloth face coverings – which will take effect on May 18th. Please make sure to keep both your nose and your mouth covered. This is critical to stopping the spread of #COVID19. 🚨 https://t.co/gPQC1C7t6v,2020-05-12 19:30:00,TweetDeck,32,96,covid; 
