Washington state has now surpassed 2000 deaths from COVID-19 as we've lost nearly 200000 lives across America. It's a stark reminder that this crisis is far from over. Please continue to follow public health precautions and wear a mask when you leave your home.,2020-09-16 19:30:00,TweetDeck,85,300,covid; 
Every other industrialized country realized long ago that you should not tether health care to employment. Yet in the US 27 million people have lost their insurance because they lost their job during COVID-19. It's time we catch up and guarantee health care as a human right. https://t.co/AGMcM0hoFl,2020-09-16 17:00:00,Twitter Media Studio,131,323,covid; 
In the midst of COVID-19 and poor air quality throughout our communities it's even more urgent that people have a roof over their head. It's time to pass my Housing is a Human Right Act which would invest $300 billion into housing infrastructure while reducing homelessness.,2020-09-16 01:00:01,TweetDeck,84,405,covid; 
As Hispanic Heritage Month begins let's not forget that Hispanic and Latinx communities are disproportionately impacted by this racist xenophobic Administration COVID-19 and a devastating economic crisis.  We must fight for policies that deliver real opportunity and justice. https://t.co/JlEFnHdEdd,2020-09-15 18:05:37,Twitter Web App,30,101,covid; 
Millions have lost their care because they lost their job during this crisis. At tomorrow's Medicare for All Caucus meeting we'll be discussing why COVID has only underscored the need to untether health insurance from employment.  Join us at 11 a.m. ET: https://t.co/9hjdsNfw2n https://t.co/VKduJ9e3LP,2020-09-15 01:35:05,Twitter Web App,66,210,covid; 
We had a child care crisis before COVID hit. Now it's even more dire for families. That's why I helped introduce the Child Care is Essential Act a $50 billion investment in child care. The House passed it in July. It's time for the senate to do the same. https://t.co/9huAMYlF8W,2020-09-14 23:20:00,TweetDeck,65,177,covid; 
More than 90% of immigrants in one detention center were impacted by COVID. But this isn't an outlier. With inhumane conditions the virus is spreading through centers across America. We must pass my FIRST Act to release immigrants from detention centers. https://t.co/8xtFWDkloZ,2020-09-13 22:00:00,TweetDeck,62,215,covid; 
We pay more per capita for health care than any other country yet our for-profit system left 87 million uninsured or underinsured before COVID-19. That has only gotten worse during this crisis.   We must finally guarantee health care as a human right by passing Medicare for All. https://t.co/N2R8i1Ap89,2020-09-13 19:00:01,TweetDeck,75,191,covid; 
As COVID-19 forces schools to go online we need to take immediate steps to ensure all students have access to the internet and necessary technology. Failing to do so will only make our current achievement gaps even worse. https://t.co/XGfBEsHhkv,2020-09-12 22:30:00,TweetDeck,89,371,covid; 
Mayors see firsthand the impact that a for-profit health care system has on their communities as 87 million people were uninsured or underinsured before COVID-19 even hit. So excited that @RobertGarciaLB and @LibbySchaaf have created @mayors4medicare!  https://t.co/2DNbDjbh0i,2020-09-11 16:38:08,Twitter Web App,56,130,covid; 
Millions of people have lost their jobs housing and health care during COVID-19. We must respond with policies that match the scale of this unprecedented crisis. The new Republican bill in the Senate FAILS to do that.   RT to share 6 reasons why:,2020-09-10 01:19:36,Twitter Web App,127,345,covid; 
As the pandemic took off between March and May Border Patrol didn't test a single immigrant for COVID-19. This total lack of care is just another way that this administration inhumanely treats immigrants and continues to severely mishandle the crisis. https://t.co/O9D13J7JX4,2020-09-08 21:15:58,Twitter Web App,84,205,covid; 
We need a complete and accurate census—critical funding for our communities depends on it. I've called for counting operations to be extended and for an emergency allocation of $400 million to address the challenges of conducting the Census during COVID. https://t.co/K5hkBLHfrF,2020-09-08 16:33:27,Twitter Web App,51,148,covid; 
I'm thinking of workers and the millions who have lost jobs because of COVID-19. Let's have their backs by restarting the $600/week of expanded unemployment renewing eviction moratoriums issuing stimulus checks and getting relief to businesses to bring workers back on payroll.,2020-09-07 19:00:00,TweetDeck,202,923,covid; 
Thousands of immigrants have tested positive for COVID while in ICE detention centers. Crowding more people into these dangerous conditions will only put more lives in danger.   We must pass my FIRST Act to begin releasing immigrants from detention centers.https://t.co/un8gQNp8dc,2020-09-06 22:30:00,TweetDeck,248,701,covid; 
This is not only devastating it is preventable. I refuse to just watch as millions are evicted. I'm fighting for an eviction moratorium. I'm fighting to cancel rent and mortgage payments during COVID. And I'm fighting for more relief so people can actually withstand this crisis. https://t.co/KRPLionV4E,2020-09-03 17:30:12,Twitter Web App,239,707,covid; 
Instead of levying partisan attacks at cities across America and attacking those powerfully protesting police brutality this president should be focused on attacking COVID and the devastating economic crisis we face with millions having lost their jobs housing and health care.,2020-09-03 03:48:42,Twitter Web App,30,100,covid; 
Not just unlawful but also a prime example of Trump's failed leadership and desperation. Amidst COVID people in Seattle &amp; across America need more federal funding—not less. Yet he would prefer to turn your attention away from these real crises by fearmongering &amp; fanning racism. https://t.co/jJNiv0BFUy,2020-09-03 03:48:20,Twitter Web App,191,651,covid; 
ICE refuses to allow immigrants to follow health guidelines. That causes COVID-19 to spread like wildfire. That leads to death. We're culpable if we do nothing to prevent it.   We must pass my FIRST Act to begin releasing immigrants from detention centers. https://t.co/MX63tXwbMG,2020-09-02 20:15:36,Twitter Web App,77,213,covid; 
Our inaction is deadly. As COVID-19 continues to spread through ICE detention centers the stakes couldn't be more clear: if we fail to act more lives will be lost.  We must pass my FIRST Act to begin releasing immigrants from these deadly conditions. https://t.co/iJgUGYL62D,2020-08-31 23:00:01,TweetDeck,58,141,covid; 
Keeping people in their homes is not only the right thing to do it's also critical to stopping the spread of COVID-19.  Here's what we must do: extend eviction moratoriums cancel rent and mortgages and get more relief directly into people's pockets. https://t.co/Qz7NEfhcvV,2020-08-31 15:45:09,Twitter Web App,80,224,covid; 
WATCH: I joined @Crosscut this week for a discussion about Trump's sabotage of the USPS ongoing protests against police brutality and racial injustice my efforts to get economic relief to people during COVID-19 and more urgent topics. https://t.co/nu7lbe2klt,2020-08-28 18:17:40,Twitter Web App,44,144,covid; 
#TBT to Trump saying COVID-19 is "totally under control." His failed leadership has NEVER had it under control.  We need a national strategy a full investment in testing and contact tracing resources economic relief and leaders to take this level of devastation seriously. https://t.co/fPZqu4NRcU,2020-08-28 01:00:01,Twitter Media Studio,63,171,covid; 
We already faced an affordability crisis long before COVID-19. Now an additional 30 million people are at risk of being evicted. We must immediately extend the eviction moratoriums. We should also cancel rent and mortgage payments throughout this crisis. https://t.co/gqwxvoxk5Y,2020-08-27 23:00:00,TweetDeck,50,160,covid; 
TODAY: I'm joining @Crosscut at 11 PT/2 ET for a LIVE conversation about COVID-19 the ongoing movement for racial justice the USPS and more. Hope you'll join us! RSVP at https://t.co/yDSuSZjBjf https://t.co/4PRJEjri4t,2020-08-26 16:45:00,TweetDeck,11,50,covid; 
At least 38 million households remain uncounted. We must extend counting operations through October 31 and allocate $400 million to addressing the continued challenges of conducting a complete and accurate Census during COVID-19. Let's get this right. https://t.co/6ZD2AVsP54,2020-08-24 21:49:37,Twitter Web App,126,258,covid; 
You've told me that an attack on the USPS is an attack on your safety during COVID-19 as we follow public health guidance and stay home trying our best to do our part to stop the spread of this deadly virus. https://t.co/RAP5UZfELu,2020-08-22 17:34:18,Twitter Web App,49,178,covid; 
Today's USPS hearing made it clear that Trump's dangerous assault on the Postal Service is accomplishing several of his top goals: 🔴Undermine our elections and democracy 🔴Put money into the pockets of his cronies 🔴Attack our health care 🔴Hurt working people 🔴Ignore COVID-19,2020-08-20 22:45:26,Twitter Web App,242,583,covid; 
No one is laughing as your inaction has led to the deaths of 167000 Americans from COVID-19. No one is laughing as your failed presidency collapsed our economy. No one is laughing as millions lose their jobs families are evicted and businesses are forced to permanently close. https://t.co/wmy7Z5mi7N,2020-08-14 02:48:14,Twitter Web App,392,1993,covid; 
As PPP failed to help minority-owned businesses the unemployment rate for Black workers continued to rise.   Our responses to COVID-19 shouldn't leave some people behind. The Paycheck Recovery Act will get urgent relief to ALL workers and businesses. https://t.co/yeYN8SijyI,2020-08-13 19:03:07,Twitter Web App,74,221,covid; 
We must pass my FIRST Act and move immigrants out of detention centers. Let's not wait for another person to catch COVID-19 as the virus spreads like wildfire in these facilities. Let's not wait for another immigrant to die in ICE custody. Let's act NOW. https://t.co/VNvRFCDgk7,2020-08-13 01:00:00,TweetDeck,138,481,covid; 
Maria says she worked her entire adult life until being laid off because of COVID:  "The $600 replaces my income perfectly. No more and no less...I will now be forced into personal bankruptcy. This is a terrible feeling...don't allow Republicans to destroy the middle class",2020-08-11 23:11:07,Twitter Web App,50,255,covid; 
Caitlin is out of work because of COVID. She says she's stuck for the foreseeable future like many:  "I need this extension because without it I can't pay rent I won't be able to eat...So many people are depending on it. These are the real concerns we're feeling on the ground.",2020-08-11 23:10:26,Twitter Web App,22,119,covid; 
Taylor is 38 and has been working since they were 12. They say COVID caused them to be laid off for the first time and calls the impact suffocating:  "I'm terrified. This will pass eventually but the reality of rent bills finances and student loans pilling up is overwhelming.",2020-08-11 23:09:46,Twitter Web App,23,107,covid; 
Important op-ed from my colleagues @RepJerryNadler &amp; @RepChuyGarcia on the need to ensure we fund public transit in the next #COVID19 relief package. https://t.co/BlU2r3uZnY,2020-08-11 18:56:00,Twitter Web App,65,184,covid; 
COVID-19 Deaths 🔴Tuesday: 1265 🔴Wednesday: 1328 🔴Yesterday: 1248  New COVID-19 Cases 🔴Tuesday: 51185 🔴Wednesday: 51884 🔴Yesterday: 53206 https://t.co/6ImI7KByRO,2020-08-08 01:27:06,Twitter Web App,186,469,covid; 
COVID-19 and this economic crisis are racial justice issues. Black and Latinx workers have already been disproportionately impacted—and now the disparities could get even worse if the Senate fails to renew the critical $600 a week of expanded relief. https://t.co/iSEqyV8yv2,2020-08-07 18:30:00,TweetDeck,58,147,covid; 
To address the challenges of conducting an accurate and complete Census during the COVID-19 pandemic we must: ✅Allocate $400 million ✅Extend the household counting operations through October 31 ✅Modify the deadline to transmit state population totals to April 30,2020-08-06 20:25:57,Twitter Web App,135,423,covid; 
COVID-19 has spread like wildfire through ICE detention centers since the beginning of this crisis. We must urgently pass my FIRST Act which would finally move immigrants out of detention centers before more lives are lost. https://t.co/XJo14Ntv8e,2020-08-05 18:21:02,Twitter Web App,114,345,covid; 
There were 19000 new COVID-19 cases on the day the CARES Act was signed into law. The number of new cases on August 1 was more than 3X that.  This pandemic hasn't stopped. The relief necessary to withstand it shouldn't stop either. https://t.co/WFzhIynl2R,2020-08-03 20:26:44,Twitter Media Studio,96,339,covid; 
New positive cases: ⬆ Deaths from COVID-19: ⬆ Small businesses closing: ⬆ Unemployment claims: ⬆  We should be increasing (not cutting!) relief. We need to get more help to more people as this crisis continues. https://t.co/dV0oZdi7py,2020-08-03 01:48:12,Twitter Media Studio,131,468,covid; 
COVID-19 has only further highlighted what we've long been saying: we cannot continue to allow health care to be tied to employment. Health care is a human right and it must be guaranteed in this country. I won't stop fighting until we make that a reality.,2020-07-31 21:37:20,Twitter Web App,113,444,covid; 
Our bill would immediately close the coverage gap by expanding Medicare during COVID-19 to guarantee care for millions of people who are struggling with the health and economic realities of this pandemic. It also protects people from outrageous out-of-pocket costs.,2020-07-31 21:36:53,Twitter Web App,88,337,covid; 
Our bill would immediately close the coverage gap by expanding Medicare during COVID-19 to guarantee care for millions of people who are struggling with the health and economic realities of this pandemic. It also protects people from outrageous out-of-pocket costs.,2020-07-31 21:36:53,Twitter Web App,88,337,covid; 
This administration's corrupt response to COVID-19 has not been enough and the American people are paying the price.,2020-07-30 19:14:31,Twitter Web App,45,202,covid; 
My legislation with @SenWarren @SenBlumenthal @ChrisCoons and @RepSarbanes will: ✅Prohibit conflicts of interest ✅Improve transparency for PPP funds ✅Require disclosure of COVID-related lobbying ✅Strengthen oversight transparency and whistleblower protections,2020-07-30 19:14:31,Twitter Web App,99,322,covid; 
We've seen 151000 deaths and a 33% decline in our economy—yet members of the Trump Administration and their donors are continuing to profit off this corrupt response to COVID-19. It is long past time that we pass the CORE Act and #StopCOVIDCorruption. https://t.co/HoXiR5yRRS,2020-07-30 19:14:30,Twitter Web App,430,1496,covid; 
The virus can get to all of us. The best thing we can do to prevent its spread is to take the necessary science based precautions: rigorously wear masks social distance and follow public health guidelines. This is too serious not to.,2020-07-29 15:58:48,Twitter Web App,115,733,social distance; 
We should be cutting the Pentagon budget and spending that money on COVID relief instead of cutting COVID relief and spending that money on the Pentagon. https://t.co/xTzIcMrI8l,2020-07-29 01:24:00,Twitter Web App,692,2839,covid; 
"We can’t let this election be decided by voter suppression via the very real fear of contracting a deadly virus."  Let's act now to protect and expand voting rights during COVID and beyond. We must ensure that every voice is heard every vote is counted. https://t.co/J42esWCwtX,2020-07-28 16:45:00,TweetDeck,111,304,covid; 
We knew detention centers were tinderboxes for COVID-19. But instead of promoting public health and getting help to immigrants ICE cruelly tried to conceal the facts.  It's time for us to pass my FIRST Act which would move immigrants out of detention. https://t.co/W8QdA7Z4iw,2020-07-27 18:00:00,TweetDeck,137,326,covid; 
Late May: 20000 new #COVIDー19 cases/day  July 1: 50000 new cases  July 24: 74000 new cases  In two short weeks alone there have been 1 MILLION new cases and more than 12000 people have died because Trump and @senatemajldr have refused to act.   These deaths are their doing.,2020-07-26 18:25:50,Twitter for iPhone,110,280,covid; 
Republicans have refused to hold Trump accountable for ANYTHING—not COVID not abuses of power not undermining our institutions and not destroying our Constitution. They continue to dance like a puppet to the strings of a corrupt White House. https://t.co/4GexMaPJ6W,2020-07-24 22:00:00,Twitter Media Studio,100,316,covid; 
When Republicans passed a $2 trillion tax cut for corporations and the ultra-wealthy they didn't say we couldn't afford it.  But when it comes to taking care of Americans in their most dire time of need Republicans are demanding we cut COVID-19 relief. That is insulting. https://t.co/GFGnSyn9Ig,2020-07-23 02:47:06,Twitter Media Studio,134,378,covid; 
COVID and this economic crisis are racial justice issues. Black and Latinx workers have been disproportionately impacted. Minority-owned businesses have been locked out of relief. My Paycheck Recovery Act would get help to all businesses and their workers. https://t.co/tf0W2yL6Qw,2020-07-22 21:43:48,Twitter Web App,22,61,covid; 
This year's defense budget was 90x bigger than the budget for the CDC.   Yet—as we near 3.8 million COVID-19 cases and 141000 deaths from the virus—Trump wants to add more money for defense spending while cutting money for testing and contact tracing. We can't let him.,2020-07-20 01:30:00,TweetDeck,571,1655,covid; 
While at least 5.4 million people have lost their insurance during COVID-19 United Healthcare’s profits are soaring. The system isn’t broken—it’s working for exactly who it was designed for: for-profit insurance companies. We need Medicare for All now. https://t.co/0FAAgjRF38,2020-07-19 20:10:07,Twitter for iPhone,172,459,covid; 
Proud to lead this effort in the House. Ensuring that we defeat COVID-19 before even more lives are lost should not be a political issue. The Trump Administration must finally put its own interests aside and put the well-being of the American people first. https://t.co/Mhe6R0Bem6,2020-07-18 16:24:09,Twitter Web App,72,341,covid; 
To defeat COVID-19 we need timely accurate and public data. While the CDC has provided that we know that Trump won't. That's why I'm leading an effort in the House to rescind this corrupt new order that tries to hide COVID-19 data. https://t.co/BDXGILi8tJ,2020-07-18 00:46:01,Twitter Web App,127,431,covid; 
At a time when we already have more than 3.5 million cases and more than 138300 deaths we should not allow health experts to be silenced.  I'm leading the House in calling on this administration to rescind their dangerous guidance to send COVID data to HHS instead of the CDC. https://t.co/EZsceUzbjN,2020-07-17 17:12:43,Twitter Web App,84,243,covid; 
“They put us in here to let us die."  That's not an exaggeration as we see COVID-19 spreading like wildfire through ICE detention centers. It is time to pass my FIRST Act which would move immigrants out of detention centers before more lives are lost. https://t.co/RpmSxlYBu2,2020-07-15 21:30:00,TweetDeck,75,174,covid; 
We asked NLRB General Counsel Robb whether they were stepping up to protect workers who are organizing amidst mass layoffs. They told us “additional directives are unnecessary” to address worker health and safety during COVID-19.   They lied. https://t.co/ZOTKmHuGik,2020-07-15 20:30:00,TweetDeck,38,76,covid; 
“Universal coverage is...now medically necessary as protection for us all. COVID has taught us that tying insurance to employers no longer makes sense.”  Many are seeing up close what we've long argued: health care is a human right and must be guaranteed. https://t.co/rWHG2sPxxK,2020-07-15 17:45:00,TweetDeck,112,353,covid; 
Our inaction is deadly. We know COVID is spreading like wildfire through ICE detention centers. We know COVID can quickly lead to death. But we're refusing to release immigrants or even provide basic hygiene. Each day we fail to change this we're responsible for what follows. https://t.co/Lr4BpTHCcc,2020-07-14 00:09:00,Twitter Web App,92,217,covid; 
COVID-19 is a racial justice issue. Black Latinx and Native individuals are disproportionately working on the front lines of this pandemic are more likely to be uninsured and are more likely to live in polluted communities. All of this must change. https://t.co/Jm8rEFY7v9,2020-07-13 21:45:00,TweetDeck,64,161,covid; 
There were 19046 new COVID-19 cases on the day the CARES Act—which added $600 a week to unemployment checks—was signed into law.  Yesterday there were 66786 new cases.  This pandemic hasn't stopped and the relief necessary to beat it shouldn't stop either. We must extend PUA. https://t.co/TNov5VJpfY,2020-07-13 17:30:11,Twitter Web App,192,445,covid; 
PPP has failed to end this mass unemployment crisis while being completely inaccessible to many small businesses especially minority-owned ones.   My Paycheck Recovery Act will get relief to workers while ensuring ALL businesses can survive COVID-19. https://t.co/0gCGHWy4RQ,2020-07-13 15:30:00,TweetDeck,40,175,covid; 
We already had a housing crisis before COVID-19 hit. Now 28 million more Americans could be evicted because of this pandemic.  There is a solution: let's immediately pass my Rent and Mortgage Cancellation Act to get urgent relief to people across America. https://t.co/HpwSGxXK04,2020-07-13 02:15:40,Twitter Web App,214,670,covid; 
Trump’s presidency COVID-19 and mass uprisings against white supremacy have laid bare systemic anti-Blackness deadly public health inequities &amp; economic greed.  Incrementalism can't be the solution. We must be bold. My conversation with @billmckibben: https://t.co/nB1jaB990p,2020-07-10 16:25:00,TweetDeck,38,131,covid; 
New COVID-19 cases yesterday: Norway🇳🇴: 6 Denmark🇩🇰: 12 Sweden🇸🇪: 295 Germany🇩🇪: 397 All 4 countries combined: 710  United States🇺🇸: 62425 https://t.co/mcltC9n5o3,2020-07-10 03:20:52,Twitter Web App,1346,3176,covid; 
137 out of 300 employees at one ICE detention center have tested positive for COVID-19!   As cases continue to spike across America we must move immigrants out of detention centers before more lives are lost. My FIRST Act will make that happen. https://t.co/31LWi3KwmZ,2020-07-10 01:30:00,TweetDeck,158,334,covid; 
COVID-19 demonstrates just how important it is that people have a roof over their head during this crisis. We must pass my Rent and Mortgage Cancellation Act to finally put an end to this mass evictions crisis. https://t.co/C1qHiVH2wO,2020-07-09 19:00:01,TweetDeck,45,122,covid; 
Good. But there are still many more immigrants who must be released as COVID-19 continues to spread through ICE detention facilities.  We must pass my FIRST Act to move immigrants out of detention centers and save lives. https://t.co/IQSvpUjG26,2020-07-09 00:05:00,TweetDeck,26,117,covid; 
Make no mistake: our fight against this virus is far from over. There have been more than 1 million new COVID-19 cases in the last 28 days alone. We must respond at the scale of this crisis—and quickly. https://t.co/77sNaaqAZE,2020-07-08 17:26:22,Twitter Web App,44,148,covid; 
A stunning confirmation of what we've been seeing: Black Latinx and Native people are being disproportionately impacted by COVID.  Latinx and Black people have been 3X as likely to become infected as their white neighbors and nearly 2X as likely to die. https://t.co/JSTCvwO4Hr,2020-07-07 00:42:29,Twitter Web App,122,261,covid; 
ICE is refusing to release vulnerable immigrants or allow them to follow basic public health guidelines—making detention centers a tinderbox for COVID-19.  We must pass my FIRST Act to move immigrants out of detention centers and save lives. https://t.co/s6Vphauykb,2020-07-06 22:42:20,Twitter Web App,84,188,covid; 
New daily COVID-19 cases in Washington: 🔴May 2: 182 🔴June 2: 327 🔴Yesterday: 716  This pandemic hasn’t gone away and it hasn’t slowed down. It's gotten worse. Please wear a mask follow public health guidelines and stay safe this weekend.,2020-07-03 18:01:38,Twitter Web App,138,414,covid; 
Embers?!  COVID-19 is a blazing fire that has already taken more than 128000 lives in the U.S. (that's more lives than we lost in WW1!) and just set a daily record for new cases TODAY with absolutely no end in sight—yet the White House wants to call this embers? https://t.co/6GKPrcbf1J,2020-07-02 22:25:26,Twitter Web App,166,746,covid; 
Rent is due today. Yet millions have lost their jobs during COVID-19 and we've failed to respond at the scale necessary.   Congress must pass my Rent and Mortgage Cancellation Act which would get urgent relief to people across America.,2020-07-01 15:25:42,Twitter Web App,184,716,covid; 
75% of Americans believe the country is on the wrong track under this President's leadership.   They overwhelmingly want us to stop spread of #COVID-19 rather than trying to get economy going.   We need #PaycheckRecoveryAct to give workers &amp; businesses relief &amp; keep people home.,2020-07-01 10:38:18,Twitter Web App,139,597,covid; 
As COVID cases spike in detention facilities Trump and his cronies are continuing their inhumane treatment of children and families. We must finally pass my FIRST Act which moves immigrants out of detention centers before more lives are lost. https://t.co/Q8hNWCTHN7,2020-06-29 20:30:00,TweetDeck,79,201,covid; 
