The impacts of this petition — more danger for whales and even more difficulty earning a living for lobstermen — should make it a non-starter. That’s why I led the Maine delegation today to call on the administration to reject the Pew petition outright. 3/ https://t.co/f7G2v8bKgY,2020-07-01 19:11:20,Twitter Web App,1,2
Pew claims these closures protect right whales a cause most lobstermen support. But lobstermen want proof that the actions they're asked to take will actually help.  However if Pew's petition is approved NOAA data shows it could actually create MORE risk for the whales. 2/,2020-07-01 19:11:20,Twitter Web App,0,0
NOAA is being petitioned to close 3 large areas in the Gulf of Maine to lobstering. These closures will take tens of millions of $$ from lobstermen &amp; their families many of whom are struggling as demand for lobsters sags with the economy. 1/ https://t.co/zkWwdOYOsQ,2020-07-01 19:11:19,Twitter Web App,1,2
Yesterday I voted to pass legislation to improve the Affordable Care Act by lowering the cost of health care purchased through ACA marketplaces and empowering the fed’l gov to negotiate down Rx drug prices. 2/  Read more here: https://t.co/9dF8Vgy7e8,2020-06-30 15:50:31,Twitter Web App,2,8
The Affordable Care Act has made health coverage available to millions &amp; millions of people but it’s still far too expensive for many others. My focus right now is on improving the program so that we can lower costs and make the ACA work better for working Mainers. 1/,2020-06-30 15:50:31,Twitter Web App,3,19
If they win it’s estimated that 98000 Mainers will lose their health care. Those are the stakes and we need to fight for them.   I’ll continue to stand up for access to health care rural hospitals and more affordable Rx drugs.    https://t.co/xVLT6QNmFW,2020-06-26 14:39:08,Twitter Web App,6,24
Americans have told the GOP time and again that they want the coverage for pre-existing conditions and other protections that are included in the Affordable Care Act.  But the party is still trying to repeal those health care protections — right now — this time using the courts.,2020-06-26 14:39:08,Twitter Web App,7,39
When #LocalS6’s Chris Wiers joined me at the State of the Union he spoke passionately about the union’s ideas for how to increase productivity &amp; get BIW back on schedule  This quote from Chris gets to the heart of the matter. GD should listen #mepolitics  https://t.co/2A1McBPuX9 https://t.co/mywm3lPY05,2020-06-25 23:51:18,Twitter Web App,8,13
The president’s advisors got a little warmer this time...   but I strongly recommend they finally come forward with a proposal to address the issue we all know matters most to Maine lobstermen at this time: the threat they face from his own administration’s new regulations. 5/,2020-06-25 20:35:02,Twitter Web App,1,17
The president has acted to rollback and block regulations for so many industries with big money &amp; deep pockets.  So why won’t he engage with ME lobstermen about how he can help them with the regulatory threats that would crush fishing communities up &amp; down the coast of Maine? 4/,2020-06-25 20:35:01,Twitter Web App,1,19
But let’s be clear about two things:  1. POTUS is acting to provide relief for a problem he created and he’s doing it only after several seasons of damage;  2. His administration continues to sidestep the biggest threat to Maine lobstermen: NOAA’s Right Whale regulations.  3/,2020-06-25 20:35:01,Twitter Web App,5,33
During the president’s visit lobstermen tried to raise NOAA’s Right Whale regulations as their biggest concern.  But instead POTUS is offering subsidy payments to help the lobster industry recover from his trade wars. That financial relief will be helpful and appreciated. 2/,2020-06-25 20:35:01,Twitter Web App,0,17
When the president came to Maine he announced he was saving the ME's lobster industry by reopening an undersea monument off Massachusetts to fishing. The vast majority of Mainers don’t fish off of Cape Cod.  That announcement woulda been better made in Boston than Bangor. 1/ https://t.co/PUspIeOlzy,2020-06-25 20:35:01,Twitter Web App,21,66
@USPS could lose more than $22 billion over 18 months due to COVID-19 putting it in danger of shutting down in 2020.  I joined a group of over 100 bipartisan House members to tell the Senate: we need to help the Postal Service now before we put our rural communities at risk. 2/ https://t.co/r30ZSjDOll,2020-06-24 20:40:35,Twitter Web App,2,11
Maine's one of the most rural states in the country which makes @USPS particularly important for us. Rural Mainers count on a fully functional Postal Service to deliver medications information and goods they can’t get elsewhere in their communities. 1/  https://t.co/QYhg32Lur8,2020-06-24 20:40:35,Twitter Web App,10,39
SMALL BUSINESSES: Did you miss last week’s tele-town hall? @SBA_Maine's Amy Barrett and I are holding another one at 6pm Tuesday to help ME small businesses &amp; workers navigate changes to COVID-19 small biz relief programs.  You can register &amp; join us here: https://t.co/L8HC29EEuR,2020-06-22 21:06:34,Twitter Web App,1,5
My message to the men and women of Local S6: https://t.co/dNcY2FGK9K,2020-06-22 11:58:47,Twitter Web App,18,50
These companies use forced arbitration to avoid being held accountable.   The Justice for Servicemembers Act would end this practice for servicemembers in most cases and also provide them with critical protections in the workplace.   Learn more: https://t.co/XzXycIwAe8  3/,2020-06-21 16:07:40,Twitter Web App,0,24
Predatory companies prey on servicemembers — especially younger ones — signing them onto leases car loans cellphones and other contracts that use the small print to trick them into waiving their rights and the protections they deserve when they deploy on our behalf.   2/,2020-06-21 16:07:39,Twitter Web App,1,17
When I was in the Marines I saw the ways in which the young men and women who serve our country are targeted by greedy corporations.   1/,2020-06-21 16:07:39,Twitter Web App,2,28
We all need more good news these days. Here’s a great example of Maine workers and Maine manufacturing adapting to challenging circumstances and working with our hospitals to protect health care workers.   https://t.co/8deIJpr8XT,2020-06-19 15:34:09,Twitter Web App,1,2
I’m a cosponsor of H.R. 6401 the Ban Conflicted Trading Act which would fully prohibit Members of Congress from trading individual stocks. It’s a small price to pay for more integrity in Congress.   2/,2020-06-18 14:10:14,Twitter Web App,4,37
The answer to this question is yes. Representatives should be in Congress to serve not to benefit from their office. Even the appearance of misconduct hurts our democracy. 1/  https://t.co/avWhvJcE43,2020-06-18 14:10:13,Twitter Web App,3,31
If you or someone you know runs a small business we’re holding another tele-town hall in a couple hours to help Mainers navigate recent changes to COVID-19 small biz relief programs. https://t.co/7NJX66qaKL,2020-06-17 18:49:30,Twitter Web App,5,9
We’ll start up at 4:30 today with @MaineSBDC Director Mark Delisle. You can register at https://t.co/L8HC29Wfmp.,2020-06-17 14:07:33,Twitter Web App,0,1
COVID-19 small biz relief programs have undergone big changes in the last 2 weeks and small businesses need to know how they will be affected  If you or someone you know runs a small business we’re holding another tele-town hall this PM to help Mainers navigate these programs.,2020-06-17 14:07:33,Twitter Web App,5,11
REMINDER: There’s still time to fill out your 2020 Census. Making sure you’re counted helps Maine fund better roads and schools programs for small businesses and more.   Visit https://t.co/tXtnms9n81 or call 844-330-2020 to complete your census. It only takes a few minutes.,2020-06-16 22:38:05,Twitter Web App,14,20
As always if you have questions about this or any other small business relief program reach out to our Small Biz Response Team: SmallBizResponseTeam@mail.house.gov  2/,2020-06-16 13:45:22,Twitter Web App,0,1
BREAKING: This morning the SBA reopened the Economic Injury Disaster Loan (EIDL) program to non-farm small businesses.  Details on the EIDL program and how to apply in our Small Business Resource Guide: https://t.co/3od9bGWHN2  1/,2020-06-16 13:45:22,Twitter Web App,3,0
LGBTQ Americans still face other forms of discrimination including a new policy the White House unveiled Friday that threatens many Americans’ health care due to their gender identity.  I’ll work to overturn the admin’s new rule in the coming weeks.   2/  https://t.co/OlC3ctbidu,2020-06-15 20:56:55,Twitter Web App,0,17
Today’s Supreme Court decision is a big step for equality and it’s been a long time coming. No American should be fired because of who they love or who they are. 1/  https://t.co/w1PWGDGKqg,2020-06-15 20:56:55,Twitter Web App,7,36
Allowing fisheries disaster declarations for pandemics like COVID-19 would provide another proven avenue for fishermen to seek relief funds they need to keep fuel in their tanks bait in their traps &amp; help their communities recover. 4/  Read more here: https://t.co/Nq38U8LV05,2020-06-12 16:06:18,Twitter Web App,0,0
Instead Congress set aside just $20 million in relief funds for all of Maine’s fisheries.   Our fishing industry contributes around $1 billion to Maine’s economy every year. $20 million falls far short of what fishermen in our state need to help keep our economy moving.,2020-06-12 16:06:17,Twitter Web App,0,0
But under current law governors can’t use COVID-19 as a cause to request a fisheries disaster declaration and get relief funds for their fishermen. That’s bad policy and it doesn’t reflect what our fishermen are seeing on the ground: that COVID-19 is a disaster.   4/,2020-06-12 16:06:17,Twitter Web App,0,1
When a hurricane or an oil spill devastates a fishery the state can request a fisheries disaster declaration from the federal gov’t.   The declaration opens up an established process to send relief funds to fishermen and their communities to help them recover.   3/,2020-06-12 16:06:16,Twitter Web App,0,0
It’s clear COVID-19 has been a disaster for Maine's fisheries and fishermen. For lobstermen in particular prices have slumped and demand has plummeted.   This affects entire communities on our coast &amp; it’s going to take a long time to recover. 2/ https://t.co/2zx7716AKA,2020-06-12 16:06:16,Twitter Web App,0,1
This week I introduced a bill with Republican @RepGarretGraves to allow fisheries disaster declarations for COVID-19 and other pandemics. Our bill would help direct significant relief funds to Maine’s fishermen and fishing communities.   Here’s why this bill is necessary:  1/,2020-06-12 16:06:15,Twitter Web App,2,11
If you or someone you know are interested in attending one of our nation’s distinguished military academies the application is available on my website: https://t.co/WmP7n50DyZ   2/,2020-06-10 12:42:08,Twitter Web App,0,0
Once a year I have the honor of nominating talented young Mainers like Halle to serve our country.   https://t.co/Zn1ZZfoXqi  1/,2020-06-10 12:42:08,Twitter Web App,1,3
This demand is not going away any time soon.  That’s why we called on the Senate to pass my SBDC Improvement Act which will reauthorize and expand SBDCs and help bring their services to many more businesses. The bill passed the House last year and now we need to make it law. 3/3,2020-06-09 16:11:28,Twitter Web App,0,1
Earlier this year I worked to secure $192 million in add'l funding for SBDCs to respond to COVID-19. As we heard in the hearing the results have been impressive: @MaineSBDC advisors have assisted over 1300 small biz helping them secure $10 million in capital since March. 2/3,2020-06-09 16:11:28,Twitter Web App,0,1
Thanks to Farmington small business owners Joe and Mary for joining me &amp; members of @HouseSmallBiz to talk about how Small Business Development Centers (@ASBDC) are helping Maine small businesses adapt to new economic challenges from COVID-19. 3/3 https://t.co/oAxV02q27n,2020-06-09 16:11:28,Twitter Web App,3,3
My staff &amp; I are here to help you plain and simple.  Whether it's a VA claim tracking down your Economic Impact Payment or helping a small biz navigate COVID-19 relief programs our team's just a phone call away M-F 9-5  Thanks to Renee for the shoutout in today's @SunJournal https://t.co/YdgVpvaexx,2020-06-08 23:05:45,Twitter Web App,5,35
These hospitals mean jobs economic stability &amp; health care for Calais &amp; Lincoln. If the courts won't take action Congress must step in.  I introduced a bill to make relief funds available to these rural hospitals and I'll continue to fight to pass it thru Congress. #mepolitics https://t.co/RAanPqcs8y,2020-06-08 12:42:45,Twitter Web App,6,29
He clearly has no clue that the "Washington bureaucrats" he blamed in today's roundtable are his very own — and they are the ones responsible for the most significant threat to the future of Maine's lobster fishery. 2/2  https://t.co/ckWT5w9L0I,2020-06-05 20:11:48,Twitter Web App,25,78
President Trump just met with Maine fishermen to announce a policy change that will mostly benefit fishermen in... Massachusetts. 1/2  #mepolitics https://t.co/QeQiiOAeqm,2020-06-05 20:11:47,Twitter Web App,64,146
Important information for Mainers who have had their unemployment claims cancelled: https://t.co/qKXG6s9ygA,2020-06-05 14:45:50,Twitter Web App,1,2
Friends of Katahdin Woods and Waters https://t.co/fsY7h5dFQc,2020-06-04 21:21:51,Twitter Web App,1,4
Maine Outdoor Brands https://t.co/wWTL2mIxtB,2020-06-04 21:21:51,Twitter Web App,2,1
.@TNCmaine https://t.co/5gOxp7Cs8G,2020-06-04 21:21:51,Twitter Web App,1,4
.@MCVoters https://t.co/uyEwEYEJNc,2020-06-04 21:21:50,Twitter Web App,1,3
.@AppMtnClub https://t.co/eyagiix4gm,2020-06-04 21:21:50,Twitter Web App,1,2
.@FriendsofAcadia https://t.co/RYwkvXJjYp,2020-06-04 21:21:50,Twitter Web App,1,4
.@TroutUnlimited https://t.co/0lsMrCjAeg,2020-06-04 21:21:49,Twitter Web App,1,2
.@NRCMenvironment https://t.co/Meys8jEXsQ,2020-06-04 21:21:49,Twitter Web App,2,5
If you don’t take my word for it listen to the Mainers who work in and on public lands every day. Sportsmen conservationists and outdoors groups all support our legislation:   4/,2020-06-04 21:21:49,Twitter Web App,0,9
We’re funding the Great American Outdoors Act w/o asking for a dime from taxpayers. This legislation uses fees collected from oil &amp; gas companies and directs it to protection and conservation. It’s a common sense approach with widespread support from both sides of the aisle. 3/,2020-06-04 21:21:49,Twitter Web App,0,13
That’s 1 reason I introduced a landmark bill today with a bipartisan group in the House: The Great American Outdoors Act.   Our bill restores and repairs America's iconic nat'l parks &amp; makes sure LWCF continues to protect public lands all over Maine. 2/   https://t.co/FYwiP195S0,2020-06-04 21:21:48,Twitter Web App,3,16
Public lands have always been critical to Maine's economy and our way of life. From the playground at your local park to your favorite spot to hunt or snowmobile places that were easy to take for granted just a few months ago have become essential during the COVID-19 crisis. 1/,2020-06-04 21:21:48,Twitter Web App,5,27
We are long past the time for roundtables — Maine lobstermen need real meaningful action.,2020-06-04 19:10:54,Twitter Web App,2,17
Last July I led the ME delegation to formally request that POTUS stop NOAA — a part of his administration — from moving forward w/ these regulations on lobstermen until it can prove the regs will truly be effective.   A year later still no response.  https://t.co/AxGMBOgnvF,2020-06-04 19:10:54,Twitter Web App,0,8
It’s great that @realDonaldTrump is finally meeting with Maine's fishing industry tomorrow but I have to ask:  Where has he been for the past few years as lobstermen have faced onerous fed'l regulations put forward by his own administration? #mepolitics  https://t.co/uv6B31IHja,2020-06-04 19:10:54,Twitter Web App,8,30
No one should be held above the law. Not our leaders not the wealthy or the privileged and not individuals entrusted with enforcing our laws and protecting our communities.  My statement on the events of the past week: https://t.co/2b0INDfhqA,2020-06-01 22:47:33,Twitter Web App,7,21
Today I'm leading the @HouseSmallBiz Subcommittee I chair to hear from small business owners who've used SBDCs to keep their business running and SBDC directors from across the country. 2/ #mepolitics  We're starting in a few minutes. Follow along here: https://t.co/0QSWeUMq2f,2020-05-28 16:45:37,Twitter Web App,3,3
@MaineSBDC locations all over our state have been providing cost-free services to Maine small businesses to help them stay afloat continue to provide jobs and adapt in response to the recession we're facing from COVID-19. 1/,2020-05-28 16:45:37,Twitter Web App,2,3
Do you have questions about your Economic Impact Payment COVID-19 scams or tax information?   The IRS will be holding a tele-town hall specifically for Mainers tomorrow May 28 at 12p.m.  You can join at noon tomorrow by calling (888) 331-8226 and entering access code 6688968.,2020-05-27 20:45:59,Twitter Web App,5,8
Nonprofits provide jobs to 1 in 6 Mainers. Many of their services have never been more important as families deal with hardship from COVID-19. This week I led the Maine delegation to push the administration to change their rules &amp; protect these critical services in our state. 2/ https://t.co/TXp2ydfZXI,2020-05-27 19:23:13,Twitter Web App,4,12
New rules from the Dep't of Labor are forcing Goodwills YMCAs and other nonprofit organizations to shoulder hundreds of thousands of dollars in unexpected costs upfront even though half of those costs will be reimbursed later by the fed'l government. 1/ https://t.co/F18Q4Hw6dA,2020-05-27 19:23:13,Twitter Web App,6,9
In the @HouseSmallBiz we’re working on legislation to make changes to relief programs that help small businesses stay afloat &amp; rehire workers. My work is informed by what I’m hearing from small businesses and I want to be sure that I hear from as many of them as possible.,2020-05-21 21:46:06,Twitter Web App,0,3
If you’re a small business owner take our survey and tell us what changes to COVID-19 relief programs your business needs to provide jobs and survive this recession: https://t.co/1QgbT1XJsz  Please share with other small businesses.,2020-05-21 21:46:06,Twitter Web App,5,5
Our Small Business Response Team is here to help small business owners with questions and work with them to resolve problems they're having with the PPP and other programs.   Contact our team at: SmallBizResponseTeam@mail.house.gov,2020-05-21 13:45:12,Twitter Web App,0,2
@SBAgov recently released more information about how small businesses participating in the Paycheck Protection Program can qualify for loan forgiveness.  This forgiveness application doesn’t provide all the answers but it’s a start. You can find it here:  https://t.co/2tgjmrUhUb,2020-05-21 13:45:12,Twitter Web App,0,2
The Maine Department of Marine Resources is asking for feedback about how to best allocate relief funding for fisheries in response to the economic impact of COVID-19. If you’re a fisherman or lobsterman make your voice heard here:   https://t.co/ukgWyIWKf9,2020-05-20 21:02:16,TweetDeck,1,1
Kennebec Valley Community College is where Maine trains some of its finest nurses electrical line workers and many others. I was honored to participate in their commencement last weekend and wish these grads well as they move forward in their careers.   https://t.co/jV8QOgst05,2020-05-20 20:02:38,Twitter Web App,2,5
When the @HouseSmallBiz convened recently to hear from SBA’s resource partners about their response to COVID-19 I underscored how important @ASBDC are to small businesses in Maine and why the Senate needs to do its part reauthorize the program now. 2/ https://t.co/DM9CTHzahQ,2020-05-14 14:09:17,Twitter Web App,1,3
Small Business Development Centers (SBDCs) offer free consulting &amp; training services to small businesses and they’ve never been more important. Small businesses need reliable resources to stay afloat and provide jobs amid COVID-19 which the 11 SBDCs in our district provide. 1/ https://t.co/zhVONgOZ9O,2020-05-14 14:09:17,Twitter Web App,1,3
We need to be sure VA’s telehealth capabilities meet the needs of American veterans. I worked with @SenatorCollins @SenAngusKing &amp; @chelliepingree to collaborate with the VA on improving telehealth services particularly in rural areas. 2/  Read more: https://t.co/QWf4Ez4bbv,2020-05-13 16:51:51,Twitter Web App,0,4
COVID-19 has changed the way many veterans receive VA care. A lot of Maine veterans are having to forgo the care they’d normally receive at Togus or local clinics and instead use VA telehealth services. 1/,2020-05-13 16:51:51,Twitter Web App,4,11
Small business relief should go to small businesses. I called for new guardrails on the Paycheck Protection Program last week to keep corporations’ hands off money intended for small businesses. 2/ https://t.co/PEClybF3qI,2020-05-11 20:09:12,Twitter Web App,8,29
Every relief dollar that goes to a large corporation publicly traded company or hedge fund is a dollar that is not helping real small businesses who are struggling to stay afloat and avoid layoffs right now. 1/,2020-05-11 20:09:12,Twitter Web App,7,28
During my tele-town hall with Maine seniors this week we got a few questions about which grocery stores held seniors’ hours. Luckily @AARPMaine already put together a handy comprehensive list! Feel free to share w/ any seniors who could use the info: https://t.co/uvef14FBWA,2020-05-08 21:37:51,Twitter for iPhone,4,11
You can read more about my bill here: https://t.co/aFmfmspO4w   3/,2020-05-08 14:57:05,Twitter Web App,0,4
Thankfully the two hospitals got good news this week: a judge stepped in to give them temporary access to PPP. But these hospitals need a reliable fix. My bill would make all non-profit critical access hospitals undergoing Chapter 11 permanently eligible for the program. 2/,2020-05-08 14:57:05,Twitter Web App,0,5
I introduced a bill this week to ensure that critical access hospitals like those in Lincoln and Calais can get relief through the Paycheck Protection Program (PPP). These hospitals are too important to health care &amp; the economy in rural ME to be excluded from relief programs. 1/,2020-05-08 14:57:05,Twitter Web App,3,25
You can read my letter and testimonials from 8 different businesses and organizations across the 2nd District here: https://t.co/I6qbYTMq9i 5/,2020-05-07 13:49:52,Twitter Web App,3,4
3. Allow businesses to use a greater portion of their PPP loan for non-payroll expenses. 4/  #mepolitics https://t.co/OPnWHCm3fW,2020-05-07 13:49:52,Twitter Web App,0,5
2. Consider extending the terms of loan repayment for those who through no fault of their own fail to meet the full standard for forgiveness to a longer period than 24 months. 3/  #mepolitics https://t.co/UqIEq2QbQp,2020-05-07 13:49:51,Twitter Web App,2,5
The Maine small businesses we’re hearing from need Congress to do at least 3 things to fix PPP:  1. Clarify how businesses qualify for loan forgiveness whether partial forgiveness is an option and who controls that process. 2/  #mepolitics https://t.co/xH2iyxS0gZ,2020-05-07 13:49:51,Twitter Web App,2,6
I wrote to congressional leaders yesterday w/ a simple message: ME small businesses need the Paycheck Protection Program to be improved.  Don’t take it from me take it from the folks I represent the ones working hard to keep their businesses afloat &amp; their workers employed. 1/ https://t.co/hnBsu7pKft,2020-05-07 13:49:51,Twitter Web App,9,26
Maine nurses are putting in extra hours risking their own health and making hard choices during COVID-19.  On #NationalNursesWeek I'd like to recognize all the ways Maine health care professionals — especially nurses — are going above &amp; beyond for all of us during COVID-19. https://t.co/yBslLVqGqQ,2020-05-06 23:21:01,Twitter Web App,11,47
These hospitals need help now if they’re going to stay open. I pressed the SBA with @SenatorCollins and @SenAngusKing today to amend the agency’s rules to allow critical access hospitals reorganizing under Chapter 11 — like Calais &amp; Penobscot Valley — to apply for PPP relief. 3/ https://t.co/r0ZtHbE4og,2020-05-01 20:55:33,Twitter Web App,3,11
These hospitals are also major employers and economic drivers in our communities. They should be shoo-ins for  Paycheck Protection Program (PPP) relief. Instead @SBAgov denied their applications b/c of recent bankruptcies even though that standard isn't required by law. 2/,2020-05-01 20:55:32,Twitter Web App,2,8
Calais Regional Hospital and Penobscot Valley Hospital are in trouble. ‘Critical access’ hospitals in small rural communities like these two are seeing declining revenue and higher costs due to COVID-19 making already tough financial situations worse. 1/ https://t.co/s9vqQ1Aq3Q,2020-05-01 20:55:32,Twitter Web App,7,13
Great to talk with folks at my former high school Leavitt Area High in Turner this morning. We talked about life after high school what I loved about my time at Leavitt and staying sane in these trying times. https://t.co/RI5rqzSxbZ,2020-04-29 15:37:20,TweetDeck,2,10
SELF-EMPLOYED MAINERS: If you're out of work due to COVID-19 you can apply for expanded unemployment benefits with @maine_labor starting Friday.   Let us know if you have any questions as you apply: https://t.co/n0qYeGOwhB https://t.co/bOVOgTjTor,2020-04-29 14:50:42,Twitter Web App,4,7
