Congratulations to Bath Iron Works Dead River Company and Penobscot Job Corps. Your commitment to hire Maine veterans and this recognition from the HIRE Vets Medallion Program from the U.S. Department of Labor is something to be proud of.  https://t.co/hPns3mLyqu,2020-11-27 21:00:01,Twitter Web App,4,40
As I reflect upon what I am most grateful for this year I am especially glad to be able to share that my wife Izzy and I are expecting a baby in 2021. We are excited about this new addition to our family and look forward to the blessings ahead. 2/ https://t.co/7cxoxO51hD,2020-11-26 15:01:00,Twitter Web App,23,1158
I wish all of my fellow Mainers a safe and Happy Thanksgiving. 1/,2020-11-26 15:00:01,Twitter Web App,4,59
I wrote to both Speaker Pelosi and Minority Leader McCarthy to urge them to get this done. We must protect Mainers struggling to make it through this crisis:   https://t.co/POBuVd8xG7   4/,2020-11-25 21:03:00,Twitter Web App,3,20
A deal like that means ensuring that Mainers can access remaining PPP funds and can still receive unemployment enhancements and be protected by foreclosure and eviction moratoriums after they expire at the end of the year. 3/,2020-11-25 21:02:00,Twitter Web App,1,11
But in order for that to happen Speaker Pelosi and Minority Leader McCarthy must put partisanship aside and work together to pass an extension of CARES Act programs that expire on December 31st. 2/,2020-11-25 21:01:00,Twitter Web App,2,22
Congress has utterly failed to keep up with the coronavirus pandemic’s cost to everyday people.  With the end of the year approaching the very least that Congress can do is ensure that folks continue to get the support that was already provided by the CARES Act. 1/,2020-11-25 21:00:01,Twitter Web App,4,33
Open enrollment in the Affordable Care Act marketplace is available until DECEMBER 15th.  The window to get covered is limited. During the coronavirus pandemic it’s more important than ever that you &amp; your family have the coverage you need:  https://t.co/xSVTR7cznc,2020-11-24 21:40:00,Twitter Web App,10,21
The people who use HCTC are mostly folks who've spent their careers working hard manufacturing and mill jobs. They need this provision to afford health care until they can get on Medicare so recently I led a push to extend the credit through 2025. 3/  https://t.co/0yT4RfrtkW,2020-11-23 21:42:54,Twitter Web App,1,5
Last year we were able to save the provision from elimination but it’s set to expire again next month. 2/,2020-11-23 21:42:53,Twitter Web App,0,5
The Health Coverage Tax Credit (HCTC) helps a number of retired Mainers afford health care especially those who’ve been affected by outsourcing or pension changes but aren’t yet on Medicare. 1/  https://t.co/2nioJPupos,2020-11-23 21:42:53,Twitter Web App,3,10
Earlier this week the Trump Administration announced a drawdown of U.S. forces in Afghanistan. My statement below:   https://t.co/tHQLkYct97,2020-11-20 20:11:46,Twitter Web App,3,11
I’ve been calling for a compromise deal since May and I remain committed to a bipartisan approach. We should negotiate off of the Problem Solvers plan which is already supported by members of both parties.  My thoughts on COVID-19 relief: https://t.co/5zuBbED4JI  #mepolitics 2/,2020-11-19 23:13:08,Twitter Web App,2,12
Speaker Pelosi and Majority Leader McConnell along with the sitting president have failed to set aside election year politics to meet the needs of the country on COVID-19 relief.   As a result the nation is unprepared for the winter surge in virus cases.   #mepolitics 1/,2020-11-19 23:13:08,Twitter Web App,8,48
My office is happy to help you if you have any questions. You can also speak with your Local Service Center to apply — find out where that is here:   https://t.co/TQkzG1rgVC  3/,2020-11-18 23:22:01,Twitter Web App,1,7
Farms in most Maine counties are eligible to apply and the money can be used for everything from living expenses to labor costs and debt.   2/,2020-11-18 23:22:01,Twitter Web App,0,12
While many Maine farmers have struggled under COVID-19 an intense drought over the summer has added further strain.  Fortunately after pressure from the ME delegation U.S. Ag Secretary Sonny Perdue has announced that some farmers may now be eligible for disaster relief aid. 1/,2020-11-18 23:22:01,Twitter Web App,2,27
You can read more about the scams targeting those receiving unemployment and how to stay safe here:   https://t.co/RSr4mSfcWA   2/,2020-11-17 22:33:33,Twitter Web App,1,5
The Maine Department of Labor (MDOL) is letting Mainers know about phishing scams targeting unemployment recipients. The MDOL will NOT send you information about resetting your password unless you request it first. 1/,2020-11-17 22:33:33,Twitter Web App,6,18
We should be encouraging Mainers with good ideas to continue growing Maine’s small biz community especially during these challenging times. Break is a great example.  Thank you for having me. 2/,2020-11-16 21:46:59,Twitter Web App,0,20
The owners of Break Coffee Shop in Lewiston welcomed me to their new small business recently to talk about their experience as entrepreneurs including the challenges of getting started during a global pandemic. 1/ https://t.co/a6mG1StaAp,2020-11-16 21:46:59,Twitter Web App,4,62
I give special thanks today to those who have suffered long-lasting wounds during their service. Your sacrifices will not be forgotten.   Thank you.    2/,2020-11-11 15:15:54,Twitter Web App,0,17
Thank you to all my fellow veterans for your service to this nation. It's been an honor to follow in your footsteps or to serve alongside you and I am proud of those who have followed in the years since I completed my service.    1/,2020-11-11 15:15:53,Twitter Web App,6,60
I’m dedicated to keeping the ACA in place and working to make the improvements necessary to make coverage and care more affordable for Mainers. 3/ https://t.co/nq5TIJLX4n,2020-11-10 21:25:57,Twitter Web App,2,18
Many Mainers may not even know that they have a pre-existing condition that could be excluded from coverage without the ACA. It’s not only asthma and diabetes but COPD obesity and even pregnancy that could mean folks would no longer be guaranteed coverage. 2/ https://t.co/HQcvHAxuzt,2020-11-10 21:25:57,Twitter Web App,3,14
I held a socially-distanced roundtable in Bangor recently to talk with medical experts about the importance of the ACA to Maine what we need to do to improve the law and what healthcare access Mainers stand to lose if the law is repealed. 1/ https://t.co/2ZTEEakVUL,2020-11-10 21:25:56,Twitter Web App,4,31
Proud to help get this done for Gold Star Families in Maine and across the country.   https://t.co/MTBMsZL50Y  #mepolitics,2020-11-09 21:42:47,Twitter Web App,5,45
No matter where you are in the district there are resources available to you. You can find a list compiled by the Office on Women's Health here:   https://t.co/5GPAakJzQ2  3/,2020-10-30 21:38:17,Twitter Web App,1,10
I spent some time at Safe Voices’ new location in Lewiston (opening soon) to see how their new space will help survivors of domestic violence in Androscoggin County. Elise &amp; her team are doing essential work throughout ME for survivors and their families. 2/ https://t.co/nPIQYK1FPX,2020-10-30 21:38:17,Twitter Web App,1,12
This October as we mark Domestic Violence Awareness Month we should remember that survivors face even more challenging circumstances during COVID-19.  Thankfully there are many resources available for Mainers who are experiencing violence. 1/ https://t.co/VlsdYIbZPA,2020-10-30 21:38:16,Twitter Web App,4,18
This is a small but important gesture of our respect and gratitude for Gold Star Families and I’m proud to have gotten this done. 2/,2020-10-29 13:49:13,Twitter Web App,2,19
For months I’ve been working w/ @SenatorAngusKing to provide free access for Gold Star Families to our nat'l parks and fed'l public lands. Today @Interior announced — starting 11/11 — they are implementing our proposal nationwide.  https://t.co/t33O28FUWX  1/,2020-10-29 13:49:13,Twitter Web App,6,41
These actions have resulted in the deaths and addiction of too many Americans &amp; too many Mainers.  https://t.co/RgzSU6nRFi  4/,2020-10-28 20:32:22,Twitter Web App,0,4
Shortly before DOJ announced its decision my colleagues &amp; I demanded that DOJ reverse its decisions &amp; hold pharmaceutical companies responsible for their reckless action. 3/,2020-10-28 20:32:22,Twitter Web App,0,4
But the Department of Justice has just announced that it’s closing its case into OxyContin manufacturer Purdue Pharma without anyone going to jail.  That’s absolutely ridiculous and we all know it. 2/,2020-10-28 20:32:21,Twitter Web App,0,3
Mainers are still being hit hard by the opioid epidemic especially during COVID-19.  The way I see it the opioid epidemic is a direct result of Big Pharma caring more about profits than regular people. 1/ https://t.co/ROnpAoA8cr,2020-10-28 20:32:21,Twitter Web App,2,12
Tonight the Senate will vote on the confirmation of a new Supreme Court justice just 8 days before the election. #mepolitics   My statement: https://t.co/t2QYBZB6np,2020-10-26 22:50:23,Twitter Web App,10,44
Happy National Forest Products Week to the loggers mill workers truckers and all Maine workers who make Maine’s forest products industry the economic engine and job creator that it is. https://t.co/axbUYvDAkA,2020-10-23 20:06:24,Twitter Web App,6,39
"The kind of flexible long-term relief that’s included in Congressman Golden’s RESTART Act is the kind of support we need. I hope Congress will get to work passing this legislation.” 7/,2020-10-22 20:24:28,Twitter Web App,3,11
"July and August look like they will be okay months but one can't live off a 8 week season. We received PPP money but that is now gone and the State of Maine has only pointed us back to federal programs. We’re a 90 year old business that wants to carry on but we need help." 6/,2020-10-22 20:24:28,Twitter Web App,2,9
Here’s what John from Castle Island Camps had to say about the RESTART Act:   “As a fishing/sporting camp we lost 25% of our season right off the top. We were allowed to reopen in June but after canceling everyone we had a hard time filling it back in." 5/,2020-10-22 20:24:28,Twitter Web App,0,4
The RESTART Act would eliminate the requirement that a small business has to spend a minimum percentage of the loan on payroll for it to be forgivable giving seasonal biz with smaller staffs more flexibility to pay rent utilities and other costs. 4/ https://t.co/q50UKY6wmn,2020-10-22 20:24:27,Twitter Web App,1,5
Congress needs to do better addressing the needs of ALL small biz. Fortunately momentum is growing behind the RESTART Act which I introduced in the House. This bipartisan solution provides more flexible longer-term small biz relief that works across a range of industries. 3/,2020-10-22 20:24:27,Twitter Web App,1,5
We have a lot of seasonal businesses in Maine and the PPP and other small business relief programs didn't quite work for many of them. 2/ https://t.co/8s9CNWHr0P,2020-10-22 20:24:26,Twitter Web App,0,5
I recently spoke with small biz owners John and Rhonda at Castle Island Camps a seasonal business our office assisted during the pandemic. 1/ https://t.co/rFs6xcqqbH,2020-10-22 20:24:25,Twitter Web App,2,15
Federal loans and grants can help us keep infrastructure up-to-date &amp; respond to new challenges like COVID-19.  Great to see the USDA making investments in our communities so Mainers can continue to access quality healthcare &amp; clean water.   https://t.co/ZIj3hadIxT,2020-10-21 20:46:38,Twitter Web App,3,9
Great to join Raye’s Mustard owners Karen and Kevin in Eastport to learn about their successful small business and their Mustard Mill Museum project. We’ll be working with them to support grant programs that help small businesses preserve historic buildings across Maine. https://t.co/CkA577wgmX,2020-10-20 20:15:27,Twitter Web App,3,47
I led a bipartisan group with @chelliepingree &amp; @RepDavidRouzer to urge the USDA to provide loggers relief just like farmers and fishermen. The reforms we’re pushing for would make grants available to logging operations in ME thru existing programs.  https://t.co/jFKOgqhe7V  2/,2020-10-19 20:59:59,Twitter Web App,0,8
Congress has created programs to help both farmers and fishermen stay above water during COVID-19 and the economic downturn. But loggers have received no such help despite the fact that Maine’s timber harvest is expected to drop by 20% this year due in part to the pandemic. 1/,2020-10-19 20:58:49,Twitter Web App,5,17
Captain Bob Peacock &amp; I met at the Eastport Breakwater &amp; talked about the value of rail transportation in places like Washington County &amp; supporting Maine veterans especially during COVID-19.  I learned a lot from Bob about the Port of Eastport &amp; I appreciate the warm welcome. https://t.co/0nOYjqRWa2,2020-10-15 20:10:00,Twitter Web App,2,13
I’ve been pushing back writing to both the Department of Health and Human Services &amp; drug manufacturers about ensuring that the 340B program remains available to serve low-income Mainers who need treatment. You can read these letters here: https://t.co/yjmxlqVMlj   3/,2020-10-14 22:03:03,Twitter Web App,0,5
It's an important part of keeping Mainers especially Maine seniors and Mainers in poverty healthy.  But lately Big Pharma is trying to undermine this program &amp; we can’t let that happen. 2/,2020-10-14 22:03:02,Twitter Web App,0,7
I had a virtual meeting with the Maine Primary Care Association where we discussed the importance of the 340B program for Mainers.   340B is a discount program for Rxs that helps Maine community health centers access low-cost medication and support valuable services. 1/ https://t.co/jjFSBpILgt,2020-10-14 22:03:02,Twitter Web App,2,16
We’re working hard to build support for this bill. You can learn more about the RESTART Act here:   https://t.co/zFjEsTsRQe  5/,2020-10-13 21:32:08,Twitter Web App,1,5
My solution is a bipartisan bill I introduced in the House called the RESTART Act which builds on the PPP to provide more flexible longer-term small biz relief.  This bill is the only comprehensive small biz relief plan with bipartisan support in both the House and Senate. 4/,2020-10-13 21:32:08,Twitter Web App,2,6
Many of the small businesses I’m hearing from still need help even as Congress has failed to come together to pass add’l COVID-19 relief. 3/,2020-10-13 21:32:08,Twitter Web App,2,7
One business that reached out to us was Belgrade Lakes Golf Club who we helped apply for a PPP loan. I went to visit BLGC recently to get an update from the club’s owners &amp; other small businesses in the area. 2/,2020-10-13 21:32:08,Twitter Web App,1,3
At the beginning of the pandemic many Maine small businesses were struggling to figure out how to navigate new federal aid programs so they could stay afloat. So we set up a Small Business Response Team in my office to help. 1/ https://t.co/FCLRpn9QkC,2020-10-13 21:32:07,Twitter Web App,5,23
The company is combining renewable tidal energy with new technology to power Maine and help protect our fragile power grid. It’s an impressive cutting-edge project and it’s happening right here in Maine. Thanks to Stuart John and Bob for telling me about your work. 2/ https://t.co/1hNHjk2XRN,2020-10-12 20:41:00,Twitter Web App,2,13
Maine’s abundant natural resources mean that we’re in a great position to lead the way on renewable energy. I visited the Ocean Renewable Power Company in Eastport recently to learn more about their new microgrid project. 1/ https://t.co/mXSOxj1h8D,2020-10-12 20:40:00,Twitter Web App,7,42
With summer camp cancelled Camp Mechuwana and their staff have spent this past summer distributing food to kids who need it in the Monmouth Vienna and Winthrop areas. Thanks to Camp Mechuwana for stepping up to the plate and working hard when your community needed you! https://t.co/EaFdFlW9nM,2020-10-09 20:40:00,Twitter Web App,3,26
PPP PARTICIPANTS: @SBAgov has a new streamlined loan forgiveness application for PPP loans of $50K or less: https://t.co/WY9RYMI8re  Our Small Biz Response Team is standing by to help you with the app &amp; answer your questions: 207-241-6767 or SmallBizResponseTeam@mail.house.gov,2020-10-09 13:50:32,Twitter Web App,7,10
We need to protect Social Security benefits so I’m backing a bill to effectively block and reverse the executive order. Mainers deserve a real bipartisan COVID-19 relief bill not a partisan half-measure that could harm older Mainers. https://t.co/wkOPWkPCc1  2/,2020-10-08 20:41:00,Twitter Web App,5,18
An executive order announced last month would defer payroll taxes which threatens Social Security benefits and doesn’t offer the relief that Mainers who have lost their jobs need. https://t.co/eP0SVlu4LM  1/,2020-10-08 20:40:00,Twitter Web App,3,10
If someone you know doesn’t have internet access but may be eligible to receive an EIP as a non-filer the IRS can accept their information offline.   Find out more in Question G9 below &amp; make sure to take action by OCT. 15th if you’re eligible: https://t.co/QZrmOjIQXo   2/,2020-10-07 20:50:36,Twitter Web App,1,4
According to a recent news release from the IRS more than 30000 Mainers still haven’t received their Economic Impact Payment (EIP).   But there’s still time. Many of these folks may be non-filers who don’t know that something’s missing. 1/,2020-10-07 20:50:36,Twitter Web App,3,19
As I've said for months now the American people can't wait for additional coronavirus-related federal aid — not until after the election and certainly not until 2021.  My statement on the president's decision to withdraw from COVID-19 negotiations: https://t.co/arjLDeDZWR,2020-10-06 23:39:55,Twitter Web App,9,27
If you or your small business are struggling with a federal program or need information my office is ready to assist you. Contact us here: https://t.co/cSbfTJnS1K  Or call one of our offices:  Bangor: (207) 249-7400 Caribou: (207) 492-6009 Lewiston: (207) 241-6767  2/,2020-10-06 21:42:52,Twitter Web App,0,7
Every day we get dozens of calls from constituents looking for information or help with Medicare the VA or other federal programs. We do our best to serve you and meet your needs during these difficult times. It’s not flashy but it’s some of the most important work we do. 1/ https://t.co/7NlR0gIrpX,2020-10-06 21:42:51,Twitter Web App,9,32
"Acts like this motivate our police officers to persevere improve and strive to forge meaningful connections in our communities by showing us we are appreciated and valued.”  — Matt Nadeau President Maine Fraternal Order of Police  3/,2020-10-05 23:49:04,Twitter Web App,1,5
Here’s what the president of Maine’s Fraternal Order of Police had to say about the bill:  “The Protect and Serve Act cosponsored by Representative Golden is exactly what’s needed by today’s law enforcement officers." 2/,2020-10-05 23:49:04,Twitter Web App,2,6
I’m proud to cosponsor the Protect and Serve Act a bipartisan bill to increase penalties for targeting law enforcement officers with violence. The officers working to protect our communities every day deserve nothing less. 1/   https://t.co/Uf1P22mN4D,2020-10-05 23:49:04,Twitter Web App,3,5
I'm sick and tired of the grandstanding and empty promises on COVID-19 relief and I know many of my constituents are too. Mainers need real relief now not another partisan bill with no chance of becoming law.   My statement on last night's vote: https://t.co/Nc33vlXBzm,2020-10-02 17:30:56,Twitter Web App,7,25
I’m adding my prayers alongside many others for the President and First Lady’s good health and full recovery. COVID-19 can be life-threatening especially for seniors and people with certain pre-existing conditions and we all need to take steps to watch out for one another.,2020-10-02 11:51:38,Twitter for iPhone,11,76
I spent some time at Greenhead Lobster in Bucksport where we talked about the growing lobster processing industry in ME &amp; how to keep Maine lobstermen from being dependent on Canadian processors.  Thank you Hugh Chris &amp; Rick for having me &amp; taking the time to show me around. https://t.co/320Xs36rp6,2020-10-01 22:28:26,Twitter Web App,4,31
We should be making sure ambitious folks like Kathy have the tools they need to succeed especially right now. It’s time for the Senate to take action &amp; help protect small biz during COVID-19 by passing the SBDC Improvement Act which I passed thru the House a year ago. 2/ https://t.co/9xfQoaWRj1,2020-09-30 22:20:34,Twitter Web App,3,6
When I went to see Lighthouse Arts Center owner Kathy James last month she reminded me exactly how important the Small Business Development Center (SBDC) program is. Kathy has been working hard to re-open her small business with the help of her local SBDC during COVID-19. 1/,2020-09-30 22:20:33,Twitter Web App,3,9
I’m excited to see Bucksport continue to make a name for itself in seafood processing and I look forward to working with Pemaquid Mussel Farm and other small businesses to get there. 3/ https://t.co/R5hyZip2rM,2020-09-29 21:58:49,Twitter Web App,0,7
I got to see that progress firsthand recently visiting two Bucksport processing plants including Pemaquid Mussel Farm last month. I received a tour of the facility spoke with some of the workers and heard more about their mussel and oyster operations. 2/ https://t.co/6SesZWtq4q,2020-09-29 21:58:48,Twitter Web App,0,7
Losing the mill six years ago led to challenges for Bucksport. But Mainers are resilient and these days Bucksport is a new seafood processing hub. 1/,2020-09-29 21:58:47,Twitter Web App,3,22
It’s time for us to carry it across the finish line — so I led a bipartisan &amp; bicameral letter to NDAA Conference Committee leadership to ensure that this small but important acknowledgement of our Gold Star Families’ sacrifice doesn’t get left out. 2/ https://t.co/cOVOSJd7Dt,2020-09-28 23:29:26,Twitter Web App,5,13
I’ve been working to get Gold Star Families free access to National Parks and other federal lands for months now and we’re closing in. 1/,2020-09-28 23:29:26,Twitter Web App,5,29
My provision makes it easier for loggers to sell their extra materials &amp; helps our state move towards more renewable energy sources.  You can learn more about my amendment here: https://t.co/ZPLhLM93sS 2/,2020-09-25 22:14:19,Twitter Web App,1,9
Logging is part of our heritage as Mainers. But COVID-19 is hitting loggers hard &amp; we need real solutions to help this industry &amp; its workers recover. I secured an amendment to the House's clean energy bill to help ME loggers generate additional revenue thru biomass energy. 1/,2020-09-25 22:14:18,Twitter Web App,4,18
Our Service Academy Night is this evening at 6:00pm. Join us tonight if you'd like more information about opportunities to prepare for your career and serve in our country's armed services. https://t.co/YgEmvGywfo,2020-09-23 20:45:46,Twitter Web App,1,8
We’re working with @PLCofMaine to build support for the bill and I’ll keep pushing to help the logging industry in Maine make a full recovery. This is one of our state’s most important industries and Maine’s rural communities need it to be healthy. 3/ https://t.co/Gm2LxHg2yg,2020-09-22 20:42:33,Twitter Web App,0,7
One thing I’ve been working on to help loggers and truckers in Maine is the Loggers Relief Act which I introduced w/ Republican Rep. David Rouzer. Our bill would provide direct COVID-19 relief to logging &amp; log hauling operations like the aid we provide to farmers right now. 2/,2020-09-22 20:42:33,Twitter Web App,0,7
The Androscoggin Mill explosion has hurt the logging industry throughout our state. I headed to Jay last month to get an update from Pixelle representatives &amp; Rep. Tina Riley on the mill's progress and hear what our loggers &amp; truckers need to get the industry humming again. 1/,2020-09-22 20:42:33,Twitter Web App,3,18
... along with @RepSchrader @RepSusanWild @RepFinkenauer @RepKendraHorn @RepSusieLee @RepGallagher @RepPaulCook @RepTomReed @RepSlotkin and @RepDonBacon who also signed on to this effort to push for bipartisan COVID-19 relief. 5/,2020-09-22 13:35:46,Twitter Web App,0,8
.@RepMaxRose @HerreraBeutler @RepFredUpton @RepBrindisi @RepGilCisneros @RepStephMurphy @RepCunningham @RepJoshG @RepJimCosta @RepVanTaylor @RepColinAllred @RepSherrill @RepTomSuozzi and @RepJohnKatko joined us to press  for COVID-19 relief before the election 4/,2020-09-22 13:35:45,Twitter Web App,0,10
I led a group of 34 Republicans and Democrats with @RepBrianFitz @RepKathleenRice and @RepAGonzalez to make clear to House leaders:   Until the House has sent new bipartisan COVID-19 relief legislation to the Senate our place of duty remains here in the People’s House. 3/ https://t.co/Em9NrV8aYN,2020-09-22 13:20:11,Twitter Web App,8,32
Members of Congress were elected to represent the best interests of our constituents and the country not a political party. Our constituents expect that in the midst of this crisis we will rise to the occasion and stay at the table until we have delivered relief. 2/,2020-09-22 13:20:10,Twitter Web App,2,23
The #1 priority in the House right now needs to be passing bipartisan COVID-19 relief for our constituents.   Too many are still unemployed too many businesses are on the brink of going under and our schools rural hospitals and state &amp; local gov’ts face a budget crisis. 1/,2020-09-22 13:20:10,Twitter Web App,21,100
Read more about our bill here: https://t.co/C7ukXAkrj1  2/,2020-09-21 20:45:57,Twitter Web App,3,10
