The Postal Service is a lifeline for rural Mainers and small businesses. I’ve introduced the bipartisan Postal Service Emergency Assistance Act to provide emergency funding that allows USPS to function at full capacity during this pandemic &amp; recession. 1/ https://t.co/p5Wvx8wVc0,2020-09-21 20:45:57,Twitter Web App,11,41
My statement on the news of Justice Ginsburg's death last night: https://t.co/UQgqdu0Lpz,2020-09-19 13:43:13,Twitter Web App,4,33
I led the rest of the ME delegation in pressing the U.S. Trade Representative to put in place essential trade protections for wild blueberry producers &amp; processors while protecting the supply chain that ME processors use to sustain their businesses. 2/ https://t.co/G8Bsp07UgX,2020-09-18 21:57:41,Twitter Web App,2,24
The blueberry industry is a powerful economic force in our state &amp; for good reason. ME wild blueberries are the best in the world. But ME growers and processors are facing new challenges as berries from abroad flood the market &amp; undercut Mainers’ ability to sell here at home. 1/,2020-09-18 21:57:41,Twitter Web App,3,36
Last week the USDA announced $530 million in relief aid to American fisheries including Maine’s lobster fishery.   If you want more information contact our office to find your nearest Farm Service Agency service center and next steps to apply. Or use: https://t.co/oGkTbZSf0E,2020-09-17 21:43:11,Twitter Web App,1,10
My colleagues and I are committed to staying in Washington and doing our jobs until we deliver for our constituents. Helping people that have lost jobs keeping our hospitals fiscally healthy and saving small businesses is more important than any campaign.   3/,2020-09-16 20:33:51,Twitter Web App,1,6
It’s not too late to put negotiations back on the right track.   The bipartisan Problem Solvers proposal shows that when party politics are taken out of the mix there is a solid deal to be had.   2/,2020-09-16 20:33:50,Twitter Web App,1,6
We started Tuesday w/ a credible bipartisan proposal to deliver COVID relief and a commitment to staying in Washington until we got a deal done.  We ended Tuesday w/ party leaders choosing politics over country bringing momentum to a screeching halt. 1/ https://t.co/SI7h7d8jeL,2020-09-16 20:33:50,Twitter Web App,4,18
Today's agreement is a positive and welcome development for Israel the UAE Bahrain and the entire region.   https://t.co/qlbIar4YkW,2020-09-15 20:07:16,Twitter Web App,7,21
Parks like Hosmer are one reason I support the LWCF &amp; helped introduce the Great American Outdoors Act which the president signed into law last month. That law permanently funds the LWCF and will help make sure important local projects like Hosmer Park continue across Maine. 2/ https://t.co/jFTRKO1oxR,2020-09-14 12:27:48,Twitter Web App,0,9
I met with local officials in Rumford recently to learn more about the renovation of Hosmer Park which used funding in part from the Land and Water Conservation Fund (LWCF). 1/ https://t.co/dLXMdx41CH,2020-09-14 12:27:47,Twitter Web App,4,24
The administration should build on this progress and turn its attention to finally tackling the biggest threat Maine lobstermen face right now: damaging misguided right whale regulations that could put many lobstermen out of business. 3/,2020-09-09 22:07:07,Twitter Web App,0,4
I look forward to working with lobstering communities and the administration to ensure that these relief funds are quickly distributed to Maine lobstermen as soon as possible. 2/,2020-09-09 22:07:07,Twitter Web App,0,4
Through all the bad news and challenges that have been thrown at them in 2020 lobstermen have continued to work hard to make a living and provide for their families. They deserve this welcome news. 1/   https://t.co/xa9d6Z3Xe6,2020-09-09 22:07:06,Twitter Web App,1,14
I couldn’t have gotten this done without the support and hard work of @SenatorCollins @SenAngusKing and @chelliepingree. Mainers are lucky to have a delegation that works together across the aisle to deliver for veterans. 4/,2020-09-03 13:18:53,Twitter Web App,0,11
Construction on the new facility will start next year and Maine veterans will begin receiving care in 2022. This fills a huge gap in veterans’ care in Maine and I applaud the leadership at Togus VISN-1 and @DeptVetAffairs for recognizing the need for this facility. 3/,2020-09-03 13:18:53,Twitter Web App,0,18
Here in Maine the VA doesn’t offer long-term treatment for substance use.   Instead vets get sent away to CT or MA far from their family friends and support system. You don’t need to be a doctor to know that’s not a recipe for success when it comes to recovery.  2/,2020-09-03 13:18:53,Twitter Web App,0,15
A new 24-bed facility to treat veterans with substance use disorder is coming to Maine.   I've worked to bring this care to our state since I was in the State House and since day 1 in Congress and I'm proud to deliver for my fellow vets. 1/  #mepolitics  https://t.co/qpjzqq3fuG,2020-09-03 13:18:52,Twitter Web App,92,325
Let’s get it done. Congressional leaders should use this opportunity to show the American people that Congress can still function like it’s supposed to and deliver for our constituents.   Read more about our proposal here: https://t.co/aBlqtthdx4   6/,2020-09-01 20:35:46,Twitter Web App,1,6
Here’s the kicker: if we passed legislation along the lines of our proposal today we could save American seniors over *$20 billion* in out-of-pocket costs on Rx drugs.   That’s meaningful work that has the support of Democrats Republicans and the White House.   5/,2020-09-01 20:35:45,Twitter Web App,2,12
Working w/ @RepMikeGallagher @RepHarley &amp; @RepBrianFitz we looked at both bills identified the areas where they overlapped &amp; found significant areas of agreement. We outlined these provisions in a letter to party leaders this week and urged them to finally work together. 4/ https://t.co/KrjRPKND3x,2020-09-01 20:35:10,TweetDeck,3,9
If Washington worked like it should congressional leaders would figure out where these 2 bills had common ground and pass a compromise. But DC is broken &amp; leaders aren’t talking.   So I worked with a group of bipartisan members to try and pick up the task where they failed. 3/,2020-09-01 20:30:50,Twitter Web App,2,9
Congress can’t seem to agree on anything but the need to lower Rx drug costs is one issue that cuts across the political divide.   The House passed a bill to lower drug prices a key bipartisan Senate committee has done the same and the White House has endorsed their effort. 2/,2020-09-01 20:30:50,Twitter Web App,1,9
Coronavirus the resulting economic downturn and millions of job losses mean Americans have even less money to afford the prescription medications many of us need to live normal lives.   This is a problem I hear about from Mainers a lot and it’s getting worse.   1/,2020-09-01 20:30:50,Twitter Web App,13,31
Our small business response team can answer your questions and help you apply for the program. Email or call us at smallbizresponseteam@mail.house.gov or (207) 241-6767,2020-08-30 23:18:28,Twitter Web App,1,7
Using funds Congress passed as part of the CARES Act Maine is starting a new grant program to help small businesses that are struggling during the pandemic.   https://t.co/mKuGgO0XFf,2020-08-30 23:18:28,Twitter Web App,6,17
You can hear more from constituents my office has helped on my website: https://t.co/fYz54TJLQi  5/,2020-08-28 15:30:48,Twitter Web App,0,1
We helped Lynne in Crystal resolve an issue with Medicare. 4/ https://t.co/vGPLvVovFb,2020-08-28 15:30:47,Twitter Web App,0,0
We helped Rafael in Newport get her tax refund. 3/ https://t.co/aVwlMSyQPI,2020-08-28 15:30:47,Twitter Web App,0,1
We helped Margaret in LaGrange with her unemployment benefits when she lost her job during the pandemic. 2/ https://t.co/YSlgSVMS71,2020-08-28 15:30:46,Twitter Web App,1,2
Many Mainers are facing new struggles during the pandemic and we’ve stepped up our constituent services to help meet their need. If you need assistance contact our nearest office at https://t.co/Qa8JkSoSzl  Here are just a few of the folks we’ve helped:   1/,2020-08-28 15:30:46,Twitter Web App,5,11
If you have questions about how to apply or whether your business is eligible we can help. 2/  Contact our Small Business Response Team at SmallBizResponseTeam@mail.house.gov or (207) 241-6767.,2020-08-26 16:10:41,Twitter Web App,1,3
Maine Department of Economic &amp; Community Development and @MaineSBDC are using CARES Act funds to offer new grants for rural small businesses with less than 5 employees. 1/  https://t.co/H3mcqoep9Z,2020-08-26 16:10:41,Twitter Web App,6,7
Great to stop by the @LAMetroChamber recently. Throughout the pandemic I’ve worked with the Chamber and their members to help them navigate federal small business relief programs like PPP and EIDL. They’ve been doing crucial work to help local businesses stay afloat. https://t.co/fIiLOLuQiq,2020-08-24 15:18:59,Twitter Web App,3,11
Whether it's for finding work studying or anything else find out if your local library is open and has internet connections here: https://t.co/UpOxcoTdno  2/,2020-08-20 20:26:42,Twitter Web App,1,8
Visiting libraries is one of the best ways for Mainers without good internet at home to get online. Lewiston Public Library is opening back up with some new safety measures during COVID-19 and I know some other libraries throughout the state are doing the same. 1/ https://t.co/zisYVeHIoK,2020-08-20 20:26:42,Twitter Web App,3,22
Read more about our call to restart negotiations on a COVID-19 relief package here: https://t.co/9f97GbBpCj,2020-08-20 15:33:24,Twitter Web App,1,9
Thanks to @RepBrianFitz @RepStephMurphy @MikeKellyPA @RepBenMcAdams @RepJohnKatko @RepCunningham @RepDaveJoyce @RepBrindisi @RepAGonzalez @RepSusieLee @MarkAmodeiNV2 @RepTimRyan @HerreraBeutler @RepJoshG @RepFredUpton @RepMaxRose &amp; @RepKendraHorn for joining me in this effort. 4/,2020-08-20 15:33:24,Twitter Web App,0,8
In times of national crisis Americans look to our elected officials to set aside their differences and take action through a sense of shared purpose and direction. The time for excuses has passed: Congress must work together and find compromise to jumpstart this process. 3/,2020-08-20 15:33:24,Twitter Web App,1,9
Congressional leaders need to understand that failing to reach a deal on a COVID-19 relief package is not an option.   Today I’m leading a group of 18 reps — 10 Democrats and 8 Republicans — to pressure Leader McCarthy and Speaker Pelosi to restart negotiations immediately. 2/ https://t.co/8lTNt6zHzt,2020-08-20 15:33:23,Twitter Web App,4,25
Party leaders are calling the House back to DC this weekend for votes on the postal service.   That's important work but afterwards leaders will put Congress back in recess... as if there isn't a pandemic a recession and an unemployment crisis unfolding before their eyes. 1/,2020-08-20 15:33:22,Twitter Web App,6,27
With these stories in mind I’m continuing to push for an improved version of PPP through the RESTART Act which offers more flexible longer-term partially forgivable loans for hard-hit small biz. This program will deliver the kind of relief ME small businesses say they need. 4/,2020-08-19 18:56:43,Twitter Web App,0,8
Many of the businesses I spoke with have used PPP but are counting on Congress to offer more relief. The way several business owners put it: more federal relief is the difference between staying open and keeping people hired and closing down for good. 3/ https://t.co/ltkaW0SMv5,2020-08-19 18:56:42,Twitter Web App,0,8
We need to get back to the table and work towards a deal that gets our country on track to economic recovery. That’s why I visited local businesses in Lewiston last week to talk about the challenges they’re facing and better understand what they need in the next relief bill. 2/ https://t.co/6U4Drh7n27,2020-08-19 18:56:41,Twitter Web App,0,6
It’s clear to just about everyone — except congressional leadership — that Congress should be in Washington right now working on COVID-19 relief. But congressional leaders and the White House are refusing to negotiate so the House is not in session and the Capitol is empty. 1/,2020-08-19 18:56:41,Twitter Web App,8,29
If you haven’t already you can fill out your census here: https://t.co/03Ko3pEdfI   And if you’d like to learn more about the rankings or Maine’s response rate you can see that information here: https://t.co/XGsu9YleIE,2020-08-18 20:03:59,Twitter Web App,5,6
Maine is 48th in the nation for responding to the census. We need to do better.  By participating in the census you help ensure that Maine gets its fair share of federal resources for schools roads housing infrastructure and other critical needs. https://t.co/HEhf6lCcFO,2020-08-18 20:03:23,TweetDeck,15,40
Mainers know best about how to build broadband in our state and why it’s so important. For this bill we talked with  service providers town officials small businesses and others who are working to expand broadband in our state. 2/  So don’t take my word for it. Take theirs:,2020-08-14 16:47:11,Twitter Web App,2,21
I’m introducing the Small Business Last Mile Act today with Republican @RepPeteStauber. It builds on Maine’s existing state and local broadband efforts to help rural small businesses build the all-important ‘last mile’ of broadband infrastructure. 1/,2020-08-14 16:47:11,Twitter Web App,2,45
This is good news for peace which has been rare in recent years.   We should welcome any developments in this volatile region that ratchet down hostilities and open lines of communication. I applaud both countries for their work to bring about this deal.  https://t.co/DIt7y4SVvf,2020-08-14 12:20:00,TweetDeck,1,6
The goal is to expand the program nation-wide if we find that it works well. That would mean better care for more veterans and more veterans who could stick close to home and family to get the help they need.  You can read more about my bill here: https://t.co/dl8LJJ2gRx,2020-08-11 15:23:42,Twitter Web App,2,6
We need to find new solutions which is why I’ve introduced a bill — the Veterans Access to Online Treatment Act — with @RepJimBanks to create a pilot program that provides remote mental health care to vets through online therapy and other computer-based technologies. https://t.co/xWPKWtwiVN,2020-08-11 15:23:42,Twitter Web App,3,13
For veterans who live far from VA facilities — and there are 1000s of them in Maine — distance is a huge barrier to receiving care which is particularly dangerous when it comes to mental health. We’ve expanded community care but too many veterans still slip through the cracks.,2020-08-11 15:23:42,Twitter Web App,2,13
The president's actions are a serious overreach of executive authority and come up short on addressing our nation’s public health crisis and recession.  We need congressional leaders to drop the political games and lead their caucuses to a compromise.  My full statement: https://t.co/Y6bMDvekIk,2020-08-10 15:49:47,Twitter Web App,11,51
This is a promising development that moves BIW and its shipbuilders closer to getting back to work building critically important Destroyers for the Navy. 2/,2020-08-08 20:44:41,Twitter for iPhone,0,7
It is great news that a tentative agreement has been reached. I applaud the men and women of S6 for standing together to exercise their rights and BIW for returning to the bargaining table to find an acceptable compromise. 1/   #mepolitics   https://t.co/AIfhuzixds,2020-08-08 20:44:41,Twitter for iPhone,8,28
There's broad bipartisan agreement for tackling this problem. Congressional leaders and the White House need to listen to mayors county commissioners and town councillors from across the country and make state and local gov’t relief a part of their COVID-19 package.,2020-08-06 13:32:35,Twitter Web App,1,10
This is a crisis waiting to happen. If Congress doesn’t provide federal relief — and greater flexibility — to towns and states local services Mainers count on like fire depts road repairs &amp; more will go under the knife. We're already seeing it in ME. https://t.co/V4q8sN3mU1,2020-08-06 13:32:35,Twitter Web App,4,18
Yesterday POTUS signed the Great American Outdoors Act — a bill I introduced in the House with a bipartisan group — into law.  Working across the aisle we're getting results to improve and protect public lands Mainers use for hunting hiking &amp; fishing.  https://t.co/eVhqKluCmu,2020-08-05 13:25:15,Twitter Web App,3,37
Our RESTART proposal is gaining traction among small businesses and in Congress with 79 bipartisan House members now cosponsoring our bill.   Today I led 24 of these representatives to write to House leadership urging them to include RESTART in their COVID-19 negotiations. https://t.co/liOwbKpLP0,2020-08-04 16:08:07,Twitter Web App,2,8
Last month I introduced the RESTART Act w/ @MikeKellyPA to help Maine's hardest-hit small businesses as they continue to struggle.  RESTART builds on &amp; improves the PPP with flexible long-term partially forgivable loans that covers: - Payroll - Rent - PPE - Utilities (&amp; more),2020-08-04 16:08:07,Twitter Web App,3,11
To help address this problem we passed a bill through the House last week to provide $1 billion in funding for broadband development including support targeted specifically to the telemedicine and distance learning services our rural areas need most during the pandemic. 2/ https://t.co/MERyX2RNWH,2020-07-31 21:07:32,Twitter Web App,3,14
Today is #RuralBroadbandDay — which has become even more urgent during COVID-19 and this economic downturn. The broadband gap damages the health and education of rural patients and students in normal times and the impacts are far worse right now. 1/,2020-07-31 21:07:31,Twitter Web App,5,22
These vets are sent out of state because Togus doesn’t have long-term mental health beds.   Maine veterans deserve better which is why I secured $20 million in the House's VA funding bill to help address this problem. #mepolitics 2/  Read more here: https://t.co/haOU0aB0Di,2020-07-30 17:04:03,Twitter Web App,9,33
When Maine veterans need long-term VA mental health care for things like post-traumatic stress or substance abuse they’re sent to Massachusetts or Connecticut to get treatment. Far away from their families and support systems recovery becomes more difficult. 1/,2020-07-30 17:04:03,Twitter Web App,7,19
Americans owe you a debt of gratitude Congressman Lewis. Thank you for your service to our country.   Photo credit: @AP https://t.co/6YaQJq6xMi,2020-07-29 13:20:36,Twitter Web App,9,93
We turned that idea into bipartisan legislation and worked with @SenAngusKing to introduce it earlier this summer. This week we passed it through the House and I’ll keep fighting to get that bill on the president’s desk. 2/  #mepolitics  https://t.co/OHKNsO4KNc,2020-07-23 13:21:51,Twitter Web App,6,44
A constituent brought me an idea last year: Gold Star Families should have free access to national parks. It’s a small but meaningful act from a grateful nation to honor their sacrifice. 1/,2020-07-23 13:21:51,Twitter Web App,7,77
Today the House sent the Great American Outdoors Act to the president’s desk.   This bill which I introduced w/ 11 bipartisan lawmakers protects and expands the #publiclands Mainers use to hunt hike and fish for the next generation. #LWCF  https://t.co/KAQ1Zg1k7s,2020-07-22 22:18:19,Twitter Web App,9,38
Last night the House passed my legislation to protect the rights of servicemembers against predatory lenders telephone companies and others as part of the National Defense Authorization Act. #mepolitics  Here's why it's important to our our servicemembers: https://t.co/eizbbFtQky,2020-07-22 14:04:02,Twitter Web App,24,98
Our country has lost a great American and historic leader. As we grieve the passing of this giant let’s resolve to follow his example as we confront these challenging times.  2/,2020-07-18 12:24:07,Twitter for iPhone,3,35
Very few have worked as hard to make our country live up to its ideals as John Lewis. Working with him in Congress I’ve been inspired by his graceful leadership and service ability to see good in all people and strong sense of America's conscience. 1/  https://t.co/Ud1ZP1M8qR,2020-07-18 12:24:07,Twitter for iPhone,8,54
5 million Americans have lost health insurance since March.  Rather than working with us in Congress to solve this crisis the administration is in the Supreme Court trying to dismantle the ACA and cut coverage for ~98k Mainers. We cannot let that happen.  https://t.co/DphBFM6B4A,2020-07-17 14:07:02,Twitter Web App,48,84
Find out more about the RESTART Act here: https://t.co/CCJeTj0Tu2,2020-07-11 20:06:49,Twitter Web App,0,5
I introduced the bipartisan RESTART Act last week in the House. It’s the best next step for Maine small businesses and their workers to help them make it through the COVID-19 recession.  But you don't have to take my word for it here’s what ME small businesses think: https://t.co/susX1N9mb9,2020-07-11 20:06:49,Twitter Web App,5,13
Thanks to @StopBigMoney @MECleanElection and @Public_Citizen for supporting my legislation. 9/,2020-07-09 20:29:37,Twitter Web App,3,19
If we’re ever going to make real progress on the issues that matter most to Mainers we need to fix the entire system.  I want people to have faith in the power of our democracy again and these proposals put us on that path.   See my full plan here: https://t.co/i9UAK5mG7E 8/,2020-07-09 20:29:36,Twitter Web App,5,28
But I’m not stopping there. There are 12 other pieces of legislation in my plan. If we’re successful we can ban Members of Congress from ever lobbying overturn Citizens United block foreign interests from influencing our elections continue to build on HR 1 and much more. 7/,2020-07-09 20:29:36,Twitter Web App,9,45
I’m also introducing the Crack Down on Dark Money Act today.   This bill: - Targets the 501(c)(4) organizations big money groups use to spend $$$ on elections without revealing their donors - Places limits on these orgs' spending - Forces their big donors to reveal themselves 6/ https://t.co/F436s3ANM1,2020-07-09 20:29:35,Twitter Web App,16,50
Key to my plan is the Stop Foreign Payoffs Act which bans...  POTUS VP Cabinet officials Congress &amp; their families  ... from taking a salary from a foreign company (serving on a board for example) or holding an investment in a foreign company (like a Scottish golf course). 5/ https://t.co/PbTu16wG7v,2020-07-09 20:29:35,Twitter Web App,11,36
The plan focuses on three key areas to take power away from money and special interests and return it to the people.  4/ https://t.co/VTP9yZPHfb,2020-07-09 20:29:35,Twitter Web App,8,23
I'm sick of it. For over a year I’ve been working on new legislation &amp; developing a set of proposals to put our country back on the path to working for regular people.  Today I’m announcing my Plan to Fix a Broken Washington.  Read the plan here: https://t.co/i9UAK5mG7E 3/ https://t.co/z3RNsMmvUK,2020-07-09 20:29:34,Twitter Web App,8,39
Corruption and money in politics reach into our lives in a million different ways.   They maintain the status quo and hold us back from tackling some of our most urgent issues like lowering Rx drug costs reducing the deficit or protecting our jobs from being sent overseas. 2/,2020-07-09 20:29:34,Twitter Web App,6,20
I talk to a lot of people who've lost all faith in Congress and the fed'l government. Washington seems rigged against regular people by those with money and power &amp; in many ways it is.  Everyone can see the system is broken — but too many in DC have given up trying to fix it. 1/,2020-07-09 20:29:34,Twitter Web App,17,76
Our RESTART program builds on PPP to offer partially forgivable loans that are targeted to businesses that have taken a hit of more than 25% due to COVID-19.   Learn more here: https://t.co/CCJeTj0Tu2 3/,2020-07-08 20:02:17,Twitter Web App,0,2
PPP was successful as an emergency measure to quickly protect as many small businesses and jobs as possible at the beginning of the outbreak.   But now most small businesses have spent through their PPP funds or never applied because it didn’t quite work for them.   2/,2020-07-08 20:02:16,Twitter Web App,0,2
I introduced new legislation with Republican @MikeKellyPA  this month to create the RESTART program. RESTART builds on the Paycheck Protection Program to help the most hard-hit small businesses and their workers make it through this recession. 1/  https://t.co/111srswk4d,2020-07-08 20:02:16,Twitter Web App,2,7
That's why I introduced a bill — the Preventing China from Exploiting COVID-19 Act — with 13 of my colleagues to identify analyze &amp; help combat efforts by the Chinese government to exploit the COVID-19 pandemic. 2/  Learn more about our legislation here: https://t.co/xBcc69DMw2,2020-07-08 12:49:46,Twitter Web App,1,12
We’re seeing evidence that China is using the coronavirus crisis to spread misinformation and commit cyber-theft. Our country needs to understand the threat and be prepared for what comes next. 1/ https://t.co/N7LQWV0Et6,2020-07-08 12:49:46,Twitter Web App,4,16
I’ve been holding tele-town halls since COVID-19 began to hear from Mainers about the challenges they're facing and come together to talk about solutions.  If you haven't been able to join yet we're holding another one tomorrow. Register here to join in: https://t.co/L8HC29EEuR,2020-07-07 22:47:23,Twitter for iPhone,8,15
Wishing all Mainers a Happy Independence Day. Be safe and enjoy the day. God bless America! https://t.co/1w1lH4IGCB,2020-07-04 15:35:46,Twitter Web App,2,36
