Please remember the 10000 families in Massachusetts missing someone at the dinner table &amp; the thousands more who are alone &amp; fighting COVID-19. As we celebrate the kindness &amp; generosity of others may today bring a renewed sense of gratitude for all we have to be thankful for.,2020-11-26 18:08:12,Twitter Web App,4,28,covid; 
Because of #COVID19 America's hunger crisis has become a hunger catastrophe. I'm walking 43 miles from Springfield to Greenfield today &amp; tomorrow w/ @MonteBelmonte to raise awareness about the millions of Americans who are food insecure. #MontesMarch https://t.co/fMY8OGlysY,2020-11-23 16:30:36,Twitter Web App,10,45,covid; 
This morning on @CommonTalkPod I spoke about the 31st anniversary of the Jesuit priest murders the urgent need for #COVID19 relief legislation and how President-elect Biden will work to crush the virus and unite our country. https://t.co/CabaY873Bh,2020-11-20 00:22:31,Twitter Web App,3,12,covid; 
#COVID19 jeopardizes decades of progress in global child health &amp; survival. This #ChildHealthWeek let’s work to chart a new &amp; better path forward for all children. Thank you @unfoundation @MarchofDimes @UNICEFUSA &amp; so many more for working to ensure gains made are not lost!,2020-11-13 19:27:59,Twitter Web App,5,22,covid; 
Información importante para Worcester #COVID19 ⬇️ https://t.co/8B3E7Lyqpq,2020-11-12 21:35:38,Twitter Web App,5,3,covid; 
‼️ IMPORTANT DEADLINE COMING UP ‼️  Please RT to help spread the word: If you or someone you know has not yet received a COVID-19 Economic Impact Payment you MUST register by Nov. 21 2020 to receive a $1200 relief check. More info below. https://t.co/S5pDFbiDvI,2020-11-10 21:20:25,Twitter Web App,24,18,covid; 
Important information about COVID-19 resources in Worcester #StopTheSpread ⬇️ https://t.co/9OEquhoWZP,2020-11-05 14:37:56,Twitter Web App,7,18,covid; 
Every Thursday AM @ 7:30 I call @MonteBelmonte to answer your questions and talk about what's happening in America on 93.9 WRSI The River. With votes being counted and #COVID19 infections hitting record highs lots to talk about from Washington to the 413. https://t.co/vzHhlBRlRV,2020-11-05 12:29:17,Twitter Web App,3,8,covid; 
On Thursday @DonaldJTrumpJr said deaths are "down to almost nothing."  2236+ Americans have died of COVID-19 since then. COVID-19 is currently the third leading cause of death in the United States.  No integrity. No decency. Just lie after lie after lie. https://t.co/wWr6beUtME,2020-11-02 16:29:11,Twitter Web App,32,108,covid; 
#Covid19 has made it clearer than ever that everyone needs reliable high-speed broadband. Today the Trump @FCC doubled down on its decision to gut #NetNeutrality and jeopardize public safety and universal broadband access. We won’t stop fighting until #NetNeutrality is restored. https://t.co/aAuOvZOtJd,2020-10-27 16:40:05,Twitter Web App,7,18,covid; 
3/ There's no good reason why any family child senior or individual should wonder where their next meal will come from. Yet the harsh reality is that close to a billion people around the world are impacted by hunger &amp; COVID-19 has made things even worse. https://t.co/rGl5nBGOao,2020-10-16 20:07:47,Twitter Web App,1,9,covid; 
Maybe if you spent less time attacking your own advisors and more time attacking COVID-19 we wouldn't be in this mess in the first place. https://t.co/mVKg6xqtKU,2020-10-13 14:53:23,Twitter Web App,18,88,covid; 
A COVID-19 diagnosis is an awful thing that far too many Americans have had to confront—including 200000 who have tragically died. I wish the first family a quick recovery. I’m praying for our country. Please please please wear a mask keep your distance &amp; stay safe America.,2020-10-02 12:46:53,Twitter Web App,23,147,covid; 
It’s been 130+ days since the House passed the Heroes Act. Mitch McConnell moves like lightning on a SCOTUS nominee but won’t lift a finger to save lives &amp; livelihoods with a COVID-19 stimulus package. Tells you everything you need to know about him. All he cares about is power.,2020-09-20 21:37:02,Twitter Web App,163,401,covid; 
200000 Americans have died due to COVID-19.  Trump gutted the pandemic response team downplayed the danger lied about it tried to slow down testing ignored medical experts &amp; holds super-spreader rallies to boost his ego.  His reckless incompetence has cost countless lives. https://t.co/Xg0jbjhL2Q,2020-09-19 21:28:20,Twitter for iPhone,31,61,covid; 
Congress must lead by example &amp; condemn hateful rhetoric against Asian-Americans. Here are my thoughts from earlier today in support of H. Res. 908 — Condemning all forms of anti-Asian sentiment as related to COVID-19. https://t.co/q8vQeG8Fl5,2020-09-15 18:24:39,Twitter Media Studio,21,60,covid; 
One thing on their mind is how to find safe indoor locations this winter to sell food during COVID-19.  I’m hopeful we can facilitate some relationships to make sure they &amp; other farmers can continue to move their products to market. https://t.co/wiWZCf1VD9,2020-08-27 18:12:30,Twitter for iPhone,1,11,covid; 
Like so many others our farmers are adapting to the economic changes brought about by COVID-19.  On stop 3 today we caught up w/ Julia Coffey of Mycoterra Farm (a 2018 Farm Tour stop) who lept into action &amp; created MassFoodDelivery to get farm-fresh foods to Massachusetts homes. https://t.co/aDlQGxFgaG,2020-08-27 00:50:53,Twitter for iPhone,4,18,covid; 
First stop: Riverland Farm in Sunderland where they’re growing 40 acres of certified organic vegetables (leeks carrots onions &amp; more.) Owner Emily Landeck showed us around &amp; we discussed how COVID-19 is impacting their operations/ what we can do to be wind at their back. https://t.co/W7f9OcsvIx,2020-08-26 14:42:59,Twitter for iPhone,4,19,covid; 
As the Republicans’ deadly 100 days of inaction continues the coronavirus is spiraling out of control. https://t.co/eK7iFVLFjH,2020-08-23 17:41:56,Twitter for iPhone,15,38,corona; 
This morning I spoke on the House Floor about the devastating impact that COVID-19 is having on global hunger and food security especially among children. We can and must do more! https://t.co/aEqcH9hhkc,2020-08-22 15:11:08,Twitter for iPhone,36,161,covid; 
IMPORTANT INFO: Today from 10AM to 7PM the City of Worcester &amp; UMass Memorial are providing free masks hand sanitizer and COVID-19 testing at Main South CDC (875 Main Street). More info here ➡️➡️ https://t.co/XgTf5PxsDf,2020-08-03 14:56:21,Twitter Web App,12,32,covid; 
The Senate GOP‘s new COVID-19 relief proposal includes:  ✅ Tax deductions for wealthy CEOs to write off fancy lunches.  ✅ Billions of dollars for defense contractors.  ❌ Nothing for hungry families struggling to buy groceries.  They have made their priorities abundantly clear.,2020-07-28 18:42:11,Twitter for iPhone,54,104,covid; 
Despite having the highest number of COVID-19 cases in the country the Northeast received the second-lowest allocation of any geographic region—only $46 million (4.4%) of the total $1.2 billion made in the first round of @USDA distributions.  @RepPressley &amp; I want answers. https://t.co/RsTNSNA60C,2020-07-22 01:33:18,Twitter Web App,17,45,covid; 
In today's @DailyHampGaz ➡️  COVID-19 has raised America's consciousness about our decades-long hunger crisis. As @SenMarkey &amp; I fight to make ending hunger a permanent priority inside of Congress we need your help making it a priority outside of Congress.https://t.co/8RhI4Gnfp8,2020-07-21 14:52:29,Twitter Web App,18,44,covid; 
Food is a basic human right.  Yet during COVID-19 food banks have been inundated &amp; America’s hunger crisis has deepened. It’s been 2 months since the House passed the Heroes Act to reinforce our anti-hunger safety net yet I hear crickets from Senate Republicans. We need action! https://t.co/f1z0eneMHb,2020-07-19 01:27:12,Twitter for iPhone,33,76,covid; 
I sat down with @RepDavidTrone to talk about why I took the #SNAP challenge of spending only $1.40/ meal for a week &amp; what we can do about hunger in America during #COVID19. https://t.co/CVv9TTbecA,2020-07-10 18:51:54,Twitter Web App,9,23,covid; 
During this COVID crisis firefighters are not only responding to fires but also emergency medical calls. We need to make sure that our first responders are protected with the proper equipment.,2020-07-07 21:46:07,Twitter for iPhone,1,19,covid; 
2/2 ...how coronavirus relief legislation passed by Congress has impacted them and what more needs to be done to make our communities whole again. Learning lots of good info today to take back to my colleagues in Congress.,2020-07-07 17:34:03,Twitter for iPhone,2,14,corona; 
We're 6 months into #COVIDー19.  130000+ Americans are dead.   2900000 have gotten sick.  But instead of healing our country or working across the aisle to pass the #HeroesAct this administration is focused on pitting Americans against each other. https://t.co/wmbaqNpaK1,2020-07-06 17:09:52,Twitter Web App,15,23,covid; 
53K COVID19 cases today up from 39K last Wednesday. But Trump says it’s “going to disappear” even though he has no plan.  I’ve never seen such incompetent leadership in my life. Those near him get tested daily. He only cares about himself. Ignore him &amp; listen to medical experts. https://t.co/Ya5VlT0sr2,2020-07-02 03:35:17,Twitter for iPhone,37,110,covid; 
Every American should see this. Donald Trump's complete &amp; utter mismanagement of the coronavirus is a disaster.  120000 Americans are dead &amp; ignoring the problem won’t make it go away. We STILL don’t have a national testing &amp; tracing plan to reopen safely. Stunning incompetence. https://t.co/OhgyRAIKkM,2020-06-20 18:10:23,Twitter for iPhone,18,49,corona; 
There’s still time to get tested for #COVID19 at pop up sites across Massachusetts tomorrow.  Full list of locations &amp; more information here: https://t.co/6PaTogP0tC https://t.co/hSjVadp8Jj,2020-06-18 03:13:18,Twitter for iPhone,6,13,covid; 
The MA delegation is supporting @MASchoolsK12 nutrition workers &amp; community organizations by asking @USDA to grant a waiver allowing school districts to keep delivering meals to students during #COVID19.   We’re working to protect vulnerable kids during this difficult time. https://t.co/Sm2GUdRsYR,2020-06-10 16:05:20,Twitter Web App,6,24,covid; 
NEWS: I'm introducing the Protecting Human Rights During Pandemic Act to prevent human rights abuses from being carried out in the name of #COVID &amp; to ensure that America continues standing up for #HumanRights during this challenging time. Read more: https://t.co/wJzPnJWkGt,2020-06-04 23:20:35,Twitter Web App,28,87,covid; 
On Friday I joined @MassAGO Maura Healey for a conversation about George Floyd employee rights during COVID-19 and more. https://t.co/yifTVu5s6k,2020-05-31 18:55:41,Twitter Web App,3,8,covid; 
Tomorrow at 4:00PM I'm hosting a tele-town hall update and Q&amp;A on the coronavirus for #MA02. I hope you can join us!  Sign up to receive a call ➡️ https://t.co/ziTYjxbHaS https://t.co/HZtx7jncqR,2020-05-31 00:17:19,Twitter Web App,5,14,corona; 
There’s an important new resource for families w/ children during #COVID19. Created by Congress in the Families First Coronavirus Response Act it could provide additional money for your family to buy food while schools are closed. Find out more below: https://t.co/cBUfil4KNJ,2020-05-30 16:25:37,Twitter for iPhone,4,9,covid; corona; 
Sadly the Coronavirus is accelerating the loss of too many of our oldest veterans especially WWII veterans robbing families and our nation of the last few years of the memories and wisdom of this most special and heroic generation.,2020-05-25 11:35:29,Twitter for iPhone,6,28,corona; 
In a few moments I'll be joining Hank Stolz @CommonTalkPod on WCRN live from #Worcester (at my house) for an update on the #COVID19 response both in Washington &amp; here at home in Massachusetts.  Listen on the radio: 830 AM Listen online ⬇️ https://t.co/i6Q8Iy4ftx,2020-05-21 12:07:00,TweetDeck,8,15,covid; 
Thanks to everyone who joined me for today's important call focused on the economic impact of #COVID19 on the Commonwealth’s cultural sector &amp; creative community. https://t.co/SJjWokaQrD,2020-05-20 22:37:51,Twitter Web App,2,18,covid; 
TODAY at 4:00pm I'm hosting a live conversation about how #COVID19 is impacting cities &amp; towns featuring local leaders:  ➡️ Greenfield Mayor Roxann Wedegartner ➡️ Northampton Mayor David Narkewicz ➡️ Auburn Town Manager Julie Jacobson  Watch here: https://t.co/NkkFayTAGK https://t.co/Mq7qO3azPY,2020-05-19 17:30:16,Twitter Web App,8,17,covid; 
#COVID19 is not a Republican problem or a Democratic problem. @senatemajldr work with us! Painting our efforts to respond as partisan &amp; polarizing this debate does a disservice to the American people's health safety &amp; economic well-being. https://t.co/XdhnuElSdi,2020-05-15 03:09:15,Twitter Web App,13,44,covid; 
1/ It has been roughly three months since the first community transmission of COVID-19 was discovered in the United States. Since that time our world has changed dramatically: there are now more than 1.3 million confirmed cases across the country. https://t.co/Znb2CNH9bl,2020-05-14 16:03:54,Twitter Web App,1,3,covid; 
Right now the Rules Committee is discussing my bill H.Res 965 which would temporarily allow for virtual committee work and remote voting on the House Floor during the COVID-19 pandemic. Watch live: https://t.co/kyA8ANhSxp,2020-05-14 15:11:55,Twitter Web App,2,15,covid; 
Years of environmental injustice have been made visible by the awful and unequal toll the coronavirus is taking on communities of color. https://t.co/M9lmELND7E,2020-05-14 15:04:56,Twitter Web App,11,47,corona; 
We are all in this together.  That's the idea that should guide our response to #COVID19 and that's the idea behind @HouseDemocrats Heroes Act.  This is no time to tread water. We need bold solutions matching the size and scope of the problems we face. We need the #HeroesAct. https://t.co/7tUGhnsTrs,2020-05-13 23:39:25,Twitter Media Studio,10,32,covid; 
The coronavirus pandemic is magnifying social and economic injustices and I’m glad that this federal funding will go towards vulnerable members of our community who need help. https://t.co/EeVE813e5e,2020-05-12 19:56:12,Twitter Web App,3,31,corona; 
NEWS: Bipartisan co-chairs of the House #Hunger Caucus/ #FoodIsMedicine Working Group @RepMarshall @RepWalorski @chelliepingree &amp; I are asking @USDA @SecretarySonny &amp; @USAID @JBarsaUSAID to support America's global food security &amp; nutrition programs during #COVID19. Read more⬇️ https://t.co/yk5Gnm41Ev,2020-05-11 01:26:52,Twitter Web App,15,44,covid; 
Thank you to #Tibetan Associations across the U.S. that contributed more than $35K to @_MealsOnWheels to help vulnerable Americans during the COVID-19 pandemic.  In these trying times it's gestures of solidarity like this that uplift our spirits &amp; reaffirm our shared humanity.,2020-05-10 00:52:31,Twitter Web App,25,89,covid; 
The coronavirus pandemic is magnifying social and economic injustices in our community and I’m glad that this federal funding will go towards vulnerable members of our community who need help. https://t.co/lN2ao8Yr4z,2020-05-08 19:05:56,Twitter for iPhone,10,37,corona; 
This is ridiculous. We are in the middle of a public health crisis. #COVID has claimed nearly 75000 American lives. And President Trump's answer is to take health care away from people and eliminate protections for people w/ pre-existing conditions. https://t.co/yDZBab4oOR,2020-05-07 17:05:39,Twitter Web App,12,30,covid; 
He could support a resolution my colleague @RepGraceMeng introduced last month (H.Res. 908) condemning all forms of anti-Asian sentiment related to COVID-19. To date there are 144 Democratic co-sponsors and only 1 Republican co-sponsor. https://t.co/iheUXpDfrr,2020-05-07 15:35:46,Twitter Web App,13,40,covid; 
Instead of a GOP partisan task force designed to divert attention from President Trump’s coronavirus response failures @GOPLeader McCarthy could get serious about holding the Chinese government accountable by supporting bipartisan initiatives. https://t.co/cReztlKDHs,2020-05-07 15:35:44,Twitter Web App,64,89,corona; 
#COVID19 has revealed the tireless dedication of America’s teachers.   This #TeacherAppreciationWeek we thank our teachers who are going above and beyond to serve their students. #ThankATeacher https://t.co/jb4iLerb3a,2020-05-06 00:57:07,Twitter for iPhone,18,58,covid; 
Our local state &amp; federal team is working together to support our workers &amp; families and keep our communities safe &amp; healthy.   I joined @GreenfieldMA Mayor Wedegartner Sen. @Jo_Comerford &amp; @RepPaulMark at today’s press conference to discuss our ongoing #COVID19 response. https://t.co/di7uBNt5q4,2020-05-06 00:53:48,Twitter for iPhone,6,18,covid; 
Today @SenatorLeahy &amp; I are pressing @SecPompeo &amp; @stevenmnuchin1 to immediately confirm that U.S. policy does not preclude shipments of medical equipment food or other humanitarian items to #Cuba to combat #COVID19.   Read our full letter: https://t.co/02Rya6RuWk,2020-05-05 23:07:27,Twitter Web App,31,79,covid; 
#HumanRights don't go away during a pandemic. Foreign governments should release arbitrarily detained Americans &amp; all prisoners of conscience on humanitarian grounds immediately.  My statement w/ @ChrisCoons @SenThomTillis &amp; @RepChrisSmith. #COVID19 https://t.co/v8jfZdwV4O,2020-05-01 23:11:00,TweetDeck,12,26,covid; 
Please don’t avoid seeking medical care for a non-coronavirus related medical emergency. Health care providers are working hard to ensure that everyone can stay safe during this pandemic. https://t.co/BXX1rpdClt,2020-05-01 03:24:34,Twitter for iPhone,19,55,corona; 
#COVID19 exposed just how unprepared Congress is to continue its business during an unforeseen crisis.   Inaction isn't an option — it's time for us to embrace tech so we can safely keep legislating in an emergency.  My new op-ed in the @washingtonpost:  https://t.co/5xzsY9ehFX,2020-04-29 22:14:00,TweetDeck,16,47,covid; 
#HumanRights don't go away during a pandemic. Foreign governments should release arbitrarily detained Americans &amp; all prisoners of conscience on humanitarian grounds immediately.   My statement w/ @ChrisCoons @SenThomTillis &amp; @RepChrisSmith. #COVID19 https://t.co/v8jfZdfkdg,2020-04-28 20:47:00,TweetDeck,3,16,covid; 
#COVID19 exposed just how unprepared Congress is to continue its business during an unforeseen crisis. Inaction isn't an option — it's time for us to embrace tech so we can safely keep legislating in an emergency.  📰 My op-ed in today's @washingtonpost ⬇️ https://t.co/9YkyGsow9f,2020-04-28 18:38:56,Twitter Web App,8,25,covid; 
#2020Census pro tip: If your college students are home because of COVID-19 they should still be counted “where they usually live and sleep most of the time.” For most students that means in their college town. Get the facts then help them respond: https://t.co/6gpauSazIs,2020-04-28 12:00:00,TweetDeck,11,17,covid; 
2/ Last week the House passed my bill H.Res. 935 creating a new investigatory panel to make sure hard-earned taxpayer dollars are spent on the small businesses and workers who need help because of the #coronavirus.   We need accountability transparency and fairness. https://t.co/vpuUqCVxcI,2020-04-27 20:51:47,Twitter for iPhone,4,19,corona; 
Foreign governments should release arbitrarily detained Americans &amp; all prisoners of conscience on humanitarian grounds immediately. My statement alongside ➡️@ChrisCoons @SenThomTillis &amp; @RepChrisSmith. #HumanRights #COVID19  https://t.co/v8jfZdfkdg,2020-04-27 18:57:33,Twitter Web App,6,6,covid; 
We're experiencing a crisis of food insecurity not seen in America in decades. Hungry families can't wait.   I'm leading 139 Members of Congress calling for anti-hunger programs like SNAP to be prioritized in the next #COVID19 relief bill ➡️ https://t.co/3sZJ4rvoO9,2020-04-26 15:28:03,Twitter Web App,38,98,covid; 
#MitchAntoinette would rather deny aid to firefighters police &amp; EMS than deliver the relief they need to keep fighting the coronavirus. This is a disgusting remark to make when American lives are on the line. https://t.co/puBU5RKG6O,2020-04-23 23:45:26,Twitter for iPhone,21,41,corona; 
My heart is heavy for @SenWarren following the loss of her brother. The coronavirus has brought so much sadness and heartbreak to our country.  Elizabeth — Lisa &amp; I will keep you &amp; your entire family in our prayers during this difficult time.,2020-04-23 19:04:04,Twitter Web App,11,120,corona; 
At least 40 children in Office of Refugee Resettlement custody have come down with #COVID19. How are children who are detained supposed to socially distance?  We're calling on @HHSGov &amp; @DHSgov to release them ASAP. Anything less would be heartless &amp; cruel. https://t.co/djPCw2bp1N,2020-04-23 16:00:25,Twitter Web App,18,35,covid; 
Tonight the Rules Committee met to establish a select subcommittee on the coronavirus crisis.  Congress must ensure that the taxpayer dollars we've allocated to respond to this crisis are well spent: that means saving lives rooting out fraud &amp; fighting for ALL small businesses. https://t.co/Af9zLUirjj,2020-04-23 03:12:25,Twitter Web App,20,93,corona; 
Trump &amp; Senate GOP: It's up to the states to organize a #COVID19 response.  Also Trump &amp; Senate GOP: We won't provide funding for state &amp; local #COVID19 response.  Confused? That's because it makes no sense at all.,2020-04-22 19:01:14,Twitter Web App,12,38,covid; 
Thank you President Tsai @iingwen for your generous donation of medical masks to the @MassEMA warehouse.   #Taiwan’s early and proactive efforts serve as an example to the world of how to effectively prevent the spread of #COVID19. We appreciate your help. https://t.co/mgIdy90pWr,2020-04-21 01:27:39,Twitter Web App,342,1175,covid; 
And thank you @joshuawongcf @SunnyCheungky @demosisto @networkdiplohk for your generous donation to @umassmemorial caregivers to fight #COVID19. We are grateful for your support and friendship. I am very proud of our work together to support human rights &amp; democracy in #HongKong! https://t.co/0zqvWF9j2T,2020-04-21 01:23:18,Twitter Web App,3177,4612,covid; 
The #coronavirus crisis is causing levels of hunger in America not seen in decades &amp; decades.  Thank you @chefjoseandres for explaining what we're fighting for. America has MORE THAN ENOUGH food — what we lack is the political will to ensure nobody in this country goes hungry. https://t.co/0qOQjaajMi,2020-04-20 18:51:00,Twitter Web App,67,138,corona; 
TONIGHT: Join me for a telephone town hall to answer your questions and discuss our #coronavirus response here in Massachusetts &amp; across the nation. https://t.co/yu6vWHpTrK,2020-04-16 22:16:16,Twitter Web App,7,18,corona; 
TOMORROW: I'm hosting another telephone town hall to answer your questions and discuss our coronavirus response in Massachusetts and at the federal level.  Keeping you and your family healthy safe and informed during this crisis is my #1 priority and I hope you can join. https://t.co/m93AcFRxjs,2020-04-16 01:41:05,Twitter Web App,14,44,corona; 
Governments must both guarantee prisoners’ right to health and protect their societies from those who have committed grave crimes. #Honduras must not use the #coronavirus as an excuse to free the men who murdered Berta Cáceres. #JusticeForBerta https://t.co/14X3H0qQq3,2020-04-16 00:12:34,Twitter Web App,27,47,corona; 
Coronavirus cases &amp; deaths aren't just numbers on a screen.   They're beloved members of our community with families &amp; friends whose lives have been changed forever by this pandemic. My thoughts are with everyone in #MA02 &amp; across America who has lost a loved one. https://t.co/AKpZC6tzqm,2020-04-15 16:21:19,Twitter Web App,10,36,corona; 
This year #BlackMaternalHealthWeek comes in the midst of a pandemic.  The racial disparities in COVID-19 outcomes reflect ongoing disparities in maternal mortality rates in the U.S. As a Member of the @BMHCaucus I am working hard to address this crisis. #BMHW20 https://t.co/rGALNlDELG,2020-04-14 19:02:07,Twitter Web App,11,31,covid; 
Wow. @Deans_Beans in #Orange is donating 1000 pounds of fresh organic coffee to those impacted by #COVID19 &amp; thousands of tin ties for face masks. Our community is coming together to take care of &amp; look out for each other. We are stronger together. Thank you Dean's Beans! https://t.co/6E0ExzBNux,2020-04-14 16:05:00,Twitter Web App,11,48,covid; 
When I say the lack of leadership at the White House is a disaster this is what I mean:  "On the evening of April 10 the @DeptofDefense received approval from the White House Task Force to execute the first DPA Title 3 project responding to COVID-19." https://t.co/dR6yAxg1Eb,2020-04-13 22:46:48,Twitter Web App,13,44,covid; 
Everyone needs to watch. Even before #COVID19 #hunger was a dire problem in America — now the level of hunger &amp; food insecurity we are seeing is nothing short of a humanitarian catastrophe.  Congress MUST prioritize food in our next coronavirus relief package. https://t.co/DA8TiQjy7K,2020-04-11 22:13:10,Twitter for iPhone,298,723,covid; corona; 
It's not surprising that America's racial disparities are reflected in our broken healthcare system. But it is outrageous and wrong.  Communities of color are being disproportionately impacted by #COVID19.  We need data. We need action. We need justice. https://t.co/KCp3wam70B,2020-04-08 01:52:43,Twitter Web App,14,59,covid; 
