2/ I also sent this letter to @USTreasury Secretary @stevenmnuchin1 last week encouraging him to make sure smaller communities are not left behind or left out as we support local #coronavirus response efforts. https://t.co/R1JNbwoJda,2020-04-08 01:05:00,Twitter Web App,2,13,corona; 
🚜 #Farmers work day and night to keep food on our table — we need to be there for them during the #coronavirus crisis and do everything possible to support local farms &amp; local food.  Proud to join this letter asking @SBAgov to allow farmers to access federal disaster loans. https://t.co/5FaUEKdBvI,2020-04-07 20:48:32,Twitter Web App,10,29,corona; 
This morning I joined @ClarkUniversity students for a class called the politics of food and drink. We talked about food insecurity and how #coronavirus could make #hunger much worse if our government doesn't take action. Thanks for letting me join and for the great questions! https://t.co/BvVXzk6hcs,2020-04-04 00:39:34,Twitter Web App,9,39,corona; 
ICYMI: @MassDeptAgr has created a great new webpage that focuses on how and where to buy fresh local food including how to find pick up and delivery options during the pandemic. #Massachusetts #mapoli #COVIDー19 https://t.co/GwReLsqjGT,2020-04-03 19:25:00,TweetDeck,8,15,covid; 
Important info from the Massachusetts @HealthConnector: make sure you update your account if you experience a change in income due to #COVIDー19! https://t.co/2W0NTpuc65,2020-04-02 17:49:24,Twitter Web App,9,13,covid; 
Looking for more detailed information about the bipartisan legislation that has been signed into law to address the coronavirus crisis? We pulled together a resources page to keep everything in one place ⤵️ https://t.co/qbl13sdoLa,2020-04-01 20:17:54,Twitter Web App,7,23,corona; 
#MA02 #SmallBiz: if you've been impacted by #COVID19 here's a flow chart of how you can navigate the emergency relief process now that the #CARESAct has passed.  Please RT to spread the word &amp; help #SmallBusiness in #Massachusetts! https://t.co/n3EE2rVkSC,2020-03-31 19:22:08,Twitter Web App,16,24,covid; 
10/ Getting feedback from people on the front lines during a crisis is critical — so I hosted another emergency conference call with local public health authorities to gather input about our COVID-19 response at the local state and federal levels. https://t.co/ULtQD589IF,2020-03-30 23:25:25,Twitter Web App,1,12,covid; 
9/ We also built a dedicated COVID-19 resources page on my website where #MA02 residents can find local accurate up-to-date information during this time of uncertainty. https://t.co/J1N4TujYHx,2020-03-30 23:25:24,Twitter Web App,1,11,covid; 
8/ By the way EVERYONE needs to do their part to #StopTheSpread of COVID-19. For example my staff and I are teleworking and we canceled my public events. https://t.co/WeCQgq4SKD,2020-03-30 23:25:24,Twitter Web App,1,13,covid; 
6/ As Chair of @RulesDemocrats I helped bring to the House Floor the bipartisan #FamiliesFirst Coronavirus Response Act the second phase of our response. It secures paid emergency leave enhanced unemployment insurance &amp; more. https://t.co/rvs3PlcGFP,2020-03-30 23:25:23,Twitter Web App,2,15,corona; 
3/ Massachusetts needs a robust coordinated federal response to this crisis. So the day after my conference call our Congressional Delegation asked the @WhiteHouse Coronavirus Task Force to take urgent &amp; specific steps to help our state respond. ⤵️ https://t.co/LtR0Sp29zr,2020-03-30 23:25:22,Twitter Web App,3,18,corona; 
2/ Before we had any confirmed cases of #COVID19 in #MA02 I organized an emergency conference call with health care providers to discuss whether or not they had the information tools and resources needed to keep our community safe. https://t.co/nE2XbpREiK,2020-03-30 23:25:22,Twitter Web App,3,15,covid; 
THREAD: I want to be as open &amp; accountable as possible to the people of Massachusetts' Second District about what actions my team and I have taken to address the #COVID19 crisis.  Here's a list of some of what we've been up to. (1/?),2020-03-30 23:25:21,Twitter Web App,25,89,covid; 
Hospitals are using refrigerated trucks to hold the bodies of #COVID victims in New York. Doctors and nurses are using trash bags to protect themselves and splitting ventilators to save people.  And Trump is tweeting about how popular he is on TV. https://t.co/UCuVpwOiFm,2020-03-30 15:57:06,Twitter for iPhone,31,72,covid; 
I just voted in support of a bipartisan Coronavirus relief package to help get Americans the relief they need during this emergency.  I know this bill is not perfect. But we're far from done &amp; I promise I’ll keep fighting #ForThePeople as we continue to address this crisis. https://t.co/JgzAuKa5G0,2020-03-27 18:06:09,Twitter for iPhone,30,253,corona; 
This pandemic knows no borders and is not constrained by history or politics. I agree with those calling on the United States to suspend #Cuba sanctions to facilitate humanitarian aid amid #COVID19 ⬇️ https://t.co/dZcTF1YyQH,2020-03-26 23:17:54,Twitter Web App,65,120,covid; 
ICYMI: last week my team and I put together a comprehensive #coronavirus resource center on my website that we've been updating daily as information becomes available. Take a look ⤵️ https://t.co/J1N4TujYHx,2020-03-26 19:26:27,Twitter Web App,6,17,corona; 
Be careful of #COVID19 scams during this crisis.  ❌ Price gouging? ➡️ Call @MassAGO’s Consumer Protection Hotline at 617-727-8400.  ❌ Only trust your doctor for info on treatments.  ❌ Be on the lookout for unauthorized or fraudulent charities &amp; solicitations.,2020-03-24 20:15:10,Twitter for iPhone,13,20,covid; 
IMPORTANT UPDATE➡️Text "COVIDMA" to 888-777 to get COVID-19 text message alerts sent to your phone so you can stay informed and up-to-date on the latest #COVID19 Massachusetts info. https://t.co/r5mr4nHhed,2020-03-24 17:58:36,Twitter Web App,15,29,covid; 
10 years later the Affordable Care Act is protecting 130 million Americans with pre-existing conditions to ensure they access to the health care they need as we fight the coronavirus. #ProtectOurCare https://t.co/55aBawPGB6,2020-03-23 20:46:54,Twitter Web App,7,33,corona; 
Thank you to everyone who joined me for last night’s town on the coronavirus including our guest experts U.S. Small Business Administration Massachusetts Director Bob Nelson &amp; Dr. Eric Dickson from Umass Memorial Health Care. https://t.co/U0sARZabhq,2020-03-23 18:00:01,Twitter Web App,6,40,corona; 
LOOKING FOR HELP? The Massachusetts Department of Unemployment Assistance will be holding virtual town halls the rest of this week to help anyone who has been affected by the coronavirus.  More information on how to sign up here➡️ https://t.co/zC6jF30rX1 https://t.co/UOyudhvZNR,2020-03-23 16:42:17,Twitter Web App,20,25,corona; 
We want to make sure ALL health care facilities — including in rural and disadvantaged areas — can get funds for important telehealth services during #COVID19. https://t.co/JYfQUzNCYl,2020-03-22 23:36:36,Twitter for iPhone,13,44,covid; 
HAPPENING SOON: I'm holding a telephone town hall at 5:30PM to answer your questions and discuss the #coronavirus with healthcare and small business experts from #Massachusetts. https://t.co/Kdfg0BRmZn,2020-03-22 18:32:53,Twitter Web App,11,35,corona; 
I am so grateful for the teachers across America who are stepping up to support their students and make sure they continue learning during this crisis. Our community is thankful for all your work! #COVIDー19 #Coronavirus https://t.co/I3ny5yVgy8,2020-03-22 16:59:16,Twitter Web App,13,43,covid; corona; 
TOMORROW: I'm holding a live telephone town hall at 5:30PM to answer your questions and discuss the #COVIDー19 #coronavirus w/ healthcare and small business experts from #Massachusetts. https://t.co/NMV8wHMjOi,2020-03-22 00:45:17,Twitter Web App,18,46,covid; corona; 
#COVID19 highlights the importance of full participation in the census. The census helps the federal government allocate federal funds during and after an emergency including healthcare services for seniors and other at-risk groups. https://t.co/8VMS1er5w8,2020-03-20 19:11:57,Twitter for iPhone,8,15,covid; 
A CDC analysis of U.S. #COVID19 cases from Feb. 12 to March 16 shows that 38% of those sick enough to be hospitalized were YOUNGER than 55.  Bottom line: everybody no matter their age needs to immediately take steps to protect themselves! https://t.co/FpV7htRPIn,2020-03-20 04:18:07,Twitter Web App,27,54,covid; 
My team and I want to make sure we get you the most accurate and helpful #COVID19 information and facts. We've created this new #Massachusetts resource page on my website that will be updated and improved daily. https://t.co/J1N4TujYHx,2020-03-19 20:37:12,Twitter Web App,17,52,covid; 
Thankfully @HouseDemocrats included in our #FamiliesFirst Coronavirus Response Act quick relief from harsh work requirements during this pandemic.  We will not stop fighting for America's workers families and communities. #ForThePeople,2020-03-19 19:35:24,Twitter Web App,7,38,corona; 
Important alert: the @USTreasury &amp; @IRSnews are providing emergency relief to individuals &amp; businesses in response to #COVID19.   The tax filing deadline remains April 15 but income tax payment deadlines for many individuals &amp; businesses are now extended to July 15 2020➡️ https://t.co/D8ziMHO8hh,2020-03-19 17:40:05,Twitter Web App,5,13,covid; 
This is good news. Thank you @SpeakerPelosi for your leadership on this. As a reminder our #COVID19 response package provides for:  ✅ Free testing. ✅ Paid emergency leave. ✅ Increased federal funds for Medicaid. ✅ Enhanced food security &amp; unemployment insurance. https://t.co/VqdHXAFCTC,2020-03-18 20:32:16,Twitter Web App,24,65,covid; 
Important #COVID19 updates for veterans: https://t.co/vwanm9TkTn,2020-03-18 19:47:06,Twitter Web App,8,12,covid; 
NEWS: I’m joining @RepDavidTrone to share our concern regarding the impact of #COVID19 on the #Census and to ask for the @uscensusbureau’s plan to ensure an accurate count during this unprecedented health emergency. https://t.co/nOnTudDEQM https://t.co/eSvGqOfm4C,2020-03-18 19:10:10,Twitter for iPhone,7,22,covid; 
Constant news of #COVID19 outbreak can be extremely stressful for individuals families and kids. Here are some important steps for managing anxiety and stress from @CDCgov ➡️ https://t.co/76NLIKb7lU,2020-03-18 01:39:46,Twitter Web App,6,23,covid; 
NEWS: I'm joining @RepSpeier to ask for updates from the  @WhiteHouse about how they plan to use DOD resources such as mobile hospital units or the Army Corps of Engineers so Congress can provide a proper response and funding for these efforts. #COVID19 https://t.co/MLgahBNZar,2020-03-17 21:06:50,Twitter Web App,8,24,covid; 
$500M for low-income pregnant women &amp; moms w/ young kids. $400M for food banks. $250M for home-delivered meals to low-income seniors.  Thanks to the leadership of @SpeakerPelosi Congress is moving swiftly &amp; decisively to respond to #COVID19 by putting #FamiliesFirst. https://t.co/6WVXfZBllO,2020-03-17 18:13:16,Twitter Web App,16,49,covid; 
Nobody should be kicked out onto the street during a crisis like this. We need an immediate nationwide moratorium on evictions and foreclosures. #COVID19 #Coronavirus #mapoli  https://t.co/o7xt4o4pt8,2020-03-17 17:40:52,Twitter Web App,12,34,covid; corona; 
I’m doing my best to keep you updated &amp; informed in real time about our #COVIDー19 response but remember to turn off the news go for a walk if you can and take care of yourself too.  This is not an easy time but if we come together as a community we will get through this.,2020-03-17 01:33:18,Twitter for iPhone,4,37,covid; 
Thank you to everyone who watched today’s Facebook and Instagram live &amp; joined for my conference call with local public health authorities. #massachusetts #mapoli #coronavirus https://t.co/S2LI50fpRH,2020-03-17 01:33:18,Twitter for iPhone,8,50,corona; 
Trying to amplify Massachusetts-specific resources &amp; info as much as possible for anyone affected by #COVIDー19. I want to make sure I’m not missing anything that should be shared so I’m opening up DMs before I sign off. Please send anything you think is important. #mapoli,2020-03-16 03:31:35,Twitter for iPhone,11,52,covid; 
I just received an update from the unified command staff at the @TweetWorcester Emergency Operations Center. #COVIDー19 https://t.co/nMlM90kGp6,2020-03-15 15:48:50,Twitter for iPhone,5,21,covid; 
🚨 #SmallBiz &amp; nonprofits: if you have been impacted by #COVID19 @SBAgov is offering loans through funding provided by the Coronavirus Preparedness and Response Supplemental Appropriations Act that was recently passed by Congress.,2020-03-15 00:41:59,Twitter Web App,43,88,covid; corona; 
Quick update on how we are responding to #COVID19 — including the important #FamiliesFirst Coronavirus Response Plan that the House of Representatives passed early this morning. https://t.co/ysSKp683B9,2020-03-14 19:46:23,Twitter Media Studio,17,49,covid; corona; 
It’s ridiculous that Republicans waited all day for Trump to tweet out permission for them to vote yes on urgent #coronavirus legislation.  You vote yes if you think it’s the right thing to do! The American people didn’t elect us to sit around and wait for tweets. https://t.co/tbe5vQ574N,2020-03-14 03:40:33,Twitter for iPhone,31,119,corona; 
From day one our priority has been to put #FamiliesFirst and that is exactly what our coronavirus response bill does #ForThePeople. https://t.co/uSzmBfMpbh,2020-03-14 03:06:25,Twitter for iPhone,14,59,corona; 
NEWS: Today I helped lead the Massachusetts Congressional Delegation in demanding that the @USDA &amp; @SecretarySonny immediately halt SNAP eligibility changes to protect vulnerable families in light of #COVID19. https://t.co/iHLVz6DqrT,2020-03-13 19:59:55,Twitter Web App,221,980,covid; 
Thank you @CharterNewsroom for offering free access to spectrum broadband and Wi-Fi for K-12 &amp; college students who don't already have a broadband subscription. This is essential to making sure students can continue to learn as we work collaborative to contain #COVID19. https://t.co/HyauqV9il0,2020-03-13 19:01:46,Twitter Web App,11,40,covid; 
Americans are demanding solutions. Congress needs to deliver by passing the #FamiliesFirst Coronavirus Response Act. https://t.co/RXIRBQqNPp,2020-03-13 02:23:01,Twitter for iPhone,13,52,corona; 
¡Detenga la propagación de gérmenes! #COVID19 #Coronavirus https://t.co/nbdrW8jmQq,2020-03-13 02:20:32,Twitter for iPhone,7,23,covid; corona; 
The Massachusetts Department of Public Health has set up a website with updates guidance prevention tips and recommendations on #COVID19 ➡️ https://t.co/gt4Vd7sPb1 #coronavirus https://t.co/VfJoeSMpDR,2020-03-12 22:53:33,Twitter Web App,14,26,covid; corona; 
If you're not already signed up for my newsletter you can read my latest update on the #coronavirus here: https://t.co/yBQtKOJDfn https://t.co/9wy2PYoXbW,2020-03-12 22:16:28,Twitter Web App,8,23,corona; 
Update: @HouseDemocrats have introduced a #FamiliesFirst #Coronavirus Response. We need swift decisive action. Our bill:  🍲 Expands food assistance 💉 Establishes free testing 👪 Provides paid leave 💵 Supports strong unemployment benefits 👩‍⚕️ Protects front-line health workers https://t.co/Mpm5oulWJm,2020-03-12 18:15:18,Twitter Web App,53,86,corona; 
I’m very concerned that the #coronavirus could put a major strain on families who are already struggling to put food on the table. The majority of SNAP recipients who are able to work do work but they make so little that they still qualify for benefits. https://t.co/nRl21i39fp,2020-03-12 16:31:42,Twitter Web App,23,71,corona; 
Mr. President — #COVID19 is already here. We’re in the midst of a global health crisis we‘re hardly testing people and you barely mentioned testing in your speech. Providers in my district tell me that tests are still not available. This is unacceptable. https://t.co/A2aNtnlayu,2020-03-12 04:11:14,Twitter for iPhone,92,343,covid; 
Right now the Rules Committee is meeting to consider H.R. 6201 — the #FamiliesFirst Coronavirus Response Act.   The House will move to pass this bill tomorrow and send it to the United States Senate. https://t.co/jFjeGOh9zI,2020-03-12 04:05:37,Twitter for iPhone,55,91,corona; 
The health and safety of our communities is my #1 concern.  I will stay in close contact with @MassGovernor Charlie Baker and the @MassDPH as well as health care providers and experts throughout Massachusetts to support our Commonwealth’s #COVID19 response in any way I can.,2020-03-12 00:27:44,Twitter for iPhone,2,13,covid; 
NEWS: Today our state's congressional delegation is asking Vice President Mike Pence to take urgent &amp; specific actions to help #Massachusetts respond to the ongoing #coronavirus outbreak. Here is the letter we sent: https://t.co/dmed07Nzb3,2020-03-12 00:27:41,Twitter for iPhone,14,60,corona; 
Reliable high-speed internet is as essential to our communities as electricity or roads. W/ schools switching to online classes to stop the spread of COVID-19 it’s more important than ever that the @FCC provide the $$ needed to close the digital divide. https://t.co/PjrrJVzrBd,2020-03-11 14:18:50,Twitter Web App,11,25,covid; 
As we continue to feel the effects of COVID-19 I will do everything I can to make sure we are listening to our frontline health care providers and responding swiftly and decisively to this crisis.  For the latest updates please remember to follow: ➡️ @CDCgov ➡️ @MassDPH ➡️ @WHO,2020-03-10 22:04:50,Twitter for iPhone,3,20,covid; 
We need to listen to and amplify the concerns of providers scientists and experts about the COVID-19 #Coronavirus response.   We need to make sure they are getting the information tools and resources they need to keep our communities safe. https://t.co/DAHv6nBsOk,2020-03-10 22:04:49,Twitter for iPhone,2,17,covid; corona; 
Help prevent the spread of #COVID19:  🙅‍♂️Avoid close contact with people who are sick. 🖐️Avoid touching your eyes nose &amp; mouth. 🧼Wash your hands with soap and water. 🤧Stay home if you're sick. ☎️If you think you have symptoms CALL AHEAD before visiting your doctor.,2020-03-09 21:55:06,Twitter Web App,7,36,covid; 
Looking for official updates about #coronavirus? Bookmark the link below &amp; follow:  ➡️ @MassDPH ➡️ @CDCgov ➡️ @CDCemergency ➡️ @WHO https://t.co/xgaFa74RFY,2020-03-08 01:22:00,TweetDeck,10,22,corona; 
We all need to do our part to prevent the spread of #COVID19:  🤧Avoid close contact w/ people who are sick.  🖐️Avoid touching your eyes nose &amp; mouth.  🏡Stay home if you're sick.  ☎️If you think you have symptoms CALL AHEAD BEFORE YOU VISIT YOUR DOCTOR!,2020-03-07 13:56:00,TweetDeck,32,79,covid; 
NEWS: @HouseDemocrats just passed a robust bipartisan #COVIDー19 emergency response package which gives federal state and local officials the resources they need to keep America healthy and safe.   I take this situation very seriously and I voted YES on today’s bill. https://t.co/AOdVL4rbtR,2020-03-05 02:05:11,Twitter for iPhone,26,65,covid; 
Here's how to help prevent the spread of #COVID19:  🙅‍♂️Avoid close contact with people who are sick. 🖐️Avoid touching your eyes nose &amp; mouth. 🏡Stay home when you are sick. 🤧Cover your cough or sneeze with a tissue. Throw your tissue your into the trash. https://t.co/xg8mlsTX07,2020-03-03 22:40:03,Twitter Web App,10,38,covid; 
.@RepShalala is right: fact and science should lead the way in our response to the coronavirus. This is no time to play politics.   https://t.co/TfnBxAyyeZ,2020-03-02 21:51:16,Twitter for iPhone,4,39,corona; 
