I am proud of my friend Elizabeth Warren and the inspiring campaign she ran. Her fierce advocacy for the middle class and willingness to fight for core Democratic values have made us a stronger party and will help us win in November.,2020-03-05 23:15:59,Twitter Web App,0,0
Nothing’s worse than being hit by a surprise medical bill after you receive care. I’m working tirelessly to make that practice a thing of the past. https://t.co/b6uSYSiNoT,2020-02-24 15:01:03,Hootsuite Inc.,1,0
Thank you Alan for having me on Congressional Corner and for your support. I always enjoy our conversations about how we move Western Massachusetts forward. https://t.co/jEC9sEnUvh,2020-02-22 22:30:11,Hootsuite Inc.,0,0
I had a great conversation with WAMC’s Alan Chartock. Give it a listen today and let me know what you think. https://t.co/tbCCFuZUsv,2020-02-22 22:00:15,Hootsuite Inc.,1,0
Rural communities in Western Mass should never be left behind. This is a great win for our district. https://t.co/rU9UHGpYMl,2020-02-22 14:00:21,Hootsuite Inc.,1,4
Grateful for the chance to sit down with the @BerkshireEagle and talk about issues that affect everyone across Massachusetts and across the country. Give it a read and let me know what you think in the comments.  https://t.co/UJ93e7OEye,2020-02-13 20:39:19,TweetDeck,1,1
This year offers us a chance to imagine the future Western and Central Massachusetts workforce we’d like to see. Bringing it to fruition will take dedicated effort from all of us and I’m eager to work with you to build it.  https://t.co/vsrmnbOKs6,2020-02-11 23:53:04,TweetDeck,0,0
To learn how you can get involved too click here: https://t.co/niB2rak3fS,2020-02-06 00:19:30,Twitter Web App,0,0
I'm proud of my record in Congress but I'm even prouder to have earned the trust and support of folks like these from across western and central Mass. https://t.co/S03E88HR1v,2020-02-06 00:13:02,Twitter Web App,0,0
It was an honor to greet dozens of supporters last weekend at the opening of my new campaign headquarters. https://t.co/cuxkvBLwi4,2020-02-06 00:12:59,Twitter Web App,0,1
Seven months before election day and Team Neal is already fired up about this election. https://t.co/uKv4Ac27WP,2020-02-06 00:12:56,Twitter Web App,1,1
U.S. Rep. Richard E. Neal on Wednesday touted the possibility that a new $760 billion infrastructure plan by Democrats could bring broadband internet to rural Western Massachusetts and frequent Springfield-to-Boston rail travel.  https://t.co/i0jTmpnTHY,2020-01-29 18:49:56,TweetDeck,2,2
There were many times I thought the USMCA was dead. But I also thought it was too important to give up.  https://t.co/55oj8MFGYb,2020-01-23 22:18:00,TweetDeck,0,2
USMCA sets a new standard for US trade agreements and demonstrates that our trade deals can achieve broad bipartisan support if they empower workers protect patients’ access to affordable health care and improve our shared environment.  https://t.co/6WQ5ABe1yT,2020-01-22 18:20:00,TweetDeck,0,0
The USMCA was the culmination of months of House Democrats’ work to transform the new NAFTA into a deal that respects the dignity of workers contains meaningful enforcement provisions and prioritizes environmental protection and remediation.  https://t.co/6WQ5ABe1yT,2020-01-22 18:19:00,TweetDeck,0,0
I've always been a strong supporter of union organizing. The USMCA is transformative. It's a triumph for organized labor and for workers across America.  https://t.co/hZpSzd9Qb5,2020-01-21 21:59:12,TweetDeck,0,0
