In the richest nation in the world it is profoundly egregious that millions of Americans are going hungry. The federal government has a duty to promote the general welfare &amp; we must pass another COVID-19 stimulus package that provides for those in need. https://t.co/cdkYEHuvLC,2020-11-27 21:31:44,Twitter for iPhone,25,84,covid; 
Coronavirus cases continue to spike across the country. It is incumbent upon all of us to take steps to stop the spread of this virus. I encourage folks to continue to heed the advice of experts practice social distancing and wear a mask.  https://t.co/xd4Z5hdFMG,2020-11-27 19:14:10,Twitter for iPhone,5,17,corona; 
During COVID-19 everyone is navigating new sources of stress. I'm glad to see the expansion of critically important mental health services across the SUNY system. I'll keep pushing at the federal level to ensure future COVID-19 relief prioritizes resources for mental health. https://t.co/gTbQSXmwZ9,2020-11-25 19:55:26,Twitter for iPhone,5,18,covid; 
#NY19 is home to critically important orgs like the Lexington ARC that allow young people &amp; adults living with special needs to lead independent lives. I enjoyed connecting with the staff &amp; learning how they're adapting to keep folks safe during COVID-19. https://t.co/L6SACRThRX,2020-11-24 21:17:58,Twitter for iPhone,4,15,covid; 
State &amp; local govts continue to take on expenses to respond to COVID—&amp; yet the Heroes Act including my Direct Support to Communities Act to ensure relief is provided to every locality languishes in the Senate. I will keep pushing to get something done.  https://t.co/rq8W4HWjTZ,2020-11-22 15:48:35,Twitter for iPhone,9,33,covid; 
Rising overdose rates in our area are deeply alarming. I will continue my calls for COVID-19 relief that includes funding for substance abuse resources and keep pushing for my legislation the MAT Act to remove barriers to treatment for addiction. https://t.co/LTcsycXjjK,2020-11-21 21:42:21,Twitter for iPhone,5,27,covid; 
Important reminder from @YoungFarmers for farmers and producers all across #NY19. Applications for the Coronavirus Food Assistance Program close on December 11. Apply today. https://t.co/iNHXvXphfT,2020-11-21 18:46:59,Twitter for iPhone,7,14,corona; 
For months small businesses across upstate have faced the economic devastation of COVID-19 with fewer and fewer federal resources. That's why I'm pushing for my legislation that extends my SBA loan relief program signed into law through the CARES Act. https://t.co/yZTA4dpR1F,2020-11-20 00:16:18,Twitter for iPhone,5,14,covid; 
Our nation has reached another devastating milestone in the fight against COVID—250000 Americans lost to this deadly virus. My heart is with their loved ones. We will get through this pandemic by coming together &amp; following the advice of medical experts. https://t.co/KAjfF6wpsV,2020-11-19 19:59:31,Twitter for iPhone,7,19,covid; 
Important update for students facing additional expenses due to COVID-19 — there is still time to apply for federal funding through the bipartisan CARES Act that can help offset the cost of remote learning. https://t.co/kl16nwkPeu,2020-11-18 20:08:20,Twitter for iPhone,4,8,covid; 
Our rural communities and hospital systems were already facing economic challenges prior to the pandemic. I will keep calling for additional COVID-19 relief that includes urgently needed resources for rural hospitals and health care providers. https://t.co/kAluk29I4D,2020-11-17 19:12:37,Twitter for iPhone,5,19,covid; 
News of rising cases is deeply alarming and my heart is with those who have lost loved ones to this dangerous virus. It is incumbent upon all of us to continue to follow the advice of experts maintain social distance and wear a mask.  https://t.co/RwrnPDPYet,2020-11-16 22:24:51,Twitter for iPhone,6,31,social distance; 
This is excellent news and a testament to the hard work of scientists and researchers across the country. We must continue to ensure vaccines and COVID-19 treatments are driven by science.  https://t.co/INGwEJKCFA,2020-11-16 16:28:59,Twitter for iPhone,7,33,covid; 
During these prolonged periods of isolation everyone is navigating new sources of stress. I will continue to advocate for future coronavirus relief legislation that includes urgently needed resources to address the mental strain of this pandemic. https://t.co/YcKznOvI9E,2020-11-15 23:52:11,Twitter Web App,4,39,corona; 
There is no excuse for the lack of testing capacity at this point in the coronavirus pandemic. More than six months ago I called on the Trump Admin to utilize the Defense Production Act to meet PPE and testing needs to safely reopen our economy.  https://t.co/gbmoIKHZ2V,2020-11-14 20:47:41,Twitter Web App,8,57,corona; 
13 million Americans could lose their unemployment insurance next month if Congress fails to act this year. I urge Congressional leaders to reach an agreement on additional COVID-19 relief. Failure to provide for our fellow citizens is not an option. https://t.co/uva8cVgzme,2020-11-13 23:02:52,Twitter for iPhone,9,30,covid; 
COVID-19 has exacerbated the already prevalent opioid crisis in our communities &amp; it is vital that we continue to prioritize this epidemic. I'll keep urging support for my bipartisan MAT Act to help folks access treatment for the disease that is addiction.https://t.co/zTY74YZg13,2020-11-13 19:19:39,Twitter for iPhone,3,13,covid; 
As COVID-19 cases spike across upstate it is imperative that our front line workers have the resources &amp; PPE they need to stay safe on the job. I will continue my calls for the Admin to utilize the Defense Production Act to produce gloves masks &amp; tests. https://t.co/B7c3xWOB3M,2020-11-12 23:06:21,Twitter for iPhone,6,44,covid; 
Coronavirus cases continue to rise across our state and in #NY19. We all have a role to play in working to combat this disease and slow the spread in our communities through social distancing washing our hands and wearing a mask. https://t.co/hmeU34RjRe,2020-11-09 22:15:48,Twitter for iPhone,5,10,corona; 
This is an important resource for students all across #NY19 who are facing unforeseen costs due to the COVID-19 pandemic. Don't miss this opportunity to apply for financial assistance made available through the CARES Act. https://t.co/MIyzIsN6fU,2020-11-08 19:25:56,Twitter for iPhone,7,21,covid; 
During CARES Act negotiations I advocated for disaster relief for farmers which was included in the Coronavirus Food Assistance Program. Now USDA is accepting a second round of applications from producers who experienced losses due to COVID. Learn more: https://t.co/X31VRkKgnL,2020-11-08 15:32:52,Twitter for iPhone,6,16,covid; corona; 
The COVID-19 pandemic remains a real and persistent threat across the country. We all have a responsibility to protect one another and slow the spread by washing our hands maintaining social distance and wearing a mask.  https://t.co/93azQnFttQ,2020-11-07 15:33:59,Twitter for iPhone,13,25,covid; social distance; 
As the weather grows colder &amp; the COVID-19 pandemic continues I am grateful for organizations like @IDMH_NewPaltz that provide resources to address the mental strain of this health crisis. Find more info &amp; sign up for their virtual training sessions here: https://t.co/9FvspGy6eU,2020-11-06 20:51:28,Twitter for iPhone,5,9,covid; 
Seniors are especially vulnerable to COVID &amp; it’s critically important that folks have every tool available to stay safe at home. That's why I introduced the Senior Accessible Housing Act which provides a tax credit to offset the cost of home modification. https://t.co/Z0ntZ5oY6G,2020-11-02 16:01:52,Twitter for iPhone,4,13,covid; 
It’s imperative that our upstate producers have the resources required to remain operational this winter. I'll keep urging Congressional leaders to put aside the partisanship &amp; reach an agreement on additional COVID-19 relief that meets the needs on the ground in our communities.,2020-10-31 20:36:31,Twitter for iPhone,1,15,covid; 
During CARES Act negotiations I successfully advocated for $9 billion in disaster assistance for farmers which was distributed through the Coronavirus Food Assistance Program — but it's clear our #NY19 farmers need more help. https://t.co/S5aGurlsZp,2020-10-31 20:36:31,Twitter for iPhone,8,16,corona; 
We cannot lose sight of the fact that COVID-19 remains a persistent threat. I encourage everyone in our area to continue to look out for one another respect social distancing measures and wear a mask.  https://t.co/aVY04zrNSR,2020-10-27 17:44:41,Twitter for iPhone,8,31,covid; 
We are learning new information about the threat of #COVID19 every day. I encourage everyone in #NY19 to continue to listen to the advice of experts and wear a mask to keep one another safe. We will get through this together. https://t.co/T19Xh4ndXJ,2020-10-23 18:01:29,Twitter for iPhone,1,15,covid; 
#COVID19 outbreaks in nursing homes are devastating and we must take steps to protect our most vulnerable populations. My bipartisan legislation will study how we can improve the health and safety of assisted living facilities to stop the spread of contagious diseases. https://t.co/FCedOjbpEB,2020-10-22 15:30:00,Twitter for iPhone,7,14,covid; 
#COVID19 continues to pose an urgent threat across the country. It is incumbent upon all of us to remain vigilant against this virus — follow the advice of experts practice social distancing and wear a mask.  https://t.co/rpCzC2QgAT,2020-10-18 13:59:28,Twitter for iPhone,20,35,covid; 
We are 7 months into this pandemic and millions of Americans are feeling the real pain of unemployment and COVID-19’s impact on our economy. I've heard these concerns all across our rural communities in #NY19. https://t.co/QZbcy5JcTG,2020-10-15 14:52:56,Twitter for iPhone,37,58,covid; 
I've supported multiple COVID-19 relief packages that included funding for broadband internet and they continue to be ignored by the Senate Majority. We cannot leave our students small businesses or seniors who need internet access behind.,2020-10-13 18:31:10,Twitter for iPhone,9,31,covid; 
The last time Congress worked in a bipartisan fashion to pass meaningful relief was March. It's shameful how much time has passed while so many Americans continue to struggle. I've supported multiple COVID assistance packages &amp; stand ready to do so again. https://t.co/5s92wwPE62,2020-10-12 18:03:44,Twitter for iPhone,21,34,covid; 
This Wednesday October 14 @IDMH_NewPaltz is holding one of their monthly trainings focused on the mental health impacts of COVID-19. Learn more here about how you can register for this free virtual resource: https://t.co/9FvspGy6eU,2020-10-12 15:23:21,Twitter for iPhone,3,5,covid; 
On last week’s Congressional Corner my conversation with Alan focused on the need for robust mental health and substance abuse resources. I’m working at the federal level to ensure future COVID-19 relief includes funding for national and local initiatives.https://t.co/7Q15rnjvNV,2020-10-09 18:45:18,Twitter for iPhone,2,11,covid; 
Last week I joined Alan Chartock on @WAMCNews’ Congressional Corner to talk about the urgent need for additional federal COVID-19 relief including what I’m hearing from teachers local leaders and communities all across the district. Listen here ⬇️ https://t.co/Y7MJXJs6wz,2020-10-08 23:41:29,Twitter for iPhone,4,18,covid; 
The COVID-19 pandemic has laid bare the urgent need for affordable accessible broadband throughout our upstate communities. Read my op-ed one year after my Congressional Field Hearing on rural broadband on the urgent need to get our communities online. https://t.co/QeSlzu38cg,2020-10-04 17:35:03,Twitter for iPhone,12,44,covid; 
Upstate farmers were already facing headwinds prior to the pandemic. As Congressional leaders negotiate future COVID relief legislation I will keep fighting for our producers &amp; working to ensure small farms have the resources they need to stay operational.https://t.co/Euaqzputpd,2020-10-03 20:25:54,Twitter for iPhone,18,52,covid; 
Folks of all ages in our community are working to navigate new sources of stress &amp; anxiety throughout this pandemic. I will keep urging my colleagues at the federal level to support additional mental health resources in future coronavirus relief bills.  https://t.co/L6nY5cGJoW,2020-09-30 20:40:45,Twitter for iPhone,25,38,corona; 
Small farmers were already facing a difficult farm economy prior to the pandemic &amp; federal ag policy that is based on economies of scale is exacerbating this crisis. We must ensure future #COVID19 relief includes specialized resources for small producers. https://t.co/BZDA6lONwi,2020-09-29 18:49:56,Twitter for iPhone,6,9,covid; 
Museums &amp; cultural centers across our district have been forced to close their doors due to #COVID19. Last week I announced funding that will allow the Iroquois Museum to expand virtual tours so more of our community can access their collections from home.https://t.co/kv62Bsp2z5,2020-09-29 14:38:53,Twitter for iPhone,7,25,covid; 
I'll keep pushing at the federal level to ensure that future coronavirus relief legislation includes support for federal mental health organizations and state and local governments who are doing this work on the ground every day in our communities.,2020-09-28 18:19:42,Twitter for iPhone,3,16,corona; 
As the #COVID19 pandemic continues our local and national recovery organizations must have the resources they need to address increases in opioid overdoses and assist folks seeking treatment for the disease that is addiction. https://t.co/NWsbCx9UGF,2020-09-28 18:19:41,Twitter for iPhone,8,13,covid; 
I've heard from business owners all across the district about the need for more federal support to get through the #COVID19 pandemic. This legislation will build on my small business law to give firms in upstate NY additional loan relief to stay afloat. https://t.co/ghOs9AFU1i,2020-09-25 13:47:34,Twitter for iPhone,6,14,covid; 
The second round of applications for the Coronavirus Food Assistance Program is now open to farmers across #NY19. If you have experienced losses due to #COVID19 learn more here to see if you qualify: https://t.co/i2gzpjZEXW,2020-09-23 21:28:22,Twitter for iPhone,5,15,covid; corona; 
Even before COVID-19 two-thirds of folks are living paycheck to paycheck and the fastest growing class of Americans are the working poor. Now more than ever we must invest in our communities from the ground up and restore the role of government to promote the general welfare. https://t.co/t5eFHHmR5z,2020-09-23 15:02:18,Twitter for iPhone,14,24,covid; 
Every day our communities are living with the impacts of Senate inaction on additional COVID-19 relief. I will continue to push for legislation that recognizes the scope of this crisis and gives our state and local govts the resources they need to respond.https://t.co/vGyrEv4QyH,2020-09-21 17:45:12,Twitter for iPhone,5,21,covid; 
It is imperative that future COVID-19 legislation provides funding for federal mental health initiatives as well as resources for state &amp; local govts. We must ensure local orgs have the support they need to continue to treat the disease that is addiction. https://t.co/vgTxEfZm7M,2020-09-20 20:21:59,Twitter for iPhone,5,10,covid; 
The Trump Administration's approach to agriculture programs dictated by acreage inherently disadvantages small farms. I will continue working to hold the USDA accountable and ensure future COVID-19 relief addresses the needs of small upstate producers. https://t.co/63M9Svc9ze,2020-09-19 16:49:51,Twitter for iPhone,6,15,covid; 
The House passed the Heroes Act more than 120 days ago. For four months the Senate Majority has ignored this comprehensive response to the #COVID19 pandemic and now their lack of action is making this crisis worse. There is no excuse.  https://t.co/B7ZQKDIGli,2020-09-16 14:15:10,Twitter for iPhone,12,18,covid; 
For 6 months state &amp; local govts have provided urgently needed #COVID19 resources while facing a dire fiscal future. We can't abandon our local partners in their time of need. The Senate needs to come to the table w a workable proposal &amp; Congress must act.https://t.co/sfyfJ1wXZG,2020-09-08 19:36:40,Twitter for iPhone,7,14,covid; 
Throughout the COVID pandemic workers have risked their lives health &amp; safety to keep our country going. On #LaborDay we honor their efforts with action &amp; continue the fight for fair wages for safe workplaces &amp; for a secure retirement for every worker.,2020-09-07 14:44:47,Twitter for iPhone,6,24,covid; 
It is incumbent upon all of us to remain vigilant against #COVID19 this #LaborDay weekend. I encourage everyone to continue to maintain a safe social distance wear a mask and wash your hands regularly. https://t.co/sd0rd5Badi,2020-09-06 15:34:03,Twitter for iPhone,6,13,covid; social distance; 
Restaurants face specific challenges as the colder weather months will limit outdoor seating. I sat down with the owners of Aba's Falafel in Rhinebeck this afternoon to hear how they've managed during #COVID19. https://t.co/2VXQa1g4zh,2020-09-04 21:23:24,Twitter for iPhone,5,24,covid; 
It is egregious that in the wealthiest nation in the world one in eight families don’t have enough to eat. #COVID19 has exacerbated food insecurity that was already plaguing our rural communities and we cannot sit idly by as families go hungry. https://t.co/6Xq33rNTJB,2020-09-03 19:09:20,Twitter for iPhone,7,16,covid; 
Small farmers were already facing a difficult farm economy &amp; #COVID19 has placed an additional strain on small producers. My Helping America's Farmers Act would create an Ag-EIDL program to give family farmers in #NY19 additional tools to stay afloat. https://t.co/dvtOC1H9zY,2020-09-02 20:59:42,Twitter for iPhone,8,18,covid; 
Visited the Mermaid Cafe in Catskill today &amp; met with owner Michelle Williams where I thanked her for her work to feed &amp; support our community during COVID-19. Following a quick walk I spoke with Dave Snyder from Left Bank Ciders a new cidery that opened amid the pandemic. https://t.co/gEvwJftgxE,2020-08-31 23:45:39,Twitter for iPhone,6,47,covid; 
Small businesses are the cornerstone of our local economies in #NY19. Following the Open Air Market I walked Church St in New Paltz &amp; spoke with the business owners &amp; employees at Huckleberry Commissary Grinds &amp; Grains &amp; CronArt about how they're responding to COVID-19. https://t.co/OEW6A2CARU,2020-08-30 22:30:34,Twitter for iPhone,13,42,covid; 
The Admin's ag policies are built around economies of scale rather than economies of cooperation &amp; small farmers are paying the price. I will not accept the failure of family farms. We need programs specifically for small producers in future COVID relief. https://t.co/he2t6hs7sS,2020-08-30 14:30:34,Twitter for iPhone,27,61,covid; 
As we approach #InternationalOverdoseAwarenessDay on August 31 it is vitally important that our local treatment and community support organizations have the resources they need to adapt to and address this epidemic during COVID-19. https://t.co/Pv4UnW4Qkd,2020-08-29 20:20:05,Twitter for iPhone,8,12,covid; 
For months our state &amp; local governments have managed the COVID-19 response in their communities including increased demands for resources &amp; a shrinking tax base. Now they urgently need federal coronavirus relief funding to fill in the gaps. https://t.co/5i9AfTnsh5,2020-08-28 18:48:05,Twitter for iPhone,5,11,covid; corona; 
For decades Sullivan County has been home to a rich tourism industry that drives our local economy. Now they're feeling the impact of #COVID19. I will keep showing up to make sure our businesses feel heard &amp; represented as we prepare for the future. https://t.co/fk6oQXRkUD,2020-08-27 15:46:09,Twitter for iPhone,4,15,covid; 
#NY19 is home to more than 27000 #smallbiz &amp; self-employed owners who are vital to our communities &amp; essential to our local economies. Today I connected with the shop owners at Picture Perfect &amp; Settler's Block in Canajoharie to hear how they've responded to COVID-19. https://t.co/3LIO7ypCUV,2020-08-26 18:34:02,Twitter for iPhone,4,20,covid; 
Different counties today but the same theme.  Met with folks in Sullivan and Broome who are working to manage through the manifold economic challenges COVID-19 has brought about. And the question remains is more relief coming? If so when? https://t.co/HjmMVescMR,2020-08-25 19:06:47,Twitter for iPhone,7,46,covid; 
Colleges across #NY19 have stepped up to support frontline workers &amp; our region's response to the coronavirus pandemic. I am excited about the launch of the SUNY Prepare Innovation and Internship Program and look forward to visiting @NewPaltz soon. https://t.co/VTS1ZzWTUc,2020-08-25 17:22:16,Twitter for iPhone,6,11,corona; 
#NY19 is home to nearly 5000 farms 96% of which are family-owned. Farmers across our region have experienced challenges during #COVID19 and I'm glad to see organizations finding creative ways to share agricultural knowledge with the community. https://t.co/1SNxhJFaPB,2020-08-24 20:40:09,Twitter for iPhone,3,9,covid; 
It has never been more important that we support those struggling through the mental &amp; physical strain of these unprecedented times. I wrote to Congressional leaders urging them to prioritize funding for mental health services &amp; substance abuse disorders in future COVID19 relief. https://t.co/1Z5CookrQ4,2020-08-21 16:25:30,Twitter for iPhone,8,10,covid; 
I thoroughly enjoyed meeting with the good folks of Brown's Brewing Company in Hoosick Falls yesterday.  As we manage through COVID19 it is important to know what's working across #NY19 and how to help grow and support our small businesses for the future. https://t.co/b22abRrGk2,2020-08-18 15:55:32,Twitter for iPhone,2,15,covid; 
Small businesses are essential to the fabric of our communities in #NY19. I connected with Tom and Sarah of @ChathamBrewing where I held one of my Columbia County town halls last year to discuss their experience of running the brewery during the COVID-19 pandemic. https://t.co/MYA4WkMXj6,2020-08-17 19:18:26,Twitter for iPhone,5,13,covid; 
We must remain vigilant against the threat of this deadly virus. I encourage folks across #NY19 to continue to wear a mask maintain social distance and wash your hands regularly.  https://t.co/Az68XNDBVI,2020-08-16 14:33:38,Twitter Web App,9,32,social distance; 
Great to see this Livingston Manor landmark now opened for visitors wearing a face mask and maintaining social distance.   https://t.co/l16mAvxsyY,2020-08-12 16:55:40,Twitter Web App,3,14,social distance; 
Really glad to see our community and the passionate folks at @SUNY_Delhi come together to support our young people facing unforeseen costs related to the COVID-19 pandemic.   https://t.co/Ud5I64Crhl,2020-08-12 14:00:25,Twitter Web App,2,9,covid; 
Pleased to see the work of campuses across #NY19 have an impact on current #COVID19 research and development. Learn more here about the work of @BardCollege Professor Felicia Keesing: https://t.co/7l6M3JrHzd,2020-08-11 20:15:33,Twitter Web App,5,11,covid; 
Producers in #NY19: don’t miss this opportunity to learn more about the Coronavirus Food Assistance Program (CFAP) before the August 28th deadline. https://t.co/Ywt6tGtAeO,2020-08-11 18:22:01,Twitter Web App,5,10,corona; 
The @YoungFarmers coalition has put together a helpful frequently asked questions guide with resources for the agriculture community on #COVID19. Find answers here:  https://t.co/qh0p1m6ZBk,2020-08-09 20:05:26,Twitter Web App,6,16,covid; 
These COVID-19 infection rate numbers are encouraging. To maintain these numbers it remains critically important that as a community we continue to practice social distancing wash our hands regularly and wear a mask.  https://t.co/v8tnSS3MYt,2020-08-08 22:31:57,Twitter for iPhone,7,25,covid; 
Great joining Patrick Clancy and Erika Andersen owners of Great Life Brewing in Kingston for a conversation about how their business is adjusting during #COVID19. Small businesses are the lifeblood of our economy &amp; I’ll keep working to make sure they have the support they need. https://t.co/aUf9xJy5Uc,2020-08-07 22:08:08,Twitter for iPhone,3,17,covid; 
This afternoon I stopped by a new small business in #NY19 @KingstonBread. Great to see a new space from the owners of Rough Draft and learn more about how small business owners are managing through the COVID pandemic and reopening. https://t.co/aS35vgn33I,2020-08-07 18:42:14,Twitter for iPhone,4,35,covid; 
The #COVID19 pandemic has once again laid bare the urgent need for access to rural broadband — and how the #DigitalDivide holds back our rural communities. From students to farmers to #smallbiz broadband must be treated as an essential utility. #NY19 https://t.co/Pz38OYXLsX,2020-08-01 20:40:15,Twitter for iPhone,8,23,covid; 
B/w the end of the CARES Act eviction moratorium &amp; unemployment benefits it’s never been more urgent to pass the #HeroesAct. Our government has a duty to promote the general welfare &amp; ensure our communities have the resources needed to respond to #COVID19.https://t.co/BDQvL1iNBJ,2020-07-26 22:50:06,Twitter for iPhone,6,28,covid; 
Every day we learn more about the #coronavirus and the severe risks this disease poses to our health and wellbeing. I encourage everyone to continue to practice social distancing wear a mask &amp; get tested. https://t.co/5oUJvD2yxq,2020-07-25 22:54:11,Twitter for iPhone,21,29,corona; 
The bipartisan #CARESAct includes important resources and funding for students and folks in higher education. Learn more here about how these funds can support students who experienced a disruption due to #COVID19:   https://t.co/D867si1Dbo,2020-07-24 22:45:26,Twitter for iPhone,5,5,covid; 
