I continue to hear from folks about the dire circumstances for our family dairy farmers during the #COVID19 outbreak. I worked to prioritize assistance for our small farms &amp; I'll continue to partner w state &amp; local officials to support our ag economy. https://t.co/2GS2ADjXXG,2020-04-13 14:46:38,Twitter for iPhone,3,9,covid; 
NY is the canary in the coal mine when it comes to rising #COVID19 cases &amp; it is critically important that our hospitals have the support &amp; PPE they need. I joined a bipartisan group of my NY colleagues urging funding for our hospitals in #NY19.  https://t.co/EnxXjuF1MC,2020-04-12 21:22:00,Twitter for iPhone,5,11,covid; 
Our small farmers were facing significant headwinds before the #Coronavirus outbreak that disrupted many local food systems. I'm so glad to see these important resources that connect small farms directly with folks across #NY19.  https://t.co/3IyK5mxACd,2020-04-10 21:01:10,Twitter for iPhone,2,3,corona; 
Combating the #Coronavirus requires partnership and cooperation at every level of government. Very glad to have panelists from across the district join me in answering questions &amp; sharing resources with our upstate communities. https://t.co/MIqujnXwuZ,2020-04-10 14:29:05,Twitter for iPhone,2,9,corona; 
Today we attended a powerful event paying tribute to our health care workers on the front lines of the Coronavirus outbreak. We are so grateful to our health care heroes! Stay safe and stay healthy. https://t.co/F8vfnV2m4a,2020-04-08 21:40:42,Twitter for iPhone,13,82,corona; 
Farmers were already facing a difficult farm economy prior to the #COVID19 pandemic &amp; we need to make sure every tool is available to our agriculture community. I'm urging the SBA to make sure our family farms can access needed SBA loans &amp; grants. https://t.co/cB9xKQ865c,2020-04-08 14:05:10,Twitter for iPhone,5,10,covid; 
On #WorldHealthDay I join our nation and the world in lifting up the work of our brave medical professionals working to treat those with #COVID19. Our health heroes need PPE and I will keep fighting for  masks and supplies to them safe. https://t.co/IqqbQTUnFz,2020-04-07 23:46:16,Twitter for iPhone,6,18,covid; 
Yesterday in my Agriculture Advisory Committee we discussed the importance of helping our small farmers get online as we look for new ways to adapt during the #COVID19 outbreak. Find a resource library for new &amp; beginning farmers here: https://t.co/LAJmNiTDq1,2020-04-07 20:47:15,Twitter for iPhone,3,8,covid; 
Our farmers were already facing a difficult farm economy prior to the Coronavirus outbreak. I led a letter with 86 colleagues urging the SBA to follow the intent of Congress &amp; allow farmers to qualify for needed disaster loans. https://t.co/YaUnggyLi2,2020-04-05 23:42:24,Twitter for iPhone,4,13,corona; 
Our small businesses are facing an untenable economic reality during the #COVID19 pandemic. I wrote in today's issue of the Times Herald-Record about my work to help get our small biz community urgent loan &amp; grant relief. We're going to get through this together. https://t.co/mKb1aA6xvq,2020-04-05 21:24:36,Twitter Web App,6,16,covid; 
Thank you to all our #NY19 health care heroes. We are so deeply grateful for your work to treat the Coronavirus and care for our community. https://t.co/I08xUu2D15,2020-04-05 14:52:00,Twitter for iPhone,6,26,corona; 
I will continue to push for broadband measures in future coronavirus response legislation.  I'm ready to partner with folks on both sides of the aisle to fix these flawed mapping practices &amp; close the #DigitalDivide.,2020-04-04 21:27:55,Twitter Web App,0,17,corona; 
Our upstate community continues to come together to support one another throughout this public health emergency. Glad to see Regeneron rush production of 500000 urgently needed test kits for #COVID19. https://t.co/827vZ9SOLr,2020-04-03 23:32:21,Twitter for iPhone,8,24,covid; 
Addressing the #Coronavirus pandemic cannot be partisan. Last week the House &amp; Senate passed &amp; President signed the CARES Act a bipartisan bill that I hope will instill confidence during these uncertain times. https://t.co/tjLp3I8H5v,2020-04-03 20:32:05,Twitter Media Studio,3,13,corona; 
Our small and family farmers in upstate continue to face difficult conditions made worse by the #COVID19 pandemic. I'm working with my colleagues to ensure that small farms have access to economic disaster loans through the Small Business Administration. https://t.co/IQSdUCwcIP,2020-04-03 17:23:02,Twitter for iPhone,2,15,covid; 
The #COVID19 pandemic continues to challenge our region and I'm working every day to advocate for #NY19 and make sure folks can access the urgent relief available to our family farms &amp; small biz. https://t.co/gp9qOksv6x,2020-04-02 17:29:30,Twitter for iPhone,6,16,covid; 
What's in the bipartisan CARES Act? I joined @SPECNewsAlbany to talk about the critically important small business loan relief disaster assistance for our family farms &amp; the important work that must continue as we confront #COVID19 together. https://t.co/lhdDhnEgve,2020-04-02 15:37:18,Twitter for iPhone,3,9,covid; 
Our rural communities experience a unique strain during the #Coronavirus pandemic. On @WSKG I talked about my work to include direct assistance to small &amp; mid-sized farms in the CARES Act &amp; my legislation to assist #NY19 small biz with outstanding loans. https://t.co/0s1b00Eumc,2020-03-31 16:49:38,Twitter for iPhone,4,6,corona; 
On Monday I joined @BrianLehrer on @WNYC for a conversation about how we support our rural communities throughout the #COVID19 pandemic &amp; the urgent need for the President to continue to use the Defense Production Act. Listen here: https://t.co/NWdgdzLuZm,2020-03-31 14:19:25,Twitter for iPhone,10,15,covid; 
The emergency relief legislation passed last week is just one of many steps that will need to be taken to make our country whole again as we combat the #COVID19 pandemic.  https://t.co/vsKT9lVLfV,2020-03-30 21:08:25,Twitter for iPhone,2,9,covid; 
On #NationalDoctorsDay I join in sharing my heartfelt appreciation for the doctors and medical professionals in #NY19 and across the country working every day to save lives as we combat the #COVID19 pandemic.,2020-03-30 17:33:52,Twitter for iPhone,7,32,covid; 
The #COVID-19 pandemic must be taken seriously. We owe an enormous debt of gratitude to our health care workers and medical professionals in #NY19 and across the country working on the front lines of this public health emergency every day.  https://t.co/Yzn36yb1JI,2020-03-29 21:44:14,Twitter for iPhone,8,21,covid; 
NY19 is home to nearly 5000 farmers 96% of which are family farmers. Our farmers are facing a difficult farm economy exacerbated by Coronavirus. I along w @PingreeforME urged inclusion of disaster assistance for our small farms in the bipartisan bill signed into law Friday. https://t.co/3FtXOyN2Tj,2020-03-29 17:23:52,Twitter for iPhone,3,32,corona; 
#Coronavirus continues to challenge our nation and it is urgent that we get assistance to working people aid to our hospitals &amp; support for our small businesses. Listen to my interview on @WAMCNews about what this bill means for #NY19: https://t.co/2uSW6k1Ysa,2020-03-29 14:51:05,Twitter for iPhone,2,3,corona; 
After holding 35 in-person town halls in #NY19 during the #COVID19 pandemic I've held two telephone town halls to hear from folks in all 11 counties &amp; connect the community with resources as we work to get through this public health emergency together. https://t.co/7W89Q1Vgt2,2020-03-28 20:28:41,Twitter for iPhone,9,39,covid; 
Yesterday the House passed &amp;  POTUS signed into law legislation to support #NY19 families small businesses &amp; family farmers during the #Coronavirus pandemic. This law will support our brave medical professionals &amp; give direct support to working people. https://t.co/cJmigno2KC,2020-03-28 15:00:54,Twitter for iPhone,4,19,corona; 
The #COVID19 pandemic is causing unprecedented disruptions for our small businesses &amp; family farmers. Glad the bipartisan emergency relief legislation includes measures I championed including loan relief for small biz &amp; disaster payments to small farmers. https://t.co/YhhA8TDoS4,2020-03-26 23:00:03,Twitter for iPhone,7,14,covid; 
In-person town halls are essential to staying connected to folks and hearing from every community in #NY19. To respect social distancing measures I held my first telephone town hall on #COVID19 with nearly 5000 folks. https://t.co/ZDaBYgkoZI,2020-03-26 18:22:58,Twitter for iPhone,6,31,covid; 
From labor shortages to disruptions in the food chain family farmers in #NY19 are facing compounded challenges during the #COVID19 pandemic. I wrote to Congressional leaders last week urging considerations &amp; relief for our small farms.  https://t.co/j5U5Y775F1,2020-03-26 00:42:24,Twitter for iPhone,16,37,covid; 
#COVID19 is wreaking havoc on family farms &amp; local food systems. That’s why I teamed up w @PingreeforME to secure $9.5B in disaster assistance for growers and producers in this bipartisan bill. This is one of many steps we must take to support upstate ag. https://t.co/PHeHUL0a9i,2020-03-25 21:17:37,Twitter for iPhone,4,16,covid; 
Claverack's own Olde York Farm is creating Hand Sanitizer during the #COVID19 pandemic. My thanks to our community members and small businesses working to assist our entire region through these unprecedented and difficult times.  https://t.co/mMAbNmP0LA,2020-03-25 16:13:14,Twitter for iPhone,8,25,covid; 
Our rural hospitals are already struggling and the #Coronavirus will push these facilities to capacity. I wrote a letter to the President last week urging action to support this vital rural infrastructure to keep our communities safe. https://t.co/AMsN9cQKwa,2020-03-24 18:26:50,Twitter for iPhone,9,30,corona; 
Do not miss this important resource if you are looking for a new job during the #COVID19 pandemic.  https://t.co/z2TWhCeXNr,2020-03-23 17:04:58,Twitter for iPhone,8,13,covid; 
We lost a member of the Dutchess County community this weekend to #COVID19. My condolences go out to his loved ones. I encourage everyone to continue to take this virus seriously &amp; #StayAtHome to keep themselves safe.  https://t.co/w8X86lv0Ww,2020-03-23 14:11:23,Twitter for iPhone,7,35,covid; 
Social distancing during this #COVID19 pandemic presents new mental health challenges &amp; strains on our communities. I'm glad to see so many organizations in Dutchess finding creative ways to continue to serve our community &amp; most vulnerable populations.  https://t.co/pAXxVBoGoX,2020-03-22 19:28:57,Twitter for iPhone,5,10,covid; 
Our family farmers in #NY19 are facing new stress in addition to managing a difficult farm economy. As Congressional leaders negotiate future #COVID19 legislation I led a letter of 36 members urging them to include relief for our small &amp; mid-size farmers. https://t.co/78VEoLTyYL,2020-03-22 16:45:55,Twitter for iPhone,11,30,covid; 
The #COVID19 pandemic reinforces that broadband internet access must be treated as a utility and an essential for our communities. I'm glad the FCC will allow our communities to apply for these critical funds. https://t.co/b0Mgnv8gQc,2020-03-21 20:08:08,Twitter for iPhone,13,43,covid; 
Our small businesses self-employed &amp; farmers in #NY19 are feeling the impacts of the #COVID19 pandemic. Last night's tele-town hall was an important opportunity to hear from the community collaborate w local leaders &amp; share info to ease this burden.  https://t.co/j5B9YYtfbg,2020-03-21 16:19:58,Twitter for iPhone,4,10,covid; 
Just wrapped up my first tele-town hall on #COVID19 with questions from folks across #NY19. Thank you to the leaders stakeholders &amp; experts we had on the line tonight offering accurate well researched info for our community. Look forward to holding more &amp; staying connected. https://t.co/DBdpJsdhzV,2020-03-21 00:25:07,Twitter for iPhone,5,76,covid; 
The @SBAGov's declaration yesterday is a big deal for our small businesses who are acutely impacted by #Coronavirus and the economy. I pushed for this designation and I'll keep fighting for the 27000 small biz and self employed owners in #NY19. https://t.co/a1RzyVJQ7y,2020-03-20 20:44:56,Twitter for iPhone,3,9,corona; 
Our small businesses are feeling the impact of the #COVID19 pandemic &amp; closures across our state. I introduced legislation yesterday to relieve the burden of loans for our small biz owners &amp; I'll keep pushing to get this bill through Congress immediately. https://t.co/g3B1FzXLOY,2020-03-20 16:15:19,Twitter for iPhone,1,8,covid; 
Addressing the #COVID19 pandemic takes coordination &amp; collaboration with all levels of government &amp; partners on the ground. Appreciate the opportunity to join @PatRyanUC for an update on how we’re both working to help #NY19 through these challenging times. https://t.co/nEy9yTDidu,2020-03-20 14:11:05,Twitter for iPhone,3,19,covid; 
Checking in after a great Facebook live conversation w/ @PatRyanUC about our work to address the #COVID19 epidemic &amp; how our communities are responding. Talked about increasing testing hospital beds &amp; getting our small businesses the relief they need.  Stay safe &amp; stay healthy. https://t.co/GUEi5F3UyG,2020-03-19 20:40:49,Twitter for iPhone,7,34,covid; 
Small businesses make up the lifeblood of #NY19’s community and economy and I join our chambers of commerce in supporting them during the #Coronavirus pandemic. I'm working at the federal level to get biz owners &amp; the self employed the help they need. https://t.co/N8IqmRmcaq,2020-03-19 18:53:06,Twitter for iPhone,5,22,corona; 
The #COVID19 pandemic will present new challenges economically and mentally for every single person in our region. Now is not the time to panic but prepare. We will continue to get through this together. https://t.co/w95nFYLS6e,2020-03-19 16:48:05,Twitter for iPhone,4,14,covid; 
Our families need flexibility during the unprecedented #COVID19 pandemic. I joined my NY colleagues in a letter urging an extension to the tax deadline.,2020-03-19 14:55:50,Twitter for iPhone,7,44,covid; 
This is a great resource for our seniors and populations most vulnerable to #Coronavirus. Price Chopper stores will be open at 6:00 a.m. for seniors only shopping to reduce the spread &amp; keep folks safe. https://t.co/wzKIXf1cIK,2020-03-19 01:54:29,Twitter for iPhone,16,40,corona; 
New and beginning farmers are facing unique challenges due to the spread of #Coronavirus. Don't miss this opportunity to connect with fellow @YoungFarmers to learn more about how the agriculture community is adapting.  https://t.co/1PHKQ6LVB2,2020-03-18 20:40:38,Twitter for iPhone,3,8,corona; 
I'm glad to see increased flexibility from the U.S. Treasury Department as communities in #NY19 and across the country are dealing with the #COVID19 pandemic.  https://t.co/1CJtGiP42a,2020-03-18 17:49:08,Twitter for iPhone,1,5,covid; 
Thousands of students in our region receive breakfast and lunch through their school. I am thankful to those who have stepped up to provide meals for our community during #COVID19-related school closures.  https://t.co/uWP18L1C3D,2020-03-18 02:11:46,Twitter for iPhone,7,27,covid; 
Attention Otsego County residents: Basset Healthcare has a #Coronavirus hotline at (607) 547-5555. Call if you have questions or believe you are showing symptoms of #COVID19. https://t.co/Av4frltVnK,2020-03-17 16:14:45,Twitter for iPhone,3,6,covid; corona; 
The spread of #Coronavirus presents many new challenges for families especially those with young kids who may not understand why they're home from school. PBS has put together some great resources to help explain. https://t.co/zai83FSWfo,2020-03-17 14:04:22,Twitter for iPhone,4,12,corona; 
We are working together to support #NY19 families &amp; small businesses experiencing dramatic change due to the #Coronavirus. As a reminder: the Ulster County #COVID-19 hotline is 845-443-8888.,2020-03-16 19:23:27,Twitter for iPhone,7,21,covid; corona; 
Person-to-person interactions will continue the spread of #Coronavirus. This simulation from the Washington Post walks through why social distancing is critically important to keep our communities safe.  https://t.co/WTcoO0kCiP,2020-03-16 14:36:56,Twitter for iPhone,16,45,corona; 
There are people with #COVID19 that do not show symptoms. This is why social distancing and avoiding large gatherings is critical for the health of everyone in our community. I urge folks to continue to follow NYS and CDC guidelines. https://t.co/2fPXnJFE0H,2020-03-15 21:41:30,Twitter for iPhone,12,37,covid; 
Our rural communities will experience a unique strain and set of challenges throughout the #COVID-19 pandemic. If you are in a rural community and struggling to access medical care or tele-health call the NYS Coronavirus Hotline at 1-888-364-3065. https://t.co/oxYWTTtKau,2020-03-15 14:35:02,Twitter for iPhone,10,22,covid; corona; 
Grateful for the work of our colleges and workforce development programs for sharing information on how to stop the spread of #COVID19 in our communities. I'll keep amplifying local resources as they become available. https://t.co/84Qv6IkjyI,2020-03-15 00:18:18,Twitter for iPhone,3,15,covid; 
Good to be home after the House passed a bipartisan #COVID19 response. The bill ensures paid medical leave &amp; free testing expands unemployment insurance &amp; Medicaid &amp; provides food security.  Let’s continue to work together through these challenging times &amp; care for one another. https://t.co/F1r9KeERR1,2020-03-14 15:34:04,Twitter for iPhone,33,164,covid; 
The #2020Census is a crucial priority to ensure everyone in our community is accounted for. The spread of #Coronavirus could jeopardize an accurate &amp; thorough count. I joined my colleagues to urge Commerce Sec. Ross to extend the data gathering period. https://t.co/SVXYmhEiK9,2020-03-13 22:10:30,Twitter for iPhone,5,14,corona; 
We need to continue preparations for the #COVID19 pandemic &amp; its effect on our daily lives. I introduced the bipartisan PREP Act to ensure folks can access needed benefits including SNAP legal &amp; crisis resources. I urge anyone w/ COVID Qs to use the NYS hotline: 1-888-364-3065. https://t.co/xCT9EGdlGb,2020-03-13 16:09:47,Twitter for iPhone,13,37,covid; 
The #COVID19 virus is a rapidly evolving public health concern in upstate. I will continue to monitor this situation and encourage anyone with questions or concerns to call the New York State Coronavirus hotline at 1-888-364-3065.,2020-03-11 14:11:29,Twitter for iPhone,14,49,covid; corona; 
Yesterday the first case of COVID19 was confirmed in Ulster County. I'm paying close attention to this evolving situation &amp; working w/ local partners keep our communities safe. Now is the time to prepare not panic. Find resources thru the NYS Coronavirus Hotline: 1-888-364-3065 https://t.co/uFOtVK7HCv,2020-03-09 14:55:03,Twitter for iPhone,14,54,covid; corona; 
#COVID-19 is changing rapidly &amp; the House voted for a bipartisan supplement to make sure our country is prepared for a thorough &amp; robust response to this public health challenge. Last week I joined WAMC to talk about how we are working to address this. https://t.co/NbLaInWIq0,2020-03-05 15:10:20,Twitter for iPhone,4,21,covid; 
I continue to closely monitor the emerging threat of #coronavirus. Now is the time to put politics aside prioritize public safety and make sure our nation has the resources we need. https://t.co/LMRXmNDwLo,2020-02-28 16:51:40,Twitter Web App,9,35,corona; 
We must closely monitor the threat of coronavirus and ensure we have a robust response system to ensure public safety.  Protecting the American people and doing so with transparency and accountability should be the top priority.  https://t.co/OZTKY2jpY0,2020-02-27 14:14:51,Twitter for iPhone,7,37,corona; 
