During the #COVID19 pandemic there is nothing more important than accurate information and resources for our community. I worked with Esri to create a resource hub for #NY19 that allows folks to discover nearby COVID testing facilities PPE and food pantries. https://t.co/fCg8RHMKfa,2020-07-24 19:22:47,Twitter for iPhone,6,20,covid; 
More than a million Americans filed for unemployment last week alone. We must pass additional coronavirus relief legislation with extended unemployment. https://t.co/VqcQj9bR4d,2020-07-23 13:47:07,Twitter for iPhone,6,22,corona; 
Our family farmers are critical to our upstate way of life and I've worked to make advocating for small farms in #NY19 a priority throughout #COVID19 relief negotiations. I'll continue to advocate for ag producers across our district in the months ahead. https://t.co/thFLFEQwab,2020-07-22 22:15:14,Twitter for iPhone,3,12,covid; 
Tele-medicine has never been more important during #COVID19 &amp; I'm glad to see #NY19 colleges at the forefront of these innovative procedures. I'll continue to prioritize #ruralbroadband measures to strengthen these connections and expand tele-health across upstate. https://t.co/MIQLii6IMJ,2020-07-16 17:29:50,Twitter for iPhone,2,12,covid; 
What is the upside to keeping this essential data hidden from the public? We must be transparent in our tracing tracking and testing of the coronavirus to understand the impact and keep our communities safe. This is short-sighted and dangerous.  https://t.co/ZOeA1xyKye,2020-07-15 15:20:43,Twitter for iPhone,26,71,corona; 
As our nation battles #COVID19 we must ensure that job loss does not leave folks unable to access or afford treatment. My Medicare-X Choice Act addresses this by creating a public option.  https://t.co/VxUsqAJzxG,2020-07-14 18:05:01,Twitter for iPhone,3,11,covid; 
Checking in after meeting with folks in the wedding &amp; events industry in Greene County. These are upstate jobs that rely on social gatherings &amp; have been greatly impacted by #COVID19 esp during the summer months. We must continue to finds ways to support at the federal level. https://t.co/vVxCbze0hc,2020-07-10 21:28:33,Twitter for iPhone,10,61,covid; 
#NY19 is home to nearly 5000 farms 96% of which are family-owned. Appreciate the opportunity to join the folks at @RonnybrookFarm to discuss how family farmers are responding to #COVID19 &amp; future steps we need to make sure farmers land on their feet. https://t.co/fxRTLdMpei,2020-07-09 16:41:46,Twitter for iPhone,4,12,covid; 
The House passed the #HeroesAct in May including my bipartisan Direct Support for Communities Act which would allow all communities regardless of size to access needed coronavirus relief funds. The Senate needs to take up this legislation now. https://t.co/P1RECL5pV4,2020-07-08 21:35:57,Twitter for iPhone,14,25,corona; 
#COVID19 remains an urgent threat &amp; it is critical that we have the tracing resources needed to understand the spread. I will keep calling for a comprehensive national testing strategy &amp; urge folks to continue to #WearAMask &amp; practice social distancing.  https://t.co/Ro7EEM1O0i,2020-07-08 17:21:59,Twitter for iPhone,3,17,covid; 
Enjoyed joining the Delaware County community in celebrating #IndependenceDay and grateful for the opportunity to deliver chicken meals to the essential health care employees working day in and day out to care for our seniors and treat #COVID19 patients.  https://t.co/itPrl5qy3S,2020-07-08 15:32:48,Twitter for iPhone,4,5,covid; 
As folks look for more socially distant activities this summer check out this Parks Explorer app with additional information about to connect you with resources and guides for New York State Parks.  https://t.co/E8NXfxA1xM,2020-07-07 00:19:08,Twitter for iPhone,7,27,socially distant; 
#COVID19 has laid bare the urgent need for investment in broadband and measures to close the #digitaldivide in rural communities across #NY19. I will continue to hold the FCC accountable and fight for federal broadband funds in upstate New York.  https://t.co/Z8oQBx7XEK,2020-07-05 15:17:16,Twitter for iPhone,8,38,covid; 
#COVID19 has fully exposed &amp; exacerbated the staggering levels of inequality that have been plaguing our country for far too long. We must return the work of our govt to promoting the public good not advancing the special interests of private wealth. https://t.co/A5rm2oClfA,2020-07-02 21:29:38,Twitter for iPhone,20,46,covid; 
Dramatically ramping up &amp; expanding testing is how we contain &amp; defeat #COVID19. I will continue to call for the Trump Administration to release a comprehensive plan to expand testing capacity at the federal level.  https://t.co/cfn7eo41hG,2020-06-30 21:39:17,Twitter for iPhone,2,14,covid; 
✓ Lower costs.  ✓ Better access to health care.  We need universal coverage and as our nation continues to take on the #COVID19 pandemic I'm proud to vote for legislation that protects and expands access to critically important care. https://t.co/aDtMLilVpJ,2020-06-30 15:18:12,Twitter for iPhone,3,9,covid; 
As the world continues to confront the #COVID19 pandemic we must remain vigilant against the severe threats of climate change and flooding risks that cause costly damage to our communities and economies.  https://t.co/DEKAB5vz6W,2020-06-29 23:02:18,Twitter for iPhone,6,11,covid; 
#NY19 is home to nearly 5000 farm operations and the USDA's #CFAP program is designed to help small farmers recover from losses due to #COVID19. Find the digital application here: https://t.co/92rWW3EkaY,2020-06-28 22:43:23,Twitter for iPhone,6,10,covid; 
#COVID19 remains a serious threat to communities across the country including in rural areas across #NY19. We must remain vigilant against this dangerous disease—practice social distancing &amp; wear a mask when outside. https://t.co/xM7xQSR4jY,2020-06-28 16:21:38,Twitter for iPhone,9,20,covid; 
Glad to see historic gems like the Olana State Historic Site offer the opportunity for folks to explore the grounds while maintaining social distance. Learn more here about the new walking tours offered this weekend. #NY19 https://t.co/VlWYuJkcHy,2020-06-27 21:38:17,Twitter for iPhone,10,48,social distance; 
We need universal health care. Full stop. The #COVID19 pandemic has laid bare the urgent need for affordable quality health care coverage for every American &amp; this is why we must pass my Medicare-X Choice Act to achieve universal coverage. https://t.co/aFitjFnVaD,2020-06-27 16:43:27,Twitter for iPhone,9,33,covid; 
This is a very revealing look at the spread of #COVID19 across the U.S. &amp; reminder that our work to defeat this virus is far from over. We must continue to invest in expanding testing &amp; maintain social distancing measures to keep our communities safe. https://t.co/dtykkVPMNE,2020-06-26 15:21:53,Twitter for iPhone,3,14,covid; 
Great to join my friend @PatRyanUC and leaders across Ulster County at today's virtual Indivisible Ulster rally! Even when we are socially distant I can feel the energy from this community ready to make positive change at every level. https://t.co/wuUhfE0heu,2020-06-13 23:13:57,Twitter for iPhone,9,32,socially distant; 
During #PrideMonth and while so many are struggling through the health impacts of COVID-19 the Trump Admin finalized an egregious rule removing non-discrimination protections in health care for #LGBT Americans. This is shameful cruel and wrong. https://t.co/W44KdAQlCw,2020-06-13 13:37:23,Twitter for iPhone,10,27,covid; 
Happy #NationalDairyMonth #NY19! Dairy farming is a time-honored tradition in upstate &amp; I will continue to support the work of our farmers through the enactment of my Family Farmer Relief Act &amp; fighting for needed resources during the #COVID19 pandemic.https://t.co/hiaT0lhg7n,2020-06-12 21:10:32,Twitter for iPhone,7,16,covid; 
Our health care heroes are both working on the front lines of this pandemic and supporting the technology to save lives. Grateful to #NY19 colleges supporting our community response to #COVID19. https://t.co/RJyBfKvcXD,2020-06-11 17:25:42,Twitter for iPhone,4,12,covid; 
Proud to support bipartisan legislation that gives students the resources they need to stay classes during the #COVID19 pandemic. I will continue to fight for our #NY19 colleges &amp; universities to give our young people every opportunity at success. https://t.co/FLNeWkxaJ9,2020-06-09 18:56:46,Twitter for iPhone,5,19,covid; 
Our veterans have made enormous sacrifices for the freedoms we hold dear. I am encouraged to see the full recovery of our nation's heroes from #COVID19.   https://t.co/VfFPvxVgZz,2020-06-06 13:07:15,Twitter for iPhone,7,26,covid; 
#COVID19 will require continued federal work to make sure our health care systems &amp; govts have the support they need to continue vital services. I'll keep fighting for my Direct Support for Communities Act to assistance to municipalities of every size. https://t.co/8UqsJSijql,2020-06-05 20:15:13,Twitter for iPhone,5,11,covid; 
I joined Congressional Corner on @WAMCNews last week to talk about adjusting to life in Congress during #COVID19 including home schooling holding telephone town halls to stay connected with the community &amp; more. #NY19 https://t.co/tAJm98PGdF,2020-06-03 22:09:26,Twitter for iPhone,5,13,covid; 
Small businesses across #NY19 continue to bear the brunt of the economic impacts of COVID19. Appreciate the opportunity to connect w the Rensselaer business community to discuss work at the federal level to support our local biz in the weeks &amp; months ahead.https://t.co/75Bkg2xOcY,2020-05-29 14:00:46,Twitter for iPhone,4,9,covid; 
The National Guard been critical to New York's #COVID19 response. It is good to see the President heeding the bipartisan call put forth by myself &amp; Rep. Katko to extend the length of their service &amp; ensure our heroes get the 9/11 GI benefits they deserve. https://t.co/KKfYh4PCzH,2020-05-29 00:11:28,Twitter for iPhone,7,32,covid; 
The House has passed five #COVID19 related bills with funding to support nursing homes as they battle this virus. I called on HHS to distribute this funding as soon as possible to protect our neighbors in nursing homes across #NY19. https://t.co/9USKFbgGAz,2020-05-27 17:41:56,Twitter for iPhone,2,5,covid; 
Regional airports across upstate are important hubs for our response to the #coronavirus and local economy. Glad to see this needed federal relief support the Sidney Airport in Delaware County. https://t.co/YcSxhyslDh,2020-05-26 16:07:46,Twitter for iPhone,5,13,corona; 
First responders answer the call of duty to protect our communities &amp; during the #coronavirus pandemic have faced new challenges and dangers. I'm glad to see our community honor our selfless first responders many of whom are volunteers this #EMSWeek. https://t.co/2DYoJKoZUx,2020-05-25 20:07:20,Twitter for iPhone,9,21,corona; 
Our communities of all sizes including cities towns &amp; villages have managed their response to #COVID19 &amp; need federal relief. I joined Mayor Johnson to discuss my bipartisan Direct Support for Communities Act that would get Hudson &amp; municipalities of all sizes federal support. https://t.co/EKSiQEo754,2020-05-22 18:52:39,Twitter Media Studio,4,11,covid; 
Our municipal leaders have managed their local #COVID19 response &amp; we cannot leave our rural communities behind. This is why I introduced &amp; voted for my bipartisan Direct Support for Communities Act to get relief to every town—regardless of size.  https://t.co/sEIcXApU0Z,2020-05-19 21:17:10,Twitter for iPhone,11,14,covid; 
Nursing homes and older populations are extremely vulnerable to the #Coronavirus &amp; Congress has approved funding to support testing and treatment in these facilities that HHS continues to delay. I am calling for answers. https://t.co/ogM8IRlmQg,2020-05-19 17:50:50,Twitter for iPhone,17,18,corona; 
Yesterday I voted to pass the #HeroesAct which includes my bipartisan and bicameral Direct Support for Communities Act. This bill makes sure every single county and municipality in #NY19 can receive federal coronavirus response funds. https://t.co/Fwuw4XapHm,2020-05-16 13:04:00,Twitter Media Studio,13,63,corona; 
When the CARES Act passed state and local funding left out our rural communities &amp; counties under 500000 people. Learn more about my bipartisan Direct Support for Communities Act that makes sure every single county town &amp; village qualifies for #COVID19 relief: https://t.co/McTlTNidtD,2020-05-15 14:31:07,Twitter for iPhone,2,4,covid; 
The Heroes Act includes critical funding for NY. As our small towns have managed their response to the #COVID19 pandemic we cannot abandon them in their moment of need. It also includes my bipartisan proposal to get funding for communities of all sizes. https://t.co/sExKQR3PUI,2020-05-15 01:13:48,Twitter for iPhone,10,21,covid; 
As #COVID19 has turned our lives upside down our small towns &amp; county govts have stepped in to manage the response. They need our help. My bipartisan Direct Support for Communities Act will ensure every town—regardless of size—can qualify for these funds. https://t.co/e0bL7RnWFs,2020-05-14 21:46:11,Twitter for iPhone,4,9,covid; 
Across #NY19 our rural communities and small towns are working day in and day out to support our #COVID19 response in upstate. I am glad to see my bipartisan Direct Support for Communities Act included in the Heroes Act. https://t.co/EilEOSFRC3,2020-05-13 14:11:49,Twitter for iPhone,6,14,covid; 
Supporting our communities' response to the #COVID19 pandemic will require the cooperation of all levels of government. Appreciate the opportunity to join Sullivan County officials to discuss my bipartisan Direct Support for Communities Act. https://t.co/1RR6jouy6l,2020-05-12 16:31:41,Twitter for iPhone,2,7,covid; 
State &amp; local gov'ts have been asked to shoulder the burden of responding to #COVID19 with fewer resources due to a shrinking tax base. I partnered with Rep. Zeldin &amp; Senators to offer the only bipartisan solution that ensures relief to every single town. https://t.co/aqpckergEY,2020-05-12 14:12:10,Twitter for iPhone,5,10,covid; 
Listen to my conversation on Radio Kingston with Warren Lawrence about telephone town halls during #COVID19 advocating for state &amp; local funding &amp; ensuring small farmers can access the EIDL program. https://t.co/JzD7HNf8yL,2020-05-09 17:43:10,Twitter for iPhone,4,9,covid; 
Right now our counties towns villages &amp; hamlets are forced to shoulder this #COVID19 pandemic response alone. I introduced the bipartisan Direct Support for Communities Act to provide local government with urgently needed resources. https://t.co/jrNyapQrCf,2020-05-07 17:05:32,Twitter for iPhone,23,42,covid; 
My Small Farms Relief Act will provide one-time loan forgiveness targeting three kinds of USDA FSA loans — this would give our small farmers across #NY19 increased flexibility during #COVID19. https://t.co/SYBMtwcFY4,2020-05-07 14:38:10,Twitter for iPhone,11,19,covid; 
On #NationalNursesDay we celebrate the incredible nurses working day in and day out to treat #coronavirus patients and support our upstate response to this pandemic. #ThankANurse,2020-05-06 16:23:30,Twitter for iPhone,7,22,corona; 
Learn more about https://t.co/4MZCZBmo7N and how the #NY19 community is working to bring joy and support to #COVID19 patients.  https://t.co/ooB5V9t2pT,2020-05-05 21:40:57,Twitter for iPhone,7,6,covid; 
Our farmers are facing extreme challenges throughout the #COVID19 pandemic and recovery. If you're a new or beginning farmer check out these resources from the @YoungFarmers coalition. https://t.co/0EV6c3kA9j,2020-05-04 20:58:32,Twitter for iPhone,6,9,covid; 
After I led a bipartisan letter with 86 members small farmers were made eligible for the SBA EIDL program in the most recent #COVID19 law. I’m deeply disappointed the SBA hasn't reopened the application process effectively leaving our farmers out again. https://t.co/9UrHGhWaP5,2020-05-03 18:09:28,Twitter for iPhone,10,18,covid; 
Our family farmers were facing a difficult farm economy prior to the #COVID19 outbreak. In addition to disaster assistance &amp; access to SBA loans I introduced the Relief for America's Small Farmers Act which would forgive three types of USDA FSA loans. https://t.co/ozG5CZOdXr,2020-05-02 17:46:47,Twitter for iPhone,6,14,covid; 
With questions about small business relief to student loan support to following proper health guidance I'm grateful to everyone who joined our community discussion at my seventh #NY19 telephone town hall on #coronavirus. https://t.co/8qBilpdYLf,2020-05-02 15:23:53,Twitter for iPhone,5,9,corona; 
Farms across #NY19 must have access to a number of tools to respond to the #COVID19 pandemic including SBA programs &amp; loan forgiveness. I introduced the Relief for America's Small Farmers Act to give our farmers the flexibility to remain operational. https://t.co/pZuHnhe40j,2020-04-30 14:31:26,Twitter for iPhone,7,19,covid; 
Older Americans are acutely vulnerable to the #coronavirus and I appreciate the opportunity to join @AARPNY for this important conversation on the resources available to our seniors. https://t.co/gkPPBkUzJ0,2020-04-29 18:14:25,Twitter for iPhone,6,13,corona; 
Last night the upstate delegation came together to discuss how we are working together to support our communities' response to the #COVID19 outbreak. We focused on a wide range of issues including supporting small farmers &amp; ensuring rural-specific funding in future legislation. https://t.co/3TS41cQ1wg,2020-04-29 14:51:11,Twitter Media Studio,7,16,covid; 
Our health care heroes continue to bravely treat and support our state's response to the #coronavirus. I am deeply grateful to medical students across #NY19 who are joining the fight in our hospitals &amp; rural medical centers. https://t.co/LM4IiH8C62,2020-04-28 21:01:02,Twitter for iPhone,4,19,corona; 
Great to connect with AARP members throughout #NY19 via telephone town hall.  We focused on the need to address #COVID19 while also remaining focused on protecting critical programs like Social Security and Medicare. https://t.co/76RPmcQ31L,2020-04-28 14:41:36,Twitter for iPhone,5,16,covid; 
Testing is essential to tracking this virus &amp; ensuring we can keep our communities healthy. Ulster County residents: make sure you know where your closest #COVID19 testing location is and bring the proper paperwork.  https://t.co/cnVgt0A9dV,2020-04-27 23:56:54,Twitter for iPhone,10,25,covid; 
Our #NY19 family farmers were already facing market consolidation lower prices &amp; a difficult farm economy prior to the #coronavirus. This legislation makes an important change that means our family farmers can apply for SBA economic injury loans. https://t.co/PAq4JEAXLR,2020-04-27 01:06:39,Twitter for iPhone,12,18,corona; 
Glad to see POTUS has signed the bipartisan emergency relief legislation that includes an important clarification that small farmers qualify for SBA loans. Future bills must include essential funds to support our rural communities' response to #COVID19. https://t.co/2u9kIFebvl,2020-04-25 19:34:27,Twitter for iPhone,6,17,covid; 
From questions about the latest tools for small biz to farmers' access to EIDL to fighting for rural communities &amp; local funding in future bills thank you to everyone who called in &amp; listened live to my 6th tele-town hall on #coronavirus. #NY19 https://t.co/Y4992G440v,2020-04-25 15:07:02,Twitter for iPhone,10,11,corona; 
Our rural communities must be heard throughout the #COVID19 pandemic. I joined Republicans and Democrats in asking the USDA to create a task force for rural America. Read more ⟶ https://t.co/o3Eh1nIWV7,2020-04-24 21:57:48,Twitter for iPhone,4,8,covid; 
Congress has much more work to do to make sure our communities are made whole following the #COVID19 pandemic. I stand with our building trades employees and I will work to make sure they have access to health care pensions and benefits. @GoIUPAT @DC9_IUPAT https://t.co/RX1krhF8MD,2020-04-24 16:34:33,Twitter for iPhone,13,26,covid; 
Economic Injury Disaster Loans allow small biz &amp; now small farms to access immediate funding to keep their businesses running during the #COVID19 pandemic. I'm glad the bipartisan bill passed last night reflects this needed change to include family farms. https://t.co/TQIUsToz5y,2020-04-24 15:51:07,Twitter for iPhone,5,3,covid; 
I continue to hear from #NY19 family farmers about the urgent need for tools to combat this difficult farm economy. I'm glad the emergency #COVID19 relief legislation reflects a change I fought for that will allow farmers to access SBA EID loans.  https://t.co/Uq6mk7y6ey,2020-04-24 00:11:08,Twitter for iPhone,3,13,covid; 
New York is a hotspot for the #coronavirus and we need federal resources as we continue to treat folks and work to recover from this public health emergency. I joined colleagues on both sides of the aisle urging support from FEMA. https://t.co/QiN49TID4X,2020-04-22 00:25:33,Twitter for iPhone,4,19,corona; 
Our rural communities have specific needs &amp; it is essential that our voices be heard at every level of government. I led a letter urging the Administration to make sure our upstate communities are accounted for with a #COVID19 Rural Task Force at the USDA. https://t.co/SUWPxxLhUt,2020-04-21 20:41:15,Twitter for iPhone,7,11,covid; 
It is such a pleasure to see our young people engaged in history and learning—even from home. I really enjoyed the opportunity to join Berlin Central School students and answer questions about my work in Congress to support #NY19 during the #coronavirus. https://t.co/YKAZDYqt0W,2020-04-21 14:34:03,Twitter for iPhone,3,14,corona; 
The #coronavirus has an impact on everyone's mental health — including new stresses and anxieties. Here's how you can continue to practice social distancing and find places to relax in #NY19.  https://t.co/2Xda18T8j6,2020-04-20 20:33:24,Twitter for iPhone,3,17,corona; 
Rural communities must have a seat at the table. I led a letter with colleagues on both sides of the aisle urging the USDA to establish a #COVID19 task force focused on the needs of rural America.  https://t.co/HuuCzlJVHo,2020-04-20 14:00:26,Twitter for iPhone,3,8,covid; 
Upstate is home to counties towns villages and hamlets that make up our rural way of life. We must empower their response to the #COVID19 pandemic with rural-specific funding. https://t.co/Cfr6bbugC8,2020-04-19 16:02:06,Twitter for iPhone,10,31,covid; 
As Congressional leaders weigh future legislation it is imperative that rural-specific funding be included to make sure our upstate communities have the tools they need to respond to #COVID19. https://t.co/cBDIjJW94y,2020-04-18 21:09:37,Twitter for iPhone,6,14,covid; 
Reopening the country without a massive increase in testing is a dangerous proposition. Testing tracing &amp; understanding COVID-19 is what’s needed to ensure we are not putting lives at risk. We must use every tool to scale up our testing capacity. https://t.co/urxMLiHl23,2020-04-18 15:07:43,Twitter for iPhone,21,81,covid; 
Our rural communities must have their voices heard. I led a bipartisan bicameral letter to Ag Secretary Perdue urging the creation of a COVID-19 Rural Task Force to make sure the needs of rural upstate are heard &amp; met throughout this public health crisis. https://t.co/6U9ee1sSpv,2020-04-18 14:04:57,Twitter for iPhone,14,54,covid; 
#NY19 is home to nearly 5000 farms 96% of which are family-owned. The agriculture community is hurting during the #Coronavirus pandemic and I will continue to push to make every tool available so family farmers can find relief. https://t.co/U5ZD2ISyfR,2020-04-18 00:53:29,Twitter for iPhone,6,15,corona; 
We have unique needs in our rural communities and ought to have separate funding that allows our upstate villages &amp; hamlets to support their response to the #Coronavirus. I'll continue to highlight the need rural-specific funding &amp; relief.  https://t.co/05q4cLYCrr,2020-04-17 16:25:35,Twitter for iPhone,5,10,corona; 
Our small towns in upstate already have to compete with larger localities to get access to federal funding. Yesterday I wrote a letter with @SenGillibrand urging the inclusion of rural-specific funding in the next #COVID19 relief legislation. https://t.co/ntNdLr0yFY,2020-04-17 14:12:23,Twitter Web App,8,28,covid; 
Protecting &amp; supporting our farmers remains a top priority as our rural communities combat #COVID19. I worked to include disaster assistance for local producers in the CARES Act &amp; I'm leading efforts to make sure our small farmers can access EID loans. https://t.co/IuhUOLwnMs,2020-04-15 21:10:20,Twitter for iPhone,3,5,covid; 
Many parents are homeschooling for the first time during the #COVID19 outbreak. The Delgados are no exception—this is hard work! Thinking of all the other parents and teachers out there working to support our young people every day. https://t.co/HcjrqX2VZD,2020-04-15 14:12:11,Twitter for iPhone,21,108,covid; 
Family farming is a time-honored tradition in upstate and across #NY19 and our farmers who were already battling market consolidation are experiencing new challenges during the #COVID19 pandemic.,2020-04-14 17:09:49,Twitter for iPhone,4,15,covid; 
Access to testing is non-negotiable. We need tests to track #COVID19 &amp; keep our communities safe. I will continue to work alongside state &amp; local officials to ensure access to tests across our district &amp; advocate for add’l testing at the federal level. https://t.co/9E4ngMRtht,2020-04-14 14:09:43,Twitter for iPhone,9,26,covid; 
Our food hubs across #NY19 are experiencing dramatic changes due to the #COVID19 outbreak. I'm pushing to make sure our small farmers can access needed emergency SBA grants &amp; stay operational. https://t.co/yOuITuxYUH,2020-04-13 22:44:37,Twitter for iPhone,2,18,covid; 
