Just because Republicans wouldn’t agree to spend $3 trillion and give Democrats everything they demanded unemployed workers won’t get additional federal unemployment benefits and small businesses won’t get needed financial support. What a shame.,2020-09-10 20:43:19,Twitter for iPhone,65,152
It’s unfortunate Democrats won’t take yes for an answer. Once again they have taken the position it’s either their way or the highway for #coronavirus relief. https://t.co/785W1pyqwX,2020-09-10 20:43:19,Twitter for iPhone,439,618
Judges like Judge Ludwig who are committed to applying the law as written and not acting like superlegislators from the bench are critical in upholding our system of checks and balances.,2020-09-08 23:37:26,Twitter Web App,31,133
I was pleased to recommend and vote for Brett Ludwig today to fill an important judicial vacancy for the Eastern District of Wisconsin that remained open for far too long. A final confirmation vote happens Wednesday.,2020-09-08 23:37:26,Twitter Web App,100,402
America stands with the people and the courageous leaders of Serbia and Kosovo President Vucic and Prime Minister Hoti. https://t.co/sFnKmxcezk,2020-09-08 02:05:12,Twitter for iPhone,50,206
@Mike_Pence @DairylandPower @realDonaldTrump Thank you for coming to Wisconsin this #LaborDay. With all of your visits here you are certainly an honorary Badger  Mr. Vice President!,2020-09-07 21:15:38,Twitter for iPhone,25,136
Welcome to Wisconsin @VP. You are certainly an honorary Badger for as many times as you have visited Wisconsin. https://t.co/6HpwMxr7mb,2020-09-07 17:14:26,Twitter for iPhone,341,1908
Thank you to the Milwaukee Lawyers Chapter of @FedSoc for inviting me to speak at their meeting this week. It's wonderful to be back doing in-person public speaking events. I appreciate the questions and the desire to fight for our country. https://t.co/UEY6fSbDMo,2020-09-06 17:51:51,Twitter for iPhone,34,168
Hopefully both nations can build on this success to help achieve lasting peace security and prosperity for the benefit of their people and the entire region.,2020-09-04 17:56:37,Twitter Web App,12,56
I also applaud President Trump Ambassador Grenell and National Security Advisor O’Brien for their dedicated effort and brilliant strategy of concentrating on economic benefits to bring the two countries together.,2020-09-04 17:56:37,Twitter Web App,17,79
The economic cooperation agreement signed today between Serbia &amp; Kosovo is a really big deal.   I couldn’t be happier for the people of both nations. I applaud President Vucic &amp; Prime Minister Hoti for the political courage they displayed in achieving this historic breakthrough.,2020-09-04 17:56:37,Twitter Web App,119,376
As our nation responds to COVID-19 CA wildfires and Hurricane Laura in the Gulf states it is essential that Americans develop preparedness plans before disasters strike. For guidance &amp; best preparedness practices please visit https://t.co/1OsoU2k5qy #NationalPreparednessMonth https://t.co/aOztcsUXmO,2020-09-04 15:11:31,Twitter Web App,9,26
I welcome @JoeBiden into our state today. I hope he actually views the destruction and starts to understand how devastating it is. How continued protests create a siege and can shut down a city. I also hope he understands exactly what it took to stop the rioting in #Kenosha.,2020-09-03 16:42:46,Twitter Web App,225,809
Today we mark the 75th anniversary of #VJDay &amp; the end of #WWII. General MacArthur signed the surrender documents aboard the USS Missouri. MacArthur is a Milwaukee native and today his statue on the lakefront is surrounded by 2972 flags honoring MKE residents killed in WWII. https://t.co/tiO2Bmp8eU,2020-09-02 21:49:30,Twitter Web App,39,99
I would suggest an appropriate response to this assassination attempt would include the cancellation of the Nord Stream 2 gas pipeline. We must hold Russia accountable.,2020-09-02 20:15:02,Twitter Web App,141,626
I appreciate Germany’s treatment and diagnosis of the poison used against Alexei Navalny. This outrageous assassination attempt and violation of the international chemical weapons ban should not be rewarded with an expansion of Putin's malign influence in Europe.,2020-09-02 20:15:01,Twitter Web App,1307,4434
I am so appreciative of the words of unity and forgiveness spoken by Jacob Blake's mother Julia Jackson.  It's time to combine the proper role of law enforcement with people who want to end the violence. https://t.co/lOvBHvE1VB,2020-09-02 02:56:18,Twitter Media Studio,43,182
My message to law enforcement today in #Kenosha... Don’t be dispirited. The vast majority of Americans are for you. But at the same time it takes unity and healing from all of us. https://t.co/NwpuKK6JHT,2020-09-02 02:14:30,Twitter Media Studio,69,204
Thank you @realDonaldTrump for coming to Wisconsin today. There is no doubt that the decisiveness resolve and surge of resources helped bring peace to the streets of Kenosha. https://t.co/OaBiqbj0tp,2020-09-02 01:59:14,Twitter Media Studio,367,1108
In Kenosha with @realDonaldTrump thanking law enforcement and the National Guard for restoring peace after the devastating riots. https://t.co/NQYSDF6Kl7,2020-09-01 19:37:15,Twitter for iPhone,2414,8043
Now is the time to support law enforcement and the citizens of #Kenosha. It is not the time to encourage activities that will keep Kenosha boarded up and shut down. That is why I visited Kenosha on Saturday and why I will welcome President Trump on Tuesday.,2020-08-31 21:17:46,Twitter for iPhone,478,1606
Even if protests don’t result in riots lost lives and property destruction if not contained they can lengthen into a siege like we’ve seen in Portland &amp; Seattle denying the constitutional rights of business owners and their employees who are prevented from earning a living.,2020-08-31 21:17:45,Twitter for iPhone,303,1150
@POTUS provided decisive leadership and offered support for Kenosha that Governor Evers initially rejected. Instead the governor and his lieutenant gov. made statements leapt to conclusions and have participated in rallies that have done more to incite than calm the situation.,2020-08-31 21:17:45,Twitter for iPhone,377,1265
Throughout this rolling tragedy I’ve pleaded for calm but also for political leadership that provides the resolve and manpower to end the rioting and allow the safe reopening of downtown Kenosha.,2020-08-31 21:17:44,Twitter for iPhone,208,999
It is a sad state of affairs when @GovEvers asks the president of the United States to stay out of Wisconsin.,2020-08-31 21:17:44,Twitter for iPhone,4793,16708
Got a tour of Kenosha from @WI_Guard &amp; @KenoshaPolice No photos were allowed but what I saw: boarded up businesses and citizens unable to make a living.  It's a tragedy.,2020-08-30 20:41:58,Twitter Web App,2924,6782
I don't want to see anybody lose their life. I don't want to see the violence continue.  I don't want to see businesses burn down.  I don't want to see economic destruction.  I condemn it all.  #Kenosha #CNNSOTU https://t.co/gS91L6XpAh,2020-08-30 20:12:47,Twitter Media Studio,220,519
It’s a tragedy that 2 people had to lose their lives before Gov. Evers was willing to set aside politics and accept help. Going forward our focus should be on healing – for Jacob Blake for the lives turned upside down in the rioting and for the community of Kenosha. https://t.co/Q47pTdMpcy,2020-08-27 00:28:23,Twitter for iPhone,328,968
Going forward our focus should be on healing – for Jacob Blake for the lives turned upside down in the rioting and for the community of Kenosha. https://t.co/OeB65r2jIy,2020-08-26 18:16:38,Twitter Web App,23,95
Violence and chaos like we’ve seen the last three nights do nothing to advance justice and they drown out the voices of those protesting peacefully.,2020-08-26 18:16:38,Twitter Web App,79,307
My statement with @RepBryanSteil on @GovEvers decision to accept assistance in Kenosha from @POTUS:   It is a tragedy that two people had to lose their lives before Gov. Evers was willing to set aside politics and accept President Trump’s help to restore order in Kenosha.,2020-08-26 18:16:38,Twitter Web App,328,832
It is now three days since Jacob Blake was shot. I have repeatedly urged peace and I renew that call today. Anarchy and chaos will not advance justice and must be stopped. (2/2),2020-08-26 12:25:40,Twitter for iPhone,135,535
It is heartbreaking that the violence in Kenosha has now escalated to include the loss of human life.  Although it will not guarantee peace  @GovEvers should reconsider his refusal to accept @potus offer to send more personnel to restore order. (1/2),2020-08-26 12:24:56,Twitter for iPhone,857,2777
.@DHS_Wolf has been performing admirably under very trying circumstances. I look forward to receiving his nomination and giving it the consideration it deserves.,2020-08-26 01:17:54,Twitter for iPhone,94,386
.@potus @realDonaldTrump offered help for Kenosha Governor Evers turned it down. I hope Governor Evers doesn’t regret that decision. https://t.co/GUUCjrxazE,2020-08-26 00:50:56,Twitter Web App,1167,1912
In particular I ask Governor Evers to provide a sufficient presence of the Wisconsin National Guard to maintain order.    Peaceful protesting is a constitutionally protected form of free speech. Rioting is not. It must not be allowed to continue. #KenoshaRiots,2020-08-25 14:41:17,Twitter Web App,130,428
After another night of violence and destruction I again ask for demonstrators to remain peaceful and also call on elected officials charged with the responsibility to maintain safety and security in Wisconsin to devote the manpower to do so.,2020-08-25 14:41:17,Twitter Web App,259,826
Many Wisconsinites fought for the  Right to Try and @realDonaldTrump saw its value. It’s all about freedom. Thanks @RCamposDuffy https://t.co/XTLvj7H4re,2020-08-25 02:17:07,Twitter for iPhone,146,389
God Bless Archbishop @CardinalDolan. Thank you for your prayer for America. https://t.co/6F8oNRy3O5,2020-08-25 02:15:16,Twitter for iPhone,113,437
While emotions are understandably running high in the Kenosha community and elsewhere I urge any demonstrators to remain peaceful and give our justice system the opportunity to work.,2020-08-24 13:28:19,Twitter Web App,52,241
I support a full &amp; thorough investigation into the events leading up to yesterday’s officer-involved shooting in Kenosha.,2020-08-24 13:28:19,Twitter Web App,144,645
Thank you @USPS Postmaster General DeJoy for your testimony today. The Democrats have put you in the cross hairs of another hyperbolic false attack perpetrated to scare people and gain political advantage. https://t.co/ZmULg7IlQi,2020-08-21 20:08:08,Twitter Media Studio,398,826
Today's #HSGAC hearing on @USPS finances and operations put a spotlight on false narratives being pushed by Democrats.  Did you know USPS earned $1.5 billion more during COVID-19 than during the same period last year? https://t.co/nOm2tt3hJq,2020-08-21 19:13:39,Twitter Web App,247,370
It takes extraordinary courage to be a Russian and oppose the criminal Putin regime.  Litvinenko Nemtsov Politkovskaya Kara-Murza the Skripals and now possibly Alexei Navalny.  This is not how a civilized government acts.  Wishing Mr. Navalny a speedy recovery.,2020-08-20 17:43:46,Twitter Web App,327,1503
.@SenGaryPeters wants to keep the American people in the dark by not letting us ask Jonathan Winer about his correspondence with Steele. Winer admitted to destroying his Steele-related records &amp; now Peters wants to make sure Winer isn’t questioned. https://t.co/bEQoD2Y1Bx,2020-08-20 14:54:30,Twitter for iPhone,142,193
.@SenGaryPeters is again trying to undermine my investigation with absurd process arguments to delay or derail our subpoena of fmr @StateDept official Jonathan Winer who destroyed his correspondence w/Chris Steele. What is Sen. Peters afraid we'll learn? https://t.co/bEQoD2Y1Bx,2020-08-20 14:50:08,Twitter for iPhone,540,691
As we move into a #5G world Open RAN holds a lot of promise. Great to see @AjitPaiFCC bring experts together for a productive and educational conversation on this important topic. #WinTheRaceTo5G #5Geconomy https://t.co/KPE1SWzq11,2020-08-19 21:02:11,Twitter Web App,34,70
I look forward to Postmaster General DeJoy testifying at our virtual hearing this Friday. The Postal Service has had significant financial problems for years and it is important for everyone to fully understand its current fiscal challenges. https://t.co/y6Mq4D47Yp,2020-08-18 21:33:36,Twitter for iPhone,144,345
BTW the history purpose and goals of my investigations into Obama administration corruption is all in my open letter. I’m just trying to uncover and help reveal the truth. It would be nice if more in the media were similarly dedicated. https://t.co/FDQMO0y2Kd,2020-08-17 17:01:17,Twitter Web App,1155,2715
The fact is VP Biden met with Hunter’s business partner Devon Archer only 6 days before Devon joined Burisma’s board and only 27 days before Hunter joined. What DID they discuss at the White House? Inquiring minds want to know.,2020-08-17 16:59:54,Twitter Web App,980,2442
We are supposed to believe VP Biden was oblivious to what Hunter was up to?  VP Biden claims “I have never spoken to my son about his overseas business dealings.”  To quote VP Biden again “Come on man.” How believable is this denial?,2020-08-17 16:54:57,Twitter Web App,966,2561
In fact the Burisma deal was so concerning to Hunter’s business partner (Secretary of State Kerry’s stepson Christopher Heinz) and State Department officials that none of them wanted any part of it.,2020-08-17 16:54:20,Twitter Web App,927,2284
The truth is VP Biden and Hunter were involved in conduct that created a real quandary for U.S. and Ukrainian officials who wanted to fight corruption.,2020-08-17 16:51:15,Twitter Web App,1043,2542
The reaction to my series of tweets regarding @JoeBiden and Hunter’s glaring Ukrainian conflict of interest on Friday and Saturday is interesting.  To paraphrase Jack Nicholson in “A Few Good Men” it looks like some people simply can’t handle the truth.,2020-08-17 16:50:13,Twitter Web App,7685,17204
This scheme was hatched and implemented within the span of 1 month and only 2 months after more than 100 Ukrainians lost their lives revolting against corruption. The media covers for VP Biden by repeatIng “no evidence of wrongdoing or illegal activity.” What do you think? (10),2020-08-15 14:50:42,Twitter Web App,1864,4202
An interesting article in @FDRLST quotes a study from Watchdog Research showing a similar sized US company typically pays board members $55000 to $83000 a year. Hunter was paid 7.2 to 10.9 times that amount. Again great gig if you have the right name. (9),2020-08-15 14:48:52,Twitter Web App,1609,3629
BTW the average American household works hard to earn 10% of what Hunter Biden and his firm were paid by Burisma. It’s nice to have the right last name and friends in high places. (8),2020-08-15 14:47:42,Twitter Web App,1286,3162
And how much did Zlochevsky pay Hunter and Devon for that protection?  Public reports say Hunter and his firm were paid $3 million over the next 5 years - more than $600000 per year - for doing what? (7),2020-08-15 14:46:20,Twitter Web App,1376,3121
BTW don’t you think that Mykoloa Zlochevsky would have made sure Ukrainian officials desperate for U.S. support knew that Hunter Biden was on his board? I’ll bet he did. The obvious message to those Ukrainian officials: “If you want U.S. support leave Burisma alone.” (6),2020-08-15 14:44:38,Twitter Web App,1247,3035
Fifteen days later on May 13 2014 guess who joins the board of Burisma?  That’s right Hunter Biden.  Another sheer coincidence? (5),2020-08-15 14:43:52,Twitter Web App,1939,4387
Six days later British officials seize the London bank accounts of Zlochevsky containing $23 million.   I guess that might be a sign that Obama administration officials were correct to view him as highly corrupt. (4),2020-08-15 14:43:23,Twitter Web App,1342,3113
The very next day Devon Archer joins the Board of Burisma a Ukrainian gas company owned by Mykoloa Zlochevsky a Ukrainian oligarch generally viewed as highly corrupt.   A mere coincidence? (3),2020-08-15 14:42:36,Twitter Web App,1485,3368
Five days later on April 21 2014 VP Biden travels to Ukraine and news reports describe him as the “public face of the administration’s handling of Ukraine” (2),2020-08-15 14:41:22,Twitter Web App,1549,3399
The timeline of @JoeBiden and Hunter’s multimillion-dollar Ukrainian conflict of interest is revealing.  Only two months after revolution to rid Ukraine of corruption Hunter’s business partner Devon Archer meets VP Biden at White House.  Doesn’t that seem a little odd? (1),2020-08-15 14:41:01,Twitter Web App,14031,26461
More to come. Stay tuned...,2020-08-14 18:40:56,Twitter Web App,727,2424
13. What does @JoeBiden know about financial benefits his brothers and sister-in-law have obtained because of their relationship to him?,2020-08-14 18:34:36,Twitter Web App,1014,2339
12. What does @JoeBiden know about Hunter Biden’s business dealings in China?,2020-08-14 18:34:27,Twitter Web App,925,2199
11. What skills or knowledge did Hunter Biden possesses that qualified him to be on Burisma’s board and receive $50000 to $166000 per month for his and his partner’s services?,2020-08-14 18:34:13,Twitter Web App,1076,2428
10. Why do you believe Burisma recruited and paid Devon Archer whom @JoeBiden met at the White House in 2014 and Hunter Biden to be on its board?,2020-08-14 18:33:59,Twitter Web App,800,1960
9. When did @JoeBiden first become aware of how much Hunter Biden was being compensated by Burisma?,2020-08-14 18:33:41,Twitter Web App,838,2026
8. When did @JoeBiden first become aware that Hunter Biden joined the board of Burisma?,2020-08-14 18:32:07,Twitter Web App,823,2041
7. Was @JoeBiden aware in April 2014 that Hunter Biden joined the board of Burisma?,2020-08-14 18:31:47,Twitter Web App,809,2014
6.Does @JoeBiden believe Mykoloa Zlochevsky and his company Burisma are corrupt?,2020-08-14 18:31:21,Twitter Web App,783,1995
5.When did @JoeBiden first become aware of the reputations for corruption of Burisma and its owner Mykoloa Zlochevsky?,2020-08-14 18:31:09,Twitter Web App,885,2096
4.Was Hunter Biden aware that British officials had seized the bank account of Burisma owner Mykoloa Zlochevsky?,2020-08-14 18:30:55,Twitter Web App,933,2199
3.Was @JoeBiden aware that Burisma’s owner Mykoloa Zlochevsky was generally viewed as a corrupt oligarch and that his London bank account containing $23 million had been seized by British officials only 15 days before Hunter Biden joined the board of a company he owned?,2020-08-14 18:30:42,Twitter Web App,1060,2364
2.Was @JoeBiden aware that Devon Archer joined the board of Burisma six days after his April 16 2014 White House meeting with Archer?,2020-08-14 18:30:27,Twitter Web App,1094,2479
1.Why did @JoeBiden meet with Hunter’s friend and fellow Burisma board member Devon Archer at the White House on April 16 2014? Was anything related to Ukraine Hunter Biden or Burisma discussed?,2020-08-14 18:30:15,Twitter Web App,1425,2858
Here are some important questions the mainstream media should be asking and @JoeBiden should be answering:,2020-08-14 18:29:58,Twitter Web App,967,2406
Even Secretary of State Kerry’s stepson knew Hunter’s involvement with Burisma was problematic severing business ties with Hunter and making clear his reason why. https://t.co/YlSP79Atrr,2020-08-14 18:29:29,Twitter Web App,1451,2832
Ukrainian officials desperate for U.S. support got the message:  If you want U.S. support don’t touch Burisma.,2020-08-14 18:28:21,Twitter Web App,927,2430
Two months after Ukraine’s Revolution of Dignity - a revolution against corruption - Hunter seized a multimillion-dollar opportunity available to him because his last name was Biden.,2020-08-14 18:28:00,Twitter Web App,1133,2701
My investigations into multiple corruptions during the Obama administration have been ongoing for years. I didn’t target @JoeBiden his actions and glaring conflict of interest yielding millions of dollars for Hunter from a corrupt Ukrainian gas business demanded scrutiny.,2020-08-14 18:27:24,Twitter Web App,7326,13543
.@GovEvers needs to help out-of-work Wisconsinites get an additional $400/week in unemployment by simply saying yes to @realdonaldtrump’s executive order. All the info he needs to accept federal UI support is right here: https://t.co/pXHPmOu798. My office stands ready to assist.,2020-08-13 16:59:49,Twitter Web App,164,294
In our increasingly connected world it is imperative that our communications networks are secure and free of equipment that poses a national security threat. The Ensuring Network Security Act will help accomplish that. https://t.co/WRMLPiX9gL,2020-08-12 19:12:17,Twitter for iPhone,102,226
Democrats have initiated a coordinated disinformation campaign in an effort to personally attack myself and Sen. @ChuckGrassley but this will not obstruct our investigation. We will find the truth and get answers for the American people. https://t.co/CKrVOwO54X,2020-08-10 19:30:00,Twitter Web App,1383,2749
We will not be deterred by these coordinated and despicably false attacks. We intend to uncover the truth and make it public.,2020-08-10 18:08:51,Twitter Web App,252,704
The only way I can counter these personal political attacks is to tell the truth and continue to conduct my committee’s investigations with the utmost integrity and transparency. https://t.co/FDQMO0y2Kd,2020-08-10 18:08:51,Twitter Web App,204,596
Today I have released an open letter regarding the Democrats’ combative and false comments regarding my committee’s investigation. https://t.co/2sQ5VkKV66,2020-08-10 18:08:50,Twitter Web App,1176,2080
It is outrageous that Officer Mensah his loved ones and the greater Milwaukee community should endure such violence and intimidation. https://t.co/FeSiCYiqNk,2020-08-10 15:55:28,Twitter Web App,329,617
@SenBlumenthal @SenBlumenthal’s twisting of classified briefings and repeating of false news reports is beyond the pale. https://t.co/77fEIw12yT https://t.co/MGG261uz16,2020-08-08 18:59:07,Twitter for iPhone,10,25
7/7 The only ones responsible for furthering Russian disinformation to interfere in our election are the Democrats in Congress and the Biden campaign and the media that is willingly amplifying their lies. They should all be ashamed.,2020-08-08 18:49:22,Twitter for iPhone,2985,7802
6/7 Our investigation is focused on documents and officials from government agencies and a U.S. Democrat-linked lobbying firm.,2020-08-08 18:49:22,Twitter for iPhone,874,2707
5/7 That wasn’t enough for Dems to use against us so they continued to push CIA for info to try to derail our investigation. To my knowledge CIA has not responded to THEIR requests.,2020-08-08 18:49:21,Twitter for iPhone,805,2577
4/7 Ranking member Peters asked me to arrange an intelligence briefing months ago. We did and were told there was no new info to brief on.,2020-08-08 18:49:21,Twitter for iPhone,784,2548
3/7 It is a flat-out lie that I asked for the CIA to brief our committee and that they refused. We’ve already been briefed repeatedly on these issues Democrats simply didn’t like what they heard.,2020-08-08 18:49:21,Twitter for iPhone,1099,3048
2/7 It is a flat-out lie that I received the documents from Ukrainians that Democrats keep claiming. And they know it. It is unconscionable that Democrats and the press continue to report it.,2020-08-08 18:49:20,Twitter for iPhone,1409,3557
1/7 @SenBlumenthal’s twisting of classified briefings and repeating of false news reports is beyond the pale. https://t.co/TThKfDSnIX,2020-08-08 18:49:20,Twitter for iPhone,3873,7058
On the 12th anniversary of Russia’s invasion of Georgia the US continues to stand with Georgia in the face of Russian aggression. Russia must withdraw its forces to pre-conflict lines.,2020-08-07 20:00:10,Twitter for iPhone,539,1966
#HeyGoogle &amp; @sundarpichai  Your company wields a considerable amount of power. We need assurances that you will not allow any sort of electioneering or use of politically-biased algorithms on your platform.  Sincerely @SenRonJohnson @SenMikeLee   https://t.co/F9FPw4D1nO,2020-08-07 17:01:14,Twitter Web App,155,318
✅Fact: Over a trillion dollars still hasn't been spent from the first  coronavirus relief package. https://t.co/PiTUo9fFHi,2020-08-07 00:40:00,Twitter Media Studio,160,231
When you encourage disdain for police you encourage criminals.  When you do little or nothing to stop riots you unleash anarchy.  Warning: the following video contains graphic content. It was shown during today's #HSGAC hearing. https://t.co/a9pKXIULlx,2020-08-07 00:05:00,TweetDeck,200,315
We need a common sense approach to another round of loans for the #PaycheckProtectionProgram. We need transparency and to target the program to those who really need it. https://t.co/rKjsqhZonR,2020-08-06 23:30:00,Twitter Media Studio,37,87
We need the right tools to grow our economy.  The $600/week in extra unemployment is only incentivizing people to stay on the sidelines. https://t.co/QjRt2UmUF3,2020-08-06 20:25:30,Twitter Media Studio,280,712
We still haven't spent (or even obligated) $1.2 trillion of coronavirus relief money.  So why don't we look at what we spent what's left over what worked what didn't and then really target financial relief to the people and businesses that truly need it? https://t.co/OuSnHAHfvz,2020-08-06 18:57:45,Twitter Media Studio,137,295
Happening Now: Hearing with @DHS_Wolf to discuss the deployments of @DHSgov personnel to recent protests. Live stream available here: https://t.co/LbzrLriLf6,2020-08-06 14:00:07,Twitter Web App,39,56
