❓for Dems  Why did the press know more about the content of allegedly classified material than my committee?  Are you more interested in headlines &amp; scoring political points than actually confronting the issue of foreign interference in our elections?https://t.co/HdLTGmpTvF,2020-08-05 20:04:29,Twitter Web App,154,265
#OTD Oak Creek’s Sikh temple was the site of a deadly targeted attack. Just this March one of the critically wounded a beloved religious teacher named Baba Punjab Singh passed from his injuries. We honor his legacy of love  by standing against hate. #RememberOakCreek https://t.co/bCYEOKE4f7,2020-08-05 16:55:35,Twitter Web App,10,42
Dear @SpeakerPelosi @SenSchumer @RepAdamSchiff @MarkWarner   Stop playing political games with election security intelligence. It is simply too important.   Sincerely @SenRonJohnson &amp; @ChuckGrassley   P.S.: Here's the entire letter➡️ https://t.co/9w25uJY34m,2020-08-05 16:33:59,Twitter Web App,211,350
We are starting to fill in the pieces of the puzzle. The American people will finally be able to get the full picture of the corruption that occurred in the 2016 presidential transition process. https://t.co/As8FZ2RmrC,2020-08-03 19:20:12,Twitter Media Studio,1597,3295
Last week Republicans went to the Senate floor with serious proposals to help workers facing a lapse in federal unemployment benefits. Democrats rejected every Republican proposal. They are not serious about solving the problem they simply want a political issue. https://t.co/vv6KYdqWTl,2020-08-03 19:01:32,Twitter Media Studio,450,608
Herman Cain was an inspiration and true patriot.  My condolences to his family and many friends.   https://t.co/K5do0Em14o,2020-07-30 22:01:41,Twitter for iPhone,255,1012
I’ll be going to the Senate floor this afternoon to ask my colleagues to pass this urgent reasonable solution by unanimous consent. I hope the Senate will rise to the occasion.,2020-07-30 14:26:17,Twitter Web App,10,39
States would be given two options for how to help their affected residents. 1) a flat $200/week or 2) an amount (not to exceed $500) to “plus up” unemployment benefits to 2/3 of a person’s lost wages.,2020-07-30 14:26:17,Twitter Web App,12,43
Our bill would extend and modify the unemployment insurance benefits from the CARES Act. The unemployment program would be extended through December 31 2020.,2020-07-30 14:26:16,Twitter Web App,8,15
Introduced a bill w/ @SenatorBraun that doesn't harm small businesses by incentivizing unemployment but recognizes the assistance needed for Americans who are facing unemployment due to state and local government mandated shutdowns. https://t.co/duyYmgJRRM,2020-07-30 14:26:16,Twitter Web App,30,77
Democrats have escalated their rhetoric in what appears to be an attempt to silence our investigation.   As I‘ve said from the beginning I‘m simply attempting to find the truth.   What are they afraid I might find? https://t.co/nMKQGlmHL7,2020-07-29 19:17:03,Twitter Web App,449,760
These attacks will not deter me; they only increase my curiosity. Our investigation will continue.   https://t.co/rKsuTKGX8j,2020-07-28 17:43:53,Twitter Web App,429,823
Must read @Newsweek: This Yale professor says physicians who have been using #HCQ are truly heroic. They have done what the science shows is best for their patients often at great personal risk. https://t.co/vRlzOeo8RP,2020-07-27 19:12:35,Twitter for iPhone,920,1266
Bernell Trammell was known to many in Milwaukee.  My condolences to his family and friends.  I hope they get answers and justice soon. https://t.co/XciQwmlMuJ,2020-07-25 03:06:44,Twitter for iPhone,587,1120
We should welcome additional federal resources to help reduce violent crime and drug trafficking. No one is talking about sending an occupying force. It's disappointing that some are suggesting this is anything other than an effort to combat crime. https://t.co/zzQtB95ZG7,2020-07-24 21:30:53,Twitter Web App,194,440
Let this sink in.   We’ve authorized enough #COVID19 relief spending to replace 13.5% of annual economic output and more than $1 trillion of it hasn’t yet been spent or obligated.  No more blank checks.   https://t.co/osHNEKDZve,2020-07-24 18:53:51,Twitter Web App,192,449
...trying to lecture about foreign influence and using fear of it as a weapon against investigations they’re scared of.  https://t.co/LLFRFExZXr,2020-07-23 22:02:55,Twitter Web App,111,256
It’s astounding to watch the same Democrat Party that paid for and promoted Russian disinformation in the 2016 election (footnote #350) https://t.co/2vea6Fr0gb,2020-07-23 22:02:55,Twitter Web App,297,612
Congress authorized nearly $3 trillion in  #COVID19 relief and we're talking about spending more.   But more than $1 trillion still hasn't been spent or obligated.   Congress should not be handing out blank checks until we see what worked &amp; what didn't. https://t.co/IGrDolrkT7,2020-07-23 20:47:40,Twitter Web App,164,321
We ask Americans: if you see something say something.  But @CISAgov cannot do the same.  This legislation gives them authority necessary to reach out and warn owners of critical infrastructure before they become victims of cyberattack.#NDAA https://t.co/wM4L0LmoVH,2020-07-22 20:54:41,Twitter Web App,21,51
Businesses of all sizes remain either totally or significantly shut down months into the coronavirus pandemic. #PPP provided short-term financial support but now Congress needs to think outside the box to help.  https://t.co/i2lexeahun,2020-07-22 01:03:05,Twitter Web App,16,57
Congress needs to think outside the box.  #PPP loans provided short term help but many businesses remain significantly or totally shut down by the pandemic.   This idea helps reopen businesses while giving employees a stake in their success.  https://t.co/i2lexeahun https://t.co/6tizmQk6WE,2020-07-21 21:43:42,Twitter Web App,16,43
My thoughts and prayers are with the family and friends of John Lewis - a courageous leader who will be missed by all who served with him in Congress and throughout America. -rj,2020-07-18 15:10:20,Twitter for iPhone,29,238
The economic devastation of widespread shutdowns is real. Government should not further the damage by incentivizing people not to work.  Let's get smart about helping America and Wisconsin get back to work. https://t.co/nVNJpeXTqY,2020-07-14 01:08:09,Twitter for iPhone,146,325
Do you know a Wisconsinite making a difference through adoption? Nominate them by July 15 for @CCAInstitute's Angel in Adoption award. https://t.co/vnFzHbOn8m,2020-07-13 19:29:11,Twitter Web App,6,26
ICYMI: Rather than allow another paid day off for federal workers to pass without debate or vote I wanted to start a discussion. The original amendment is being withdrawn and I'm introducing a modified one that preserves Columbus Day and taxpayer dollars. https://t.co/fzs3e2IPFA,2020-07-06 23:55:00,TweetDeck,51,188
God bless America. 🇺🇸 Land that I love. Stand beside her. Happy #4thofJuly https://t.co/HBBinCbuvK,2020-07-04 13:11:26,Twitter for iPhone,61,309
The evidence for the effectiveness of HCQ in treating #COVID is beginning to mount.  Why was #HCQ politicized?  Sure sounds like it can save lives. https://t.co/aloj0EvVtB,2020-07-03 14:43:09,Twitter for iPhone,184,309
Modifying my substitute amendment to preserve both Columbus Day and the tax dollars of hard-working Americans. https://t.co/iB9Zkcm9DL,2020-07-03 13:02:08,Twitter Web App,1177,5070
It is not deprecating Christopher Columbus’ achievements or expressing any value judgement regarding his place in history. I do not support efforts to erase America’s rich history — not the good the bad or the ugly.,2020-07-02 00:57:54,Twitter for iPhone,49,218
My sole motivation for offering this amendment to the Juneteenth bill is to prevent giving federal workers another paid holiday and incurring the additional cost.,2020-07-02 00:57:53,Twitter for iPhone,39,200
We support celebrating emancipation with a federal holiday but believe we should eliminate a current holiday in exchange.  We chose Columbus Day as a holiday that is lightly celebrated.,2020-07-02 00:57:52,Twitter for iPhone,58,287
In response to a bipartisan effort to give federal workers another day of paid leave by designating Juneteenth a federal holiday we have offered a counterproposal that does not put us further in debt.,2020-07-02 00:57:51,Twitter for iPhone,247,914
Here's something we can all agree on.   Proud to announce legislation w/ @SenatorBaldwin to rename the @USPS in Port Washington after #WWII  veteran Joe Demler. He worked there nearly 4 decades after surviving a Nazi POW camp. Every Day is a Bonus.  https://t.co/FtkGutDsdt https://t.co/v98hR8v9Ko,2020-07-01 17:13:50,Twitter Web App,37,150
I’m disappointed Senate Dems objected to passing the Luke &amp; Alex School Safety Act. The parents of Parkland school shooting victims worked tirelessly to find nonpartisan commonsense solutions to prevent future tragedies. The School Safety Clearinghouse was a great first step. https://t.co/4RjDE63rpm,2020-07-01 01:49:20,Twitter Media Studio,68,124
It's time to force some fiscal discipline on Congress and end the cost and chaos of government shutdowns. We are offering an amendment to the #NDAA to Prevent Government Shutdowns. https://t.co/4Xp7pWqj9y,2020-07-01 00:32:00,TweetDeck,53,121
Elected officials have become skilled at circumventing the debt ceiling and mortgaging our children’s future with impunity. That's why I'm working with @SenatorLankford to offer the Preventing Government Shutdowns Act as part of the #NDAA. https://t.co/4Xp7pW8Ii0,2020-06-30 20:31:00,TweetDeck,27,71
A big win today for #SchoolChoice and religious liberty. Today's #SCOTUS ruling is about fairness and freedom. https://t.co/ru5WiGqUKW,2020-06-30 20:08:55,Twitter Web App,57,141
WWII hero James "Maggie" Megellas accomplished many things in his 103 years (most decorated officer of 82nd Airborne). Medal of Honor recipient was not one of them. Megellas passed away in April but I'm proud to say we offered an amendment to keep trying for his #MedalofHonor https://t.co/aun0rdXKd7,2020-06-30 20:04:13,Twitter Web App,17,55
@JosephL28080870 Good to hear!,2020-06-28 23:05:33,Twitter for iPhone,0,2
I have heroes on my staff.  For the past 9 months my Comms Dir. has been working while coping with kidney failure.  Another staffer gave him the gift of life.  Their surgeries were postponed due to #COVID but now they are both finally on the road to recovery. #DonateLife https://t.co/sQndenfj19,2020-06-28 13:41:49,Twitter for iPhone,252,1313
This is great news. As a former manufacturer I have long believed there are multiple ways to achieve your full human potential. A college degree is only one of many paths. https://t.co/fbCtp5htN9,2020-06-27 14:43:24,Twitter for iPhone,229,655
That #FridayFeeling after finishing the Joseph Project and interviewing for a job... “It’s the first time I’ve completed anything. It feels good!” #JosephProjectWI https://t.co/iOfmsfBi2I,2020-06-27 01:53:14,Twitter for iPhone,30,111
Our first Joseph Project class in this new normal may look a little different but the mission is the same. We are connecting people with jobs. Class 90  had interviews this week. #JosephProjectWI https://t.co/J3VBySJ6w1,2020-06-26 23:48:26,Twitter for iPhone,18,66
@RepGallagher Congratulations Mike!,2020-06-25 22:54:43,Twitter Web App,0,8
We are paying the price for this lack of clarity. As we develop data &amp; models to address the demand during this pandemic that information needs to be captured and put to immediate use updating and redesigning the structure and management of the SNS. https://t.co/VJ0elc6FNU,2020-06-24 20:20:38,Twitter for iPhone,5,26
It’s not from a lack of dedicated individuals working within the agencies or with the Strategic National Stockpile. It seems to be a more pervasive problem of a lack of clarity and understanding of exactly what the SNS’s role is and what it should be.,2020-06-24 20:20:38,Twitter for iPhone,5,20
Preparing for today's senate hearing on the Strategic National Stockpile I assumed we'd be able to quickly obtain the list of items that should be held there. We quickly found out that those lists do not exist or certainly are not made available to Congress or the public.,2020-06-24 20:20:37,Twitter for iPhone,18,37
HAPPENING NOW:  Hearing to discuss the mission of the Strategic National Stockpile its role in the response to #COVID19 and how we can enhance preparedness efforts in the future. https://t.co/VJ0elc6FNU,2020-06-24 14:05:38,Twitter Web App,11,20
It should not take government months sometimes years to approve something that takes ~1 hour to deploy- pleased to see @BrendanCarrFCC doing great work at the @FCC to cut needless government red tape around #5G infrastructure deployment #wintherace #5Geconomy #ruralbroadband https://t.co/Is2f2SUxYi,2020-06-23 18:00:54,Twitter Web App,36,89
Milwaukee has one of the longest running #JuneteenthDay celebrations in the nation. Since the official event was canceled due to #COVID here's the link to a virtual celebration from 12-2 pm CT today: https://t.co/Q2XuzdmJVW,2020-06-19 14:24:27,Twitter for iPhone,3,18
Tomorrow is Juneteenth Day a day that signifies the end of slavery. June 19 1865 was the day the last remaining slaves heard the news of their freedom. The Wisconsin capitol will fly a Juneteenth flag tomorrow.  https://t.co/RX0LQ6RLDb,2020-06-19 00:12:00,Twitter for iPhone,15,67
This resolution reaffirms our enduring alliance. https://t.co/lqcrqoyQtb,2020-06-18 20:43:06,Twitter Web App,1,7
Pleased to introduce a resolution w/@SenatorShaheen celebrating the 140th anniversary of establishing diplomatic relations with Romania🇺🇸🤝🇷🇴  America applauds Romania's continuing pursuit of democratic social &amp; economic progress.,2020-06-18 20:43:06,Twitter Web App,5,21
It’s important to recognize that an elective procedure for one person may be somebody's life saving diagnostic or treatment. We really should try and keep as much of our economy open as possible especially health care systems. https://t.co/vofBZCN4IX,2020-06-11 23:55:00,Twitter Media Studio,26,67
Talking with @SquawkCNBC about the importance of re-opening the American economy and the need to ensure stimulus funding makes it to the workers and businesses who need it most. https://t.co/RUcMBvwu0B,2020-06-11 21:41:00,Twitter Media Studio,15,51
As part of the Great American Outdoors Act we introduced a bipartisan amendment that would delist the gray wolf from the endangered species list in Wisconsin and other states in the western Great Lakes region. https://t.co/5dDSW8YGzs,2020-06-11 17:48:03,Twitter Web App,19,57
HAPPENING NOW: #HSGAC hearing with @FEMA_Pete to discuss the government’s procurement and distribution strategies for #COVID response.  https://t.co/rVbRp7BWe7,2020-06-09 14:07:54,Twitter Web App,8,16
Tomorrow we will hold a hearing with @FEMA_Pete @DeptofDefense @HHSGov to discuss the government’s procurement and distribution strategies in response to #COVID19. Watch it here: https://t.co/Z5zz2t9X60,2020-06-08 21:32:37,Twitter for iPhone,9,29
In response to the violence that played out over the weekend in cities across the country... https://t.co/uuX5mOYr4k,2020-06-01 17:21:01,Twitter Media Studio,2247,8210
While the solution isn’t rioting and burning down buildings and hurting other innocent people I sure wish in this case the wheels of justice will turn a little quicker and hopefully the rioting will stop. I understand the frustration. #GeorgeFloyd https://t.co/RaXnQSwXkD,2020-05-29 16:52:28,Twitter Media Studio,63,195
Moving forward with getting the truth for the American people. https://t.co/krn97reaxv,2020-05-28 18:32:41,Twitter Web App,2214,8155
While in-person Memorial Day parades and ceremonies have been cancelled we still reflect on the great cost of freedom and resolve to not take for granted what our service men and women through the ages have fought and died for. God Bless you and your families this #MemorialDay https://t.co/cYR5Y65ObU,2020-05-25 14:01:51,Twitter for iPhone,28,145
With two Great Lakes and a rich maritime history today Wisconsinites celebrate #NationalMaritimeDay. Did you know during #WWII 28 Navy submarines were built in Manitowoc? Learn more @WIMaritime museum. https://t.co/9rWFykI97U,2020-05-22 19:16:24,Twitter Web App,16,62
Wisconsin is proud of its rich shipbuilding &amp; maritime history.  Bordered on 3 sides by commercially navigable waterways our state has benefited greatly over the centuries from water transportation.  #NationalMaritimeDay https://t.co/y7xQk0wG91,2020-05-22 19:10:22,Twitter Web App,1434,5757
Before we talk about another round of spending in response to #coronavirus let's analyze what we've already done and why $2 trillion of the $3 trillion authorized has yet to be spent. https://t.co/b6Grlqv4CB,2020-05-22 01:01:08,Twitter Media Studio,1507,5227
My committee is focused on #covid but there’s no reason we can’t continue to seek the truth for the American people. Don’t know why Democrats would object to that. https://t.co/RH4UBjc34K,2020-05-21 21:15:00,Twitter Media Studio,1574,5495
Democrats are having a hissy fit over a subpoena that should be no big deal. We're just trying to get to the truth about #burisma. Now with yesterday's vote we can finally get some information. https://t.co/UGJNMNxwnK,2020-05-21 18:00:00,Twitter Media Studio,1998,6159
Who is Blue Star Strategies and why did we need this subpoena vote today? The American people have a right to know. They've been kept in the dark for too long.  https://t.co/syx1TvaiGT https://t.co/b15a8JZ6aY,2020-05-21 02:01:41,Twitter Media Studio,1808,5098
My committee just wants to get to the truth. The vast majority of our work is #Covid_19. This subpoena didn't have to be a big deal. https://t.co/syx1TvaiGT https://t.co/LJP2vpeWsj,2020-05-21 01:59:10,Twitter Media Studio,1583,5196
Agree. That's why I've held 3 hearings or roundtables on these issues to date with a fourth planned for early next month. Read my letter to Senate Democrats here: https://t.co/pu8lWXJQI0 https://t.co/C2SM9ECsHF,2020-05-20 00:37:54,Twitter Web App,34,78
One thing we have found out from declassified information is that the FBI was ready to close the file on General Flynn on Jan. 4 because they had found nothing. That is until James Comey’s office called down and said let's keep this open. https://t.co/d5MpN39muE,2020-05-18 12:58:00,Twitter Media Studio,2039,5902
.@jaketapper asked what I thought when you saw packed bars in Wisconsin?  I see Wisconsinites celebrating a little freedom...but we still need to be responsible and take this disease seriously. https://t.co/oXkNOQ6LaJ,2020-05-18 00:57:00,Twitter Media Studio,154,628
Talking with @jaketapper on @CNNSotu about the recently declassified list of Obama-era officials who were behind the unmasking of Michael Flynn. https://t.co/wMiBYfdIZe,2020-05-17 23:42:16,Twitter Media Studio,1666,5168
Thanks @realDonaldTrump https://t.co/CcckBIkyFt,2020-05-16 18:45:58,Twitter for iPhone,1697,6006
Looking forward to it. Lots that needs to be discussed. https://t.co/S3RFg5gKzc,2020-05-16 16:52:23,Twitter for iPhone,17,62
On this #PeaceOfficersMemorialDay we honor and remember the 4 Wisconsin police officers added to the National Law Enforcement Officers Memorial this year: William McGinty Matthew Rittner Fred Wiercyski and John Hetland #PoliceWeek2020  https://t.co/fZ44zoqlWV,2020-05-15 19:41:18,Twitter Web App,7,50
We are noted in this country for the peaceful transition of power and respecting voters' wishes. Members of the Obama administration did not respect that tradition. https://t.co/iBoY9F2KLN,2020-05-14 23:47:00,Twitter Media Studio,2222,3960
Celebrating the charter schools in Wisconsin and around the country for #CharterSchoolsWeek. Thank you for going #AboveAndBeyond for students and families...especially during the COVID-19 crisis.,2020-05-14 20:23:09,Twitter Web Client,29,111
As Reverend Jeremiah Wright once said the chickens are coming home to roost. https://t.co/vrm5OBCZ0m,2020-05-14 18:37:18,Twitter Media Studio,395,1079
I urge the state legislature and @GovEvers to recognize this fact and work together to implement a set of guidelines that lets people start to go back to work and resume their lives in as safe a manner as possible.,2020-05-14 17:12:58,Twitter Web App,24,117
I have always believed the vast majority of our economy should be deemed essential and continue to operate with appropriate safety measures.,2020-05-14 17:12:58,Twitter Web App,63,261
Attorney General William Barr and Acting Director of National Intelligence @RichardGrenell are heroes. They are patriots. They are being unfairly attacked right now mercilessly attacked. These gentlemen realized that this is a threat to our democracy. @BretBaier https://t.co/SvEyKFRNQk,2020-05-14 00:23:30,Twitter Media Studio,583,1567
We are making this information public and pushing for additional relevant disclosures because the American people have a right to know the full truth. https://t.co/solZZ1StlL,2020-05-13 19:30:22,Twitter for iPhone,1889,3974
Today Senator @ChuckGrassley and I received a list of individuals who requested the unmasking of Lt. General Michael Flynn and others who received access to that information.,2020-05-13 19:30:21,Twitter for iPhone,793,2499
Thank you @RichardGrenell for your responsiveness.  We received the list of individuals who requested the unmasking of Michael Flynn. We are making this public because the American people have a right to know what happened. : https://t.co/solZZ1StlL https://t.co/qkaZS5xaky,2020-05-13 19:23:53,Twitter Web App,101,183
Transparency is needed now more than ever. We need this information declassified. https://t.co/LzIXM7Fm6u,2020-05-13 16:07:40,Twitter Web App,48,151
Read the letter @ChuckGrassley and I wrote to @TheJusticeDepartment and @RichardGrenell asking for the names of Obama-era officials who were behind the unmasking of Americans.https://t.co/pMxgT3ZXpn,2020-05-13 16:06:31,Twitter Web App,51,142
Getting ready for a telephone town hall coming up at 3pm CT.  You can listen and ask questions online here: https://t.co/uvzPHTTCY2 https://t.co/mQcGXXaTaC,2020-05-12 18:49:06,Twitter for iPhone,10,27
I'm holding a telephone town hall Tuesday at 3pm CT. You can listen online here:  https://t.co/uvzPHTTCY2 https://t.co/pgv3SIMK9F,2020-05-12 00:39:31,TweetDeck,14,38
Look up Tuesday. Operation American Resolve coming to the skies over Wisconsin tomorrow. Thanks 115th Fighter Wing. https://t.co/fzFEjPQEjd,2020-05-11 18:26:29,Twitter Web App,14,58
A sincere thank you to all mothers for your hard work and love.  Happy Mother’s Day!!! #MothersDay https://t.co/cFgg4O2qJc,2020-05-10 14:16:58,Twitter for iPhone,8,80
Many thanks to @MOFA_Taiwan for donating 100000 surgical masks to Wisconsin's first responders. We appreciate Taiwan's humanitarian efforts in the fight against #Covid_19 and their help in shoring up supplies of #PPE.  https://t.co/3uJPOpEBhT,2020-05-07 22:37:43,Twitter Web App,15,55
@taureansmall @uwsmph @SpectrumNews1WI @SpectrumNewsDC Watch it here: https://t.co/KhEmpRQJhP,2020-05-06 18:28:14,Twitter for iPhone,0,1
We are holding a remote #HSGAC roundtable today to discuss how new #COVID19 information should drive policy with @DrDavidKatz @Avik and doctors from @stanford @UWMadison @JohnsHopkins. Livestream at 2 pm ET https://t.co/KhEmpRQJhP,2020-05-06 15:36:51,Twitter Web App,8,16
On this #NationalNursesDay we recognize and thank all nurses for their skill and compassion. We are especially thankful for nurses on the frontline of the #COVID19 pandemic for their courage. #ThankYouNurses,2020-05-06 15:35:27,Twitter Web App,11,58
Insightful piece from @brian_blase in the @WSJopinion  https://t.co/nYlBVV4ZFN,2020-05-06 01:51:28,Twitter for iPhone,7,18
Wisconsin innovation on display! Great work by Milwaukee manufacturers working together to quickly develop a new reusable face mask. https://t.co/xVu8w5yuXG,2020-05-05 00:37:12,Twitter Web App,18,68
May is #MilitaryAppreciationMonth. Thanks @milwaukeeva @DeptVetAffairs for introducing us to this #WWII nurse who is turning 99 today! She says family and education made her life rich. Happy Birthday Alice! https://t.co/eR35I7JZFV,2020-05-04 20:36:33,Twitter Web App,7,20
We will have to be innovative and figure out new ways to practice social distancing but there are smart ways to reopen more Wisconsin businesses. @fox11news https://t.co/OgegY8OX5o,2020-05-04 16:26:29,Twitter Web App,14,58
Small businesses impacted by the #coronavirus crisis like this Kimberly daycare are who #PPP is supposed to help. I continue to push to make sure PPP is helping these businesses and is not used up by others who aren’t hurt by the crisis. https://t.co/DHm4bZFNPb,2020-04-29 23:49:50,Twitter for iPhone,27,93
Totally agree @Avik: "We have to completely change our mind-set. Instead of thinking up creative ways to force people to stay home we should think hard every day about how to bring more people back to work." https://t.co/D54J2PXu6F,2020-04-29 20:20:17,Twitter Web App,43,109
If a business makes more money in 2020 than 2019...they may still have a #PPPloan fully forgiven. That is one example of a problem we need to fix in the Paycheck Protection Program. https://t.co/7GWkh4PsQj,2020-04-24 00:39:00,TweetDeck,8,28
Let's identify the non-essential businesses that really do pose a risk to the spread of #Covid_19 and keep them closed but financially supported. Everyone else we should work to safely reopen. https://t.co/Cq7AutglUl,2020-04-23 21:00:11,Twitter Media Studio,19,89
The #CARESAct had the best of intentions but as we become aware of problems I hope the administration and my congressional colleagues will work in good faith to remedy them. Case in point: forgiveness of #PPPloan  https://t.co/ajehWJEilk,2020-04-23 14:49:10,Twitter Web App,17,39
