For the first time in more than 2 decades we are seeing a decrease in overdose deaths more Americans are accessing treatment &amp; lives are being saved. Much work remains but we are finally headed in the right direction &amp; I will continue this fight on behalf of AL-02.,2019-09-12 13:39:55,Twitter Web App,2,5
We are tackling the opioid crisis head-on. By the end of this year the Trump Administration’s @HHSGov will have awarded more than $9 billion in grant dollars to states &amp; local communities to increase access to opioid addiction treatment &amp; prevention services.,2019-09-12 13:39:55,Twitter Web App,4,12
This afternoon I sat down w/ COL David Mollahan &amp; Suzanne McKee from Marion Military Institute. I was glad to hear some important updates from campus &amp; I will continue to be MMI's advocate &amp; partner as we work to grow &amp; strengthen this outstanding institution. @MarionMilitary https://t.co/Jo28bR3qLJ,2019-09-11 20:34:52,Twitter Web App,4,14
Just caught up w/ constituents who are in D.C. representing the American Society of Farm Managers &amp; Rural Appraisers. Agriculture is the largest employer in the 2nd District &amp; I consider it a tremendous responsibility to fight for our farmers &amp; producers. Thanks for your time! https://t.co/y4yM6CHU5s,2019-09-11 19:15:00,Twitter Web App,1,8
I started the day off meeting w/ great friends from the @MGMChamber who are in Washington for their annual visit. It's always a true pleasure to sit down w/ this group of hardworking folks from my hometown! Thanks for your time this morning. https://t.co/t3f2zE5RU1,2019-09-11 15:12:48,Twitter Web App,1,18
May #Sept11 always be a solemn day to reflect upon how much has been sacrificed by so many. Let us also reaffirm our steadfast commitment to the American ideals of freedom liberty &amp; justice that make this country the greatest in the world. #NeverForget,2019-09-11 12:59:16,Twitter Web App,3,9
Most of us will never forget where we were on 9/11/01 when the world changed before our eyes. I join our state &amp; country in marking this day by remembering the Americans lost praying for their families &amp; by honoring the heroes who emerged that day &amp; in the days that followed. https://t.co/CdG9R9pp3q,2019-09-11 12:59:15,Twitter Web App,7,27
Congress is back in session after a great August district work period &amp; I'm glad to be back in D.C. meeting w/ constituents in my office. This morning I visited w/ educators from the Community College Systems &amp; hardworking folks from Medical Place in MGM. Thanks for your time! https://t.co/OmhJQp754b,2019-09-10 17:01:03,Twitter Web App,1,5
Today is #WorldSuicidePreventionDay. If you or someone you know is fighting this battle please consider accessing the help available through the National Suicide Prevention Lifeline. You can find free &amp; confidential support by calling 1-800-273-TALK (8255). https://t.co/SirmRqS5gZ,2019-09-10 13:42:58,Twitter Web App,5,5
For months we've asked House Dems to take up legislation to protect infants #BornAlive during an abortion but they've consistently refused. Protecting children born alive after a failed abortion should not be a partisan issue. #LetUsVote #EndInfanticide,2019-09-10 13:02:01,Twitter Web App,19,42
Today we're holding a hearing on the #BornAlive Abortion Survivors Protection Act featuring expert witnesses on abortion procedures &amp; statistics. Live stream the hearing here beginning at 12:00 p.m. Central Time: https://t.co/H9KyTzbajM https://t.co/fMGhWczgOx,2019-09-10 13:02:00,Twitter Web App,75,167
You can access more information about the program &amp; the application process here: https://t.co/UZaDXdCEhW,2019-09-09 18:27:51,Twitter Web App,1,1
More than $3bil is available thru the disaster relief package passed by Congress &amp; signed by POTUS earlier this summer. I am grateful that we will soon deliver recovery aid to our farmers in the Wiregrass &amp; so many others across the country who experienced extreme devastation.,2019-09-09 18:27:51,Twitter Web App,2,1
Great news: @USDA Secretary Perdue today announced that agricultural producers affected by natural disasters in 2018 &amp; 2019 including Hurricane Michael can apply for assistance beginning this Wednesday Sept. 11.,2019-09-09 18:27:51,Twitter Web App,6,8
The August #JobsReport shows that our nation's economy remains strong. Unemployment is at a nearly 50-year low &amp; hardworking Alabamians are benefiting thanks to our pro-growth job-creating policies. #Jobs https://t.co/M42U2qr56I,2019-09-06 13:50:10,Twitter Web App,7,14
Great news: Alabama was awarded over $13 million to help combat the #OpioidCrisis. We are headed in the right direction &amp; we'll keep fighting. I appreciate the Administration's efforts to help our communities stand up against this epidemic. https://t.co/knUhbVcb6Z,2019-09-04 16:26:49,Twitter Web App,4,10
You can read about the important work the Alabama Fusion Center is doing each &amp; every day to protect our schools &amp; children in my weekly column via @yhn: https://t.co/jOPqryWDI6,2019-09-04 13:59:07,Twitter Web App,0,1
Since the new school year is in full swing I'm sharing some important information about school &amp; student safety I recently received during my visit to @ALEAprotects Alabama Fusion Center a few weeks ago.,2019-09-04 13:59:07,Twitter Web App,1,4
The avg wkly earnings for Alabamians in June '19 were $861.80 -- $45.83 more than last yr. The unemployment rate is 3.3% 16th lowest in the nation. Our state is open for business &amp; I'm looking forward to building on this success. More via @ALDailyNews: https://t.co/eeFh5dS6sw,2019-08-29 14:01:17,Twitter Web App,3,8
Labor Day is only a few days away &amp; the @USChamber is recognizing AL’s record job growth! Our state has added 40000 jobs since July '18 ranks 10th in the nation for job growth &amp; is 18th in the nation for wage growth. https://t.co/wliwevSMF0,2019-08-29 14:01:17,Twitter Web App,22,67
Abbeville Fiber will have the capacity to produce over 2200 truckloads of lumber a yr &amp; Great Southern Wood has made an investment of roughly $40m in the community. This is a major development for Abbeville &amp; all of Henry County. Looking forward to many great yrs of business.,2019-08-27 18:18:15,Twitter Web App,3,6
What an exciting day! I had the privilege of being in Abbeville to attend the grand opening celebration for Great Southern Wood's new yellow pine sawmill plant called Abbeville Fiber. https://t.co/yeHvgNP0Hr,2019-08-27 18:18:14,Twitter Web App,2,14
You can read more about my recent conversations w/ farmers small business owners &amp; community leaders regarding what they’re experiencing on the ground in my weekly column via @AlabamaToday: https://t.co/ECX8y4gorl,2019-08-27 14:33:00,Twitter Web App,1,4
On top of new jobs @NFIB this month released a survey indicating that optimism among small business owners is strengthening &amp; I saw this trend firsthand during my time on the road in AL-02 this month.,2019-08-27 14:33:00,Twitter Web App,3,6
We don’t often hear about it on the news but we have a lot to be proud of in our state &amp; country right now. In June our economy added 224000 #jobs &amp; in July we added 164000.,2019-08-27 14:33:00,Twitter Web App,5,19
Last week local officials announced a $50 million government-backed whitewater park and outdoor fun center that will open adjacent to Maxwell Air Force Base. You can read more about the park features and economic impact via the @MGMAdvertiser here: https://t.co/aAhWlmDKS8,2019-08-26 16:35:22,Twitter Web App,1,8
It's newsletter Monday! If you don't already receive my weekly e-newsletter you can sign up here to get it in your inbox tonight: https://t.co/JFolj6aTWq,2019-08-19 15:16:43,Twitter Web App,1,6
Yesterday I stopped by the Red Level municipal complex where I visited w/ Mayor Willie Hendrix Sandy Williamson &amp; Tonya Cook. We discussed some of the ways my office can be helpful as we work to assist our shared constituency. Thanks for your time and leadership! https://t.co/wzs7TplgKV,2019-08-16 18:44:58,Twitter for iPhone,3,12
Today I stopped by the South Alabama Regional Airport (SARA) for a tour &amp; update from Executive Director Jed Blackwell. SARA is a major job creator for the area. I was glad to hear directly from Director Blackwell about some of the ways I can be helpful. Thanks for hosting me! https://t.co/dXY8pPrWUo,2019-08-15 22:19:47,Twitter for iPhone,3,10
Looking forward to talking with @jeff_poor on the @JeffPoorShow today at 4:45 Central Time. Listen live here: https://t.co/agex5HWl7u https://t.co/kJtoSa4VdR,2019-08-15 19:48:50,Twitter for iPhone,8,5
This afternoon I enjoyed lunch in Andalusia at the Buckboard Restaurant graciously hosted by my friends at PowerSouth &amp; the Andalusia Chamber. This was a great opportunity for me to speak directly w/ so many of the people I represent in Covington County. Many thanks! https://t.co/TbTEhdHuNs,2019-08-15 19:28:49,Twitter for iPhone,2,12
I started the day in Opp visiting w/ local leaders &amp; small business owners. I am grateful for this opportunity to hear directly from folks on the ground in Covington County. It was especially great to see my friend Mayor Becky Bracke. https://t.co/RaNdxhj5lT,2019-08-15 16:12:29,Twitter for iPhone,1,10
These men &amp; women are on the front lines fighting all crimes that plague communities throughout our state &amp; I’m tremendously grateful for their work. I will continue to do all I can to support their critically important efforts especially those related to protecting children.,2019-08-14 22:32:15,Twitter for iPhone,1,8
Today I visited @ALEAprotects Fusion Center where I received an informative update from Director Jay Moseley Secretary Hal Taylor Director John Hamm &amp; several other hardworking individuals. I appreciated their presentation about the important work they’re doing each day. https://t.co/r23qdPnWk3,2019-08-14 22:32:13,Twitter for iPhone,4,15
It’s always fun to sit down w/ my old friend &amp; former staff member @toddcstacy of @ALDailyNews! Enjoyed catching up today. Sign up for his excellent daily news digest here: https://t.co/ME8nDXyzTy https://t.co/lt5z5B85W4,2019-08-14 18:15:22,Twitter for iPhone,3,14
Just attended Rex Lumber’s open house &amp; was given an awesome tour of their impressive operation located right here in Pike County. Rex is the most technologically-advanced sawmill in the South &amp; I’m grateful they’ve chosen to invest in AL-02. Thanks for having me in Troy today! https://t.co/JCmKVTwxev,2019-08-14 16:49:39,Twitter for iPhone,4,25
Great to see some friendly faces from Butler County this morning! Enjoyed our visit. https://t.co/iKkbuWeBrl,2019-08-14 15:20:51,Twitter for iPhone,1,3
What a tremendous privilege to offer the keynote address this morning at @MGMChamber Eggs &amp; Issues event. I always appreciate the opportunity to speak w/ friends &amp; familiar faces in my hometown &amp; today was no exception. Many thx to all who attended &amp; made the event successful! https://t.co/RTATYSEhgg,2019-08-14 14:34:56,Twitter for iPhone,2,10
Finished the day in Headland participating in a roundtable discussion w/ farmers &amp; business owners. We had a productive conversation about the challenges they’re facing &amp; ways I can be helpful. Thx to all who took the time to speak w/ me today. Always great to be in Henry County! https://t.co/7iewSaCQ1n,2019-08-13 23:47:54,Twitter for iPhone,1,11
Thanks for hosting me! https://t.co/tzgbKwU90g,2019-08-13 19:59:10,Twitter for iPhone,1,5
Key Fire Hose has more than 300 distributors reaching more than 70 different countries worldwide &amp; the company has sold a fire hose to every continent. 🌎 Thanks for having me!,2019-08-13 19:55:34,Twitter for iPhone,1,3
This afternoon I stopped by Key Fire Hose Industries Inc. in Dothan to visit w/ company leadership &amp; employees. I was blown away by their impressive operation designing &amp; manufacturing hoses for fire fighting forestry the military agricultural industry &amp; more. https://t.co/yTeAAzyy2T,2019-08-13 19:55:33,Twitter for iPhone,2,9
I just had the privilege of speaking to the Associated General Contractors during their lunch meeting in Dothan. We had a fantastic discussion &amp; I appreciated the opportunity to update them on my committee assignments &amp; how I will continue to fight for their priorities. https://t.co/vHYTUpvVgZ,2019-08-13 18:04:11,Twitter for iPhone,1,4
It was exciting to learn about @EnterpriseState’s facility improvements &amp; the many expanded opportunities for students. In Congress I will continue to do all I can to support their important role in workforce development. Thankful to have this great school in AL-02!,2019-08-13 16:30:06,Twitter for iPhone,1,9
My staff &amp; I had a productive visit to @EnterpriseState this morning &amp; we appreciated the warm welcome! I enjoyed hearing from President Matt Rodgers division chairs &amp; directors &amp; State Rep. Rhett Marques. https://t.co/2wzTn1twsS,2019-08-13 16:30:05,Twitter for iPhone,3,14
HHS announced last week that AL will receive $6.3m to help combat the opioid crisis that's gripping communities throughout AL. This money will help community health centers &amp; schools improve access to treatment services &amp; education. More via @yhn here: https://t.co/pZjgcDed6c,2019-08-12 18:07:07,Twitter Web App,4,10
The President authorized USDA to provide up to $14.5B in direct payments thru MFP. These payments will be made to mitigate the losses for non-specialty crops specialty crops &amp; animal products. More info about eligibility &amp; the application process here: https://t.co/aRu2laotyP,2019-08-02 15:41:34,Twitter Web App,4,12
On Monday the Trump Administration opened the 2nd round of applications for the Market Facilitation Program (MFP) which is designed to aid farmers &amp; ranchers whose commodities have been directly impacted by foreign retaliatory tariffs.,2019-08-02 15:41:34,Twitter Web App,3,13
These disaster aid block grants which are separate from the individual payments to farmers will help our ag industry get back on its feet after the devastating setbacks that Hurricane Michael brought.,2019-08-01 17:34:07,Twitter Web App,1,10
This program will allow the State of Alabama to administer disaster aid to producers who were impacted by Hurricane Michael in 2018. I'm praying our farmers are finally able to get the help they need to continue to feed Alabama &amp; our country.,2019-08-01 17:34:07,Twitter Web App,1,12
Earlier this week my Alabama colleagues joined me in sending a letter to USDA Secretary Perdue urging swift approval of the Alabama Agriculture Recovery Relief Program. https://t.co/pdE4TFhioA,2019-08-01 17:34:07,Twitter Web App,5,17
Last week the 3rd &amp; final group of Team Roby DC interns presented their legislative policy proposal. Their proposal aims to rehabilitate imprisoned individuals suffering from opioid addiction by implementing a 3-pronged program. Very proud of their work on this important issue! https://t.co/WIxe4fiMNe,2019-07-29 15:00:44,Twitter Web App,2,22
@ALGOP Thank you so much! Looking forward to another great year!,2019-07-26 18:43:55,Twitter Web App,0,7
This legislation will help put an end to patent gamesmanship that prevents lower-priced generic drugs from entering the market. I look forward to continuing our work to find ways to bring down the cost of prescription drugs for all Americans.,2019-07-26 14:33:52,Twitter Web App,3,30
One of the top issues I hear about from my constituents is that prescription drugs are too expensive. That's why I'm proud to join @RepHankJohnson in introducing the Affordable Prescriptions for Patients Through Improvements to Patent Litigation Act: https://t.co/T2Q6bx1tBB,2019-07-26 14:33:51,Twitter Web App,7,32
Once again AL has proved it's open for business! Just this week AL was ranked the 3rd best business climate in the country by national economic development publication “Business Facilities.” Read more about the ranking &amp; some of the investments here:  https://t.co/H9HfG1fc9C,2019-07-25 18:26:17,Twitter Web App,5,19
Calling all rising seniors! It’s my privilege to nominate candidates for appointment to the U.S. service academies each year. If you or someone you know is interested in pursuing entry direct them to my website. The deadline is Nov. 8. More info here: https://t.co/Da1QZUTcPd,2019-07-23 14:42:44,Twitter Web App,0,22
AL's 14th annual sales tax holiday is officially underway! Until midnight on Sunday July 21 families have the opportunity to purchase certain school supplies computers books &amp; clothing TAX-FREE.   Here's a list of items you can buy #TaxFree this wknd: https://t.co/JUYU7gdPAr,2019-07-19 15:41:58,Twitter Web App,1,11
50 yrs ago AL helped send man to the moon w/ the #Apollo11 landing. For yrs we’ve heard from those who watched in awe or played a role in executing this historic mission. I encourage you to share your stories &amp; hopes for the future of US space exploration! #Apollo50 #AlabamaProud,2019-07-17 17:40:17,Twitter Web Client,1,20
Hurricane season lasts until the end of Nov. &amp; it’s extremely important that we take the necessary precautions to protect our loved ones &amp; property. Check out my column in the @MGMAdvertiser for some safety tips from the National Weather Service: https://t.co/yZfF869PEX,2019-07-17 14:07:58,Twitter Web App,6,11
Great infrastructure news for AL-02's Houston Geneva Crenshaw Pike &amp; Coffee Counties! I'm excited about the opportunities that access to high-speed Internet will offer my constituents. Thanks @GovernorKayIvey - this is a very important development for AL's rural communities. https://t.co/p7CLTIApou,2019-07-16 14:11:34,Twitter Web App,1,24
I just met with Alabama members of the Academy of Nutrition and Dietetics. We had a great discussion about how we can improve Americans’ health through food and nutrition. Thanks for your important work and for sitting down with me! https://t.co/5ZXFX0bpcv,2019-07-12 14:12:54,Twitter Web Client,5,23
German automotive company Gerhardi Inc. just celebrated the grand opening of a new facility in MGM - their 1st facility in North America! Gerhardi invested over $41M in this facility &amp; will employ 235 Alabamians. Welcome to Sweet Home Alabama! @MGMChamber https://t.co/ziyAdOoNOP,2019-07-11 14:51:52,Twitter Web Client,5,11
@BiloxiCondos Thanks for reaching out! As of this morning my office has not received your correspondence. It typically takes several weeks for mail to go through the security screening process but you can email me here: https://t.co/zBlvq8Tch0,2019-07-10 13:10:54,Twitter Web App,0,0
These hardworking professionals don’t always receive the recognition &amp; compensation they deserve due to several factors namely illegal #piracy. Read about how piracy impacts us in AL &amp; why our copyright laws matter in my column via @MGMAdvertiser: https://t.co/zoZPwEWkT9,2019-07-08 19:26:48,Twitter Web App,2,11
In AL the music industry contributes $636mil to our GDP &amp; supports more than 14k jobs. The motion picture &amp; TV industry is responsible for more than 10200 jobs &amp; $387mil total wages in our state. AL is home to 958 music businesses &amp; nearly 720 motion picture &amp; TV businesses.,2019-07-08 19:26:48,Twitter Web App,1,13
I'm honored to serve as Ranking Member on @JudiciaryGOP's Subcommittee on Courts Intellectual Property &amp; the Internet. In this role I'm in a strong position to advocate for the core copyright industries &amp; related workforce that contribute so much to our economy &amp; culture.,2019-07-08 19:26:47,Twitter Web App,13,35
Last week my offices said goodbye to our 2nd group of summer interns. We enjoyed having these bright students on Team Roby &amp; my staff &amp; I wish them the best in their future endeavors. More info about my summer internship program is available here: https://t.co/rrjgLi9Xkm. https://t.co/VmF7lFFfRU,2019-07-08 15:59:34,Twitter Web App,2,14
I’ve been waiting for an #independenceday that falls on a #TBT to share this gem from 1993! Hope everyone has had a wonderful day celebrating this great nation. 🇺🇸@distinguishedyw https://t.co/MKpqQOaOOG,2019-07-04 22:43:06,Twitter for iPhone,6,34
Happy #IndependenceDay I wish you a fun &amp; safe holiday celebrating this nation w/ family &amp; friends. As always I extend my sincere thanks to those who wear the uniform &amp; sacrifice for our freedom. We live in the greatest country on earth. Let's count our blessings today. https://t.co/Oh1SOZbQFl,2019-07-04 13:32:49,Twitter Web Client,7,17
USA! USA! USA! 🇺🇸 Congratulations @USWNT. Can’t wait until next Tuesday’s semifinal match against England. #USAvFRA #WomensWorldCup https://t.co/bb1FVds94e,2019-06-28 21:34:06,Twitter for iPhone,1,4
The military installations in AL-02 &amp; across our state perform vital work for the security of this nation &amp; I'll always advocate for them. It is an honor to have a platform to fight for those who serve us all. More in my weekly column via @MGMAdvertiser: https://t.co/T9nW5Z8aPJ,2019-06-28 13:33:47,Twitter Web App,2,14
I was joined by @RepDougCollins Ranking Member of @JudiciaryGOP in introducing H.R. 3533 the Combat Violent Crime Act to update current US code &amp; allow for more effective prosecution of individuals who commit violent crimes. More: https://t.co/g67xKaddRu,2019-06-27 19:07:25,Twitter Web App,2,5
On Mon. SCOTUS struck down a portion of US criminal code related to crimes committed w/ firearms ruling the statute unconstitutionally vague. In his opinion Justice Gorsuch stated Congress could update/clarify the language. Today we took a step towards accomplishing that goal.,2019-06-27 19:07:24,Twitter Web App,4,5
This is a fantastic group of students &amp; we've been fortunate to have them on Team Roby this month. More information about my summer internship program is available here: https://t.co/rrjgLi9Xkm,2019-06-27 14:07:48,Twitter Web App,2,3
The goal of their proposal is to increase the number of trafficking reports while reducing the number of victims of these heinous crimes. I appreciate their eagerness to tackle such a critical issue impacting communities across the country.,2019-06-27 14:07:48,Twitter Web App,2,4
This wk my DC office's 2nd session of summer interns presented their legislative policy proposal &amp; I'm so proud of their hard work. They chose to focus on measures to combat human sex trafficking including implementing preemptive education for school-aged youth &amp; educators. https://t.co/orvuldeJaF,2019-06-27 14:07:46,Twitter Web App,2,11
Thanks for your time! I enjoyed our conversation. https://t.co/BzsNHICMfT,2019-06-26 19:29:56,Twitter Web App,2,3
I was glad to meet w/ friends from @ManufactureAla earlier this afternoon! I appreciate their work to strengthen Alabama's economy &amp; their efforts to support our state's 3703 manufacturing firms. Thanks for your time - it's always a pleasure to visit w/ you all. https://t.co/uYJh9iqLZY,2019-06-26 19:25:53,Twitter Web App,5,22
I have a deep appreciation for the artists who create the songs we know &amp; love. Glad to work w/ @RepTedDeutch on the Songwriters Caucus to ensure that they are properly compensated &amp; recognized for their creative work. Together we'll improve the industry &amp; #StandWithSongwriters. https://t.co/vlEngHGdlj,2019-06-26 13:42:41,Twitter Web App,2,3
This is fantastic news for the Second District! I visited @BenEKeithFoods in Elba just last year &amp; I was thoroughly impressed by the work they're doing. Congratulations to this outstanding company - wishing them continued growth &amp; success. #Jobs https://t.co/Xz5IXPKUqb,2019-06-26 13:18:08,Twitter Web App,2,7
Alabama members of the National Council of Farmer Cooperatives stopped by my office this morning to discuss a number of timely issues. I appreciate hearing from them and I will continue to stand up for farmers in Congress. Thank you for meeting with me! https://t.co/9Cz8vnAGmG,2019-06-25 18:49:49,Twitter Web Client,1,6
I just met w/ a group visiting D.C. for the National Pancreatic Cancer Advocacy Day. I'm always honored to hear their stories &amp; how this disease has impacted them &amp; their families. We discussed how Congress can help fight back against this terrible disease. #MomentsMatter https://t.co/euGCPGYfnT,2019-06-25 16:10:23,Twitter Web Client,2,3
Looking forward to talking with @jeff_poor at 2:15 p.m. CST! Tune in: https://t.co/ui0HKIaZz5 https://t.co/k3w7h1mLVK,2019-06-20 18:20:06,Twitter Web App,4,8
The existing facilities at Dannelly that currently service the F-16 Red Tail’s squadron are inadequate &amp; I look forward to working w/ my colleagues on this issue as we continue through the FY2020 appropriations process. https://t.co/eThz7tMsYN,2019-06-20 16:56:29,Twitter Web App,1,6
The 187th Fighter Wing at Dannelly Field in Montgomery was selected as a preferred location for the bed down of the F-35. The 1st aircraft will arrive in the next few yrs &amp; Dannelly needs a correctly sized properly configured maintenance facility to support &amp; repair it.,2019-06-20 16:56:29,Twitter Web App,1,6
Yesterday I spoke on the House floor during consideration of the Military Construction &amp; Veterans Affairs Appropriations Subcommittee FY2020 funding bill to raise awareness for the facility updates needed at Dannelly Field to support the F-35 Joint Strike Fighter mission. https://t.co/kEkQxue6LS,2019-06-20 16:53:44,Twitter Media Studio,4,6
#TeamCongress didn't quite pull off the W during last night's @CWSoftballGame but I couldn't be more proud of what we accomplished. We raised over $365000 for @YSCBuzz to support women battling breast cancer. #TeamCongress &amp; #TeamRoby will be ready to #BeatThePress next year! https://t.co/uG1ts32kKd,2019-06-20 14:31:04,Twitter Web App,2,11
