In the meantime my family &amp; I will continue praying for the Alabamians impacted by this devastating event especially for those who tragically lost family members &amp; friends.,2019-03-05 18:35:24,Twitter Web Client,0,4
This is a time of unspeakable heartbreak for many individuals &amp; families in Southeast Alabama. As we begin rebuilding in the aftermath of Sunday’s severe weather I urge the President to support Governor Ivey’s request for an expedited major disaster declaration.,2019-03-05 18:34:22,Twitter Web Client,2,6
Today I joined @SenShelby Sen. @DougJones &amp; @RepMikeRogersAL in sending a letter to President Trump expressing support for @GovernorKayIvey's request for an expedited major disaster declaration for the State of Alabama. https://t.co/0SMCLx2EH9,2019-03-05 18:32:25,Twitter Web Client,0,12
.@Airbnb has initiated its Open Homes Program to help Lee County residents impacted by the storm by providing free housing through March 25th. You can find available housing or volunteer your own home for the program here: https://t.co/FanFJgNMqI,2019-03-05 15:31:21,Twitter Web Client,0,7
Yesterday @SenShelby became the longest serving Senator in AL history. He's led a remarkable career in service to our state &amp; we're better off for his dedicated work to make AL a great place to live &amp; work. Thank you Senator - it's an honor to work w/ you. https://t.co/mwCyq5qnxJ,2019-03-04 19:56:12,Twitter Web Client,0,8
As recovery efforts begin please join me in praying for those in neighboring counties who lost loved ones yesterday. This is a time of unspeakable tragedy for many throughout Southeast Alabama.,2019-03-04 16:57:09,Twitter Web Client,2,4
Yesterday AL was hit w/ devastating severe weather. Crews are working to assess the damage &amp; return power. If you're in AL-02 &amp; need assistance please contact my local offices. We're here to work through this w/ you &amp; we stand w/ all impacted by the storm. https://t.co/jtENE8NMxS,2019-03-04 16:57:09,Twitter Web Client,1,4
While we await full damage assessment please be patient as crews work to return power and clear debris in roadways. As always please be cautious and heed warnings. Follow @AlabamaEMA for timely updates.,2019-03-04 00:23:13,Twitter for iPhone,2,13
Here in Southeast Alabama we faced extremely severe weather all afternoon. While no fatalities have yet been reported in AL-02 my prayers are w/ those in Lee County who are in the midst of heartbreaking tragedy. https://t.co/6DdzkdlDFJ,2019-03-04 00:19:07,Twitter for iPhone,2,19
Margaret George &amp; I are participating in the Faith &amp; Politics Civil Rights Pilgrimage in my hometown Montgomery. Our state has a rich history &amp; an important place in the American Civil Rights Movement. We’re honored to take part in this important event &amp; larger conversation. https://t.co/XsiHwdzAYL,2019-03-01 23:39:14,Twitter for iPhone,3,52
According to the VA’s own data the Central AL VA continues to be a terrible VA health care system. I am sick &amp; tired of getting status quo answers as to why. This is a huge disservice to our veterans &amp; I will not stop making the case to Secretary Wilkie until we get this right.,2019-03-01 16:18:41,Twitter Web Client,3,9
ICYMI: This week I spoke to VA Secretary Robert Wilkie during a MilCon-VA Appropriations Subcommittee hearing. I explained to him the severity of the problems our veterans face in Southeast Alabama. https://t.co/5hWjvP2tMn,2019-03-01 16:16:58,Twitter Web Client,3,8
This week in DC I had the opportunity to visit w/ @nyuniversity leadership students. As an NYU alumnus I was glad to talk w/ these students about the importance of valuing good relationships being kind in spite of differences &amp; being willing to listen more than speak. https://t.co/FDgIgRBVmp,2019-03-01 13:54:57,Twitter for iPhone,1,5
This morning I met with the Alabama Wing of Civil Air Patrol and we discussed their mission and funding priorities. Thank you for spending some time with me today and more importantly thank you for your service. https://t.co/DCSK92vKe2,2019-02-28 16:09:03,Twitter Web Client,1,14
Earlier today I caught up with members of the Alabama Aviation Council. Thanks for your time and conversation! ✈️ https://t.co/iKb95EKdrj,2019-02-27 21:03:47,Twitter for iPhone,0,5
This afternoon I spent some time w/ a large group from Electric Cities of AL. I was glad to learn more about their priorities as they work to support their numerous municipally-owned electric utilities that provide reliable low-cost electricity to 1mil customers across Alabama. https://t.co/IqWp8qnpRD,2019-02-27 19:46:50,Twitter for iPhone,1,3
Today I met with Alabama members of the National Association of Letter Carriers. This was a valuable opportunity for me to hear more about the issues they face in their important work and I appreciate their willingness to talk with me. https://t.co/12Bl5icqYs,2019-02-27 18:34:38,Twitter for iPhone,0,6
This morning I met with Alabamians from the Vlasic division of Pinnacle Foods. I was glad to visit with these folks and learn more about their priorities related to pickle packing. Thanks for your time! https://t.co/Vh3yR2YINH,2019-02-27 16:07:53,Twitter for iPhone,0,9
I along w/ my fellow Republicans want to see a reduction in violent crime &amp; gun violence – but H.R. 8 won’t accomplish that. Read more about my thoughts on this overreaching bill here: https://t.co/YEoRV8A8JD,2019-02-27 14:22:59,Twitter Web App,6,9
In order to actually combat gun violence we must take a long hard look at making improvements in our society like repairing our mental health care system &amp; enforcing existing laws. We must stop playing politics w/ legislation that will not benefit the American people.,2019-02-27 14:20:43,Twitter Web App,5,14
Today the House will vote on H.R. 8 a poorly drafted &amp; ill-considered bill that would punish lawful gun owners w/o doing anything to prevent gun violence. I urge my colleagues to oppose this measure &amp; get to work finding REAL solutions to #EndGunViolence.,2019-02-27 14:19:39,Twitter Web App,6,18
Alabama Department of Veterans Affairs Commissioner Rear Admiral W. Kent Davis stopped by my office this afternoon. I am grateful for his leadership and look forward to working together in the future! https://t.co/Tz3kVA8JCL,2019-02-26 22:31:29,Twitter Web Client,1,6
This afternoon I met with some American Legion members. I always enjoy meeting with this great group and learning more about how I can better fight for our veterans. Thank you for coming by! https://t.co/6jSXcj15ju,2019-02-26 21:39:28,Twitter Web Client,1,7
We should be giving veterans the best care in a timely fashion and it just isn’t working. I appreciated Sec. Wilkie's response and I look forward to working w/ him to finally get this right.,2019-02-26 19:23:57,Twitter Web App,3,11
I participated in a MilCon-VA hearing today on general VA oversight where Sec. Wilkie testified. I was glad to have this opportunity to express my concerns w/ failing VA medical facilities including the CAVHCS. I invited him to AL02 to see firsthand the challenges veterans face. https://t.co/O4C4cT3YzK,2019-02-26 19:22:31,Twitter Media Studio,2,4
Great event at @FRCdc! Thanks for having me join you to discuss our #Prolife efforts in Congress. I count it a tremendous responsibility to speak for those who cannot speak for themselves. https://t.co/Kzp7M9FmNm,2019-02-26 18:25:25,Twitter Web App,5,16
Happening now - tune in! https://t.co/COL09uHK6E,2019-02-26 17:04:02,Twitter for iPhone,3,10
AL-02 members of School Meals for Children met w/ me to discuss their efforts to feed hungry children in AL. As I told them it's imperative that our students are fed &amp; cared for both in the home &amp; at school. I appreciate their dedication to this issue. Thanks for meeting w/ me! https://t.co/0aJzUWZHHL,2019-02-26 16:23:49,Twitter Web Client,1,6
I'm looking forward to joining the Family Research Council TODAY at 12 p.m. ET to discuss congressional efforts to defend the unborn. Watch online at https://t.co/nD0i3VRR2p or on Facebook live! #prolife https://t.co/55LStV33NG,2019-02-26 14:34:24,Twitter Web App,5,13
It should be a no-brainer to vote in favor of a bill requiring medical care for babies born alive during abortions but yesterday Senate Democrats voted against the measure and House Democrats continue to block us from voting on it at all. Unbelievable. https://t.co/h9ldyZBDV4,2019-02-26 14:03:15,Twitter Web App,10,28
Tomorrow (2/26) at 12 p.m. ET I'm leading a pro-life discussion at the Family Research Council about congressional efforts to defend the unborn. The event will be broadcast live on @FRCdc's website &amp; Facebook page so plan to tune in! More info here: https://t.co/ui8z2XBBwF https://t.co/cp8fWXRR6l,2019-02-25 19:17:49,Twitter Web App,7,11
Thanks @AlanLCross. When a child is born alive we're not talking about abortion anymore. I hope no matter how opinions on abortion might vary we can still agree that babies born alive must be protected. https://t.co/plefLUueI3,2019-02-25 16:15:52,Twitter Web App,2,14
Today the Senate will vote to proceed to the Born-Alive Abortion Survivors Protection Act a bill that implements protections for babies born alive during abortion. Needs 60 yeas. I hope my friends on the other side of the Capitol say "NO" to infanticide. https://t.co/iTLcrz8XXN,2019-02-25 16:08:38,Twitter Web App,4,28
I finished my week on the road in AL-02 with a visit to New Brockton where I stopped by their Town Hall building. It was great to talk with some constituents and local leaders including Mayor Kathryn Holley and Town Clerk Debra Andrews. Looking forward to next time! https://t.co/BduXIXWHRO,2019-02-22 21:13:14,Twitter for iPhone,0,13
Next Tuesday Feb. 26 I will join @FRCdc to discuss our pro-life efforts in Congress. The past couple of weeks have proven that now more than ever we must use our voices to defend the voiceless. You can find more info about the event &amp; register here: https://t.co/ui8z2XBBwF https://t.co/6bRgVS2sF4,2019-02-22 19:57:19,Twitter Web App,2,7
I’m hopeful we will make this happen soon and in the meantime I encourage anyone in AL-02 who needs hurricane recovery assistance to contact my offices. We are here to help.,2019-02-22 17:44:55,Twitter for iPhone,3,5
This wk I had the opportunity to catch up w/ my friend state Senator @DonnieChesteen at lunch. I assured him that I firmly believe Congress should make agriculture disaster recovery funds available for those in the Wiregrass who were hit hardest by Hurricane Michael last Oct. https://t.co/2IYjMZLYCe,2019-02-22 17:43:18,Twitter for iPhone,2,13
Yesterday I paid my first visit to Air Performance in Hartford. It was great to meet the company’s leadership tour their impressive facility and speak to the hardworking employees. Thank you for having me! It is an honor to serve each of you in Congress. https://t.co/p8urKcrABu,2019-02-22 16:03:58,Twitter for iPhone,1,15
Alabama is fortunate to have a strong network of high schools and two-year colleges that offer CTE programs to thousands of students ensuring that today’s young people are equipped to fill tomorrow’s jobs. It’s always a pleasure to be in Geneva. Thanks for hosting me!,2019-02-22 00:17:26,Twitter for iPhone,2,11
What an awesome day! I was on campus at Geneva High School to attend the signing of a proclamation recognizing February as Career and Technical Education month. #CTEMonth https://t.co/Rp4jS12593,2019-02-22 00:16:18,Twitter for iPhone,1,16
I am so grateful our state now has this new treatment center for children who are victims of sex trafficking. My prayer is that one day we will no longer need it. #EndIt https://t.co/xZGl01zl0O,2019-02-21 23:49:55,Twitter for iPhone,1,14
I had a great first visit to Air Performance in Hartford today! Grateful to have this company and jobs in Geneva County. Thanks for hosting me - I'll be back! https://t.co/dd6WhEK81Y,2019-02-21 20:37:48,Twitter Web App,3,7
Yesterday I had the opportunity to visit Four Star Freight in Montgomery to meet with management and employees. I was given a fantastic site tour and really enjoyed learning more about their business. Thanks for hosting me! https://t.co/uYwrjXnA8H,2019-02-21 15:20:17,Twitter Web App,1,13
This morning in Montgomery I participated in a roundtable discussion w/ the Alabama Restaurant &amp; Hospitality Association. This was a valuable opportunity for me to hear firsthand what they are experiencing in the industry &amp; I appreciate everyone who took the time to be there! https://t.co/LneFXpMVj3,2019-02-20 16:05:27,Twitter Web App,2,13
The language used by the Democrat-Reporter is deeply disturbing &amp; completely unacceptable. There is no place for this type of hateful rhetoric in our society. I encourage the newspaper to issue a public apology &amp; urge Mr. Sutton to resign as publisher. https://t.co/BpjyJmaspz,2019-02-19 20:08:05,Twitter Web App,11,41
This afternoon I spoke to the Montgomery Kiwanis Club during their weekly luncheon. I appreciated this opportunity to share with the group my new committee responsibilities and continued priorities for the 116th Congress. Thank you for hosting me - looking forward to next time! https://t.co/HC2aFdCpkX,2019-02-19 19:55:49,Twitter Web Client,0,17
Happy Presidents’ Day! 🇺🇸 https://t.co/q6Q0Cw6Y6o,2019-02-18 15:52:55,Twitter for iPhone,1,12
Chef Kelsey Barnard Clark continues to make AL-02 proud! Best of luck in the next round! https://t.co/g5EVQnMVZr,2019-02-15 19:22:47,Twitter Web App,0,6
As a member of the House Appropriations Committee I remain committed to ensuring that we use every tool available to secure the border &amp; I’m eager to see these barriers quickly constructed.,2019-02-15 02:21:52,Twitter for iPhone,4,28
I just voted to fully fund the government &amp; avoid another partial shutdown. Still we are in the midst of a real crisis at our southern border so I am glad the bill also includes a down payment of $1.4 billion on the President’s request for new barriers.,2019-02-15 02:20:58,Twitter for iPhone,5,40
Looking forward to talking with you @jeff_poor! If you’re in the Huntsville area turn on WVNN this afternoon - I’ll be calling in at 3:30 p.m. CT. https://t.co/lWJw1t3LkL,2019-02-14 19:32:51,Twitter for iPhone,7,10
I along w/ my fellow Republicans want to see a reduction in violent crime &amp; rates of gun violence but H.R. 8 won't accomplish that. My full statement on the bill is available here: https://t.co/0DrGzR2FA4,2019-02-14 15:00:20,Twitter Web App,0,5
In order to actually #EndGunViolence we must look at improvements to our mental health care system &amp; more effectively enforce laws on the books. We should not be wasting time on ineffective bills that only serve to impede upon the constitutional rights of law-abiding Americans.,2019-02-14 14:59:14,Twitter Web App,4,8
H.R. 8 would make these actions illegal: Loaning a gun to your neighbor donating a firearm to a museum gifting a gun to a relative. The bill would even make it a crime to remove firearms from a friend's house at their request if they express concerns about suicidal thoughts.,2019-02-14 14:57:27,Twitter Web App,4,9
Late last night I voted against Judiciary Committee passage of H.R. 8 a poorly drafted &amp; ill-considered bill that would punish lawful gun owners without doing anything to prevent gun violence.,2019-02-14 14:55:57,Twitter Web App,4,25
Just joined my colleagues on the floor to voice STRONG opposition to the recent pro-abortion efforts in NY &amp; VA &amp; to express my unwavering support for the Born-Alive Abortion Survivors Protection Act a bill I cosponsor to protect babies born alive during failed abortions. https://t.co/YmERK0HSCS,2019-02-13 22:50:57,Twitter Media Studio,81,407
Just spoke to @Austal_USA suppliers during their Industry Day in DC. The company employs thousands of Alabamians &amp; has had a $2.29bil impact on our state’s economy since '08. I will always do my part to ensure that our shipbuilding community’s needs are met. Thanks for having me! https://t.co/zFCfO2HLsR,2019-02-12 22:15:08,Twitter Web App,2,14
I'm looking forward to joining @FRCdc on Feb. 26 to discuss a number of important issues including some of the pro-life legislation I proudly support. If you're in DC I hope you'll join us! More information here: https://t.co/ui8z2XBBwF https://t.co/3CCZPOTj9W,2019-02-12 20:36:53,Twitter Web App,0,4
In light of the disturbing news coming out of NY &amp; VA recently + ongoing debates in the House I'd like to make something clear: "Born-alive abortion" = infanticide. Period. Read more about my thoughts on this humanitarian issue in my wkly column via @yhn: https://t.co/Q6e7CoxWAv,2019-02-12 19:24:15,Twitter Web App,9,35
Each Monday evening I send out an e-Newsletter full of updates about what's going on in Congress &amp; my work on behalf of AL-02.  If you haven't already you can sign up here: https://t.co/JFolj6aTWq,2019-02-11 19:48:31,Twitter Web Client,3,7
Just sat down w/ Mr. Alabama Daily News himself @toddcstacy! Great to visit w/ my old friend &amp; former Communications Director about my priorities for the 116th Congress. If you haven’t signed up for Todd’s daily news digest I encourage you to do so now: https://t.co/IUQeb8Sjcf https://t.co/2XJpbDNosh,2019-02-07 22:28:59,Twitter for iPhone,2,7
Appalling. I can't fathom how any person could oppose protecting living breathing infants born despite attempted abortion. Dems can call it a matter of "women's health" but I'm calling it what it is: Infanticide. And Americans deserve to know where each of us stands on it. https://t.co/G365RJGC4J,2019-02-07 20:52:06,Twitter Web Client,234,612
Glad to join 301 of my colleagues in sending a letter to CMS Administrator expressing support for the Medicare Advantage pgrm which enrolls 22mil Americans. I look forward to cont'd strengthening of the pgrm to guarantee our seniors access to affordable health coverage choices. https://t.co/f1NkU2LxOs,2019-02-07 19:53:10,Twitter Web Client,3,8
@FreyjaMoody @ENDITAlabama According to the event website the summit will run from 9:00 a.m. - 4:45 p.m. Central Time. More info here: https://t.co/8FtHyjgaT8,2019-02-07 15:55:30,Twitter Web Client,1,1
You can access more information about the state of human trafficking efforts to #EndIt and tomorrow's @ENDITAlabama summit here: https://t.co/8FtHyjgaT8,2019-02-07 15:53:44,Twitter Web Client,2,7
Fact: Human trafficking in the 2nd largest criminal industry in the world today just behind illegal drug trade. Human trafficking is also the fastest-growing criminal industry in the world. It's happening in this country &amp; it's happening in the State of Alabama.,2019-02-07 15:51:42,Twitter Web Client,4,7
The Alabama Human Trafficking Task Force will host its 5th annual summit tomorrow (Feb. 8) at the Embassy Suites downtown Montgomery. A record 295+ law enforcement social workers educators attorneys medical professionals nonprofits &amp; others will be present. @ENDITAlabama,2019-02-07 15:49:46,Twitter Web Client,2,11
Great news for fishermen &amp; women across our state: AL's 2019 recreational #RedSnapper season will be 3-day weekends (Fri.-Sun.) from 6/1 to 7/28. Thank you to Senate Appropriations Chairman @SenShelby who has worked tirelessly to give states increased flexibility in this matter. https://t.co/Wq1NMDmNVg,2019-02-06 22:28:18,Twitter Web Client,4,10
I STRONGLY support this effort by @SteveScalise &amp; @RepAnnWagner to force a vote on a bill to protect babies who are born ALIVE during botched abortions. This is a commonsense measure. Every single member of Congress must go on record against infanticide. https://t.co/pzQm2B8nPm,2019-02-06 21:06:00,Twitter Web Client,118,353
I had a great meeting this morning with the Alabama Rural Water Association. We discussed several pieces of legislation and how they’ll impact Alabama. Thank you for meeting with me! https://t.co/1fjGd2SnQ1,2019-02-06 17:44:46,Twitter Web Client,0,3
I am honored to serve as co-chair of the Congressional Independent Colleges Caucus for the 116th Congress alongside my colleague @RepDerekKilmer. Together we will advocate for &amp; support these educational institutions that offer immense opportunity to our country’s students. https://t.co/QpLJt1xl6E,2019-02-06 16:37:35,Twitter Web Client,2,8
AL is fortunate to have 14 independent diverse non-profit colleges &amp; universities. It was a true privilege to visit w/ many of them last night during the NAICU reception &amp; to be introduced by my friend Huntingdon College President Cam West. Looking forward to our next meeting! https://t.co/vFbRjWfAqt,2019-02-06 15:20:46,Twitter for iPhone,4,17
I am eager to continue working w/ the Trump Administration &amp; my colleagues in Congress to deliver the meaningful results that the American people &amp; Alabama’s Second District deserve. My full statement here: https://t.co/wbX8K9xCmm,2019-02-06 03:48:23,Twitter Web Client,3,7
.@POTUS also laid out a vision for our country’s future as it relates to enhancing border security &amp; addressing our illegal immigration problem. Now w/ a divided Congress I am encouraged by his remarks abt the importance of bipartisanship &amp; working together to get our job done.,2019-02-06 03:46:46,Twitter Web Client,2,8
In his 2nd #SOTU @POTUS highlighted economic success Americans are experiencing thx to pro-growth policies. I was also glad to hear about his plan to reinvigorate infrastructure support our military bolster nat'l security efforts improve care for veterans &amp; defend the unborn.,2019-02-06 03:42:39,Twitter Web Client,2,22
This year my guest to the #SOTU⁠ ⁠is @TrinityWildcats history teacher Mr. Oliver McLemore (pictured left). We were excited to run into @MyPillowUSA CEO Mr. Michael Lindell! 💤 https://t.co/F0JAM8mHvm,2019-02-06 02:07:33,Twitter for iPhone,3,32
Tonight at 8:00 Central Time @POTUS will address the nation from the House floor for the #SOTU. I am looking forward to attending &amp; hearing what he has to say about his continued vision for our country.  Here's how you can watch: https://t.co/zimurv0gML,2019-02-05 15:28:51,Twitter Web Client,6,14
I encourage you to read Jeanie's powerful story &amp; I hope you'll visit Montgomery to experience the city's place in the Civil Rights Movement. From the Civil Rights Memorial Center to the Rosa Parks Museum &amp; Dr. King's Dexter Avenue Baptist Church there is much to absorb.,2019-02-04 15:59:11,Twitter Web Client,0,5
The City of Montgomery my hometown has a deep history that helped &amp; continues to be instrumental in shaping the character of our nation. There are few places in this country where the struggle to achieve justice can be felt as powerfully.,2019-02-04 15:55:47,Twitter Web Client,0,4
To honor #blackhistorymonth I'm sharing "Tunnel Vision" a short story by my friend Jeanie Parnell. This piece about Montgomery won the 2018 SETI writing competition which challenged participants to use fiction to inspire readers to visit real places. https://t.co/p0LocOYDno,2019-02-04 15:54:54,Twitter Web Client,5,5
As of last night Dothan resident Chef Kelsey Barnard Clark owner of KBC on Foster is in the top 7 "cheftestants" on Bravo's Top Chef! I'm so proud of Kelsey &amp; the positive attention she's bringing to the culinary scene in the Wiregrass. More here: https://t.co/jWjOuhgo6n,2019-02-01 19:57:11,Twitter Web Client,2,28
In Congress I will continue to be a vocal advocate for YouthBuild pgrms across the country - they provide a truly invaluable service to at-risk youth in our communities. Read more about YouthBuild in one of my recent columns: https://t.co/JOxbv9nACO,2019-02-01 15:41:03,Twitter Web Client,0,10
Great news: The Dept. of Labor announced it will award $85mil to YouthBuild pgrms in 32 states. Here in AL Bham's Institute for Community Youth &amp; Family Services will receive $967734. I recently visited YouthBuild in Eufaula &amp; was amazed by the ed &amp; training pgrms offered.,2019-02-01 15:39:51,Twitter Web Client,2,13
What a fun week it's been! I'm so excited to have my daughter Margaret &amp; her class from @TrinityWildcats in D.C.! Yesterday they toured the White House &amp; today I met w/ them for a tour of the Capitol. I hope you've enjoyed the trip. It's been a special honor to spend time w/ you! https://t.co/YwftkWoB2m,2019-01-31 16:27:22,Twitter Web Client,1,20
Happy 98th birthday to Alabama's largest farm organization @AlfaFarmers! Thank you for your tireless work for farmers in all 67 Alabama counties. Here's to 98 more!,2019-01-31 14:16:36,Twitter Web Client,2,22
.@mgmwerx is officially open! Yesterday they hosted their grand opening in downtown Montgomery to show off their new innovation center. I’m confident this collaboration w/ @usairforce &amp; @HQAirUniversity will produce some amazing results. More via @yhn: https://t.co/NQiCQ2prFM,2019-01-30 17:40:15,Twitter Web Client,2,7
Thanks for taking the time to sit down with me - I enjoyed our discussion! https://t.co/knzTyb0ACS,2019-01-30 15:09:32,Twitter for iPhone,1,6
This afternoon I met w/ the AL Chapter of the American Academy of Pediatrics &amp; the Medical Association of the State of Alabama. I appreciated this opportunity to learn more about the developments &amp; needs of our medical community. Thanks for meeting w/ me &amp; sharing your knowledge! https://t.co/FD5j0maeMV,2019-01-29 21:36:57,Twitter Web Client,2,10
I'm grateful for these opportunities to continue to advocate for the conservative priorities important to the people I represent in AL-02. My full statement: https://t.co/aff2dp1ATR,2019-01-29 18:54:06,Twitter Web Client,0,4
