Great to have another friend &amp; colleague cheering on #TeamCongress at tonight’s @CWSoftballGame! Thanks for being here to help us #BeatCancer &amp; #BeatThePress @SteveScalise! #CWSG2019 https://t.co/FTS0exT8ZR,2019-06-20 00:24:00,Twitter for iPhone,24,188
Thanks for coming out to the @CWSoftballGame to show your support @GOPLeader! #TeamCongress #BeatCancer #BeatThePress https://t.co/SIPeNR49DQ,2019-06-20 00:14:17,Twitter for iPhone,1,28
Bad news for the #BadNewsBabes: #TeamCongress knows how to RUN &amp; WIN. In tonight’s @CWSoftballGame we’re ready to #BeatCancer &amp; #BeatThePress! Game starts at 7pm EST. More here —&gt; https://t.co/ZiREv5OYoq,2019-06-19 19:57:35,Twitter for iPhone,1,3
Members of the Alabama Music Educators Association stopped by my office this morning &amp; we discussed the importance of music education &amp; how Congress can be supportive. Thanks for meeting w/ me &amp; for your invaluable work to educate Alabama’s students. I enjoyed our conversation! https://t.co/RallPESpLK,2019-06-19 15:52:31,Twitter Web App,2,14
Wonderful to be on-post at Fort Rucker yesterday for the Change of Command ceremony! Congratulations to General Gayler &amp; General Francis. It was a fantastic morning in the Wiregrass. More via @ALReporter --&gt; https://t.co/78f5fLmPt0,2019-06-18 19:17:17,Twitter Web App,3,12
Margaret George &amp; I attended the Change of Command ceremony at Fort Rucker earlier today. Wonderful to be on-post again to visit w/ some of our district's military leaders. Congratulations &amp; thanks to General Gayler &amp; General Francis. A very exciting morning in the Wiregrass! https://t.co/Eu1JcQicfI,2019-06-17 17:37:08,Twitter Web App,2,11
Happy Father's Day to all the dads! I hope you have a wonderful day celebrating with family. #FathersDay2019 https://t.co/uNiM3V9ruT,2019-06-16 13:59:50,Twitter for iPhone,3,29
Residents of Barbour Henry &amp; Houston counties take note --&gt; https://t.co/noyXLHwYA7,2019-06-14 15:04:01,Twitter Web App,3,5
Today our country celebrates #FlagDay. As we honor the Stars and Stripes may we all reflect upon what it symbolizes: freedom liberty &amp; hope. And may we all remember the many men &amp; women throughout history who bravely sacrificed to defend it. https://t.co/V3P0MDpZaz,2019-06-14 14:56:09,Twitter Web App,4,12
Happy 244th birthday @USArmy! #ArmyBday https://t.co/PF0u8nJcyC,2019-06-14 13:25:24,Twitter Web App,4,7
These AL-02 students are to be commended for their eagerness to serve our great country their academic excellence &amp; their outstanding leadership abilities. Read more about these young men &amp; women here: https://t.co/biWSmTDABn,2019-06-13 18:39:13,Twitter Web App,2,4
Proud to announce I nominated AL-02 students who received apts to the U.S. service academies: Daniel Brayden Banner Theodore Maxwell Dowd Amore Jacarra Hardy Timothy Jurard McClendon Johnny M. Montgomery III Jackson Scott Parker Isaac Taylor Sherman &amp; Seth Cameron White. https://t.co/SDWeWOMVNK,2019-06-13 18:39:12,Twitter Web App,3,7
ICYMI: This week I offered a #ProLife amendment to a funding bill that would prevent taxpayer $ from being spent on abortion in D.C. Taxpayer $ should never be used for the destruction of human life especially in our nation's capital. My amendment helps guard the innocent. https://t.co/Cc2ZX8xsPJ,2019-06-13 14:25:13,Twitter Web App,7,17
DC currently permits abortion during all 9 months of pregnancy for any reason. I can’t begin to express my concern w/ this. My amendment upholds the basic duties of government &amp; helps guard the innocent in our nation's capital. Read more here: https://t.co/QQDxsyKc7Q,2019-06-12 13:55:04,Twitter Web App,7,12
Yesterday during full Appropriations Committee markup of the Financial Services &amp; General Govt Appropriations Subcommittee FY2020 funding bill I offered a #ProLife amendment known as the Dornan Amendment that would prevent taxpayer funds from being spent on abortion in DC. https://t.co/MjrdpXh5LJ,2019-06-12 13:52:00,Twitter Media Studio,6,16
For too long our country has been complicit thru our tax dollars in experimentation using babies' bodies. There are other scientifically-proven ways to conduct research &amp; we can do better. This is a significant #ProLife victory - I thank @POTUS for taking this decisive action.,2019-06-11 16:02:50,Twitter Web App,3,12
Major pro-life win: Last week @HHSGov &amp; @NIH announced they will not renew a contract w/ the University of California San Francisco to fund research using the body parts of aborted babies. https://t.co/oPsEViGvcR,2019-06-11 16:02:49,Twitter Web App,4,9
This morning I met with Southeast Tourism Society members from Alabama. We had a great discussion about the industry and its huge impact on our state. Thank you for stopping by! https://t.co/KPYs8S9IQH,2019-06-11 15:13:49,Twitter Web Client,3,13
@dallas_burrow Hi Dallas please send me a private message with the best contact information for you (phone number email) &amp; my office will be in touch. Thanks for reaching out.,2019-06-10 21:25:44,Twitter for iPhone,0,0
These students' willingness to serve their home district while learning more about our nation's legislative process is highly commendable. Thank you for your hard work. Until we meet again! Pictured here are the AL02-based interns: Hannah Streitman Trent Mann &amp; Will Merrill. https://t.co/lE0UQ1xI92,2019-06-07 16:08:21,Twitter Web App,1,8
My offices are saying goodbye to our 1st group of summer interns today. Over the last few wks they have worked diligently for the people of the 2nd District &amp; I greatly appreciate their efforts. Pictured here are the DC interns: Alex Reynolds Annabel Roth &amp; Greyson Matthews. https://t.co/IeFfij1KVU,2019-06-07 16:08:17,Twitter Web App,2,14
Today on the 75th anniversary of D-Day we remember the #GreatestGeneration &amp; their incredible bravery. May we never forget the more than 160000 soldiers who stormed the beaches of Normandy &amp; changed the course of history. #DDay75 https://t.co/iTEnAea9XX,2019-06-06 14:54:52,Twitter Web App,3,16
Those of us who live and work in AL-02 know well that Fort Rucker is one of the finest military installations in the country &amp; I could not be prouder that they’ve received this outstanding recognition. This honor is well deserved.,2019-06-05 15:02:57,Twitter Web App,3,8
Congrats Ft. Rucker! Last month our Wiregrass military installation received the Army Communities of Excellence Gold Award for their quality in installation management that has led to improved readiness in energy efficiency emergency services &amp; more. https://t.co/GhxyP9EWoj,2019-06-05 15:02:57,Twitter Web App,6,14
Great news for AL-02! Dothan Elba Eufaula &amp; Wetumpka have all been designated “Main Street Alabama Communities.” @MainStreetAl works to revitalize communities across the state. Read more about this organization &amp; see the full list of communities here: https://t.co/4VaWS91y32,2019-06-04 19:44:16,Twitter Web Client,1,6
ICYMI: Last night the House passed a disaster relief bill that includes aid for Wiregrass communities that were devastated by Hurricane Michael. The bill now awaits POTUS' signature. Grateful to finally send help to those who need it most especially our farmers. via @yhn https://t.co/aw4zGtHmTa,2019-06-04 18:13:57,Twitter Web App,3,13
Each student who participates in my D.C. internship program works w/ their peers to draft &amp; present a policy proposal on a topic of their choice. These students selected an important issue &amp; I'm proud of their work. More info about the internship program: https://t.co/rrjgLi9Xkm,2019-06-04 17:27:53,Twitter Web App,2,7
Earlier today Alex Annabel &amp; Greyson the students in my D.C. office's 1st internship session presented their policy proposal. Their proposal raises awareness for badly needed research on foster care &amp; also offers modifications to current legislation related to foster care. https://t.co/BC6eosD235,2019-06-04 17:27:51,Twitter Web App,3,18
ICYMI: Last wk while Congress was out of session I had the opportunity to visit w/ my constituents on the ground in AL-02. Great to spend quality time in Brundidge Ozark Montgomery Eufaula &amp; Dothan. Big thanks to all who made our conversations productive! More via @yhn --&gt; https://t.co/06gPqJC1V9,2019-06-04 13:52:24,Twitter Web App,3,5
I am eager to see the President sign this bill into law to finally help the many Americans who have suffered extreme devastation in the wake of natural disasters across the country.,2019-06-03 23:08:48,Twitter Web Client,11,18
Next stop: The White House. For 8 long months farmers in the Wiregrass &amp; throughout the SE have waited for disaster relief aid after Hurricane Michael devastated the region last October. I am very proud that Congress has at last delivered this long-overdue assistance. https://t.co/Do3rMt48uZ,2019-06-03 23:08:04,Twitter Web Client,6,12
I congratulate the new commander Col. Edward Casey for this remarkable achievement. I look forward to working w/ him as we strive to strengthen our district’s military footprint together. Thank you for your service &amp; best wishes in your new role! 🇺🇸,2019-06-03 19:34:50,Twitter for iPhone,1,4
I attended Col. William Sparrow’s Change of Command ceremony at Dannelly Field on Friday. What a special occasion! Col. Sparrow led the 187th Fighter Wing with distinction &amp; I’m grateful for his service to our country &amp; the River Region. I wish him great success moving forward. https://t.co/vOjfT9jg5c,2019-06-03 19:32:49,Twitter for iPhone,2,12
During my time in Dothan last week I attended the grand opening of a new Five Star Credit Union location. It was wonderful to meet employees &amp; tour the brand new facility. I was glad to be involved in the festivities as we celebrated new #jobs in the Wiregrass! https://t.co/hacSB8qMAA,2019-06-03 14:47:53,Twitter for iPhone,2,4
This morning I attended a ceremony in Dothan at Glasstream Powerboats celebrating their business’ expansion. I’m thrilled any time I have the opportunity to celebrate the creation of new jobs in our AL-02 communities. The Wiregrass is open for business! https://t.co/nOKGS7PH77,2019-05-31 20:19:15,Twitter for iPhone,3,14
While in Eufaula yesterday I stopped by American Buildings Company where I sat down w/ company leadership to learn more about their legislative priorities. I enjoyed our visit &amp; appreciated the candid conversation. Thanks for having me! https://t.co/NEAKt8m4uG,2019-05-30 15:33:55,Twitter for iPhone,2,10
George &amp; I had a fantastic day in Eufaula! We started the morning w/ a visit to Johnson Outdoors Marine Electronics where we were given a very engaging &amp; informative tour. We enjoyed visiting w/ company leadership &amp; employees to learn about the innovative work they perform. https://t.co/ESAm9VFE9J,2019-05-29 21:01:20,Twitter for iPhone,2,15
I appreciate the Carrolls for graciously hosting me &amp; sharing their insight &amp; experience. Agriculture is the backbone of our district’s economy &amp; it is very important for me to spend time on the ground with our farmers.,2019-05-29 15:31:02,Twitter for iPhone,2,5
Chris &amp; Monica Carroll are 5th generation owners of a beautiful farm in Ozark that produces cattle poultry soybeans &amp; wheat. Yesterday while I was in the Wiregrass I had the opportunity to tour their operation &amp; see firsthand the hard work they do. https://t.co/VNs7sCGF40,2019-05-29 15:30:05,Twitter for iPhone,3,10
@John_R_Ramage Always wonderful to see you. Thanks for your kind words friend!,2019-05-28 22:07:12,Twitter for iPhone,0,5
It was a privilege to join the Ozark Kiwanis Club for their meeting today. I appreciated having the opportunity to give an update from Washington on a number of topics especially about our efforts to deliver disaster relief. I’m hopeful this will be done soon. Thx for hosting! https://t.co/UO1FNLCfZU,2019-05-28 22:02:56,Twitter for iPhone,3,11
I am grateful for this opportunity to see Bell Helicopter’s work firsthand &amp; I am eager to see the company continue to thrive right here in Alabama’s Second District. My son George is on the road working w/ me today &amp; he thoroughly enjoyed the visit too! Thanks for hosting us!,2019-05-28 17:43:05,Twitter for iPhone,2,16
Just wrapped up a great trip to Bell Helicopter in Ozark where I met w/ employees &amp; company leadership &amp; toured their impressive facility. Bell currently employs 76 people &amp; they perform incredibly important work supporting our military. https://t.co/mYK1zNPN6i,2019-05-28 17:41:47,Twitter for iPhone,4,26
I started the day off at Brundidge City Hall visiting with Mayor Isabell Boyd &amp; several constituents. I enjoyed our conversation &amp; appreciated hearing directly from the group. It’s always great to be in Pike County! https://t.co/yuOTt2DUbi,2019-05-28 15:50:59,Twitter for iPhone,4,11
Today our country takes a collective pause to remember those who gave their lives in service to this nation paying the ultimate price for the freedoms we enjoy. May we always remember the true meaning of Memorial Day. 🇺🇸 https://t.co/AKsMNb5oVA,2019-05-27 14:16:46,Twitter for iPhone,8,48
Still starstruck after having the opportunity to introduce Charlotte Caffey &amp; Jane Wiedlin of The Go-Go's at last night's We Write the Songs concert. Thx @ASCAP for hosting the event to showcase the creative process behind the hits we love. #WeGottheBeat https://t.co/BUkXzd5qqw,2019-05-22 13:59:30,Twitter Web App,5,15
Earlier today I met w/ a group of Central AL Electric Cooperative employees who are in DC to learn more about our legislative process &amp; the importance of advocacy. Had a great discussion about efforts to improve access to rural broadband in AL-02 communities &amp; across the country. https://t.co/Muy8nLgVhI,2019-05-21 18:12:28,Twitter for iPhone,3,16
100 years ago today the House passed a constitutional amendment guaranteeing women the right to vote. Today we celebrate those who courageously fought to include women's voices in our democracy &amp; in doing so changed the face of our nation's history forever. #WomensVote100 #OTD,2019-05-21 14:52:59,Twitter Web App,45,145
Exciting news: Last year Alabama experienced record tourism numbers. Visitors spent over $15 billion in our state last year alone with a growing number visiting Montgomery my hometown! https://t.co/Q70hIlVr6e,2019-05-21 14:07:42,Twitter Web Client,2,10
Several military bases were severely impacted by recent storms &amp; need help to recover. The House acted last week. I hope the Senate follows suit quickly so we can send an improved disaster aid bill to the President's desk.,2019-05-17 16:54:06,Twitter Web App,3,11
Farmers in the Wiregrass &amp; across the country desperately need disaster relief &amp; so does the Department of Defense. Congress must get this done immediately. Read what @SecAFOfficial Wilson has to say: https://t.co/idEEmgBjq4,2019-05-17 16:54:05,Twitter Web App,2,11
Just over a month away! I am excited to participate in the @CWSoftballGame again this year as we rally together to support young women battling breast cancer - a deeply worthy cause. https://t.co/RSLg3hLGvr,2019-05-16 17:10:43,Twitter Web App,6,17
Throughout my time in Congress I have been staunchly &amp; unapologetically pro-life. I will continue to use my platform to advocate for the unborn. Check out @WDHN’s coverage of my recent efforts on the federal level to defend life at every stage: https://t.co/PYXsxwX7af,2019-05-16 01:04:32,Twitter for iPhone,6,31
It's #NationalPoliceWeek! Let's all take time to thank our law enforcement officers &amp; their families for their work &amp; sacrifices to keep American communities safe. https://t.co/zDVTuFaEs9,2019-05-14 14:28:14,Twitter Web App,18,43
Great news for AL's local airports! The FAA awarded $20.8 million in grants to 5 airports across AL including Franklin Field Airport in Union Springs. This funding will be used for vital projects &amp; I appreciate @SenShelby’s leadership in these efforts. https://t.co/7vKsTlowXM,2019-05-13 19:19:05,Twitter Web Client,8,10
The @nationalcouncil has 7 skills you can use to help a friend in need: https://t.co/tGebsTTnl8,2019-05-13 16:40:52,Twitter Web Client,3,6
Did you know that 1 in 5 individuals will be affected by mental illness in their lifetime? May is #MentalHealthMonth. I encourage you all to spend this month raising awareness working to erase the stigma and exploring the many resources available. https://t.co/xviXcFGAaP,2019-05-13 16:40:52,Twitter Web Client,4,11
To all the moms out there Happy Mother's Day! We truly have the most rewarding and wonderful job in the world. I hope you spend this special day with all the people you love most. https://t.co/cyKzCYuNJB,2019-05-12 15:30:04,Twitter for iPhone,2,22
On this #MilitarySpouseAppreciationDay join me in thanking all military spouses for the many sacrifices they make in service to our country. https://t.co/oLQHJsdH1W,2019-05-10 20:11:20,Twitter Web App,5,9
That's why I was glad to lead a letter signed by 117 of my colleagues that today was sent to Dr. Norman Sharpless Acting FDA Commissioner urging him to crack down. I'm proud to join my colleagues in sending the clear message that we won't tolerate these dangerous practices. https://t.co/qkNfe6Mt4M,2019-05-10 15:13:14,Twitter Web App,5,10
By violating FDA safety protocols these companies endanger the health of American women &amp; their children. The FDA must take decisive action against these illegal activities immediately.,2019-05-10 15:13:13,Twitter Web App,2,9
Troubling: Certain abortion-by-mail providers primarily based in Europe have widened their consumer base to include the United States. These companies provide remote consultations send prescriptions to be filled in India &amp; then send the abortion drugs to American customers.,2019-05-10 15:13:13,Twitter Web App,3,10
Looking forward to talking with @jeff_poor at 3:30 p.m. Central Time! Tune in live: https://t.co/ui0HKIaZz5 https://t.co/vJHetK4dVA,2019-05-09 20:12:42,Twitter Web App,4,7
This morning I sat down with @UofAlabama President Dr. Stuart Bell. I was glad to learn about his priorities and to hear about the wonderful developments happening on campus. Thanks for your time! https://t.co/XgLTzyLGEE,2019-05-09 15:08:10,Twitter for iPhone,3,7
It was great to see Alabama State Forester Rick Oates and Southern Foresters Policy Director Tim Foley in Washington today. I enjoyed our discussion! https://t.co/72iCLLlEIr,2019-05-08 21:17:32,Twitter Web Client,4,12
The Trump Admin’s rule requires any clinic using TitleX $ to be physically/financially separate from facilities that perform abortions drawing a clear line between family planning services &amp; abortion providers. My amendment would give this rule a fighting chance of becoming law.,2019-05-08 19:25:31,Twitter Web App,6,19
My amendment is simple: We cannot handcuff the current Administration to regulations of the past. Despite the inclusion of the Hyde Amendment abortion providers like Planned Parenthood have been able to get their hands on American tax dollars through TitleX $.,2019-05-08 19:25:30,Twitter Web App,8,16
While the rule is going thru the judicial process the Dem majority on the House Approps has elected to tie the hands of HHS thru legislation stating that the Dept. may only act in accordance w/ regulations established before 1/18/17 - TWO days before Donald Trump became POTUS.,2019-05-08 19:25:30,Twitter Web App,3,2
I offered an amendment to the LHHS FY2020 bill that would allow courts NOT the Dem majority to decide the fate of the Trump Admin's rule restricting TitleX family planning $ from being directed to entities that aren't physically/financially separate from abortion providers. https://t.co/37cFba8Iym,2019-05-08 19:25:29,Twitter Web App,6,19
Earlier today I visited w/ Glenn Crumpton &amp; Christian Arnold who traveled to Washington from Montgomery w/ the American Orthotic &amp; Prosthetic Association. We discussed ways we can help those who have suffered limb loss or impairment receive quality care. Thanks for your time! https://t.co/sUUd8m3cv4,2019-05-08 17:31:21,Twitter for iPhone,2,6
I just met with Dr. John Allen Meadows from Montgomery. We had a great conversation about ways we can better support individuals who suffer from allergies &amp; asthma. I appreciate his advocacy for these issues w/ the Allergy &amp; Asthma Network. https://t.co/hT6dpownSw,2019-05-08 15:08:54,Twitter for iPhone,5,45
The success of Afghan women is indicative of the entire country’s success &amp; I'm optimistic about the process toward reaching peace. Also grateful for our country’s relationship w/ Jordan &amp; for the stability our ally brings to the region. Great trip - looking forward to next yr!,2019-05-07 21:13:28,Twitter Web App,1,4
In Congress I have also maintained a strong commitment to improving circumstances for Afghan women &amp; this annual trip also serves as an important opportunity for us to remain engaged ensuring continued forward momentum.,2019-05-07 21:13:28,Twitter Web App,1,8
This trip marks 8th yr I've visited w/ deployed US soldiers &amp; Afghan women around Mother’s Day &amp; it is always deeply important to me. The trip serves as a reminder of our servicemembers’ sacrifices - spending months away from their families often in harm’s way defending us.,2019-05-07 21:13:28,Twitter Web App,0,2
Wow - what a special trip. I just returned from a bipartisan female congressional delegation to Afghanistan &amp; Jordan led by my friend @RepSusanDavis. During the visit our group met w/ U.S. servicemembers top military commanders &amp; Afghan &amp; Jordanian leaders. https://t.co/h5FolH8It3,2019-05-07 21:13:27,Twitter Web App,2,32
This week is #SmallBusinessWeek! Join me in celebrating our nation’s 30 million small businesses and all that they do for our communities especially those in AL-02. You can find more ways to show your support here: https://t.co/tiUBbvufBs https://t.co/Fekt53tKzL,2019-05-07 14:33:17,Twitter Web Client,1,3
Happy #TeacherAppreciationWeek! As a mother I'm grateful for our educators who pour so much into AL's students. This week I hope you'll #ThankATeacher for their dedication &amp; sacrifices. Check out some of the ways businesses are saying “thank you” here: https://t.co/xK6iyXRITe,2019-05-06 20:38:59,Twitter Web Client,1,8
It’s #NationalNursesWeek! This week we honor the nurses who dedicate their lives to helping others. Through long hours &amp; challenging situations nurses play a vital a role in our health &amp; wellness. A special “thank you” to the nurses in AL-02 - it's a true honor to serve you. https://t.co/U9zXOJiMVz,2019-05-06 17:46:51,Twitter Web Client,2,12
Great news from today's #JobsReport! 263000 new jobs were added last month. Business is booming wages are increasing &amp; the job market is strong. https://t.co/o9kDbulIUh,2019-05-03 16:55:23,Twitter Web App,5,17
The Alabama Teacher of the Year Zestlan Simmons stopped by my office this afternoon. Congratulations on this great honor and thank you for your efforts to educate our students and prepare them for bright futures. https://t.co/wd8SKyXavl,2019-05-02 18:12:38,Twitter Web Client,2,11
I met w/ the Southern Crop Protection Association to discuss a number of issues including the need for disaster relief funding in AL. I'll continue the fight in Congress to help farmers who have been set back by severe weather. Thank you for meeting w/ me &amp; sharing your insight. https://t.co/1DRkSCTvhr,2019-05-02 14:35:28,Twitter Web Client,11,15
One of my constituents Bobby Tomberlin from Luverne stopped by today with the Nashville Songwriters Association to discuss the challenges songwriters are facing in their creative work. Thank you for your time and for sharing your talent! https://t.co/qPBKiRdooJ,2019-05-01 20:11:31,Twitter Web Client,2,12
This morning I spoke w/ members of the Alabama Rural Electric Association. Representatives from AL's 22 distribution cooperatives were in attendance. We had a great discussion about energy issues impacting our state’s electric cooperatives. Thank you for your time &amp; conversation! https://t.co/z6jQZ9Z5iH,2019-05-01 16:56:20,Twitter Web Client,1,10
Yesterday I met Birmingham-Southern College President Daniel Coleman &amp; VP for Advancement &amp; Communications Virginia Loftin. I was glad to hear about the many exciting developments happening on campus! Thanks for your time. @FromTheHilltop https://t.co/bTd1R6fr6X,2019-05-01 13:18:49,Twitter for iPhone,2,6
I met with the Alabama Beverage Association this afternoon. I appreciated hearing their perspective on a variety of topics important to their industry. Thanks for your time! https://t.co/0djTIlpY6s,2019-04-30 20:05:15,Twitter Web Client,1,4
AnDrika Miller stopped by to advocate for issues impacting families. The last time I saw her precious son he was just a tiny baby! As a mother I recognize the many resources parents need to ensure their kids are thriving &amp; I remain committed to fighting for them in Congress. https://t.co/NswVGxEag2,2019-04-30 18:22:12,Twitter Web Client,2,7
I sat down with members of the Wiregrass Electric Cooperative this morning to discuss our efforts to improve broadband access in Alabama’s rural communities. I assured them that this remains a priority of mine. Thank you for coming by! https://t.co/7fFapA2RdV,2019-04-30 17:00:47,Twitter Web Client,3,11
Inaccurate or miscounted numbers in the 2020 Census will mean Alabama has to do more with less &amp; that cannot happen. It is critically important that our rural communities be accurately counted.,2019-04-30 15:57:47,Twitter Web App,1,11
