The bipartisan Veteran Treatment Court Coordination Act we passed tonight upholds our responsibility to our servicemen and women. So many veterans carry scars—both seen and unseen—and they deserve the counseling and treatment they need to stay out of the criminal justice system.,2019-10-29 01:05:22,Twitter for iPhone,0,11
@JoshRBuckley @andybiggs4az @SenatorSinema @SenMcSallyAZ Hey Red Mountain High Students! You can contact us on Twitter Facebook Instagram our website...or even the old fashioned way by sending me a letter.,2019-10-28 19:11:06,Twitter for iPhone,1,26
Today marks the beginning of #Diwali the Festival of Lights. May it bring happiness prosperity and light into your lives! https://t.co/1rwRZ63DC5,2019-10-27 15:43:32,Twitter for iPhone,4,10
Congrats Lynette Stant! After 15 years teaching in the Salt River Pima-Maricopa Indian Community Mrs. Stant is the first Native American woman to receive this honor. She's an advocate for students in small rural schools and our students deserve outstanding educators like her. https://t.co/zg7nDZbFxt,2019-10-25 16:31:59,Twitter Web App,0,16
The SHIELD Act: ✅Creates a duty to report illicit offers of campaign help from foreign governments ✅Improves online political ad transparency ✅Restricts campaign info exchanges between candidates and foreign governments ✅Prohibits deceptive practices about voting procedures,2019-10-23 22:40:14,Twitter for iPhone,2,5
Foreign adversaries attacked our 2016 election and plan to do the same in 2020. To fight back we just passed the SHIELD Act to strengthen the laws to protect U.S. elections against foreign intervention.,2019-10-23 22:40:13,Twitter for iPhone,3,12
Love to see stories of kindness like this. Keep up the good work❤️🤝🖐👊 @TempeElementary. https://t.co/CoiL691VIu,2019-10-23 18:36:36,Twitter for iPhone,0,10
Tomorrow marks the next chapter for @downtownphoenix. The @FrysFoodStores will serve those who previously lived in a food desert offer affordable and healthful food to residents along the light rail and create new jobs. Welcome to #dtphx Fry’s! 🍎 https://t.co/NTPGFk9DR3,2019-10-22 22:12:29,Twitter for iPhone,4,63
Congressman Elijah Cummings spoke with such moral authority not just because of his oratory skills but because he was decent and fair and a tireless champion for the less fortunate and the enduring ideals that make America great. My full statement on his passing: https://t.co/XeeUrFZh0a,2019-10-17 12:08:10,Twitter Web App,36,147
Ran into my old friend Ambassador @EAnthonyWayne tonight at an event with the American Leadership Initiative. When he served as American Ambassador to Mexico he welcomed many of our delegations from Phoenix and helped us improve our trade relationship. https://t.co/lWFZy0Xckw,2019-10-16 23:11:49,Twitter for iPhone,1,8
The President is now resorting to withholding information about our national security from Congress because he didn't get his way. This isn't leadership it's a tantrum. https://t.co/izrJL6Ioup,2019-10-16 21:58:12,Twitter Web App,2,19
Today the House—with overwhelming bipartisan support—opposed President Trump's impulsive decision to withdraw U.S. troops from Syria. Shortly after the White House canceled an all-member classified briefing on the situation the President's actions have caused.,2019-10-16 21:57:57,Twitter Web App,2,25
In Congress we're fortunate @RepOHalleran represents this region and is taking action. I'm proud to cosponsor his bill H.R. 4318 which would provide federal resources to stabilize communities affected by energy plant closures and support displaced workers.,2019-10-16 14:54:36,Twitter Web App,1,9
The Navajo Generating Station has supported the Navajo Nation and Page's economy for decades. Those jobs are hard to replace. Many workers are now faced with the difficult choice: leave home for the replacement job offered or start their careers over. https://t.co/LO76EPHhzv,2019-10-16 14:54:36,Twitter Web App,1,8
No veteran who has served our nation should have to live on the streets—especially not veterans with young children. Tonight we passed H.R. 95 the Homeless Veteran Families Act to ensure the VA can help minor children of homeless veterans find a safe place to live.,2019-10-15 23:25:35,Twitter for iPhone,3,29
In 2016 our Phoenix City Council voted unanimously to join cities across the U.S. in observing #IndigenousPeoplesDay. Today we promote a more accurate understanding of Arizona’s history and reflect on the contributions both past and present of the Native American population.,2019-10-14 14:58:17,Twitter for iPhone,15,58
Happy #NationalComingOutDay to everyone who has come out who will come out who never got the chance to come out and to anyone who has supported someone coming out. https://t.co/69svrfTZpt,2019-10-11 18:21:04,Twitter Web App,8,44
Our Arizona Congressional delegation gets together every month to catch up and talk about what's going on in our districts. These are important opportunities to remind us that we can get more accomplished when we work together. Watch @harrisonmantas's story for Cronkite News. https://t.co/uNY6GTS8Sh,2019-10-09 18:27:22,Twitter Media Studio,3,8
Wishing an easy fast and blessed holiday to all observing #YomKippur this evening. G'mar Chatima Tova.,2019-10-08 20:53:14,Twitter Web App,3,4
The President’s decision to turn his back on our allies shows weakness not wisdom and sends a chilling message to those we ask to stand with us in times of uncertainty. Read my full statement: https://t.co/LKEdpp2uID,2019-10-07 18:20:20,Twitter Web App,5,20
October is Domestic Violence Awareness Month. You can help by spreading the word about these important resources:   AZ Coalition to End Domestic Violence: 602-279-2900 National Domestic Violence Hotline: 1-800-799-7233 National Sexual Assault Hotline: 1-800-656-4673  #DVAM2019 https://t.co/yt62eiBcXY,2019-10-07 14:25:49,Twitter Web App,5,6
Thanks for a great event! https://t.co/a25EWOipCg,2019-10-03 19:59:53,Twitter for iPhone,0,3
I’m fortunate to represent South Scottsdale in Congress including @CoronadoSUSD. I had the chance to visit with several Government classes today to talk with students about my experience in Congress so far and encourage them to get more civically involved. Go Dons! https://t.co/Qn6ZpXG1OJ,2019-10-02 20:27:15,Twitter for iPhone,3,7
HAPPENING NOW: I'm participating in a @HouseAdm_Dems a field hearing in Phoenix on Voting Rights and Elections Administration in Arizona. You can watch the hearing live here: https://t.co/VNpbyV0tXj,2019-10-01 17:17:06,Twitter Web App,0,6
Sundown marks the start of #RoshHashanah the Jewish New Year. Wishing you a peaceful and prosperous 5780. Shanah Tovah!,2019-09-29 21:23:17,Twitter for iPhone,4,14
Another productive Arizona congressional delegation breakfast in the books! @RepDavid practiced his stand up routine with us. https://t.co/D7bkuibE2V,2019-09-26 20:33:12,Twitter for iPhone,1,20
September is National Suicide Prevention Month. All month long mental health advocates prevention organizations survivors and allies have come together to promote awareness around prevention. Watch to learn more about 5 steps you take take to help those who may be hurting. https://t.co/0OSfTTSHJR,2019-09-26 15:10:41,Twitter Media Studio,7,15
"We don't accomplish anything in this world alone... and whatever happens is the result of the whole tapestry of one's life and all the weavings of individual threads form one to another that creates something.",2019-09-25 18:25:49,Twitter Web App,1,2
"As a citizen you need to know how to be a part of it how to express yourself — and not just by voting.",2019-09-25 18:25:49,Twitter Web App,1,2
"In terms of having the American people look at the court and think of it as being fair and appropriate for our nation it helps to have women plural on the court.",2019-09-25 18:25:48,Twitter Web App,0,0
"Do the best you can in every task no matter how unimportant it may seem at the time. No one learns more about a problem than the person at the bottom.",2019-09-25 18:25:48,Twitter Web App,0,0
In honor of the anniversary here are some of Justice O'Connor's most inspiring words.   "I don't know that there are any shortcuts to doing a good job.",2019-09-25 18:25:48,Twitter Web App,0,2
Today in 1981 Sandra Day O'Connor made history when she was sworn in as the 1st female Supreme Court Justice. Since her time on the bench she has worked tirelessly to advance civic learning and ensure all citizens understand the Constitution and participate in their community. https://t.co/VqWsqeEfsn,2019-09-25 18:21:30,Twitter for iPhone,1,10
My statement regarding further evidence of President Trump's impeachable conduct: https://t.co/LNUXVG8SoT,2019-09-24 18:45:39,Twitter Web App,28,111
It's #NationalVoterRegistrationDay—the perfect opportunity to make sure you're ready to go on election day! 🗳Whether you recently moved 🚚 are registering for the first time🎉 or just want to make sure everything's up to date✔️ click ➡️ https://t.co/5YiHH0ffVM. https://t.co/UrQtuX0CRm,2019-09-24 17:08:11,Twitter for iPhone,5,10
On average Native women make 58 cents on the dollar—one of the largest wage gaps in the US— and work 9 additional months just to get paid what their white male counterparts got paid last year. On #NativeWomensEqualPay we call for equity and paycheck fairness for Native women. https://t.co/RWDGyYfT4Z,2019-09-23 18:49:21,Twitter Web App,7,9
Special congrats to McKayla Skinner and Jade Carey on this incredible accomplishment. Arizona will be rooting for you! https://t.co/OcEwU8PV8N,2019-09-23 17:19:53,Twitter for iPhone,0,3
Huge congrats to Cody Friesen ASU professor and @zeromasswater founder for winning the 2019 Lemelson-MIT Prize for invention. The award honors inventors whose ideas bring significant value to society. Read about his work to solve the global water crisis. https://t.co/H6hnTOpEou,2019-09-23 14:09:40,Twitter Web App,4,21
I've seen up close how the lack of transportation infrastructure hinders economic development in tribal communities including Gila River + the Navajo Nation. @RepDavids @repdonyoung + I asked @USDOT to focus on tribal nations when awarding BUILD grants. https://t.co/gYbYtPQTzW,2019-09-20 21:38:45,Twitter Web App,0,2
We spoke with early intervention experts and pediatricians about addiction and child welfare. Together we're learning more about the complexities of addiction and the bipartisan policies we can advance to end the crisis. Thank you @RepDavidTrone for bringing this group together. https://t.co/6seLA3TuuE,2019-09-20 20:46:52,Twitter Web App,2,4
23 million Americans across the nation are recovering from addiction and 20 million more are still struggling to seek treatment. This morning our Freshman Working Group on Addiction had an important conversation about the impact of the opioid crisis on children and families. https://t.co/TXuB6wQ9oz,2019-09-20 20:46:51,Twitter Web App,2,12
Following today's designation as a Nebraska state statue Chief Standing Bear stands in the U.S. Capitol as a reminder of his fight for justice. His words are inscribed: “The blood that will flow from mine will be the same color as yours. The same God made us both. I am a man.” https://t.co/kn4glwdgfw,2019-09-18 21:29:05,Twitter Web App,4,16
The legacy of Chief Standing Bear weighs heavily on our country’s history. After the Ponca tribe was forced to leave their home in 1877 Chief Standing Bear successfully fought the federal government to recognize Native Americans as persons entitled to civil rights under the law. https://t.co/9rsE8CrW6q,2019-09-18 21:29:02,Twitter Web App,15,31
This is a shameful day for Arizona. My full statement regarding the Arizona Supreme Court’s Brush &amp; Nib decision: https://t.co/cC8bpeYkz8,2019-09-16 18:31:21,Twitter for iPhone,26,81
Los hispanoamericanos han contribuido enormemente a nuestro país. Durante el Mes de la Herencia Hispana reconocemos y celebramos lo afortunados que somos de tener una comunidad hispana vibrante y creciendo en Arizona. Nuestro futuro es brillante debido a nuestra diversidad. https://t.co/VEQcrvAgxE,2019-09-16 14:50:30,Twitter for iPhone,1,3
Hispanic Americans have contributed immeasurably to our country. During #HispanicHeritageMonth we recognize and celebrate how fortunate we are to have a vibrant and growing Hispanic community in Arizona. Our future is bright because of our strong diversity. https://t.co/cPLWBdzyhk,2019-09-16 14:38:16,Twitter for iPhone,16,45
Back in July I advocated for federal investment in the Tempe Streetcar at a @TransportDems hearing. Just heard from @FTA_DOT that the project will be awarded $75 million in Capital Investment Grant funds. A huge win for one of the highest transit ridership centers in our region!,2019-09-13 21:28:17,Twitter for iPhone,14,81
Congrats and cheers to @PedalHausBeer for being named BEST IN THE U.S. at the 8th annual Copa Cervezas de América a competition for beer makers in Latin America and North America. Making #AZ09 proud! https://t.co/jfCCxddgt3,2019-09-13 18:37:54,Twitter Web App,1,8
Let me know what issues matter most to you. Take our survey and share your top priorities ➡️ https://t.co/rBtRNHq5TI,2019-09-12 20:14:14,Twitter for iPhone,0,2
I voted yes today to #ProtectTheArctic. Opening drilling in the Arctic National Wildlife Refuge would destroy one of the last unspoiled places on Earth and be a death sentence for the wildlife that depend on this ecosystem. This sacred landscape is no place for drilling. https://t.co/is2j2NhpmM,2019-09-12 16:52:53,Twitter Web App,7,34
When the 9/11 attacks happened 18 years ago first responders didn't hesitate to run towards disaster to save lives. I'm proud of the work we did in Congress to finally reauthorize the Victims Compensation Fund to give those heroes the care they deserve.  https://t.co/9ZZ1P3LmUe,2019-09-11 20:50:09,Twitter Web App,1,12
Today we remember the thousands of Americans who lost their lives on September 11 2001. It is important to teach our children about the selflessness and courage of the 9/11 first responder heroes. In doing so we show how our nation continues to heal 18 years later. #NeverForget https://t.co/zgTkIbm5aj,2019-09-11 14:47:30,Twitter for iPhone,8,46
#WorldSuicidePreventionDay is a good opportunity to check in and say it's okay to ask for help. If you're struggling you're not alone. And there are resources available 24/7.  @800273TALK: 1-800-273-8255 @TrevorProject: LGBTQ Lifeline 1-866-488-7386 https://t.co/KXKqRJQ2L1,2019-09-10 20:49:30,Twitter Web App,13,28
Congress is back in session today after a productive district work period at home in Arizona. We covered a lot of ground meeting with the people organizations and businesses that make Arizona's 9th District so strong. #AZ09 https://t.co/AM9n38rsUH,2019-09-09 19:50:45,Twitter Web App,0,5
It's a remarkable feat to appear at the top of this list once let alone 5 years in a row. President @michaelcrow and @ASU's faculty staff and students continue to push the limits of higher education. The seemingly impossible is being solved right here in Arizona. #High5ASU https://t.co/BJW3ot2nba,2019-09-09 15:11:01,Twitter for iPhone,11,96
I am full of gratitude to the soldiers and families of the @AZNationalGuard. 🇺🇸 I spent some time with a group being deployed to the Middle East. An inspiring moment to say thank you and commit to making sure our National Guard receives the support and resources they need. https://t.co/IuB494k0dC,2019-09-08 22:17:16,Twitter for iPhone,1,16
The #AZCEOSummit brought together an outstanding group of private and public leaders from across the state. It was a great opportunity to share how @RepDavid @RepOHalleran and the rest of our delegation comes together on bipartisan issues that will benefit all Arizonans. https://t.co/dFglAR9jCB https://t.co/p8Va2cWKfq,2019-09-07 19:51:22,Twitter for iPhone,1,3
Two years ago the Trump Administration terminated #DACA putting the legal status of millions in question. Ending this program is not only cruel it could negatively affect our economy. DACA recipients contribute billions in taxes each year and they deserve to stay. https://t.co/9xuwusuQfB,2019-09-05 20:23:36,Twitter Web App,6,18
I support modernizing our infrastructure along the southern border but the tactic of stealing authorized military construction funds—including $30 million from Arizona’s Fort Huachuca—is the wrong move and violates Congress’s unique constitutional appropriation responsibility.,2019-09-04 21:11:47,Twitter Web App,2,6
The Administration is willing to weaken our military to try to leave the impression of fulfilling the President’s failed campaign promise to deliver a border wall.,2019-09-04 21:11:47,Twitter Web App,1,10
Labor Day is a well-deserved tribute to our American workers. We’re grateful for the contributions and achievements of the labor movement. Without unions we wouldn’t have weekends. Enjoy a safe and restful holiday! https://t.co/k6hITlqyP8,2019-09-02 15:11:21,Twitter for iPhone,0,13
First game of the season tonight Devils! #ForksUp #SunDevilTough #GoDevils https://t.co/KeY05sxiVq,2019-08-29 20:08:08,Twitter Web App,1,7
I'm proud of @MayorGallego and the broad bipartisan coalition of business and labor leaders neighborhood groups nonprofits and volunteers who helped defend Phoenix's future. The nation is indeed taking note and we will continue to lead on transportation and infrastructure.,2019-08-29 16:20:58,Twitter for iPhone,0,10
On Tuesday Phoenix voters spoke once again loud and clear: Keep investing in public transit. Since light rail opened 10 years ago it’s exceeded our expectations and brought $11 billion ininvestment along the line—it's been a resounding success and it's here to stay. https://t.co/816U3W6VGh,2019-08-29 16:20:57,Twitter for iPhone,1,24
Trade with Mexico is essential for Arizona’s economy and it supports tens of thousands of good jobs. Thank you Governor @dougducey for a positive bipartisan tele-town hall tonight about the #USMCA and strengthening our trade relationship with Mexico. https://t.co/L0OguJoNjb,2019-08-29 02:50:59,Twitter for iPhone,11,35
On this day 1963: 250000 demonstrators marched with the goal to shine a light on the racism and poverty that persisted 100 years after emancipation. Martin Luther King Jr. delivered his 'I Have a Dream' speech at the March on Washington and his words are still powerful today. https://t.co/CmWJhGK3N7,2019-08-28 20:06:16,Twitter Web App,2,10
We celebrate #WomensEqualityDay to commemorate the adoption of the 19th Amendment to the Constitution granting women the right to vote. Here's to the women who fought for years for this right—and the women who continue to empower others and fight for greater voter access today. https://t.co/oMLyuMeQVr,2019-08-26 17:54:06,Twitter Web App,0,8
Thank you to the @seedspot team for convening such an impressive group of entrepreneurs for Congressional #StartupDay2019. Arizona is a great place to start and grow a business—and we need entrepreneurs at the table to find ways to continue building an innovative economy. #yesphx https://t.co/pGa0NAubDl,2019-08-23 22:39:17,Twitter for iPhone,2,16
Today marks #BlackWomensEqualPay Day or the date in this year when Black women finally earn what white non-Hispanic men made last year. #PaycheckFairness is the first step towards economic security for Black women and families.,2019-08-23 00:55:08,Twitter Web App,1,4
We now have an opportunity to move this policy further in the right direction by extending in-state tuition to Dreamers. Arizona students who have lived and been educated in our state for nearly their whole lives should have equal access to Arizona universities.,2019-08-22 21:41:48,Twitter Web App,2,17
This is the right thing to do for our students our universities and our economy. https://t.co/eE5b2zgFUF,2019-08-22 21:25:25,Twitter for iPhone,14,60
Two-thirds of all reported Valley Fever cases are from Arizona—@RepDavid and I hosted a roundtable yesterday to discuss how to change that. Thank you to the medical experts health care providers and Arizonans with first-hand experience dealing with Valley Fever who joined us. https://t.co/toERmKyw63,2019-08-22 19:02:04,Twitter Web App,10,14
Yesterday I toured the Phoenix Electrical JATC where over 400 apprentices are on their way to becoming electrical contractors. My office is proud to support training programs that provide workers with the technical skills needed to enter the workforce. https://t.co/mUUmAdkzPT,2019-08-21 01:59:19,Twitter Web App,6,23
We capped off our experience talking to representatives from many industries committed to maintaining a strong relationship with Mexico our state's largest trading partner. Our trade partnerships with our southern neighbor support agriculture infrastructure aviation and more. https://t.co/xSRY55AemN,2019-08-16 23:32:59,Twitter Web App,0,8
We stopped by @LutesCasino--a Yuma staple--to try their famous potato tacos and the Especial. We chatted with owner Bob Lutes and caught up with @yumacountyaz Supervisor Lynne Pancrazi. https://t.co/TBOg1S1oxV,2019-08-16 23:32:47,Twitter Web App,0,4
We visited the temporary migrant holding facility. Border Patrol agents showed us supplies on site for families. I spoke with a mother and child from Central America and she was frank with me about her experiences coming to the U.S. and her fear of being returned to Mexico. https://t.co/23DzwE9Wwk,2019-08-16 23:32:42,Twitter Web App,0,2
We first toured the Port of San Luis II where U.S. Customs officials inspect and process commercial imports. It's a critical facility that supports our cross-border trade and business. https://t.co/NHnz4PLf3T,2019-08-16 23:32:26,Twitter Web App,0,3
Yesterday I was in Yuma with State House Minority Leader @CharleneforAZ to tour the San Luis border facilities and meet with local leaders in agriculture trade infrastructure transportation and economic development. https://t.co/mgSPEyOgo9,2019-08-16 23:32:20,Twitter Web App,1,14
7 years ago #DACA began helping young people brought here as children come out of the shadows and work lawfully. Today hundreds of thousands are at risk of losing their legal status. If you have questions about DACA or renewing your status we can help. https://t.co/EcjPjqtRWZ,2019-08-15 23:12:57,Twitter for iPhone,2,7
Today is #NavajoCodeTalkerDay. Navajo Code Talker Fleming Begaye Sr. passed away earlier this year at age 97. He was one of more than 400 Code Talkers who developed a secret military code during WWII. We owe a huge debt of gratitude for their service. https://t.co/8E4jZXYGAU,2019-08-15 00:09:23,Twitter Web App,27,82
Since day one we've been working hard to deliver results to Arizonans. Take a look at some of our team's highlights since the start of the 116th Congress. #AZ09 https://t.co/hdqwYJCmhx,2019-08-13 17:28:25,Twitter Media Studio,3,21
To my friends celebrating the festival of sacrifice Eid al-Adha I wish you many blessings and #EidMubarak.,2019-08-11 21:48:19,Twitter for iPhone,4,24
Before signing the #VotingRightsAct on this day in 1965 President Johnson said "Today is a triumph for freedom as huge as any victory that has ever been won on any battlefield.” 54 years later we have more work to do to ensure every American can exercise their right to vote. https://t.co/g2bdG6HaTc,2019-08-06 22:54:28,Twitter for iPhone,4,18
Thanks for a great meeting and for being advocates for a fiduciary standard across the industry. I look forward to working with you more in the future! https://t.co/yx53qJSu5v,2019-08-05 20:57:34,Twitter for iPhone,0,5
Light rail isn't just for getting to work or school it can also take you to some of the best restaurants in the Valley. Investment in great public transit spurs great economic development and that includes great destinations for foodies. https://t.co/cnUhA1PPmG,2019-08-02 15:41:11,Twitter Web App,0,14
Separating children from their parents at the border on the basis of the parent’s HIV status is cruel and senseless. We’re committed to getting an explanation from the administration. https://t.co/N700MCdDhb,2019-08-01 22:08:14,Twitter for iPhone,29,79
We’re working to improve access to great public transportation options across Arizona in communities big and small. This is a bipartisan bill that would increase support for transit systems in Flagstaff and Casa Grande and help them reach even further. https://t.co/KAFQxNyA62,2019-08-01 18:01:49,Twitter Web App,0,7
Earlier this year the House passed the Save The Internet Act which included my amendment to help promote accessible and affordable broadband service on tribal land. This is an issue that we're going to keep fighting for. #RuralBroadbandDay https://t.co/Pvlw73yxqQ,2019-07-31 17:22:07,Twitter Web App,0,5
Tomorrow the FCC will consider proposals to improve broadband mapping—and we want to make sure they recognize how important the need for affordable reliable high-speed internet is throughout Arizona. #RuralBroadbandDay,2019-07-31 17:22:07,Twitter Web App,1,18
54 years ago President Johnson signed Medicare and Medicaid into law. Today more than a third of Americans get their health care through these two programs—including 3.16 million Arizonans. I'm committed to ensuring more Americans have access to quality affordable health care. https://t.co/oRw4BvijQk,2019-07-30 20:28:32,Twitter Web App,0,7
It's past time that we work together to create a bipartisan comprehensive infrastructure plan. That's why my @newdemcoalition colleagues and I sent a letter to the President outlining our top four priorities for a bold infrastructure plan. https://t.co/eJsSUCFcgW,2019-07-30 15:16:28,Twitter Media Studio,2,10
