Team Stanton is out today celebrating the @cityofchandler 25th Annual Multicultural Festival. Everyone’s enjoying the great food live music and local vendors. There’s still time to swing by—my team is answering questions about our constituent services at the festival until 6! https://t.co/Z85Jj7b8ip,2020-01-18 21:49:57,Twitter for iPhone,4,14
Next week when I'm home in our district I will meet with Arizonans whose businesses depend on trade with Mexico and Canada. I look forward to reporting that Congress got this done in a bipartisan way.,2020-01-16 18:58:07,Twitter for iPhone,0,6
The Senate passed the USMCA today offering much-needed certainty for Arizona businesses and workers. We still have more work to do to ensure our economy sees the benefits from this trade agreement but getting the USMCA passed was a critical step.,2020-01-16 18:58:07,Twitter for iPhone,4,15
Ann Kirkpatrick is one of the finest public servants I know. She's been a fighter her whole life and I'm not surprised to see her make such a brave decision. I wish her all the best in her recovery and look forward to working with her on behalf of all Arizonans when she returns.,2020-01-15 18:14:20,Twitter Web App,19,168
Providing exceptional service to our residents and delivering results is always our goal. I'm so proud that last year we were able to return $1662940 in federal benefits owed to residents of Arizona's 9th district. https://t.co/lYvWGYRcPY,2020-01-14 20:50:39,Twitter Web App,3,15
I am encouraged by the progress being made on the USMCA in the Senate and I hope they are able to get it across the finish line this week. Hard-working Arizonans who rely on market access to Mexico and Canada deserve the certainty USMCA will provide.,2020-01-14 17:52:40,Twitter for iPhone,2,5
After being deployed a year in the Middle East today we welcomed home these brave soldiers from the @AZNationalGuard. We are continually grateful for the sacrifice of our troops and their families. Job well done. https://t.co/B6VwLG6MhC,2020-01-12 00:18:00,Twitter for iPhone,5,21
Congratulations @michaelcrow on being awarded the Lifetime Achievement on Science Service and Leadership from @NCSE this week. A well-deserved recognition of Dr. Crow's exceptional contribution to advancing innovation and sustainability at @ASU. https://t.co/ZSlmi0k2D8 https://t.co/oxMz85Nrp4,2020-01-10 22:28:53,Twitter Web App,2,12
Congress has for too long abdicated its responsibility concerning the conflict in the Middle East. Today I voted to make it clear that Congress must assert its role in the discussion surrounding violent conflict with Iran. The American people deserve to be heard.,2020-01-09 23:10:44,Twitter for iPhone,9,44
On January 8 2011 six innocent people lost their lives to a senseless act of gun violence in Tucson. My friend @GabbyGiffords was among the 13 others shot and wounded. @RepKirkpatrick led the U.S. House tonight in a moment of silence to honor those we lost that tragic day. https://t.co/TPgLs7PIQi,2020-01-09 00:05:02,Twitter Media Studio,30,79
My full statement on U.S.-Iran tensions following today’s classified intelligence briefing from Trump Administration officials: https://t.co/RXYq2do65X,2020-01-08 23:00:25,Twitter for iPhone,11,18
Our letter to President Trump: https://t.co/6MDg6PyAmm,2020-01-08 16:11:40,Twitter for iPhone,5,8
Today I will receive a classified briefing by top Administration officials on the increasingly volatile situation with Iran. I joined my colleagues in sending a letter to President Trump to demand answers about the Administration's strategy to keep Americans safe moving forward.,2020-01-08 16:11:39,Twitter for iPhone,5,21
Happy New Year! It’s been a whirlwind of a decade but one that brought incredible opportunities and growth to our community. I look forward to continuing to work hard for Arizona in 2020. https://t.co/pDfKuGxMK7,2020-01-01 16:48:50,Twitter Media Studio,3,24
As you make your plans for #NYE2020 make sure you you’re ready to #celebratesafe. You can ride bus light rail and Paratransit for FREE starting tonight at 7 p.m. Take advantage of these great public transit options and have fun tonight! https://t.co/VUCskBa7IZ,2019-12-31 17:15:55,Twitter for iPhone,4,7
There is no tougher person than @repjohnlewis — a man who time and time again faced evil with grace humility and strength.  We are a better nation because of him and his moral leadership and have his back during this difficult time.,2019-12-29 23:29:20,Twitter for iPhone,4,41
It's been a full first year in Congress—and together we delivered real results for Arizonans. I'm proud of the work we accomplished for Arizona's 9th District and I'm ready to continue our work in 2020. Read more: https://t.co/QK4yljockV https://t.co/xX0TmyqFRI,2019-12-28 18:04:58,Twitter Web App,2,14
Tonight is the first night of #Kwanzaa. As you light the candles each night and reflect—from Umoja to Imani—may your Kwanzaa be filled with blessings and joy. https://t.co/cjcOP53ZJ3,2019-12-26 17:01:44,Twitter Web App,4,8
From my family to yours I wish you a very Merry Christmas. May the holiday bring you the closeness of friends and the comfort of home. I’m happy to be celebrating in Arizona. https://t.co/MDL4ADLPHj,2019-12-24 23:48:50,Twitter for iPhone,10,57
I’m proud the House voted last week to advance the new USMCA. Arizona businesses—from large corporations to medium- and small-sized firms—made clear that the USMCA will provide much-needed certainty and opportunity for growth. Read what they have to say: https://t.co/69TmH6mQxq,2019-12-23 14:06:23,Twitter for iPhone,3,12
Happy Hanukkah! I hope you enjoy this first night of the Festival of Lights with friends family and loved ones. https://t.co/jmzN4cf1pl,2019-12-22 20:26:55,Twitter for iPhone,11,32
The final 2020 National Defense Authorization Act supports a strong national defense. And I'm proud it included two key amendments I offered to improve veterans’ quality of life. Read more ➡️https://t.co/qYBR2WxVUG,2019-12-21 18:32:51,Twitter for iPhone,4,15
This week @SenMcSallyAZ and I introduced a bipartisan bill to accelerate the development of I-11 in Arizona. I-11 would open up a new transportation corridor in Arizona leading to new jobs and increased trade with our partners in Mexico and Canada. https://t.co/Y4jxbtJILx,2019-12-20 22:13:49,Twitter for iPhone,4,9
Those of us in border states understand the value of trading with our neighbors and growing trade relationships with Mexico and Canada is essential to Arizona. I'm proud the House voted today to advance USMCA—a win for all Arizonans. https://t.co/oXHi3HxkXw,2019-12-19 21:47:28,Twitter Web App,7,24
Today the House will take an important vote to advance an improved North American trade policy. With #USMCA we have a real opportunity to lift job creators. From multinational companies to mid-sized and small businesses there’s no doubt that the new USMCA is a win for Arizona. https://t.co/f3sNDQyU5k,2019-12-19 17:46:27,Twitter Media Studio,9,28
If the Administration has its way and the entire ACA is eliminated 20 million Americans will lose their insurance coverage 135 million Americans with pre-existing conditions will be stripped of their protections and costs will go up for millions more.,2019-12-19 01:03:42,Twitter for iPhone,7,6
Today the Fifth Circuit Court of Appeals declared part of the Affordable Care Act unconstitutional a decision with serious consequences. It leaves the future of health insurance for millions of Americans in limbo with no plan to ensure families can access the care they need.,2019-12-19 01:03:42,Twitter for iPhone,3,18
Today we provided certainty for exporters across AZ by extending the Export-Import Bank for 7 years. Last month I spoke in support of a long-term reauthorization of #EXIM which in the last five years has helped finance upwards of $2B in exports statewide. https://t.co/SevuRw6qqb,2019-12-17 22:41:02,Twitter Web App,4,15
Those funds will put a spotlight on one of our nation’s deadliest epidemics and put us on a path towards answers and solutions. I’m grateful to the work of so many organizations and advocates—and especially the young voices who relentlessly spoke up and fought for this change.,2019-12-17 22:21:06,Twitter Web App,2,18
Today the House took an important and long-overdue step to reduce gun violence. For the first time in more than 20 years we included in our spending bill an investment in gun violence prevention research.,2019-12-17 22:21:05,Twitter Web App,8,65
As the House prepares to vote this week on the United States-Mexico-Canada-Agreement Arizona businesses are speaking up about the importance of trade with our neighboring countries. Read what they have to say about how #USMCA will impact their business. https://t.co/69TmH6mQxq,2019-12-17 19:21:31,Twitter Web App,3,4
UPDATE: The deadline for Open Enrollment has been extended! You now have until December 18 at 1 a.m. AZ time to re-evaluate your current health insurance or #GetCovered for 2020. Visit https://t.co/A4svPXjZDR to enroll or update your coverage now. https://t.co/bd1MvrPMxz,2019-12-17 16:05:14,Twitter Web App,67,170
Last week I introduced a bill with @SenMcSallyAZ to bring more tourism and recreation dollars to our state. The Southwest Tourism Expansion Act will strengthen our relationship with Mexico and open up new economic opportunities to more Arizona businesses. https://t.co/HUPvtwa2Yj,2019-12-17 14:32:09,Twitter Web App,2,13
Last night I joined my fellow House Judiciary Committee members to begin marking up H.Res. 755 Articles of Impeachment. I have been in public life for nearly two decades and it is not lost on me that these are the most consequential votes I will ever take. My full remarks: https://t.co/il8soPFcgc,2019-12-12 21:21:03,Twitter Media Studio,63,266
H.R. 3 allows the @HHSGov secretary to negotiate lower drug prices; extends Medicare coverage to include dental vision and hearing; caps Medicare out-of-pocket costs for seniors and people with disabilities; reinvests the billions of dollars saved into public health and more.,2019-12-12 19:31:07,Twitter Web App,4,14
But right now most cancer medications cost more than $100000 each year. That’s simply too expensive—and 90% of Americans agree. We took action today to lower the costs of medications and treatment and stop drug companies from ripping off American patients.,2019-12-12 19:31:07,Twitter Web App,2,11
Today the House took a bold step toward lowering the cost of prescription drugs for all Americans. Families shouldn’t be burdened with the astronomical costs of life-saving treatments when faced with cancer diagnoses—or diabetes asthma HIV or multiple sclerosis diagnoses.,2019-12-12 19:31:07,Twitter Web App,10,37
The bipartisan Farm Workforce Modernization Act is good for Arizona’s economy—where agribusiness contributes $23.3 billion annually. I voted YES to make it easier for Arizona farmers to meet their workforce needs and provide a path for agriculture workers to earn legal status.,2019-12-11 23:35:05,Twitter Web App,7,20
We are one step closer to cementing certainty for job creators throughout Arizona by securing our nation’s market access in Mexico and Canada. As we near a vote on the USMCA I will continue to work with Arizona’s business community to ensure they have a voice in this process.,2019-12-10 15:26:39,Twitter Web App,1,4
I am encouraged that a deal on the USMCA has been reached and look forward to reviewing it in detail. Strong trade relationships with our North American allies is essential to Arizona’s economy and the USMCA gives us an opportunity to deepen those relationships.,2019-12-10 15:26:39,Twitter Web App,5,18
78 years ago today more than 2000 Americans gave the ultimate sacrifice for our country. Today’s Pearl Harbor Remembrance Ceremony gave Arizonans a chance to honor and remember those who perished those who survived and their families. Thank you to all who have served. https://t.co/ggZqSJM7Cz,2019-12-07 21:23:59,Twitter for iPhone,3,20
Nothing in our democracy is more sacred than the right to vote. The SCOTUS Shelby County v. Holder decision gutted the Voting Rights Act disenfranchising too many eligible voters. We just passed #HR4 to #RestoreTheVote and help stop the most egregious voter suppression tactics.,2019-12-06 17:45:06,Twitter Web App,10,46
There are additional proposals on the table that would eliminate SNAP for another 30000 Arizonans. I’m cosponsoring the Protect SNAP Act because Congress must take action and send a message that this self-defeating economic policy hurts real people in our communities.,2019-12-05 21:39:40,Twitter Web App,3,15
Worse yet this new restriction will also disproportionately affect Native American and rural residents in our state. It ignores the unique economic challenges in rural communities and on Tribal lands and puts those populations at greater risk. And the Administration isn't done.,2019-12-05 21:39:39,Twitter Web App,2,14
Heightened work requirements for SNAP recipients does not lower unemployment rates and does not help anyone find a job. It simply takes away a vital benefit from the most vulnerable in our community. It also strips states' rights to establish their own requirements and standards.,2019-12-05 21:39:39,Twitter Web App,1,10
The Trump Administration made a decision this week that will cause hundreds of thousands of Americans to lose government food benefits--including at least 6700 Arizonans. This is a short-sighted policy change that hurts low-income individuals and tightens the cycle of poverty.,2019-12-05 21:39:39,Twitter Web App,6,28
Today is International Day of Persons with Disabilities. We must grow our situational awareness of the social political and economic obstacles people with disabilities face each and every day and stand by them in demanding an accessible future. #IPWD2019,2019-12-03 21:02:41,Twitter for iPhone,5,23
Thank you to Dawn Schumann and @ibtlu104 for leading the fight at Mission Mine to Fred Yamashita from @ArizonaAFLCIO @937USW and all of the other unions as you pursue what is right and just for workers. https://t.co/OmT46IrWlX,2019-12-02 19:42:56,Twitter Web App,2,10
I stand with the striking workers fighting for fair wages and benefits for ASARCO employees in Southern Arizona. The battle they are waging is important--not just for the workers and their families but for workers across America who deserve honest pay for honest work. https://t.co/LIXslohEF0,2019-12-02 19:42:53,Twitter Web App,11,38
Today is the 31st #WorldAIDSDay. In 31 years there have been incredible advances in our understanding and treatment of HIV. But 1.7M people were newly infected in 2018. It’s on us to spread awareness and erase the stigma. Together we can end HIV and AIDS for the next generation. https://t.co/2AUNFFZg5K,2019-12-01 16:32:16,Twitter for iPhone,7,21
The holidays have arrived in downtown Mesa! Merry Main Street is your one stop shop to support local businesses enjoy the 49-foot tree and take a spin on the ice rink. Thanks to @MayorGiles @MesaChamber @CITYOFMESA for supporting this annual family-friendly community event. https://t.co/rrCpufSeyR,2019-11-30 04:08:59,Twitter for iPhone,12,63
On #NativeAmericanHeritageDay we recognize celebrate the culture traditions and achievements of Native people. Arizona’s history is intertwined with the history of the indigenous people who came before us—and we’re a stronger more diverse state for it.,2019-11-29 23:02:17,Twitter for iPhone,2,12
For every $100 spent at a locally owned business $43 remains in our economy—compared to only $13 when you spend at a non-locally owned business. Nov. 30 is #SmallBusinessSaturday the perfect opportunity reinvest your dollars here in our community. Where will you shop tomorrow? https://t.co/DrgF4iktDU,2019-11-29 22:40:33,Twitter for iPhone,2,11
It’s the season for giving. My family and team enjoyed serving Thanksgiving dinner to local families tonight at the @ClubzonaBGC in Chandler. https://t.co/SADSqTRQYQ,2019-11-28 03:30:26,Twitter for iPhone,4,10
Today @POTUS signed my bipartisan bill to permanently extend security protections for our Supreme Court Justices. It is important that we protect the Justices of the highest court in the land—on that Congress is united. Thanks to @RepGregSteube for leading this effort with me.,2019-11-28 00:54:00,Twitter for iPhone,2,13
All month long we've been honoring our veterans. I had the opportunity to interview Major Fannie Griffin McClendon one of nearly 800 women in the Army’s first and only all-Black all-female battalion to serve overseas for the @librarycongress Veterans History Project. Watch: https://t.co/8lmEs7BLgt,2019-11-27 19:04:55,Twitter Media Studio,7,17
AZ continues to lead when it comes to increasing cross-border business. We’ve enhanced our trade capacity with innovative solutions like the @SkybridgeA inland international port at @gatewayairport. Thanks to @MayorGiles @MesaDistrict5 and the Gateway team for the inside look. https://t.co/toyYgkEYMz,2019-11-26 00:28:20,Twitter for iPhone,6,18
Arizona needs 600 primary care physicians to address its current shortage and we will need 1900 more by 2030. This new scholarship initiative awards tuition to students practicing primary care in AZ communities that need it most--helping us put more doctors in all 15 counties. https://t.co/KVlryvAoFB,2019-11-22 18:18:20,Twitter Web App,19,40
I look forward every month to our Arizona Congressional Delegation breakfasts. Everyone comes for the free coffee and pastries but stays for the bipartisanship! (P.S. @RepOHalleran joined too he's the one behind the camera.) https://t.co/lOpJ35RzFF,2019-11-21 22:51:52,Twitter Web App,23,96
It was an honor to meet with @ArtieRodriguez President Emeritus of @UFWupdates when we passed the Farm Workforce Modernization Act. Arturo has carried Cesar Chavez's torch—fighting for better pay health coverage retirement and job security for farm workers and so much more. https://t.co/1xkpuBQ8eF,2019-11-21 16:27:52,Twitter for iPhone,1,7
Farming in Arizona is hard work—and agribusiness contributes more than $23 billion to our state's economy. We must take care of the needs of those who help feed our families. This bill rewards farmers and agriculture workers for their hard work by modernizing the H-2A program.,2019-11-21 14:57:21,Twitter Web App,1,2
Our @HouseJudiciary Committee just advanced the bipartisan Farm Workforce Modernization Act of 2019 which streamlines the important H-2A foreign workforce program and provides a pathway for agriculture workers to earn legal status.,2019-11-21 14:57:21,Twitter Web App,3,5
This year we've lost at least 23 transgender Americans to anti-trans hate violence and bigotry. Our trans community deserves equality and respect. Today we honor the lives we’ve lost and commit to loving our neighbors without exception. #TDOR https://t.co/gGNS249L2w,2019-11-20 19:29:39,Twitter Web App,1,11
Latinas are making waves as community leaders heads of households and career professionals. Yet they only earn 54 cents to every $1 their white non-Hispanic male counterparts earn. They deserve more. It’s time for the Senate to act on #PaycheckFairness. #LatinaEqualPayDay https://t.co/FvK3ArfC6R,2019-11-20 19:18:30,Twitter Web App,4,8
My bipartisan bill to permanently extend security protections for Supreme Court Justices outside the court grounds has earned the unanimous support of the Senate. I introduced H.R. 4258 with @RepGregSteube in September and it will now head to the President's desk for signature.,2019-11-20 16:44:54,Twitter Web App,2,8
Phoenix Tempe and Tucson continue to send the message that our communities are open to everyone. Congrats on earning repeat perfect scores on @HRC's Municipal Equality Index—the result of forward-thinking inclusive policies that make our state more economically competitive. https://t.co/v1444rvLrE,2019-11-19 16:45:32,Twitter for iPhone,5,31
Native American history is American history. I'm proud to cosponsor a resolution that recognizes National #NativeAmericanHeritageMonth and encourages the people of the United States to celebrate the cultures and contributions of Native Americans. https://t.co/ZgsMdjS0q3,2019-11-18 19:06:18,Twitter for iPhone,2,10
In AZ 4 out of 5 exporters supported by the Export-Import Bank are small businesses. In the last 5 years it supported $2B+ in exports across our state. The House just approved a 10-year reauthorization of the bank an essential move to give our exporting businesses certainty.,2019-11-15 17:40:54,Twitter Web App,1,13
Climate change is ravaging the Southwest. We need bold action to tackle rising temps forest fires prolonged drought and vulnerable water supplies. Today I called on the Select Committee on @ClimateCrisis to consider policies to protect Arizona's future. https://t.co/0ilm9v9U9B https://t.co/UyZt9T2G0P,2019-11-14 22:07:05,Twitter Web App,11,21
The Export-Import Bank is an essential tool to ensure Arizona businesses thrive in an increasingly competitive global market. Tempe-based @firstsolar is one of many local companies that benefit from the bank. I'm cosponsoring H.R. 4863 which would reauthorize Ex-Im for 10 years. https://t.co/cJscqzowXO,2019-11-14 20:58:02,Twitter Media Studio,8,9
.@WSJ ranked @PHXSkyHarbor the best in the U.S.! Short lines fast wi-fi excellent local restaurants and the ease of getting downtown put PHX at the top. Sky Harbor is our region's most important economic engine--we take pride in its world-class service. https://t.co/J4gY0Ulk19,2019-11-13 23:09:18,Twitter Web App,2,27
The language of the ERA is clear and to the point: Equality of rights under the law shall not be denied or abridged by the United States or by any state on account of sex. The time is now to adopt it once and for all. #ERANow,2019-11-13 20:58:02,Twitter Web App,1,7
It's up to us to ensure equality of the sexes is enshrined in the U.S. Constitution. Today our @HouseJudiciary Committee advanced a bill to remove the expired deadline for the ratification of the Equal Rights Amendment paving the way for the 38th and final state to adopt it.,2019-11-13 20:58:02,Twitter Web App,1,20
I’m at the Supreme Court this morning to hear the arguments that will determine the fate of #DACA. Dreamers are an integral part of our communities and they deserve to contribute and participate fully without fear of their legal status being taken away. #HomeIsHere https://t.co/VAbB5JvY2c,2019-11-12 15:07:24,Twitter for iPhone,19,74
We owe our freedoms to the women and men who have served our country in the Armed Forces. On Veterans Day and every day we honor those in service the fallen and their families.,2019-11-11 15:17:22,Twitter for iPhone,1,11
As a special thank you to our veterans all National Parks will be free this Monday. A great opportunity to spend the day celebrating some of the most beautiful parts of our country --and a reminder to be thankful for our freedom. https://t.co/G8hsXLTTZU,2019-11-09 14:46:05,Twitter Web App,5,15
November is Native American Heritage Month an opportunity to recognize the sacrifices and celebrate the contributions and achievements of Native people. Arizona's history cannot be separated from the history and heritage of the indigenous people who came before us. https://t.co/SHrkdzcouB,2019-11-08 15:39:44,Twitter for iPhone,20,59
.@evadultresource promotes health for seniors through services like Meals on Wheels serving nearly 1000 meals to seniors per year. Today I had the chance to work alongside dedicated volunteers and deliver meals to some pretty great people in our Mesa community! https://t.co/tHfTGG3j7t,2019-11-08 01:40:19,Twitter Web App,3,9
Today we celebrate a pioneering suffragist Rep. Jeannette Rankin. Although many were skeptical Rankin broke barriers as the first woman elected to Congress in 1916 paving the way for more to follow. I am inspired to work alongside 101 women in the House of Representatives. https://t.co/DieSOV5fpg,2019-11-07 16:44:49,Twitter Web App,3,17
@ftbrownies We love sharing Fairytale Brownies as our home state product!,2019-11-06 21:53:57,Twitter Web App,0,1
This week we celebrate the opening of the River at Eastline Village affordable housing complex for residents living with physical disabilities and sensory processing issues. Projects like this make a difference in people’s lives and show what we can get done when we work together https://t.co/HBj7ljEefy,2019-11-06 19:52:34,Twitter Web App,3,16
The Trump Administration's retreat from the Paris Climate Accord is a foolish step that will continue to erode American leadership on the world stage. Climate change is harming Arizona. California is burning. We can't afford for the White House to turn a blind eye.,2019-11-04 22:17:02,Twitter Web App,16,92
The resolution passed by the House today outlines procedures for moving forward with impeachment proceedings. The House has collected extensive evidence about the President’s misconduct and now the American people will be able to hear directly from witnesses in an open setting.,2019-10-31 19:36:33,Twitter Web App,60,257
Today we will vote to protect @GrandCanyonNPS for generations. The Grand Canyon Centennial Protection Act permanently protects nearly 1 million acres around the Canyon from uranium mining. It is a vital step to protect this delicate ecosystem and we must pass it. #KeepItGrand https://t.co/bXyFJSbGWe,2019-10-30 19:56:15,Twitter Media Studio,32,147
Today marks one year since the crash of Lion Air Flight 610 and the tragic loss of all 189 lives on board. In a hearing tomorrow @TransportDems will hold Boeing accountable for the design development and certification of the 737 MAX plane and investigate its role in the crash.,2019-10-29 18:27:56,Twitter for iPhone,2,9
