The new Gila Crossing Community School is an incredible example of the Gila River Indian Community’s ingenuity and entrepreneurial spirit - I was honored to join Governor Roe Lewis and other community leaders this morning for the grand opening of this great school. https://t.co/LQxfxqiPmn,2019-07-27 20:26:37,Twitter for iPhone,2,20
We have to stand up for animals who can't stand up for themselves. One way is by ending the cruel practice of horse soring. I'm proud to cosponsor the PAST Act which the House passed today to protect horses from this abusive act. #PassthePASTAct https://t.co/OKXbUhoLl2,2019-07-25 21:08:19,TweetDeck,5,25
Watch this morning's hearing on the oversight of family separation and U.S. Customs and Border Protection short-term custody LIVE: https://t.co/V0M3q4TgRs,2019-07-25 15:06:20,TweetDeck,18,31
"The attacks made against you and your team intensified because your report is damning. I believe you uncovered substantial evidence of high crimes and misdemeanors...I believe you are right about something else: The only remedy for this situation is for Congress to take action." https://t.co/2a3sbzf1yl,2019-07-24 21:36:14,Twitter Media Studio,24,91
The Special Counsel’s report details Russia’s sweeping attack on our democracy. Since its release he has made clear that it is up to Congress to learn more and demand accountability—and that's what we plan to do tomorrow. This is a responsibility I take seriously.,2019-07-23 22:38:29,Twitter for iPhone,15,89
July 20 1969 half a billion people watched in awe as our American astronauts took their first steps on the moon. 🌔Today we celebrate the 50th anniversary of the Apollo 11 moon landing and remember what can be possible when we work towards a common goal. ✨ #Apollo50th https://t.co/MDZ9QNt8A3,2019-07-20 20:35:41,Twitter for iPhone,2,30
171 years ago women gathered in #SenecaFalls for the first women's rights convention. Organizers Elizabeth Cady Stanton and Lucretia Mott set out to "discuss the social civil and religious condition and rights of woman." The convention launched the women's suffrage movement. https://t.co/jpsQMymPAG,2019-07-19 21:14:37,Twitter Web App,9,31
In the wake of his daughter's death in the Parkland shooting @Fred_Guttenberg has been one of our strongest voices for commonsense gun violence protection laws. I met with Fred @po_murray and her son @tmmurray1000 of @NewtownAction during their visit to the captiol this week. https://t.co/K2cLzgkB02,2019-07-18 17:19:33,Twitter for iPhone,19,198
Americans are working harder and longer than ever but wages are falling further and further behind. Working families need a raise. After more than a decade without an increase—the longest stretch in U.S. history—it's time to raise the federal minimum wage. #RaiseTheWage,2019-07-18 14:40:30,Twitter Web App,15,35
I’m proud H.R. 2088 advanced out of the @EnergyCommerce Committee today. Our bill empowers local governments to take action on sustainable initiatives and create good jobs. https://t.co/vq1G5PQcMq,2019-07-17 16:24:05,Twitter for iPhone,2,10
I cosponsored and voted for today's resolution which upholds those sentiments and condemns President Trump's racist comments. His continued divisive rhetoric does not reflect our values as Americans.,2019-07-16 22:56:07,Twitter for iPhone,8,64
America does not define patriotism by race or ethnicity—but by devotion to our Constitutional ideals. Equality liberty inclusion and democracy. We are a nation of immigrants and diversity has been and always will be our strength.,2019-07-16 22:56:07,Twitter for iPhone,23,112
Fifty years ago today Apollo 11 🚀 began its historic launch to the moon carrying astronauts Neil Armstrong Buzz Aldrin and Michael Collins. The rocket and its fearless passengers taught us all to believe in the impossible.🌔 #Apollo50 https://t.co/gkONUk0SGD,2019-07-16 20:30:00,Twitter Web App,6,24
We need to keep making the case for transit. Not just as a way to move people but as an economic development tool. At today's transit hearing I asked the FTA to follow through on its commitment to local transit projects including Tempe Streetcar and South Central light rail. https://t.co/J1sHUb40o3,2019-07-16 19:32:59,Twitter Media Studio,2,21
ICYMI: Last week the House passed the National Defense Authorization Act. The bill included two amendments I offered which earned unanimous support to honor and improve the quality of life for our veterans. https://t.co/DNRIo8rm8t,2019-07-15 15:51:06,Twitter Web App,1,8
With Arizona temps on the rise Fozzie and I want to remind you to never leave your pets in the car for any length of time. Dogs can’t cool themselves down like we can and a hot car can be deadly. Reply with a photo of your pup to help spread the word. https://t.co/SBnUHpueAq https://t.co/hA4UeUllTG,2019-07-12 20:03:13,Twitter for iPhone,11,61
Our 9/11 heroes deserve peace of mind that if they are diagnosed with 9/11-related illness we’ll be there for them. Today we renewed the bipartisan September 11th Victim Compensation Fund to give those responders and their families much-needed support and care.  #Renew911VCF https://t.co/QbkP7mEMNi,2019-07-12 19:23:58,Twitter for iPhone,3,14
Our servicewomen and men deserve to feel safe and prepared while they defend our nation and our vets deserve access to the resources and support they’ve earned when they come home. I'm proud to offer these amendments to the Nat'l Defense Authorization Act to support our vets. https://t.co/OcYGVVzo7A,2019-07-12 15:00:48,Twitter Media Studio,1,14
These latest allegations from the Yuma Customs and Border Protection facility are deeply upsetting and are cause for grave concern for every American. My full statement: https://t.co/be4yGolT9W,2019-07-11 00:50:32,Twitter Web App,4,9
Today I joined @TransportDems Water Resources Subcommittee to talk to @USACEHQ officials about Arizona projects: Tres Rios Lower Santa Cruz Rio de Flag Rio Salado and Rio Salado Oeste. These projects will revitalize our communities and protect homes and businesses from floods. https://t.co/91ZIdR2X1M,2019-07-10 21:35:13,Twitter Media Studio,2,9
In Congress I’m working to strengthen the ACA so that it works better for more Arizonans. More access lower premiums and lower costs for prescription drugs.,2019-07-10 19:55:48,Twitter Web App,2,22
The attack from Republican governors and attorneys general on the Affordable Care Act is real and 20 million Americans are at risk of losing their health care. 130 million with pre-existing conditions will lose protections. “Repeal and refuse to replace” is cruel and reckless.,2019-07-10 19:55:48,Twitter Web App,6,39
So lucky to welcome @PhoenixMercury to the nation’s capitol including Yvonne Turner and the (soon to be) @WNBA MVP @britneygriner. Thank you @SpeakerPelosi for hosting us. On the Hill and the hardwood—we #BelieveInWomen. https://t.co/sy7TpuCaph,2019-07-10 00:03:30,Twitter for iPhone,25,195
Today the @FTA_DOT announced it will allocate $100 million in Capital Investment Grant Funding to @valleymetro for the South Central extension. We’ve long fought for this project which is going to connect the community to new economic opportunities. It’s a great day for Phoenix.,2019-07-09 18:11:05,Twitter for iPhone,20,74
Check out all the highlights from #AZ09 craft brewery tour! Great company + great beer + great communities. Thanks again to @SanTanBrewing @HussBrewingCo @OroBrewCo and @HeltonBrewingCo for showing us your passion for brewing outstanding beer. https://t.co/iSgSy2317J,2019-07-08 20:08:08,Twitter Web App,8,21
That’s why I’m co-sponsoring #HR1175 the Craft Beverage Modernization and Tax Reform Act to ensure a more fair and equitable tax structure for craft brewers - empowering them to continue investing in their business and creating more jobs for Arizonans. #AZBrews,2019-07-07 00:19:10,Twitter for iPhone,1,11
Our tour today was about highlighting the work our Mayors City Councilmembers and business owners are doing to build our local economy and how Congress can support them. https://t.co/ASTqIRZSFW,2019-07-07 00:19:09,Twitter for iPhone,5,19
On our last stop we joined @MayorGallego at Helton Brewing Company and met the owner Brian Helton - Brian is a visionary who worked hard to revitalize an old warehouse in Phoenix into the vibrant business it is now. https://t.co/yFBqnQFjAf,2019-07-07 00:05:29,Twitter for iPhone,3,17
Stop #3 - Mesa Councilmember Jen Duff and @OroBrewCo - @DowntownMesa ‘s economic revitalization would not be possible without entrepreneurs like Chuck and David investing their talent and energy. They also mentioned the light rail has been a huge driver of their success https://t.co/Ts6DuP5Npq,2019-07-06 22:52:54,Twitter for iPhone,2,5
Stop #2 on our #AZ09 tour @HussBrewingCo in Tempe with @AZMayorMitchell - Jeff and Leah Huss are a Arizona success story and shared with us that Tempe is a  craft brewery friendly city. https://t.co/cUyiNWstSi,2019-07-06 21:38:35,Twitter for iPhone,2,8
Today I’m joining with #AZ09 Mayors and City Councilmembers to tour and talk about one of Arizona’s fastest growing industries locally owned independent craft beer brewing. First up Mayor Kevin Hartke and @SanTanBrewing in #Chandler #AZBrews https://t.co/N2sVSlNloT,2019-07-06 20:28:51,Twitter for iPhone,2,18
Continued my #IndieWeekAZ tour of independently owned businesses with a stop at Hillside in Ahwatukee. They have a great menu for lunch dinner happy hour and to go! I try to swing in whenever I’m in the Tuke. #AZ09 https://t.co/0yg72kqtYH,2019-07-06 00:31:00,Twitter for iPhone,2,9
Have a safe and happy Independence Day! #HappyFourth https://t.co/vgQC2mRvL3,2019-07-04 14:50:47,Twitter for iPhone,1,12
Did you know it’s #IndieWeekAZ? We’re celebrating the great local independent businesses in Arizona this week with @LocalFirstAZ. Today we picked up some tunes at a Tempe music institution @ZiaRecords—I took home @NipseyHussle’s Victory Lap. Shop local this holiday weekend! https://t.co/FQWFZcVW9u,2019-07-04 00:35:28,Twitter for iPhone,8,32
This is a big win for Arizona. Now our focus must be on getting the most complete accurate count on the #2020Census. https://t.co/RWwipHwMSr,2019-07-03 01:22:07,Twitter for iPhone,5,36
I spoke with @kjzzphoenix about my experience yesterday in El Paso. The conditions I saw were unacceptable for anyone to endure for extended periods of time especially children. https://t.co/5MNYoBIjH8,2019-07-02 20:35:43,Twitter Web App,35,94
Fixing this can’t be solved with funding alone. This Administration’s border and immigration policy is broken and clearly designed to inflict as much pain on migrants as possible. Policies such as family separation and using these camps are morally bankrupt. We must do better.,2019-07-02 00:58:36,Twitter for iPhone,13,56
The situation at the border is challenging and overwhelming and placed unprecedented pressure on border communities law enforcement and migrant families and children. But as we enforce our laws we must stay true to our American values.,2019-07-02 00:58:36,Twitter for iPhone,9,32
My Congressional colleagues and I toured the El Paso and Clint Border Patrol Facilities to see what we’ve read about in horrifying reports over the past few weeks. Today I saw conditions no human being should endure for extended periods of time especially children.,2019-07-02 00:58:35,Twitter for iPhone,36,88
I’m in El Paso today with @HispanicCaucus to tour @CBP and @HHSGov facilities. Reports about the conditions and treatment of migrants are haunting and unacceptable. I want to see these facilities firsthand and learn more. https://t.co/39qTlH2jGj,2019-07-01 17:36:53,Twitter for iPhone,27,102
The #Stonewall Riots happened 50 years ago today a historic moment that launched the #LGBTQ rights movement. When patrons of the NYC bar were harassed for simply congregating they rioted against the oppression and brutal intimidation they faced. Their fight and mission live on. https://t.co/3vfZMpbZOY,2019-06-28 20:42:06,TweetDeck,2,13
Strengthening Arizona's relationship with Mexico continues to be one of my top priorities in Congress. Today I joined my colleagues @RepDLesko and @RepDavid at #AMCCELEBRATES60 Summit to discuss the importance of trade to Arizona's economy and the next steps for #USMCA. https://t.co/BJo0t0ilvT,2019-06-28 18:44:20,TweetDeck,10,38
Today’s decision affirms what we have known all along: the Administration’s plan to add a citizenship question was ill-conceived and officials have lacked candor about their intentions.  My full statement: https://t.co/aqklwhzsjd,2019-06-27 18:14:23,TweetDeck,1,12
June 26 marks the anniversary of 3 landmark Supreme Court decisions that impacted the equal rights of millions of Americans. I’m cosponsoring a resolution to officially recognize and celebrate today as #EqualityDay. The fight for #LGBTQ equality continues. #PrideInProgress https://t.co/fbIp6gFkfa,2019-06-26 18:31:47,Twitter for iPhone,10,28
The House just passed an emergency funding bill to provide humanitarian assistance while protecting the rights of migrants at the Southern border. It will fund food and water medical support legal assistance and relief for overcrowded facilities. We cannot ignore this crisis.,2019-06-26 01:55:26,Twitter for iPhone,7,35
And more:  🛫FAA modernization for traffic control radios 🛤Capital Investment Grants for transportation 🏥Native American health services 🏘Supportive housing for veterans  We’re making investments that improve lives in Arizona.,2019-06-25 19:44:15,Twitter for iPhone,0,7
Today we passed the second funding bill which includes investments that support AZ communities. It helps fund: 🚫Initiatives to reduce opioid abuse 🏠Transitional housing for domestic abuse survivors  💧Clean water and drinking water projects 🏗Community Development Block Grants,2019-06-25 19:44:14,Twitter for iPhone,1,13
Every day families around the world are forced to flee their homes in search of safety. They carry with them stories of hardship perseverance and hope. This #WorldRefugeeDay we recommit to the tradition of welcoming refugees into our country. #WRD2019 #RefugeesWelcome 🏠💛 https://t.co/pf3hXYWTxn,2019-06-20 16:12:07,Twitter for iPhone,5,9
Another solid AZ delegation breakfast in the books. We’re fighting for our state as a bipartisan team: border infrastructure to facilitate trade protecting Arizona’s military installations and long-term water planning. Thanks @SenMcSallyAZ for hosting and bringing the coffee! https://t.co/EI9YIGthpb,2019-06-20 00:41:11,Twitter for iPhone,0,16
June 19 1865 two years after emancipation Union troops took control of Texas and freed the last enslaved Americans. On Juneteenth we celebrate African American freedom and independence. We also reflect on our past and the work we have left to do to create a more equal future. https://t.co/ifumjDXspa,2019-06-19 18:01:29,TweetDeck,11,24
June is #AlzheimersandBrainAwarenessMonth. 5.8 million people in the U.S. are living with Alzheimer's or dementia. It hits close to home for so many in AZ including my own family. We must do more to raise awareness and join @alzassociation's fight to end Alzheimer's for good. https://t.co/9o23WUFnCd,2019-06-18 19:09:13,TweetDeck,6,4
Arizona needs a healthcare system that works for everyone. I've been fighting for common-sense bipartisan reforms that protect people with pre-existing conditions and lower prescription drug prices. Here's a glance at 10 important bills we’ve passed this year. #HealthCareWeekend https://t.co/tO1aczHxip,2019-06-16 23:46:41,Twitter for iPhone,2,9
Every day immigrants start and grow businesses create jobs and strengthen our economy. Our diversity is our strength and we should especially celebrate it during #ImmigrantHeritageMonth. #CelebrateImmigrants https://t.co/bl6T9cqTJ8,2019-06-13 18:52:57,TweetDeck,15,29
Today @HouseJudiciary advanced a bill with unanimous Committee support to make Arizona’s judicial system more accessible to Flagstaff and Yuma. @RepOHalleran introduced this common-sense bill earlier this year and it has the support of every member of our state’s delegation. https://t.co/AFhLNAZtAu,2019-06-12 22:34:09,Twitter Media Studio,0,12
I'm proud to cosponsor the LGBTQ Essential Data Act to improve the data collection on sexual orientation and gender identity of victims of violent deaths including bias-motivated violence and suicide. Victims of anti-LGBTQ crimes should never be forgotten. #PulseOrlando,2019-06-12 18:28:41,Twitter for iPhone,3,16
Three years ago 49 innocent lives were taken at the Pulse Nightclub in Orlando in an act of hatred and violence. Most of them were young LGTBQ and Latinx. We #HonorThemWithAction by recommitting to stand up against bigotry and fight for equality and gun violence prevention. https://t.co/Cj1llAINfb,2019-06-12 18:28:40,Twitter for iPhone,10,35
Jon Stewart is right—it's not enough to "Never Forget." I’m proud to cosponsor and support the passage of HR 1327 which would fully fund the VCF and keep it open to those who may become sick. 9/11 responders gave their all that day for our nation it’s our turn. #Renew911VCF https://t.co/iQ5GyYUqLd,2019-06-11 18:02:26,Twitter for iPhone,89,269
Great to catch up with my friend @JoseAndres_GR who I worked with as mayor to establish Phoenix’s two trade offices in Mexico. We both agree we have to continue to grow the Arizona-Mexico trade relationship to create jobs and support our export economy. https://t.co/2XGxB8g0is,2019-06-11 17:44:48,Twitter for iPhone,3,22
✅Act on climate change ✅Protect LGBTQ individuals ✅Reauthorize the Violence Against Women Act ✅Lower prescription drug prices ✅Limit special interests’ influence on politicians  That’s what it looks like to work #ForThePeople. No more delays it’s time to vote.,2019-06-10 17:04:21,Twitter for iPhone,9,36
We’re working hard in the House to deliver results—so it’s frustrating to see so many good bills die on the Senate’s doorstep. We’ve already taken action to:  ✅Provide Dreamers a path to citizenship ✅Require background checks on gun buyers ✅Ensure paycheck fairness,2019-06-10 17:04:20,Twitter for iPhone,17,57
My family and I joined Phoenix @momsdemand to assemble relief packages for survivors of domestic violence at the @SojournerCenter. This event was just one of thousands happening around the country for #WearOrange weekend to raise awareness about the need for gun safety reform. https://t.co/ggnC9evgAf,2019-06-09 17:35:05,Twitter for iPhone,16,53
On Monday I will introduce a resolution opposing Trump's tariffs on Mexico goods. There is bipartisan opposition to the President’s plan because it amounts to a massive tax increase and it hurts Arizona businesses workers and consumers much harder than other states.,2019-06-06 22:59:05,Twitter for iPhone,10,65
The House just passed H.R. 6 the #DreamAndPromiseAct to provide permanent protections for Dreamers. Make no mistake this is an economic stimulus bill. The economic gains in communities across the country will be significant—and few stand to benefit more than ours in Arizona. https://t.co/boUAVmg8uz,2019-06-04 22:50:10,Twitter Media Studio,4709,7480
To my Muslim friends in Arizona and throughout the country #EidMubarak! Eid-al-Fitr marks the end of the fasting month of Ramadan. I hope the festival brings you many blessings and peace.,2019-06-04 17:45:14,TweetDeck,8,23
We owe so much to these orgs and the many individuals who support them: @1n10 @swcforhivaids @equalityarizona @ACLUaz @onecommunityaz @phoenixprideaz @stonewalldemsaz @phxpridelgbtctr @echomagaz @hrcaz @azlgbtq @tqpueblo @phoenix_tea @GLSEN_Phoenix @mulligansmanor @outnative,2019-06-01 23:10:53,Twitter for iPhone,4,22
Throughout Pride we should reflect on history and progress and also recommit to protecting and fighting for equality moving forward. LGBTQ activism and community-building continues today and Arizona is home to incredible groups leading this cause and making a difference.,2019-06-01 23:10:52,Twitter for iPhone,2,10
Today kicks off #PrideMonth a celebration of everyone in the LGBTQ community. This month also honors the 50th anniversary of the Stonewall Riots civil rights and community leaders fought back against LGBTQ harassment from the police in Greenwich Village in June 1969.,2019-06-01 23:10:52,Twitter for iPhone,11,47
The President's threat to impose up to a 25 percent tariff on goods from Mexico is self-defeating illogical and frankly dumb. It puts our economy at risk by harming Arizona businesses workers and consumers.,2019-05-31 20:07:40,TweetDeck,20,58
It is time for the House to take the extraordinary step of opening an impeachment inquiry. My full statement here: https://t.co/uThtHEje9v,2019-05-30 19:00:44,Twitter for iPhone,344,1119
We’re working together in Washington to deliver results at home in Arizona. Thank you to the @chandlerchamber for hosting the “Update from Washington“ and convening East Valley business leaders to discuss the challenges and opportunities ahead. #AZ09 https://t.co/bWlhilfugk,2019-05-29 17:13:50,Twitter for iPhone,0,11
Our state’s economy and its future are stronger when we work together. We had a packed house at @GPEC today for the Trade Forum—our Congressional delegation mayors and business leaders all gathered to discuss our shared goals to diversify and grow Arizona’s export economy. https://t.co/Mzm3pIgv5L,2019-05-29 01:04:30,Twitter for iPhone,4,17
On Memorial Day we honor the service and sacrifice of our fallen heroes. Today is a day to reflect on the lives of those service women and men and remember all they have given to our country. https://t.co/A8kbn5HlEg,2019-05-27 14:27:59,Twitter for iPhone,5,31
The Trump Administration just announced its plan to roll back the Health Care Rights Law which protects patients from discrimination on the basis of sex and gender identity. This is yet another blatant strike against the LGBTQ community and women—and we won't stand for it.,2019-05-24 19:48:05,Twitter for iPhone,26,76
Jerry Emmett represented the best of our state. She was 104 when she passed away last month. Today @RepKirkpatrick @RepOHalleran @RepRubenGallego and I held a Special Order on the House Floor to celebrate this phenomenal woman's life. Watch: https://t.co/no4uoUzXqC,2019-05-23 21:01:15,Twitter Media Studio,10,38
More than 30% of Americans believe they will face financial hardship in retirement or won’t be able to retire at all. Today we passed the #SECUREAct—bipartisan legislation that closes loopholes and helps more Americans retire with financial peace of mind.,2019-05-23 16:45:58,TweetDeck,5,21
"A New Life" by Mesa High School student Yennifer Macias was selected as the winner of our 2019 Congressional Art Competition! I’m proud that millions of tourists visiting the U.S. Capitol will see Yennifer’s work representing of our district. #AZ09 https://t.co/MUUdBoFkxR https://t.co/dhE9FbsrAS,2019-05-22 20:59:10,TweetDeck,1,10
Today marks 100 years since the House voted to pass the 19th Amendment finally granting women the right to vote. Members are wearing yellow roses today to commemorate this special anniversary—and to remind us that the fight for #EqualRights continues. #WomensVote100 https://t.co/DLnWQ5w7AG,2019-05-21 20:16:17,Twitter for iPhone,2,22
No veteran who has selflessly served this nation should ever be without a safe and secure place to call home. I'm cosponsoring the bipartisan Homeless Veteran Families Act to address veteran homelessness and help keep families together while they fight to get back on their feet.,2019-05-20 19:27:57,TweetDeck,1,8
The House just passed H.R. 5 the historic #EqualityAct to end discrimination against LGBTQ individuals. When it comes to equality we've come a long way but we have more work to do to protect and defend the civil rights of every American. https://t.co/yMSZ5OuQEs,2019-05-17 17:04:19,Twitter Web App,299,1269
The House is about to take a historic vote on H.R. 5 the #EqualityAct. This morning I spoke on the floor in support of the bill because everyone should be treated equally no matter who they are who they love or how they express themselves. #LoveIsLove https://t.co/ol7hKB1VBu,2019-05-17 15:29:17,Twitter Media Studio,6,25
We need a bold infrastructure plan that will invest in Arizona communities and create good jobs. #InfrastructureWeek #BuildTheFuture https://t.co/pZcktgGIFc,2019-05-16 21:55:41,Twitter Media Studio,1,9
My bill to reauthorize and fund the Energy Efficiency Block Grant program would empower states cities and tribal communities with new resources to reduce emissions and modernize infrastructure. I'm proud it earned unanimous support today from the Energy Subcommittee. https://t.co/IsVMUDvii3,2019-05-16 21:23:46,Twitter Web App,2,8
Tomorrow the bill I introduced with @RepVeasey to reauthorize and increase funding for the Energy Efficiency and Conservation Block Grant Program will be marked up by @EnergyCommerce. H.R. 2088's movement is a testament to common-sense solutions that can improve our communities.,2019-05-15 21:17:14,TweetDeck,1,5
Our aviation system is the safest in the world but these accidents have shaken the public’s confidence and trust. Today we hope to learn more about what happened. Watch the hearing live: https://t.co/qKiEEBQf3v,2019-05-15 14:47:21,Twitter for iPhone,3,5
Last night the House passed the Blue Water Navy Vietnam Veterans Act to expand VA health benefits to include veterans exposed to Agent Orange during the Vietnam War. I'm proud to cosponsor this bill and will continue to stand up for our veterans.,2019-05-15 13:26:09,TweetDeck,3,14
