Employees from John Deere Financial in Johnston https://t.co/uBTsgyZc2r,2019-07-16 20:22:30,Instagram,6,37
Gr8 to meet Ambassador Branstad’s grandson Everett who is an advocate for Prevent Blindness Iowa https://t.co/MhTnpMWhiz,2019-07-16 20:19:11,Instagram,12,56
John Larsen CEO of Alliant Energy https://t.co/pFZsF5Vicj,2019-07-16 17:32:09,Instagram,3,24
Yesterday I administered the oath of office for Andrew Saul as the new social security admin commissioner. Important work to be done to provide good service to beneficiaries https://t.co/ONe5csRHWl,2019-07-16 17:21:16,Instagram,21,135
for yrs ive led bipartisan fight 2fix disastrous eb5 prgrm 2address rampant fraud+abuse but US Chamber+ big $$ groups want 2keep status quo of syphoning $ from areas that need it most ENOUGH IS ENOUGH @realDonaldTrump can notch another big win 4rural US like iowa w eb5 regs,2019-07-16 15:44:39,Twitter for iPhone,195,757
eb5 program was designed 2help create jobs in rural/struggling parts of US but its been hijacked by BIG $$$ INTERESTS 2fund extravagant projects in wealthy cities NOT WHAT CONGRESS INTENDED Trump admin taking important steps 2 restore purpose of prgm,2019-07-16 15:35:27,Twitter for iPhone,124,359
BIG progress by @realDonaldTrump  + admin 2bring real reforms &amp;accountability to flawed eb5 investor visa program New regs cleared by OMB wld bring needed integrity 2program scarred by abuse +natl security problems NEED TO PUBLISH NOW!,2019-07-16 15:33:14,Twitter for iPhone,135,502
The Goetsch &amp; Aalderk families from Cedar Falls https://t.co/PqAmvOBNrA,2019-07-15 17:28:18,Instagram,3,29
Go to the nonHistoryChannel to watch “Axmen “  right now. I’m going elsewhere,2019-07-13 16:49:18,Twitter for iPhone,60,392
Received this for my leadership on #cjreform from WH when Deputy AG DOJ officials and Jared Kushner came to brief me abt progress of First Step Act implementation. Justice Dept is making encouraging/timely progress… https://t.co/5kk4nhsWYX,2019-07-12 15:18:10,Instagram,27,162
Kris Steinmetz Executive Director of the Autism Society of Iowa https://t.co/Ogf2fUHflF,2019-07-12 00:15:15,Instagram,11,88
ISU TRIO Educational Talent Search &amp; Upward Bound programs from S Tama Hampton-Dumont Ft Dodge Marshalltown + Perry https://t.co/2oMaBGOlMz,2019-07-11 22:26:05,Instagram,5,46
South Central Middle School students from Rockwell City https://t.co/EAufzctbsL,2019-07-11 22:02:11,Instagram,10,74
Iowa’s home 2 a large Bosnian population that came 2Midwest during the conflict in 1995 after 8000+ were killed in Srebrenica genocide Ethnic/religious violence can never b tolerated/forgotten Especially thinking abt the Bosnian Iowans who lost neighbors/loved ones 24yrs ago 2day,2019-07-11 21:57:53,Twitter for iPhone,32,148
The French govt would be wise to not move fwd w their tax on digital services that hurts US companies Pres Trump has shown he doesn't back down when the US is treated unfairly I hope the French govt works w us &amp; other countries thru OECD to find a fair solution among allies,2019-07-11 17:47:37,Twitter for iPhone,101,317
Spoke to the Autism Society of America abt my work on Kevin &amp; Avonte’s law Autism Cares Act of 2019 &amp; ACE Kids Act https://t.co/ELZUNoCQIw,2019-07-11 15:49:52,Instagram,12,75
Iowans w JDRF’s Children’s Congress https://t.co/577E7cAct1,2019-07-10 23:11:19,Instagram,4,29
Erica Szuba from Laurens w the National Retail Federation https://t.co/czpsKhjdbq,2019-07-10 23:07:12,Instagram,4,26
Perfectly doable to get USMCA passed quickly House is working w Senate + USTR on impt details &amp; then USMCA bill can b sent to Congress Enforcement of whole trade agrmt is key Every1 agrees USMCA is better than NAFTA Time for USMCA is NOW #USMCAnow,2019-07-10 21:36:39,Twitter for iPhone,109,339
2day Pres Trump signed a new exec order that will help Americans on dialysis + make more kidneys available to ppl who need them most More than 700k Americans need a transplant or dialysis to survive This will help them &amp; their families,2019-07-10 21:32:54,Twitter for iPhone,558,2130
Spoke to former foster youth on Capitol Hill interning this summer as part of CCAI's Foster Youth Internship program. I’m cochair of the Senate Caucus on Foster Youth https://t.co/fYiapmdFlP,2019-07-10 17:36:44,Instagram,14,83
Andrew Morse with UNI https://t.co/pKinHNpGQL,2019-07-10 14:15:54,Instagram,3,17
Sen Fischer of Nebraska &amp; I talked to the Renewable Fuels Association abt ethanol/E15 yr round &amp; small refinery waivers https://t.co/V0L28EiZ3v,2019-07-10 13:27:29,Instagram,14,70
Met Jon &amp; Jerry from Altoona + Sioux City at Sen Ernst’s constituent coffee this morning https://t.co/Js9n9gLHgh,2019-07-10 12:40:51,Instagram,2,26
I introd bipartisan EAGLES Act named for mascot of Marjory Stoneman Douglas HS 2expand Secret Service threat assessment program 2better prevent shootings/violence at schools+ businesses+ places of worship Common sense 2share this critical info/training CONGRESS SHLD PASS 2/2,2019-07-09 21:44:55,Twitter for iPhone,23,129
Secret Service Natl Threat Assessment Center issued report on acts of mass violence Info is critical 2preventing tragedies in communities across US Congress shld pass my bipartisan EAGLES Act 2get this report+training in hands of more school administrators+ community leaders 1/2,2019-07-09 21:43:28,Twitter for iPhone,67,320
The Schmidt family from Tama County https://t.co/MF3O0ehYAP,2019-07-08 18:40:01,Instagram,5,32
Wk 10 #cornwatch Very hot weather has advanced the corn crop so it’s only abt 1 wk behind normal. As you can see it’s as tall as me Next wk I expect to report on pollination starting w the emergence of the corn tassel https://t.co/aXmDFzqmJ3,2019-07-08 15:31:57,Instagram,42,228
Wk 7 #soybeanwatch still abt 2 wks behind normal but developing very well W/in 2 wks last year’s cornfield will look like this year’s soybean field https://t.co/x15Yx8fBHp,2019-07-08 15:26:24,Instagram,15,70
Honored to speak at the 103rd Expeditionary Sustainment Command’s Farewell Ceremony for Army Reserve soldiers in Des Moines. 250 men &amp; women deploying to serve our nation in the Middle East. we wish them safe journey… https://t.co/APYj3OznR1,2019-07-07 17:42:20,Instagram,25,214
@realDonaldTrump U hv the economy on the move. Rather than citing the Stock Market as measure of success  cite the statistics in Friday s WSJ Ed “A Tale of Twp Economies “ so the average Jill&amp;Joe know how the economy works for everybody,2019-07-06 11:37:18,Twitter for iPhone,422,2036
Hallie Cooper is a summer intern in my Cedar Rapids office https://t.co/fsJoQxt1Q1,2019-07-05 17:51:51,Instagram,8,84
Turn to the nonHistoryChannel to watch Mountain Men,2019-07-05 01:13:02,Twitter for iPhone,64,501
MIRACLE UPON MIRACLE 5 hours later there is still history on the mislabeled History Channel,2019-07-04 18:20:03,Twitter for iPhone,128,923
For an understanding of what happened on July 4 1776 every American should read George Wills Washington post oped today for an understanding of the interaction of the declaration of independence and our Constitution that spells out the goals sought by those patriots US IS UNIQUE,2019-07-04 14:56:03,Twitter for iPhone,315,1198
Happy Independence Day 🇺🇸 https://t.co/IoSyTciIAi,2019-07-04 13:05:24,Instagram,49,364
QUICK QUICK THERE IS HISTORY ON THE history channel.  Before they change back to Mountain Men etc etc and everything nonhistory,2019-07-04 12:49:19,Twitter for iPhone,459,2803
Stopped for ice cream in Webster City after Q&amp;As in 12 counties this wk. at least 1 Q&amp;A in 77 counties so far on my 39th annual #99countymeetings When I finish all #99countymeetings I’ll celebrate at Dairy Queen also https://t.co/rLHKw7FLvi,2019-07-03 23:09:49,Instagram,34,255
Tour/Q&amp;A at Stewart Memorial Community Hospital in Lake View 28ppl issues: rural broadband drug prices health insurance trade student debt campaign spending etc #99countymeetings https://t.co/UcsvD6SFm8,2019-07-03 21:45:01,Instagram,11,38
Tour/Q&amp;A at Merrill Mfg in Storm Lake 27ppl issues: tuition cost health care bipartisanship edu soil conservation veterans etc #99countymeetings https://t.co/WDIJ1QUeQv,2019-07-03 19:52:36,Instagram,11,34
Pocahontas TM 43ppl issues: Pres Trump Kavanaugh confirmation small refinery waivers tariffs USMCA rural health care electoral college min wage drug prices shld b on tv ads big tech Medicare climate change robocalls ethanol/e15 yr round #99CountyMeeetings,2019-07-03 16:58:33,Twitter for iPhone,676,1633
Annual Pocahontas County town mtg #99countymeetings https://t.co/C6kX4VFoFn,2019-07-03 16:54:09,Instagram,8,38
Tour/Q&amp;A Jet Company in Humboldt 49ppl issues: cmte assignments Justice Kavanaugh confirmation serving Iowans #99countymeetings etc https://t.co/nkM9I9viVx,2019-07-03 15:24:25,Instagram,11,31
The mayor or Belle Plaine David Fish has sat w me at a lot of UNI women’s b-ball games over the yrs #99countymeetings https://t.co/L6ySQpLQu9,2019-07-03 13:08:08,Instagram,10,36
Tour/Q&amp;A 35ppl Iowa Mold &amp; Engineering in Belle Plaine issues: African swine fever China tariffs cost of health insurance border security infrastructure etc #99countymeetings https://t.co/StsmcB8xol,2019-07-02 21:58:25,Instagram,10,35
Jones County Sheriff Graver &amp; his deputy #99countymeetings https://t.co/7LQH3EjT0o,2019-07-02 21:16:54,Instagram,10,31
#realhistorychannel 55yrs ago 2day PresLBJ signed Civil Rights Act of1964 This landmark legis prohibited discrimination based on race religion sex or national origin As Americans were ALL CREATED EQUAL&amp;we shld alwys remember sacrifices made by civil rights pioneers who came b4 us,2019-07-02 20:18:23,Twitter for iPhone,61,196
Tour/Q&amp;A 49ppl MSI Mold Builders in Cedar Rapids issues: tariffs China/trade farm bill term limits currency manipulation crim justice reform congress irresponsibly delegating power to POTUS etc #99countymeetings https://t.co/f5YjhEeFHq,2019-07-02 20:15:08,Instagram,4,27
100yrs ago 2day on July 2 1919 Iowa ratified the 19th amendment paving the way for a constitutional amendment giving women the right to vote #realhistorychannel 13 mos later when TN was the last state to approve my mother was 1 of 4 women to b 1st 2vote in Iowa the next day,2019-07-02 17:22:21,Twitter for iPhone,94,479
Tour/Q&amp;A w employees at Mercy Iowa City. 46ppl Issues: rural health care vaccines climate change tariffs telehealth Medicare Medicaid etc #99countymeetings https://t.co/ZYSadOga1g,2019-07-02 17:19:36,Instagram,8,31
Anamosa TM 126ppl issues: humanitarian crisis at the border wind energy VA tax extenders border security Fast&amp;Furious election security criminal justice reform health care social security natl debt USMCA China/trade capital gains etc #99countymeetings,2019-07-02 15:05:06,Twitter for iPhone,19,60
Annual Jones County town mtg in Anamosa #99countymeetings https://t.co/CxlRqd1c2c,2019-07-02 14:58:37,Instagram,7,19
Stop &amp; see the friendly ppl of Mallard Iowa. They're as inviting as the down of a duck #99countymeetings https://t.co/23E0nH4m7t,2019-07-01 23:12:49,Instagram,15,79
Tour/Q&amp;A at EPS in Graettinger 51ppl issues: ESOP tariffs my lawnmower bipartisanship term limits student debt H2b visas etc #99countymeetings https://t.co/5PwTRPag5i,2019-07-01 22:13:49,Instagram,5,31
2day @realDonaldTrump signed the bipartisan bicameral Taxpayer First Act into law It will enact necessary reforms at IRS to put taxpayers 1st The reforms in this law are long overdue This bill was a product of the Finance Cmte which I chair,2019-07-01 21:50:37,Twitter for iPhone,221,810
Tour/Q&amp;A at Arts Way in Armstrong 26 ppl issues: term limits tariffs health insurance no pay raise for congress Medicare etc #99countymeetings https://t.co/nwVsISBBHv,2019-07-01 20:36:10,Instagram,10,36
Kum&amp;Go shifts thousands of workers to full time work w benefits. Unemployment very low + wages up Shows strength of @realDonaldTrump economy and value of Tax reform/cuts Gr8 for American Workers Big change from when Obamacare pushed biz 2 hire only part time w no benefits,2019-07-01 18:41:00,Twitter for iPhone,251,774
Q&amp;A at Algona Rotary Club mtg 24ppl issues: drug pricing legislation USMCA Finance chairmanship my voting record election security budget caps SCOTUS etc #99countymeetings https://t.co/3TT5GHAeOk,2019-07-01 18:26:14,Instagram,12,40
Forest City TM 89ppl issues: humanitarian crisis at the border farm economy drug pricing nursing home oversight USMCA environment small refinery waivers/ethanol trade/China SW Iowa floods student debt farm reports surprise billing #99countymeetings,2019-07-01 16:13:34,Twitter for iPhone,13,57
Annual Winnebago County town mtg in Forest City #99countymeetings https://t.co/qhGbkNDJl5,2019-07-01 16:07:58,Instagram,3,22
Wk 8/9 #cornwatch This yr Grassley corn is hip high by the Fourth of July usually shoulder high by the Fourth of July behind because of wet cool spring https://t.co/kY4PDSwEcB,2019-07-01 13:04:40,Instagram,33,148
#soybeanwatch three weeks behind in another three weeks it’ll look like a beanfield finally covering the corn stubble of last year https://t.co/xo8uiPIbg9,2019-06-30 22:22:07,Instagram,20,119
The Matthews Hughlette + Watson families from Grinnell Urbandale Haverhill &amp; Story City https://t.co/QFR9OCxaFg,2019-06-28 21:33:11,Instagram,4,30
Thought long time how Trump can improve his approval rating majority of the people like his policies stick to policy don’t attack individuals but state why opponents policy wrong don’t denigrate them personally if somebody is stupid bite your lip,2019-06-27 22:39:34,Twitter for iPhone,485,2276
The Casady family from Webster City &amp; Miller family from Albert City https://t.co/tP40y6kLo3,2019-06-27 19:22:59,Instagram,4,21
2day scotus said drawing cong districts is political question beyond reach of courts matter 4 states/elected branches to handle Judges should be interpreting law not making policy/redrawing maps Any other decision wld put scotus in a political thicket w no authority to operate,2019-06-27 19:19:47,Twitter for iPhone,72,279
Essay contest winners Cameron LaPage from N Scott High School &amp; Gabriella Hoard from Roosevelt High School https://t.co/feh6j1eUzW,2019-06-27 12:46:01,Instagram,7,58
Iowans w the Property Casualty Insurers Association https://t.co/a40VOASLcu,2019-06-27 11:49:51,Instagram,6,37
The Dreyer family from Johnston &amp; the U of Iowa Stead Family Children’s Hospital https://t.co/nQmCJ1Yrdv,2019-06-27 11:47:19,Instagram,6,49
Congrats to Megan Niewoehner from Hawkeye + Jaxon Mullinnix from Lone Tree for being named recipients of the Presidential Scholars award https://t.co/RahJVRO1B4,2019-06-26 22:44:01,Instagram,10,41
Thx to Blank Children’s in Des Moines &amp; the Children’s Hospital Association for naming me a Champion for Children’s Health for my work incl recently passed ACE Kids bill which helps kids w complex medical conditions https://t.co/Vhs9b6j6sf,2019-06-26 22:40:56,Instagram,12,69
Addressing border crisis CAN BE bipartisan Im working w/ RM Wyden to conduct bipartisan investigation into HHS child migrant housing facilities American people want govt to treat everyone humanely AND to secure border +close loopholes+ enforce rule of law,2019-06-26 22:19:45,Twitter for iPhone,49,164
funding in 2days bill necessary for migrants already here but it wont stop travesties like child recycling or tragedy of drowned father+child DEMS PLEASE WORK WITH GOP TO FIX,2019-06-26 22:12:07,Twitter for iPhone,86,218
Dems finally admit humanitarian crisis on S border isnt manufactured yet refuse 2take needed action 2address cause Throwing money at migrant housing w/o other reform wont deter more dangerous travel+human exploitation IF DEMS R SERIOUS WORK WITH GOP TO FIX,2019-06-26 22:06:29,Twitter for iPhone,792,2381
Vote for addnl $$ 2meet increased humanitarian needs shows GOP is serious about ending crisis but w/o securing border+closing immig loopholes we r only setting govt up for failure as record migration continues Status quo encourages more dangerous travel+ more human trafficking,2019-06-26 21:55:40,Twitter for iPhone,34,114
Just voted 2provide more $ for migrant housing+care as illegal immigration influx+humanitarian crisis continues at border but solving problem requires more than money Dems need 2get serious about fixing underlying cause of historic immigration increase,2019-06-26 21:42:20,Twitter for iPhone,186,630
Senate just passed our overwhelmingly BIPARTISAN emergency humanitarian funding bill 84-8 Includes over $4 billion in humanitarian aid,2019-06-26 21:39:06,Twitter for iPhone,168,564
The Bumgarner Vanderhorst &amp; Burkhalter families from Spencer Hedrick + Creston https://t.co/87iIZCQqqi,2019-06-26 21:06:31,Instagram,3,15
Health cmte just advanced bill that includes my bipartisan CREATES Act 2end anticompetitve scheme by brandname drug cos 2keep generics off market Judic Cmte voting on more drug pricing bills thurs+more 2come in Finance cmte 2improve transparency+competition+reduce cost of Rx meds,2019-06-26 19:19:42,Twitter for iPhone,28,83
Americans deserve 2kno what their govt is up to Freedom of Information Act designed to promote transparency when govt lacks openness but recent SCOTUS ruling+EPA &amp;Interior regs undermine FOIA I will write legislation 2fix TRANSPARENCY BRINGS ACCOUNTABILITY,2019-06-26 19:17:45,Twitter for iPhone,314,1137
Enjoyed talking w Iowans at Sen Ernst’s weekly constituent coffee https://t.co/AylKXExaF7,2019-06-26 17:45:14,Instagram,4,23
Senators from Iowa Kansas Missouri &amp; Nebraska met w R.D. James Asst Scty of the Army for civil works in my office this morning. Each of us pressed the pt that there has to be more emphasis on protecting… https://t.co/5mPIuQHwt5,2019-06-26 15:37:29,Instagram,14,58
Iowans w AIPAC talked to me abt the importance of a strong US-Israel relationship https://t.co/eO2daGBG63,2019-06-26 13:49:39,Instagram,18,81
Iowans w the pancreatic cancer action network https://t.co/idoFwPcHkz,2019-06-26 11:33:08,Instagram,10,36
State Representative Lee Hein from Monticello https://t.co/ut25mhY8it,2019-06-25 23:55:37,Instagram,3,16
David Beech from Ankeny &amp; the Hoffman’s from Mason City https://t.co/CFO334HCQ1,2019-06-25 23:53:26,Instagram,3,11
Iowans from the United Spinal Association https://t.co/OWAryxUzGf,2019-06-25 23:49:38,Instagram,3,20
Met w the Schwartz family &amp; Blank Children’s in Des Moines abt Medicaid ACE kids bill making a difference + need for gene therapy https://t.co/yRjoSgYZrw,2019-06-25 22:12:09,Instagram,14,48
FIRST Robotics Team 648 &amp; 6630 from the Quad Cities + La Porte City https://t.co/y4naX0IyuN,2019-06-25 20:33:38,Instagram,5,15
Nathan Anderson is a farmer from Aurelia. He testified before the House Ag Conservation &amp; Forest Subcommittee this morning https://t.co/sqQs11MUEB,2019-06-25 20:14:22,Instagram,8,35
As chairman of the Senate Finance Cmte I have interns working in my cmte office this summer. They work w my staff &amp; me on health care tax oversight + trade issues https://t.co/ZFMP1BxOq6,2019-06-25 17:49:13,Instagram,26,145
WH signing ceremony for exec order on health care transparency. State Sen Mariannette Miller-Meeks from Ottumwa &amp; Andy Butler from Dubuque also attended https://t.co/qUEDBp4y6a,2019-06-24 23:06:42,Instagram,35,127
2day I attended White House signing ceremony 4exec order on health care transparency There’s too much secrecy in health care Increasing transparency holds hospitals+ insurance companies + health care providers +Rx companies accountable 4 what they charge Thx @realDonaldTrump,2019-06-24 22:53:39,Twitter for iPhone,207,919
Met w the Alcock Freese Allers Christensen Dyburg Forrest Heitshusen + Trenary families from Marion Fort Dodge Ankeny Cedar Rapids Dubuque + Luzerne today https://t.co/5CWIICoZMK,2019-06-24 21:30:02,Instagram,4,25
Transparency is critical 4 good govt FDA is putting safety &amp; accountability first by making public its secret medical device safety database More needs 2B done but this is a good 1st step toward greater govt accountability,2019-06-24 20:24:22,Twitter for iPhone,45,209
As president pro tem I’m proud to sign the Taxpayer First Act. My bipartisan bill will strengthen taxpayer protections &amp; help implement long overdue IRS reforms. Now to Pres Trump for his signature https://t.co/28Uw2tmgcU,2019-06-24 18:35:11,Instagram,55,237
For anybody who wants to get Trump re-elected read Peggy Noonan WSJ article this week,2019-06-23 15:10:00,Twitter for iPhone,492,1572
Iowa has a 2.4% unemployment rate for the 11th month in a row That’s nearly 1 yr of historic low joblessness Tax Cuts &amp; Jobs Act + Pres Trump/Gov Reynolds hard work is paying off for Iowans Very few things are better for society than a good economy w jobs available for everyone,2019-06-21 17:21:44,Twitter for iPhone,529,2318
The Fitzsimmons Paulson + Lutz families from Marion + Indianola https://t.co/xDak4nkqZT,2019-06-21 14:49:46,Instagram,6,27
The Fitzsimmons Paulson + Lutz families from Marion + Indianola https://t.co/xDak4nC1Rr,2019-06-21 14:49:46,Instagram,7,25
Congrats to Amy Ryan from Des Moines. She’s a recipient of the Congressional Award Gold Medal for her work raising $$ for veterans &amp; first responders w the org Tunnel to Towers https://t.co/HfXvqAe9bp,2019-06-20 21:58:32,Instagram,23,184
The Backes Ruzicka LaBruna + Johnston families from Jesup Humboldt &amp; Linden https://t.co/comvn74hod,2019-06-20 21:55:05,Instagram,6,22
Sergeant Bluff-Luton Middle School students https://t.co/r4Yhsi2zXr,2019-06-20 21:53:09,Instagram,5,16
Good to see Angie &amp; Leo Ettleman who are leaders/advocates for flood mitigation in SW Iowa https://t.co/gTQCcH9dwV,2019-06-20 20:58:59,Instagram,8,36
Met w Japanese Ambassador Sugiyama abt US Japan trade negotiations https://t.co/qVN2R9u24d,2019-06-20 20:43:03,Instagram,18,75
Cedar Rapids Mayor Brad Hart &amp; City Manager Jeff Pomeranz talked w me about investment in Cedar Rapids infrastructure &amp; flood control https://t.co/MDcjnE34za,2019-06-20 20:27:30,Instagram,4,45
Iowans w the American Nurses Association https://t.co/5pKf10ZSS0,2019-06-20 19:11:18,Instagram,6,40
Sen Ernst &amp; I met w Iowa students on the 4-H Citizenship Washington Focus trip https://t.co/ewEbZV6YiX,2019-06-20 13:41:53,Instagram,5,62
Q&amp;A w the Iowa Rural Electric Cooperative Youth Tour https://t.co/kjq1ZM7jJ4,2019-06-19 23:25:01,Instagram,5,36
Mills Co 4Hers saved up to pay for their DC trip for 4yrs—an impressive group of young ppl https://t.co/VD7uEpUJoS,2019-06-19 23:00:23,Instagram,15,88
Mexican Senate approving USMCA is a very positive step 2help move along legislation in the US / Now Congress must do its part 2bring the gr8 benefits of USMCA to farmers +business +families,2019-06-19 20:39:19,Twitter for iPhone,274,982
2day we celebrate Juneteenth the day enslaved African Americans learned abt their freedom 2 yrs after EmancipationProclamation We must always strive 2 form a more perfect union&amp;never forget the horrors of slavery,2019-06-19 19:43:04,Twitter for iPhone,46,268
Discussed status of levees along the Missouri River &amp; ongoing impacts of flooding w Col Hudson Omaha District Commander of the Army Corps of Engineers https://t.co/EvJHNmb35U,2019-06-19 15:12:48,Instagram,27,84
State Senator Craig Johnson of Independence &amp; his family Susan + Hannah at Sen Ernst’s constituent coffee https://t.co/eScxKe0GA8,2019-06-19 12:44:21,Instagram,7,46
Dr. Kit Ford teaches at St Ambrose in Davenport &amp; founded Argrow’s House which supports women who survived sexual assault. She received a 2019 Jefferson Award for her dedication to helping others https://t.co/fuXbodi1vi,2019-06-18 23:23:00,Instagram,20,91
Isiah Lysis a senior at Briar Cliff Univ in Sioux City &amp; Pres of “men of color” student org received a 2019 Jefferson Award for his ldrship &amp; non-profit work to benefit Haiti https://t.co/DsMFvrZVo2,2019-06-18 23:19:10,Instagram,13,54
Natl Park Police fatally shot unarmed Bijan Ghaisar 19 mos ago Family+Congress+Public still awaiting answers on FBI review of police action WHATS TAKING SO LONG?? Family shldnt hv 2use FOIA 2 get simple details FBI lack of transparency in slow moving case erodes public trust,2019-06-18 22:52:31,Twitter for iPhone,60,222
West Lyon FFA Qs on my start in politics my schedule #99countymeetings agriculture etc https://t.co/eyTU0pQx9q,2019-06-18 22:24:39,Instagram,4,26
The Snook Gaster Trytten Corcoran families from West Union Decorah Cedar Rapids + West Des Moines https://t.co/FQUrM47ioe,2019-06-18 21:02:24,Instagram,6,27
Ive been doing oversight of Clinton email server +mishandling of classified info since 2015 State Dept response to my inquiries proves safeguards for national secrets ignored by 15 ppl Violators shld b held accountable https://t.co/fBaNpUoKc1,2019-06-18 20:58:05,Twitter for iPhone,3599,7664
Congrats 2 Sen Susan Collins of Maine 4casting her 7000th consecutive vote in the US Senate She’s never missed votes as a senator Not missing votes is a way 2show the ppl u represent that you’re on the job That’s why I’ve cast 8447 consecutive votes w/out missing in 26 yrs,2019-06-18 17:43:53,Twitter for iPhone,392,2370
AGWSR FFA from Ackley https://t.co/5Qw9igCcGh,2019-06-18 17:09:02,Instagram,4,25
Glad state dept responded 2 my inquiry &amp; disclosed 23 violations + 7 infractions from 15ppl mishandling classified info in Clinton email review I’ve been doing oversight on this since 2015 Classified info must b handled by the book &amp; violators shld b held accountable,2019-06-18 13:20:23,Twitter for iPhone,2726,7321
Artist Grant Wood from Anamosa Iowa was famous for his depiction of rural America. He painted the iconic American Gothic in 1930. #realhistorychannel This house in Eldon Iowa is the backdrop for his famous… https://t.co/1wzlqgr1tl,2019-06-18 11:00:29,Instagram,20,107
