Uni leads Indiana st 56/37   5:39 left.  I’m going to leave,2020-01-19 21:33:38,Twitter for iPhone,25,197
Uni 31/13 over Indiana St half,2020-01-19 20:49:21,Twitter for iPhone,5,65
Uni over Evansville 74/61,2020-01-18 00:53:41,Twitter for iPhone,7,69
Uni over Evansville third qtr 56/47,2020-01-18 00:24:47,Twitter for iPhone,8,56
Uni panthers over Aces 35/27 halftime,2020-01-17 23:44:50,Twitter for iPhone,6,44
Uni women’s bb first qtr Panthers over Aces 21/8,2020-01-17 23:21:25,Twitter for iPhone,14,67
Thx to George Belitsos &amp; the Iowa Network Against Human Trafficking and Slavery for honoring me in Des Moines. I wasn’t able to be there bc of votes so I thank Maggie Tinsman Pat Grassley Gov Reynolds LG Gregg + many… https://t.co/cNjhli0qbk,2020-01-17 20:38:17,Instagram,44,253
Consumers need 2 hv choice at gas pumps including ETHANOL/e-15 Thx @realDonaldTrump + Ag Scty Perdue for issuing request for info on ethanol infrastructure program Infrastructure is needed to encourage investment/access to biofuels,2020-01-16 22:51:56,Twitter for iPhone,92,402
Thx Iowa Network Against Human Trafficking &amp; Slavery for naming me 1 of several 2020 Outstanding Anti-Trafficking Service Award recipients Human trafficking is a horrible crime Im honored 2use my job in Senate 2work w Iowans+others 2 fight against human exploitation/trafficking,2020-01-16 21:17:02,Twitter for iPhone,461,1664
BIG wk for @realdonaldtrump &amp;his trade deals gr8 victories w China phase 1 + 2day USMCA passed Senate w overwhelming bipartisan vote 89-10 I was glad 2lead this effort in Senate wrking in bipartisan way 2deliver much needed certainty for American farmers + manufacturers + workers,2020-01-16 17:28:46,Twitter for iPhone,533,1823
Enjoyed teaching new EU Trade Commissioner Hogan abt how I’m a laboratory for how GMOs won’t kill you since I’ve been eating Iowa corn &amp; soybeans my whole life https://t.co/hPmBrjx9Sc,2020-01-15 22:46:38,Instagram,43,324
Pres Trump speaking in East Room abt historic phase 1 China trade agreement https://t.co/9onXNwG10Q,2020-01-15 18:18:03,Instagram,325,1544
W Senator Ernst &amp; Governor Reynolds at White House b4 Pres Trump signs phase 1 of China trade agreement https://t.co/2UykNE2Y90,2020-01-15 16:46:49,Instagram,53,241
Heading down to WH for @realDonaldTrump signing of phase 1 trade agreement w China Gr8 news for farmers China has been in WTO for 20yrs + they’ve been cheating for 20yrs 3 previous presidents haven’t challenged China’s cheating HOORAY Pres Trump,2020-01-15 16:04:56,Twitter for iPhone,727,2204
Shame delayed impeachment is blocking attention on critical/popular bills like bipartisan Grassley/Wyden Prescription Drug Pricing Reduction Act @realDonaldTrump making gr8 strides 2lower cost of meds+time for Congress 2step up but House Dems more content w grinding govt 2halt,2020-01-15 15:46:09,Twitter for iPhone,1017,2671
Bret Wilkinson Buena Vista Co Engineer https://t.co/0Xd3dHqlin,2020-01-15 15:11:37,Instagram,6,25
Chief Justice Roberts will preside over impeachment trial on TV I hope he gets comfortable in front of cameras in Senate chamber &amp;warms up 2 cameras in courtroom @ Supreme Court Transparency wld allow more Americans 2see our judicial system @ wrk,2020-01-14 22:16:57,Twitter for iPhone,1276,3664
Only in washington would FISA court hope to restore credibility after FISA abuse by hiring Kris a person who publicly denied FISA abuse ever happened to oversee reforms If u want to improve public confidence+ prevent civil liberties violations dont hire fox to fix henhouse!!!,2020-01-14 21:41:57,Twitter for iPhone,5508,12498
Peter Gaynor was just confirmed FEMA Administrator 81-8 I’ve worked w him as he served as acting adm prior 2confirmation &amp;he’s been helpful FEMA is vital in wake of natural disasters/natl emergencies Iowans count on FEMA in times of need,2020-01-14 18:05:49,Twitter for iPhone,73,325
Former spkr Kraig Paulsen made 3 new gavels from a walnut tree at the Grassley farm for Pat to use as Speaker. Pictured w my son Robin grandson Pat + gr8 grandson Chance @ Iowa State Capitol https://t.co/a8NrWtoxK1,2020-01-14 12:07:39,Instagram,44,320
Barbara &amp; I are very proud of our grandson Speaker of the House Pat Grassley @ Iowa State Capitol https://t.co/bULHKd5s5W,2020-01-13 19:10:00,Instagram,79,624
Heavyweight uni wins 3:1  sodakst wins team 25/13,2020-01-11 02:53:15,Twitter for iPhone,12,65
Uni 197 loses by fall to sodakst,2020-01-11 02:42:53,Twitter for iPhone,8,37
Uni 184 over sodakst 10/4,2020-01-11 02:40:36,Twitter for iPhone,11,38
Uni 174 wins over SoDakSt 12/1,2020-01-11 02:30:03,Twitter for iPhone,10,32
Uni at 165 loses by fall to SoDakSt,2020-01-11 02:20:56,Twitter for iPhone,6,26
Uni at 157 loses to SoDakSt 4/0,2020-01-11 02:02:26,Twitter for iPhone,5,31
Uni at 149 loses to SoDakSt 9/1,2020-01-11 01:50:53,Twitter for iPhone,7,27
Uni at 141 wins over SoDakSt 7/5,2020-01-11 01:38:57,Twitter for iPhone,7,34
Uni at 133 loses to SoDakSt 10/4,2020-01-11 01:27:30,Twitter for iPhone,6,36
Uni at 124 loses to SoDakSt 10/5,2020-01-11 01:18:31,Twitter for iPhone,5,39
banner on right tells uni was NCAA national champs in 1950. I’m at sodakst vs uni  Wrestling historically strong in all of Iowa for a century https://t.co/uSiOAiacvV,2020-01-11 00:39:10,Instagram,8,73
Iowa has strong czech history+communities I sponsored a resolution congratulating Czech Republic &amp; Slovak Republic on 30th anniversary of Velvet Revolution+ the 26th anniv of the formation of the Czech Republic/Slovak Republic &amp; the 101st anniv of independence of Czechoslovakia,2020-01-10 21:49:24,Twitter for iPhone,80,348
My False Claims Act clawed back another $3BILLION in tax$$ from fraudsters in 2019 Total recoveries since Congress passed my bill in 1986 is more than $62BILLION Whistleblowers r key to recouping these tax dollars+DOJ shld encourage greater use of False Claims Act+WB provision,2020-01-09 21:58:30,Twitter for iPhone,252,1079
Taking Qs from the media after US Mexico Canada trade agreement voted out of Senate Finance Cmte w a big bipartisan vote 25-3 https://t.co/FOziOUcDLl,2020-01-07 17:01:52,Instagram,58,197
After several yrs of hard work USMCA just passed out of Sen Finance Cmte 25-3 BIG bipartisan support for trade deal is a historic win Congrats to @realDonaldTrump +USTR Amb Lighthizer +the USA! USMCA is good news for workers/manufacturers/farmers &amp; all Americans,2020-01-07 16:54:29,Twitter for iPhone,1818,5883
Back in the Capitol for a productive 2020 https://t.co/zQXGZnnMBH,2020-01-06 22:33:40,Instagram,47,351
Welcome Sen Ben Sasse 2 Sen Finance Cmte You are the 7th Nebraskan to serve on the cmte I look fwd to working w you on important issues--trade/tax/health care/social security/pensions etc,2020-01-06 16:10:29,Twitter for iPhone,158,1002
Final. Uni 69 Bradley 64,2020-01-05 03:15:14,Twitter for iPhone,11,163
Uni ovr Bradley at half 34/32,2020-01-05 01:55:50,Twitter for iPhone,9,76
It is surprising what u run across going through old files. From Wash Post 2/25/85 https://t.co/CGYLFrhRCR,2020-01-02 23:44:11,Instagram,42,213
2 ring in new yr drug cos increased list price of 250+ drugs an average of 5/10% If Grassley Wyden bill was law rx price increase cldnt b more than last yrs inflation Another reminder how drug cos r hiking prices at consumers/taxpayers expense 2020 is yr 2lower cost of rx drugs!,2020-01-02 23:37:15,Twitter for iPhone,166,497
Whoever keeps watch on @realDonaldTrump at WH have the economist there especially Navarro read WSJ oped by Henninger This is what I’ve been preaching to the President for two yrs./President wld benefit fr reading it / IN TURN USA BENEFITS,2020-01-02 15:54:30,Twitter for iPhone,982,3774
Happy bday to you Iowa 173 yrs ago Iowa was the 29th state admitted to the union #realhistorychannel https://t.co/XXhzT6tX1c,2019-12-28 16:36:08,Instagram,92,579
Christmas day sunset at Grassley farm. 38 gathered to celebrate Now all quiet just Mrs G &amp; me https://t.co/mIZqYvV1bD,2019-12-25 23:53:19,Instagram,282,2415
Merry Christmas! Besides being thankful for family + presents we should thank God for America Happy 2 hv our freedom to celebrate Jesus birth and for those of Jewish faith to celebrate Hanukkah,2019-12-25 16:41:02,Twitter for iPhone,1637,8545
(Very) old Beth has completed another successful mission readying the Grassley farmhouse for family (&amp;manyfriends) gathering for Christmas. I was Beth’s pilot https://t.co/WX0Y1edjTH,2019-12-24 16:33:22,Instagram,80,641
Additional tax extenders incl tuition deduction +increased tax deduction will b available for individuals w large health care expenses +the new paid family leave tax credit enacted in Tax Cuts&amp; Jobs Act will b available so small biz can continue offering those important benefits,2019-12-23 21:44:17,Twitter for iPhone,68,231
Tax extenders help businesses plan 4 future &amp;eventually b self sustaining Biodiesel &amp; Short line railroad tax extenders were part of yr end tax package I negotiated These r critical for agriculture/ag economy Will help encourage investment &amp; bring much needed certainty 2industry,2019-12-23 21:40:49,Twitter for iPhone,79,340
My CREATES Act is now law Iowans want Rx prices lowered &amp;our bipartisan CREATES helps get generics on market faster Some pharmaceutical cos use anticompetitive practices 2 block access 2 affordable generics this bill stops that abuse +helps consumers + saves taxpayers $3.7B,2019-12-23 17:23:30,Twitter for iPhone,223,895
The SECURE Act was incl in yr end package Congress passed. I led effort on Senate side SECURE will help more Americans save 4 their retirement + help more small biz invest in their employees’ future financial security like big cos already do,2019-12-23 16:19:22,Twitter for iPhone,77,309
2010’s very good/WorldBank reports world wide poverty fell by half fr 18.2%to8.6% &amp;World Data Lab calculated over half world population is “middle class”,2019-12-22 22:26:34,Twitter for iPhone,191,768
1 of 3 original copies of the Lansdowne portrait of George Washington hangs in the East Room of the White House. #realhistorychannel Painted by Gilbert Stuart in 1797. It’s a life size portrait of Washington during… https://t.co/E8I588WE7F,2019-12-22 13:40:30,Instagram,88,473
This wk I talked by video w Elisha &amp; Krystal + other Urbandale HS students for their CSPAN gov’t project https://t.co/jcWvWfykIu,2019-12-22 01:39:31,Instagram,38,218
I intend to hv markup of USMCA b4 Sen Finance Cmte on Jan 7 Passing USMCA trade deal delivers much needed certainty + modernizes NAFTA I expect Senate will hv a strong bipartisan vote &amp; can send USMCA to Pres Trump in early 2020,2019-12-21 22:19:50,Twitter for iPhone,665,2766
This wk the Senate confirmed 13 district judges @realdonaldtrump &amp; Senate GOP continue 2make the judiciary a top priority Several judges had BIPARTISAN support,2019-12-20 18:40:53,Twitter for iPhone,1206,4369
FINALLY relief is coming 2reduce those irritating robocalls Congress passed Pallone-Thune Telephone Robocall Abuse Criminal Enforcement &amp; Deterence Act This legis takes aim at stopping telemarketers who prey on consumers/increases enforcement +penalties against worst offenders,2019-12-19 23:07:22,Twitter for iPhone,496,1874
Why is Dem house now getting cold feet abt moving ahead w impeachment trial? They want 2hijack Senate process+muck up senate/SCOTUS schedule U need some consideration abt SCOTUS since Chief Justice presides in Senate. R they worried their articles r too weak to move fwd?,2019-12-19 17:52:39,Twitter for iPhone,10252,23300
These magic words from Oval Office Sept 12 agreement are missing from 2days EPA rule on Renewable Fuel Standard “three year rolling average based on hard data and actual waived gallons” EPA changed deal from what was agreed 2 w Pres Trump Will hold Wheeler’s feet to fire on RFS,2019-12-19 15:57:37,Twitter for iPhone,254,632
Gr8 to catch up w ISU President Wendy Wintersteen https://t.co/CybRGTXeRt,2019-12-18 22:16:16,Instagram,9,63
Thx to hrd work/good faith negotiation bill 2secure justice for US victims of terror will soon b on Pres desk w spending bill Proud to work with Sen Lankford + bipartisan group to reopen courthouse doors/restore US assistance that PLO shamefully blocked to avoid acctability,2019-12-18 21:56:54,Twitter for iPhone,54,254
1yr ago 2day the Senate overwhelmingly passed First Step Act 87-12 The bipartisan crim justice reform is 1st in a generation I worked on this for yrs &amp; @realDonaldTrump support helped pull much needed reforms &amp; programs 2 give ppl another bite at the apple across the finish line,2019-12-18 18:32:31,Twitter for iPhone,172,485
FBI abuse in IG report has weakened natl securty by calling into question use of critical FISA tools 2fight actual security threats If heads dont roll how can American ppl trust govt wont use false info 2shred civil liberties in future? Lying 2court is a crime/cant b ignored!,2019-12-18 17:19:31,Twitter for iPhone,1886,4066
Judge Collyer shld b calling for heads as well as fixes! FISA courts job is 2protect civil liberties against unjustified govt spying It got duped by FBI w false/incomplete info 2spy on Trump campaign aide Americas faith in FISA process is shaken,2019-12-18 17:17:22,Twitter for iPhone,1995,4418
I congratulate the American Farm Bureau Federation on its centennial This org has led farmers thru some of the gr8est depressions/recessions in history +some of the most prosperous times 4 farmers Their policies are from the grassroots up I’ve been a farm bureau member for 63yrs,2019-12-18 15:48:37,Twitter for iPhone,80,390
Sad 2hear abt the death of the king of Iowa Football Hayden Fry He had a long tenure at Univ of Iowa from 79-98 &amp; put Iowa football back on the map for the 1st time since the 1950s He was beloved by Hawkeye fans/players/coaches I send my condolences 2 his family + fans Go Hawks,2019-12-18 12:33:13,Twitter for iPhone,96,505
Proud 2support the Natl Defense Authorization Act which includes a well deserved pay raise for the men &amp; women who serve in our armed forces After yrs of decline under previous admin the U.S. military is rebuilt &amp; stronger than ever,2019-12-17 21:43:45,Twitter for iPhone,398,1997
@realDonaldTrump Rumors going around abt negotiations going on between Pelosi Mnuchin and White House on tax policy that detrimental to farmers that this Chr of Finance has not had input  The President loves farmers and I remind Mnuchin of that,2019-12-14 15:37:38,Twitter for iPhone,328,1344
NCAA VB Louisville over Texas 3/2   Watch by me bc uni coach Bobbi Petersen twin daughter is outstanding player for Texas just like other twin is outstanding for uni  congratulations to Louisville advance to regional finals,2019-12-13 23:43:57,Twitter for iPhone,13,119
Mtg w the Federation of Iowa Insurers in Des Moines issues: SECURE Act health care Grassley/Wyden prescription drug pricing bill surprise billing etc https://t.co/Y6aX0LDH2e,2019-12-13 20:26:18,Instagram,25,92
gr8 news w the Trump admin announcement on Phase 1 of China trade deal This is something the 4 previous admins were unwilling 2tackle so shld praise @realDonaldTrump 4 strong/enforceable trade deal This will help Iowa exporting ag products to China particularly soybeans+pork,2019-12-13 16:36:32,Twitter for iPhone,754,3161
2day in Iowa USDA Scty Perdue announced 2nd round of $550M USDA Reconnect Pilot Program $$ from Congress for Farmers Mutual Telephone Company in Stanton This additional $$ will continue 2 help beef up high speed broadband internet infrastructure access in rural communities,2019-12-12 21:40:30,Twitter for iPhone,60,197
Congrats to Dr Stephen Hahn who will b next FDA commissioner Recently I met w Dr Hahn &amp; we discussed my outstanding oversight issues w FDA &amp; the need to keep vaping products out of the hands of teenagers Looking fwd to working 2gether,2019-12-12 20:44:53,Twitter for iPhone,97,434
Senate this wk confirmed 2 new judges to famous Ninth Circuit Inching closer to balance on that court It also makes 50 circuit judges confirmed overall since @realdonaldtrump inauguration Glad 2 help lead this effort +SenGraham Ldr McConnell &amp; Sen GOP keeping it up!!!,2019-12-11 22:37:50,Twitter for iPhone,1846,5392
Uni men’s bball beat top 25 team Colorado on the road last nite 79-76 Go Panthers,2019-12-11 17:56:25,Twitter for iPhone,9,93
Dems decry GOP as the so called party of the rich but 2yrs ago the GOP doubled the child tax credit+lower/middle income Americans received the largest % tax cut in tax reform Contrast to 2day House Dems debate giving a $20+ billion tax cut to millionaires,2019-12-11 17:46:23,Twitter for iPhone,508,1392
Talked to Maria Bartiromo on Fox Business Network + David Westin on Bloomberg TV this morning about FISA abuse/impeachment/USMCA/China trade https://t.co/UBbZudD72C,2019-12-11 13:45:19,Instagram,91,318
FISA report shows Steele dossier built on lies&amp;rumor Graham/Grassley crim referral of Steele Jan 2018 looks like tip of iceberg compared 2details exposed by IG re politically motivated Steele dossier. FBI fed FISA court a bunch of hogwash knowing Steele dossier had NO credibility,2019-12-11 11:58:04,Twitter for iPhone,3994,9675
1st Democrats said it was collusion then quid pro quo then they tried bribery now they’ve settled on abuse of power after yrs chasing impeachment Reality is Democrats hv wanted 2erase Pres Trump’s victory since Nov 2016,2019-12-11 00:57:24,Twitter for iPhone,2022,6088
Met today w Families Against Mandatory Minimums &amp; prisoners  released under the First Step Act passed nearly a yr ago. Incl Matthew Charles 1st released under First Step. Inspired by their stories &amp; efforts to be… https://t.co/zWAWP7D0HQ,2019-12-10 23:27:13,Instagram,76,267
Renegotiating NAFTA was a central campaign promise of Pres Trump and 2day he delivered a historic win for the American ppl The USMCA will create hundreds of thousands of new jobs+protect American workers+raise wages Another promise made &amp; promise kept by Pres Trump,2019-12-10 15:17:57,Twitter for iPhone,7186,23088
This morning I presented 11 stories of Iowa veterans to the Library of Congress Veterans History Project. These were recorded at the Iowa Veterans Home in Marshalltown. This preserves their personal history &amp; honors… https://t.co/ypm863RxhB,2019-12-10 13:40:14,Instagram,81,356
Horowitz IG FISA report shows Carter Page was improperly surveilled &amp; falsely accused of being a Russian agent highlighting the lengths FBI was willing 2go 2get an in on Trump campaign Top brass at FBI seemed 2b looking for any excuse to pursue Trump so basis was rumor NOT facts,2019-12-10 12:21:38,Twitter for iPhone,6027,15823
2day is a wake up call for the American ppl The abuses shown in Horowitz IG FISA report targeted Pres Trump but it could’ve been anyone This isn’t abt politics or Trump it’s abt ensuring our civil liberties are preserved/respected w/in our own govt,2019-12-10 01:43:28,Twitter for iPhone,4255,10680
Talked to Martha MacCallum on Fox News about the release of the Horowitz IG FISA report https://t.co/9oF12P3o82,2019-12-10 00:52:05,Instagram,62,266
Met w the Greater Des Moines Partnership &amp; other local partners for an update on the water trails project that just received a $25M federal BUILD grant from Dept of Transportation https://t.co/vU5h4jVPlD,2019-12-09 22:29:03,Instagram,23,123
Thx FERC for continuing to support Ernst/Reynolds/Grassley request for swift attention to Midwest propane situation. Recent approval for additional shipments is much needed for corn farmers still finishing harvest,2019-12-09 16:10:10,Twitter for iPhone,70,256
I'm glad HUD Disaster Supplemental $96.7M for Iowa via Community Development Block Grant funding that Sen. Ernst + I worked hard to include has been allocated to help support Iowa flood recovery,2019-12-09 15:11:09,Twitter for iPhone,63,273
I can’t hardly believe it the Horowitz IG FISA report is finally coming out 2day We’ve overcome my suspicions of deep state delay Look fwd to studying it!!,2019-12-09 13:19:34,Twitter for iPhone,2656,9561
This wk Iowans w NAIFA talked to me about the importance of passing the SECURE Act that will expand &amp; secure retirement savings. As Finance Chairman this bill is a priority of mine too https://t.co/i6IR9UGJbk,2019-12-08 15:08:47,Instagram,53,189
Sad to hear of Berkley Bedell’s passing He served NW Iowa as a congressman from 1975-1987 He was a good good friend of mine Party difference never kept us from cooperating Barbara &amp; I send our condolences to his family &amp; friends Berkley was beloved by so many,2019-12-08 02:13:54,Twitter for iPhone,60,458
Ystrdy Senate passed legis 2make the FAFSA form for federal student aid shorter+simpler. A big priority for Sen Alexander. I worked 2eliminate students having to provide tax info to Dept of Ed. 175133 Iowans filed FAFSA form in 2018 so this will b helpful 4 lots of Iowa families,2019-12-06 22:08:03,Twitter for iPhone,74,403
Community Bank &amp; Trust holiday luncheon in Waterloo https://t.co/dKiOqGDaRh,2019-12-06 21:35:39,Instagram,17,54
USA has a 50yr record low unemployment rate thx to Pres Trump + GOP leadership even though Dems would prefer ppl believe things are terrible. HIRING signs+growing wages tell the real story More than 266k jobs in Nov despite dire predictions from Dems/media. USA is back on track,2019-12-06 15:10:00,Twitter for iPhone,1106,3294
2day Spkr Pelosi did what we knew she’d do 4 last 2mos &amp;what Democrats hv wanted 2do for last 3yrs per WaPo Jan 20 2017 “Campaign to impeach Pres Trump has begun” we shldnt b surprised but looks like Ds want 2erase ‘16 election Why not wait for 2020election/ppl 2hv voice on Pres?,2019-12-06 00:34:36,Twitter for iPhone,1382,4308
Last night was the US Capitol Christmas Tree lighting ceremony to kickoff the holiday season. #realhistorychannel This tradition began in 1964 when then Spkr of the House McCormack planted a live Christmas tree on… https://t.co/d2xAVEYQ7i,2019-12-05 23:02:47,Instagram,58,270
students with iJAG (Iowa jobs for America’s graduates) https://t.co/jMu9u6klPE,2019-12-05 21:58:20,Instagram,11,51
Carol &amp; Mark Doss from Des Moines https://t.co/FmPG09o0jq,2019-12-05 21:41:04,Instagram,6,43
this wk Senate confirmed 8 more of @realdonaldtrump district court judges That makes 170 SCOTUS/circuit/district judges confirmed by Republican led Senate since Pres Trump took office As Judiciary Chair I led most of these noms&amp; Chair Graham continues 2make judges a top priority,2019-12-05 21:29:31,Twitter for iPhone,1659,5634
World Bank about to sneak through a plan to give China the 2nd largest economy in the world billions of $$ +Congress hasn’t seen plan. They should remember Congress controls the purse strings &amp; transparency brings accountability,2019-12-05 13:38:00,Twitter for iPhone,2822,4643
Talked w Corryn from RFD-TV abt the seeding rural resilience act USMCA China trade &amp; biodiesel/ethanol https://t.co/qID741ahDd,2019-12-04 23:56:50,Instagram,29,104
Japan has approved the trade deal Pres Trump made w PM Abe This new agreement is a big win for US ag/farmers/ranchers who will be able to sell many of their products in Japan on a level playing field w the competition Next step is a comprehensive trade deal w Japan,2019-12-04 17:39:00,Twitter for iPhone,471,1417
The Nelson + Snavely families from Emmetsburg &amp; Iowa City https://t.co/UeYwKjYh4I,2019-12-03 23:31:01,Instagram,7,47
New rpt says Big Pharma excuse of R&amp;D costs for high prices is bogus Prices for drugs for multiple sclerosis were based on distortions/not enough transparency NOT R&amp;D costs The Grassley/Wyden bill to lower Rx prices will help lower prices w/o causing harm to R&amp;D. Must act NOW,2019-12-03 22:25:17,Twitter for iPhone,252,908
The Smith family from Grinnell https://t.co/zKbTza7Ofo,2019-12-02 22:27:36,Instagram,7,66
The “first reading of the emancipation proclamation by president lincoln” hangs above the west staircase outside the Senate floor. #realhistorychannel It depicts Lincoln reading the 1st draft of his Emancipation… https://t.co/GHNQgmHn1m,2019-12-02 12:58:26,Instagram,97,402
1 yr ago @realDonaldTrump signed the US Mexico Canada trade agreement Pres Trump wants Congress to pass USMCA &amp; Iowans do too. USMCA will benefit agriculture+mfg +jobs etc It’s time for House Democrats to allow a vote &amp; we can deliver #USMCANow for the American ppl,2019-11-30 20:53:12,Twitter for iPhone,1996,5477
Uni wins match over Valparaiso 3/1.   Uni advances to mo valley tourney finals,2019-11-30 00:56:58,Twitter for iPhone,8,87
Valparaiso over uni 25/20 3rd set,2019-11-30 00:29:41,Twitter for iPhone,7,47
MoValley tourney Set two uni over Valparaiso 25/20,2019-11-29 23:53:25,Twitter for iPhone,4,40
MoValley VB tournament semifinals set one  uni over Valparaiso 25/9,2019-11-29 23:21:55,Twitter for iPhone,5,47
Like pilgrims coming to america for religious freedom Im thankful for the same freedom And I’m thankful for the men &amp; women who serve our nation to defend all our freedoms I’m also thankful for family + the opportunity to serve Iowa in the US Senate Happy thanksgiving to all,2019-11-28 13:38:20,Twitter for iPhone,349,2029
As u gather around table 4 thanksgiving remember Iowa is the #1 state for pork/corn/eggs #2 for soybeans #5 in turkey processing #7 in turkey production Food doesn’t grow in grocery stores We shld b thankful for family farmers &amp;agriculture every day &amp; thanksgiving is no exception,2019-11-28 01:45:39,Twitter for iPhone,1765,7877
Well!! Thanksgiving is here. Time to get house ready for 25/30 Grassley’s&amp;friends  So Beth is ready for my contribution to holiday. My only order is “stay out of the kitchen” https://t.co/diPF26yNfE,2019-11-26 19:19:33,Instagram,68,450
