I read Scty Perdue said we need to cover flood damaged grain stored in bins in the much needed Sen disaster bill. I AGREE + I hv an amendment that would do just that. Sen Approps working w me to help farmers,2019-04-10 13:27:09,Twitter for iPhone,39,155
Good talking w Iowans at Sen Ernst’s constituent coffee this morning https://t.co/jzHQ7hYn0X,2019-04-10 12:42:38,Instagram,7,60
Met w leaders from Pella today issues: rural water infrastructure economic development etc https://t.co/WO6iJHVGTP,2019-04-10 00:40:28,Instagram,13,63
Honored to receive my very own GRAMMY from their CEO Neil Portnow for my ldrship on the Music Modernization Act which Pres Trump signed into law. Improves access to royalties for… https://t.co/5rjRq5dBbZ,2019-04-09 18:56:14,Instagram,50,254
Increased enforcement+H1B rules 2protect US techworkers+ EB5 regs+public chrge rule+ protecting US workers from fraud/discrimination = just some of Dir Cissna's ACCOMPLISHMENTS @ USCIS Long overdue reforms promoting rule of law &amp; doing what voters asked4 w PresTrump election,2019-04-09 17:57:44,Twitter for iPhone,78,260
U of Iowa students in the Leadership Education in Neurodevelopmental &amp; related Disabilities program https://t.co/GOILuQFUDz,2019-04-09 14:00:25,Instagram,8,41
Talked w CNBC &amp; Bloomberg this morning abt Senate Finance Cmte’s 3rd hrg on drug pricing. This hrg we focus on the PBMs which are the middlemen of Rx drugs https://t.co/Myel82P8ii,2019-04-09 12:46:14,Instagram,31,133
The Birkedal Stephens Wilson +Weber families from Mason City Waukee Norwalk + Monticello https://t.co/ZeR12QvO37,2019-04-08 23:38:36,Instagram,12,43
Spoke w Martha MacCallum abt Dem request for Pres tax returns oversight &amp; ldrship changes at Homeland Sec Dept. Watch on FOX News 2nite https://t.co/Qb17R7A2xH,2019-04-08 23:08:21,Instagram,35,143
As president pro tem of the Senate I signed the bill authorizing the honorary promotion of my friend Sen Bob Dole to the rank of colonel. A promotion from Army captain from his service in… https://t.co/QdZJIFObRh,2019-04-08 21:58:27,Instagram,78,417
Commissioner McAleenan will do gr8 job @ DHS. Has gr8 support from 1 of smartest immigration policy minds I know: US Citizenship &amp; Immigration Services Dir Cissna who worked w me for 2yrs on judic cmte &amp; is doing an excellent job leading USCIS,2019-04-08 15:16:13,Twitter for iPhone,219,672
Skype Q&amp;A w 125 students from Stilwell Jr High in West Des Moines issues: contacting elected officials pollution immigration govt shutdowns bipartisanship https://t.co/FAtB35JtPt,2019-04-08 13:10:02,Instagram,23,89
Cong Nunes: It’s now clear that top intel officials were perfectly well aware of the dubiousness of the dossier but they embraced it anyway because it justified actions they wanted to taketurning the full force of our intel agencies first agst acandidate and then agst  POTUS,2019-04-07 18:01:39,Twitter for iPhone,5169,11627
From Land of the UNBELIEVABLE  THE BELIEVABLE. Hurry there is real History on the Channel,2019-04-06 22:04:32,Twitter for iPhone,63,337
Dems now going after AG Barr digging up anything they can to discredit him Barr said he’d release the Mueller report mid month. Dems need to hv patience Let law+process work but they can’t get over that Pres Trump is our constitutionally elected president,2019-04-06 20:15:24,Twitter for iPhone,2036,5493
2 wks since Mueller finished report Not surprised Dems still aren’t satisfied Pt of investigation was to find if there was a crime Mueller found NO BASIS FOR A CRIME Why are Dems trying to create a crime (that doesn’t exist) rather than accept results of highly respectd Mueller??,2019-04-06 20:05:34,Twitter for iPhone,1053,2900
1 of the giants of the Senate for the last century Fritz Hollings has passed away He wasn’t only dedicated 2serving South Carolinians but he brought to the Senate moderation as a southern democrat It was a thrill to listen to his debate always intellectual as well as entertaining,2019-04-06 16:45:33,Twitter for iPhone,35,161
This wk at the White House Pres Trump celebrated the impact the First Step Act is having on Americans. Pres Trump’s compassion will help turn lives around after passage of criminal… https://t.co/nyDU4EebSX,2019-04-06 16:23:42,Instagram,95,345
The Wright family from Des Moines &amp; Sioux City https://t.co/dJ36Jev21x,2019-04-04 18:29:26,Instagram,10,49
Honored to receive the Holmberg Lifetime Achievement Award for my leadership/advocacy for biofuels &amp; rural America but my work’s not done yet https://t.co/RxqOTjSigb,2019-04-04 14:59:34,Instagram,27,219
I support release of the Mueller report,2019-04-04 14:13:30,Twitter for iPhone,14708,84849
Today NATO Secretary General Jens Stoltenberg addressed a joint session of Congress. https://t.co/RhG9plILaW,2019-04-03 22:31:27,Instagram,27,115
John &amp; Kim Grzywacz of Ames talked to me about transportation issues https://t.co/Ny8NPJOEqE,2019-04-03 22:26:06,Instagram,8,37
Q&amp;A w Iowans from Lake City &amp; Des Moines after their Capitol tour issues: prescription drug prices health insurance Medicare etc https://t.co/OJu80HwDna,2019-04-03 21:08:02,Instagram,15,55
In 2013 Dem majority+GOP agreed to speed up Senates consideration of Obama nominees But 2day 34 Dems changed position from 2013.  GOP is consistent. What has changed for Dems???,2019-04-03 20:04:13,Twitter for iPhone,306,1021
Iowans w Land O’Lakes https://t.co/oSRowVJCNj,2019-04-03 19:27:34,Instagram,9,42
Talked w Raquel for WOI/KCAU TV about the need for federal disaster relief to help Iowans impacted by the devastating floods &amp; other natural disasters. https://t.co/QoNXMypvDK,2019-04-03 19:16:25,Instagram,18,91
Yet another study among multitudes of studies showing ethanol is good for the environment refuting anti ethanol orgs who try 2spread the false facts abt ethanol’s harm to the environment Don’t believe them Ethanol is good good good,2019-04-03 14:37:24,Twitter for iPhone,123,435
Attended Sen Ernst’s constituent coffee this morning. Barbara w VGM employees from Waterloo &amp; Jamie Davis from Carroll working at the Pentagon https://t.co/Mla9Rd2R7T,2019-04-03 14:33:43,Instagram,9,40
Talked w the Iowa Cattlemen’s Association in Sen Ernst’s office https://t.co/kMBVWWZWaN,2019-04-03 14:24:47,Instagram,6,42
Sen Ernst &amp; I answered Qs from 40 Le Mars Middle Schoolers https://t.co/48VlnYf0nT,2019-04-03 14:08:29,Instagram,13,55
Iowa Chapter of the Alzheimer’s Association https://t.co/CH5HSawUWr,2019-04-03 13:30:19,Instagram,10,52
Cherry blossoms at the US Capitol #realhistorychannel 3020 cherry trees were presented in 1912 as a gift from Japan. First Lady Taft ensured the trees were transferred &amp; she planted 2… https://t.co/Bp8wGPDTkn,2019-04-03 12:59:59,Instagram,30,165
My bipartisan bill Right Rebate Act w Sen Wyden just passed Congress &amp; is on to Pres Trump to be signed into law It will save taxpayers billions of $$ by stopping pharma cos from mislabeling generic drugs as brand name costing Medicaid billions$$$ every yr,2019-04-02 22:57:29,Twitter for iPhone,339,1422
My ACE Kids bill UNANIMOUSLY passed &amp; is on its way 2 POTUS. ACE coordinates care 4 kids on Medicaid w medically complex conditions so they can receive higher quality health care focused on their specific needs ACE gives more flex for states&amp; kids/families 2 coordinate care,2019-04-02 22:39:40,Twitter for iPhone,109,496
Mtg w the Iowa Bankers Association https://t.co/FcFyVkCAfA,2019-04-02 21:09:34,Instagram,7,41
I hope Iowans/Iowa media will ask my dem colleagues on their next trip to IA why they voted against disaster relief funding bill that was b4 the Senate 2night impeding $$$ getting to disaster areas like devastating floods of SW Iowa Don’t they care abt Iowans in distress?,2019-04-02 00:26:27,Twitter for iPhone,954,2353
Difficult Medicaid news in IA w UHC leaving but Gov Reynolds is right to b tough to push insurance plans to focus on quality &amp; value for Iowans + Accountability measures shldnt b controversial,2019-04-01 23:30:26,Twitter for iPhone,26,120
2nights mtg at WH was a reminder that most said we'd never pass crim justice reform We proved them wrong w passage of overwhelmingly BIPARTISAN/ @realdonaldtrump backed bill Im inspired by so many stories of ppl who've turned their life around alrdy since being releasd frm prison,2019-04-01 22:53:20,Twitter for iPhone,272,867
3mos ago POTUS signed biggest crim justice reform in 30yrs Gr8ly humanitarian he deserves credit ATTN: media big accomplishment+ very bipartisan,2019-04-01 22:50:48,Twitter for iPhone,267,905
The Bulver family from Ankeny https://t.co/PcfyKbXlbU,2019-04-01 21:19:58,Instagram,5,33
2day marks 500 days since US park police fatally shot Bijan Ghaisar His family still waiting for info+FBI mum on its investigation  Family deserves answers+ accountability Whats taking so long?,2019-04-01 21:05:26,Twitter for iPhone,72,243
Lot of SW Iowa families+ farmers +small biz owners still working on recovery &amp;rebuilding as disastrous floods recede Senate votes 2day on disaster $$ that can help recovery NO REASON SHLDNT B BIG BIPARTISAN VOTE Some Dem sens are hearing from Iowans directly during their IA trips,2019-04-01 19:17:49,Twitter for iPhone,75,246
Impt for ppl talking abt health care reform 2 remember that affording good insurance is only 1part of issue Lowering health care/Rx drug/hospital costs is just as urgent if not more so I'm working w Dems+GOP on the Finance Cmte to pass legis this yr/Obamacare failed 2 lower costs,2019-04-01 15:08:44,Twitter for iPhone,170,807
Peggy Noonan Saturday Wall Street Journal “so I am worried which is the point of this piece. The war between Trump and not trump will continue will not be resolved will get meaner. One side will win and one side will and the  nation will go on changed . it grieves me” Me too,2019-03-30 20:08:11,Twitter for iPhone,94,476
@realDonaldTrump If jack Kennedy cld keep Soviet missiles out of Cuba  the USA ought to get 100 Russian military thugs out of Venezuela. The Monroe doctrine says it all,2019-03-30 19:36:04,Twitter for iPhone,178,641
Congrats to Iowa U women for advancing to Elite 8 of ncaa.  Gustafson w 29 is the greatest.  But it’s all teamwork p,2019-03-30 18:03:02,Twitter for iPhone,25,180
much reflection needed by Govt +Press + anyone disappointed by result of thorough 3yr investigation that Pres Trump DID NOT COLLUDE w foreign adversary  5/5,2019-03-30 16:24:46,Twitter for iPhone,679,2097
In final analysis highly respected Mueller+19lawyers+40 agents+2800subpoenas +500srch wrnts + 500witnesses+13info reqsts frm foreign govs over 3yrs &amp; &gt;$25m found NO COLLUSION Full report can end vicious innuendo Americans deserve 2see 4/5,2019-03-30 16:24:16,Twitter for iPhone,417,1013
How our constitutionally protected free press fell for it hook line &amp; sinker and carried it forth for 3 yrs giving credibility to the whole thing 3/5,2019-03-30 16:23:40,Twitter for iPhone,1034,3740
Even worse Clinton camp+Fusion pulled wool over prev fbi/doj/cia eyes+weaponized RUSSIAN SOURCED dossier (collusion?) Feds relied on dubious dem-funded rumors to SPY ON AMERICANS+trump camp 2/5,2019-03-30 16:22:58,Twitter for iPhone,470,1056
1 Senators reflection on the total failure of the RESISTANCE Got 2hand it to dems for masterful job of manuftrng something that didnt exist Bogus Russian collusion naratv drove political discussn 4last 3yrs+effort 2derail CONSTITUTIONALLY ELECTED president  1/5,2019-03-30 16:22:18,Twitter for iPhone,703,1628
Thx to Iowa Natl Guard for help executing flight 2day to survey SW Iowa floods https://t.co/V3vASt7cPZ,2019-03-29 23:42:04,Instagram,24,178
Joined USDA Under Scty Bill Northey &amp; IA Scty of Ag Mike Naig in Malvern. 300 farmers issues: flooded grain bins crop insurance levees etc https://t.co/GAVwU9BeYS,2019-03-29 20:10:53,Instagram,26,89
45ppl Mills Co flood mtg in Glenwood/viewed drone footage of damage Issues:pumps not successfully draining hwy damage Railroad repairs road access damage assessments etc https://t.co/OvANiblBFU,2019-03-29 18:18:20,Instagram,12,43
55ppl in Hamburg getting update from city/schools/hospital after flooding. Concerns abt temporary housing city making payroll levee water infrastructure property tax relief on flooded… https://t.co/WB40rkNFMw,2019-03-29 16:29:04,Instagram,20,51
Flying over SW Iowa surveying flood devastation https://t.co/Dy0Z4iYxYl,2019-03-29 14:44:06,Instagram,24,85
2day I’m touring flood damage in SW Iowa 2 hear from Iowans in flood impacted communities I’ll also be w USDA UnderScty Northey &amp; Iowa Scty of Ag Naig Hearing from farmers/producers abt the floods affect on agriculture&amp;the tremendous flood damage to small towns of SW Iowa,2019-03-29 13:13:28,Twitter for iPhone,85,471
Amb Ken Quinn is retiring as president of DSM based World Food Prize Foundation in Jan 2020 He has brought tremendous ldrship &amp; notoriety to the org that celebrates Ag/innovation/legacy of Norman Borlaug/etc Sad to see him go but good 2hear he’s staying in DSM,2019-03-28 20:03:46,Twitter for iPhone,16,88
Q&amp;A w Dubuque Chamber issues: trade health care emergency powers community health centers transportation etc https://t.co/DcSLUpNs3t,2019-03-28 19:44:37,Instagram,8,34
The McDermott family from Crescent https://t.co/Ip799wFb76,2019-03-28 19:37:00,Instagram,11,32
Dr Michael Abramoff U of Iowa Dept of Opthalmology https://t.co/TvauNsd6Eb,2019-03-28 11:38:15,Instagram,10,44
2day I reintrod bipart bill 2 help fam farmers who fall on hard times Family farmer relief act updates Chapt12 of bankruptcy code 2recognize increased debt small farms often carry 2 FEED THE WORLD I hope NO family farmer has 2take advantage of this legis but Ag economy fluctuates,2019-03-27 23:43:38,Twitter for iPhone,248,1336
Q&amp;A w 50 Iowa Farm Bureau members Issues: trade Farm Bill implementation etc https://t.co/6bucquIJW5,2019-03-27 23:16:05,Instagram,14,49
thx to Autism Speaks for recognizing my work on the ACE Kids bill &amp; Kevin &amp; Avonte’s law. https://t.co/llpIvQAOqN,2019-03-27 23:00:10,Instagram,25,116
Attended AIPAC conf last night Glad to support Israel/the freest democracy+best ally of the US in the Middle East  Pres Trump has been a good friend to Israel by keeping his promise to move embassy to Jerusalem/recognizing Israeli Golan Heights/withdrawing from the Iran nuke deal,2019-03-26 22:21:48,Twitter for iPhone,195,1206
Interviewed by Sarah Julia &amp; Marissa from the Daily Iowan. Qs on Mueller report green new deal + Iowa flooding https://t.co/DAQppwfoO2,2019-03-26 20:50:38,Instagram,21,88
Career &amp; technical education students from Iowa https://t.co/vvDYAHsAE1,2019-03-26 20:37:47,Instagram,9,38
Good mtg w Iowans in DC for AIPAC conference https://t.co/UaT51FGalr,2019-03-26 20:06:43,Instagram,11,65
5yrs ago 2day the Norman Borlaug statue was unveiled in the US Capitol. Dr Borlaug of Cresco dedicated his life to end hunger &amp; poverty across the world. 2day would be his 105th bday https://t.co/5RsbRzrBCU,2019-03-26 00:44:24,Instagram,38,277
Glad the IRS issued relief from filing deadlines/penalties for Iowa taxpayers &amp; businesses in Fremont Harrison Mills Monona + Woodbury counties bc of devastating floods Deadlines generally extended to July 31 2019,2019-03-25 23:20:11,Twitter for iPhone,62,285
Chloe Reed from Bettendorf is an intern in my Davenport office https://t.co/aKEqYKPWOb,2019-03-25 23:15:53,Instagram,11,68
2 yrs of false accusations I’m glad that Mueller‘s work is done I appreciate his good work &amp; the recommendations let’s not gloat let’s all move on &amp; do the country’s business,2019-03-24 22:14:21,Twitter for iPhone,2986,14241
UNI 184lb Foster wins NCAA championship.  Mediapolis Iowa proud of hometown hero   I saw him wrestle at home when UNI beat Iowa St  Congrats fr this UNI alumnus,2019-03-24 01:58:30,Twitter for iPhone,45,406
Thx @realdonaldtrump for approving Gov Reynolds expedited federal assistance request for Iowa floods Badly needed 4 recovery I applaud ur quick turn around due to serious situation,2019-03-23 21:59:12,Twitter for iPhone,635,3006
PTL the Mueller investigation is over Waiting w breathless anticipation of what it says,2019-03-22 22:26:25,Twitter for iPhone,243,1443
I know that the VP after touring the flooded parts of Iowa knows how serious the flooding situation is here &amp; that he has told Pres Trump of its devastation Common sense tells me that @realDonaldTrump will quickly approve Gov Reynolds request for expedited disaster relief,2019-03-22 13:59:31,Twitter for iPhone,197,1004
In phone convo I urged FEMA Acting Administrator Gaynor to move quickly approving Gov Reynolds expedited disaster request for Iowa flooding FEMA assistance must get moving in the state after massive infrastructure/business/homes/agriculture damage,2019-03-22 13:47:03,Twitter for iPhone,62,210
As you watch NCAA #MarchMadness Notice the b-ball hoops ALL manufactured in Jefferson IA by 94 employees at American Athletic Inc I saw the hoops being made last yr during my #99countymeetings Yes this is RURAL IOWA a community of abt 4000,2019-03-21 22:03:36,Twitter for iPhone,100,478
Tour + Q&amp;A at Henry County Health Center 60ppl issues: physical reimbursement REACH bill EMS support cost of insulin immigration drug price transparency #99countymeetings https://t.co/bsS6kDUjXq,2019-03-21 21:42:31,Instagram,6,33
45ppl Dexter Apache Tour/Q&amp;A in Fairfield issues: trade ESOP infrastructure tariffs border wall etc #99countymeetings https://t.co/gG5Ctg3WGe,2019-03-21 19:54:17,Instagram,10,39
Stopped by the Fairfield Ledger for an interview with Andy #99countymeetings https://t.co/PJxa5v9eLo,2019-03-21 18:44:36,Instagram,9,35
Iowans incl. families + farmers+ businesses can find info/resources on the floods in Iowa on my website https://t.co/gwplafDp33,2019-03-21 18:41:02,Twitter for iPhone,26,48
Members of the Durant Police Dept #99countymeetings https://t.co/PocMpDFHnx,2019-03-21 17:36:38,Instagram,13,32
Q&amp;A at Sigourney HS issues: border wall public edu flat tax bipartisanship climate change guns natl debt equal rights etc #99countymeetings https://t.co/Wg0QdybsT4,2019-03-21 17:06:18,Instagram,15,52
Durant TM 95ppl issues: thx for work on judges Juvenile Justice Reauth natl emergency/article one bill drug $$$ guns natl debt visas water quality student loans spending bills WOTUS trade Mueller report pensions Trump cabinet economy etc #99countymeetings,2019-03-21 14:23:28,Twitter for iPhone,12,80
Cedar County town mtg in Durant #99countymeetings https://t.co/wZONINcGv4,2019-03-21 14:20:10,Instagram,7,28
Congrats to Urbandale HS students Jacob Sammon Matthew Moran &amp; Riley Vander Hart named FIRST prize winners in natl CSPAN studentcam competition on the 1st amendment/what it means to b an American I was honored to b interviewed for the project,2019-03-21 02:13:46,Twitter for iPhone,29,249
Thx for the gr8 service &amp; dinner at the Muscatine Family Restaurant #99countymeetings https://t.co/5QTsRJuG5O,2019-03-21 00:34:30,Instagram,7,92
Just hung up w Transportation Scty Chao abt western Iowa road conditions from flooding Significant interstate/secondary road/railroad damage DOT stands ready to respond to any help that we need Particularly w helping Iowans applying to appropriate grants,2019-03-20 22:38:10,Twitter for iPhone,59,258
Q&amp;A w farmers at the Muscatine Co Farm Bureau issues: trade WOTUS ethanol flood assistance Ag mergers Pres budget green new deal etc #99countymeetings https://t.co/UIEzst74hu,2019-03-20 22:13:10,Instagram,11,45
Tour + Q&amp;A w 45ppl at Grask Peterbilt in Davenport issues: infrastructure pensions social security China trade health care/drug prices #99countymeetings https://t.co/vaetIpqGIz,2019-03-20 19:44:58,Instagram,16,51
Honored Jim Barr a USPS letter carrier for 32yrs in DeWitt as he was recognized w a PMG hero award for heroic service on the job https://t.co/AZYewt52aL,2019-03-20 17:04:29,Instagram,13,78
DeWitt Chief of Police Dave Porter #99countymeetings https://t.co/IZygdkrTxl,2019-03-20 16:17:37,Instagram,7,22
DeWitt TM 160ppl issues: mental health trade Medicare drug $$$ govt shutdowns welfare human trafficking FISA whistleblowers central state pensions natl debt biodiesel soc security filibuster reform etc #99countymeetings,2019-03-20 16:14:57,Twitter for iPhone,32,95
Clinton County town mtg in DeWitt #99countymeetings https://t.co/STORFcvHPl,2019-03-20 16:11:09,Instagram,6,29
Interviewed by Marquette HS students in Bellevue for their radio program on Maquoketa Radio Station KMAQ #99countymeetings https://t.co/UwtMJ7FRGQ,2019-03-20 14:33:15,Instagram,13,43
Q&amp;A at Marquette Catholic in Bellevue 82ppl issues: fed emergency assistance political philosophy presidents USMCA etc #99countymeetings https://t.co/vPdCijnccY,2019-03-20 14:25:49,Instagram,12,44
Last night I spoke w the Army Corps ldrship in Omaha abt flooding in western Iowa Expressed critical need for communication &amp; assistance to severely affected Iowa communities Flood mitigation must be a Corps priority &amp; common sense problem solving is badly needed,2019-03-20 12:48:21,Twitter for iPhone,53,267
Invited to U of Dubuque to speak on bipartisan criminal justice reform &amp; the 85 federal judges confirmed in the 1st 2yrs of Trump’s presidency #99countymeetings https://t.co/ACdc4nRofx,2019-03-20 01:24:18,Instagram,39,221
The Mayor of Elkader Josh Pope #99countymeetings https://t.co/dNsqxCfHyL,2019-03-19 21:24:51,Instagram,9,23
Deputy Sheriff McCartney Allamakee Co #99countymeetings https://t.co/qNn6yFwmcA,2019-03-19 21:22:48,Instagram,10,29
Thx to Alpine Communications for hosting me in Elkader 34ppl Q&amp;A issues: rural broadband infrastructure trade ag economy bipartisanship privacy natl debt immigration #99countymeetings https://t.co/3VRPTg4O3C,2019-03-19 21:16:50,Instagram,17,52
Tour + Q&amp;A w employees at KolGol in Waukon 31ppl issues: trade border security FEMA drug prices/PBMs rural broadband rural health care green new deal etc #99countymeetings https://t.co/ZQPHn8HX9m,2019-03-19 20:23:58,Instagram,14,49
For 40yrs CSPAN has covered cong hearings+speeches+other govt proceedings making our representative democracy more accessible to ppl across the country It’s time to make the federal judiciary just as accessible &amp; put cameras in the courtrooms Sen Durbin &amp; I have a bill to do this,2019-03-19 17:21:49,Twitter for iPhone,386,1468
Walking tour of West Union’s Main St + Q&amp;A 60ppl issues: trade Medicare climate change immigration etc #99countymeetings https://t.co/WEzAIDRxmo,2019-03-19 16:55:09,Instagram,11,32
Devastating flooding over the wknd in parts of Iowa particularly along the Missouri River My staff &amp; I are monitoring closely &amp; helping w federal emergency assistance Not surprised by all the stories of neighbors helping each other Shows strong character of our state,2019-03-18 17:04:19,Twitter for iPhone,121,665
Congrats to Dike New Hartford 7th graders on their 4th straight AAU volleyball state championship. My gr8 granddaughter Indee is # 15 https://t.co/hCjPvEngzQ,2019-03-17 17:52:14,Instagram,31,220
Parents and kids looking for advice about going to college. Read Peggy Noonan in the Wall Street Journal today she gives very good advice about picking a college I will make a suggestion to go to the University of Northern Iowa but her general advice is really great,2019-03-16 16:18:31,Twitter for iPhone,115,763
This wknd Cedar Rapids is featured on “CSPAN cities tour” this is an opportunity 2 get some Iowa HISTORY u can’t get on the history channel,2019-03-15 16:31:34,Twitter for iPhone,54,396
5 more ridiculous RFS waivers for big oil cos from EPA for 2017 That’s nearly a billion bushels of corn demand lost from policies fired Pruitt put in place Important for new Admin Wheeler 2put in new process 4 2018/future yrs Pres Trumps commitmnts to Iowa/Midwest hang in balance,2019-03-14 22:13:06,Twitter for iPhone,209,568
Its up to the Pres under 1976 natl emergencies act to use authority given by Congress So its up to Congress to take back those powers / I support Sen Lee's ARTICLE ONE Act to do that 2days show vote doesnt fix the ROOT of the problem of Congress giving away 2 much power to Pres,2019-03-14 21:05:50,Twitter for iPhone,138,494
I counseled Pres against using natl emergency but Congress gave him authority+as commander in chief its his job to protect natl security&amp; w the 12yr high in illegal crossings+record fentanyl theres of course an emergency on the border / Congress failed to fix the problem so far,2019-03-14 21:03:24,Twitter for iPhone,3825,10125
The Kuntz family from Oakville https://t.co/gFPWIw4qGp,2019-03-14 19:38:05,Instagram,4,30
Collins-Maxwell HS students at Sen. Ernst’s spring break reception https://t.co/0Kp0MIXOXM,2019-03-14 19:14:35,Instagram,5,27
The Fyfe family from Pella https://t.co/jw7CiHuswJ,2019-03-14 19:12:42,Instagram,5,24
Treasury Scty Mnuchin testified b4 the Senate Finance Cmte this afternoon https://t.co/s7dUDRgZ9y,2019-03-14 19:05:22,Instagram,16,71
Proud to be a family farmer from New Hartford #nationalagday #cornwatch https://t.co/t6DabVu0H9,2019-03-14 17:03:52,Instagram,18,101
More $$$ being spent to beef up enforcement at ports of entry as a result drug lords are crossing the border where there isn’t any protection/barriers That’s why border security/resources are still badly needed,2019-03-14 16:59:14,Twitter for iPhone,706,1867
Customs&amp; border patrol seized 388lbs of fentanyl btwn ports of entry in FY18 (almost 88MILLION LETHAL DOSES) Drugs+human trafficking clearly a crisis at the border Fed govt needs 2protect American ppl&amp; Congress shld support @realdonaldtrump border security priority,2019-03-14 16:44:23,Twitter for iPhone,1980,4116
