Bradley 25/22over uni set 2,2019-10-12 00:01:55,Twitter for iPhone,7,45
Uni ovr Bradley 25/19. First set,2019-10-11 23:30:21,Twitter for iPhone,10,50
Not surprised House Dems r trying to impeach Thats been their goal since inauguration day But w no formal process +no real investigating+ no inclusion of GOP/white house +no regard for history/precedent its hard to take them seriously,2019-10-11 14:17:43,Twitter for iPhone,6720,22473
Where do House Dems get idea they can conduct impeachment inquiry &amp;freeze republicans out of process? I understand why WH Counsel sent letter 2House bc of unprecedented +unfair approach Dems r using Unbelievable that Ds think Rs shld hv less involvement now than w Nixon&amp;Clinton,2019-10-11 14:13:40,Twitter for iPhone,735,1904
Attended the grand opening of the Waterloo Career Center which will help better prepare high school students for the workforce https://t.co/IR9asFJP4s,2019-10-10 23:53:26,Instagram,23,199
Gr8 to see Trump admin Exec Order to improve regulatory transparency&amp;accountability and end abuse of reg guidance docs Another step in right direction for Gov by the People NOT bureaucrats,2019-10-10 15:27:50,Twitter for iPhone,366,1451
Happy to have former First Lady Laura Bush at my alma mater UNI in Cedar Falls. She’s speaking tonight as part of the Joy Cole Corning distinguished leadership lecture series https://t.co/S3ch7Ffmec,2019-10-09 23:31:14,Instagram,26,215
Washington is an island surrounded by reality. Iowa farmers know the time for USMCA is now. https://t.co/ZWlIEkFa8N,2019-10-09 22:16:00,Instagram,154,507
Honored to introduce my grandson State Rep Pat Grassley to VP Pence. The Vice Pres congratulated Pat on being newly elected speaker-select by the Iowa House Republican Caucus https://t.co/yKetY7f8nL,2019-10-09 21:29:41,Instagram,99,506
Enjoyed talking w Iowans at Vice President Pence’s event on USMCA in Waukee https://t.co/RFsMnIU2Hw,2019-10-09 21:09:40,Instagram,35,156
Driving down to Waukee to promote the US Mexico Canada trade agreement alongside VP Pence Sen Ernst Gov Reynolds &amp; Iowans who know it’s time to pass #USMCAnow,2019-10-09 18:25:13,Twitter for iPhone,553,2506
Harvest has started on the Grassley Farm #cornwatch https://t.co/IIXzm7xryC,2019-10-09 15:26:15,Instagram,1341,4232
1yr ago Justice Kavanaugh was confirmed JudicCmte investigated many accusations&amp;in 4 cases ppl def lied to Congress which is against law To send a clear signal 2prevent ppl telling Cong false info/gum up conf process we r asking doj what hv u done in past yr on crim referrals?,2019-10-08 23:36:23,Twitter for iPhone,1213,3820
Today was about partnerships &amp; celebration at the groundbreaking of the Cedar Rapids flood project funded by the Army Corps of Engineers. https://t.co/b9aQyH1P5n,2019-10-08 21:39:01,Instagram,29,127
Toured Thomson Prison w Sen Durbin &amp; Congresswoman Bustos. We discussed the implementation of the First Step Act that Durbin &amp; I led + Pres Trump signed in December. The First Step Act is a policy to reduce… https://t.co/Mtr52m9FbC,2019-10-08 17:38:39,Instagram,49,134
Thx Pres Trump for your recent action on ethanol &amp; biodiesel @ New Hartford Iowa https://t.co/j4ZDhunStx,2019-10-08 12:09:42,Instagram,83,333
US/Japan trade deal @realDonaldTrump signed 2day is gr8 news for Iowa farmers+ US agriculture I had ph call w Japanese Amb Sugiyama last wk to discuss details Next step is a full trade deal w Japan This helps strengthen US negotiating position w China,2019-10-07 20:47:18,Twitter for iPhone,279,1136
2/2 Barbara &amp; I continue to be very proud of our grandson and have full confidence @PatGrassley will serve Iowans well as he takes on his new role as speaker of the Iowa house,2019-10-07 19:12:58,Twitter for iPhone,21,201
I’ve watched my grandson @PatGrassley mature as a freshman legislator at age 23 to become a very effective leader in the Iowa House. I attribute the mentorship of @SpeakerUpmeyer for serving as a tremendous role model to Pat + the entire Republican caucus 1/2,2019-10-07 19:11:54,Twitter for iPhone,52,409
gr8 news! W 2day’s announcement @realdonaldtrump delivers on his continued promise to support ethanol+ biodiesel + farmers THANK YOU Pres Trump for your support of rural America &amp; following the renewable fuel standard as Congress intended Promises made&amp; promises kept,2019-10-04 14:39:33,Twitter for iPhone,775,3339
@realDonaldTrump Thanks for the great improvement you made to Medicare advantage it will really help our senior citizens unlike Democrats who propose Medicare for all it would end Medicare advantage,2019-10-04 00:48:04,Twitter for iPhone,252,973
Gr8 news: The state of Iowa has $289+ million budget surplus Proving Gov Reynolds &amp; Republican led state legislature are responsible stewards of taxpayer $$,2019-09-30 16:39:31,Twitter for iPhone,584,2497
Uni win match 3/1 over Indiana st,2019-09-29 00:02:56,Twitter for iPhone,8,72
Indiana st ovr uni 27/25 set three,2019-09-28 23:37:19,Twitter for iPhone,11,58
Uni ovr Indiana st 26//24 set two,2019-09-28 23:01:16,Twitter for iPhone,7,56
UNI ovr Indiana st 25/17. Set one,2019-09-28 22:28:04,Twitter for iPhone,7,49
Why are House Democrats cutting House Republicans out of the process of developing Articles of Impeachment and not following same procedures used in Nixon and Clinton impeachments???? Seems like a political motivation not a constitutional one!!!,2019-09-28 13:46:52,Twitter for iPhone,12795,36330
UNI over Evansville 3/1 match,2019-09-28 01:18:09,Twitter for iPhone,4,57
UNI ovr Evansville 26/24 set 3,2019-09-28 00:54:10,Twitter for iPhone,6,33
Evansville ovr UNI 32/30 set 2,2019-09-28 00:10:46,Twitter for iPhone,4,39
UNI ovr Evansville 25/17. Set one,2019-09-27 23:27:14,Twitter for iPhone,9,46
This wk I met w the city of Rock Valley on infrastructure &amp; ethanol https://t.co/zmLxrValg9,2019-09-27 19:52:52,Instagram,14,84
The Sheets Gingerich &amp; Ryan families from Deep River Muscatine + Boone https://t.co/osTWNUc6xq,2019-09-27 14:12:29,Instagram,5,40
The Bottley’s from West Des Moines w Jack &amp; Jill of America https://t.co/Frp8vhtxAF,2019-09-26 21:34:17,Instagram,5,26
Mtg w the Iowa State Education Association https://t.co/iPIFaomLXI,2019-09-26 18:55:31,Instagram,6,41
More than 12k signatures from AARP supporting lowering the price of prescription drugs &amp; thousands of personal stories shared at the Iowa State Fair. It’s clear that Iowans want action. The Grassley-Wyden Rx bill is… https://t.co/TYaK5g3hl5,2019-09-26 16:00:55,Instagram,49,191
Met w sheriffs from Iowa about immigration https://t.co/ED7Fcwu5e0,2019-09-26 14:10:30,Instagram,24,118
Brad Anderson &amp; Anthony Carroll w Iowa AARP talked to me about AARP’s support for the Grassley-Wyden prescription drug pricing bill. Iowa’s seniors want Congress to act &amp; help lower the cost of Rx drugs. https://t.co/hzXPyhyjP5,2019-09-25 23:12:48,Instagram,36,121
Glad to have 2 Iowa farmers at senate ag hearing today on livestock &amp; poultry. Trent Thiele pork producer from Elma + Ron Kardel turkey producer from Walcott. I asked them about trade &amp; foreign animal disease. https://t.co/DmQW0n9CHH,2019-09-25 19:20:43,Instagram,28,147
Despite House impeachment frenzy I held a pen &amp; pad discussion w approx 30 reporters on tax trade health care etc https://t.co/EhRdEeB4uj,2019-09-25 18:42:01,Instagram,58,334
Democrats+media are focused on impeachment but 2day Pres Trump agreed to a trade deal w Japan that will help Iowa farmers This is what Iowans talk to me abt at my #99countymeetings not impeachment New trade deal is gr8 news for USA,2019-09-25 17:03:34,Twitter for iPhone,704,2474
Always good to see State Rep Sandy Salmon &amp; Matt Salmon from Janesville https://t.co/fqog7wepKw,2019-09-25 13:23:33,Instagram,5,41
Ruth Ann Eccles &amp; Janice Gadberry from Cedar Rapids https://t.co/irMkt7HxGL,2019-09-25 12:52:01,Instagram,6,25
Talked w sheriffs from Hardin Wayne Marion Iowa Washington &amp; Muscatine counties in Senator Ernst’s  office https://t.co/0E3C8gSpiO,2019-09-25 12:50:47,Instagram,7,59
Met the Farrell family from Grinnell at Sen Ernst’s constituent coffee. They go to my church Prairie Lakes at our Grinnell campus https://t.co/vYodazxx6Q,2019-09-25 12:49:33,Instagram,2,39
2day Senate confirmed new Treasury Dep undersecretary for legislative affairs Nominee Brian McGuire is qualified &amp; ready. Senate also confirmed David Black as new DepCommissioner of Social Security Both excellent nominees previously approved by Sen Finance Cmte,2019-09-24 21:56:44,Twitter for iPhone,161,780
The Soppe &amp; Gorre families from Linn &amp; Warren counties https://t.co/A4vI2OWCK9,2019-09-24 21:11:53,Instagram,8,34
Q&amp;A w Sen Ernst &amp; the Iowa Association of Electric Cooperatives. Issues: RURAL Act retirement savings/RESA energy storage etc https://t.co/CURhayVBaE,2019-09-24 19:35:07,Instagram,4,46
Jennie Doke-Kerns from DMACC talked to me about second chance pell grants https://t.co/rmKkhaIOww,2019-09-23 21:49:40,Instagram,9,39
This statue of Pres Dwight Eisenhower stands in the rotunda of the US Capitol. #realhistorychannel His wife Mamie was born in Boone. In her honor you can drive down Eisenhower Avenue in Boone. https://t.co/YrkDNgc8A2,2019-09-23 13:18:22,Instagram,31,248
The Autism Cares Act unanimously passed the Senate 2day I was a cosponsor of this bill to help autism research at NIH + early identification/training for treatment Many Iowans talked to be abt their support for this bill,2019-09-20 01:05:55,Twitter for iPhone,90,449
Met w HHS Scty Azar + House GOP 2day on my bipartisan prescription drug bill Lowering drug prices is a top priority for Americans so it shld be for Congress too Senate Finance Cmte passed 19-9 my bill w Sen Wyden over summer,2019-09-19 21:14:50,Twitter for iPhone,73,333
The Frye + Clingerman families from Altoona + Solon https://t.co/jPvpKwnQJp,2019-09-19 20:24:13,Instagram,5,28
Iowans w the Association of Equipment Manufacturers https://t.co/ObwWr9KOLw,2019-09-19 20:04:03,Instagram,9,39
@realDonaldTrump 1wk ago U were gr8 in mtg about fixing EPA's waived gallons so both small refineries &amp;biofuels industry can win I appreciate v much ur commitment 2help us w small refinery waived gal so we get 15B gal as law requires Farmers looking fwd to good news,2019-09-19 14:50:25,Twitter for iPhone,49,200
Met w the American Wind Energy Association https://t.co/NONSXNssLs,2019-09-18 22:55:11,Instagram,12,63
As president pro tem I signed HR 1200 the Veterans Compensation Cost-of-Living Act of 2019. Now to Pres Trump for signature https://t.co/kv8TbtuOCc,2019-09-18 22:25:01,Instagram,44,164
Named “health champion” by the Natl Council for Behavior Health. Gr8 to see all the Iowans in attendance https://t.co/VbJRoppVmI,2019-09-18 14:50:34,Instagram,9,57
Iowans on the Eastern Iowa Honor Flight got to enjoy in the 75th Anniversary Commemoration of Operation Market Garden &amp; Battle of Angaur at the WWII Memorial today. WWII Vet James Washburn of Alburnett participated… https://t.co/vQrurT6FCG,2019-09-17 23:41:27,Instagram,22,119
Talked abt trade tax extenders &amp; “hardship” waivers w Iowans from the National Biodiesel Board https://t.co/hpmeicqFcW,2019-09-17 23:23:38,Instagram,7,57
Good mtg w Iowa’s Scty of State Paul Pate https://t.co/7R5h06ERDQ,2019-09-17 22:36:58,Instagram,9,47
Everett Cunningham Pres of GE Healthcare is from Waterloo. His dad was Dr Walt Cunningham a longtime well respected educator in Waterloo https://t.co/nc3Zuk6NhC,2019-09-17 18:31:58,Instagram,9,45
I’m fortunate to serve the ppl of Iowa alongside Senator Joni Ernst. She even brings me donuts on my bday https://t.co/HQc1Vfg4GU,2019-09-17 12:48:50,Instagram,85,678
The Petrie &amp; Jennings families from Altoona &amp; Des Moines https://t.co/t1yBuANF0e,2019-09-16 21:33:17,Instagram,6,37
Since I described pollination abt 2 months ago #cornwatch this is end product Filled out to the end of cob indicating enough moisture + a good harvest https://t.co/VAtFb9A9li,2019-09-16 10:55:50,Instagram,257,912
Star Spangled Banner at Jack Trice in Ames https://t.co/XdX3DCXL63,2019-09-14 20:25:57,Instagram,20,101
Talking ethanol/biodiesel at the Iowa vs Iowa State game w Undersecretary Northey https://t.co/UkybsQkvBH,2019-09-14 20:24:23,Instagram,23,115
See the little dents in the middle of the kernel? #cornwatch When all the kernels are dented it’s just a matter of time until the moisture dries out of the ear of corn We like to start harvest when moisture level is… https://t.co/YrRurkQw2J,2019-09-14 14:46:49,Instagram,1218,3456
When bean fields start to turn brown it’ll be about 3 wks until harvest #soybeanwatch A gradual process going from green to brown when all leaves drop off that’s usually when we start to harvest https://t.co/hFnGttk03L,2019-09-13 23:48:42,Instagram,80,350
Met ystrday w Pres Trump at White House w Sen Ernst Gov Reynolds + other Midwest senators Ethanol/biodiesel are hurting in Iowa EPA needs to follow the law of 15B gallons Farmers are counting on @realDonaldTrump,2019-09-13 23:07:58,Twitter for iPhone,107,479
My staff greeted veterans from Davenport on the Quad Cities Honor Flight on the National Mall https://t.co/MDpEDEW7yP,2019-09-13 19:17:27,Instagram,19,87
Encouraging 2see easing of tensions of trade talks w China w exemption of US pork &amp; soybeans from additional tariffs Heading in a promising direction for farmers Need productive talks + a strong trade deal w China. @realDonaldTrump strategy seems 2b having results,2019-09-13 16:50:21,Twitter for iPhone,118,408
Talked to Concerned Women for America abt the 150 federal judges appointed by Pres Trump &amp; confirmed by the Republican Senate including my work to confirm Justices Kavanaugh &amp; Gorsuch https://t.co/KFoXvcJcfs,2019-09-12 17:31:28,Instagram,48,186
Sgt Major Adams from the Iowa National Guard https://t.co/4fRnXnpzwl,2019-09-12 15:44:25,Instagram,9,49
Mtg w Iowa corn growers https://t.co/NFslka278P,2019-09-12 00:39:46,Instagram,15,73
2day the Senate confirmed the 150th federal judge under @realDonaldTrump These judges understand role of courts=rule based on letter of law &amp; constitution NOT be super-legislators Good 4 separation of powers,2019-09-12 00:12:23,Twitter for iPhone,480,2069
Co-chairs at the Angels in Adoption Host Committee Reception: ACLI CEO Susan Neely Congresswoman Shalala Congressman Aderholt &amp; former Sen. Landrieu https://t.co/HGqKUBSs8g,2019-09-11 23:28:28,Instagram,8,45
Met w 30 members of the Iowa Farm Bureau on USMCA &amp; ethanol waivers https://t.co/2W8Io9vNT6,2019-09-11 21:48:16,Instagram,12,61
Talked w Iowa Pork Producers abt trade gene editing technology foreign animal disease preparedness &amp; labor challenge https://t.co/scNPJNJbze,2019-09-11 19:33:15,Instagram,6,56
2day the Senate held a moment of silence in remembrance of Sept 11 2001 A day we will never forget We mourn the lives lost during that senseless terrorist attack I still remember being in USCapitol the policemen banging on my door saying u gotta get out of here &amp; get out fast,2019-09-11 17:03:26,Twitter for iPhone,59,341
Met w business leaders who employ thousands of Iowans about the need to pass USMCA https://t.co/SvHWfiGjRj,2019-09-11 15:59:30,Instagram,12,67
Thx to Iowans w Growth Energy for presenting me w the 2019 Fueling Growth Award for my support of biofuels https://t.co/mdXQGg6Q9z,2019-09-11 15:56:43,Instagram,5,58
Always good to see former Senator Max Baucus &amp; his wife Mel (originally from Des Moines) &amp; their friends the Haan’s (also from Des Moines) https://t.co/AlFauHvdcj,2019-09-11 14:58:17,Instagram,6,42
Met the Graft Sherer McQuillen &amp; Ulmer families from Cedar Rapids Woodbine Dubuque + Marion https://t.co/AJDFtEjp1e,2019-09-11 00:30:26,Instagram,13,50
Iowans w the American Cancer Society https://t.co/Nlki2KAX92,2019-09-10 22:05:23,Instagram,5,27
Congrats to Elizabeth Darling who was confirmed 2day to lead HHS dept implementation of the Family First program which will help kids stay w their families instead of entering foster care,2019-09-10 22:03:53,Twitter for iPhone,102,620
Brandon Ellis from Mediapolis https://t.co/wD8Y6SADHf,2019-09-10 19:55:52,Instagram,5,22
Members of my staff greeted Iowa veterans like Larry Best of Waterloo on the Cedar Valley Honor Flight at the WWII Memorial this morning. https://t.co/LYoUuU3ob6,2019-09-10 17:23:30,Instagram,13,118
Housed in the President’s Room off the Senate floor is this portrait of Thomas Jefferson as Scty of State #realhistorychannel Jefferson is displayed alongside portraits of George Washington &amp; Washington’s 1st… https://t.co/WwexAGyRJi,2019-09-10 11:52:24,Instagram,28,175
Kentucky over UNI 3/0,2019-09-08 02:45:29,Twitter for iPhone,6,49
Now back to volleyball. Waiting for UNI to play Kentucky.                       Congrats to Creighton.  This wkend 3/0 over every team at UNI tourney.  UNI. SoCal &amp; Kentucky,2019-09-08 00:32:16,Twitter for iPhone,19,122
Final. UNI wins 34/14.  So Utah,2019-09-07 23:59:08,Twitter for iPhone,5,45
Qtr 3 UNI 34 So Utah 7,2019-09-07 23:21:20,Twitter for iPhone,7,55
UNI 24/0 over SoUtah,2019-09-07 22:28:28,Twitter for iPhone,4,43
First qtr UNI 7 So Utah 0,2019-09-07 21:41:22,Twitter for iPhone,6,43
When u hv a reputation for liking donuts &amp; Iowans know it this is the result. thx to MercyOne We had a very in depth discussion of maintaining quality health care in rural Iowa. The donuts are not the best example of… https://t.co/p8Jzk8REKt,2019-09-07 16:40:00,Instagram,15,83
Creighton wins match 3/2 over UNI,2019-09-07 03:34:16,Twitter for iPhone,5,33
UNI over Creighton 25/18 set4,2019-09-07 03:12:22,Twitter for iPhone,5,33
Creighton over UNI 25/21 set 3,2019-09-07 02:45:00,Twitter for iPhone,3,22
Creighton over UNI 25/22 set2,2019-09-07 02:12:01,Twitter for iPhone,4,35
UNI ovr Creighton 25/19 first set,2019-09-07 01:33:59,Twitter for iPhone,3,19
UNI volleyball tourney Kentucky over SoCal 3/1.  Next match. UNI v Creighton i,2019-09-07 01:33:04,Twitter for iPhone,3,38
UNI volleyball tourney update.  A game I didn’t attend. Morning match Creighton 3/1 over Kentucky,2019-09-07 00:17:43,Twitter for iPhone,5,46
Rumors floating around town abt some ethanol announcement to counteract the disaster of EPA 31 small refinery waivers  If rumors true this wld be yet another disaster for ethanol and corn growers and wld be bad politically for Republicans / Big oil strikes again,2019-09-06 18:34:51,Twitter for iPhone,107,323
Watch me on KCCI’s Close Up program this Sunday at 1030am issues: ethanol prescription drug prices trade etc https://t.co/uYRYju4BQV,2019-09-05 13:21:21,Instagram,13,58
Q&amp;A in Des Moines w rural child welfare leaders from 18 states to talk about foster care &amp; the Family First Act implementation in rural areas https://t.co/aoazww78ln,2019-09-04 23:13:33,Instagram,10,50
It was my honor to present military medals to veterans &amp; their families at a ceremony in Urbandale. Their service &amp; sacrifice for our country should never be forgotten 🇺🇸 https://t.co/Zv65H1YAtu,2019-09-04 22:11:55,Instagram,34,203
35ppl for Q&amp;A on retirement policy including the SECURE Act in West Des Moines #99countymeetings https://t.co/CGC0Jzg2Uu,2019-09-04 21:13:54,Instagram,3,31
Sen Ernst &amp; I had a Q&amp;A w the Iowa Business Council in Des Moines Their companies employ 150k++ Iowans issues: workforce immigration physician shortage in rural areas USMCA/trade ethanol waivers etc,2019-09-04 17:23:50,Twitter for iPhone,24,123
Q&amp;A on rural health care at MercyOne in Des Moines 91ppl issues: access to care 340b surprise billing etc #99countymeetings https://t.co/7kgXmj9Un8,2019-09-04 15:50:58,Instagram,5,23
Q&amp;A at VGM Group in Waterloo 47ppl issues: mental health ESOP data breaches Medicare elder justice infrastructure etc #99countymeetings https://t.co/FXvlUneVgx,2019-09-03 21:02:59,Instagram,7,35
New Gallup poll says Big Pharma is the most disliked industry in America Even the fed govt ranks better The American ppl are demanding lower prescription drug prices Members of Congress would b wise to recognize this reality,2019-09-03 16:07:11,Twitter for iPhone,280,1176
Grassley farm 2019 #cornwatch @ New Hartford Iowa https://t.co/3gXHmhTcbe,2019-09-02 15:55:14,Instagram,18,85
Gov Reynolds did very good job on FOX Steve “Revolution”  just now Interview at first day st fair.  Now I know who the bald guy interviewing her as we observed her and Steve walking close to me. That’s the view fr the back,2019-09-02 01:44:31,Twitter for iPhone,72,516
Here w my gr8 grandson Chance State Rep Pat Grassley’s son. He loves helping his dad on the Grassley farm #soybeanwatch https://t.co/SAqTyCWplQ,2019-09-01 22:43:48,Instagram,61,518
#womenworthwatching  UNI volleyball: Creighton Friday SoCal and Kentucky on Saturday,2019-09-01 20:19:46,Twitter for iPhone,9,57
UNI losesto Iowa St 29/26 in :3overtimes That’s my first Tweet on UNI sports Stay in touch.  Next week  go to Utah St  and Uni.  And volleyball UNI creighton Uni/Ky.  Uni/SoCal,2019-08-31 20:22:06,Twitter for iPhone,9,104
UNI vs Iowa State football at Jack Trice Stadium https://t.co/3kJeti5ENT,2019-08-31 20:13:26,Instagram,4,45
Congressman Loebsack &amp; I welcomed NASA Administrator Bridenstine to U of Iowa to tour the thermal-vacuum chamber &amp; magnetometer process furnace. NASA &amp; the U of Iowa have a strong partnership advancing space… https://t.co/YWseaPGlHS,2019-08-30 18:37:03,Instagram,16,89
2day I learned more abt Dept of Physics&amp;astronomy/U of Iowa’s role in the NASA TRACERS mission This will b vital to Artemis lunar exploration program Iowa's bright minds continue 2 lead the way,2019-08-30 18:33:00,Twitter for iPhone,24,203
Congratulations to U of Iowa physicist Dr. Craig Kletzing &amp; his team for receiving $115M from NASA to study interactions btwn magnetic fields of the sun &amp; Earth. that’s the largest research award in U of Iowa +… https://t.co/IuBZICAVwO,2019-08-30 17:12:11,Instagram,33,200
Thx to Peter for the gr8 dinner at Catfish Charlie’s in Dubuque https://t.co/YxPIf76bOd,2019-08-30 01:54:11,Instagram,22,119
Family farmers who produce corn/soybeans work hard 2feed US&amp;produce ethanol/biodiesel Famfarmers always seem 2b fighting BIG OIL 2get what law requires 4 RFS Im sick of this constant battle considering big oils been helped since discovered in 1859 +gets plenty of help frm taxcode,2019-08-29 22:42:48,Twitter for iPhone,123,504
Tour/Q&amp;A at ASAC in Cedar Rapids w US Drug Czar Jim Carroll. In response to the Ernst-Grassley letter abt meth in Iowa Jim came to Iowa to learn firsthand. We had discussion on prevention/treatment/enforcement &amp;… https://t.co/6K5vlh16QD,2019-08-29 22:08:57,Instagram,11,39
instead of seeking apology Comey shld read IG report He shld b very embarrassed abt his wrongful actions (leaking) + bad example set for rest of FBI Its Comey who shld apologize to American ppl When we talk abt fbi being premier law enfrcmnt agency Comeys actions erase "premier",2019-08-29 21:47:27,Twitter for iPhone,6837,21300
My friend Johnny Isakson works hard for the ppl of Georgia Im sorry 2see him lv Senate at end of the yr He's a very productive member of the Sen Finance Cmte His common sense knowledge &amp; biz background is going 2b sorely missed in the US Senate,2019-08-28 21:34:35,Twitter for iPhone,103,682
Lunch mtg in Cedar Falls w USDA Undersecretary Bill Northey abt the need to pass USMCA &amp; other important issues affecting Iowa farmers https://t.co/HA58nSIJfd,2019-08-28 20:51:45,Instagram,12,78
39yrs of #99countymeetings + the snickers blizzard was a home run @ Dairy Queen https://t.co/tzkZzJKfcq,2019-08-27 23:30:08,Instagram,10,152
99th TM of 2019 in Spencer 71ppl issues: ethanol guns surprise billing behavior health immigration Grassley-Wyden Rx drug pricing reduction bill USMCA social security infrastructure election security natl debt Tax Cuts &amp; Jobs Act renewable energy tariffs etc #99CountyMeetings,2019-08-27 22:12:04,Twitter for iPhone,15,81
Annual Clay County town mtg in Spencer #99countymeetings https://t.co/ySLpyFEG1S,2019-08-27 22:08:00,Instagram,4,38
Tour/Q&amp;A 75ppl Polaris/Indian Motorcycle in Spirit Lake issues: trade workforce rural economy Greenland vocational training etc #99countymeetings https://t.co/jWTD6rWLzG,2019-08-27 20:30:33,Instagram,8,59
Q&amp;A w Sibley Rotary Club 18ppl issues: more civility in USA soybean markets future ready Iowa program veterans rural health care etc #99countymeetings https://t.co/zAbr6U7jbL,2019-08-27 18:18:06,Instagram,7,53
Tour/Q&amp;A Avera Merrill Pioneer Health in Rock Rapids 36ppl issues: critical access rural health care ethanol guns trade mental health etc #99countymeetings https://t.co/TLycOrALEr,2019-08-27 16:24:24,Instagram,4,31
Tour/Q&amp;A at Maintainer Corporation 38ppl in Sheldon issues: infrastructure trade ethanol waivers balanced budget amendment higher edu social security workforce global warming renewable energy etc #99countymeetings https://t.co/SJjN0jK7Uq,2019-08-27 14:27:57,Instagram,6,62
Thx to the US Chamber for presenting me w the Spirit of Enterprise Award in Sioux City for my work as a “champion of free enterprise” &amp; the jobs that free enterprise has created #99countymeetings https://t.co/bhLArRpn9Y,2019-08-27 14:18:47,Instagram,25,179
It’s not a surprise 4 u to hear 2nite I had DQ in Sioux City Can confirm my favorite snickers blizzard is back &amp; still tastes good,2019-08-27 01:38:44,Twitter for iPhone,437,4011
Q&amp;A at Guaranteed Roofing &amp; Siding in Sioux City 30ppl issues: infrastructure robocalls ethanol waivers trade Grassley-Wyden Rx drug pricing reduction bill etc #99countymeetings https://t.co/WVq9v5MhOx,2019-08-26 23:02:15,Instagram,11,59
