As we continue to deal with #Covid_19 it is important the United States has the ability to work with other nations to ensure we have quick access to necessary medicines and medical devices.  That is why I introduced the RESULT acts.,2020-03-16 20:39:59,Twitter Web App,5,24
@CongressmanHice  @RepGrothman  @KYComer  @RepCloudTX  @RepBobGibbs  @RepClayHiggins  @RepMarkGreen  @RepArmstrongND  @RepGregSteube,2020-03-16 19:55:09,Twitter Web App,11,43
On Friday I sent a letter to @OversightDems requesting a hearing to look into the “threat” of relying on China for medicines used in the United States. We need to get on top of this and we need to do it yesterday.   CC: @Jim_Jordan  @RepGosar  @virginiafoxx  @RepThomasMassie https://t.co/mUimLDMcf4,2020-03-16 19:55:08,Twitter Web App,1135,1208
We have to get serious about our reliance on China for medication.  Too many supply chains for our most critical medicines and medical devices are too dependent on China  I hope my friends and colleagues on @OversightDems will take up the call. https://t.co/MMWovNqszl,2020-03-16 19:44:08,TweetDeck,7,17
Happy to lead this effort with my colleagues --   "Republicans on the House Oversight Committee demanded that Democrats schedule a hearing to look into the “threat” of relying on China for medicines used in the United States."  https://t.co/oFYefzpq2X,2020-03-16 19:37:18,TweetDeck,19,50
Hey #TX21!   @GregAbbott_TX is hosting a press conference w/ @Ron_Nirenberg on #coronavirus. Tune in!   https://t.co/WuYbo8StsX,2020-03-16 19:18:40,TweetDeck,1,5
Hey #TX21! Our office has put together a list of resources and steps to take as we continue to deal with #coronavirus.   Please visit the link included in the tweet below for more information. https://t.co/2ShZlqr3kW,2020-03-16 18:29:52,Twitter Web App,5,9
3) Ensure relief for American citizens also getting hammered because they too will be laid off due directly to government calls for folks to sequester themselves.  https://t.co/LJD7Rzrh98,2020-03-16 18:25:05,Twitter Web App,3,10
Our goals in responding to #coronavirus should be simple.   1) Ensure we get on top of testing supply chain problems and our ability to respond to the virus nationwide.  2) Ensure ample liquidity and capital for businesses being hammered by both the virus and our response,2020-03-16 18:25:04,Twitter Web App,4,10
No more Wall Street corporate bailouts! Small business owners have reached out to me to ask what we can do to help stop this so they won’t be hurt.   What is Washington missing? It does no good to mandate “paid leave” from a job that doesn’t exist because the business went under. https://t.co/LDO9lqLeck,2020-03-16 18:25:04,Twitter Web App,14,39
Roy rightly points out that it's “corporate welfare cronyism” passed at the expense of small and mid-size businesses. Those businesses must now rely on tax credits to make up the difference even though the credits will not cover the entirety of costs...  https://t.co/U1ZAs9Emi0,2020-03-16 18:14:01,TweetDeck,14,31
3) Ensure relief for American citizens also getting hammered because they too will be laid off due directly to government calls for folks to sequester themselves.   https://t.co/LJD7Rzrh98,2020-03-16 17:05:32,Twitter Web App,6,12
Our goals in responding to #coronavirus should be simple.   1) Ensure we get on top of testing supply chain problems and our ability to respond to the virus nationwide.  2) Ensure ample liquidity and capital for businesses being hammered by both the virus and our response,2020-03-16 17:05:31,Twitter Web App,24,69
218-years-ago today Congress established the United States Military Academy at West Point.   https://t.co/XKQRr7xeT1,2020-03-16 16:43:23,TweetDeck,6,27
LATEST Op-Ed: Here Is How Congress Can Defeat #Coronavirus   https://t.co/4VnqEQ0Y20,2020-03-16 15:42:09,TweetDeck,18,23
the opportunity to vote.   I voted no because this bill will cause more harm for more Americans than the good it purports to offer,2020-03-14 05:00:09,Twitter for iPhone,74,300
We should adopt these 5 S’s -- Separate Sanitize Sleep Seek medical advice on phone due to spare resources and Serve seniors to protect them.   Our job in Congress when presented with legislation is to read debate amend and vote – yet we were only provided...,2020-03-14 05:00:09,Twitter for iPhone,50,216
we must take immediate action as Americans to care for one another at the community level.  It is our civic duty to take steps not to overwhelm the healthcare system to keep our economy humming and to take personal responsibility to limit the spread of the virus.,2020-03-14 05:00:09,Twitter for iPhone,48,179
The truth is no one really knows.   Now that we’re racing down this road we all know that today’s bill sets the stage for what’s coming next — more corporate bailouts.   In addition to the $8.3 billion Congress authorized last week focused on addressing the health emergency ...,2020-03-14 05:00:08,Twitter for iPhone,45,161
a national emergency declaration. Furthermore last week Congress passed an $8.3 billion relief package which I supported despite not having time to fully vet the bill (just like this measure). Now this bill will cost perhaps tens if not hundreds of billions of dollars more.,2020-03-14 05:00:08,Twitter for iPhone,44,169
vulnerable and those who need it such as seniors and those with weaker immune systems.     Finally Congressional leadership on both sides of the aisle admit they don’t know how much this bill will cost. Today the President unleashed upwards of $50 billion in funds through...,2020-03-14 05:00:08,Twitter for iPhone,44,172
thanks to the mix of national and state labs with private industry the administration has been working with recently. But the bill’s design risks unnecessarily overwhelming our healthcare system and infrastructure in a way that would block or limit access to care for our most...,2020-03-14 05:00:08,Twitter for iPhone,41,172
freeing up capital for small businesses so they can bridge the gap through coronavirus and support their employees and communities through these difficult times.   We all want to provide sick Americans quick access to the tests they need and we hope that many are coming online..,2020-03-14 05:00:07,Twitter for iPhone,48,193
Despite being well intentioned it puts onerous burdens and mandates on main street employers while picking winners and losers by carving out big business! These burdens will lead to job losses and undermine the very thing we need for growth right now –- ...,2020-03-14 05:00:07,Twitter for iPhone,56,222
to review — while the Chamber of Commerce issued statements of support.  As often happens K Street had the draft before most members of Congress.   Second we were given a take-it-or-leave it bill with zero chance to amend it or debate it. None.,2020-03-14 05:00:07,Twitter for iPhone,181,492
Tonight I voted against Nancy Pelosi’s #Coronavirus bill.    I could not support the bill for several reasons.   First the legislative process is corrupted.  As of 9:51 pm I was communicating with a group of U.S. Congressmen — none of whom knew which version of the legislation,2020-03-14 05:00:06,Twitter for iPhone,366,1225
We are about to vote on the Pelosi #coronavirus relief package. Negotiations have gone done to the wire and we still don’t know what is in it.   Here are some thoughts: https://t.co/sRnPnKl6gP,2020-03-13 22:15:24,Twitter for iPhone,110,214
Our office has put together a list of resources and steps to take as we continue to deal with #CoronaVirus #TX21.   We are sending this information in a newsletter but we've also made all the information publicly available on our website.   https://t.co/2b5WXZOEYB,2020-03-13 16:38:55,TweetDeck,4,3
That is why I wrote this letter 2 weeks ago inquiring how the administration plans to respond if coronavirus outbreaks in Central America and Mexico prompt many to flee to the U.S.-Mexico border.  2 weeks and no response.   https://t.co/RPUfHb6QV6 https://t.co/LPBWqj6O1N,2020-03-13 14:57:26,TweetDeck,5,23
Hey #TX21!   The @NASA application is still open and are accepting qualified applicants through March 31st!  #BeAnAstronaut   Check out this cool video: https://t.co/30ifoRvV6k,2020-03-11 21:53:19,TweetDeck,7,5
As a former federal prosecutor I’m all for going after bad guys but we must do consistent with the Constitution.   President Trump should veto the bill rather than perpetuating the deep state swamp he went to D.C. to drain.,2020-03-11 21:36:32,Twitter Web App,30,88
within the flawed FISA court and dresses it up as sufficient protection.   If you want to surveil an American citizen you must do so in accordance with constitutional protections protected by the Fourth Amendment.,2020-03-11 21:36:31,Twitter Web App,41,103
The bill continues to allow the warrantless surveillance of American citizens. Indeed it would have done precious little to stop the abuses in the Carter Page case.   Further it does not sufficiently require the sharing of exculpatory information and it layers bureaucracy...,2020-03-11 21:36:31,Twitter Web App,48,84
The fact is civil liberties of all American citizens should be protected. Having an election certificate shouldn’t make you special.   There are other problems too.,2020-03-11 21:36:31,Twitter Web App,25,85
Today the House passed an incredibly disappointing #FISA reauthorization that is the definition of the swamp in action.  How is that? The bill provides more scrutiny for politicians and candidates for office than it does for everyday Americans.,2020-03-11 21:36:30,Twitter Web App,201,350
We need answers. Full stop.   I've asked for them for a month.   #COVID19  #TX21 https://t.co/E7nRQ3FMAz,2020-03-11 17:06:36,Twitter Media Studio,18,78
This is not a partisan issue. We need answers.   #TX21 https://t.co/v1bfDIoNHN,2020-03-11 17:01:13,TweetDeck,5,17
While Congress debates more spending ... https://t.co/cYJOcq8JYN,2020-03-10 21:42:22,TweetDeck,29,69
Roy said that he has since been in touch with HHS but that the Pentagon has not responded — “and I’m pretty ticked about it.”   https://t.co/u0r3onbYDe,2020-03-10 17:18:13,TweetDeck,12,13
SrA (E4) Lindquist served in the US Air Force from  September 3 1971 to September 2 1975.   A service will be held for them on Wednesday March 11 2020 at 2:30 PM at Pavilion 4 at Ft. Sam Houston National Cemetery.   Don't let these veterans get buried alone!,2020-03-10 14:58:24,Twitter Web App,8,10
- Mr. Raul Esquivel was born May 7 1951 and passed on February 23 2020.  Specialist Esquivel  served in the US Army from February 19 1971 to February 16 1973.  - Ms. Janice Kay Lindquist was born September 26 1948 and passed on January 12 2020...,2020-03-10 14:58:24,Twitter Web App,7,7
Hey #TX21 please help us in honoring the life of the following veterans:  - Mr. Eric Brigham was born September 27 1959 and passed February 10 2020.  Private Brigham served in  the US Army from July 5 1978 to December 15 1980.,2020-03-10 14:58:23,Twitter Web App,23,43
Hey #TX21!  Are y'all ready for the 2020 Congressional Art Competition?  This year’s theme is “Community.”  The winning artwork will be displayed for one year in the U.S. Capitol!  https://t.co/yDEkSEMrab,2020-03-10 13:18:41,TweetDeck,2,2
Rep. Chip Roy (R-Tex.) sent a letter to Esper and Health and Human Services Secretary Alex Azar asking whether “the extra transportation and movement of sick patients put San Antonio and Bexar County residents further at risk?”  https://t.co/u0r3onbYDe,2020-03-10 13:13:13,TweetDeck,8,20
God bless @RepTomGraves. Our team is praying for John and your entire family. https://t.co/NetdnL0keE,2020-03-09 13:59:25,TweetDeck,5,30
Hey #TX21!   Are y'all ready for the 2020 Congressional Art Competition?  This year’s theme is “Community.”   The winning artwork will be displayed for one year in the U.S. Capitol!   https://t.co/jRyUBMAOnu,2020-03-09 12:54:53,TweetDeck,5,6
Maybe not ... but designating them "Foreign Terrorist Organizations" (FTOs) will.   #HR1700   https://t.co/9Gj4kHx0ew,2020-03-09 12:39:01,TweetDeck,7,10
Texas is the best state in the nation. You just can't argue against it y'all. Please don't tell the Californians. They are already coming in droves! https://t.co/ty9zPf73Cf,2020-03-06 17:57:01,Twitter Web App,13,42
Hey #TX21!  Please help us celebrate the life of Mr. Eric Bigham he was a Veteran of the United States Army.  A service will be held for him on Wednesday March 11 2020 at 2:30 PM at Pavilion 4 at Ft. Sam Houston National Cemetery!  Don't let this veteran get buried alone!,2020-03-06 15:22:43,TweetDeck,56,92
184-years-ago today the 13 day siege of the Alamo ended.   189 Texans died defending the Alamo Mission. They stood their ground no matter the cost.   As Texans always do we went on to win less than two months later.    #RememberTheAlamo  #TX21   https://t.co/t1pd5h5btG,2020-03-06 15:14:30,TweetDeck,13,31
"Employers added 273000 jobs...Wages increased 3.0% from a year earlier in February"  https://t.co/kwKenFMJay,2020-03-06 14:03:10,TweetDeck,4,11
"While the value of big insurance stocks skyrockets Americans are having a difficult time affording the “affordable” coverage ObamaCare promised let alone the care."  https://t.co/tGZU3FfKBT,2020-03-05 18:58:13,TweetDeck,15,18
We are three weeks away from the 10th anniversary of ObamaCare. Let’s wake up from its fever dream and get busy creating a system that works for you not big insurance companies. https://t.co/uOlYWCTaMe,2020-03-05 16:26:40,Twitter Web App,16,37
The leaders of those companies are resting easy now knowing that ObamaCare will continue propping up their bottom lines.   Latest op-ed:   https://t.co/6yWC8y0HdX,2020-03-05 16:15:00,Twitter Web App,17,23
What could be mistaken as tears from Bernie bros across the United States following former Vice President Joe Biden's #SuperTuesday victories is really the drops from the rocket fuel that propelled a banner day for big insurance and health care stocks on Wednesday.,2020-03-05 16:15:00,Twitter Web App,10,30
#WastefulWednesdays https://t.co/GMls1l9ipi,2020-03-04 22:32:44,Twitter for iPhone,17,31
Agreed @GOPLeader!   We should pass @realDonaldTrump's $2.5 billion supplemental as requested. We can address future needs as they arise.   @HouseDemocrats are trying to use Rahm Emanuel's playbook of never letting a "crisis" go to waste. We can't let them play politics. https://t.co/roTDgtVgT9,2020-03-04 16:34:35,Twitter Web App,60,120
What I don't want to see is the House or Senate pass a bloated spending bill because we are reacting rather than being responsible. @realDonaldTrump sent up a $2.5 billion #coronavirus supplemental that gets some of the money from existing dollars while we are $23.4 tril in debt https://t.co/oo27C5asDa,2020-03-04 14:57:05,Twitter Media Studio,13,40
I had the privilege of meeting with @ICEgov today. They tell me they still lack the resources to do their job effectively for both Americans and the migrants who seek to come here.   My @HouseDemocrats colleagues want to abolish ICE. HARD PASS!   I stand w/ law enforcement. https://t.co/xAtChq8drk,2020-03-03 22:49:58,Twitter for iPhone,77,270
Joining @TeamCavuto in 5! https://t.co/UkzKr63mTv,2020-03-03 21:38:05,Twitter for iPhone,4,15
Had a productive meeting with @ICEgov this afternoon. We need to stand behind the men and women of ICE 100 percent. Thank you for all you do to keep Americans and migrants safe. https://t.co/nWabueibIF,2020-03-03 21:13:52,Twitter for iPhone,36,93
“Let’s be clear that #SuperTuesday is a fight in Texas and around the country on which Democrat is going to be sent to pasture in November.”    Also how will #coronavirus impact the southern border? @Varneyco and I discussed earlier. https://t.co/Z1Ou77vv5R,2020-03-03 21:08:25,Twitter Media Studio,8,20
I wrote this over a year ago. The state of the border remains the same.   #StateOfOurBorder #EndBorderCrisisNow  https://t.co/tVMRsRLXwU,2020-03-03 17:53:38,TweetDeck,25,43
Prayers are with our friends in Nashville and in Tennessee today.   https://t.co/ZS4iDOVeKm,2020-03-03 17:42:12,TweetDeck,12,43
Gave an update on #COVID19 #Coronavirus on the @GuyBensonShow.   Start around 1:08 #TX21!   https://t.co/xWc7L0nWvc,2020-03-03 14:26:48,TweetDeck,9,12
Regarding #Coronavirus:   Texas officials and San Antonio officials need to be the ones to make the call about any releases of anyone into our communities in Texas. Period.,2020-03-02 20:28:49,TweetDeck,5,43
After nearly a decade of suffering under #Obamacare what is America's path forward?   Read my op-ed for one important step towards #HealthcareFreedom:  https://t.co/UOZQm1eAG8,2020-03-02 19:03:57,TweetDeck,22,36
More than a few friends and great Texans in this photo.  Love it! https://t.co/vvpzpMPqsF,2020-03-02 18:55:02,TweetDeck,7,26
Some of the great folks in this video stopped by our Washington D.C. office today so I figured it was about time to highlight this video again.   Some great work is getting done in #TX21 for our veterans local businesses and more! https://t.co/H6zYYkF9Pg,2020-03-02 18:27:10,Twitter Web App,4,11
Happy #TexasIndependenceDay!   184 years ago a free sovereign and independent republic was born. Together we keep the legacy of those brave men and women. #Texas strong! https://t.co/SiXS8YqE1l,2020-03-02 14:55:02,TweetDeck,8,32
https://t.co/Xnw5RjNDB1  #TX21,2020-03-02 14:13:27,TweetDeck,1,2
Glad to have led the House effort in requesting answers to these very important questions -- Texas Republicans raise alarms about coronavirus threat at the southern border https://t.co/r8gHXOWqqr via @TexasTribune,2020-03-02 13:29:31,Twitter Web Client,10,19
Join us for Service Academy Day #TX21!  Sunday March 8 2020 10:30 a.m. to 1:00 p.m. University of Texas at San Antonio Downtown Campus Buena Vista Building Theater https://t.co/VWwaDnoX4e,2020-02-29 12:00:00,TweetDeck,2,6
We are collecting information and organizing links to resources regarding the Coronavirus particularly for those in or near #TX21.  As new information comes in we will update the page as necessary.  https://t.co/rIVZ5QShzg,2020-02-28 23:39:40,Twitter for iPhone,4,21
Y’all should really follow @freedomcaucus on Twitter and Facebook! Also check out our podcast. I was on today’s episode with @CongressmanHice and @RepGregMurphy. https://t.co/u5J9sNUnDC,2020-02-28 22:46:37,Twitter for iPhone,14,36
It’s #RidiculousRegulations Friday https://t.co/VfTRWbToC4,2020-02-28 22:10:32,Twitter for iPhone,5,6
"A group of 11 lawmakers led by Rep. Chip Roy of Texas sent the secretaries of @HHSGov DOD and homeland security a letter Friday seeking information on what if anything they expect to see at the southern border and how they will respond."  https://t.co/RPUfHb6QV6,2020-02-28 19:44:45,TweetDeck,14,38
Why wouldn't Democrats want to protect babies? #ProLife https://t.co/qSPgoKXQla,2020-02-28 17:41:38,TweetDeck,122,317
As I often say the solutions to our problems can be found in our communities not in Washington.   Read my op-ed about this clinic in #TX21 turning the current broken healthcare model on its head:   https://t.co/UKY35I7koj,2020-02-28 17:33:24,TweetDeck,3,8
Want to know how we can move away from an overly regulated and pricey healthcare system? Read my latest op-ed:   https://t.co/UOZQm1eAG8,2020-02-28 01:05:46,Twitter for iPhone,10,23
Keep it up @Trinity_U! https://t.co/hBe7hPX2lO,2020-02-27 21:56:49,Twitter Web App,2,8
I sent a follow up letter to @SecAzar thanking his staff for the tour and briefing I received yesterday on the #coronavirus.  It is imperative that local officials and medical personnel be fully involved in the preparedness response as the disease continues to move.  #TX21 https://t.co/wRPohZV6ST,2020-02-27 19:29:09,TweetDeck,9,26
Bring it to em @SchreinerU!  #TX21   https://t.co/JNrl14tmBs,2020-02-27 15:51:49,TweetDeck,1,0
#WastefulWednesdays https://t.co/9xkhl5QSVx,2020-02-27 00:26:32,Twitter for iPhone,35,43
Pictured:   Dr. Brian McCall Chancellor of Texas State University System (TSUS)  Dr. Denise M. Trauth President of Texas State University-San Marcos  Dr. Dana Hoyt President of Sam Houston State University (SHSU)  Dr. Bill Kibler President of Sul Ross State University (SRSU),2020-02-27 00:12:40,Twitter for iPhone,0,10
Met with some fine #TX21 educators today.   Thank you for all you do for the young men and women studying in the great state of #Texas! https://t.co/IGfnhRLteI,2020-02-27 00:12:40,Twitter for iPhone,3,18
Happy #AshWednesday #TX21!   https://t.co/epkM9CC3FI,2020-02-26 22:22:22,TweetDeck,1,22
We love New Braunfels #TX21! https://t.co/Ms8hr6Rip2,2020-02-26 21:55:08,TweetDeck,1,8
My thoughts on Iran #TX21.   https://t.co/w1Oi4MlxEs,2020-02-26 21:26:07,TweetDeck,4,8
I know we already mentioned it but big thanks to @SecretaryCarson for meeting with the team today. https://t.co/AcBx2H0PTt,2020-02-26 19:23:35,TweetDeck,7,34
Big move from @realDonaldTrump!   The rule of law should be upheld!  https://t.co/n9sSOnXRSy,2020-02-26 17:18:42,TweetDeck,239,715
Had a great meeting with @SecretaryCarson this morning.   We discussed robust options to combat homelessness and put the homeless on a path towards independence.   Under Sec. Carson HUD is doing some amazing work. Happy to work together in the near future!   #TX21,2020-02-26 16:40:58,TweetDeck,34,104
Just got a briefing from @HHSGov about the response to #coronavirus.   My team and I have been in constant contact with the administration and state and local officials.   Here’s what we just heard: https://t.co/uie2dpRBE0,2020-02-26 16:02:39,Twitter for iPhone,29,68
Behind every “choice” is a life and a story.  Read about the story of two young men I know well -- Jonah and Manfred.   #ProLife   https://t.co/AG96WCYzmA,2020-02-25 18:32:02,TweetDeck,24,62
Thanks to @SteveScalise for the King Cake! We found the baby on the second try.   Happy #MardiGras to our good friend Steve Scalise and his team!   #TX21 https://t.co/HMqv1Pp8uC,2020-02-25 16:26:54,Twitter for iPhone,28,166
They don’t make em like this anywhere else. Yep it must be #TX21.   The view over the most gorgeous district in Texas last night.   #TEXAS https://t.co/68yQxua46B,2020-02-25 15:47:23,Twitter for iPhone,4,43
Join us for Service Academy Day #TX21!  Sunday March 8 2020 10:30 a.m. to 1:00 p.m. University of Texas at San Antonio Downtown Campus Buena Vista Building Theater https://t.co/jmVW3fbDjx,2020-02-25 15:38:42,TweetDeck,2,1
"Students from the region intensely competed to see whose robot could stack the highest tower of blocks on Saturday during the FIRST Tech Challenge Central Texas Regional Championship at Canyon High School."  #TX21   https://t.co/DQYd6P4top,2020-02-25 14:59:04,TweetDeck,2,5
Tune in at 2:30:00!  https://t.co/U5X7dEZ3gg https://t.co/82hAXXpNGS,2020-02-25 14:57:54,TweetDeck,1,3
Joined @JoeTalkShow yesterday evening!  I'm the last 10 minutes of the show!   https://t.co/U5X7dFgE7O,2020-02-25 14:55:20,TweetDeck,3,1
"It is a federal crime to distribute an app for preventing pregnancy without warning people that the app can’t prevent sexually transmitted infections."  #RidiculousRegulations   CC: @CrimeADay https://t.co/DVogKSMJfF,2020-02-24 21:49:52,Twitter Media Studio,1,4
Hey #TX21 we topped the list (again).   "Austin Texas topped the list for the second consecutive year according to a Wall Street Journal ranking of new data collected by Moody’s Analytics."   https://t.co/QHpqClND6w,2020-02-24 21:03:26,TweetDeck,7,11
The border is not secure and we must remain vigilant to secure operational control to protect our national security and the migrants who seek to come here.  https://t.co/Bec7Nsih4k,2020-02-24 19:34:16,Twitter Web App,31,45
5) Address loopholes in the Trafficking Victims Protection Reauthorization Act (TVPRA) so we can return folks safely home 6) Fully fund @ICEgov and @CBP   7) Target specific Mexican drug cartels as the terrorist organizations they are (https://t.co/Oni2c7YeXk)  #StateOfOurBorder,2020-02-24 19:34:15,Twitter Web App,42,73
How can we start reclaiming full operational control of our southern border?   1) #BuildTheWall 2) Support @realDonaldTrump's efforts to crack down on sanctuary cities 3) End #CatchAndRelease  4) Fix the broken Flores settlement,2020-02-24 19:34:15,Twitter Web App,237,623
Had a productive meeting with the head of @SanAntonioVAMC Director Christopher Sandles and his team this morning.   Under his leadership South Texas Veterans Healthcare System provides services for roughly 97000 unique veterans.   Thank y’all for all you do for #TX21 veterans! https://t.co/iJgeo4A05N,2020-02-24 18:42:51,Twitter for iPhone,2,9
I joined my friends at @SanAntonioVAMC this morning for the designation of South Texas Veterans Healthcare System as the 3rd #PurpleHeart Healthcare System in the United States! #TX21 https://t.co/iJVztFawBD,2020-02-24 18:31:15,Twitter for iPhone,1,12
Read up on my fix to one of the lesser-known but serious obstacles impeding Border Patrol and local law enforcement from having operational control of our southern border.   #BorderSecurity  #EndBorderCrisisNow  https://t.co/Bec7Nsih4k,2020-02-24 17:46:55,TweetDeck,7,11
Our website -- https://t.co/Jw87EFysII -- is temporarily down. Our staff is currently working to get it back up! Thanks for working with us #TX21!,2020-02-24 15:31:42,TweetDeck,2,4
Joined @DailyCaller to discuss why we don't want to make #Texas like #California.   #TX21   https://t.co/WOvWcOEyNK,2020-02-21 20:27:15,TweetDeck,25,66
My staff toured the Hye Rum and Garrison Brothers Distilleries today.   In 2008 there were only six permitted distilleries in Texas. Today there are over 160!   This explosion has supported over 3000 new jobs and generated $1.3 billion in total economic output.  Cheers #TX21! https://t.co/89HKHmZMxU,2020-02-19 23:10:52,Twitter for iPhone,8,28
