I've spent the morning on the phone with @Mike_Pence @stevenmnuchin1 Dr. Fauci Dr. Birx &amp; @SeemaCMS -- talking through testing treatments how to help hospitals rural providers &amp; how to help people who need it most right now.,2020-04-09 16:37:36,TweetDeck,19,146
Small businesses &amp; nonprofits are the backbone of this country. Since the #PaycheckProtectionProgram is quickly running out of money for small biz &amp; nonprofits we should provide additional funding--all Republicans have agreed but we are waiting on Senate Dems to sign off today,2020-04-09 15:39:40,TweetDeck,87,302
I'll join leaders of the faith community in the next 10 minutes to give a #COVID19 update &amp; discuss the CARES Act. We'll also discuss what it looks like to navigate the pandemic through a lens a faith. Interested in joining? Tune in at ▶️ https://t.co/07Zw0xvVF1. https://t.co/n94KdzvC8D,2020-04-08 18:30:00,Twitter Web App,7,29
Right now the wilderness may look like a tiny novel virus but it doesn't change God's goodness or His power. Pesach Sameach!,2020-04-08 15:31:00,Twitter Web App,11,128
Today Jewish people all over the world gather to celebrate one of the most sacred holidays in Judaism. Passover celebrations may look a lot different this year but it doesn't change the reason you celebrate or God's ability to guide us through the wilderness. https://t.co/7caNXkgkco,2020-04-08 15:30:00,Twitter Web App,6,44
Although I won’t join until later this afternoon viewers can hear from faith leaders most of the day at https://t.co/07Zw0xekNt. The livestream is free of charge. Anyone with interest is welcome.,2020-04-08 13:35:19,Twitter for iPhone,3,6
I’ll join faith community leaders in a discussion about the CARES Act COVID-19 and what it looks like to navigate the pandemic with a perspective of faith this afternoon around 1:40 CST. https://t.co/EJJk3yX1xK,2020-04-08 13:35:18,Twitter for iPhone,14,42
I hope you’ll join me at 1:40pm CST as I speak with leaders in the faith community about the CARES Act. https://t.co/idtfmKjW4q,2020-04-08 02:09:08,Twitter for iPhone,8,15
As our nation continues to respond to the #COVID19 outbreak we are all appreciative of the sacrifices you make every single day to take care of your neighbors while leading us through this difficult time. You are hometown heroes. Thank you for everything you do.,2020-04-07 17:57:53,TweetDeck,6,25
On #WorldHealthDay2020 I am grateful for every health care professional serving on the frontlines. From doctors to nurses to lab techs CNAs and everything in between thank you. We quite literally could not make it without you &amp; your willingness to serve your neighbors.,2020-04-07 17:49:03,TweetDeck,14,92
Fantastic keep up the hard work. Remember the Census plays a vital role in determining how many seats each state gets in the House &amp; help local &amp; federal governments plan for public service needs. Want to be a good neighbor? Fill out your Census today at https://t.co/Y9qIWgtb1b. https://t.co/AihMhPSzrP,2020-04-06 14:51:24,Twitter Web App,5,18
Thank you @realDonaldTrump @stevenmnuchin1 &amp; @SBAJovita for working to make sure that faith based orgs &amp; churches are eligible for new #PaycheckProtectionProgram #COVID2019,2020-04-04 14:53:33,Twitter for iPhone,31,162
Not sure what the #PaycheckProtectionProgram can be used for? The program forgives loans used to cover the cost of rent and payroll expenses. For more info review our FAQ’s here ➡️ https://t.co/lmQOQn61iF https://t.co/JxTR1AXKLa,2020-04-03 20:16:17,Twitter for iPhone,12,19
I believe in #SecondChances because as a Christian I understand the power of forgiveness &amp; redemption. We've been undeservingly forgiven with infinite amounts of chances we should also extend forgiveness to others. Human dignity is inherent in all people no matter their past. https://t.co/bmrAyOjTA7,2020-04-03 17:47:22,Twitter for iPhone,17,64
My office has resources to answer the most frequently asked questions related to the program. If we can clarify or answer any of your pressing concerns please don’t hesitate to reach out. Questions about the Program? See frequently asked questions here ▶️ https://t.co/lmQOQn61iF,2020-04-03 15:06:00,Twitter Web App,3,5
$349 billion from the CARES Act became available TODAY for the #PaycheckProtectionProgram. This program is designed specifically to help small businesses keep their workforce employed amid the impact of #COVID19. https://t.co/tRGDFhouRx,2020-04-03 15:03:39,Twitter Web App,16,40
Glad to see our state expand it's testing capabilities to those who come in direct contact with and those showing symptoms of #COVID19. This is excellent news. https://t.co/Gu5a8TjrG8,2020-04-02 13:20:53,TweetDeck,18,67
Congrats to a great Oklahoman Dr. Droegemeier! You are incredibly qualified to serve in this role &amp; our nation is grateful for your service. https://t.co/QR8YTsfRYe,2020-04-01 20:43:58,TweetDeck,7,33
Saudi Arabia’s moves to flood the crude market with excess supply is hurting American oil producers and costing jobs. If MBS values the US as a global partner moving forward he must stop following Russia’s lead in manipulating the market.   https://t.co/NFfyR0sA4k,2020-04-01 17:00:26,TweetDeck,21,62
@KOCOMaggie @HornForCongress @GovStitt @DeptVetAffairs My staff is reaching out to you for more details.,2020-04-01 15:44:30,Twitter for iPhone,3,13
I hosted another telephone town hall this afternoon to answer questions about #COVID19. I’m always impressed with the concern Oklahomans have for the well-beings of our neighbors. Keep raising the #OklahomaStandard.  Oh &amp; sorry my socks aren't as cool as @SenatorTimScott ‘s! https://t.co/hP3FT5FfhS,2020-03-31 21:53:52,Twitter for iPhone,18,135
His greatest joy was his wife Carolyn and his daughters Callie Katie and Sarah and their families. Cindy and I pray for the Coburn family as they walk through this incredibly hard journey. They have lost a husband father and grandfather; we have lost a friend and a leader. https://t.co/7C6L7xOXu8,2020-03-28 14:56:09,TweetDeck,51,245
Dr. Coburn will be remembered by many around the country for his work in Congress but in Oklahoma he will be remembered as a physician a Sunday School teacher and a mentor. He delivered over 4000 babies and cared for thousands of moms in Muskogee. https://t.co/IctbOGAAd4,2020-03-28 14:55:38,TweetDeck,41,170
Oklahoma has lost a tremendous leader and I lost a great friend today. Dr. Coburn was an inspiration to many in our state and our nation. He was unwavering in his conservative values but he had deep &amp; meaningful friendships with people from all political &amp; personal backgrounds.,2020-03-28 14:52:36,TweetDeck,91,563
One hour until “Let Hope Rise: Together in Prayer for Oklahoma”. I hope you’ll join online at https://t.co/AI3eiXKR7j News 9 in Oklahoma City or News on 6 in Tulsa. Let’s come together as we pray for our state and the families impacted by COVID-19. https://t.co/PfJpndTQOv,2020-03-26 22:43:44,Twitter for iPhone,6,42
Glad to do it. There are a lot of questions out there on the phase 3 emergency relief bill we passed yesterday. If you have a question you can visit https://t.co/CHunQgYQyf or contact my office at 405-231-4941. https://t.co/4ahs3X7XDm,2020-03-26 18:46:23,Twitter for iPhone,9,26
At 6:30 pm tonight @transformtulsa  will host “Let Hope Rise: Together In Prayer for Oklahoma” a special prayer and worship event. Join online at https://t.co/AI3eiXKR7j News 9 in Oklahoma City or News on 6 in Tulsa.,2020-03-26 18:03:56,Twitter for iPhone,6,21
In times of such uncertainty I hope you’ll join me and thousands of Oklahomans today for a state-wide day of prayer. https://t.co/kTB6cdV3Ju,2020-03-26 18:03:56,Twitter for iPhone,15,99
Our nation &amp; our state are resilient. We know what it means to work together to get through difficult times.,2020-03-26 03:48:30,Twitter Web App,5,44
Every American is called to stop this pandemic by taking action to slow the spread. This comes at a great consequence to many American workers &amp; small businesses. Today's vote was targeted at the heart of our #OK economy-small businesses the employees &amp; the families they serve,2020-03-26 03:48:30,Twitter Web App,6,42
This evening I supported emergency relief that meets the needs of Oklahomans and their families. Every aspect of our communities is being affected by #COVID19 &amp; it's critical that Congress provide much-needed support &amp; assistance in this unprecedented time of need.,2020-03-26 03:48:30,Twitter Web App,13,105
The Senate will be voting shortly on the emergency relief bill to address COVID19. You can read the entire bill here: https://t.co/Mfw4Yljrlw,2020-03-26 02:41:00,Twitter Web App,12,59
Now more than ever nonprofits including houses of worship are supporting families and communities across the country. @SenChrisCoons and I worked to include a universal charitable deduction in the COVID-19 response package to help nonprofits keep their operations going. https://t.co/EUNm8GwPKt,2020-03-25 22:41:50,Twitter for iPhone,34,168
Cindy and I continue to lift his wife family and the entire 138th up in prayer as they walk through this difficult time. Thank you TSgt. Roberts for answering the call to serve your country. #TSgtMarshallRoberts,2020-03-25 15:56:06,Twitter for iPhone,10,37
Today our friend and neighbor TSgt. Marshal Roberts returns home to Oklahoma for the final time. It is a reminder to our Oklahoma community of the service and sacrifice made by many of our neighbors. https://t.co/GCY70uWN7Q,2020-03-25 15:56:06,Twitter for iPhone,16,90
.@Braums_Inc is a household name in Oklahoma for its great food ice cream milk and groceries. Today we grieve with the entire family as they remember William Braum. We are grateful for his leadership and the difference he made in our state.,2020-03-24 21:42:42,Twitter Web App,35,209
These are people’s livelihoods we’re talking about. Time is important let’s stop pretending it’s not. Let’s vote.,2020-03-24 20:12:57,Twitter for iPhone,10,57
Small businesses are waiting for us to pass this relief bill so they can access payroll loans to keep people employed at their full salary. Instead my colleagues on the other side are still making ‘wish lists’ while businesses are at point where they have to lay folks off. https://t.co/j5EAMDf2NT,2020-03-24 20:12:56,Twitter for iPhone,33,124
Senate Democrats and Speaker Pelosi continue to play games while the American people wait for Congress to act. We need to stop renegotiating everything we’ve already negotiated and vote so we can help the families and businesses that are hurting. https://t.co/HWTbdJ1Lzk,2020-03-24 17:36:12,Twitter for iPhone,58,251
It's time to stop renegotiating everything we've already negotiated and stop adding one more thing. Let's make the one more thing a vote so we can help the families and businesses that are hurting. #PassTheBill https://t.co/UvyG1hfzRx,2020-03-24 14:01:21,Twitter Web App,24,100
You are either helping right now or hurting. Pelosi's handpicked partisan ploys are helping no one. She's hurting American families by prioritizing airplane emissions same day voter registration &amp; wind energy tax credits over #coronavirus relief. #StopTheGamesNancy #PasstheBill,2020-03-24 14:00:00,Twitter Web App,211,650
I have people at home who are suffering while folks here are playing politics and discussing if we need more solar grants. Can we just deal with COVID19?! Let's help business and families that are struggling!   https://t.co/qYNr2XfRih,2020-03-23 19:39:25,Twitter Web App,113,313
I keep hearing from my Democrat colleagues that this COVID relief bill is not enough. It's $2 trillion!!,2020-03-23 18:27:05,Twitter Web App,246,1005
It is unbelievable that Democrats would stall the relief bill. Senate Democrats have written many sections of the economic relief bill already - Now they are holding hostage critical support to combat the COVID19 pandemic for more demands. We need to get aid moving quickly.,2020-03-22 22:45:43,Twitter Web App,3973,7164
This is great news for Oklahoma small businesses! If you are a small business owner and need assistance you can visit https://t.co/MQXe7rCvSz for resources. Questions? Contact my office or visit https://t.co/CHunQgYQyf https://t.co/UDqtJtBne6,2020-03-21 14:44:32,Twitter Web App,13,49
If you're in OK &amp; have questions you can call the @HealthyOklahoma at 877-215-8336 or 2-1-1 for trusted information. https://t.co/TjBPMkkbcZ,2020-03-20 23:33:21,Twitter Web App,13,41
Remember the best places to stay up to date with the latest #COVID19 developments: @WhiteHouse @CDCgov @healthyoklahoma @govstitt and the current issues page on my website at https://t.co/OZ9bf4OyvA.,2020-03-20 17:47:16,Twitter Web App,1019,4174
Cybersecurity researchers report findings of over 4000 coronavirus-related domains &amp; websites that are malicious or suspicious. The attacks come in the form of emails or info to provide tips on #COVID19 prevention. Be aware &amp; mindful of sites you’re navigating &amp; downloading from https://t.co/2IYa1iYwdQ,2020-03-20 17:47:15,Twitter Web App,29,51
Now is the time to provide vital access to hospitals in rural communities. @SenatorDurbin &amp; I offered our bipartisan solution to phase 3 bill to give flexibility to states which will allow rural hospitals a critical lifeline to serve their patients.,2020-03-19 20:44:05,Twitter Web App,19,118
If you or someone you know in Payne County can use assistance please use these resources. We are all here to help as we walk through this together. Thank you @unitedwaypayne for always being willing to answer the call  to help your neighbors. https://t.co/O7zQCqBFL1,2020-03-19 19:22:20,Twitter Web App,8,12
Looking for ways to support to local businesses while you quarantine? Pick up or call in delivery for lunch from your favorite local restaurant. https://t.co/NvrC0QKnKP,2020-03-19 17:59:22,Twitter Web App,9,31
A great reminder that we should still be making healthy choices. Physical mental and spiritual health still matters. https://t.co/3PbMPrJKFZ,2020-03-19 15:34:41,TweetDeck,7,21
ICYMI: 2020 Census field operations have been suspended until April 1. Looking for things to do in your free time?  Complete your 2020 Census form here: https://t.co/Y9qIWgtb1b https://t.co/UpPF0mOs6N,2020-03-18 23:05:14,Twitter for iPhone,9,11
I commend @realDonaldTrump on nominating @RussVought45 to serve as Director of the Office of Management and Budget. Russ has years of experience that will equip him to serve the nation well in this role. I hope the Senate will work swiftly to confirm his nomination.,2020-03-18 22:14:07,Twitter Web App,12,40
We have an opportunity to fix this issue in a third bill that the Senate is currently working on and the American people are counting on us to get it right,2020-03-18 22:09:32,Twitter Web App,8,54
I voted against the second COVID-19 funding bill. Three weeks ago supported the $8.3 billion health care bill but this bill has a new government mandate on small businesses which was intended to help but I fear it will make a bad situation worse for many Oklahoma businesses.,2020-03-18 22:09:31,Twitter Web App,29,112
"If you're not having shortness of breath if you're relatively stable we keep patients at home ... about the only reason we would bring patients in for acute care is if they're having trouble breathing or having trouble keeping fluids down" said Bratzler.,2020-03-18 19:42:36,Twitter Web App,6,10
On social distancing:   "Take the social distancing seriously"Bratzler said. "I think if we do it early if we really get serious about social distancing now we can reduce the length of this outbreak and get back to normal life down the road.",2020-03-18 19:42:35,Twitter Web App,2,4
On testing shortages:   Lankford said he expects testing to be much more available in the coming week and said Congress is trying to figure out how best to address what seems to be a looming financial crisis.,2020-03-18 19:42:35,Twitter Web App,1,0
That's important because of the wide variation in reactions to the virus Lankford and Bratzler said. While most of those infected develop only mild symptoms some number will die.,2020-03-18 19:42:35,Twitter Web App,1,0
"The third important point ... is that for every known person there are probably between five and 10 people who are infected but don't know they're infected.",2020-03-18 19:42:35,Twitter Web App,1,1
"Second it's very infectious. It spreads quite rapidly from person to person. A person infected by this virus may have symptoms before the first person even knows they're infected.,2020-03-18 19:42:34,Twitter Web App,1,0
"No. 1 this is a novel virus" Bratzler said. "There is no immunity from this virus. If we're exposed to it we will be infected.,2020-03-18 19:42:34,Twitter Web App,1,0
Why has this become such a big deal in the US when the total number of cases looks relatively low?",2020-03-18 19:42:34,Twitter Web App,2,0
I had the opportunity this morning to answer some of your questions about coronavirus and the issues we're facing in our response in Oklahoma.  Here's a thread of some our most pressing concerns: https://t.co/TsFgKrX0TK,2020-03-18 19:42:33,Twitter Web App,5,13
Lots of questions from Oklahomans on testing. Here's a message from Dr. Birx w/ the White House #coronavirus Task Force https://t.co/wqIU70mazq,2020-03-18 18:50:27,Twitter Web App,12,34
For resources and updates on the #Coronavirus please check my website: https://t.co/X6EzuQE9Qk,2020-03-18 17:47:11,Twitter Web App,25,63
FYI: Beginning today Social Security offices will only offer services online and via telephone. https://t.co/87RxQp9EBq,2020-03-17 15:55:43,Twitter Web App,14,25
ICYMI: OK Small businesses affected by #coronavirus can now fill out the online form to apply for low-interest federal disaster loans through @SBAgov at https://t.co/dRsc9JuMWa. For more information and resources visit https://t.co/MQXe7rCvSz https://t.co/zAtWMnY7Gy,2020-03-16 18:55:07,Twitter Web App,13,25
Pray for those who are ill pray for the doctors nurses and everyone working tirelessly to stop the spread. God bless!,2020-03-15 15:26:15,Twitter for iPhone,9,60
As federal state &amp; local govs health professionals communities &amp; families come together to combat the spread of #Coronavirus I’m thankful we live in a nation where we can live out our faith. Where we can pause &amp; pray together in a time of need. https://t.co/0rRR32dmJI,2020-03-15 15:26:14,Twitter for iPhone,34,173
As cities and communities make the decision to close public offices &amp; rescind special event permits private entities are able to make their own decisions this includes houses of worship. https://t.co/pQ0nO4SZCF,2020-03-14 22:17:13,Twitter Web App,16,61
My office received word today that USDA has approved OK State Department of Ed request to continue meal services even during school closures. https://t.co/VOigTe3fjY,2020-03-14 21:27:26,Twitter for iPhone,63,296
@Realdonaldtrump continues to push in the fight against Iran &amp; could not be more clear—if you attack American soldiers there will be consequences. https://t.co/uV780oroFM,2020-03-13 16:55:54,Twitter Web App,3,20
@JenniferJJacobs @business I did not say this. I did talk about what happens to oil prices when Russia &amp; Saudi Arabia get in a price war &amp; how they drag down the entire global economy. We need to take steps to put pressure on these nations to stop taking advantage of a crisis. https://t.co/URxiFEtA8S,2020-03-13 14:00:22,Twitter Web App,0,1
We also pray for the members who were injured in the attack including another member of the 138th. We pray for their full recovery.,2020-03-13 13:46:19,Twitter Web App,4,29
Cindy &amp; I pray for the family of Oklahoma airman Staff Sergeant Marshal Roberts in Iraq. As they walk through this incredibly hard time we will all walk with them.,2020-03-13 13:46:19,Twitter Web App,4,41
Wednesday’s news is a painful reminder that our sons and daughters husbands and wives friends and neighbors are still fighting every day to protect us across the world. To lose a member of our military is never easy; to lose a neighbor is even harder. https://t.co/RmUbs6TdyT,2020-03-13 13:46:18,Twitter Web App,23,85
We can still serve our neighbors this weekend by taking common-sense pre-cautionary actions and practicing good hygiene as simple measures to avoid spreading the virus. We look forward to keeping you informed regarding the rescheduled date once a decision has been made.,2020-03-12 21:17:41,Twitter Web App,2,7
I’m grateful for the event’s organizers to take the health concerns of Oklahomans very seriously. Using the recommendations of health care professionals at the moment  their decision to reschedule Embrace Hope is in the best interest of our community and our state.,2020-03-12 21:17:40,Twitter Web App,1,9
Embrace Hope is rooted in the spirit of neighbors helping neighbors &amp; the strengthening of our communities. Part of being a good neighbor means removing unnecessary risks to  vulnerable members of our community.,2020-03-12 21:17:40,Twitter Web App,1,7
Out of an abundance of caution &amp;  in the interests of the safety and well-being of members of our community leaders and organizers have made the decision to reschedule the Embrace Hope event in Lawton originally scheduled for this weekend.,2020-03-12 21:17:40,Twitter Web App,9,43
@GrantHermesKWTV @JimInhofe Is the goal of your tweet to create a false impression to the public that @JimInhofe and I do not take the virus serious? A DC reporter asked if I still shake people’s hands and I said yes - but your message seems to imply something bigger-why not say what we actually said?,2020-03-12 02:06:00,Twitter for iPhone,7,82
@WHO identified #coronavirus as pandemic across the world. This is not meant to cause fear or panic but remind us to continue to make factual &amp; rational decisions to prevent the spread  as the admin continues to learn more. Here’s how you can keep your community &amp; family healthy https://t.co/xp2GMqC6as,2020-03-11 21:51:36,Twitter Web App,5,3
This is a path for individuals and families who wait for their immigration hearing to remain in Mexico instead of being released in the US. Even with this policy in place Congress still needs to act.,2020-03-11 21:43:01,Twitter Web App,12,29
Because Congress refused to fix the loopholes in our immigration laws @RealDonaldTrump and his administration took action to curb the flow of migrants at the border. https://t.co/UavAGecHFV,2020-03-11 21:43:01,Twitter Web App,18,61
We are eternally grateful for the service and sacrifices of our military men and women who work throughout the world to keep us safe. Cindy &amp; I are praying for the families of these brave warriors as they walk through this incredibly difficult time of grief. https://t.co/8CvfWQ0Vlo,2020-03-11 21:15:48,Twitter Web App,13,60
No one is shocked that Putin is changing Russia’s constitution to keep him in power through 2036. This only benefits Putin and his continued dictatorship over the people of Russia and provides leverage for his destabilizing activities around the world. https://t.co/7GeVdrpyqT,2020-03-10 22:10:00,Twitter Web App,13,44
I can’t begin to explain how important it is to stop the use of contraband cellphones in state prisons. We’ve been discussing this issue for almost a decade. We need to actually get to a resolution.,2020-03-10 20:01:35,Twitter Web App,6,32
Today I pressed @AjitPaiFCC on what they need from Congress to combat contraband cellphones in state prisons. Contraband cellphones are used to conduct criminal activity from inside our prisons putting lives at risk. https://t.co/m0kSVASxq3,2020-03-10 20:01:35,Twitter Web App,10,57
Just met with @POTUS Trump and @VP Pence on #Covid19 and US response-very fast response to the virus-well done! We now need fast action on Russia taking advantage of the virus-flooding the world with oil to hurt American energy companies-we will NOT give up energy independence,2020-03-10 18:31:36,Twitter for iPhone,51,312
Join me in congratulating @COHFH for reaching a milestone in their mission in OK. We're thankful for your leadership &amp; the hard work of all the volunteers over the years who make a difference in the lives of others. Thank you for your commitment to loving &amp; helping our neighbors. https://t.co/q9BhNhu1Fe,2020-03-10 14:39:27,Twitter Web App,4,28
https://t.co/0x8v0zZlmq,2020-03-09 15:58:24,Twitter for iPhone,5,17
The Sunshine Protection Act makes DST permanent meaning longer days year round. Some of the impacts include reduction in energy use car accidents crime &amp; more economic growth. I hope my colleagues will join me in our efforts to pass this bill for #PermanentDST. #LocktheClock,2020-03-07 17:44:41,Twitter for iPhone,21,125
These studies are a few of the reasons I’m working with @marcorubio to pass the Sunshine Protection Act. #LocktheClock,2020-03-07 17:44:41,Twitter for iPhone,8,75
Don’t forget to spring forward tonight. Four months out of the year Americans operate on standard time resulting in shorter days &amp; longer nights. Studies show an array of benefits when we operate under DST.,2020-03-07 17:44:41,Twitter for iPhone,14,106
Every Oklahoman should take preventative steps: wash hands thoroughly cover cough &amp; stay home when sick.  @HealthyOklahoma now has rapid testing kits. This is a huge step to detecting the virus sooner.,2020-03-07 00:47:39,Twitter for iPhone,9,29
@GovStitt announced the first confirmed case of #coronavirus in OK. We will work together to ensure #OK health care officials have resources needed to prevent the spread of the virus.,2020-03-07 00:47:39,Twitter for iPhone,10,30
We all can take steps to prevent the spread of the virus while medical teams across the country continue to conduct their research. #Coronvirus,2020-03-05 22:25:40,Twitter Web App,3,14
