As we take time to count our blessings I want to take a moment to thank our veterans &amp; military families. We thank you for your sacrifice and the way you serve and protect our country. We’re grateful for your selflessness today and everyday. https://t.co/mt4l0LAWSc,2020-11-27 17:22:55,Twitter for iPhone,9,59
From my family to yours happy Thanksgiving day. This Thanksgiving may look a little different than others but we still have a lot to be grateful for. https://t.co/yUkhM5be8Q,2020-11-26 15:05:36,Twitter for iPhone,7,142
Want to know my take on current events and issues that matter to you without the Washington theatrics? Sign up today to stay up to date on my work in Washington DC: https://t.co/sbXFS9E54S,2020-11-25 00:04:31,Twitter Web App,8,20
Last week I cosponsored a resolution recognizing November as #NativeAmericanHeritageMonth. We celebrate the contributions of indigenous people in OK &amp; across the nation as they're evident in our heritage &amp; culture. I am honored to serve OK’s Tribal citizens.,2020-11-24 15:15:00,Twitter Web App,9,52
On #PublicHealthThankYouDay I want to thank &amp; applaud our Oklahoma public health professionals. This season has been unique but you've served your neighbors to the best of your ability no matter the circumstance. Thank you for the way you serve. We couldn't do this without you.,2020-11-24 00:00:00,Twitter Web App,6,68
Cindy &amp; I delivered breakfast &amp; prayed with some of the frontline workers at Integris Health Edmond Hospital this morning. Healthcare workers have been the unsung heroes of 2020. Thanks for all you do. https://t.co/d0qh9hBj5N,2020-11-20 20:17:15,Twitter for iPhone,23,314
@Reid_Spencer @JoeBiden I never made a pledge. We should allow both candidates to receive the same pre-election intelligence briefings while the process of confirming election results works its way through the process.,2020-11-20 18:38:58,Twitter Web App,1,31
This week I joined @SenRubioPress to support the #HongKong Safe Harbor Act. It is right for the US to stand up for individuals in Hong Kong who are persecuted by #CommunistChina.,2020-11-20 17:16:56,Twitter Web App,847,1151
Happy #BedlamWeek! Who will you be rooting for during tomorrow night’s showdown? #GoPokes #BoomerSooner,2020-11-20 15:19:51,Twitter for iPhone,4,16
I was honored to be recognized today as the American Senior Housing Association’s first Senior Living Congressional Hero. Thank you for your advocacy ASHA &amp; for the way your members care for our nation’s elderly &amp; most vulnerable especially in such a challenging time. https://t.co/9fivnssHXb,2020-11-19 21:33:05,Twitter for iPhone,8,103
#NationalAdoptionMonth is also a time to recognize and appreciate the mothers and fathers who chose adoption when faced with an unexpected pregnancy. Our nation communities and families are better because of your bravery.,2020-11-18 19:16:04,Twitter Web App,2,12
Last year American families welcomed home 69000 children through international &amp; domestic adoption. #NationalAdoptionMonth is a time to thank parents who have grown their families through adoption &amp; to remember there are still many children in need of permanent loving homes. https://t.co/cxLgi83kmr,2020-11-18 19:16:03,Twitter Web App,10,45
I’ve got a solution to take shutdowns off the table permanently. https://t.co/8r8KPiyq1v https://t.co/tJAwXBOfsy,2020-11-18 18:43:02,Twitter Web App,5,28
Update: going live at 6:33 ET/5:33 CT. Tune in https://t.co/HCAS9uzZDv,2020-11-17 23:28:55,Twitter for iPhone,2,11
Next up:📽️ LIVE on @EveningEdit on @FoxBusiness at 6:40 ET/ 5:40 CT.   Stream live at https://t.co/J8orDVWGgX,2020-11-17 23:20:00,Twitter Web App,1,3
🚨Joining @newsmax LIVE with @seanspicer at 6 ET/5 CT. WATCH here📽️: https://t.co/p76MwDfTwW,2020-11-17 22:45:00,Twitter Web App,2,18
Oklahomans stand for life. I pushed for pro-life protections in the Senate funding bill to prohibit federal spending for:   →abortions → human embryo research →programs &amp; local govs who discriminate against professionals employers or orgs that don’t pay for or refer abortions,2020-11-17 22:14:38,Twitter Web App,17,162
Imprisonment torture death sentences &amp; mob violence are being used to target &amp; punish religious minorities in Pakistan for having a faith different than their government’s. Enough is enough. The Senate should act &amp; adopt my bipartisan resolution to condemn global blasphemy laws https://t.co/zf6cUxy9rS,2020-11-17 19:37:06,Twitter Web App,11,33
I secured language in the Senate SFOPS bill to ensure the UAE protects our F-35 program from actors like Russia and #CommunistChina. President @realdonaldtrump has made great progress in the Middle East but we must continue to protect Israel &amp; ourselves. https://t.co/rOgVfjQQDo,2020-11-17 17:58:25,Twitter Web App,2,13
Another accomplishment for @realdonaldtrump &amp; #OperationWarpSpeed. Moderna developed a coronavirus vaccine that is 94.5% effective in clinical trials. The world is one step closer to combatting #COVID19 thanks to President Trump’s leadership &amp; policies. https://t.co/dCoHLySGL4,2020-11-17 15:31:37,Twitter Web App,24,115
27 years ago the Religious Freedom Restoration Act became law after receiving overwhelming bipartisan support in Congress. Since then RFRA has been used to protect and reinforce constitutional rights of Americans regardless of their faith to freely exercise their religion.,2020-11-17 00:03:52,Twitter Web App,35,149
The Senate funding proposal solves issues impacting OK families &amp; businesses: → speeds up process for Army Corps of Engineers to renew land leases  → requires Corps to study more steps to prevent flooding of Arkansas River  → gives states more $ for water conservation/planning,2020-11-16 21:18:23,Twitter Web App,3,20
Happy birthday Oklahoma. 113 years ago today President Theodore Roosevelt admitted Oklahoma as the 46th state to the union. Our state has a prosperous story upholding and living out the #OklahomaStandard for the rest of the nation. Here's to even more years OK. Happy birthday https://t.co/dQyledL7MD,2020-11-16 15:46:18,Twitter Media Studio,30,181
I also worked to secure funding in State &amp; Foreign Operations to provide:  →$5 million for internet freedom in #HongKong from Communist China → cap US taxpayer $ for UN peacekeeping at 25%  → $3.3 billion in security assistance to our strongest ally in the Middle East Israel,2020-11-13 18:01:18,Twitter Web App,11,48
🚨 going live a few more times this morning: 7:30- @KKBSTHEBOSS1  8:05- KECO Exploring Energy (Woodward/Elk City),2020-11-13 13:32:17,Twitter for iPhone,3,27
🚨: I’ll be LIVE with @PC1170 right at 7:05 am. Tune in.,2020-11-13 12:54:45,Twitter for iPhone,7,22
The DOD funding bill holds Turkey accountable for their insistence on being an irresponsible ally. Last year I pushed to stop the transfer of F-35 technology to Turkey.,2020-11-12 17:13:13,Twitter Web App,22,173
The Milcon-VA/Defense bills funds military projects essential to OK bases including:   → construction for the Ammunition Demolition Shop at McAlester → the KC-46 &amp; B-21that Tinker will maintain → restores funding for sustainment of MC-12 for the 137th SOW at Will Rogers ANG,2020-11-11 20:48:54,Twitter Web App,14,95
Thank you veterans. Today we celebrate you. https://t.co/HycwqOS8CZ,2020-11-11 18:50:21,Twitter Media Studio,57,632
The Senate spending bills include great wins for OK’s veterans   → funds the building of a new Tulsa VA hospital → aims to reduce misuse of drug therapies → enhances @DeptVetAffairs veteran suicide prevention strategies → eases transition from active duty to civilian life,2020-11-11 16:08:59,Twitter Web App,17,116
Let me say from my heart and from my state thank you veterans for serving the way that you serve. We are grateful for the sacrifice you and your families have made. We thank Gold Star families &amp; remember the sacrifice of your loved ones. Thank you. https://t.co/VuT1ySY10q,2020-11-11 15:14:48,Twitter Media Studio,48,412
As we celebrate &amp; show appreciation for our veterans we should consider how we can help our veterans who struggle w/ mental illness. Let’s commit to serving our veterans who selflessly served to protect us &amp; our freedoms. More thoughts here. 👇https://t.co/w7rfwD3hLE,2020-11-10 22:57:29,Twitter Web App,13,124
Happy birthday @USMC. Thank you for 245 years of service to your nation. #HappyBrithdayMarines https://t.co/zfHvBY8s9l,2020-11-10 15:32:01,Twitter Web App,12,102
I join President @realdonaldtrump in applauding Pfizer’s announcement of their 90% effective vaccine candidate. As Oklahomans &amp; the rest of America continue to navigate #COVID19 this potential vaccine will be pivotal in helping us combat  the virus. Job well done. https://t.co/uAb7zyDT3O,2020-11-10 00:01:25,Twitter for iPhone,70,276
I am grateful to uphold this commitment with @SenJackyRosen on our bipartisan task force for Combating Anti-Semitism. #NeverAgain can’t just be a hashtag. We must do the hard work of educating &amp; equipping each other to actively condemn &amp; reject anti-Semitism.,2020-11-09 22:12:03,Twitter Web App,6,135
82 years ago Nazi soldiers destroyed thousands of Jewish businesses schools &amp; synagogues. This hate began one of the darkest periods in the history of the world. We must not forget the dangers of anti-Semitism &amp; must remain committed to combatting &amp; ending it when it appears.,2020-11-09 22:12:03,Twitter Web App,47,335
There's still a lot for Congress to get done in the next two months including #COVID19 relief. I'm hopeful my Democrat colleagues will come to the table and help pass real relief for Americans who are still hurting and the small businesses that need it. https://t.co/B9BNuqrpE9,2020-11-07 00:00:01,Twitter Media Studio,24,187
The @IRSnews received reports of scammers sending stimulus payments texts in an effort to steal bank account info. It is a phishing attempt &amp; if you’ve been targeted report it to the IRS. The IRS will never send an unsolicited text or email. More info 👉🏻 https://t.co/nEeUt8hFxs,2020-11-06 17:13:28,Twitter for iPhone,15,41
Led by @SenatorTimScott -- My colleagues and I petitioned the Court in support of faith-based agencies to protect their right to live their religious beliefs while caring for children in need.,2020-11-04 15:11:31,Twitter Web App,9,76
Justice Barrett is officially on the bench and today the Court will hear oral arguments on whether faith-based foster care agencies can operate by their faith and also serve families and children.,2020-11-04 15:11:30,Twitter Web App,72,519
Welcome back Officer Zarkeshan. Oklahomans are glad to see your speedy recovery &amp; even more grateful for the way you continue to protect your neighbors and keep your community safe. Thank you for the way you serve. https://t.co/I2dQ4qwNDs,2020-11-03 23:02:33,Twitter for iPhone,7,114
#Election2020 is here. As always I encourage you to do your civic duty &amp; vote. Remember you must have an ID to vote in person &amp; all polling location will have proper social distancing &amp; sanitation protocols. #COVID19 can’t define us. Happy Election Day let’s vote.,2020-11-03 17:27:49,Twitter for iPhone,39,207
Enjoy your extra hour of sleep tonight &amp; don’t forget to set your clocks before bed as we fall back into Standard time.  @SenRubioPress &amp; I have a bill that would make DST permanent. More 🌞= happier people. RT if you agree. #LocktheClock,2020-10-31 17:10:48,Twitter for iPhone,112,315
Protecting our nation is one of the vital functions of our federal government—now we have 400 miles of a new border wall system to secure our southern border. Thank you @realDonaldTrump &amp; the women and men @DHSgov . https://t.co/3A7FGhoYFe,2020-10-30 15:40:55,Twitter Web App,99,244
As many Oklahomans wait for their power to be restored I wanted to take a moment to say thank you to all of our neighbors who have stepped up to help us during this ice storm. We appreciate all of your help &amp; we’re always grateful for neighbors helping neighbors. https://t.co/IIdQYtJ9ba,2020-10-29 18:33:14,Twitter Web App,9,62
I had a great time with Lee Matthews last night talking over coronavirus the 2020 election &amp; answering some of your questions. Didn't get a chance to tune in? Listen here. 👇https://t.co/eEZ3HJbpKK,2020-10-29 16:54:16,Twitter Web App,3,10
Early voting in Oklahoma begins TODAY. @OKelections has taken steps to ensure safe voting including proper social distancing &amp; sanitation.   If you vote by mail remember all ballots must received by 7pm CT on Election Day. #COVID19 can't stop us. Be safe &amp; go vote. https://t.co/8QatfqU6KB,2020-10-29 14:04:15,Twitter Web App,5,38
The intelligence community has already found evidence of our foreign adversaries spreading misinformation &amp; fake news to cause confusion and discord leading to the 2020 election. If there's doubt there's doubt. Let's be smart in how we consume information online. https://t.co/hAQHvE0f1c,2020-10-28 19:40:00,Twitter Web App,10,87
This is a huge accomplishment &amp; I’m grateful for the administration’s commitment to a safer more peaceful Middle East.,2020-10-28 18:11:17,Twitter Web App,2,20
Congrats @USAmbIsrael &amp; @realdonaldtrump on moving to allow diverse investment in economic development in the West Bank. This brings Israelis Palestinians &amp; others together allowing them to engage in business &amp; forge relationships that are essential to bringing lasting peace. https://t.co/S1MpGFeapt,2020-10-28 18:11:17,Twitter Web App,5,29
#CommunistChina uses Confucius Institutes to spread Chinese propaganda. @MarshaBlackburn @SenTomCotton @HawleyMO @marcorubio @SenatorLoeffler @SenMikeLee &amp; I asked @CollegeBoard about their relationship w/ Beijing's Confucius Institute. More here 👉 https://t.co/XXKoTB2gNy,2020-10-28 15:19:02,Twitter Web App,687,692
IRFA also declared that religious freedom is universal &amp; fundamental human right of all. We must continue to find ways to ensure that all ppl have the right to live change or have no faith like calling for an end to blasphemy laws.,2020-10-27 23:52:01,Twitter Web App,13,36
Today is International Religious Freedom Day. 22 years ago Pres. Clinton signed the International Religious Freedom Act into law after it passed the Senate 98-0. That law established @USCIRF &amp; @IRF_Ambassador.,2020-10-27 23:52:00,Twitter Web App,11,57
#ICYMI #JusticeACB https://t.co/EDZfQBAqdG,2020-10-27 22:53:30,Twitter Web App,6,38
Early voting in Oklahoma starts this Thursday. @OKelections has taken precautions to ensure everyone can vote safely &amp; securely in the 2020 election. Today is the LAST day to request an absentee ballot &amp; they must be received by 7 pm CT on Election Day. Be safe &amp; let's vote. https://t.co/SNuFB1m8Ws,2020-10-27 15:42:46,Twitter Media Studio,13,38
Judge Amy Coney Barrett ➡️ Justice Amy Coney Barrett #Confirmed 👩🏼‍⚖️ https://t.co/5tkmuMLsy8,2020-10-27 13:52:52,Twitter for iPhone,18,182
#JusticeACB https://t.co/b27U0AKUEE,2020-10-27 01:19:04,Twitter Web App,180,1348
Moments ago I proudly voted to confirm Judge Amy Coney Barrett to the Supreme Court of the United States. As she begins this chapter in a new group of nine I’m confident she’ll serve Americans well in our nation’s highest court. #Confirmed https://t.co/GfOPEHMNEg,2020-10-27 00:24:11,Twitter for iPhone,66,841
The Senate is the world's greatest deliberative body. Yet in this process I've watched some of my colleagues smear Judge Barrett &amp; her character. We disagree strongly on policy but we don't make personal attacks. We remain above it even if it plays well to a base. #ConfirmACB https://t.co/Y8kQfXWYVL,2020-10-26 21:02:30,Twitter Media Studio,53,320
Senate Democrats keep falsely saying the Senate has never confirmed anyone in an election year. That's not true. In fact it's been done seven times before in our nation's history and today will be the eighth. #ConfirmACB https://t.co/S3hIFetjEl,2020-10-26 19:05:11,Twitter Media Studio,235,617
Senate Democrats and Senator Schumer have tried to do everything to stop the Senate from confirming Judge Amy Coney Barrett. Today the Senate will vote &amp; I'm confident Judge Barrett will be confirmed. #ConfirmACB https://t.co/mrIIpFE3fI,2020-10-26 14:24:09,Twitter Media Studio,73,435
Today I voted to move Judge Barrett’s nomination to the floor for a final vote on Monday. I look forward to voting in favor of her confirmation tomorrow. #ConfirmACB https://t.co/0fDEM2CLFx,2020-10-25 18:36:45,Twitter for iPhone,105,908
Busy week here in Washington DC meeting with Judge Amy Coney Barrett working on #COVID19 relief &amp; continuing to push on election security. This weekend the Senate will have procedural votes on Judge Barrett’s nomination w/ a final vote to confirm on Monday. #ConfirmACB https://t.co/vQew0Mb8gs,2020-10-24 16:31:15,Twitter for iPhone,9,72
Today is National #TakeBackDay. Locate your nearest take back location at https://t.co/6Jy5BOpjWA. https://t.co/mKuRWXJueR,2020-10-24 13:30:00,Twitter Media Studio,6,19
.@realDonaldTrump made another step towards lasting peace today and I congratulate Israel &amp; Sudan for normalizing ties.   As the US brokers peace agreements between Israel &amp; its Arab neighbors I look forward to encouraging Sudan towards democracy &amp; respect for human rights.,2020-10-24 00:30:02,Twitter for iPhone,98,423
Sanctions should immediately be imposed &amp;  Turkey should be removed from the F-35 supply chain,2020-10-23 20:25:06,Twitter Web App,8,45
Despite warnings Turkish Pres Erdogan confirmed Turkey tested the Russian S-400 missile defense system w/ no intention of changing course. Erdogan doesn’t want to behave like a NATO ally &amp; as long as Turkey undermines US nat'l security in the region there should be consequences https://t.co/oQ1D3EkuXX,2020-10-23 20:25:05,Twitter Web App,11,39
LIVE w/ @TeamCavuto momentarily. Tune in.📽️,2020-10-23 20:24:00,Twitter Web App,2,9
America’s brightest orange shines because of the work  dedication and pride @burnshargis and Ann have for the entire @okstate community and will leave a remarkable legacy. On behalf of all Oklahomans--thank you Burns and Ann. https://t.co/c89jPxeykg,2020-10-23 17:31:39,Twitter Web App,8,63
Judge Amy Coney Barrett will be a great addition to the Supreme Court. RT if you agree. 🇺🇸 #ConfirmACB https://t.co/0LLwb6jU7v,2020-10-23 15:47:08,Twitter Web App,380,759
Joining @PC1170 momentarily. Tune in here: https://t.co/Fx2R11hgGD,2020-10-23 12:00:21,Twitter for iPhone,1,3
I’ll be discussing election security LIVE with @BBCWorld momentarily. Tune in.,2020-10-22 20:01:37,Twitter for iPhone,2,13
I joined @KRMGtulsa this morning to discuss the latest on Russia and Iran attempts to interfere in our elections &amp; the significant changes that have been made since 2016 to enhance our security ahead of the election. https://t.co/bpKgRhOpcZ https://t.co/3FNaaAHQRq,2020-10-22 19:39:51,Twitter Web App,3,7
After touching a number of issues with Judge Amy Coney Barrett like religious liberty anti-trust issues &amp; quite a few more yesterday I'm more convinced than ever she's ready to be on the Supreme Court. I look forward to supporting her confirmation. #ConfirmACB https://t.co/kzqUExKM9p,2020-10-22 18:23:55,Twitter Web App,10,108
Reminder that Saturday is National #TakeBackDay. You can find a drop off site at https://t.co/dYOLyHYUX3. If you can't drop your old prescription drugs on Saturday you can find a year-round drop off location in Oklahoma here: https://t.co/ZkrJhBEVS8. https://t.co/cE9dfkW6rO,2020-10-22 15:15:18,Twitter Media Studio,2,13
Now her nomination is headed to the full Senate. After procedural votes throughout the weekend the final vote will be Monday Oct 26. #ConfirmACB https://t.co/9mNSGQBKNd,2020-10-22 13:52:03,Twitter Web App,12,98
As Americans we should all take steps to ensure the information we share about the election is from a reliable source. Oklahomans can visit @okelections website for information https://t.co/qEb7ZErIzB,2020-10-22 00:14:07,Twitter for iPhone,9,28
I’m grateful that DNI FBI &amp; DHS acted swiftly to provide information to Americans about foreign bad actors who are trying to spread disinformation to influence our election. Iran and Russia only seek to sow discord in our public discussions. https://t.co/5h0JDl4JMd,2020-10-22 00:14:07,Twitter for iPhone,11,46
My full statement on my meeting with Judge #AmyConeyBarrett here. 👇 #ConfirmACB https://t.co/d1FPAkhKRi,2020-10-21 19:34:35,Twitter Web App,40,206
After meeting with Judge Amy Coney Barrett today &amp; reviewing her background I’m confident she is well qualified and will be a fair justice on SCOTUS. I look forward to supporting her nomination when the full Senate considers it in the days ahead.,2020-10-21 19:08:45,Twitter for iPhone,135,678
It's extremely frustrating that Senate Democrats continue to choose politics over helping the American people. My statement on Democrat's blocking #COVID19 relief again today. https://t.co/j4v5Xagrcg,2020-10-21 18:27:06,Twitter Web App,151,471
I'm looking forward to meeting with Judge Amy Coney Barrett later today. I hope to cover some key issues that weren't covered in last week's hearings and learning more about her judicial philosophy. https://t.co/RNLoa27uG7,2020-10-21 14:43:34,Twitter Media Studio,8,86
Americans need help now. Rather than delaying with procedural tactics &amp; insisting on an all or nothing partisan wish list I hope my Dem colleagues will work with us to get help to hurting Americans as soon as possible.,2020-10-20 20:11:57,Twitter Web App,12,42
While Dems are busy playing procedural politics @SenateGOP introduced targeted #COVID19 relief that:    → increases $ for testing tracing &amp; vaccine development → creates 2nd round of #PPP to help small businesses → supports unemployment benefits for unemployed Americans,2020-10-20 20:11:56,Twitter Web App,49,193
.@OKelections will never notify you of changes to the voting process by text it will always be by mail. For the most up-to-date information on voting use the OK Voter Portal on the state election board website at https://t.co/nxkFUTIbQB.,2020-10-20 16:07:27,Twitter Web App,4,7
Federal state and local election partners have all taken steps to boost security going into the 2020 election. We’ll continue to take steps to secure election systems but there are still bad actors who will attempt to spread false information. Don’t fall for these scams. https://t.co/V1gbyKYiLh,2020-10-20 16:07:26,Twitter Web App,15,26
Saturday is @DEAHQ National #TakeBackDay. Letting your prescriptions pile up in your medicine can be dangerous. Don't do it. You can find a drop off site at https://t.co/dYOLyHYUX3. Have plans Saturday? Find a year round drop off location in Oklahoma here: https://t.co/ZkrJhBEVS8 https://t.co/uIduVXPtD6,2020-10-19 21:31:08,Twitter Media Studio,6,14
The Senate will again consider legislation this week to help Americans. I hope my Democratic colleagues will work with us on this proposal to provide assistance to American families businesses schools and continued investment in #COVID19 vaccines and therapeutics development.,2020-10-19 16:51:09,Twitter Web App,9,42
As Americans wait for real relief Dems continue to play politics &amp; demand we pass their liberal wish lists of poison pills that have nothing to do w/ the economy. @SenateGOP has been clear we need a targeted approach not multi-trillion legislation that adds to the national debt,2020-10-19 16:51:09,Twitter Web App,87,227
Last week Judge Amy Coney Barrett showed Americans just how sharp and prepared she is to be considered to serve as the next Associate Justice on the Supreme Court. As she consistently stated in her hearings Judge Barrett is dedicated to upholding the law not creating policy. https://t.co/x3iNc5fbu6,2020-10-19 15:11:10,Twitter Media Studio,57,190
Laura provided Americans the ability to see who Judge Barrett really is as a person. If you haven’t heard her testimony yet I encourage you to listen to someone who actually knows her character firsthand.  https://t.co/weTAHWqOh1,2020-10-16 15:38:26,Twitter Web App,8,49
Had the chance to catch up with my friends Butch Black and Shawn Wilson on the Exploring Energy Show on KECO 96.5 FM. Miss our conversation? Catch our recap &amp; my thoughts on the Judge Barrett hearings here. https://t.co/SRLOGbLcds,2020-10-15 20:20:23,Twitter Media Studio,2,9
Today is the FINAL day to complete your Census Oklahoma. Get yours done today at https://t.co/Y9qIWgtb1b https://t.co/KWG7RYLRcH,2020-10-15 17:56:34,Twitter Web App,6,28
Looking forward to sharing my thoughts on the hearings for Judge Amy Coney Barrett with @TalkRadio1170 &amp; @kilmeade on Kilmeade &amp; friends.   Listen live here: 9:45 CT- https://t.co/eopLFUGNON 10:05 CT- https://t.co/0KVjTbsEp6,2020-10-15 14:32:51,Twitter Web App,22,58
The Senate’s job is to provide advice &amp; consent not guarantee Judge Barrett agrees with certain policy positions or mirrors the ideology of the justice she’ll replace. I was impressed by Judge Barrett during the hearings &amp; I look forward to meeting with her in the days ahead.,2020-10-14 23:54:37,Twitter for iPhone,8,69
Not surprised my Democratic colleagues spent another day trying to make Judge Barrett into something she’s not. She’s not Justice Scalia or Justice Ginsburg she’s Judge #AmyConeyBarrett. She was nominated because she’s qualified not because she’s a pawn of a particular party.,2020-10-14 23:54:37,Twitter for iPhone,24,172
