As China continues to encroach on the freedoms of the people of Hong Kong I want to be clear- the United States stands with the people of #HongKong and will work to preserve their presently-enjoyed liberties.,2020-07-01 21:33:27,Twitter Web App,103,304
The treaty clearly states #HongKong would remain unchanged for 50 years yet after 23 years the most basic human rights of Hongkongers are being threatened in the name of so-called ‘national security’ by the mainland communist Chinese government.,2020-07-01 21:33:26,Twitter Web App,118,294
23 years ago today the Sino-British Joint Declaration treaty went into effect making #HongKong part of China but with a high degree of autonomy. A day before the anniversary Beijing reminded the world they can’t be trusted to fulfill their commitments to other nations.,2020-07-01 21:33:26,Twitter Web App,1394,1864
Yesterday’s arrests in Hong Kong prove how ridiculous &amp; overreaching Beijing’s new national security law is. A person was detained for waving an independence flag another for being a pro-democracy advocate. The people of #HongKong have a right to protest and peacefully assemble. https://t.co/voMnzQbqei,2020-07-01 17:33:28,Twitter Web App,635,752
Thank you @hughhewitt for having me. Enjoyed our conversation. https://t.co/EnU40uuk67,2020-07-01 16:16:22,Twitter Web App,3,10
Today begins a new chapter of North American trade as #USMCA officially goes into effect.   USMCA bolsters Oklahoma agriculture manufacturing and supply chains and expands opportunities for consumers workers and businesses. With #USMCA our best days in trade lie ahead. https://t.co/QkTEG0PBXI,2020-07-01 15:52:28,Twitter Web App,10,46
Moments from going live with @hughhewitt. Tune in.,2020-07-01 11:49:24,Twitter for iPhone,5,19
This morning I had the chance to ask @IRSnews Commissioner Reting a few questions regarding the Taxpayer Advocate Services &amp; lessons we can learn from the past few months in the event of another global pandemic.   Don't forget Tax Day is July 15th and it will NOT be extended. https://t.co/D4F2ENAy33,2020-06-30 23:00:01,Twitter Media Studio,7,11
Now is a time to band together in support of the police officers who serve with honor and are willing to make the ultimate sacrifice to protect everyone in our communities.,2020-06-30 20:58:20,Twitter Web App,12,75
Cindy and I are praying for the family of Sgt. Johnson and the entire Tulsa community as we grieve the loss of one of our own. The news is heartbreaking to the entire nation. We pray his family knows that Oklahomans everywhere mourn with them and pray for them today. https://t.co/S5apYrk6Iq,2020-06-30 20:58:20,Twitter Web App,15,63
These parents and children “are members of the community too” and excluding them from an available scholarship program is “odious to our Constitution.”,2020-06-30 20:40:55,Twitter Web App,5,15
Today #SCOTUS again affirmed the right to the free exercise of religion holding the Constitution “condemns discrimination against religious schools and the families whose children attend them.” https://t.co/HjB7QKsZPI,2020-06-30 20:40:55,Twitter Web App,6,18
I'm optimistic we can pass the #NDAA before the Fourth of July so we can continue to honor members of our Armed Services and thank them for their service to our nation.,2020-06-30 20:14:02,Twitter Web App,3,6
Additionally I added an amendment to allow the 13400 Oklahomans in the Guard and Reservist to finally get DD-214 records for their service just like active duty members do.,2020-06-30 20:11:11,Twitter Web App,2,14
We also provided funding for a pilot program that aims to remove the 180 day wait period for retired military personnel interested in pursuing civilian jobs in the federal government.,2020-06-30 20:11:11,Twitter Web App,1,4
In Oklahoma the #NDAA funds: →  KC-46 programs in Tinker &amp; Altus  →  T-7 Red Hawk development in Enid  →  munition plant construction projects in McAlester →  pallet &amp; integration management systems in Lawton-Fort Sill,2020-06-30 20:11:10,Twitter Web App,1,2
What’s in the bill?  → A pay raise for troops  → Funding to help licenses move from state to state for military spouses  → Ensures we won’t have another BRAC round of base closings  → Provides additional supervision for military housing,2020-06-30 20:11:10,Twitter Web App,1,2
For the 60th year in a row Congress will fulfill its duty to pass a bipartisan defense bill. The #NDAA supports our military community in Oklahoma and support for their families. https://t.co/2GBv0o3F3S,2020-06-30 20:04:13,Twitter Media Studio,34,103
Beijing will have consequences for this overreach. The US should use available tools including sanctions against any leader in the CPC implementing Hong Kong security measures.,2020-06-30 19:15:26,Twitter Web App,51,150
One country two systems. That doesn’t work when people don’t have the ability to speak freely petition the government or peacefully protest. We started seeing this within minutes of the law being signed as pro-democracy leaders quit in fear of the new laws.,2020-06-30 19:15:26,Twitter Web App,65,171
China has proved it can't be trusted to uphold commitments. They agreed to 50 years of autonomy  for #HongKong. Beijing’s new security law impedes Hong Kong’s ability to remain autonomous &amp; is a clear approach by communist China to increase power &amp; take control of the territory. https://t.co/kspdiXMk6H,2020-06-30 19:15:25,Twitter Web App,2069,2220
Cindy &amp; I are praying for the @TulsaPolice officers injured in yesterday's shooting. As the conversation on defunding the police continues this tragedy serves as an unfortunate reminder of the sacrifices officers make to protect us. Join me in praying for the Tulsa community. https://t.co/z48O2Z3MAS,2020-06-30 16:53:19,Twitter Media Studio,33,152
The world is watching.,2020-06-29 23:28:48,Twitter for iPhone,16,65
Forcing the Uighurs &amp; other minority populations to use birth control have abortions &amp; sterilizations in an attempt to reduce the population is a clear human rights violation. If Beijing fails to immediately end these practices there should be consequences from the US &amp; the UN https://t.co/vGK90XNBtR,2020-06-29 23:28:48,Twitter for iPhone,601,745
It is Congress’s responsibility to fund the government. If we fail Congress should be held accountable. Gov. shutdowns impede military readiness &amp; put an undue burden on service members &amp; their families. Service members shouldn’t have to worry about putting food on the table.,2020-06-29 22:16:44,Twitter Web App,3,18
I offered 2 amendments to the FY 2021 NDAA: the Taxpayers Right to Know Act &amp; Prevent Gov. Shutdown Act    The amendments  → increase transparency of federal programs/spending → protect taxpayer dollars → prevent costly shutdowns &amp; take away the burden on defense community,2020-06-29 22:16:44,Twitter Web App,6,22
🚨The application deadline for the #PPP is TOMORROW. #PPP has provided over $5.4 BILLION dollars to more than 63600 small businesses in Oklahoma. These loans helped our small businesses stay afloat &amp; allowed Oklahomans to maintain their livelihoods when they needed help the most https://t.co/02kkCpuOkj,2020-06-29 20:36:11,Twitter Web App,3,6
This decision prioritizes the abortion industry over the health and lives of women and preborn children. We have basic medical standards for a reason abortion clinics shouldn’t be exempt from those. https://t.co/iYl29l4CmC,2020-06-29 19:54:02,Twitter Web App,46,177
Tulsa saw the worst of racial hatred. As we near the 100th anniversary of the 1921 Race Massacre this park will show America the best of humanity helping people overcome division &amp; move forward in racial harmony. Thank you for recognizing this important part of Tulsa's history.,2020-06-25 15:53:29,Twitter Web App,3,16
Thank you @realDonaldTrump &amp; @SecBernhardt for your leadership in designating John Hope Franklin Reconciliation Park as part of the African American Civil Rights Network. This park challenges people of all places &amp; races to come together in understanding &amp; reconciliation.,2020-06-25 15:53:29,Twitter Web App,14,54
It's frustrating Democrats wouldn't even engage &amp; debate the #JUSTICEAct. There is widespread agreement on 70% of bill so it's shocking they weren't open to amending it. We all want the same end result we just have different ways of getting there. We need constructive dialogue. https://t.co/68R9SOrGlH,2020-06-25 14:54:37,Twitter Media Studio,216,544
I’m getting ready to join @NewsHour to discuss the #JUSTICEAct,2020-06-24 22:27:15,Twitter for iPhone,5,22
How many times do we have to go through this journey before we finally do something?  It's unfortunate Senate Democrats would rather prolong a problem &amp; make it political &amp; delay justice for families who want this solved. Debate &amp; amend the bill. We can't let it just stop here. https://t.co/qOeBsC3hv5,2020-06-24 22:26:25,Twitter Web App,47,176
I wish that Senator Schumer would allow the Senate to debate and amend the #JUSTICEAct rather than prevent debate and delay justice again for partisan reasons.,2020-06-24 19:30:39,Twitter Web App,4,23
Today we missed an opportunity to increase funding for body-worn cameras ban chokeholds and provide greater accountability and transparency for local law enforcement. The American people deserve better.,2020-06-24 19:30:39,Twitter Web App,2,18
Blocking the Senate from even debating the #JUSTICEAct and demanding that the Senate only take up Speaker Pelosi’s police reform bill that has not even been voted on yet in the House is unjust to every American.,2020-06-24 19:30:38,Twitter Web App,3,8
It’s unfortunate Senate Democrats have allowed partisan politics to get in the way of justice. Equal justice should not be a partisan issue. The #JUSTICEAct has more similarities with the House Democrat bill than differences.,2020-06-24 19:30:38,Twitter Web App,81,221
Senate Republicans and @realDonaldTrump have now filled 200 federal judicial vacancies a transformative milestone for the federal judiciary. These judges play a crucial role in protecting the freedom and rights of Americans and upholding the Constitution. https://t.co/NwqyNo0oPn,2020-06-24 18:17:44,Twitter Web App,14,64
In times of need we’ve come together &amp; passed overwhelmingly bipartisan bills like our #COVID19 bills &amp; criminal justice reform. Police reform should be no different.    It's time for members of both parties to come together &amp; at least support beginning debate on the #JUSTICEAct,2020-06-24 14:52:20,Twitter Web App,2,15
The #JUSTICEAct  → incentivizes prohibition of chokeholds → improves hiring practices of police departments → provides access to an officer’s records for hiring → makes lynching a federal crime  these are changes we all agree will improve law enforcement across the nation. https://t.co/MTPyQpxXK2,2020-06-24 14:47:13,Twitter Media Studio,4,28
Congress hasn’t passed a major police reform bill like the #JUSTICEAct in 25 years. There’s too much on the line to let partisanship get in the way of answering the American people. I’m hopeful Democrats will join Republicans to begin debate on the floor.,2020-06-23 22:15:00,Twitter Web App,23,94
There is so much we agree on. It makes absolutely no sense to hold up the bill and delay action when we agree on the majority of solutions.   Real long-term solutions &amp; reform are what the American people want. The #JUSTICEAct does just that.,2020-06-23 19:59:37,Twitter Web App,7,28
The #JUSTICEAct &amp; the House bill are 80% the same. Rather than Senate Dems holding it up &amp; demanding we take up the House bill let’s get on the bill debate and vote on amendments.,2020-06-23 19:59:37,Twitter Web App,15,45
When we drafted the #JUSTICEAct we included several bipartisan proposals. If there are more ideas Senate rules provide for debate &amp; amendments. The 1st step in making a law is to move forward w/ debate. If Democrats can’t do that they’re just trying to make a point – not a law https://t.co/VzJhaGZ126,2020-06-23 18:44:44,Twitter Web App,55,142
Equal justice under the law shouldn’t be a partisan issue. #JUSTICEAct https://t.co/L01coY7WF6,2020-06-23 16:02:41,Twitter Web App,82,220
Equal justice under the law shouldn’t be a partisan issue. I encourage my Democrat colleagues to come to the table so we can have a real discussion about the #JUSTICEAct this week. https://t.co/noFlhRV20M,2020-06-22 20:01:54,Twitter Web App,13,68
Happy Father’s Day to all the fathers out there. Thank you for the ways you lead serve and love your families. https://t.co/X3lAnhDfMe,2020-06-21 14:26:27,Twitter for iPhone,10,104
This is part of a multi-city listening tour to hear ideas and concerns and talk about opportunity zones and equal opportunity,2020-06-20 22:58:09,Twitter for iPhone,8,47
Great conversation with pastors &amp; leaders &amp; @Mike_Pence. @tulsaDreamCtr is a remarkable ministry to bring food education &amp; mentoring to the community. We all can learn from their example. https://t.co/STmB6U3cdt,2020-06-20 22:58:08,Twitter for iPhone,235,1686
I’m joining @foxandfriends Weekend at 8:30am CT to discuss @realDonaldTrump visiting Tulsa today #JUSTICEAct &amp; the status of a 4th stimulus package. Tune in,2020-06-20 13:26:35,Twitter for iPhone,5,55
Cindy and I stopped by Tulsa’s Juneteenth celebration this afternoon. Juneteenth has a been celebrated for a long time here in Oklahoma and I’m grateful we could be apart of it. https://t.co/1Zbvgc2TDo,2020-06-19 21:54:44,Twitter for iPhone,15,171
Tulsa's story remains unheard by many Americans. In Oklahoma we've worked hard &amp; continue to work hard to tell that story. To learn more about Tulsa &amp; #BlackWallStreet feel free to use the curriculum put together by the Commission at https://t.co/WhnnfzljRt. https://t.co/bmBLOjePBf,2020-06-19 20:42:29,Twitter Web App,30,94
We have made progress since 1865 but we still have work to do to become a more perfect union.,2020-06-19 14:48:42,Twitter Web App,9,41
Today our nation celebrates #Juneteenth which commemorates the day that word finally got to Texas that all slaves were finally free. While celebrating this important anniversary of freedom we can also take time to reflect on America’s history of slavery and racial injustice.,2020-06-19 14:48:42,Twitter Web App,12,65
Going live on @KRMGtulsa in 5 minutes to discuss the #JusticeAct &amp; @realDonaldTrump’s visit to Tulsa.,2020-06-19 12:36:28,Twitter for iPhone,5,17
Joining @tonydokoupil at 7:15am CT on @CBSThisMorning to discuss #Juneteenth @realDonaldTrump visiting Tulsa &amp; yesterday's ruling from the #SCOTUS on DACA.,2020-06-19 11:55:08,Twitter Web App,2,14
Every future administration will have to play 'Mother May I?' with every court. Any partisan judge in any court in America can take any opinion or executive action that they don't like and hold up any future president. That’s just arbitrary on its face. https://t.co/SKRLNiVU5Y,2020-06-18 17:03:42,Twitter Media Studio,19,66
This decision attempts to avoid politically difficult issues and drives our legal system into a minefield of future uncertainty. I am greatly disappointed in the Court's decision.,2020-06-18 15:20:32,Twitter Web App,12,82
SCOTUS has now ruled that every future president has to abide by any previous President's Executive Orders unless a court allows them to change it. This is the definition of  arbitrary &amp; invents a new constitutional right for the exec branch to write laws if the court likes them. https://t.co/kOMK1k0Btz,2020-06-18 14:57:57,Twitter Web App,53,142
🚨 Going live on @OutFrontCNN in 20 minutes to discuss the #JUSTICEAct and @realDonaldTrump's visit to Tulsa.   Tune in at 7:15 pm ET to hear our discussion.,2020-06-17 22:55:00,Twitter Web App,4,19
🚨Programming Alert: I'll be live with Lee Matthews on @NEWSRADIOKTOK in 30 minutes. Tune in as I discuss the #JUSTICEAct and @realDonaldTrump's visit to Tulsa this Saturday.   We're live at 6:15 ET. Don't miss it.,2020-06-17 21:45:00,Twitter Web App,2,5
Thank you @POTUSPressPool for having me. https://t.co/nxjLceRpLI,2020-06-17 16:48:59,Twitter Web App,4,12
The #JUSTICEAct is about making a law not making a point. Equal justice under the law shouldn't be a partisan issue. We're still working on trying to be a more perfect union let's pass this bill to get us one step closer. Thank you @SenatorTimScott for your leadership. https://t.co/kHV542wDOu,2020-06-17 16:28:09,Twitter Media Studio,99,403
Justice should not be a partisan issue. I look forward to partnering with my colleagues on both sides of the aisle and with the @WhiteHouse as we work toward racial reconciliation and improved relationships between law enforcement and the communities they serve.,2020-06-17 16:02:19,Twitter Web App,1,5
Transparency accountability and training will allow the thousands of good officers to shine and will expose the motives of those who are not providing equal justice. Legislative action is required to end the use of chokeholds and to bring more consistency under the law.,2020-06-17 16:02:18,Twitter Web App,1,5
Hundreds of thousands of state local and federal law enforcement officers in Oklahoma and around the nation continue to do the right thing the right way daily. However the service of great officers gets overshadowed by the actions of a few that abuse their positions.,2020-06-17 16:02:18,Twitter Web App,1,4
Honored to join @SenatorTimScott  @senatemajldr @LindseyGrahamSC @JohnCornyn @SenCapito @SenSasse &amp; @RepPeteStauber 2 intro the #JUSTICEAct which offers solutions to help bridge gap between law enforcement &amp; communities by increasing training transparency &amp; accountability https://t.co/sB52mCLwn3,2020-06-17 16:02:18,Twitter Web App,41,114
Watch here👇 https://t.co/5NQ2XMSqeW,2020-06-17 13:48:20,Twitter Web App,6,18
We will introduce the #JUSTICEAct at 9:30 am this morning. Go over to my Facebook to watch the press conference streamed live.  👉 https://t.co/KaOJ3UJ3cf,2020-06-17 12:33:00,Twitter Web App,2,6
Joining @Morning_Joe shortly to discuss the #JUSTICEAct which we’ll introduce at 8:30amCT TODAY https://t.co/G7Wt044DP0,2020-06-17 11:28:55,Twitter for iPhone,3,14
This morning I had the opportunity to question FCC Chairman Pai telehealth expansion the redrawing of broadband maps that were incorrectly drawn and the FCC's plan to address contraband cell phones in prisons. Watch our full exchange here. https://t.co/7I5c03PjBF,2020-06-16 20:49:38,Twitter Media Studio,9,35
The ability to practice faith freely is a fundamental human right of all people. I join @USCIRF in condemning Russia's continued targeting of #JehovahsWitnesses. We must continue to protect religious freedom for all people &amp; hold governments accountable. https://t.co/q16JcwStqf,2020-06-16 18:22:19,Twitter Web App,12,34
21 yrs ago @CoachBobStoops walked into Norman &amp; @OU_Football --&amp; it's never been the same. Big Game Bob has earned his place among the greats of college football. Congratulations! #Boomer https://t.co/4oz9xtqHI3,2020-06-16 16:13:38,Twitter Web App,4,18
Race is a national issue but it boils down to families &amp; individuals. If we don't develop friendships w/ people of another race our nation won't develop those relationships. I challenge everyone to develop those relationships so our nation can work on this  together. https://t.co/YIwBylppeA,2020-06-16 15:57:36,Twitter Web App,12,73
Grateful @USTreasury took steps to allow business owners with a legal past to be eligible for PPP . I look forward to continuing this work with Treasury &amp; @CoryBooker @SenatorCardin @senrobportman to ensure equitable rules for those who earned a second chance.,2020-06-16 13:41:28,Twitter Web App,8,45
I’ll join the @EveningEdit on @FoxBusiness at 6:15 pm ET. Be sure to tune in.,2020-06-15 21:49:26,Twitter for iPhone,5,15
Ideological differences do not preclude us from working together to fight for universal values and basic human dignity. When we see anti-Semitism or hate anywhere everyone must call it out.  Read my @jdforward op-ed in w/ Commissioners Bauer &amp; Manchin on rising anti-Semitism. https://t.co/FklPkIvR5t,2020-06-15 20:40:27,Twitter for iPhone,10,29
I’ll be live with The Open Mic Talk Show on KRMP 92.1 &amp; 1140 (OKC) and KGTO 99.1 &amp;1050 (Tulsa) at 9:45 am CT today. Be sure to tune in.,2020-06-15 14:14:05,Twitter for iPhone,5,10
Tune in to my conversation with @GStephanopoulos this morning about the Republican Task Force work on the #JUSTICEAct https://t.co/FvoxD0I5D7,2020-06-14 12:36:19,Twitter Web App,11,44
I'll be joining @jaketapper this morning to discuss the #JUSTICEAct -- tune in https://t.co/EHXArkFK3b,2020-06-14 12:34:27,Twitter Web App,20,87
Speaking with @chucktodd on @MTPDaily at 4:35pm CT about the #JUSTICEAct--tune in!,2020-06-12 20:53:06,Twitter Web App,2,4
🚨NEW PODCAST: Excited to share my latest podcast with everyone. In this episode of the Breakdown I sat with  @clarencehillok to talk about race reconciliation in America. Check out the latest episode on Spotify the Podcast app or Soundcloud. https://t.co/LLVhZzoj5N,2020-06-12 16:55:32,Twitter Web App,20,71
I joined @MorningEdition &amp; @KRMGtulsa this morning to give an update on the work of the task force lead by @SenatorTimScott to provide greater transparency &amp; retraining in our police depts,2020-06-11 12:01:12,Twitter Web App,7,25
I'll be live w/ @MariaBartiromo to discuss the latest congressional response to police reform bills &amp; the potential for another stimulus package--tune in at 7:10am CT https://t.co/EpOkv8WVJE,2020-06-10 10:59:11,Twitter Web App,3,28
Furthermore what a ground breaking moment in becoming the first African-American Chief of Staff of any US military branch. We are so proud of you &amp; your accomplishments.,2020-06-09 19:23:38,Twitter Web App,3,34
Congratulations General Brown on your unanimous confirmation as Chief of Staff of the @usairforce. I am confident you will lead our airmen with great dignity and honor. https://t.co/rSIdsEIawp,2020-06-09 19:23:37,Twitter Web App,13,61
Congress can talk about race share empathy &amp; listen but we’re also called to act. Honored to work w/ @SenatorTimScott &amp; my colleagues to work toward finding real solutions to address racial reconciliation &amp; improving  relations w/ law enforcement &amp; the communities they serve.,2020-06-09 18:23:14,Twitter Web App,118,613
In a @HSGAC hearing this morning practicing social distancing. We are talking about supply chain &amp; preparing for the next pandemic &amp; what is still needed for this one https://t.co/x48AdDpuuM,2020-06-09 15:19:38,Twitter for iPhone,1,18
@CDCgov awarded $1.3M in CARES funding to @HealthyOklahoma to increase preparedness for flu season &amp; #COVID19. This $ will be used to increase &amp; train staff &amp; increase flu vaccination levels for vulnerable high-risk adults. These are some small steps we can take to get ahead.,2020-06-09 13:54:31,Twitter for iPhone,0,3
Working from home &amp; virtual video meetings have provided new examples of why #cybersecurity is important. Here is some guidance from @CISAgov on how to protect yourself &amp; your business as you telework. https://t.co/R9VyraVTyw https://t.co/TlveYlCtjy,2020-06-09 13:22:14,Twitter Web App,6,10
Grateful @JECRepublicans is holding this critically important hearing on ways we can boost charitable giving during the #COVID-19 pandemic. Churchs charities &amp; nonprofits are boots on the ground helping our friends &amp; neighbors during this crisis. https://t.co/iI6qSRXqs2,2020-06-09 13:20:45,Twitter Web App,4,31
🚨 Programming Alert: I’ll be live with @koconews at 6:40 tomorrow morning. Be sure to tune in.,2020-06-09 02:54:27,Twitter for iPhone,3,21
Tulsa's story remains unheard by many Americans. In Oklahoma we've worked hard to tell the story of #BlackWallStreet &amp; the #TulsaRaceMassacre. Thanks @KingJames for helping us share that story. My loyalty lies with @okcthunder but grateful to be on the #sameteam off the court https://t.co/mVYY3Ukfhm,2020-06-08 13:58:53,Twitter Web App,12,52
Something we can all celebrate- 2.5 million jobs added to the US economy in May &amp; an unemployment rate that not only decreased but was 6 points lower than experts anticipated. We still have work to do but this is the right direction for a strong comeback from #COVID19. https://t.co/vfrUbCZJQX,2020-06-05 15:03:57,Twitter Web App,9,71
Racism will not be solved by simply passing a law—it will be solved by each and every one of us. Tune in to KFOR-TV at 7 pm CT as I join United Voice Oklahoma  for a conversation on race.  https://t.co/3EP3fVvFc7,2020-06-04 21:09:23,Twitter for iPhone,10,34
We need to have hard conversations on race relations but we are all endowed w/ right to speak freely right to hold differences of opinion &amp; right of a free press not controlled by the govt. We must not take these rights for granted &amp; also work to share those same values,2020-06-04 18:14:50,Twitter Web App,7,36
As we watch peaceful protests around our own nation—we’re reminded of how unique our American system of government is.,2020-06-04 18:14:50,Twitter Web App,6,39
That is what #hongkong is fighting for today—their right to be a free and prosperous region.,2020-06-04 18:14:49,Twitter Web App,10,40
Today marks the 31st anniversary of #tianamensquaremassacre—where students in Beijing protested for their freedom. In #China you risk imprisonment &amp; death if you protest in public and are prevented from speaking out online. That is not freedom. https://t.co/lQFzA0CuHf,2020-06-04 18:14:49,Twitter Web App,572,597
