Today on #SmallBusinessSaturday I hope all Washingtonians will #ShopSmall and support local stores that keep our communities strong &amp; create local jobs.  Small businesses have been hit hard by the COVID crisis &amp; we must do more to support them.,2020-11-28 15:56:47,Twitter Web App,16,106
Wishing every Washingtonian a happy and safe Thanksgiving today.   While our observances may look different this year as we continue to fight COVID-19 I hope everyone is safe and has a chance to reflect no matter where you are or how you are celebrating. #Thanksgiving2020 https://t.co/NAwq4wDC4K,2020-11-26 15:53:31,Twitter Web App,16,184
Healthy salmon runs are the backbone of our fishing and outdoor economy throughout the region and we must do everything we can to protect #BristolBay. (3/3),2020-11-25 20:23:41,Twitter Web App,3,72
I look forward to working with the incoming administration and the Alaska delegation to establish permanent protections for #BristolBay and promote more sustainable economic opportunities for the local communities living around these irreplaceable lands. (2/3),2020-11-25 20:23:41,Twitter Web App,6,88
The science is clear: the Pebble Mine could have destroyed the #BristolBay ecosystem and the millions of wild salmon that depend on it. So I’m pleased but not surprised the Corps finally denied the permit for this ill-conceived megaproject. (1/3)  https://t.co/Fiv1kFklTi,2020-11-25 20:23:41,Twitter Web App,30,200
More than 800000 acres burned in Washington this year. Throughout the West more than 47000 fires burned over 8 million acres. And this fire season is not an anomaly.   We need new strategies to prevent #wildfires—that’s why I cosponsored the National Prescribed Fire Act.,2020-11-23 22:31:00,Twitter Web App,23,168
The Affordable Care Act stops companies from charging women more than men for the same health care plan. And the #Medicaid expansion in the #ACA has helped people in every single corner of the State of Washington. That’s why it’s so important to keep fighting for the ACA.,2020-11-23 21:15:00,Twitter Web App,44,254
We don’t want to go backward on health care. We don’t want to see people with rare or complex diseases—or everyday conditions like asthma or diabetes—be denied care or charged an exorbitant rate.   We must defend the #ACA so that millions of Americans can get affordable coverage.,2020-11-23 19:41:25,Twitter Web App,63,398
The #ACA has helped Native Americans access health care &amp; reduced the number of uninsured American Indians &amp; Alaska Natives in Washington state by more than half.   It expanded #Medicaid &amp; also supports @IHSgov Tribally-operated health care facilities &amp; Urban Indian Health Orgs. https://t.co/9vRAR53Wbz,2020-11-22 16:30:00,Twitter Web App,19,71
Each of Washington’s 29 federally recognized Native American Tribes is a cherished part of our history culture &amp; economy. We recognize November as #NativeAmericanHeritageMonth to honor the rich heritages and celebrate the cultures of Native American Tribal nations,2020-11-22 16:02:32,Twitter Web App,88,587
This week I joined my colleagues in urging @USGSA Administrator Murphy to allow the Biden-Harris transition team to receive the resources required under the law &amp; requesting a briefing on steps GSA is taking to ensure an orderly transition.,2020-11-20 20:35:16,Twitter Web App,37,271
Thank you to all the teachers in Washington and across the country who are working tirelessly each day to teach and inspire the next generation especially in the midst of the COVID-19 pandemic. #AmericanEducationWeek #AEW2020,2020-11-20 16:33:44,Twitter Web App,18,170
Spread the word: #OpenEnrollment for health insurance is here! Visit https://t.co/MlgQAl55Li to compare plans &amp; sign up. @WAPlanFinder https://t.co/Y2H08n4Leo,2020-11-19 19:22:26,Twitter Web App,17,37
I want to thank everyone who took time to work with us on these reforms especially the victims’ families who have suffered unimaginable losses. They have been critical in helping us craft this legislation and we thank them for their support today in pushing this bill through.,2020-11-18 23:30:06,Twitter for iPhone,1,16
This legislation moves the #FAA back to a more direct supervisory role &amp; requires more robust product analysis from the manufacturers. It also requires the FAA to upgrade and retain technical expertise to do proper oversight and protects company engineers and whistleblowers.,2020-11-18 23:30:05,Twitter for iPhone,4,18
When it comes to aviation safety has to be the top priority. Cutting corners is not an option. Today the Commerce Committee passed my bipartisan Aircraft Safety &amp; Certification Reform Act to implement new safety reforms for the #FAA &amp; manufacturers. https://t.co/luvwGUXVT0,2020-11-18 23:30:05,Twitter for iPhone,9,40
America is an Arctic nation with an emerging northwest passage making this region an important opportunity for outdoor travel and tourism.,2020-11-16 23:25:20,Twitter Web App,6,50
Efforts to short-circuit the review process and ignore the law will fail just as they did for #BristolBay. This admin. should be focusing on how to ensure a smooth transition rather than trying to expedite legally-deficient projects that will degrade our nation’s public lands.,2020-11-16 23:25:20,Twitter Web App,10,63
President Trump’s last-ditch effort to shortcut environmental laws and jam through Arctic Refuge drilling on his way out the door will not stand up to court scrutiny. #ANWR  https://t.co/X4iN9i2kTB,2020-11-16 23:25:20,Twitter Web App,36,165
Congress must act to help local news survive the pandemic &amp; the onslaught of unfair practices by dominant online platforms. Local journalism occupies a unique position of public trust and is crucial to making accurate &amp; complete information available.  https://t.co/ByfWvgBDz4,2020-11-16 22:01:00,Twitter Web App,13,86
Local news is irreplaceable. By as much as a 2-to-1 margin Americans trust local news sources more than other news services. But approx. 1/4th of U.S. newspapers have closed or merged since 2004 leaving over 200 U.S. counties without a local paper. ⬇️ https://t.co/IP119r06og,2020-11-16 20:45:00,Twitter Web App,9,31
More than 34 million Americans have #diabetes. They are among the millions of Americans with a pre-existing condition whose health care is at risk if the #ACA is struck down. #NationalDiabetesMonth,2020-11-16 19:45:12,Twitter Web App,54,213
Wishing a happy &amp; safe #Diwali to those celebrating the festival of lights in the State of Washington &amp; around the world today.,2020-11-14 16:00:01,Twitter Web App,7,66
As we continue to battle COVID-19 some of our observances may look different this year but I hope each and every one of our veterans feel the thanks of our grateful nation. #VeteransDay2020,2020-11-11 16:01:42,Twitter for iPhone,6,45
Today and every day we must give thanks to the men and women who have served in the U.S. Armed Forces. We owe our freedom to their sacrifices and those of their families. Our veterans stood by us now we must continue to stand by them. #VeteransDay https://t.co/O4nrYNqlox,2020-11-11 16:01:42,Twitter for iPhone,23,174
The health care of millions of Americans is at risk. Instead of striking down the #ACA we should be working to expand access to health insurance &amp; drive down the cost of health care. #SaveTheACA https://t.co/zCvTgTRIHq,2020-11-11 01:01:00,Twitter Web App,9,73
Happy 245th birthday U.S. Marine Corps! Thank you to the brave men &amp; women of the @USMC for their tireless and dedicated service. #HappyBirthdayMarines https://t.co/Svprxe0ZXT,2020-11-10 22:31:00,Twitter Web App,7,60
We don’t want to go back to the days in which health care was out of reach for so many. We must make sure people are not denied access to health care just because they have a pre-existing condition like asthma or diabetes. That’s why we’ll keep fighting to #SaveTheACA.,2020-11-10 21:38:42,Twitter Web App,57,388
Huge CONGRATS to @ZagMBB for landing at #1 in the preseason @AP_Top25 poll! #GoZags https://t.co/aVptCEBsnZ,2020-11-10 01:01:12,Twitter for iPhone,2,27
Proud to see Kyle Lewis of the Seattle @Mariners unanimously win the 2020 Jackie Robinson AL Rookie of the Year Award tonight. Congrats @KLew_5 this honor is well-deserved! #GoMariners,2020-11-10 00:37:45,Twitter for iPhone,5,79
Retweet if you think it’s time for Republicans to abandon irresponsible efforts to unravel the #ACA. If this lawsuit succeeds the entire Affordable Care Act—#Medicaid expansion insurance protections delivery system reforms &amp; more—could be stripped away. #ACA,2020-11-09 22:31:00,Twitter Web App,164,242
Tomorrow #SCOTUS will hear arguments in #CaliforniavTexas about the future of the #ACA. This is especially concerning for the 3 million Washingtonians who have preexisting conditions &amp; for all Americans who don’t want to be discriminated against because of their medical history.,2020-11-09 21:22:21,Twitter Web App,92,367
https://t.co/oJrIxHhTLb,2020-11-07 21:36:04,Twitter for iPhone,36,302
Joe Biden is the right man for this job of moving our country forward. I am also so proud of my colleague Kamala Harris. She made history and opened doors for women especially women of color that will never again be closed.,2020-11-07 17:59:14,Twitter for iPhone,14,204
My heartfelt thanks to Joe Biden for running on a platform of uniting the country delivering the plan and resources needed to fight COVID-19 and working on an economic agenda for all Americans. He will bring people together to combat climate change and tackle racial injustice.,2020-11-07 17:59:13,Twitter for iPhone,13,201
Congratulations to the historic ticket of Joe Biden and Kamala Harris for winning the 2020 election.,2020-11-07 17:59:13,Twitter for iPhone,87,1303
It’s #ElectionDay! Washingtonians make sure to return your ballot to a drop box or your local voting center by no later than 8PM TONIGHT.   To find your nearest ballot drop box &amp; for more information about voting in WA visit ⬇️ https://t.co/orBsGfvdIn,2020-11-03 18:56:26,Twitter Web App,20,84
Make no mistake: If the provision of the #ACA that protects Americans with pre-existing conditions is struck down it would lead to more chaos. Millions of people could be denied coverage or not have health insurance because it’s too costly. #ProtectOurCare,2020-11-02 22:45:19,Twitter Web App,16,107
🚨 Did you take out a Paycheck Protection Program loan? @SBAgov has a new #PPP loan forgiveness guide ⬇️  https://t.co/XQSFNjKTW6 https://t.co/RTIsMy4ATi,2020-11-02 21:48:22,Twitter Web App,11,20
Overturning protections for the Earth’s largest remaining intact temperate rainforest will be one of the most enduring legacies of the Trump administration’s environmental corruption. This blatant overreach ignores the science and the will of the people.  https://t.co/2d1DqDtCNs,2020-10-29 21:01:00,Twitter Web App,54,154
Beyond providing relief in the next COVID package to make sure local news outlets live to fight another day Congress &amp; the @FTC must address the unfair &amp; abusive practices of big tech platforms and the unfair competition facing local news.  https://t.co/MPAxsw1ErN,2020-10-29 19:32:00,Twitter Web App,11,61
As Google Facebook &amp; other large platforms have become the dominant players in online advertising we need to make sure local news is being dealt with fairly in order to have a healthy &amp; dynamic news media across the United States.,2020-10-29 18:04:44,Twitter Web App,9,27
Local newspapers have lost 70% of their revenue over the past 2 decades. Over 40000 newsroom employees—60% of the journalistic workforce—has been laid off. Local news produces accurate &amp; trusted information &amp; holds government accountable. It’s too important to let disappear. https://t.co/3y6vsSolgV,2020-10-29 18:04:43,Twitter Web App,19,54
Our working families must have #equalpay now! Latina women make on average 55 cents on the dollar as compared to white non-Hispanic men. The #PaycheckFairnessAct would bring us closer to the goal of pay equity &amp; build upon the promise of the Equal Pay Act. #LatinaEqualPayDay,2020-10-29 17:05:09,Twitter for iPhone,35,128
Local news is too important to our democracy &amp; our economy to let continue to disappear. It keeps citizens informed &amp; engaged and provides accurate information &amp; oversight. As someone said to me local news is like hanging a lantern on a problem &amp; letting the light shine through. https://t.co/koBnlCguNA,2020-10-27 22:15:00,Twitter Web App,14,85
We shouldn't let regional and community news die as local newspapers &amp; broadcasters adjust to digital delivery because online giants are unfairly leveraging their market power against them.  https://t.co/yg1Q22WPOK,2020-10-27 21:35:00,Twitter Web App,15,56
Thanks @ChrisEvans &amp; @MarkKassen for having me on @ASP to talk about the current state of local journalism and what Congress can do to level the playing field and make sure local broadcasters &amp; local news get a fair deal. https://t.co/ATxNj0gT70,2020-10-27 21:08:04,Twitter for iPhone,30,282
Local news across America creates competition and provides trusted information. But over the last two decades revenues have been decimated and more than 40000 newsroom employees have been laid off.   Read my report on the threats facing local news ⬇️ https://t.co/IP119r06og,2020-10-27 20:02:27,Twitter Web App,18,48
We’ve had 50 years of settled law about a woman’s right to control her own body privacy rights that are guaranteed in the constitution. But Republicans wanted to have a rushed 30-day process instead of hearing from groups &amp; organizations about their concerns on Judge Barrett. https://t.co/YggXX3wJsN,2020-10-27 15:05:38,Twitter Web App,36,143
40% of restaurants are at risk of remaining closed permanently and 1 in 5 small businesses could be closed by 2021. 25% of Washington state small businesses need additional resources to survive. But instead of helping our economy Republicans are rushing to confirm Judge Barrett.,2020-10-26 23:31:00,Twitter Web App,76,345
We should be dealing with the economic crisis facing America in the midst of the COVID-19 pandemic. But the other side didn't want to get serious about a robust COVID relief package. True to form it was way more important to go after a woman's right to choose. #WhatsAtStake https://t.co/1iBJm6kDgR,2020-10-26 23:03:41,Twitter Media Studio,70,257
I do not appreciate the rush to confirm Judge Barrett. Her views are out of the mainstream. She's been critical of the #ACA &amp; its coverage for preexisting conditions. And she refused to say whether #Medicare and Social Security were constitutional. #WhatsAtStake,2020-10-26 19:38:29,Twitter Web App,214,1346
Last night I spoke out against the repeated efforts to take away the rights of American women to access health care. A majority of Americans and a majority of states support a woman’s right to choose. Judge Barrett’s views are out of mainstream. #WhatsAtStake https://t.co/jfqJUwfen0,2020-10-26 18:31:03,Twitter Web App,84,367
Adding insult to injury to this whole process is the fact that we're not dealing with the economic crisis facing America. Instead Republicans continue to pursue judicial nominees that are out of the American mainstream &amp; go after a woman's right to choose. #WhatsAtStake,2020-10-26 01:01:00,Twitter Web App,86,407
The majority of Americans support a woman's right to choose. This is 50+ years of settled law. And Republicans are trying to override it by putting someone on the Supreme Court who will say otherwise.  #WhatsAtStake #SCOTUS,2020-10-26 00:31:00,Twitter Web App,77,334
Today I spoke on the Senate Floor about #WhatsAtStake with this #SCOTUS nominee from the #ACA to a woman’s right to make her own health care decisions.  When people want to roll back the rights of American women we are going to fight back. ⬇️  https://t.co/05bYCfZp1T,2020-10-26 00:00:35,Twitter Web App,90,385
More than 800000 acres in Washington have burned &amp; devastating fires continue to ravage the U.S. This week I asked the National Guard to assess its ability to prepare for &amp; respond to wildfires to help Congress address gaps ensure proper resourcing &amp; better equip the Guard. https://t.co/MmYvnmHqiz,2020-10-23 21:21:14,Twitter Web App,16,84
The #ACA’s pre-existing condition protections are under threat by a federal lawsuit supported by the Trump administration that could soon be decided by the U.S. Supreme Court.   Patients should not be denied access to #healthcare because of a pre-existing condition. https://t.co/qflgT09VID,2020-10-22 20:30:59,Twitter Web App,79,136
What happens if the #ACA is ultimately struck down?   ❎21 million Americans could lose health insurance coverage  ❎Coverage for those with pre-existing conditions would no longer be guaranteed  ❎Caps on out-of-pocket patient costs would be eliminated,2020-10-22 15:45:06,Twitter Web App,71,148
In some areas @Amtrak is the only means of public transportation providing a direct line for economic success in rural communities. The Senate must take up legislation that includes relief for the transportation sector.   https://t.co/UcyPv9uPnt,2020-10-21 23:10:29,Twitter for iPhone,21,57
The pandemic has left millions of Americans out of work and in need of an alternative to employer-based health insurance. We need to protect the #ACA &amp; ensure everyone can access affordable #healthcare regardless of medical history.  https://t.co/2IriVUBYcy,2020-10-21 21:06:38,Twitter Web App,51,203
The moment is here for all of us to stand up and advocate for health care.  The Affordable Care Act must not be struck down and Congress must fight for great access to #healthcare in this country. #ProtectOurCare #ACA,2020-10-20 20:01:00,Twitter Web App,76,298
Washington state has dealt with #PFAS head on but we need additional action to continue the focus on improving water quality. I urged House &amp; Senate Armed Services Committee leaders to include provisions to prevent &amp; address PFAS contamination in the 2021 #NDAA defense bill. https://t.co/bBFLnCXZZU,2020-10-20 19:02:00,Twitter Web App,4,19
People should not be discriminated against because of their medical history. We must defend the #ACA and its provisions that protect coverage for pre-existing conditions.,2020-10-20 18:03:23,Twitter Web App,120,490
If the #ACA is struck down the # of uninsured Washingtonians could double. More than 21 million Americans could lose health insurance coverage.   Taking away health care options during a pandemic that has left millions of Americans out of work is dangerous &amp; unconscionable.,2020-10-16 23:01:00,Twitter Web App,109,302
The number of Washingtonians without health insurance coverage could rise 98% - to 1180000 - if the #ACA is struck down. We must fight to defend the Affordable Care Act &amp; continue making affordable health care investments. https://t.co/6CNHiFLEl5,2020-10-16 21:06:29,Twitter Web App,26,93
8 in 10 LGBTQ students experience harassment. That is just wrong. Join me this #SpiritDay to stand up against bullying and support our #LGBTQ youth. https://t.co/anVlWcPvBj https://t.co/yHAkCszvY2,2020-10-15 18:35:39,Twitter Web App,5,24
Have you completed your census form? The deadline for completion is TOMORROW. Full participation in the #2020Census is critical to our democracy &amp; our communities. The census is confidential and it’s fast &amp; easy to complete online at ➡️ https://t.co/Vnh6AxFnZN,2020-10-14 22:03:37,Twitter for iPhone,30,55
Wishing a happy 245th birthday to the @USNavy today! Thank you to all the brave men and women who serve especially those stationed in Washington at @NavalBaseKitsap Naval Station Everett Naval Air Station Whidbey Island @PSNSandIMF and @CNRNW. #Navy245 https://t.co/Yasl2dV16B,2020-10-13 22:01:00,Twitter Web App,12,38
More than 3 million Washingtonians have preexisting conditions such as diabetes heart disease or asthma. Americans don't want to be discriminated against because of their medical history. We must defend the #ACA &amp; its provisions protecting coverage for pre-existing conditions.,2020-10-13 21:02:55,Twitter Web App,52,245
Long-settled privacy laws are at stake. The issue of a woman's right to choose her own health care is long-settled law. Our privacy rights are more important than ever particularly in an era when both the government and corporations have violated those rights. My full statement: https://t.co/ssTTOHobAq,2020-10-13 16:49:51,Twitter Web App,33,88
More than 9 million Americans have already voted in the 2020 election with more voting each day. The U.S. Senate should respect the voice of the American people and the decision about this Supreme Court vacancy should be decided by the next President and the next Congress.,2020-10-13 16:43:02,Twitter Web App,176,655
Today the Senate Judiciary Committee begins its rush on hearings on a Supreme Court nominee who will impact Tribal rights and law for generations to come. My full statement⬇️ https://t.co/6wmPJHRRjg,2020-10-12 17:25:19,Twitter Web App,58,142
We celebrate #IndigenousPeoplesDay to honor Native Americans as the first inhabitants of our country and to commemorate Native culture and the history of Native peoples. Indigenous people have faced and rose above insurmountable challenges.,2020-10-12 17:19:53,Twitter Web App,38,213
It’s a serious national problem when 1/4 women &amp; 1/10 men experience domestic violence in their lifetime. We must send a clear message to domestic violence victims that no matter who you are where you’re from or where you live you’re not alone. #DomesticViolenceAwarenessMonth https://t.co/MZtNiNRir4,2020-10-11 17:02:00,Twitter Web App,22,69
Thank you to my colleagues on both sides of the aisle for keeping up this fight with me and thank you to the Seattle Indian Health Board for making sure this issue got the attention it needed.,2020-10-11 01:26:09,Twitter Web App,15,184
Finally – FINALLY – #SavannasAct is law and much-needed help for Indigenous women and girls is on the way. New law enforcement tools coordination and data will help make sure our Native women and girls get the protection and justice they deserve.,2020-10-11 01:26:09,Twitter Web App,150,692
Mental health services should be easily accessible especially in the midst of this pandemic as millions of Americans confront mental health challenges. We must keep working to expand access to affordable healthcare &amp; mental health services. #WorldMentalHealthDay https://t.co/6vTK7NiRWu,2020-10-10 17:01:00,Twitter Web App,21,56
Exempting the #Tongass from the #Roadless Rule will remove protections from more than 9 million acres of land &amp; open new areas to logging &amp; industrial development. I joined my colleagues to outline the flaws in this irrational exemption &amp; urge the Trump admin to reverse course. https://t.co/Dqy1n90qOn,2020-10-09 20:55:45,Twitter Web App,18,67
Congratulations to @SeattleStorm on tonight’s @WNBA championship win! They now have four #WNBA titles in the books. The Storm are true champions on &amp; off the court—we are lucky to have them. #GoStorm #WeRepSeattle,2020-10-07 01:37:18,Twitter for iPhone,47,421
I wish the President and First Lady speedy recoveries.,2020-10-02 14:42:29,Twitter for iPhone,13,114
A decision to move production to South Carolina will ultimately be followed by a push to pay the workforce there the wage they deserve. At that point I’m not sure what this move will have been all about. (6/6),2020-09-30 19:32:08,Twitter for iPhone,8,32
Additionally we are moving through Congress more financial flexibility for the supply chain in the next COVID relief package that will help keep supply chain production and be ready for demand to return. (5/6),2020-09-30 19:32:08,Twitter for iPhone,7,27
I plan to work with regional leaders in business labor and education on workforce training programs in composite design optimization and composite fault diagnosis that will produce true cost savings in any aircraft production including the next plane. (4/6),2020-09-30 19:32:07,Twitter for iPhone,5,15
We should be taking the opportunity now to prepare for a recovery in aviation demand by retaining a production workforce in Everett and keeping the supply chain hot and ready for higher production levels. (3/6),2020-09-30 19:32:07,Twitter for iPhone,5,17
The company should not cut its Puget Sound workforce further without a real plan for retaining and retraining that skilled workforce. I don't agree with the decision to shut down 787 production in Everett. Everett provides capacity that will be needed. (2/6),2020-09-30 19:32:07,Twitter for iPhone,4,28
Puget Sound has 100 years of aviation manufacturing history. Its workers’ skill set experience and capabilities should not be undervalued by anyone especially The Boeing Company. (1/6),2020-09-30 19:32:07,Twitter for iPhone,23,111
Lin from Shelton said “It has been slow progress for each of us to achieve increased equality &amp; so we have so much to thank #RBG for. I'm deeply saddened &amp; frightened by her passing… our democracy freedom integrity &amp; the rule of law are threatened &amp; even at greater risk.” https://t.co/9pamiHG0wh,2020-09-28 21:55:20,Twitter Web App,14,76
Eileen from Issaquah wrote “I am a business owner myself and I am terrified that gender protections are in grave danger. Ensuring civil liberties is not just the moral thing to do but it makes sound economic policy as well.” I agree with her. https://t.co/lNtgaItzJ3,2020-09-28 21:55:08,Twitter Web App,19,120
There are 35 days before the election and rushing this nomination is setting a horrible precedent. My office has received 4100 calls and letters already about Justice Ginsburg’s passing and the open Supreme Court seat.,2020-09-28 21:53:55,Twitter Web App,91,452
