The notion that we should cancel the election in the fall is just clear wrong-headedness. The president should be protecting the right to vote by helping secure our election sites &amp; protecting our mail-in-ballot system. Let America vote! https://t.co/JdceR81i6G,2020-07-30 23:12:19,Twitter Web App,57,262
An employer’s personal beliefs shouldn’t dictate the health coverage employees can receive. I cosponsored S.4246 to safeguard access to birth control for every person who needs it.,2020-07-30 19:24:56,Twitter Web App,94,463
Congrats to everyone at @NASA who worked on today’s launch of the Mars Perseverance rover! WA state has a long tradition of aerospace innovation &amp; I'm proud that WA companies supplied parts for this mission. Today reminds us what's possible when we invest in science &amp; technology. https://t.co/WozLjTLK1I,2020-07-30 17:10:44,Twitter Web App,10,56
Congress must extend support for everyone who has lost their jobs as a result of the pandemic. #ExtendUI,2020-07-30 16:05:00,Twitter Web App,110,380
#Medicare and #Medicaid were signed into law 55 years ago today. Both programs provide lifelines to affordable healthcare for over 100 million Americans including millions of Washingtonians. I will continue to stand up to protect these vital programs.,2020-07-30 14:15:25,Twitter Web App,16,86
3 years ago today we were able to protect Medicaid &amp; the Affordable Care Act from Republican repeal attempts preserving coverage for millions of Americans. We must continue the fight to defend the ACA and make affordable health care investments for the future. #ProtectOurCare,2020-07-28 18:07:53,Twitter Web App,52,198
John Lewis spent his life showing us how to fight for justice and equality. Now it’s up to us to carry it on.⬇️⬇️ https://t.co/VCO9pFMWJE,2020-07-27 22:58:00,Twitter Web App,19,80
We were recently able to provide billions in new funding to repair our public lands as part of the #GreatAmericanOutdoorsAct. I’ll continue fighting to protect &amp; expand access to our public lands.  https://t.co/QJK34fnuJg,2020-07-27 20:02:51,Twitter Web App,4,54
This National Park &amp; Recreation Month I want to thank our tireless parks &amp; rec professionals🌲🏔️Washington state is blessed to have some of the nation's most beautiful national parks trails and urban green spaces. #WeAreParksAndRec,2020-07-27 20:02:51,Twitter Web App,8,75
But the administration has chosen to push forward and help special interests at the expense of Pacific NW fishermen Alaska Native communities shipbuilders suppliers sportsmen restaurants &amp; so many others. Whatever the administration may say this fight is not over. (2/2),2020-07-27 17:43:26,Twitter Web App,16,74
We have seen analysis after analysis—including from the Trump administration’s own EPA—showing the Pebble Mine will irreparably harm Bristol Bay and over 50 million salmon that return to the watershed every year. (1/2) https://t.co/Vv6mXuyniA,2020-07-27 17:43:25,Twitter Web App,40,108
Today marks 11 years since the federal minimum wage was last raised. It’s long past time American families across the country got a raise. I’m proud to have introduced legislation to #RaiseTheWage to $15 by 2024 &amp; increase the wages of almost 30% of the U.S. workforce.,2020-07-24 23:01:00,Twitter Web App,51,183
What we need now is de-escalation. The administration should focus on ways to protect civil rights and make the changes Americans are calling for not cause further provocation and increase tensions. (2/2),2020-07-24 21:15:25,Twitter Web App,53,292
Americans have the constitutional right to assemble and protest. Local and state authorities have not asked for assistance from the federal government and it is not the role of the Department of Homeland Security to unilaterally intervene in protests in American cities. (1/2),2020-07-24 21:15:25,Twitter Web App,274,868
The United States Postal Service connects our communities helps small businesses stay connected &amp; employs more than 630000 people. Congress should appropriate funds to ensure @USPS can keep post offices open maintain its services &amp; remain independent.,2020-07-24 18:30:07,Twitter Web App,103,307
Yesterday the Senate-crafted #GreatAmericanOutdoorsAct was sent to the president’s desk. As a longtime #LWCF advocate I’m very happy that my colleagues have joined in this bipartisan effort to say that public lands really do mean a lot to our nation. https://t.co/YoYO2XN5PR,2020-07-23 19:15:14,Twitter Web App,14,57
Release the Kraken! https://t.co/IckprlDTwj,2020-07-23 17:00:05,Twitter Web App,5,84
We’re also fixing decades of underinvestment in public lands by permanently fixing funding for the Land and Water Conservation Fund which will give Americans two- to three-times more dollars invested in parks &amp; open space at no cost to the taxpayer. #LWCF https://t.co/QJK34fnuJg,2020-07-22 22:29:54,Twitter Web App,4,65
I applaud my House colleagues for passing the #GreatAmericanOutdoorsAct and getting it to the president’s desk. Our National Park maintenance backlog is atrocious. Investment in maintenance helps keep our parks open and allows them to serve more visitors. #GAOA,2020-07-22 22:29:53,Twitter Web App,14,140
I look forward to the House passing the #GreatAmericanOutdoorsAct—which will fully #FundLWCF—today. 98% of counties in America have a project funded by #LWCF. Public lands mean a lot to our nation &amp; this bill couldn’t be a more important investment or give us a bigger return. https://t.co/ccunlYHF8K,2020-07-22 19:18:32,Twitter Web App,20,81
Washington has received more than $700 million from #LWCF for projects from Gas Works Park to expanding access to our rivers &amp; forests. The #GAOA will inject money into our economy create more jobs &amp; fix the repairs we need to our public lands without costing taxpayers a dime. https://t.co/DDPQtM0yl9,2020-07-22 17:59:37,Twitter Web App,7,31
Today the House is set to pass the Great American Outdoors Act which will fully fund the Land and Water Conservation Fund &amp; address our national parks maintenance backlog. #LWCF has dedicated 5 million acres of open space across the U.S. This is a big win for Americans. #GAOA https://t.co/QIFCoGkbzo,2020-07-22 17:48:30,Twitter Web App,19,93
Congress must extend support for everyone who has lost their jobs as a result of the pandemic &amp; get more funding for our hospitals &amp; schools. It’s also critical we increase testing &amp; make sure our health care &amp; front-line workers have the #PPE they need. https://t.co/GiG9bWSkgx,2020-07-22 15:39:23,Twitter Web App,30,88
One of Americans’ most fundamental rights is the right to protest and that means being able to protest without unidentified militarized federal officers being called. This bill protects our First Amendment rights and the safety of all Americans. https://t.co/2dwAwrU6QR,2020-07-21 21:39:42,Twitter Web App,176,426
We cannot let this pandemic further the digital divide harming our nation’s students. I’m proud to cosponsor legislation with @SenMarkey to help close the #HomeworkGap with emergency FCC E-Rate funding. Functioning broadband is a necessity for every American home. https://t.co/CMhZARkd9K,2020-07-21 17:05:00,Twitter Web App,48,142
I’m urging the Trump admin to withdraw its confusing &amp; harmful changes to #COVID19 hospital reporting requirements. Abruptly changing the reporting process could disrupt the data &amp; raise questions about its accuracy. https://t.co/aig7ZebcXq,2020-07-20 23:10:27,Twitter for iPhone,52,206
We’ve lost a civil rights icon at a time the country greatly needs him. John Lewis spent his life showing us how to fight for justice and equality. Now it’s up to us to carry it on.  My full statement on the passing of Congressman John Lewis: https://t.co/GeBiCCTMeb,2020-07-18 21:02:29,Twitter for iPhone,27,169
.@SoundTransit's Federal Way Link Extension project is a game-changer for commuters in South King County connecting them to Sea-Tac &amp; downtown Seattle with easier commutes and less congestion. That means a better experience for so many people. https://t.co/PT1rJJUJna https://t.co/ARNwJgrIaq,2020-07-17 16:23:48,Twitter Web App,4,26
@SoundTransit’s Federal Way Link Extension project is a game-changer for commuters in South King County connecting them to Sea-Tac &amp; downtown Seattle with easier commutes &amp; less congestion. That means a better experience for so many people. https://t.co/ARNwJgrIaq,2020-07-17 16:10:38,Twitter Web App,0,4
We can’t afford the degradation of our environment or the pollution that could come with the Trump administration’s #NEPA rollbacks. My full statement⬇️ https://t.co/YNQ4KJF9oi,2020-07-15 21:31:17,Twitter Web App,36,87
Way to go Yakima County! #WearAMaskWA  https://t.co/KLzRNSJZBl,2020-07-15 16:05:00,Twitter Web App,168,1445
And the Trump administration is trying to take health care options away from millions of Americans during a pandemic. https://t.co/F5sExvOWS1,2020-07-14 20:29:24,Twitter Web App,85,220
We still need comprehensive civil rights and anti-discrimination legislation to help protect #LGBTQ Americans. It’s time for Leader McConnell to take the #EqualityAct out of the legislative graveyard and get it onto the Senate floor.,2020-07-14 18:31:43,Twitter Web App,8,37
In light of the SCOTUS #Bostock decision I asked the Trump administration to review &amp; revoke all of its policies permitting discrimination against #LGBTQ people. All Americans should have confidence that their federal government is working to protect—not undermine—their rights.,2020-07-14 18:31:43,Twitter Web App,19,80
Undermining or denying climate change science does not protect our economic interests. We are already seeing the huge costs of #climatechange &amp; unless we act now they will only continue to grow. https://t.co/AZlDcxN52y,2020-07-14 16:20:06,Twitter Web App,26,51
Today proves that raising our voices does matter – thank you to everyone who did. (4/4),2020-07-13 20:23:12,Twitter Web App,4,36
More recently the San Manuel Band of Mission Indians is a founding partner of the newest NFL stadium the Allegiant Stadium in Las Vegas and the Tribe is a sponsor of the Las Vegas Raider’s 2020 inaugural season. (3/4),2020-07-13 20:23:11,Twitter Web App,4,26
For example the Seattle Seahawks worked directly with Tribal member artists in Washington state to develop the team’s logo and did so with respect. (2/4),2020-07-13 20:23:11,Twitter Web App,3,16
Native Americans deserve our respect. Changing the Washington D.C. football team name is the right thing to do. Many Native Americans and Alaska Natives are not just fans of @NFL teams; Tribes partner and greatly contribute to NFL teams’ success. (1/4),2020-07-13 20:23:11,Twitter Web App,12,82
It’s #FrenchFryDay🍟- Did you know Washington state ranks second in the country for potato production? 99% of our potato farms are family-owned businesses &amp; I’ll keep fighting to make sure Washington’s potato farmers get the assistance they need during this crisis.,2020-07-13 17:31:08,Twitter Web App,28,178
Way to go Tri-Cities! #MaskUpWA https://t.co/Nf0bv59PfG,2020-07-10 23:13:46,Twitter for iPhone,15,121
I’m glad @USDA listened to Washington state farmers and made some of WA’s most valuable crops eligible for the coronavirus assistance they deserve. I’ll continue to fight to make sure all farmers get the assistance they need to weather COVID-19 losses. https://t.co/rjnNDJcRDc,2020-07-10 17:37:43,Twitter Web App,21,92
Unfortunately the report released today makes it crystal clear Neil Jacobs is not that leader and he failed to protect scientists from political influence. Therefore I oppose Neil Jacobs’ nomination to be the Administrator of NOAA and I urge my colleagues to join me. (2/2),2020-07-09 22:30:42,Twitter for iPhone,15,75
NOAA's work is crucial to protecting American lives and creating and supporting jobs in our ocean economy which is why leaders of a scientific agency like @NOAA must hold themselves and their agency to the highest scientific integrity standard. (1/2) https://t.co/F85CykjBe1,2020-07-09 22:30:42,Twitter for iPhone,12,50
There is a federal role in protecting the civil rights of all Americans &amp; preventing excessive police force. We need to honor George Floyd &amp; pass laws that help protect the citizenry of our country. #GeorgeFloydLaw #JusticeInPolicingAct,2020-07-09 18:15:00,Twitter Web App,62,209
The #SCOTUS ruling today sets a dangerous precedent and will strip birth control coverage from Americans. An employer’s personal beliefs shouldn’t dictate the health coverage employees can receive.,2020-07-08 22:38:18,Twitter Web App,43,185
More than 27000 international students study at Washington state colleges and universities. Our universities and community colleges need more flexibility during this pandemic not less. This policy will drive down innovation and harm the U.S. economy. https://t.co/JUm6D2lj8g,2020-07-08 18:14:55,Twitter for iPhone,40,109
Pandemics don’t stop at borders and neither should the global response. It is irresponsible and wrong for the United States to leave the World Health Organization especially at a time when we continue to see an increasing number of COVID-19 cases throughout the country. https://t.co/swfnqxhrOs,2020-07-08 00:24:00,Twitter Web App,31,131
The SBA is again accepting new #PPP loan applications through August 8th. More info⬇️ https://t.co/JGi0X5CG2f,2020-07-07 17:05:44,Twitter Web App,8,11
Congratulations to @MeMattke &amp; the Spokane Workforce Council for their 2020 Trailblazer Award from NAWB @WorkforceInvest!,2020-07-06 20:37:31,Twitter Web App,6,25
The Department of Justice should defend the #ACA and stop its efforts to sabotage health care protections for millions of people in the United States in the midst of the #COVID19 public health emergency.,2020-07-06 18:37:00,Twitter Web App,87,217
The Minority Business Development Agency helps entrepreneurs launch &amp; grow their businesses. I cosponsored legislation to make @USMBDA permanent &amp; ensure that we are doing everything we can to support minority-owned companies during these times of unprecedented challenges.,2020-07-06 16:38:12,Twitter Web App,4,14
Wishing everyone in Washington &amp; across the country a safe #4thofJuly!,2020-07-04 16:02:59,Twitter for iPhone,10,108
If you want advertisers to play ball with the @NFL you can't have discriminatory team names.  Changing the Washington football team name is the right thing to do. Thanks to @FedEx for saying so.,2020-07-03 21:15:02,Twitter for iPhone,26,150
That’s why I will be looking into legislative options to achieve the certainty our aviation system needs and restore the confidence of the nation’s workers and travelers. (3/3),2020-07-03 17:37:35,Twitter for iPhone,5,24
We need to ensure consistent implementation and compliance across the national aviation system to assure the flying public. (2/3),2020-07-03 17:37:35,Twitter for iPhone,4,24
The joint guidance is a step forward in the call for clear and uniform national guidelines. But there is more work to do to protect aviation workers and the traveling public. (1/3) https://t.co/QDQE76VCyv,2020-07-03 17:37:34,Twitter for iPhone,6,32
As I’ve said for years it’s time to stop using this name immediately. The @NFL does not need to condone a dictionary-defined racial slur to play football. Time for the NFL to be on the right side of history. https://t.co/c6FcQWPMRn,2020-07-03 17:20:56,Twitter for iPhone,25,151
Congress should appropriate funds to ensure the USPS maintains its services amidst #COVID19 losses and remains accessible &amp; independent. https://t.co/X0WUPfDcrl,2020-07-02 19:25:36,Twitter Web App,24,88
The @USPS is a fundamental American service uniquely serving “the last mile” &amp; employing more than 630000 including 97000 of our veterans.,2020-07-02 19:25:35,Twitter Web App,62,230
#OTD in 1964 the #CivilRightsAct was signed into law prohibiting discrimination based on race color religion sex or national origin. Just as with fighting discrimination we need a strong federal role to stop excessive police force.,2020-07-02 17:49:14,Twitter Web App,23,72
This situation has gone from bad to worse. @SecretaryRoss must immediately cease this campaign to keep the public in the dark. The Inspector General is doing their job and the public deserves to see the report. Release the report now Mr. Secretary. https://t.co/FhsSFpeT6Q,2020-07-02 13:14:38,Twitter for iPhone,26,78
It appears that @CommerceGov received an Inspector General report of an investigation into Hurricane Dorian information mismanagement on June 26 but has blocked its release. I expect that full unredacted report to be made public immediately in the interest of full transparency. https://t.co/WvUSzIm2ES,2020-07-01 14:43:26,Twitter Web App,23,68
We need to pay close attention to what’s included in the #NDAA legislation. These particular provisions are really egregious and we need to correct them before we continue to move forward.  https://t.co/P80Uapk5kX,2020-06-30 22:19:52,Twitter for iPhone,17,37
In honor of the 100th anniversary of the Negro Leagues today we tip our caps to the brave players—including those on the Seattle Steelheads—whose examples continue to make baseball and America better. #TipYourCap2020 https://t.co/vWb3VeO3jD,2020-06-30 00:31:59,Twitter Web App,15,52
Attempting to take away health care options during a pandemic that has left millions of Americans out of work and in need of an alternative to employer-based health insurance is dangerous &amp; unconscionable. https://t.co/u4lnQT6IK3,2020-06-29 18:06:33,Twitter Web App,85,227
51 years ago the #Stonewall uprising empowered the #LGBTQ community. Today we commend LGBTQ bravery solidarity &amp; resiliency.,2020-06-28 17:35:56,Twitter for iPhone,13,82
Every individual deserves the freedom to make their own #healthcare choices. Today on the anniversary of #WholeWomansHealth I’m proud to keep fighting for reproductive health &amp; rights for all. https://t.co/5Pc4ssESYS,2020-06-27 17:07:12,Twitter for iPhone,13,61
Today marks the 5 year anniversary of the SCOTUS #Obergefell decision providing nationwide marriage equality. Who you are or who you love should never be grounds for discrimination or hatred.,2020-06-26 17:04:06,Twitter Web App,32,181
President Trump’s nominee to lead @USCPSC has advocated for the deregulation of toxic #PFAS chemicals &amp; repeatedly sided with industry over the safety of American families. @USCPSC is the last line of defense for consumers—we can’t afford to go backwards.  https://t.co/hR90oBXCZM,2020-06-26 14:32:00,Twitter Web App,26,40
Wearing a mask is so important to slow the spread of COVID-19. Be safe and strong Washington! #WearAMaskWA #YakimaStrong https://t.co/2BKh9jDY3u,2020-06-25 18:56:00,Twitter Web App,136,1001
When it comes to civil rights a report is not enough. We’re not looking for 75%—we’re looking to protect all Americans' constitutional rights. There is a federal role here &amp; we should not abdicate it with a weak bill. America is watching. https://t.co/T8wL7iiit8,2020-06-25 15:46:00,Twitter Web App,24,100
It’s no surprise the @NatUrbanLeague said the Republican legislation does not meet the moment for racial justice.,2020-06-24 23:20:30,Twitter Web App,8,35
What Americans want is justice guaranteed by a strong federal response. We need real bipartisan effort to uphold the civil liberties of all Americans not a pre-determined process for a weak bill. https://t.co/HQw415OC4w,2020-06-24 23:20:29,Twitter Web App,16,69
Today as we honor the anniversary of #TitleIX we applaud the tremendous achievements of millions of female athletes around the country—they are a reminder of Title IX’s enduring legacy. It’s time for us to work together to ensure female athletes get equal pay for equal play. https://t.co/DCGEwI3r2v,2020-06-23 21:55:47,Twitter Web App,16,46
I have cosponsored S.631 legislation to recognize DC statehood and ensure that the more than 700000 people who call Washington DC home will have full representation in our democracy.,2020-06-22 22:46:41,Twitter for iPhone,241,1822
I urged @POTUS to change course &amp; use his executive authority to protect #Dreamers. It would be an American tragedy to deport DACA recipients who are saving lives in the midst of this pandemic.,2020-06-22 22:00:16,Twitter for iPhone,6,42
More than 16000 Washingtonians live and work in our state under #DACA. DREAMers are our fellow Americans. They invest in and contribute to their communities &amp; help us build a better and more prosperous America.   https://t.co/mN5UWv68ii,2020-06-22 22:00:15,Twitter for iPhone,14,73
We need an independent FAA. My bill would fundamentally change the way the FAA oversees the certification of large commercial aircrafts and make sure the FAA stays in the driver’s seat of certification.  https://t.co/FhHU7HbCdi,2020-06-22 19:22:06,Twitter Web App,7,26
Safety is job one in aviation certification. I pressed FAA chief Steve Dickson on how the #FAA needs to improve certification so that engineering safety is driving the process. https://t.co/cPNX4QtmXG,2020-06-22 19:22:05,Twitter Web App,6,20
Happy #FathersDay to all the dads in Washington &amp; across the country—we appreciate you!,2020-06-21 19:45:59,Twitter for iPhone,5,62
#Juneteenth marks the end of slavery. It’s a day to remember and reflect and a day to recommit ourselves to ending racial injustice wherever we find it.,2020-06-19 18:39:03,Twitter for iPhone,11,72
LGBTQ+ Americans still face discrimination in far too many areas of life—public accommodations housing education and some federally-funded programs. It’s time for Leader McConnell to take the #EqualityAct out of the legislative graveyard and get it onto the Senate floor. https://t.co/xf9wrBIZYz,2020-06-18 18:21:25,Twitter Web App,37,118
Court rules FOR THE PEOPLE--Dreamers my fellow Americans!   Trump’s use of the DOJ to subvert the law is wrong. What does it cost US taxpayers to keep defending Trump’s illegal actions? https://t.co/vjHcw06RHL,2020-06-18 14:56:23,Twitter for iPhone,59,264
The @USCPSC is our last line of defense against toxic hazards &amp; defects in consumer products. Dr. Beck’s record is clear—she’s sided with industry over the safety of American families. We can’t afford to go back on regulation of toxic chemicals like #PFAS. https://t.co/rS2igy8puA,2020-06-17 22:48:42,Twitter Web App,21,50
This is a huge day for public lands in the United States. #LWCF couldn’t be a more important investment or give America a bigger return. Open space is a great driver of our economy but more importantly it’s an essential aspect of American life. #FundLWCF #FixOurParks https://t.co/yo09dkgYFJ,2020-06-17 21:49:14,Twitter Web App,21,97
Today the Senate passed the Great American Outdoors Act which will fully #FundLWCF and address the maintenance backlog in our national parks. #LWCF has dedicated across the United States 5 million acres of open space for all Americans to enjoy. That is a big win. #FixOurParks https://t.co/fXMfztYB8y,2020-06-17 20:38:32,Twitter Web App,14,103
The outdoor economy generates $887 billion in consumer spending annually. Fully funding #LWCF is the right fiscal policy it is good for us &amp; for our future. I urged my colleagues vote on final passage of this landmark legislation.,2020-06-17 00:29:48,Twitter Web App,5,20
The economic return on public lands are phenomenal. #LWCF is one of the smartest fiscal policies we can make—raising revenue from private entities' offshore drilling &amp; using it to preserve open space generate revenue &amp; help all of us enjoy the outdoors. #FundLWCF #FixOurParks https://t.co/mEmxg42BAz,2020-06-17 00:29:47,Twitter Web App,10,38
While this week’s Supreme Court decision was important &amp; fundamental I want to emphasize how disappointed I am that we’ve had legislation to protect #LGTBQ+ Americans—the #EqualityAct—that we could’ve passed decades ago.,2020-06-16 16:47:06,Twitter Web App,18,75
Leader McConnell and the Republicans should take the #EqualityAct out of the legislative graveyard and get it onto the Senate floor. We need this comprehensive civil rights and anti-discrimination legislation to help protect the LGBTQ+ community. https://t.co/mmRc2jzfhi,2020-06-16 16:24:46,Twitter Web App,23,77
⬇️⬇️ https://t.co/zHekEYc0QV,2020-06-16 16:03:12,Twitter Web App,9,13
Until today we had no federal law against firing an employee or harassing someone at work for being gay lesbian bisexual or trans. That is just wrong. And LGBTQ+ Americans still face discrimination in so many areas of life. https://t.co/ap9DCemrLf,2020-06-16 02:36:39,Twitter Web App,18,122
Gay and transgender Americans should not face discrimination in the workplace or live in fear of losing their jobs simply because of who they are. This is a very important step forward but it is also long overdue. https://t.co/nNFZKyEkNy,2020-06-16 00:42:41,Twitter for iPhone,17,129
Public lands provide Americans with places to recreate hunt fish and find solace &amp; recovery. Because #LWCF is paid for by royalties from oil companies drilling offshore these investments don’t cost taxpayers a dime or add to our deficit. #FundLWCF  https://t.co/uDTf1oGjtv,2020-06-15 19:37:06,Twitter Web App,9,33
Congratulations to Raigan Barrett of Rogers High in Puyallup for being named a @Gatorade Washington Softball Player of the Year! This award recognizes Raigan as WA’s best high school softball player for outstanding athletic excellence academic achievement &amp; exemplary character.,2020-06-15 17:19:45,Twitter Web App,6,47
