That’s why it is essential the federal government build &amp; support a national testing system that resolves supply chain challenges synthesizes epidemiological data &amp; provides states with support to increase testing capacity.,2020-04-28 18:39:03,Twitter Web App,8,47
Public health officials in WA &amp; across the country require a strong testing system to get the information they need to determine when our communities can begin reductions in social distancing efforts without compromising public health.,2020-04-28 18:39:03,Twitter Web App,19,96
In addition to fever cough and shortness of breath @CDCgov has added 6 symptoms to their list of known #COVID19 symptoms: sore throat headache muscle pain chills repeated shaking with chills &amp; new loss of taste or smell.   https://t.co/99EphRXiqt,2020-04-28 16:17:34,Twitter Web App,9,25
Information for Washingtonians about #COVID19 resources &amp; relief available: https://t.co/jlUTLgjy8x,2020-04-27 21:45:55,Twitter Web App,12,23
That’s why I joined a bipartisan group of 74 senators to encourage OMB to work with federal agencies to increase advertising in local newspapers &amp; on broadcast stations to help ensure they are able to continue to operate throughout the #COVID19 pandemic.  https://t.co/cu9AUfmu1j,2020-04-24 21:59:40,Twitter Web App,5,27
It is important that local media are able to continue to provide their services during the COVID-19 pandemic so that Americans are able to stay up to date with the latest news and information.,2020-04-24 21:59:40,Twitter Web App,7,47
Thank you to all the health care workers and everyone on the front lines who are putting their lives on the line every day to save others. Our nation owes you an immeasurable debt of gratitude.,2020-04-24 20:00:20,Twitter for iPhone,9,102
#Ramadan Mubarak to all Washingtonians in the Muslim community and around the world who are preparing to fast during the holy month. Wishing you a healthy peaceful and joyful start to Ramadan!,2020-04-23 22:19:57,Twitter Web App,14,73
Lowering fuel standards will degrade public health hurt our environment and cost the average car owner more than $6000.,2020-04-23 18:40:51,Twitter Web App,9,38
I am very concerned about the Trump administration’s proposals to undermine and weaken environmental regulations during a health pandemic.   https://t.co/Amfx4YBf25,2020-04-23 18:40:51,Twitter Web App,11,49
Washington's own @DenisHayes reminds us that a healthy environment is worth fighting for. #EarthDay50  https://t.co/jJ96K2QFCW,2020-04-22 18:49:16,Twitter Web App,6,19
On #EarthDay we renew our commitment to appreciate cherish and be good stewards of our Earth. Washington state is rich with natural beauty which we must preserve for generations to come. https://t.co/gkW5wx9qEW,2020-04-22 18:49:15,Twitter Web App,10,50
Especially important to Washington this bill allows small production agriculture food fiber and aquaculture businesses to access emergency grants and loans. I am also glad more funding will be going to much-needed testing and to hospitals and health care providers.,2020-04-21 22:24:34,Twitter Web App,7,32
This is another critical shot in the arm for small businesses. Included in the $370 billion of new money for SBA is $60 billion directly to community-based lenders to make sure small businesses can get help whether they have a relationship with a big bank or not. https://t.co/VFQvvISM7Z,2020-04-21 22:24:34,Twitter Web App,9,36
Today on Yom HaShoah #WeRemember the six million Jewish victims of the Holocaust and the millions of other victims of Nazism. We must stand together to fight genocide and hate. https://t.co/uipfzShRcz,2020-04-21 19:23:07,Twitter for iPhone,18,49
An estimated 33000 U.S. news workers have been laid off furloughed or have had their pay reduced since the arrival of #COVID19.,2020-04-20 18:34:10,Twitter Web App,5,25
Ensuring that local news outlets remain viable at this critical time is not only a matter of fairness but is essential to public health.  https://t.co/efjnLj01Qu,2020-04-20 18:34:10,Twitter Web App,16,60
That’s why ensuring that local news outlets remain viable at this critical time is not only a matter of fairness but is essential to public health.,2020-04-19 19:34:57,Twitter Web App,11,38
Local newspapers local radio and local television stations provide important local content. People rely on them to cover school and business closures communicate public health guidance and combat life-threatening misinformation.,2020-04-19 19:34:57,Twitter Web App,9,39
Local newspapers TV &amp; radio have been hit hard by the COVID-19 crisis are essential for maintaining a well-informed public &amp; deserve our help. That’s why I joined @SenJohnKennedy @SenAmyKlobuchar &amp; @JohnBoozman in urging Senate Leadership to support local media outlets. https://t.co/8IlfR0lnAb,2020-04-19 19:34:56,Twitter Web App,43,110
We need to do more to ensure our democracy is prepared to overcome the challenges brought on by the COVID-19 pandemic. Nobody should have to choose between their health and the right to vote.  https://t.co/TueVHWqcT0,2020-04-17 21:34:08,Twitter Web App,17,70
The president is wrong. The 'pan' in pandemic means it doesn't stop at borders. We need to have a global response to stop the virus.  https://t.co/bKEfcjF9yZ,2020-04-16 17:56:09,Twitter Web App,28,99
Airports in Washington state will receive more than $310 million from the #CARESAct to mitigate impacts from the #COVID19 pandemic.  https://t.co/8rmUtD9M6U,2020-04-16 16:21:51,Twitter Web App,7,29
I urged the Trump Administration to develop a national real-time public-facing inventory of #COVID19 diagnostic tests &amp; results. We need this transparency to anticipate problems in the national testing supply chain &amp; help the federal gov’t address potential testing shortages.,2020-04-15 23:31:18,Twitter for iPhone,17,73
Washington state is still facing a lack of #COVID19 testing kits and supplies - including PPE and testing swabs -  needed to conduct adequate tests.,2020-04-15 23:31:18,Twitter for iPhone,48,118
Reminder‼️The tax filing deadline has been extended to July 15th due to the #COVID19 pandemic.,2020-04-15 21:23:07,Twitter for iPhone,10,29
Specialty crop producers are facing significant financial losses as a result of #COVID19. @USDA must consider these needs when providing #CARESAct disaster funding &amp; ensure that specialty crop producers receive assistance commensurate with the losses they are facing. https://t.co/uPGzau8Qyh,2020-04-15 20:50:30,Twitter Web App,13,20
New today❗️An app by @USTreasury helps you track your #StimulusPayment &amp; submit direct deposit information so that you can get your economic impact payment directly to your bank account. https://t.co/tCjsqZX1FL,2020-04-15 18:39:41,Twitter Web App,11,15
There must be more robust efforts across the federal government to respond to hateful actions against Asian Americans. That’s why I asked @USCCRgov to issue guidance to federal agencies on preventing anti-Asian discrimination.,2020-04-13 17:47:50,Twitter Web App,7,22
There has been a surge of reports of discrimination against Asian Americans related to the #COVID19 pandemic but no concerted effort from federal agencies to address this problem.  https://t.co/3c62tjjPWJ,2020-04-13 17:47:49,Twitter Web App,10,35
Wishing a happy and safe Easter to all celebrating today! #Easter2020 https://t.co/RZSeWQIb4I,2020-04-12 15:04:41,Twitter Web App,6,34
It is essential that food banks be enabled &amp; encouraged to continue their work. I asked @HUDgov Secretary Carson to modify food banks’ income verification requirements to allow them to take necessary precautions to keep their clients volunteers and staff healthy.,2020-04-11 19:06:20,Twitter for iPhone,11,31
Food banks in WA &amp; around the country are on the front lines of the #COVID19 crisis &amp; have been managing increased demand due to the economic ramifications of the outbreak.     https://t.co/kzEyMGZFDA,2020-04-11 19:06:20,Twitter for iPhone,15,34
I asked @SecAzar to swiftly begin implementing the $100 billion Public Health &amp; Social Services Emergency Fund from the #CARESAct. WA providers have been on the front lines fighting the outbreak for months &amp; they need access to funds as soon as possible.  https://t.co/rWlSs6OsNa,2020-04-09 19:06:58,Twitter Web App,10,34
Last week I urged @USTreasury to make #COVID19 cash assistance payments to Social Security recipients without requiring them to file tax returns &amp; was glad to see this change made. Veterans &amp; SSI recipients deserve the same treatment.,2020-04-09 15:07:51,Twitter Web App,0,2
This would be a fast &amp; effective way to provide desperately needed help to Washington’s 144000 veterans &amp; 149000 Supplemental Security Income recipients.    https://t.co/P1zUCON2MJ,2020-04-09 15:07:50,Twitter Web App,0,6
The Trump Administration should issue the direct cash assistance included in the #CARESAct automatically to veterans receiving benefits from the VA &amp; to Supplemental Security Income recipients without requiring them to file tax returns.,2020-04-09 15:07:50,Twitter Web App,4,22
We must ensure more robust safety precautions for our frontline transit workers. I urged @FTA_DOT to update its guidance on the use of PPE to match @CDCgov guidance &amp; to proactively help transit agencies acquire #PPE and provide it to their workers.   https://t.co/YFqrdw8YwE,2020-04-08 21:36:14,Twitter Web App,6,30
Chag Pesach Sameach to everyone celebrating #Passover in Washington across the country and around the world this evening! https://t.co/OxQ5PJ1ux3,2020-04-08 18:43:43,Twitter Web App,12,33
‼️ @StrongHeartsDV Updated Hours: Helpline now open 7 days a week from 5am-8pm PT. https://t.co/SxySkPfPi9,2020-04-07 21:43:15,Twitter Web App,9,24
Glad to see that Washington state’s 29 federally-recognized Tribes will receive a combined total of more than $12 million in funding for critical affordable housing programs from the #CARESAct.   https://t.co/HNqOWduvO9,2020-04-07 21:00:51,Twitter Web App,17,49
Domestic Violence resources: @NDVH 24/7 Helpline: 800-799-7233 855-812-1001(videophone) or 800-787-3224 (TTY) @StrongHeartsDV Native Helpline 9am-5:30pm M-F: 844-762-8483.  @WSCADV COVID-19 domestic violence resource page: https://t.co/at4IXoVmQm https://t.co/dIzNSdQmWq,2020-04-07 19:02:02,Twitter Web App,10,17
We must send a clear message to domestic violence victims that you are not alone -- no matter who you are where you’re from or where you live. #VAWA4ALL,2020-04-07 19:02:01,Twitter Web App,7,17
It’s been over one year since the House passed the Violence Against Women Act and Mitch McConnell still hasn’t brought up the bill for a vote in the Senate. It’s long past time to reauthorize #VAWA  https://t.co/PfvEsTLRwz,2020-04-07 19:02:01,Twitter Web App,67,146
This National Public Health Week is a reminder that we must keep working to expand access to affordable #healthcare including #mentalhealth. This is particularly important in the midst of the #COVID19 pandemic. #NPHW https://t.co/bPX6GVMBHd,2020-04-06 23:52:52,Twitter for iPhone,8,25
Thanks to the #CARESAct WA state &amp; local law enforcement agencies are now eligible for more than $16.6 million in funding that can help address local needs and be used to purchase PPE &amp; other critical medical items. Application &amp; more info from USDOJ at: https://t.co/YsKQzy2An6,2020-04-06 20:56:56,Twitter Web App,13,31
The CARES Act provides critical relief to Tribal governments impacted by the #COVID19 pandemic. As the administration implements this law &amp; deploys critical funding it must respect Tribal sovereignty &amp; engage in meaningful robust &amp; rapid government-to-government consultation.,2020-04-06 15:55:20,Twitter Web App,10,33
Washington beware of scammers exploiting the #COVID19 crisis for personal gain. Here are common scams to watch for - visit https://t.co/PX3qmoVGqu for more info. https://t.co/DXeNbp5PcZ,2020-04-03 21:55:59,Twitter for iPhone,24,29
More than $52 million for affordable housing funds is coming to Washington from the #COVID19 CARES Act - 31 cities and counties in Washington in addition to the state will get this funding. More info ➡️https://t.co/z7siwsRxOv https://t.co/tKCeUfslyI,2020-04-03 20:14:48,Twitter Web App,16,28
Watch @SesameStreet explain how to make your family count &amp; help support your neighborhood by filling out the #Census2020 🙂 #CensusDay2020 https://t.co/d01Crmq5QU,2020-04-01 21:53:16,Twitter Web App,8,26
Washingtonians have you completed your census form? Full participation is critical for our future and it’s fast &amp; easy to complete online or by phone or mail. #CensusDay2020 #Census2020  ➡️ https://t.co/Vnh6AxFnZN,2020-04-01 16:07:49,Twitter Web App,26,64
The waiver would provide needed flexibilities to respond to the #COVID19 outbreak protect Washingtonians and limit the spread of this disease.  https://t.co/uqrPMruveV,2020-04-01 15:44:08,Twitter Web App,10,16
I joined a bipartisan group of my WA colleagues to urge @CMSgov to grant our state’s waiver request to establish a #COVID19 Disaster Relief Fund &amp; help residents access necessary testing &amp; treatment.,2020-04-01 15:44:08,Twitter Web App,10,56
Who you are should never be grounds for discrimination or hatred. Together we must continue fighting for a more inclusive future. #TransDayofVisibility #TDOV https://t.co/GwR0khbBf1,2020-04-01 00:54:55,Twitter for iPhone,17,73
Improving fuel economy standards has spurred American innovation &amp; made our automakers more competitive internationally while benefiting families by reducing transportation costs in the long term. Lowering these standards moves us in the wrong direction.  https://t.co/k0dU8vuXpk,2020-03-31 21:50:58,Twitter Web App,14,33
Injecting uncertainty into the economy with this short-sighted action will degrade public health pollute our environment and negatively impact job growth. https://t.co/JmtJT0DnHj,2020-03-31 21:50:58,Twitter Web App,18,80
Today I want to thank all our doctors - particularly those on the front line of this #COVID19 crisis - who are working around the clock &amp; doing everything they can to help keep Washingtonians safe. #NationalDoctorsDay https://t.co/LC6oCXkyMh,2020-03-30 16:02:46,Twitter for iPhone,21,94
The #2020Census is underway and full participation is critical to our democracy and our communities. No communities should feel intimidated or disenfranchised – the Census is confidential and does not include a citizenship question. Washington it’s time to #GetCounted https://t.co/08xi2YbMVU,2020-03-29 18:40:09,Twitter for iPhone,11,29
We must ensure that Americans have access to life-saving blood transfusions in the midst of the #COVID19 outbreak.,2020-03-28 16:21:37,Twitter Web App,1,30
The #COVID19 pandemic has spurred a nationwide shortage of donated blood but @US_FDA continues to enforce a discriminatory donor deferral policy. I urged FDA to update its blood donor policies in favor of ones that are grounded in science &amp; allow all healthy Americans to donate. https://t.co/4SvgbQB2bh,2020-03-28 16:21:36,Twitter Web App,16,78
Glad to see the #COVID19 relief package signed into law. This relief is desperately needed &amp; will help our state respond to this crisis.  Resources &amp; information on how this bill helps Washingtonians⬇️  https://t.co/ZMhdTkq4Tl,2020-03-28 15:53:20,Twitter Web App,35,102
We have already seen layoffs and fishing season closures and it’s crucial that we support fishermen and ensure they have access to emergency grants &amp; other assistance as they face the unprecedented challenges of this pandemic.,2020-03-27 21:14:42,Twitter for iPhone,5,33
Thousands of fishermen in the Pacific Northwest &amp; across the nation will now have access to funding and other forms of financial relief from @NOAA.   https://t.co/ySbvOGZDpD,2020-03-27 21:14:42,Twitter for iPhone,16,54
I asked @DeptofEd to provide clear guidance to districts and lead agencies to ensure that students with disabilities receive appropriate education during the #COVID19 crisis.  https://t.co/v4oMCivi7j,2020-03-27 17:55:12,Twitter Web App,3,18
As schools close and transition to online instruction to help control the spread of #COVID19 I’m concerned about the impact of these closures on students with disabilities.   https://t.co/QCGyKp774e,2020-03-27 17:55:12,Twitter Web App,7,33
https://t.co/Mm0hYGBF7A,2020-03-27 16:43:12,Twitter Web App,2,10
This week I joined @RepAdamSmith to ask the CEO of the Northwest Detention Center in Tacoma what steps they are taking to plan mitigate and respond to any potential #COVID19 outbreak at NWDC and to assure the health and wellbeing of detained individuals &amp; staff at NWDC.,2020-03-27 16:43:12,Twitter Web App,6,52
In WA that means workers will have 39 weeks of unemployment insurance. More than 3.7 million Washingtonians will get $1200 checks and parents will get an additional $500 per child. Americans need help making ends meet while they help us beat this #COVID19 virus.,2020-03-26 23:50:07,Twitter Web App,5,26
The relief package the Senate passed last night will provide immediate help by getting laid off workers an additional $600 a week on their unemployment benefits until July 31 and provide an additional 13 weeks of benefits.,2020-03-26 23:50:07,Twitter Web App,5,34
#COVID19 is impacting every part of our lives and today’s jobless report underscores the economic effects on Washingtonians. Last week alone unemployment claims in our state increased by 843 percent.   https://t.co/BBwrMK96P1,2020-03-26 23:50:06,Twitter Web App,10,32
The state of Washington desperately needs this help and  Democrats pushed for more oversight and transparency to make sure we knew where these dollars were being spent.   More on how this #COVID19 bill helps Washingtonians here: https://t.co/O2hLcDuutG https://t.co/izyy2HmSzq,2020-03-26 22:47:37,Twitter Web App,10,60
We all know there’s more work to do. But let's get these dollars to the front line to our hospitals to our states for better equipment &amp; for more supplies. Let's support them in fighting this disease and seeing this through to the other side. https://t.co/E7Hj74c3Oe,2020-03-26 16:27:18,Twitter Web App,11,49
On the #COVID19 relief package - We must not only take care of unemployment benefits but also make sure that people experiencing unemployment have access to health care. We can't be in the midst of a pandemic and not give people affordable access to #healthcare.,2020-03-26 16:22:08,Twitter Web App,26,129
We must try to lessen the economic impacts that our small businesses are feeling as a result of social distancing or shelter-in-place. They’ve been hit hard &amp; are counting on us so I hope @SBAgov will urgently dispatch the $360 billion in grants &amp; loans in this program. https://t.co/I9aqra8Cx8,2020-03-26 01:25:26,Twitter Web App,15,51
We are responding today with more help for our state - more money for hospitals for protective gear for testing and to support our state local and Tribal governments as they continue the effort to try to stop this disease.,2020-03-26 00:18:14,Twitter Web App,7,47
Today I spoke on the Senate floor about this #COVID19 relief package. The state of Washington desperately needs this help. People on the front lines of the crisis have already paid such a heavy price. https://t.co/U135GHC363,2020-03-26 00:18:14,Twitter Web App,18,127
Hospitals in my state are already overwhelmed by the #COVID19 crisis. We need more beds but we also need personnel and equipment to meet the urgent &amp; growing needs of our communities.,2020-03-25 00:41:00,Twitter for iPhone,9,83
Today I joined my colleagues in the Washington delegation to urge @FEMA Administrator @FEMA_Pete to provide sufficient medical personnel &amp; equipment as part of any field hospitals or clinics being deployed to Washington for the #COVID19 outbreak.   https://t.co/aZ8WYRWLsn,2020-03-25 00:40:59,Twitter for iPhone,23,110
I urged President Trump and Vice President Pence to mobilize private industry to manufacture supplies &amp; equipment such as PPE &amp; ventilators that are needed to address the #COVID19 crisis.   https://t.co/PMBlf4hUku,2020-03-23 23:27:46,Twitter for iPhone,10,61
The #COVID19 outbreak is placing substantial strain on state local &amp; tribal public health agencies’ already-limited resources as they lead the response to the pandemic. The health care system is woefully under-resourced &amp; is short of testing supplies and equipment.,2020-03-23 23:27:46,Twitter for iPhone,11,49
10 years ago today the Affordable Care Act was signed into law. The #ACA has expanded #healthcare coverage to millions of Americans driven down costs and ensured that people can’t be discriminated against because of their medical history. #ACA10,2020-03-23 20:21:59,Twitter Web App,11,95
Certain restrictions are required to prevent the spread of #COVID19 but we must ensure that businesses - including hospitals &amp; medical equipment providers - that rely on cross-border travel for essential supplies and personnel do not see their supply chains compromised.,2020-03-23 19:23:40,Twitter Web App,5,33
This week I urged President Trump to coordinate &amp; communicate with the businesses and individuals affected by the #COVID19 U.S.-Canadian border closure.   https://t.co/Rme2Ro75HL,2020-03-23 19:23:40,Twitter Web App,5,32
Glad to see that the waiver was approved. Washington is moving rapidly to address this crisis and facing extreme stress to the health care system. The waiver will help the state ensure hospitals have the needed capacity to treat patients address shortages &amp; promote telehealth.,2020-03-21 17:38:00,Twitter for iPhone,10,72
This week I urged CMS to grant a waiver that would give our state’s health care system more flexibility to meet the demands of the #COVID19 outbreak and protect Washington state families.  https://t.co/DjnSq5ENPn,2020-03-21 17:38:00,Twitter for iPhone,19,75
#SmallBusiness resources for WA (6/6) - You can visit my website for an overview of these and many more current federal state and local resources available to small businesses throughout WA.  https://t.co/Lz0KreagTO,2020-03-21 00:20:15,Twitter Web App,4,14
#SmallBusiness resources for WA (5/6) - Washington’s Small Business Liaison Team has also put together a comprehensive resource page for small businesses across WA dealing with #COVID19 https://t.co/QBVP8Go7Zq,2020-03-21 00:20:15,Twitter Web App,2,8
#SmallBusiness resources for WA (4/6) - @WSBDC business advisors are providing assistance with @SBAgov disaster loans &amp; free webinars to help small businesses navigate the economic impacts of #COVID19 https://t.co/b6yfnLeuPu,2020-03-21 00:20:15,Twitter Web App,4,6
#SmallBusiness resources for WA (3/6) – Local #SBA offices in Seattle Spokane and Portland offer small business loan and assistance programs &amp; can help small businesses access &amp; apply for the capital they need. @SBASeattle @SBA_Portland https://t.co/Bx0WtUQOIl,2020-03-21 00:20:14,Twitter Web App,2,4
#SmallBusiness resources for WA (2/6) - @SBAgov is providing disaster loans to small businesses negatively impacted by #COVID19. Learn more: https://t.co/LJZDjp0IQk https://t.co/CuqfOIUkqP,2020-03-21 00:20:14,Twitter Web App,5,5
#SmallBusiness Resources for WA (1/6) - Small businesses are a pillar of our economy &amp; we must do more to support them as we continue to fight the #COVID19 crisis. Here’s a list of resources available for small business owners ➡️,2020-03-21 00:20:14,Twitter Web App,17,46
We have a responsibility to protect our elections and ensure that every citizen across our country has a say in their government. That’s why I cosponsored legislation with @SenAmyKlobuchar and @RonWyden to ensure Americans can vote amidst the #COVID19 crisis. https://t.co/uBieu4tSkF,2020-03-19 19:32:50,Twitter Web App,46,99
This is another good step as we continue to fight the #COVID19 crisis but Congress still has more to do to support workers small businesses and critical industries that employ millions of Americans.,2020-03-18 23:52:30,Twitter Web App,1,20
It also includes funding to help states deliver meals to seniors stuck at home and continue school lunch programs because people shouldn’t have to choose between flattening the curve and eating.,2020-03-18 23:52:30,Twitter Web App,5,32
Today I voted for the #FamiliesFirstCoronavirusResponseAct. I’m glad that communities that really need our help on testing and health care like Tribal communities and veterans will be receiving funding. #COVID19WA #COVID19Seattle  https://t.co/yM57cf9aED,2020-03-18 23:52:29,Twitter Web App,15,75
As the Trump administration responds to the #coronavirus outbreak they should meaningfully engage with Native communities and Tribal leaders to ensure they have access to #COVID19 resources &amp; up-to-date information regarding the presence of COVID-19 in their communities. https://t.co/nLkj4rUCy5,2020-03-18 17:24:29,Twitter for iPhone,26,83
UPDATE: SBA federal disaster loans are now available to small businesses statewide.   Find out more here: https://t.co/p1L6bgad8Q https://t.co/7z1LalFKyt,2020-03-17 22:26:12,Twitter for iPhone,223,302
Happy #StPatricksDay Washington - stay safe &amp; practice social distancing!,2020-03-17 19:35:12,Twitter for iPhone,4,39
I urged @HHSgov @SecAzar to provide timely delivery of personal protective equipment. I remain concerned that the current supply of PPE is inadequate to meet the need in Washington state. #COVID19WA #COVID19Seattle    https://t.co/Ndp2HYUcyR,2020-03-17 16:21:41,Twitter for iPhone,12,44
