Missouri received nearly $9.9 million in @CDCgov funding from Congress’ phase 1 #coronavirus legislation. Now our state will receive an additional $3.9 million to continue our coronavirus response efforts. https://t.co/Q4yMojx0tz,2020-04-07 18:27:56,Twitter Web App,5,16,corona; 
.@CDCGov just announced that Missouri will receive an additional $3.9 million for coronavirus response efforts. This funding will be used to purchase medical equipment improve testing help hospitals meet staffing needs and more.,2020-04-06 22:35:03,Twitter Web App,21,85,corona; 
Independence residents – the Independence Medical Reserve Team #COVID19 hotline is (816) 325-7033 https://t.co/AS8SRZdAdg,2020-04-06 17:41:49,Twitter Web App,4,4,covid; 
Missouri farmers and ranchers play a vital role in supporting our nation’s food supply chain. That’s why I’m calling on @USDA to work quickly to get emergency funding to @MOCattle producers facing market volatility caused by the #coronavirus pandemic,2020-04-02 19:56:58,Twitter Web App,13,46,corona; 
Our country is facing a health crisis unlike anything we have ever seen. Americans are understandably concerned about the coronavirus pandemic but I have no doubt we will rise to this challenge together. https://t.co/n6elm4Cv1x,2020-04-02 18:48:16,Twitter Web App,15,60,corona; 
Was on air with @HughHewitt this morning talking about the #coronavirus relief package listen here ⬇️ https://t.co/pVjpYkvtyl,2020-04-01 18:49:29,Twitter Media Studio,5,10,corona; 
Rural health care providers are on the frontlines in the fight against the #coronavirus. We need to ensure these clinics and hospitals – a lifeline for thousands of Missourians – have the resources they need to continue providing care during this unprecedented epidemic.,2020-03-31 16:42:11,Twitter Web App,10,53,corona; 
On Friday @realDonaldTrump signed phase 3 of the #coronavirus response into law. Here’s what was in each of the 3 phases https://t.co/1kC78UxJjv,2020-03-30 22:13:28,Twitter Web App,30,98,corona; 
While we are all focused on keeping our families &amp; communities healthy during the #coronavirus pandemic we cannot fail in our responsibility to keep kids safe and report abuse and neglect. The Child Abuse and Neglect Hotline is 1-800-392-3738. https://t.co/zQQZUQeXXb,2020-03-30 19:36:24,Twitter Web App,11,23,corona; 
Today is #NationalDoctorsDay. To all the doctors putting themselves at risk to save the lives of others and working tirelessly during the #coronavirus pandemic thank you. Our country is deeply grateful for you and all our healthcare workers. https://t.co/jwppSrsFn4,2020-03-30 17:18:58,Twitter Web App,17,38,corona; 
The latest coronavirus relief package extends funding for Certified Community Behavioral Health Clinics which provide a wide range of services like 24/7/365 crisis support immediate screenings risk assessments and diagnoses.,2020-03-27 21:41:20,Twitter Web App,4,17,corona; 
As we continue to fight the #coronavirus we have to make sure people who have a mental health or addiction issue continue to have access to the help they need.,2020-03-27 21:41:20,Twitter Web App,9,44,corona; 
#CARESAct will also help America's farmers and their families who have been impacted by #coronavirushttp://brownfieldagnews.com/news/blunt-says-senate-worked-hard-to-include-ag-aid/ via @Brownfield,2020-03-27 20:50:00,TweetDeck,4,19,corona; 
The Senate passed and @realDonaldTrump quickly signed phases 1 and 2 to combat #coronavirus. Soon he’ll also sign phase 3. Here’s how each phase helps Americans https://t.co/cAgENkXO6N,2020-03-27 18:47:10,Twitter Web App,54,115,corona; 
Missourians are appreciating President Trump’s daily proactive leadership in the #coronavirus crisis and the support he’s getting from Vice President Pence and our great healthcare professionals -- Dr. Fauci Dr. Birx Dr. Redfield and others -- is making a real difference.,2020-03-27 14:17:23,Twitter Web App,45,252,corona; 
Talked with @MarcCox971 about the unanimous vote on the latest package to combat #coronavirus. Listen here: https://t.co/QPXAR0mLAB,2020-03-26 23:23:53,Twitter Media Studio,6,15,corona; 
Phases 1 &amp; 2 signed into law by @RealDonaldTrump Phase 3 to combat the #coronavirus pandemic passed the Senate unanimously and is now heading to the House. More info on #CARESAct: https://t.co/VKaSTnq3Lf,2020-03-26 19:30:00,TweetDeck,4,8,corona; 
The #coronavirus epidemic has brought to light vulnerabilities in our medical supply chain that we have to address.,2020-03-26 13:56:43,Twitter Web App,8,71,corona; 
The Senate just unanimously passed the 3rd #coronavirus response bill to do that. Here’s what is in the #CARESAct and how it will help: https://t.co/VKaSTn8sTH,2020-03-26 03:54:45,Twitter Web App,11,17,corona; 
The #coronavirus pandemic poses the greatest threat to Americans that we’ve seen in decades. We have to speed relief to everyone who needs it - from individuals and families to small businesses and employees to healthcare providers.,2020-03-26 03:54:45,Twitter Web App,7,52,corona; 
Remember: Missouri’s 24/7 #COVID19 hotline is 877-435-8411,2020-03-25 21:20:08,Twitter Web App,13,13,covid; 
The entire Missouri delegation joined together to call on @POTUS to support @GovParsonMO’s disaster declaration so our state can combat #COVID19. Read the full letter here https://t.co/K3GZP6tKjA,2020-03-25 20:19:21,Twitter Web App,11,22,covid; 
We need to ensure patients can get tested for #coronavirus and health care providers have the personal protective equipment they need.,2020-03-24 22:27:46,Twitter Web App,5,16,corona; 
We are facing an unprecedented emergency with #COVID19. We need to ensure families and individuals are able to meet their needs.,2020-03-24 22:27:46,Twitter Web App,7,33,covid; 
In case you missed it this morning I was on air with Pete Mundo to share the latest on the Senate’s work to combat #COVID19 and provide relief to American families and workers https://t.co/pKtljUMi6G,2020-03-24 21:41:51,Twitter Media Studio,4,6,covid; 
It’s time to stop putting an ideological wish list that has nothing to do with combating #COVID19 ahead of protecting Americans from this pandemic. Senate Democrats need to vote yes on the #Coronavirus Aid Relief and Economic Security Act.,2020-03-24 15:53:42,Twitter Web App,116,422,covid; corona; 
LIVE on @TomBradleyShow sharing an update on Senate’s work to combat #COVID19 https://t.co/yGAn5oKW3t,2020-03-24 12:35:46,TweetDeck,2,3,covid; 
TUNE IN: I’ll be on @TomBradleyShow this morning to talk about the latest on #COVID19 and the Senate’s ongoing efforts to provide relief for workers &amp; families https://t.co/yGAn5oKW3t,2020-03-24 12:31:00,TweetDeck,2,2,covid; 
I spoke on the phone with @MOHospitals this morning to talk about our state’s response to #COVID19 and how we can work together to make sure they have the support they need as they fight the #coronavirus.,2020-03-23 19:52:43,Twitter Web App,11,43,covid; corona; 
In the last few weeks the Senate delivered on bipartisan legislation to combat #COVID19 &amp; provide relief to families #smallbiz owners &amp; workers.,2020-03-23 18:26:07,Twitter Web App,7,38,covid; 
We’re 1 week into our 15-day effort to slow the spread of #COVID19. Following @CDCgov &amp; @WhiteHouse’s guidance is more critical than ever to combat this: 🧼 Wash your hands 🏠 Stay at home ↔ Practice social distancing 🚫 Don't touch your face https://t.co/dXFmBbFiMB,2020-03-23 15:59:07,Twitter Web App,8,15,covid; 
As our nation continues combatting the #coronavirus @SenStabenow and I are working together to make sure people with a health or addiction issue can get the help they need. More in our @TheHill op-ed: https://t.co/EzVtHlvhmS,2020-03-21 16:48:16,Twitter for iPhone,6,18,corona; 
⬇Important #coronavirus resources⬇  https://t.co/Hiae3usYXo  MO hotline: (877) 435-8411 MO chatbot: https://t.co/iEPiuteY2x MO Department of Health &amp; Senior Services ( @HealthyLivingMo): https://t.co/IcQy9QwTpf Info for small business owners/workers: https://t.co/TILFxBq6ik,2020-03-20 18:16:55,Twitter Web App,1183,4396,corona; 
I’ll continue working closely with my colleagues to get this phase 3 #coronavirus response legislation to the president’s desk as soon as possible.,2020-03-20 16:55:31,Twitter Web App,1,10,corona; 
I’m pleased that bipartisan legislation I helped introduce to protect the nation’s medical supply chain was included in the comprehensive coronavirus package which was introduced last night.,2020-03-20 16:55:30,Twitter Web App,1,12,corona; 
The #coronavirus pandemic is a direct reminder that protecting our nation’s medical supply chain is a priority for public health and national security.,2020-03-20 16:55:30,Twitter Web App,9,36,corona; 
As we respond to #coronavirus and prepare for future challenges we need to ensure our medical supply chain will allow us to provide the health care and protection we need. https://t.co/yjQOTAMNUw,2020-03-19 22:10:31,Twitter Web App,10,24,corona; 
“The State of Missouri is also working with the US Small Business Administration to make disaster loans for small businesses that have economic issues as a result of the coronavirus.” https://t.co/b0znaKqh5H,2020-03-19 20:54:01,Twitter Web App,11,12,corona; 
Senate sent @POTUS bipartisan bill aimed at combating #COVID19. Pres Trump immediately signed it:  ▶Free #coronavirus testing ▶Paid sick leave ▶Family leave for caregivers ▶Food assistance for the needy ▶Enhanced unemployment insurance  https://t.co/L0X3eBzFpV @newspressnow,2020-03-19 16:37:57,Twitter Web App,18,100,covid; corona; 
This is a sobering reminder of how serious the #coronavirus threat is and how important it is for everyone to do their part to help keep themselves and those around them safe. #ShowMeStrong,2020-03-18 22:37:19,Twitter Web App,4,14,corona; 
With news of the first COVID-19 death in Missouri our hearts are with all those who are mourning the loss of their loved one this evening.,2020-03-18 22:37:19,Twitter Web App,7,90,covid; 
⬇⬇ @WhiteHouse’s guidelines for all Americans to help slow the spread of #coronavirus ⬇⬇ https://t.co/rNpFGYbS70,2020-03-18 15:48:43,Twitter Web App,11,17,corona; 
Earlier this month the Senate passed emergency funding for #coronavirus response efforts. Today @CDCgov announced that nearly $9.9 million is headed to #MO to support our state's response to #COVID19 &amp; enhance public health safety measures. More info: https://t.co/xRQQsDkGnc,2020-03-16 20:33:37,Twitter Web App,17,32,covid; corona; 
The #coronavirus outbreak is an important reminder that protecting our nation’s medical supply chain is a public health &amp; national security priority. Today I cosponsored legislation that will help prevent shortages of vital life-saving medical supplies. https://t.co/uV8rj6L7nx,2020-03-12 20:56:32,Twitter Web App,8,34,corona; 
Always great to meet with Major General Donna Martin to discuss issues important to @FortLeonardWood and all who serve there. Appreciate all Gen. Martin is doing to enhance #COVID19 preparedness measures and maximize public safety on #FLW. https://t.co/IP2mhWhFxP,2020-03-12 16:48:04,Twitter Web App,2,16,covid; 
.@CDCgov on how to stop the spread of respiratory diseases like #COVID19 https://t.co/l9CQLFZjIM,2020-03-10 22:45:00,TweetDeck,13,19,covid; 
I will remain in touch with @GovParsonMO Dr. Page and local officials to ensure they have what they need to respond. Additional information on the coronavirus and how people can help protect themselves is available here: https://t.co/LSi7zGI6Td,2020-03-08 01:45:27,Twitter Web App,14,25,corona; 
While Missourians will understandably be concerned about today’s announcement on the first presumptive positive case of #coronavirus in MO there is no need to panic. @GovParsonMO &amp; St. Louis County Executive Dr. Sam Page are well prepared to meet this public health challenge,2020-03-08 01:45:26,Twitter Web App,34,134,corona; 
In #SGF this morning I joined Speaker Haahr to give an update on #coronavirus response efforts. As chair of the subcommittee that funds @HHSGov &amp; @CDCGov I’ve been working to ensure local state and federal officials have the support they need to respond to this disease. https://t.co/B1Oe35F0Zr,2020-03-06 18:34:54,Twitter Web App,4,22,corona; 
Our number one priority in the Congress is keeping Americans safe. As the #coronavirus continues to spread we have to be sure we have the resources in place to respond quickly and effectively. My statement on the coronavirus emergency funding bill: https://t.co/JuXi1TLafj,2020-03-04 19:43:35,Twitter Web App,3,25,corona; 
Congress needs to act quickly to provide emergency funding for #coronavirus response efforts. More from @Missourinet:https://t.co/OmH2NpneJX,2020-03-04 19:25:15,Twitter Web App,1,8,corona; 
I’m confident that if our nation’s infectious disease experts –the best in the world- have the resources &amp; flexibility they need to respond to #coronavirus they will continue to provide the best response possible in an incredibly challenging environment. https://t.co/xDFnFe2PlU,2020-03-03 22:17:30,Twitter Web App,31,125,corona; 
ICYMI I was on with @McGrawMilhaven yesterday to talk about our country’s response to the coronavirus https://t.co/bKfD1YvTua,2020-02-28 21:42:50,Twitter Media Studio,3,13,corona; 
As chairman of the appropriations subcommittee that funds @HHSGov I’m committed to working with my colleagues and the Trump administration to ensure adequate funding is available to meet #coronavirus response needs.,2020-02-25 22:35:06,Twitter Web App,4,17,corona; 
February is #AmericanHeartMonth. Coronary heart disease (CHD) affects 344000 people in Missouri and is the leading cause of death for both men and women in the U.S. But CHD is largely preventable. Here’s how we can keep #OurHearts healthy: https://t.co/UrbxcxKvqi,2020-02-04 21:29:21,Twitter Web App,3,10,corona; 
