El Dr. Ben Reeser de Arizona creó un dispositivo para proteger a los trabajadores de salud del coronavirus. Para donar y ayudar a nuestros trabajadores de salud y socorristas valientes visite: https://t.co/aShVl3XFiG https://t.co/l1pf8zjwUg,2020-04-04 00:14:00,TweetDeck,4,9
Incredible Arizona Dr. Ben Reeser created a device to protect health care workers from contracting coronavirus. To donate and help our brave health workers and first responders visit: https://t.co/aShVl3G3U6 https://t.co/l1pf8zB7LO,2020-04-04 00:14:00,TweetDeck,12,56
Just now: @dougducey clarifies his executive order. By tmrw 5 pm closing these non-essential businesses to follow CDC guidance re: social distancing and #stayathome:  Barbers Cosmetology Hairstyling Nail Aesthetic &amp; Tanning salons Tattoo parlors Spas Massage parlors,2020-04-03 21:37:57,Twitter for iPhone,56,333
We all should stay home as much as possible. Social distancing is the best tool we have to fight this pandemic. https://t.co/OJUvbSme7s,2020-04-03 21:30:00,TweetDeck,16,85
So grateful to work with Arizona defense leaders and companies who are stepping up to help in the fight against the coronavirus. https://t.co/sStnF7obiG,2020-04-03 21:25:51,TweetDeck,10,57
Medical experts doctors and health care providers including @DignityHealthAZ are highlighting the importance of social distancing to help #flattenthecurve. https://t.co/AgXF6Fs4It,2020-04-03 19:15:00,TweetDeck,12,42
.@AZTourismNews creó una página web para conectar a los trabajadores de la industria turística a empleos. Encuentre empleos disponibles inmediatos aquí: https://t.co/QUmLC0OMTg,2020-04-03 18:10:00,TweetDeck,1,3
.@AZTourismNews set up a website to connect displaced tourism industry workers with open jobs. Find immediate job openings here:  https://t.co/QUmLC0OMTg,2020-04-03 18:10:00,TweetDeck,4,6
Our website – https://t.co/HZWAXR3594 – has coronavirus resources. Arizonans can find information on tax filing health insurance unemployment small businesses and more. https://t.co/bqpoUw0x0K,2020-04-03 17:00:00,TweetDeck,19,63
The administration must quickly implement the CARES Act to provide relief to rural Arizona hospitals and providers. https://t.co/oKbxd4W9oH,2020-04-03 16:05:15,TweetDeck,16,68
We’re hearing directly from local leaders to make sure they get the health resources food assistance and small business support needed to fight coronavirus. https://t.co/7r2pcgMiAT,2020-04-03 13:20:22,TweetDeck,8,38
¡Gracias @ohsobrewerygilbert por proveer al sistema de hospitales de Banner Health con 100 galones de desinfectante de mano! https://t.co/J99hy5UWk1,2020-04-02 23:09:00,TweetDeck,3,6
Thank you @ohsobrewerygilbert for providing the Banner Hospital system with 100 gallons of hand sanitizer! https://t.co/J99hy5DkVr,2020-04-02 23:09:00,TweetDeck,32,186
.@BrooklynBedding de AZ hace camillas y mascarillas protectoras para ayudar a los trabajadores de salud con los pacientes del coronavirus. Oficiales de salud: contacten a Brooklyn Bedding aquí (https://t.co/waGVcLgYB1) si necesitan camillas de hospitales. https://t.co/b4gst3qz87,2020-04-02 20:42:00,TweetDeck,8,11
Arizona’s @BrooklynBedding makes hospital beds and protective masks to help health care workers care for coronavirus patients. Health officials: contact Brooklyn Bedding here (https://t.co/waGVcLyzZB) if you’re in need of hospital beds. https://t.co/b4gst3IawH,2020-04-02 20:42:00,TweetDeck,32,63
The administration needs to implement the CARES Act quickly to support Tribal communities. https://t.co/WuZVindNWc,2020-04-02 20:33:11,TweetDeck,10,52
We all need to stay home to protect ourselves our loved ones and our community. https://t.co/SL57et7Tjn,2020-04-02 18:33:00,TweetDeck,45,271
For up-to-date coronavirus information all Arizonans should listen to government scientists and specialists; they are experts and will help you stay safe healthy and calm. Be on the look-out for scams: https://t.co/EiDQMgV8ST,2020-04-02 17:05:00,TweetDeck,6,21
Para información actualizada sobre el coronavirus todos los arizonenses deben escuchar a los científicos y especialistas del gobierno; ellos son los expertos y le ayudarán a mantenerse a salvo saludable y tranquilo. Manténgase alerta sobre las estafas: https://t.co/EiDQMhcJKr,2020-04-02 17:05:00,TweetDeck,2,4
Following our pressure the Treasury Department announced it will follow the law and make sure all AZ Social Security beneficiaries automatically receive their cash payment. https://t.co/ztcbPAS2fX https://t.co/Den6172xjk,2020-04-02 15:54:15,TweetDeck,30,159
We’re leading the AZ delegation in urging the President to grant a Major Disaster Declaration for Arizona. https://t.co/IIyeVItrjM,2020-04-02 14:09:24,TweetDeck,18,90
We’re telling the IRS to follow the law. It must make cash payments available to AZ Social Security recipients who don’t file taxes. https://t.co/sEVMD1mzJr,2020-04-02 01:00:00,TweetDeck,24,152
.@arizonapbs is showing educational programming for students temporarily learning at home. https://t.co/V7t4NceJbI,2020-04-01 21:56:00,TweetDeck,5,15
.@arizonapbs está dando programación educativa para los estudiantes que están aprendiendo en casa temporalmente. https://t.co/V7t4Ncwk3g,2020-04-01 21:56:00,TweetDeck,2,3
Dueños de empresas pequeñas: soliciten al Programa de Protección de Cheques de Pago para apoyar a sus negocios y mantener a sus trabajadores empleados durante esta emergencia de salud pública. Encuentre un prestamista local aprobado aquí ⬇️  https://t.co/Sw9MjAvJtF,2020-04-01 21:46:54,TweetDeck,4,5
Tuvimos llamadas con docenas de organizaciones sin fines de lucro y socorristas de AZ para contestar preguntas sobre el CARES Act y escuchar cómo podemos ayudar a los que están en la frente de esta pandemia. Gracias por trabajar para mantener a los arizonenses sanos y saludables.,2020-04-01 21:45:24,TweetDeck,2,9
We hosted calls today with dozens of AZ nonprofits and first responders to answer questions about the CARES Act and hear how we can help those on the frontlines of this pandemic. Thank you for working to keep Arizonans safe and healthy.,2020-04-01 21:44:04,TweetDeck,9,112
Small business owners: apply for the Paycheck Protection Program to support your businesses and keep your workers employed during this public health emergency. Find an approved local lender here ⬇️ https://t.co/Sw9MjAvJtF,2020-04-01 20:56:36,TweetDeck,8,32
Cuidadores: aquí encontrarán recursos útiles del @AARP para ayudarlos a protegerse y a quienes cuidan. https://t.co/ARvzBrngzA,2020-04-01 20:15:06,TweetDeck,3,7
Caregivers: here are helpful resources from @AARP to help protect yourself and those you care for. https://t.co/FkYclJTsTf,2020-04-01 20:10:00,TweetDeck,8,23
Health care providers like @BannerHealth agree: social distancing is the most effective way to slow the spread of the virus. https://t.co/gYxRgaRDUw,2020-04-01 18:03:00,TweetDeck,15,61
Watch out for these seven coronavirus scams targeting businesses: https://t.co/rCiMKD6yyZ,2020-04-01 16:15:00,TweetDeck,7,17
Manténgase alerta estas siete estafas del coronavirus están dirigidas a los negocios: https://t.co/rCiMKD6yyZ,2020-04-01 16:15:00,TweetDeck,2,5
Because we pressed @FCC they are extending the deadline for health care providers to apply for rural health care and telehealth resources allowing Arizona health care providers on the front lines to focus on fighting coronavirus in their communities. https://t.co/dSHMN6oyTR,2020-04-01 14:58:39,TweetDeck,11,51
Social distancing is the # 1 way to #flattenthecurve. We all need to do our part and stay home. https://t.co/KuQhWnpydJ,2020-04-01 14:00:00,TweetDeck,18,83
La nueva iniciativa de “mindfulness” de @ASU une a las personas para conectarse en la red mientras practican el distanciamiento social. Aprenda más: https://t.co/eDQtWzs77E,2020-04-01 00:00:00,TweetDeck,3,10
.@ASU’s new mindfulness initiative brings people together online to connect and engage while social distancing. Learn more: https://t.co/eDQtWzawg6,2020-04-01 00:00:00,TweetDeck,6,15
.@ArizonaNurses need our help. By practicing social distancing we are protecting and supporting our state’s health care workers. https://t.co/Vk5YsDkXum,2020-03-31 21:10:00,TweetDeck,17,83
Dueños de empresas pequeñas: soliciten al Programa de Protección de Cheques de Pago (Paycheck Protection Program) para apoyar a sus negocios y mantener a sus trabajadores empleados durante esta emergencia pública de salud ⬇️ https://t.co/pPHDwhXS3q,2020-03-31 20:47:12,TweetDeck,3,0
Small business owners: apply for the Paycheck Protection Program to support your businesses and keep your workers employed during this public health emergency ⬇️ https://t.co/pPHDwhXS3q,2020-03-31 20:44:27,TweetDeck,31,43
Las aplicaciones de @100ClubAZ brindan servicios de emergencia y de salud mental crítica para los socorristas de Arizona. https://t.co/C9WhCUZB6t,2020-03-31 19:07:00,TweetDeck,1,10
.@100ClubAZ’s apps provide Arizona’s first responders critical mental health and emergency services. https://t.co/C9WhCUHZHT,2020-03-31 19:07:00,TweetDeck,2,16
Voluntarios increíbles están haciendo máscaras en sus casas para los trabajadores de salud. Mire este vídeo tutorial: (https://t.co/6pyykNNvq1) de @JoAnn_Stores y deje sus máscaras en una tienda cercana para ser donadas a hospitales locales (https://t.co/EIJhlYjVYs),2020-03-31 15:30:00,TweetDeck,4,17
Incredible volunteers are making homemade masks for health workers. Watch this video tutorial (https://t.co/6pyykNNvq1) from @JoAnn_Stores and drop your masks off at a store near you (https://t.co/EIJhlYjVYs) where they will be donated to local hospitals.,2020-03-31 15:30:00,TweetDeck,10,38
We’re urging the administration to improve COVID-19 response collaboration with the 22 federally recognized Tribes in Arizona. https://t.co/fy1veeMjyG,2020-03-31 15:04:05,TweetDeck,38,192
Estas organizaciones increíbles están llevando alimentos a los arizonenses en necesidad. Aprenda más y participe: https://t.co/jDqgIgt8uq,2020-03-30 23:33:00,TweetDeck,6,17
These amazing organizations are getting food to Arizonans in need. Learn more and get involved: https://t.co/jDqgIgt8uq,2020-03-30 23:33:00,TweetDeck,8,21
This week we hired even more staff - expanding our team of social workers assisting Arizonans around the clock. If you need assistance email casework@sinema.senate.gov or visit https://t.co/HZWAXRkGxE. We're here to help. https://t.co/K0jiBp1D6o,2020-03-30 21:57:28,Twitter Web App,13,49
Si extraña ir al cine mientras practica el distanciamiento social ¡buenas noticias! Algunas películas originalmente planeadas para los cines están disponible para ver en la red. 🍿https://t.co/AmAa0EUW8k,2020-03-30 18:00:00,TweetDeck,5,5
If you’re missing the big screen while social distancing good news! Some films originally slated for theaters are available to stream. 🍿https://t.co/AmAa0FcxwU,2020-03-30 18:00:00,TweetDeck,6,30
Our website contains up-to-date information on the bipartisan coronavirus-response package: https://t.co/lD2wJoz9MU,2020-03-30 15:00:01,TweetDeck,8,31
Nuestra página web incluye información actualizada del paquete legislativo bipartidista en respuesta al coronavirus: https://t.co/lFZV9vBkNo,2020-03-30 15:00:00,TweetDeck,4,9
Heartbroken to hear of the loss of brave Phoenix Police Commander Greg Carnicle. Our thoughts are with his fellow officers Commander Carnicle’s loved ones and the community. https://t.co/cTC1xfTpRb,2020-03-30 13:55:23,TweetDeck,11,100
Garantizamos recursos para familias y trabajadores hospitales y proveedores de salud de primera línea de Arizona y las comunidades tribales y gobiernos locales a través de Arizona en el proyecto de ley en respuesta al coronavirus. Aprenda más aquí: https://t.co/lFZV9vjJVQ.,2020-03-30 01:00:00,TweetDeck,5,19
We secured resources for Arizona families and workers frontline hospitals and health care providers and Tribal communities and local governments across Arizona in today’s coronavirus-response bill. Learn more here: https://t.co/lD2wJoz9MU.,2020-03-30 01:00:00,TweetDeck,13,130
Proud to see Arizonans helping one another during these hard times. We will get through this together. https://t.co/aaD96QEO0M,2020-03-29 23:05:00,TweetDeck,13,63
Orgullosa de ver arizonenses ayudarse uno al otro durante estos momentos difíciles. Vamos a superar esto juntos. https://t.co/aaD96QWoSk,2020-03-29 23:05:00,TweetDeck,4,13
Parents: check out these education and entertainment resources for your kids. https://t.co/tqnrGYGR8V,2020-03-29 20:30:00,TweetDeck,8,19
Padres: revisen estos recursos de educación y entretenimiento para sus hijos. https://t.co/tqnrGYpfKl,2020-03-29 20:30:00,TweetDeck,2,1
Here are science-based tips to stay relaxed while practicing safe social distancing: https://t.co/EB4x1wcTwL,2020-03-29 18:00:00,TweetDeck,8,34
Aquí hay consejos basados en ciencia para mantenerse relajado al practicar la distancia social sana: https://t.co/EB4x1wcTwL,2020-03-29 18:00:00,TweetDeck,1,7
Arizonenses: aprendan más sobre el proyecto de ley en respuesta al coronavirus que garantiza inversiones en los hospitales y los trabajadores de salud de Arizona y que provee asistencia económica para familias trabajadores y empresas pequeñas de Arizona: https://t.co/4Xo63BfcS4.,2020-03-29 01:00:00,TweetDeck,6,27
Arizonans: learn more about the coronavirus response bill that secures investments in Arizona’s hospitals and health care workers and provides economic assistance for Arizona families workers and small businesses: https://t.co/lD2wJoz9MU.,2020-03-29 01:00:00,TweetDeck,23,101
Diana Brandt of @ArizonaFoodie launched a virtual tip jar to support local restaurant workers. Support a business near you: https://t.co/CzaNWjh2L7,2020-03-28 23:00:00,TweetDeck,7,29
Diana Brandt de @ArizonaFoodie lanzó una jarra de propina virtual para apoyar a los trabajadores locales de restaurantes. Apoya un negocio cerca de ti: https://t.co/CzaNWjyDCF,2020-03-28 23:00:00,TweetDeck,3,8
The president signed the CARES Act into law. Here's what it does and we’ll post updates on how AZ can access support. https://t.co/xMP051nrko,2020-03-28 20:09:01,Twitter Media Studio,25,106
.@ASU creó “ASU for You” - un recurso de aprendizaje en la red para todas las edades mientras nos quedamos en casa para #AplanarLaCurva y ayudar a salvar vidas. https://t.co/LEwK5ZeZbb,2020-03-28 17:26:20,Twitter Web App,2,5
.@ASU created “ASU for You” - an online learning resource for all ages to use while we stay home #flattenthecurve and help save lives. https://t.co/LEwK5ZeZbb,2020-03-28 17:24:56,Twitter Web App,8,22
El Arizona Restaurant Association (@azrestassn) lanzó AZ TakeOut Week. ¡Apoya a los restaurantes locales a través del estado y ordena para llevar! https://t.co/8EKuR9YVQC,2020-03-27 21:06:30,Twitter Web App,3,14
The Arizona Restaurant Association (@azrestassn) launched AZ TakeOut Week. Support local restaurants throughout the state and order pick-up! https://t.co/8EKuR9YVQC,2020-03-27 21:05:21,Twitter Web App,26,104
.@FTC must protect Arizona’s seniors from criminal fraudsters seeking to take advantage of this public health emergency. https://t.co/XTFeT03TTI,2020-03-27 18:00:29,Twitter Web App,4,18
Contestamos preguntas de 240+ alcaldes y líderes de AZ sobre la legislación de esta semana - desde Phoenix a Prescott Tucson a Casa Grande Yuma a Gila Bend a Lake Havasu City Payson Globe Willcox Jerome y Welton. Garantizaremos que AZ pueda accesar el apoyo necesario. https://t.co/p332iQjpgl,2020-03-27 17:00:28,Twitter Web App,9,30
We answered questions from 240+ AZ mayors &amp; leaders re: this week’s legislation- from Phoenix to Prescott Tucson to Casa Grande Yuma to Gila Bend to Lake Havasu City Payson Globe Willcox Jerome Welton and cities in-between. We’ll keep ensuring AZ can access needed support https://t.co/p332iQjpgl,2020-03-27 16:40:20,Twitter Web App,13,80
If you have questions about health insurance related to coronavirus visit our new page here: https://t.co/HZWAXRkGxE,2020-03-26 23:15:53,Twitter Web App,20,72
Familias y negocios de Arizona: la fecha límite para someter impuestos ha sido movida al 15 de julio para que se puedan enfocar en su salud inmediata y bienestar económico. https://t.co/x9dfNgxWeI,2020-03-26 20:17:39,Twitter Web App,7,11
AZ families and businesses: the tax filing deadline has been moved to July 15 so you can focus on your immediate health and financial well-being. https://t.co/x9dfNgxWeI,2020-03-26 20:16:51,Twitter Web App,8,36
Arizonenses: alerta a las llamadas automáticas pregrabadas ofreciendo pruebas del coronavirus falsas. Reporten las estafas aquí: https://t.co/LXfw4JH25L  https://t.co/nM0969Laxn,2020-03-26 18:31:10,Twitter Web App,6,2
Arizonans: watch out for robocallers offering fake coronavirus tests. Report scams here: https://t.co/LXfw4JH25L  https://t.co/nM0969Laxn,2020-03-26 18:30:27,Twitter Web App,20,27
El acuerdo bipartidista de ayer apoyará inmediatamente a los hospitales y trabajadores de salud de AZ en las primeras líneas a las familias cotidianas y las personas sin trabajo y asistirá a los empleadores afectados por las clausuras temporales. https://t.co/lFZV9vjJVQ,2020-03-26 16:38:13,Twitter Web App,6,17
Yesterday’s bipartisan agreement will immediately shore-up Arizona hospitals and health care workers on the frontlines support everyday families and individuals out of work and assist employers affected by temporary closures. Learn more here: https://t.co/lD2wJoz9MU,2020-03-26 16:37:34,Twitter Web App,19,127
@ReynaEMontoya @kyrstensinema Email casework@sinema.senate.gov for specific questions,2020-03-26 16:20:42,Twitter for iPhone,0,3
@ReynaEMontoya @kyrstensinema I’ll be posting summaries of the law on my website https://t.co/3c7phKKP74,2020-03-26 16:15:33,Twitter for iPhone,0,3
We pushed the federal government to cut the red tape and let AHCCCS hire quickly speed up health care delivery and let doctors telework. https://t.co/lmm0c9YrTy,2020-03-26 14:57:03,Twitter for iPhone,25,152
The Senate passed the Coronavirus Aid Relief &amp; Economic Security Act. It supports health care workers families local &amp; Tribal gov &amp; small business.  For more info. on the bill https://t.co/1t4EJtiJef  For coronavirus resources https://t.co/u8x8GmHavV https://t.co/Fi63jegyym,2020-03-26 03:49:42,Twitter Web App,50,258
@brahmresnik @drcarachrist It was not a suprise to anyone who has been watching the virus spread in coastal states nor to those who have followed my posts.   Here’s a site showing what’s coming in AZ - their data tracks w/ AZDHS data (because the science and the math is clear):  https://t.co/l3VE7iMK2K,2020-03-26 01:40:01,Twitter for iPhone,27,83
Personas mayores de Arizona: si está solo en casa y necesita ayuda revise estos recursos que están disponibles a través del Valle: https://t.co/4KI2lNLaq4,2020-03-25 22:31:25,Twitter Web App,7,8
AZ seniors: if you’re home alone and need help check out these resources available throughout the Valley: https://t.co/4KI2lNLaq4,2020-03-25 22:30:34,Twitter Web App,17,25
Estos restaurantes de Phoenix ofrecen descuentos y especiales para órdenes de pedidos en línea o de recoger: https://t.co/xXqNE5eII7,2020-03-25 21:57:11,Twitter Web App,1,8
These Phoenix restaurants offer discounts and specials for online orders or pick-ups: https://t.co/xXqNE5eII7,2020-03-25 21:56:10,Twitter Web App,9,30
In today’s bipartisan coronavirus response package we secured critical grants and loans for AZ small businesses helping protect jobs and paychecks for Arizonans. https://t.co/ieTM6vcnXh,2020-03-25 19:39:21,Twitter Web App,18,104
A relief fund for state local and Tribal governments was left out of the Senate’s original proposal. In this week's negotiations we secured a $150B relief fund for state local and Tribal governments as part of our coronavirus response package. https://t.co/0X8pJEpnmS,2020-03-25 19:35:27,Twitter Web App,17,105
The coronavirus response package will ensure Arizona families and workers have the support they need including: -Unemployment Insurance -Cash payments -Support for homeowners -Student loan assistance https://t.co/Dum4c2JBEo,2020-03-25 19:32:30,Twitter Web App,9,75
Our coronavirus response package gives health care providers the resources needed to fight this pandemic including $150B for: -hospitals clinics &amp; protective equipment for frontline health workers -testing supplies and life-saving treatments -COVID-19 research https://t.co/pQHebsbeUH,2020-03-25 19:31:14,Twitter Web App,12,36
The Senate is advancing the coronavirus response package.  Here’s what it does. https://t.co/DtwflbrHPh,2020-03-25 19:29:44,Twitter Web App,10,75
This week’s bipartisan Senate negotiations strengthened the Senate’s original proposal with critical new provisions for Arizona’s everyday families. https://t.co/Rb8iIjJWI4,2020-03-25 18:44:05,Twitter Web App,92,467
I’ll share the details of this package throughout the day &amp; my website https://t.co/3c7phKKP74 will provide info about how the bill can help your biz your family.,2020-03-25 12:46:21,Twitter for iPhone,37,346
Senate &amp; White House agree. We will vote on the largest relief package in US history today. It will be overwhelmingly bipartisan.  I’m extremely disappointed in those who played partisanship the last few days. It’s always wrong but in times of crisis it’s dangerous. Please stop,2020-03-25 12:46:21,Twitter for iPhone,569,4515
Arizonans: An Executive Order now delays eviction of renters impacted by COVID-19.  More info. ⬇️ https://t.co/x55ELFeX6J,2020-03-25 01:15:50,Twitter Web App,22,214
.@Someburros lleva alimentos a los socorristas que mantienen a los arizonenses a salvo durante el brote del coronavirus. ¡Gracias por su compromiso a nuestra comunidad! https://t.co/J12kL8r9kI,2020-03-25 00:03:48,Twitter Web App,8,25
.@Someburros delivers meals to the incredible first responders keeping Arizonans safe during the coronavirus outbreak. Thank you for your commitment to our community! https://t.co/J12kL8r9kI,2020-03-25 00:01:36,Twitter Web App,25,251
The Phoenix VA Regional office is closed to the public but will continue to serve AZ veterans. More here: https://t.co/Iyar8mgbmL,2020-03-24 21:11:58,Twitter Web App,12,46
If you’re a survivor of domestic violence trying to practice safe social distancing these resources may help: https://t.co/7DigvuB798 https://t.co/Tt21ZWu5lq,2020-03-24 20:34:51,Twitter Web App,11,28
We’re urging the White House to set up task forces to improve access to medical supplies that are needed in Arizona and help develop COVID-19 treatments and vaccines. https://t.co/T5r7rXdYeu,2020-03-24 20:07:14,Twitter Web App,33,177
Our bill provides economic relief to Arizona’s rural hospitals during the coronavirus outbreak so they can keep their doors open pay their workers and continue serving our communities. https://t.co/XhL3qWvcH4,2020-03-24 19:00:42,Twitter Web App,29,187
Arizona small businesses experiencing economic loss due to the coronavirus pandemic may now be eligible for new @SBAgov funding and assistance. Start the process by filling out the application: https://t.co/W1LAGEhCex,2020-03-24 18:01:47,Twitter Web App,24,65
Doctors and experts say social distancing is critical if we want to #flattenthecurve. We all need to do our part and stay home as much as possible. https://t.co/IDxZNTPSbG,2020-03-24 17:01:40,Twitter Web App,37,205
Today is #GreatAmericanTakeoutDay! Support local AZ restaurants affected by coronavirus closures and order take-out. Here are some of my favorites: 🔘America’s Taco Shop (@americastaco)  🔘Pizza Heaven Bistro 🔘Feast,2020-03-24 16:12:42,Twitter Web App,26,180
You can help AZ seniors get the food they need to stay at home and stay healthy while we #flattenthecurve. Search “Volunteer Grocery Shopper” here to sign up: https://t.co/3sPYpwR4Xw,2020-03-24 14:26:20,Twitter Web App,20,43
When practicing social distancing remember to stay at least 6 feet away from others in public. #flattenthecurve https://t.co/FgQ8VbSYmn,2020-03-24 01:25:30,Twitter Web App,60,275
Heartbroken to see an Arizonan has died and another is in critical condition after self-medicating to treat coronavirus. If you are experiencing symptoms follow the advice of a medical professional - and if you need help finding a provider we can help: https://t.co/hDgBifgKt7.,2020-03-23 22:44:36,Twitter Web App,27,116
Arizonans with questions about tax filling changes can visit our new webpage. https://t.co/HZWAXRkGxE,2020-03-23 22:32:05,Twitter Web App,2,32
Tucson: estos lugares están proveyendo comida gratis para los niños durante el cierre de escuelas: https://t.co/YvigQrZME0,2020-03-23 21:14:20,Twitter Web App,9,16
Tucson: check out these locations providing kids free meals during school closures: https://t.co/YvigQrZME0,2020-03-23 21:13:31,Twitter Web App,12,39
After our request FEMA extends deadline for emergency grants. Arizona cities agencies and non-profits – You now have more time to apply so you can stay focused on keeping Arizonans healthy and safe. https://t.co/NGgfqvP7D2,2020-03-23 19:16:27,Twitter Web App,30,107
We must get 2 things done in this legislative package:  🔘Help small businesses which are 94% of all Arizona businesses  🔘 Funding for our health system so we can take care of Arizonans with coronavirus  I'm urging Congressional leaders to get this done immediately for Arizona.,2020-03-23 17:54:56,Twitter Web App,112,849
Up-to-date health care guidance from @CDCgov &amp; @AZDHS ⬇️https://t.co/HZWAXRkGxE,2020-03-23 17:04:09,Twitter Web App,3,21
La COVID-19 Community Response Fund de Arizona garantiza que las organizaciones sin fines de lucro de Arizona tengan los recursos necesarios. Aprenda más:  https://t.co/aYejY83NsL,2020-03-23 16:02:07,Twitter Web App,5,11
