Let’s do our part. We must limit gatherings with people not in our households wear masks and maintain 6 feet of distance from others in public.,2020-11-28 23:29:05,Twitter Web App,13,117
Arizonans: small gatherings with friends and family outside our households are contributing to a rise in coronavirus cases. A strong economic recovery depends on all of us making safe smart choices this holiday season. https://t.co/103d8PGG0T,2020-11-28 23:29:05,Twitter Web App,60,296
This month and every month we thank our brave servicemembers and their families for keeping Arizonans safe and secure. #MilitaryFamilyMonth https://t.co/DnlXmh67mx,2020-11-28 20:00:00,Twitter Web App,6,69
Public health is economic health. Steps we take to control the spread of coronavirus are the same steps toward a full economic recovery. Increased cases hospitalizations and deaths hurt jobs businesses and wallets. We need to slow the spread to grow the economy. https://t.co/uNRUYkap29,2020-11-27 23:00:00,Twitter Web App,6,37
Want to skip Black Friday shopping? #OptOutside today at one of AZ's National Parks! Remember to wear a mask and keep 6 feet from others. https://t.co/fNLY6Kmxoq,2020-11-27 20:00:01,Twitter Web App,2,50
On National Native American Heritage Day we're proudly working with Arizona’s tribal communities to expand opportunities and protect tribal sovereignty.,2020-11-27 17:00:01,Twitter Web App,140,888
Hoy y todos los días estamos agradecidos con los hombres y mujeres uniformados que están lejos de casa este Día de Acción de Gracias para mantener a Arizona seguro y salvo.,2020-11-26 18:05:00,Twitter Web App,4,35
Today and every day we're grateful to the men and women in uniform far from home on Thanksgiving keeping Arizona safe and secure.,2020-11-26 18:00:01,Twitter Web App,8,173
¡Feliz Día de Acción de Gracias! 🦃 Las cosas se ven diferentes este año pero es importante que limitemos las reuniones con personas fuera de nuestro hogar usemos mascarillas y practiquemos el distanciamiento social. Hagamos nuestra parte para reducir el brote y salvar vidas.,2020-11-26 15:05:00,Twitter Web App,1,42
Happy Thanksgiving! 🦃 We know things look different this year but it’s important we limit gatherings with people not in our households wear masks and practice social distancing in public. Let’s all do our part to slow the spread and save lives.,2020-11-26 15:00:02,Twitter Web App,45,596
This Thanksgiving will look a little different than normal. Here’s a few tips on how to keep yourself and your loved ones safe. https://t.co/UgoAzEabSY,2020-11-25 22:00:01,Twitter Web App,17,120
Our bipartisan resolution raises awareness and advances our work to end homelessness for Arizona’s children and youth. https://t.co/2CdWvjiBJ7,2020-11-25 18:25:56,Twitter Web App,5,17
Today is the International Day for the Elimination of Violence against Women. We’re calling on Congress to permanently renew #VAWA and ensure survivors of domestic violence and sexual assault have the support they need. #orangetheworld,2020-11-25 16:00:02,Twitter Web App,22,144
Arizonans: coronavirus cases are climbing again. We must limit gatherings with people outside our households wear masks and practice social distancing in public. Find a testing site near you ⬇️ https://t.co/zo8Ev7NCvZ,2020-11-24 22:00:01,Twitter Web App,23,75
Arizona veterans sacrificed for our country and we must ensure they receive the benefits they’ve earned. The VA should be transparent about delays and must address inadequate oversight of contracted disability exams in Arizona. https://t.co/4YSWZjR51g,2020-11-24 19:46:00,TweetDeck,12,52
Our bipartisan Rural Access to Hospice Act increases access to hospice care for Arizonans in rural communities. #NationalHospiceandPalliativeCareMonth https://t.co/qenlZVJxIa,2020-11-24 19:00:01,Twitter Web App,3,36
AZ seniors: Medicare Open Enrollment ends on December 7. Check your coverage or change plans here ➡️ https://t.co/5IMtcco9si. Have questions? Our team is here to help: (602) 598-7327 or casework@sinema.senate.gov.,2020-11-23 21:00:01,Twitter Web App,7,15
Las pruebas de anticuerpos de COVID-19 de @uarizona están ahora disponibles para todos los arizonenses mayores de 18 años.  Apúntese para una prueba de anticuerpos aquí: https://t.co/ipN2eHibjI  Programe una prueba gratis de COVID-19 aquí: https://t.co/wPNiyNk50t,2020-11-23 15:34:45,Twitter Web App,2,10
.@uarizona’s COVID-19 antibody testing is now open to all Arizonans age 18 and older.  Sign up for antibody testing here: https://t.co/ipN2eHibjI  Schedule an appointment for a free COVID-19 test here: https://t.co/ZxnpAwxbYV,2020-11-23 15:30:22,Twitter Web App,9,33
AZ’s COVID hospitalization rate continues to rise. A strong economic recovery depends on all of us making safe smart choices. Let’s wash our hands wear masks practice social distancing in public and avoid gatherings with people outside our households. https://t.co/hXB7tIR4aC,2020-11-23 00:00:00,Twitter Web App,27,91
Great news - @NIH’s $4.7 million grant will help administer 29000 COVID-19 saliva tests in underserved communities across Arizona. https://t.co/SjNvreFL8y,2020-11-22 21:00:00,TweetDeck,24,137
For #NationalFamilyCaregiversMonth we’re calling on the VA to improve caregiver benefits for AZ veterans. https://t.co/FbO0yVdujX,2020-11-22 19:00:00,TweetDeck,2,26
November is #NationalDiabetesMonth. We called on the Centers for Medicare and Medicaid Services to increase access to diabetes prevention programs for Arizonans during the pandemic. https://t.co/arnStjWlT4,2020-11-21 23:00:01,TweetDeck,4,21
Great news - @Toyota’s donation will support virtual learning in Phoenix. https://t.co/jtKvOGc9Ju,2020-11-21 20:00:00,TweetDeck,10,42
Great news - 13 Arizona businesses were named HIRE Vets Medallion Program awardees! Thank you for your work recruiting employing and supporting our nation’s veterans.  https://t.co/zmnmYfvzMK,2020-11-21 16:00:00,TweetDeck,8,57
We spoke with military leaders to ensure Arizona’s servicemembers have the resources they need to do their job. https://t.co/dDF76HsZEL,2020-11-20 20:47:00,TweetDeck,5,58
Tohono O’odham Nation’s grant will help @ASU and @uarizona combat coronavirus throughout the state. https://t.co/cUTDDSlDbv,2020-11-20 19:00:01,TweetDeck,11,60
Vacunarse contra la influenza este año es más importante que nunca. El condado de Maricopa ofrece vacunas de la influenza gratis. Encuentre una ubicación cercana a usted: https://t.co/wbhGPwBvFp,2020-11-20 17:07:00,TweetDeck,6,24
AZ veterans and servicemembers can access mental health resources through the COVID Coach app. Learn more:  https://t.co/GGxa885bvX,2020-11-19 23:00:02,Twitter Web App,8,35
Military domestic violence survivors deserve our full support and we must hold perpetrators accountable. Our bipartisan bill empowers survivors by improving counseling and encouraging reporting ensuring the health and safety of all on our bases. https://t.co/e5ECHdmvXM,2020-11-19 21:52:51,Twitter Web App,6,39
Payson: COVID-19 testing tomorrow November 20 from 8am-12pm at the Church of Jesus Christ of Latter-day Saints 913 S. Ponderosa St. Pre-register for an appointment here: https://t.co/UDhk7rZoxi,2020-11-19 21:14:00,Twitter Web App,7,15
.@USDOT awarded Yavapai-Apache Nation $445000 to expand tribal transportation. This investment increases access to jobs health care and other essential services for members of the Yavapai-Apache Nation. https://t.co/QFjOiogizQ,2020-11-19 20:21:00,TweetDeck,10,30
Experts are warning that small gatherings with friends and family outside our households are contributing to a rise in coronavirus cases. We need to be safe and smart.  If we do our part and work together we will slow the spread and save lives. https://t.co/0upQASminR,2020-11-19 17:00:01,TweetDeck,45,138
The federal government must lead by example to protect Americans’ health and slow the spread of coronavirus by following best practices and continuing to ensure employees are teleworking. https://t.co/71y0eZANKP,2020-11-18 22:18:00,TweetDeck,9,73
During National Native American Heritage Month we're proudly honoring Arizona’s 22 federally recognized tribal communities and their contributions to our state. https://t.co/bfk7PdePbz,2020-11-18 19:00:01,Twitter Web App,16,91
We’re working with Arizona seniors to stop fraudsters seeking to take advantage of the pandemic. https://t.co/wJI7fPMNGC,2020-11-18 16:39:00,TweetDeck,7,64
On #NationalEntrepreneursDay we’re helping AZ startups grow by: ✅ Cutting unnecessary regulations that hold AZ startups back ✅ Equipping our workforce with the skills they need ✅ Expanding access to capital,2020-11-17 23:00:00,Twitter Web App,4,36
“...the protective benefits of masks are stronger the more people wear masks consistently and correctly.” Scientific studies show wearing a cloth mask protects yourself AND your loved ones from coronavirus. https://t.co/wdT6kpLkEn,2020-11-17 20:00:00,Twitter Web App,50,229
Happy #NationalTakeAHikeDay! Don’t forget to wear a face mask and keep 6 feet from others when you hit the trails.,2020-11-17 16:59:38,Twitter Web App,22,312
Support AZ families facing food insecurity this Thanksgiving by donating a turkey to @UnitedFoodBank at the Mesa Convention Center.  https://t.co/leiVH4Q3C0,2020-11-16 22:00:00,TweetDeck,8,20
Arizona educators are the best. This #AmericanEducationWeek we’re proud to honor AZ teachers making a difference for our students during these difficult time.,2020-11-16 19:00:00,TweetDeck,22,175
Proud that AZ middle and high school students will learn about the Holocaust and other genocides. We’ll always remember and honor the millions of innocent lives lost. https://t.co/BLsDyHM2Gh,2020-11-15 23:00:00,Twitter Web App,143,981
Support families facing food insecurity this holiday season by donating to The Thanksgiving Harvest Food Drive on November 19 from 6am-6pm at Sam’s Club 4701 N. Stone Ave. https://t.co/RfAm35mG9J,2020-11-15 21:00:00,Twitter Web App,3,38
Happy #AmericaRecyclesDay AZ! ♻️,2020-11-15 17:00:00,Twitter Web App,6,105
Maricopa County offers free flu shots Monday through Friday from 8am-4:30pm. Find a clinic near you:  https://t.co/rUcWKtd0T2,2020-11-15 01:00:01,Twitter Web App,41,108
Scientific studies show masks are key to slowing the spread of coronavirus. See how effective they are ⬇️ https://t.co/jg2OZninb7,2020-11-14 23:00:01,Twitter Web App,127,423
Arizonans: @IRSnews extended the deadline for Arizonans who didn’t file taxes to register for Economic Impact Payments. Apply here by November 21: https://t.co/4hF91c5dob,2020-11-14 19:00:00,Twitter Web App,3,10
FEMA needs to mobilize emergency health care workers in Arizona and other states experiencing coronavirus surges. https://t.co/NTEhxjEhwA,2020-11-13 21:16:00,TweetDeck,75,327
Tucson: Los inquilinos afectados por la pandemia del coronavirus pueden solicitar subvenciones de hasta $5000 para cubrir las deudas de alquiler. https://t.co/y1An1uRcdx,2020-11-13 20:00:02,TweetDeck,5,11
Great speaking this week with Davis-Monthan Air Force Base’s new commander Col. Joseph Turnham. We’re proud to welcome him to @DMAFB and continue supporting AZ’s critical role keeping America safe and secure.,2020-11-13 16:00:00,TweetDeck,4,54
Arizona’s COVID hospitalization rate continues to rise and ICU beds are 85% full. Let's all do our part. We need to wash our hands wear masks and practice social distancing in public. Most importantly we should avoid gatherings with people outside our households. https://t.co/2coEzQQYOw,2020-11-12 23:00:01,TweetDeck,42,162
COVID-19 testing Monday November 16 at North Country HealthCare Payson 126 E. Main St. Call 928-468-8610 to pre-register. https://t.co/yRxFWoDCdJ,2020-11-12 22:33:36,Twitter Web App,6,16
We’re leading the AZ delegation in urging the administration to provide more relief to Arizona health care providers during this pandemic not less. https://t.co/oUb4bFg9kW,2020-11-12 21:17:00,TweetDeck,7,79
Arizona health officials are warning us: difficult times are ahead. Let’s listen to our health professionals and continue best practices - wear masks and keep 6 feet from others in public - to make a difference. https://t.co/zFZnHWzcVO,2020-11-12 17:00:00,Twitter Web App,32,147
COVID cases and hospitalization rates are reaching troubling levels in Arizona.  Let’s slow the spread. We must wash our hands wear masks and avoid gatherings with people outside our household. https://t.co/bsYNbkEJ0L,2020-11-11 23:00:00,Twitter Web App,22,128
Dr. Fauci is warning us again: we need to make an “abrupt change” in our behavior to slow the spread of coronavirus. We can’t let our guard down. We must wear masks and keep 6 feet from others in public to save lives. https://t.co/yahIwiaYMD,2020-11-11 17:00:02,Twitter Web App,215,730
To our veterans and their families: Thank you for your sacrifice and service to keep Arizonans safe and secure. #VeteransDay,2020-11-11 14:29:52,Twitter Web App,29,294
We led the Arizona Congressional delegation in supporting @UArizona’s application for a NIH grant to help fight health disparities &amp; coronavirus. https://t.co/ztlHKTYvOp,2020-11-10 20:36:00,TweetDeck,6,41
COVID-19 testing at Central Arizona College Signal Peak Campus 8470 N. Overfield Rd Coolidge 7am-11pm 7 days a week. Pre-register for an appointment here: https://t.co/tPYotn6ZGj,2020-11-10 20:00:01,Twitter Web App,7,22
Happy birthday @USMC! Thank you for keeping Americans safe and secure for 245 years. #SemperFidelis,2020-11-10 15:00:01,Twitter Web App,12,137
As we continue to see a rise in COVID cases in Arizona we need to take action. We need to social distance wear masks and avoid gathering indoors with people outside our household. https://t.co/EUhVpPWvV5,2020-11-09 23:28:26,TweetDeck,24,134
AZ veterans: find a flu shot near you ⬇️ https://t.co/ILOADKwla7,2020-11-09 17:49:46,Twitter Web App,10,40
AZ reported the highest number of coronavirus cases since August. We can’t let our guard down. Let's keep wearing masks practicing social distancing and avoiding indoor gatherings with people outside our household. Smart action will save lives. https://t.co/QgWPCEst97,2020-11-09 16:00:00,Twitter Web App,72,350
.@uarizona’s grant will help Hispanic students pursue STEM careers. https://t.co/dGHY0t2yrg,2020-11-08 22:04:00,TweetDeck,20,156
Congratulations Arizona’s Darcy Olsen - named a 2020 Angels in Adoption Honoree! Darcy’s work to support vulnerable children in the adoption and foster care system ensures many more children grow up in safe environments. https://t.co/sNpbzcxnzU #NationalAdoptionMonth,2020-11-08 19:04:00,TweetDeck,9,96
On #NationalSTEMDay we’re strengthening STEM education to better equip AZ students for the jobs of the future. https://t.co/EtvbbhAPWu,2020-11-08 16:01:00,TweetDeck,13,127
In Arizona we’re no strangers to accomplished women defying the odds and leaving their marks. #OnThisDay 104 years ago one of my heroes Jeannette Rankin became the first woman elected to Congress.,2020-11-07 16:02:37,Twitter for iPhone,78,828
As Veterans Day approaches we’re proud to honor our Vietnam veterans and their families. AZ Vietnam veterans: register for our upcoming virtual ceremonies and receive a Vietnam Veteran Lapel Pin:  https://t.co/1TI5GRJpEG,2020-11-06 19:00:01,Twitter Web App,7,62
COVID cases are rising in Arizona and experts are telling us that it’s going to get worse. We need to take action. We need to wear masks keep social distancing and avoid gathering indoors with people outside our household. https://t.co/BZXrPm3M9J,2020-11-05 21:00:00,TweetDeck,25,182
.@ASU offers COVID-19 testing for students employees and all Arizonans. Register for an appointment here:  https://t.co/szL2UAOke5,2020-11-05 18:00:01,Twitter Web App,26,87
Arizona’s daily COVID cases are climbing. Action now will save lives. We must avoid gatherings with people not in our households wear masks and wash our hands. https://t.co/wFgV26mVvv,2020-11-03 22:45:00,TweetDeck,39,207
While some Congressional leaders are stuck in partisan corners we’re still solving problems for Arizonans. If you need help our team of social workers is here for you.  📞 602-598-7327 📧 casework@sinema.senate.gov https://t.co/ovHPWHRGGL,2020-11-02 22:00:00,TweetDeck,14,75
During Lung Cancer Awareness Month we're supporting research to understand prevention develop lifesaving treatments and lower costs. #LCAM https://t.co/itUnTgHTPg,2020-11-02 19:00:00,Twitter Web App,6,19
.@foodbanktucson’s hours for drive-thru food distribution at Kino Sports Complex are changing. Read more: https://t.co/cHQukBajuq,2020-11-01 23:00:00,Twitter Web App,6,18
Visit https://t.co/KYaPsL7hcj for critical flu information and vaccine providers in your county.,2020-11-01 19:00:00,Twitter Web App,5,39
Arizona we are approaching a second coronavirus spike. Now is the time for action. We all need to keep wearing masks social distancing and avoid gathering indoors with people outside our household. The data does not look good right now and smart action will save lives. https://t.co/nMNXGLDQEk,2020-10-31 23:00:01,Twitter Web App,59,243
.@cvspharmacy opened 7 rapid-result COVID test sites in AZ. Register for an appointment at a location near you ⬇️ https://t.co/gsG3YKJzOz,2020-10-31 21:00:00,Twitter Web App,13,44
Congratulations Chandler High School’s @Sara_Wyffels - named Arizona’s Teacher of the Year! Thanks for all you do to educate AZ kids during these challenging times. https://t.co/gEPMb9pVvZ,2020-10-31 17:00:01,Twitter Web App,8,87
USDA awarded White Mountain Regional Medical Center $1099000. This funding will help them continue to provide critical medical services to Apache County increasing access to health care for all Arizonans. https://t.co/TllJshpL5P,2020-10-30 20:22:00,TweetDeck,5,22
Peoria drive-thru flu clinics available next week. More info ⬇️ https://t.co/J76cSViEiG,2020-10-30 20:12:53,Twitter Web App,15,43
Every day we’re working to ensure Arizona veterans get the benefits they’ve earned. We’ll continue partnering across the aisle to ensure the federal government meets its obligation to our veterans. https://t.co/kb9kDBfWzO,2020-10-30 18:00:00,Twitter Web App,18,113
Arizonans who need help during these difficult times can reach our team of social workers here:  📞 602-598-7327 📧 casework@sinema.senate.gov https://t.co/EquITfYyXI,2020-10-29 22:00:00,TweetDeck,16,49
“Contact tracing does save lives” - Gwendena Lee-Gatewood White Mountain Apache Tribe chairwoman. Proud to see the White Mountain Apache Tribe ensure the health and safety of the community. https://t.co/PtZx494jgU,2020-10-29 16:00:01,Twitter Web App,22,96
Our team of social workers is here to help even when party leaders in Washington aren't. Please reach out if you need help.  📞 602-598-7327 📧 casework@sinema.senate.gov https://t.co/227GMvveoc,2020-10-28 23:00:00,TweetDeck,8,33
Glad to see FCC award broadband licenses to tribal communities in Arizona. https://t.co/5MStWSxvtz,2020-10-28 20:06:00,TweetDeck,10,45
COVID-19 has tragically taken the lives of Arizona veterans. We’re ensuring family members grieving the loss of a veteran who passed due to coronavirus receive their rightful benefits. https://t.co/ChRftN195X,2020-10-28 17:00:00,Twitter Web App,10,51
Thanks @TucsonChamber for supporting our RESTAURANTS Act. We’ll keep pushing to get local restaurants in Tucson and across Arizona the support they need during these challenging times. https://t.co/QzzrMyK56G,2020-10-27 20:48:00,TweetDeck,6,44
.@CITYOFMESA lanzó el programa “Mesa Al Fresco” el cual ofrece un reembolso de hasta $1000 a los negocios que invirtieron para expandir sus servicios al aire libre durante la pandemia. La fecha límite para solicitar es el 1 de diciembre de 2020. https://t.co/oPWN1RgNjh,2020-10-27 18:01:11,Twitter Web App,3,11
.@ASU modelers predicted Arizona’s first coronavirus surge. Now Dr. Joshua LaBaer is warning us again: we can’t let our guard down. We must continue to wear masks and keep 6 feet from others in public to save lives. https://t.co/fVSnpfzoUf,2020-10-27 16:00:02,Twitter Web App,45,213
The VA must do everything possible to help Arizona veterans and caregivers access the critical benefits and resources they’ve earned.  https://t.co/uCStPHNTFu,2020-10-26 21:33:00,TweetDeck,4,38
While the next relief package is stalled by Washington chaos we're still solving problems for everyday Arizonans. If you need assistance please reach out to our team of social workers.  📞 602-598-7327 📧 casework@sinema.senate.gov https://t.co/Y1WP1ojTmg,2020-10-26 21:05:00,TweetDeck,13,95
Today we thank the incredible servicemembers who keep America safe and protect our freedoms. #NationalDayoftheDeployed,2020-10-26 13:29:22,Twitter Web App,11,162
Arizona’s rural health providers need support to keep saving lives and combating coronavirus. Read more about our bipartisan Save Our Rural Health Providers Act.  https://t.co/z6po0UqKXf,2020-10-25 19:00:00,TweetDeck,5,61
https://t.co/1RfC1LuAcx,2020-10-25 17:08:19,TweetDeck,339,2336
Applications for the Navajo Nation CARES Fund Hardship Assistance Program are open until Tuesday November 3. Learn more ⬇️ https://t.co/0T6ASLMwdX,2020-10-25 15:30:00,TweetDeck,26,61
Visit https://t.co/aRaN2wSYBv for critical flu information and vaccine providers in your county.,2020-10-25 03:00:00,TweetDeck,8,71
Surprise AZ residents: on Veterans Day you can honor our brave Arizona veterans with a video tribute!   https://t.co/Zi1DDvx6vt,2020-10-24 19:00:01,TweetDeck,6,34
Dr. LaBaer and the @ASU modeling team warned Arizona before the first coronavirus surge. Let’s listen to our health professionals and continue best practices - wear masks and keep 6 feet from others in public - to make a difference. https://t.co/oI1HOH2Jow,2020-10-23 19:00:01,TweetDeck,40,118
Graham Co. Health Dept. and @ASUBiodesign are offering COVID-19 saliva testing today until 1pm at the Graham County Fairgrounds 527 Armory Road Safford. Online registration encouraged but drive-ins accepted. Register here: https://t.co/iNBd8rg3PC. https://t.co/WEpKVWUWqR,2020-10-23 16:16:45,TweetDeck,6,21
We must all remember to get our flu shots to protect ourselves and our loved ones. @CityofPhoenixAZ offers free flu shots from 10am-2pm on Saturday October 24 at El Oso Park 3451 N. 75th Ave. and El Reposo Park 502 E. Alta Vista Road.  https://t.co/wkN4KwgM2V,2020-10-23 16:00:01,TweetDeck,5,83
Arizonans working for Air America risked their lives to keep our country safe. They earned their federal retirement benefits.  https://t.co/x1izQTMx2e,2020-10-22 21:10:00,TweetDeck,9,23
Coronavirus cases are rising again in Arizona. We all must take action now to slow the spread in our communities.  Wear a mask  Wash hands  Limit gatherings  Keep 6ft from others https://t.co/Efk6ws1cUP,2020-10-22 21:00:01,TweetDeck,66,282
¿Busca empleo? Aquí puede encontrar una lista de empresas contratando en Arizona: https://t.co/QjkUmKgL7M,2020-10-22 17:00:02,Twitter Web App,1,12
On #PurpleThursday we’re calling on Congress to permanently renew #VAWA and ensure survivors of domestic violence can access the support they need.,2020-10-22 14:00:03,Twitter Web App,19,81
Great news - @NAU’s grant from @NASA supports STEM learning for AZ students. https://t.co/8KlY5fdXnv,2020-10-22 00:00:00,Twitter Web App,7,46
As Arizona continues distance-learning we’re ensuring AZ students stay fed and healthy during this public health emergency. https://t.co/zCDzROnBzK,2020-10-21 22:07:00,TweetDeck,6,48
Coronavirus cases are on the rise again in Arizona. We must make smart decisions so we don’t overload our doctors nurses and hospitals. Let’s do our part: remember to wear a mask and keep 6 feet from others in public.  https://t.co/R3UmSbOEqn,2020-10-21 20:00:17,Twitter Web App,52,200
Visit our website for critical flu information and vaccine providers in your county:  https://t.co/KYaPsL7hcj,2020-10-21 16:00:01,Twitter Web App,4,10
Arizonans who need help during these difficult times can reach our team of social workers here:  📞 602-598-7327 📧 casework@sinema.senate.gov https://t.co/jHAYMw8eo5,2020-10-20 23:27:00,TweetDeck,15,56
We’re thankful @CityofPhoenixAZ heard our call and approved the purchase of a new facility for @usvetsinc helping Arizona veterans have a roof over their heads. https://t.co/0QugBxyaTn,2020-10-20 19:42:00,TweetDeck,7,50
Medicare Open Enrollment offers AZ seniors a chance to check their coverage and change plans. Visit  https://t.co/5IMtccFKjQ for info. Have questions? Our office is here to help: call (602) 598-7327 or email casework@sinema.senate.gov.,2020-10-20 16:00:02,Twitter Web App,6,31
Arizonans are struggling during this pandemic - which is why we have 23 social workers ready to help you. If you need assistance get in touch:  📞 602-598-7327 📧 casework@sinema.senate.gov https://t.co/OKuJLjia0r,2020-10-19 22:00:00,TweetDeck,9,44
Flagstaff: @NAU will host family drive-up flu shots from 2pm-5pm on Thursday October 22 in the parking lot behind Cline Library 1001 Knoles Dr. Schedule an appointment here ➡️ https://t.co/jOlMwGbtjR,2020-10-19 16:00:00,Twitter Web App,6,17
AZ veterans: visit our website - https://t.co/KYaPsKPFNJ - to find a VA Medical Center providing flu shots near you.,2020-10-19 00:00:00,Twitter Web App,22,81
Donating blood saves lives. Payson residents can sign up to give blood and receive a COVID-19 antibody test:  https://t.co/Y8ZkPlhXiF,2020-10-18 20:00:00,Twitter Web App,7,21
.@NAU’s Annual Warm Clothing Drive runs until October 31. Donate used clothing items and non-perishable food at drop-off locations across campus:  https://t.co/BTyf11LXR8,2020-10-18 16:00:00,Twitter Web App,8,16
