Free COVID-19 testing this Saturday August 1 at Paradise Valley Community College 18401 N 32nd St Phoenix from 6am-11am.  Pre-register here ⬇️ https://t.co/wmb29e9pb2,2020-07-29 21:47:38,Twitter Web App,2,9
Free COVID-19 testing this Saturday August 1 at El Reposo Park 502 E Alta Vista Rd Phoenix from 6am-11am.  Pre-register here ➡️ https://t.co/AmtjVwPmYt https://t.co/N8KsiH3HNb,2020-07-29 21:46:44,Twitter Web App,15,32
Telehealth services are critical for rural veterans. We must improve broadband coverage so that our veterans can get the care they’ve earned.  https://t.co/Gg3XcpuyXn,2020-07-29 19:59:20,Twitter for iPhone,8,21
Find COVID-19 testing sites near you - article includes links to register ⬇️ https://t.co/fpMY9tDEnL,2020-07-29 19:57:15,Twitter Web App,14,42
Happy Birthday @NASA! We’re committed to protecting America’s global leadership role in space exploration.,2020-07-29 18:00:39,Twitter Web App,9,70
Glad to announce Kingman Airport will receive over $329000 in funding to renovate the existing runway. https://t.co/pkjPs32l78,2020-07-29 15:22:00,TweetDeck,4,32
Frightening images from Tempe Town Lake. Hoping everyone in the area is staying safe and thankful for the first responders on the scene.,2020-07-29 14:30:01,TweetDeck,27,398
Arizona: the coronavirus is not going away any time soon.  What you can do to help 👇 -Stay home as much as possible -Social distance -Wear a mask whenever in public https://t.co/fotTO38qKf,2020-07-29 00:32:03,TweetDeck,76,364
We must do all we can to prevent child abuse and support survivors. Our bipartisan bill funds a national child crisis hotline to help protect America’s children. https://t.co/PZjAKZJ1UL,2020-07-28 22:00:00,TweetDeck,11,51
Thank you @AzCHealthPlan for awarding grants to 22 AZ nonprofits and health providers to help protect Arizonans from COVID-19. https://t.co/y5xT5wRMuc,2020-07-28 21:00:31,Twitter Web App,10,36
We need to have policies in place to better respond to future emergencies like coronavirus.  https://t.co/dknxyd52BN,2020-07-28 19:20:00,TweetDeck,5,33
106 years ago World War I began. Today we remember and honor the brave servicemembers who protected our nation.,2020-07-28 16:00:18,Twitter Web App,52,430
Free COVID-19 saliva-based testing from @ASUBiodesign today at @StateFarmStdm 1 Cardinals Dr Glendale from 7am-12pm and tomorrow July 29 at Ellie Towne Flowing Wells Community Center 1660 W Ruthrauff Rd Tucson from 3pm-7pm.  Pre-register here ⬇️ https://t.co/UDhk7rHN8I,2020-07-28 13:41:10,Twitter Web App,11,27
The administration and some members of Congress asked the Supreme Court to end protections for Arizonans with pre-existing conditions. That’s wrong - especially during a pandemic. We’re calling on the administration to defend protections for people with pre-existing conditions. https://t.co/78VMyxyBTR,2020-07-28 00:06:00,TweetDeck,35,166
Our bipartisan TRUST Act protects Arizonan’s retirement and helps reduce the national debt.  https://t.co/D56yHUzrWl,2020-07-27 21:40:09,Twitter for iPhone,12,55
Arizona is home to the best most innovative small businesses. @LocalFirstAZ provides advice on how we can support our local businesses during the coronavirus pandemic.  https://t.co/w8u9AjhBUh,2020-07-27 21:03:02,Twitter Web App,8,25
Great news - @ASU expanded its free saliva-based COVID-19 tests. Widespread accessible testing with rapid results is key to slowing the spread of coronavirus and protecting our communities. https://t.co/w7SKtsmdlF,2020-07-27 17:00:19,Twitter Web App,26,112
On Thursday August 6 join our virtual Service Academy Day at 12:00 p.m. RSVP here: https://t.co/zglveCI5uu and find more information about service academy applications here: https://t.co/cgZvzp6Qir,2020-07-26 23:00:00,TweetDeck,2,18
Here’s how to keep you and your loved ones safe while awaiting COVID-19 test results:  https://t.co/QhRF28FhG1,2020-07-26 18:08:00,TweetDeck,46,114
Las condiciones crónicas pueden poner en peligro la vida si alguien contrae COVID-19. Escuche a un experto médico sobre cómo puede mantenerse seguro y saludable:  https://t.co/8LLqcSQbWl,2020-07-26 00:00:01,TweetDeck,3,14
We must protect health care for Arizonans with pre-existing conditions. That’s why we’re calling on the administration to reverse course and defend health protections for Arizonans with conditions like asthma cancer or diabetes. https://t.co/LFAAku7XwC,2020-07-25 22:26:00,TweetDeck,36,141
Incredible AZ nonprofit @CircletheCityAZ opened a hotel in Phoenix for COVID-19 patients experiencing homelessness. https://t.co/dCpaazdLVc,2020-07-25 19:30:00,TweetDeck,63,189
The VA needs to develop a strategy to better support veterans experiencing homelessness in Arizona. https://t.co/FoW0U7mbdQ,2020-07-24 21:49:19,TweetDeck,16,60
Tucson’s Quinlan Wilhite makes Arizona-themed face masks to keep our communities safe and healthy.  https://t.co/cxh8AafI4y,2020-07-24 19:58:50,Twitter Web App,8,29
Our team proudly worked with the Mesa Chamber Aging and Health Care Committee to designate @CITYOFMESA a dementia-friendly community. https://t.co/LxNgVbFVmW,2020-07-24 17:03:25,Twitter Web App,3,24
Senate leaders are negotiating the next coronavirus relief package.  We’re pushing for Arizona priorities. 👇 https://t.co/GvPTqbxs94,2020-07-24 15:00:01,TweetDeck,40,247
The Senate passed this year's National Defense Authorization Act. We secured funding for a number of Arizona priorities. More ➡️ https://t.co/fQNhWPcEh6 https://t.co/n2GQH5Zgnz,2020-07-23 19:46:04,TweetDeck,3,15
.@FlagShelterOrg provides Arizonans experiencing homelessness with private hotel rooms to allow for safe social distancing during the public health crisis. Learn about their services and how you can help:  https://t.co/zGDmjiD4kO,2020-07-23 17:00:48,Twitter Web App,5,26
Our bills continuing smart investment in Arizona’s airports are now one step closer to becoming law. https://t.co/SIR2BrVVFD,2020-07-23 15:45:00,TweetDeck,7,26
Find coronavirus testing sites near you - article includes links to register ⬇️ https://t.co/4ZJlv3QJ0z,2020-07-23 14:08:55,Twitter Web App,4,24
The Senate approved our resolution making July 22 Glioblastoma Awareness Day honoring the legacy of Senator John McCain. https://t.co/x6lElbHTUT,2020-07-23 02:08:53,Twitter for iPhone,14,135
The U.S. House just passed our bill permanently funding the #LWCF - supporting good-paying Arizona jobs protecting our beautiful public lands and strengthening our outdoor recreation industry. https://t.co/BtWdhZDfLx https://t.co/y7qv9HnJbr,2020-07-23 00:45:29,Twitter Web App,16,152
Our Southwest Border Security Technology Improvement Act is now one step closer to becoming law and keeping Arizonans safe and secure. https://t.co/gYHgvuSR3x,2020-07-22 19:39:00,TweetDeck,6,21
The IRS must give Arizona businesses flexibility with federal health care reporting deadlines during this pandemic. https://t.co/a43eP87hFW,2020-07-22 17:44:00,TweetDeck,3,24
Free COVID-19 saliva-based testing from @ASU this Saturday July 25 at @StateFarmStdm 1 Cardinals Dr Glendale from 7am-11am.  You must pre-register to be tested.  Pre-register here ➡️ https://t.co/rVFAvUBQfO,2020-07-22 15:52:05,Twitter Web App,16,25
Proud to have worked with Senator John McCain and @dougducey to protect $3.5 billion in funding for our schools and ensure Arizonans’ voices were heard.  https://t.co/U9NgwCk16n https://t.co/LgFmpV1kYU,2020-07-22 15:08:55,Twitter Web App,8,45
Federal state and local partners need to protect Arizonans from financial and health issues from coronavirus-related scams. https://t.co/hRsX2m3R8H,2020-07-22 15:02:00,TweetDeck,5,21
On Glioblastoma Awareness Day we remember my hero Arizona Senator John McCain. Our bipartisan resolution honors him and all Americans battling glioblastoma and other brain cancers and supports new treatments. #GBMDay,2020-07-22 14:10:26,Twitter Web App,70,466
We’re hosting a virtual Service Academy Day for AZ students interested in applying to the U.S. Service Academies on Thursday August 6 at 12:00 p.m. RSVP here:  https://t.co/zglveCI5uu,2020-07-21 23:00:01,TweetDeck,7,24
We’re calling on Senate leaders to ensure the next coronavirus relief package includes AZ priorities:  •Increased testing and infection tracking •More PPE •Paycheck support •Local and Tribal gov. support •School resources for safe and smart learning  https://t.co/94KP0N3zhN,2020-07-21 21:01:01,TweetDeck,30,138
Arizona has one of the worst coronavirus outbreaks in the country which is disproportionally impacting Tribal nations and communities of color.   Policymakers must address existing disparities if we are to effectively combat this pandemic. https://t.co/07awmD1234,2020-07-21 19:48:00,TweetDeck,75,326
Lea nuestra opinión editorial en @UnivisionAZ sobre cómo estamos solucionando problemas para los arizonenses durante la pandemia de COVID-19. https://t.co/OLPZIW5g3S,2020-07-21 17:59:08,Twitter Web App,4,29
Stop playing politics with Arizonans' health care.  We're calling on the administration to defend protections for Arizonans with pre-existing health conditions and safeguard access to affordable health care. https://t.co/un0C2O4JBd,2020-07-21 16:00:01,TweetDeck,83,338
Free COVID-19 testing through July 28 at South Mountain Park 10919 S. Central Avenue and Maryvale High School 3415 N 59th Ave from 6am-2pm.  Pre-register here ➡️ https://t.co/FJYajBRwTh https://t.co/5dTcvaCCqT,2020-07-21 15:21:27,Twitter Web App,10,34
Following our requests we’re happy to announce that the Munds Park Post Office will re-open. https://t.co/AQttOWhAUA,2020-07-21 14:39:53,TweetDeck,9,49
.@LeaderHoyer has this homage to John Lewis posted outside his office.   John and I served together as Chief Deputy Whips under @LeaderHoyer. I remember the moment when Steny called me and asked me to serve as a whip and the honor I felt to sit next to John Lewis in that role. https://t.co/YJkJmWnJtl,2020-07-21 00:53:33,Twitter for iPhone,19,164
Our bill with @JerryMoran to expand housing for veterans with disabilities just passed the U.S. House and is on its way to the President's desk to be signed into law! We'll keep ensuring Arizona's veterans get the benefits they've earned. https://t.co/y6jQrIs4tk,2020-07-20 21:31:56,TweetDeck,7,36
He came over afterwards hugged me and said “thank you my dear but I’m happy just tending to my chickens.”   I smiled and thought to myself “yep I’ve voted for the right man.”   Rest in power my dear friend.,2020-07-20 19:46:31,Twitter for iPhone,30,360
These last few days I’ve been remembering the January day in 2015 when I loudly called out his name on the floor of the House. I was the only member of Congress to vote for him that session.,2020-07-20 19:46:30,Twitter for iPhone,12,146
I voted for John Lewis my hero. He embodied all that I wished the Congress would be and what I hoped to be - kind humble honest hardworking and steadfast to his values. A man of principle and courage.,2020-07-20 19:46:29,Twitter for iPhone,15,154
Every odd-numbered January the US House chooses its Speaker of the House. Every member stands during roll call and calls out his/her vote for the chamber gallery and country to hear.,2020-07-20 19:46:28,Twitter for iPhone,45,290
Happy Birthday @SpecialOlympics! Since 1968 you’ve made sports more inclusive and inspired countless young people. #InclusionRevolution,2020-07-20 19:00:57,Twitter Web App,6,46
We’re supporting water and sanitation projects for the Navajo Nation to help stop the spread of coronavirus. https://t.co/LuqpXlitFC,2020-07-20 18:48:00,TweetDeck,20,107
Free COVID-19 testing through July 28 at South Mountain Park 10919 S. Central Avenue and Maryvale High School 3415 N 59th Ave from 6am-2pm.  Pre-register here ➡️ https://t.co/FJYajBzVuH https://t.co/opvsYlxs6K,2020-07-20 16:13:06,Twitter Web App,5,18
#OnThisDay in 1969 Neil Armstrong became the first person to walk on the Moon. #Apollo11,2020-07-20 16:02:27,Twitter Web App,19,251
#OnThisDay in 1848 the Seneca Falls Convention launched the women’s suffrage movement. https://t.co/TsjfzvL4Af,2020-07-19 19:03:00,TweetDeck,54,216
To slow the spread of COVID-19 @pimaarizona launched “Ready For You” - supporting businesses using best practices to safely re-open and get Arizonans back to work.,2020-07-18 23:52:00,TweetDeck,15,101
Masks are key to slowing the spread of coronavirus. Do your part to save lives: wear a mask when in public. https://t.co/lhpTIkudhr,2020-07-18 16:50:00,TweetDeck,86,532
My hero.   Rest in power my friend. https://t.co/JOQzQlLB66,2020-07-18 14:35:37,Twitter for iPhone,145,2124
Homebound Arizonans need our help. The administration must use the money Congress approved to distribute food to those in need during coronavirus. https://t.co/IOoZey5LZo,2020-07-17 19:43:00,TweetDeck,20,59
COVID-19 testing in Fountain Hills Saturday July 25.  - Driver's license and insurance card required  - No appointment is needed - testing is provided on a first come first serve basis https://t.co/H0S51TRpos,2020-07-17 16:52:38,Twitter Web App,19,30
Incredible siblings Thomas Kaye and Kiona Arellanes created the Hopi Relief Fund to bring supplies to reservations affected by coronavirus. https://t.co/4Zw6zAiXvd,2020-07-17 16:02:25,Twitter Web App,19,97
Free COVID-19 testing at South Mountain Park 10919 S. Central Avenue and Maryvale High School 3415 N 59th Ave beginning tomorrow Friday July 17.  You must pre-register to be tested.  Pre-register here👇 https://t.co/FJYajBzVuH,2020-07-16 20:01:19,Twitter Web App,10,23
The Department of Justice needs to defend Arizonans with pre-existing conditions. https://t.co/HYjuMMTHS6,2020-07-16 18:37:00,TweetDeck,15,76
Phoenix and Maricopa Co.’s COVID Rental Assistance programs - funded by the CARES Act that we passed into law - help Arizonans pay their bills and stay healthy during the ongoing public health crisis. Apply ⬇️  Maricopa Co.: https://t.co/r4CdtXPtVC  Phx: https://t.co/VNjD5duxUe,2020-07-16 18:36:43,Twitter Web App,9,15
Our bill makes sure AZ airports have the funding they need during the ongoing coronavirus crisis. https://t.co/HBmFUYroIw,2020-07-16 16:40:00,TweetDeck,6,38
#OnThisDay 51 years ago #Apollo11 launched! We’re working across the aisle to cut red tape support Arizona’s space industry and ensure America remains the global leader in space exploration.,2020-07-16 16:01:24,Twitter Web App,14,100
We pushed hard to ensure Yuma Proving Ground got needed funding in this year’s NDAA which the Senate is working to pass.  -$14M for the free fall school’s “ready building”  -$49.5M  for the Special Operations Forces Hangar  https://t.co/K6Y4KoiWbh https://t.co/Ucl5MGzljP,2020-07-16 13:33:43,TweetDeck,5,38
Coconino County: free COVID-19 testing this Friday July 17 from 7am-2pm at Page High School 434 S. Lake Powell Blvd.  No appointment is needed - testing is provided on a first come first serve basis. https://t.co/tVP8L0970d,2020-07-15 19:11:33,Twitter Web App,18,38
Free COVID-19 testing from @mesacc and @EmbryHealth 24 hours a day 7 days a week. Testing available at 1803 E. Rio Salado Pkwy Tempe and 1833 W. Southern Ave Mesa.  You must pre-register to be tested.  Register for an appointment here: https://t.co/SH2rX4jmOe,2020-07-15 17:47:00,Twitter Web App,14,19
Free COVID-19 testing Monday through Saturday from 11am-7pm at Kino Event Center 2805 E. Ajo Way Tucson AZ.  You must pre-register to be tested.  To pre-register visit ➡️ https://t.co/upi3E8hseD or call 800-369-3584.,2020-07-15 17:45:05,Twitter Web App,15,28
Be prepared this wildfire season. For resources or assistance visit our website - https://t.co/twJ3tyZ6ph - or email casework@sinema.senate.gov.,2020-07-15 16:00:49,Twitter Web App,5,14
We all need to make safe and smart choices - like wearing masks and social distancing - to slow the spread of coronavirus in our communities. https://t.co/THvUe6PwKv,2020-07-14 23:51:00,TweetDeck,49,277
Glad to announce North Country HealthCare’s telehealth service received $418996 through the CARES Act to help fight COVID-19. https://t.co/OCyj42OgLC,2020-07-14 21:24:00,TweetDeck,7,38
Now Congress needs to fully fund the International Boundary Water Commission so it can complete repairs in Nogales. https://t.co/admHBqMpSa https://t.co/0pFVofFbnI,2020-07-14 19:29:21,Twitter Web App,6,26
Our dedicated U.S. Service Academy students make Arizona proud and help keep America safe. https://t.co/iOZMUEJWwy,2020-07-14 16:24:23,Twitter Web App,12,74
Free COVID-19 testing from @ASU at Ak-Chin Pavilion 2121 N 83rd Ave Gate 6 tomorrow (7/14) from 7am-11am.  You must pre-register to be tested.  PRE-REGISTER HERE 👇 https://t.co/rVFAvUkfog,2020-07-13 22:30:35,TweetDeck,24,60
The administration must get more coronavirus relief funds to rural AZ health providers to help fight this pandemic. https://t.co/syxEYIThci,2020-07-13 16:41:00,TweetDeck,25,103
Pima County (@pimaarizona) residents: businesses with a “Ready For You” emblem have met safety standards to safely re-open and keep you safe during this public health crisis.,2020-07-13 16:01:22,Twitter Web App,41,193
The administration responded to our request and immediately released vital coronavirus resources so providers in underserved communities can keep Arizonans safe. https://t.co/rWvLpPyKUu,2020-07-13 00:52:00,TweetDeck,8,72
Say it with me: https://t.co/iccUNjIJU6,2020-07-12 22:00:00,TweetDeck,428,1784
We’re proposing the federal government establish a cybersecurity advisory committee to keep everyday Americans safe from cyberattacks so Arizonans can continue to innovate. https://t.co/YJPrX4lSbX,2020-07-12 18:09:00,TweetDeck,12,81
Our actions make a difference.  If we all wear masks social distance and stay home as much as possible we can #slowthespread of coronavirus. https://t.co/7R2nFSvAwL,2020-07-11 23:59:00,TweetDeck,112,558
Arizona lacks needed personal protective equipment which has delayed our ability to test since the pandemic began. We’re demanding a review of national stockpile distributions to ensure AZ gets the supplies to protect our communities. https://t.co/DBRSCsCetC,2020-07-11 17:05:00,TweetDeck,108,405
In this year’s NDAA which the Senate is working to pass we secured critical funds for Arizona’s Luke Air Force Base including:  -Funding for 60 F-35 strike fighters  -Repair and replacement of the Gila Bend turn-around  https://t.co/knXKAn1dqG https://t.co/ES8Nd6taAz,2020-07-11 00:14:00,TweetDeck,5,28
Free COVID-19 testing from @ASU at Ak-Chin Pavilion 2121 N 83rd Ave Gate 6 this Saturday (7/11) from 8am-12pm.  You must pre-register to be tested.  PRE-REGISTER HERE 👇 https://t.co/WGKIexKzSh,2020-07-10 20:28:44,Twitter Web App,34,55
Increasing penalties for coronavirus scams protects Arizona seniors from fraudsters seeking to take advantage of this public health emergency. https://t.co/dGOdwaUDPo,2020-07-10 19:00:28,Twitter Web App,12,35
Last year Arizona reported that almost 1/3 of those seeking emergency shelter in Arizona were over the age of 55. We’re making sure Arizona seniors have affordable safe and clean housing during this public health crisis. https://t.co/hWmTJprAk2,2020-07-10 17:14:00,TweetDeck,10,49
Our tele-town hall allowed us to hear directly from Arizona’s seniors answer questions about the coronavirus outbreak and ensure older Arizonans can access critical care and support. https://t.co/wn4AEqmX6o,2020-07-10 16:00:29,Twitter Web App,8,28
Arizonans: we need to take smart actions to slow the spread of coronavirus in our communities. To keep you and your loved ones safe wear a mask social distance and stay home as much as possible. https://t.co/Gcv5uOxQ8j,2020-07-09 22:45:00,TweetDeck,81,381
CARES Act funding is supporting jobs and Yuma’s transportation system during the global pandemic. https://t.co/SuySzU2rXR,2020-07-09 21:29:00,TweetDeck,5,30
Our new bill helps businesses and nonprofits create safer workplaces by offsetting the costs of implementing coronavirus safeguards. https://t.co/bqgJlaoyFF,2020-07-09 16:56:00,TweetDeck,8,52
Arizonans can sign up for county-specific wildfire alerts through our website:  https://t.co/twJ3tzgHNR,2020-07-09 16:02:56,Twitter Web App,6,24
We ensured this year’s NDAA - which the Senate is working to pass - includes vital funding for Fort Huachuca:  -$100M for Readiness and Environmental Protection Integration  -$33.7M for military construction   -Increase focus on Water Resiliency  https://t.co/dkKvGAIDDs,2020-07-09 00:09:00,TweetDeck,5,15
.@ArizonaDES launched a portal for Arizonans to report identity theft ➡️ https://t.co/Xv5CE8qPOj,2020-07-08 17:29:23,Twitter Web App,14,48
We need greater transparency of our strategic national stockpile to better distribute personal protective equipment and other critical medical supplies during public health emergencies. https://t.co/LBJG264Enz,2020-07-08 15:41:00,TweetDeck,21,94
Heartbroken to hear of the passing of Bryan Boatman a brave pilot who helped protect Arizonans from the Polles Fire. Sending our thoughts to his family and friends during this difficult time. https://t.co/9EyCdTj7nf,2020-07-08 13:52:03,Twitter Web App,13,84
We need to #slowthespread AZ.  Wear a mask practice social distancing and stay home as much as possible. https://t.co/57XM1y01Fr,2020-07-07 23:29:00,TweetDeck,118,521
Our new bipartisan bill ensures families of fallen veterans receive the benefits they’ve earned. https://t.co/pAVx98j7Bm,2020-07-07 20:50:00,TweetDeck,7,62
The administration needs to distribute CARES Act funding to Arizona’s children’s hospitals. https://t.co/ohqRbytyk1,2020-07-07 17:05:00,TweetDeck,2,45
Pima County’s “Ready For You” program ensures businesses are prepared to safely re-open while reducing the spread of COVID-19. https://t.co/djEijnj9wk,2020-07-07 16:00:19,Twitter Web App,3,11
We secured funding for vital programs at Davis-Monthan Air Force Base in this year’s Senate NDAA.  -Continued support for the A-10 program  - Funding for Compass Call program  https://t.co/D8YFGXXgcL https://t.co/QJ4H90cPhd,2020-07-06 23:00:00,TweetDeck,5,29
Arizona’s schools need more funding to help health and education leaders develop coronavirus guidelines precautions and restrictions so Arizona students can safely return to schools. https://t.co/7jvs9vm2ZR,2020-07-06 22:34:00,TweetDeck,75,306
Our resolution calls for increased @USPS funding to make sure Arizona communities have mail service. https://t.co/mQLLRHAVVm,2020-07-06 17:02:00,TweetDeck,32,126
Good news: a PPE grant from @fema will help protect Arizona’s health care workers and first responders.   https://t.co/b4RK33y7BH,2020-07-06 15:59:30,Twitter Web App,19,147
This wildfire season check out our website for info. to stay safe and secure.  https://t.co/twJ3tzgHNR,2020-07-05 22:41:00,TweetDeck,8,36
Arizona veterans servicemembers and their families can access needed resources and support here ➡️ https://t.co/Y5FuaagNQZ. We’ll get through these difficult times together.,2020-07-05 17:05:00,TweetDeck,8,32
Scientific studies show that close-up person-to-person contact increases the risk of spreading coronavirus. Stay home when possible keep 6 feet away from others and always wear a mask in public. https://t.co/d1hYUG12Oo,2020-07-05 00:11:00,TweetDeck,77,268
Share if you agree 👇 https://t.co/YMN8ar4G6y,2020-07-04 21:09:00,TweetDeck,1442,2972
I join all Arizonans this Independence Day in honoring our veterans’ and servicemembers’ sacrifices to keep America safe and secure—and protect the values of freedom justice and equality for which our nation continues to strive.,2020-07-04 13:39:20,Twitter for iPhone,30,334
Arizona we need to be smart. We have the worst coronavirus outbreak in the country. Stay home as much as possible keep six feet from others in public and wear a mask. https://t.co/NBgWfZeQHe,2020-07-03 20:48:00,TweetDeck,97,426
Happy National Park and Recreation Month Arizona!,2020-07-03 17:05:00,TweetDeck,17,266
We secured resources in this year's National Defense Authorization Act which the Senate is working to pass to help keep Americans safe and secure and maintain Arizona's leadership in our nation's defense. https://t.co/NtAkX5334U,2020-07-02 23:03:00,TweetDeck,4,20
Our new bill ensures rural Arizona communities can continue accessing electric and broadband services during the coronavirus pandemic. https://t.co/6Hsyxnr1Ie,2020-07-02 20:51:00,TweetDeck,13,69
Eligible Arizonans can file for Economic Impact Payments until October 15. Check your eligibility here: https://t.co/aBgrWSbwOS,2020-07-02 17:58:25,Twitter Web App,9,22
#OnThisDay 56 years ago President Johnson signed the Civil Rights Act into law. We’ll keep working to advance our nation’s values for all Americans: freedom justice and equal treatment under the law.,2020-07-02 15:02:58,Twitter Web App,39,205
In today’s Veterans’ Affairs Committee hearing we highlighted the need to ensure VA health centers and hospitals are fully staffed during coronavirus. https://t.co/bWyDu2Jumw,2020-07-01 23:46:00,TweetDeck,8,16
Heartbroken to hear of the loss of 21-year veteran police officer Jason Judd. Our thoughts are with his family friends and the entire Peoria community.,2020-07-01 23:45:43,TweetDeck,15,166
"We cannot thank Sen. Sinema...enough for sponsoring the Sgt. Daniel Somers Veterans Network of Support bill...If this policy had been available to us and our son...we feel that his tragic outcome might very well have been averted."  -@danielsparents  https://t.co/9tSCrpCjKE,2020-07-01 20:00:09,TweetDeck,22,146
The Senate just unanimously passed our Sgt. Daniel Somers Veterans Network of Support Act to ensure veterans transitioning to civilian life have the resources and support they’ve earned.  More about Sgt. Somers and how our bill will support all veterans 👇 https://t.co/qwyUJLksnA,2020-07-01 19:31:50,TweetDeck,20,66
