Tomorrow morning the Commemorative Air Force (@CAF1957) will fly historic warbirds over the Valley to mark the end of World War II and honor brave Arizona servicemembers throughout history.  https://t.co/tItPX6f3iX,2020-05-08 00:00:00,TweetDeck,4,24
We will recover if we are safe and smart. We must continue to stay home as much as possible and increase our testing and infection-tracking. https://t.co/4lKRrPVsOl,2020-05-07 21:51:00,TweetDeck,36,190
Our new bill increases telehealth services for Arizona Veterans. https://t.co/sTHBab06uh,2020-05-07 21:23:57,Twitter for iPhone,8,51
Arizona small businesses can still apply for paycheck protection loans to help keep workers employed during this public health crisis ➡️ https://t.co/tT6al09J00.,2020-05-07 21:02:32,Twitter for iPhone,3,12
We secured Army Corps funding in the bipartisan America’s Water Infrastructure Act for flood mitigation along Tonto Creek. https://t.co/cuBoho0E1q,2020-05-07 18:46:00,TweetDeck,4,13
We need safe and smart strategies to reopen Arizona. Moving too quickly will likely lead to the virus coming back causing greater loss of life and economic harm. https://t.co/Pwfn6lJVTf,2020-05-07 18:01:00,TweetDeck,36,174
Los proveedores de salud de Arizona están ofreciendo pruebas del coronavirus el sábado 9 de mayo y el sábado 16 de mayo. Encuentre sitios de pruebas horarios e información sobre la pre-registración aquí: https://t.co/cP24ov3zVj,2020-05-07 17:00:00,TweetDeck,5,13
AZ health providers are offering coronavirus tests on Saturday May 9 and Saturday May 16. Find testing sites hours of operation and info on pre-registration here:  https://t.co/cP24ov3zVj,2020-05-07 17:00:00,TweetDeck,6,30
To bend the curve of the virus and prevent a second wave we need contact tracing systems in place cleaning and hygiene standards and a workforce that is both protected from the virus and ready to support the airline industry. https://t.co/oLqNZdXQXX,2020-05-07 15:17:00,TweetDeck,38,204
https://t.co/mesroAUIu7,2020-05-06 22:51:17,TweetDeck,367,1679
We joined Arizona AARP for another tele-town hall to hear directly from Arizona’s seniors answer their questions and listen to their concerns about coronavirus. https://t.co/GnVeHq6JvL,2020-05-06 22:30:53,TweetDeck,8,30
To re-open strong we must be safe and smart. For now that means continuing to social distance and stay home - as well as increasing testing and infection-tracking. https://t.co/F8YivrNyBL,2020-05-06 21:30:00,TweetDeck,39,243
FCC awarded the Navajo Nation Department of Health $954990 and El Rio Santa Cruz Neighborhood Health Center in Tucson $444462 for telehealth services to help serve Arizonans during the coronavirus pandemic. https://t.co/18q3waFbGR,2020-05-06 20:48:00,TweetDeck,18,66
Congressional leaders must increase resources for water and sanitation projects for Tribal communities. https://t.co/kR15N8i0e7,2020-05-06 19:04:00,TweetDeck,14,61
IRONMAN’s donation of masks and shields will protect Arizona’s firefighters who are keeping us safe during this public health crisis. https://t.co/HQcgWc5UCc,2020-05-06 18:07:00,TweetDeck,8,59
La donación de IRONMAN de máscaras y protectores personales protegerá a los bomberos de Arizona quienes nos mantienen seguros durante esta crisis de salud pública. https://t.co/HQcgWbOjdC,2020-05-06 18:07:00,TweetDeck,1,6
We secured Arizona priorities in the Senate’s water infrastructure bill. https://t.co/F5zsop4dvd,2020-05-06 16:21:00,TweetDeck,7,54
Our bill will help small broadband companies provide critical connectivity for students and families to continue their education during the coronavirus pandemic. https://t.co/4bA0326lG7,2020-05-06 14:44:00,TweetDeck,9,59
Nurses support us during some of the toughest moments of our lives. On #NationalNursesDay we’re thankful for the amazing AZ nurses going above and beyond to care for our loved ones during this public health crisis. #ThankAZnurses https://t.co/N57jbKXglr,2020-05-06 13:28:59,TweetDeck,20,88
El Congreso y el Departamento del Tesoro deben garantizar que las comunidades más pequeñas reciban su cantidad justa de fondos para que todos los arizonenses reciban apoyo crítico durante la pandemia del coronavirus. https://t.co/AElRM74QWh,2020-05-06 00:09:00,TweetDeck,2,4
Congress and the Treasury Department must ensure smaller communities receive a fair share of funding so all Arizonans get critical support during the coronavirus pandemic. https://t.co/AElRM6Ng4J,2020-05-06 00:09:00,TweetDeck,5,14
Treasury is releasing part of the coronavirus funding for Tribal communities but they need to release the full $8B. Lives depend on it. https://t.co/l49p7jRUWC,2020-05-05 21:42:58,TweetDeck,40,161
Safe and smart steps including continuing to social distance and increasing testing are our keys to a strong re-opening of our economy. We have to do this right. https://t.co/bJU0wD93lt,2020-05-05 21:39:00,TweetDeck,30,139
Arizona: our social distancing is working. Let’s continue to stay home as much as possible to protect ourselves our loved ones and our communities from coronavirus. https://t.co/xHHYxorevD,2020-05-05 19:54:00,TweetDeck,97,481
Our new bill creates a $75B fund to help everyday Arizonans afford rent and mortgage payments during coronavirus. https://t.co/yfwgHHUclt,2020-05-05 19:09:00,TweetDeck,21,94
Arizona teachers are the best - thanks for all you do to educate AZ kids especially during these challenging times. #NationalTeacherDay,2020-05-05 17:25:00,TweetDeck,23,205
Following our request AZ agricultural producers can apply for disaster loan assistance here [https://t.co/K7WYYmbmLY] to access needed economic resources now.,2020-05-04 22:45:40,TweetDeck,18,58
Trabajamos con @IRSnews para garantizar que los recipientes de Arizona del ingreso de seguridad suplementario (SSI) reciban sus cheques de reembolso automáticamente. https://t.co/dWgo8kCyl1,2020-05-04 22:00:00,TweetDeck,2,18
We worked with @IRSnews to ensure Arizona recipients of Supplemental Security Income (SSI) automatically receive rebate checks. https://t.co/dWgo8kkXtt,2020-05-04 21:58:00,TweetDeck,14,80
The federal government needs to ensure community behavioral health organizations have sufficient funding to care for Arizonans in need during the coronavirus pandemic. https://t.co/7n1qJNP375,2020-05-04 20:05:00,TweetDeck,8,65
Social distancing is critical to saving lives and keeping Arizonans healthy. Please continue to stay home as much as possible and maintain at least 6 feet from others in public. https://t.co/pRcC4hOyGr,2020-05-04 19:04:00,TweetDeck,63,336
Domestic and sexual abuse survivors in Arizona and across the country need our full support in a public health crisis requiring Americans to stay in their homes. https://t.co/KTRP34DRfu,2020-05-04 16:00:01,TweetDeck,18,113
The federal government needs to immediately reopen the Economic Injury Disaster Loan application portal so businesses across Arizona can access needed resources. https://t.co/6LP71JJner,2020-05-04 14:48:00,TweetDeck,21,69
Interested in attending a U.S. Service Academy? Contact my office and apply here: https://t.co/cgZvzp6Qir,2020-05-03 23:32:00,TweetDeck,13,59
.@azcommerce provides free resources to help small businesses access funding and support during this public health crisis. https://t.co/foVFpRAEXc,2020-05-03 20:31:00,TweetDeck,8,37
I am happy to serve on the bipartisan White House task force focused on economic recovery working across the aisle to provide support for AZ state and local leaders. https://t.co/tITnRtQCNT,2020-05-03 17:10:17,Twitter for iPhone,38,459
Si no declaró sus impuestos en el 2018 o 2019 @IRSnews ofrece una herramienta gratis en el web para revisar su elegibilidad para un pago por impacto económico: https://t.co/TkUQu1achk,2020-05-02 23:56:00,TweetDeck,4,4
If you didn’t file a 2018 or 2019 tax return @IRSnews offers a free online tool to check your eligibility for an Economic Impact Payment: https://t.co/TkUQu1achk,2020-05-02 23:55:00,TweetDeck,8,19
Arizona restaurant workers: if you’ve lost pay due to coronavirus you can apply for immediate financial assistance here ➡️ https://t.co/y3MUWYKPRI,2020-05-02 21:00:00,TweetDeck,18,67
Trabajadores de restaurantes de Arizona: si perdió su ingreso debido al coronavirus usted puede solicitar para asistencia financiera inmediata aquí ➡️https://t.co/y3MUWYtet8,2020-05-02 21:00:00,TweetDeck,6,9
El personal de @CoconinoCC utiliza impresoras 3D para hacer mascarillas para nuestros hospitales y trabajadores de salud. https://t.co/vaxahbn1fU,2020-05-02 16:12:07,Twitter for iPhone,4,11
Amazing @CoconinoCC staff use 3D printers to make masks for our hospitals and health care workers. https://t.co/vaxahbn1fU,2020-05-02 16:10:04,Twitter for iPhone,10,51
.@Uarizona launched “AZCOVIDTXT” - a text-based resource to gather information on the spread of coronavirus. Learn more: https://t.co/CRrl5RGoqU,2020-05-02 00:17:00,TweetDeck,6,15
.@Uarizona lanzó “AZCOVIDTXT” - un recurso por mensaje de texto para obtener información sobre el brote de coronavirus. Aprenda más: https://t.co/CRrl5RoNzm,2020-05-02 00:17:00,TweetDeck,2,5
.@USTreasury needs to make sure Tribal communities across Arizona receive the CARES Act funding they are due. https://t.co/oiY11vjqFV,2020-05-01 21:18:09,TweetDeck,13,80
Following our urging the federal government will expand coverage of telehealth services for Arizona seniors and ensure community behavioral health organizations can continue to provide critical mental health services. https://t.co/7G94H5Rlsv,2020-05-01 20:19:00,TweetDeck,9,24
We need to keep up the great work and continue to stay home as much as possible. Social distancing is key to keeping our health workers safe and slowing the spread of infection. https://t.co/N5bTX0Xx15,2020-05-01 20:07:00,TweetDeck,37,241
Proud to nominate Arizona students to the U.S. Service Academies. Apply here https://t.co/cgZvzpor9Z for the Class of 2025.,2020-05-01 18:03:00,TweetDeck,3,17
We secured $7.2M in funding so that Flagstaff public transit is ready when Arizona re-opens. https://t.co/mOmyYdhI6Y,2020-05-01 16:39:00,TweetDeck,11,79
As the coronavirus outbreak continues our firefighters’ supply of personal protective equipment is in danger. Glad we could help get @AZFireFighters the PPE needed to do their jobs safely. https://t.co/6umIDDMSXM,2020-05-01 01:46:00,Twitter Media Studio,15,83
We hosted our weekly call with AZ mayors to discuss our work getting Arizona communities critical health resources economic support and small business help.,2020-05-01 00:30:00,TweetDeck,19,155
SBA and Treasury need to ensure AZ small businesses are protected when they submit their PPP applications in good faith. https://t.co/cmm0bC4zWP,2020-04-30 23:49:00,TweetDeck,7,28
Tomorrow at 3:10 p.m. @LukeAFB and @AZNationalGuard will honor our incredible first responders with a community flyover. Thank you AZ health workers for your dedication to keeping us safe and healthy.,2020-04-30 20:43:23,Twitter for iPhone,22,120
Our website - https://t.co/HZWAXRkGxE - has helpful resources and information for Arizonans struggling during coronavirus. https://t.co/qUNSSPE4jf,2020-04-30 19:49:00,TweetDeck,5,21
Federal agencies need to work together to make sure Arizonans have access to broadband during this crisis. https://t.co/rRbTbtZ8H0,2020-04-30 17:05:00,TweetDeck,10,47
Tuvimos nuestra llamada regular con los líderes de organizaciones sin fines de lucro de Arizona para discutir inquietudes relacionadas al coronavirus y cómo podemos asistir a los arizonenses acceder apoyo.,2020-04-29 20:58:34,Twitter Web App,4,14
We hosted our regular call with AZ’s nonprofit leaders to discuss coronavirus-related concerns and how to help Arizonans access support.,2020-04-29 20:58:22,Twitter Web App,6,49
Arizona students: applications for the Class of 2025 open May 1. Apply here: https://t.co/cgZvzpor9Z,2020-04-29 19:26:38,Twitter Web App,1,3
@NavalAcademy nominees:   Daniel Wall (@danielwall_7) - Tucson  Alan Gardener - Benson  Mason Wunder - Tucson John Moore - Paradise Valley Autumn Peterson - Scottsdale,2020-04-29 19:26:37,Twitter Web App,2,9
@WestPoint_USMA nominees:   Willow Brown - Phoenix Brian Lunn - Surprise  Brooke Stratman (@brookestratman) - Mesa Rich Juin - Gilbert Brandon Escamilla - Mesa,2020-04-29 19:26:37,Twitter Web App,2,5
@AF_Academy nominees:   Alexis Lee - Scottsdale  Camille Bych (@cammibych_) - Phoenix  Chaz Wilson (@chaz_cw) - Gilbert  Hailey Stelse (@HStelse) - Scottsdale  Jack Senese (@jack_senese1) - Tucson  Daniel Avila - Paradise Valley Gretchen Knox (@gretchknox) - Lakeside,2020-04-29 19:26:37,Twitter Web App,5,15
Proud to have nominated incredible Arizona students from all around the state to our U.S. Service Academies. Congratulations! Thank you for your dedication to keeping America safe. https://t.co/h20Ca93FDS,2020-04-29 19:26:37,Twitter Web App,7,54
Familias de Arizona - @CoxComm extendió su servicio Connect2Compete brindando internet gratis a las familias de Arizona con un estudiante de K-12 en el hogar hasta el 15 de julio. Gracias por ayudar a los estudiantes de Arizona terminar su año escolar.,2020-04-29 17:34:39,Twitter Web App,4,12
Arizona families - @CoxComm extended its Connect2Compete service providing free internet for AZ families with a K-12 student at home until July 15. Thank you for helping AZ students finish out the school year.,2020-04-29 17:34:28,Twitter Web App,4,20
We must allow Arizona seniors to access non-emergency medical services over the phone during this public health crisis. https://t.co/HWjjhq15Xf,2020-04-29 16:17:27,Twitter Web App,22,83
Los restaurantes @aioliburgers Modern Tortilla y Oak Wood-Fire Pizza llevan comidas preparadas cada semana para nuestros valientes socorristas y sus familias. Compre una comida aquí: https://t.co/15agk6RSZk,2020-04-29 14:48:55,TweetDeck,4,6
Amazing AZ restaurants @aioliburgers Modern Tortilla and Oak Wood-Fire Pizza deliver prepared meals every week to our brave first responders and their families. Purchase a meal here: https://t.co/15agk6RSZk,2020-04-29 14:48:31,TweetDeck,7,32
Arizonans: If you need help during this time please reach out - casework@sinema.senate.gov - and visit https://t.co/HZWAXRkGxE for useful information and resources. https://t.co/4WmMd85FJb,2020-04-29 00:47:30,TweetDeck,5,14
We heard directly from the Arizona Chamber of Commerce and small business owners to answer questions about coronavirus-relief programs and discuss how to support our employers during these challenging times.,2020-04-28 23:30:30,TweetDeck,3,33
FEMA needs to distribute coronavirus tests to states based on population. I’m working to ensure Arizona gets its fair share of tests PPE &amp; resources. https://t.co/G6xok1R7hX,2020-04-28 23:10:30,TweetDeck,13,83
Arizonans receiving SSI or veterans benefits who don’t normally file taxes but do claim eligible child dependents: enter info. by Tuesday 5/5 to get your full payments ASAP:  https://t.co/TkUQu0SBpM,2020-04-28 22:25:00,TweetDeck,11,24
Los arizonenses que reciben beneficios para veteranos o SSI que normalmente no declaran impuestos pero reclaman dependientes de niños elegibles: ingrese la información antes del martes 5/5 para recibir sus pagos completos lo antes posible: https://t.co/TkUQu0SBpM,2020-04-28 22:25:00,TweetDeck,1,3
Gracias @GoldmanSachs por comprometer $5M para ayudar a los negocios pequeños de Arizona a superar esta crisis de salud pública. Los negocios pequeños pueden solicitar préstamos del Programa de Protección de Pago de Cheques aquí: https://t.co/wRgnBnapLJ,2020-04-28 20:45:00,TweetDeck,2,7
Thank you @GoldmanSachs for pledging $5M to help AZ small businesses get through this public health crisis. Small businesses can apply for Paycheck Protection Program loans here:  https://t.co/wRgnBnapLJ,2020-04-28 20:45:00,TweetDeck,12,39
We joined @McCainInstitute and @ASU for a virtual fireside chat on the importance of public service during crises including the current coronavirus pandemic. https://t.co/oiQY5lEq0S,2020-04-28 20:13:00,TweetDeck,6,32
Increasing broadband service on the Navajo Nation is a good first step. We’ll keep working to ensure Tribal communities across Arizona can access every available resource to fight the spread of coronavirus. https://t.co/qlLiLfWfeh,2020-04-28 18:29:00,TweetDeck,11,68
Aumentar el servicio de banda ancha en la Nación Navajo es un buen primer paso. Continuaremos trabajando para garantizar que las comunidades tribales a través de Arizona puedan acceder cada recurso disponible para luchar contra el brote del coronavirus. https://t.co/qlLiLfWfeh,2020-04-28 18:29:00,TweetDeck,3,6
The federal government must remove all unnecessary barriers blocking Arizona seniors from getting direct payments they are counting on. https://t.co/MrnOjglbr5,2020-04-28 16:00:01,TweetDeck,11,58
Gracias @DignityHealthAZ por diseñar batas de tela reusables para nuestros trabajadores de salud. https://t.co/V0HXdelf2d,2020-04-27 23:24:00,TweetDeck,8,17
Thank you @DignityHealthAZ for designing reusable fabric gowns for our health care workers.   https://t.co/V0HXdeCQqN,2020-04-27 23:24:00,TweetDeck,8,43
The federal government needs to give nursing associations tourism boards &amp; other trade organizations access to economic assistance. https://t.co/J3PaRs4UQu,2020-04-27 21:00:00,TweetDeck,14,62
Buenas noticias - @AZNationalGuard entregó materiales a @FabricTempe para producir batas aprobadas por el FDA para los trabajadores de salud. https://t.co/R9NGW2wMVW,2020-04-27 18:06:00,TweetDeck,6,10
Good news - @AZNationalGuard delivered materials to @FabricTempe to produce FDA-approved gowns for health workers. https://t.co/R9NGW2fbxm,2020-04-27 18:06:00,TweetDeck,9,38
We need to make sure the next coronavirus relief package includes funding for mental health and suicide prevention. https://t.co/RqNFMAJaRi,2020-04-27 18:03:19,TweetDeck,41,262
USDA must protect agriculture inspectors Arizona farmers and our ports of entry during the coronavirus pandemic. https://t.co/vmo0yle98a,2020-04-27 14:58:31,TweetDeck,12,64
Tucson: si necesida cuidado de niños o comestibles o tiene dificultad pagando sus cuentas revise la guía de recursos de @TucsonStar: https://t.co/K9jPu6Mi4K,2020-04-27 01:27:00,TweetDeck,2,9
Tucsonans: if you need childcare or groceries or have trouble paying your bills check out @TucsonStar’s coronavirus resource guide: https://t.co/K9jPu6Mi4K,2020-04-27 01:27:00,TweetDeck,17,36
The next relief package needs to provide direct financial relief for towns cities and Tribal communities with less than 500000 people. https://t.co/EKxC1s6Sel,2020-04-26 21:56:00,TweetDeck,47,206
Los estadounidenses están recibiendo pagos directos para ayudar con la dificultad financiera relacionada al brote del coronavirus. Esto es lo que tiene que saber: https://t.co/QyWb4WSSCc,2020-04-26 20:06:28,TweetDeck,3,13
Americans are receiving direct payments to help with financial strain related to the coronavirus outbreak. Here’s what you need to know: https://t.co/QyWb4WSSCc,2020-04-26 19:07:00,TweetDeck,6,39
Arizonans should listen to government scientists and specialists; they are experts and will help you stay safe healthy and calm. https://t.co/gyehd5nkst,2020-04-26 00:03:00,TweetDeck,72,521
Read these 10 tips to protect yourself from coronavirus scams: https://t.co/9qGjApM1ie,2020-04-25 18:34:00,TweetDeck,10,30
Lea estos 10 consejos para protegerse de las estafas de coronavirus: https://t.co/9qGjAq3C9M,2020-04-25 18:34:00,TweetDeck,1,4
Escuchar directamente de líderes locales nos ayuda a garantizar que las ciudades y pueblos de Arizona tengan los recursos de salud y el apoyo de negocios pequeños que necesitan. https://t.co/WfvDVFZHRA,2020-04-25 16:04:00,TweetDeck,3,8
Hearing directly from local leaders helps us ensure Arizona’s cities and towns have the health care resources and small business support needed. https://t.co/WfvDVFZHRA,2020-04-25 16:04:00,TweetDeck,8,39
Happy to help @ralphamsden! Arizonans: if you need help getting your direct payment or anything else please reach out. ⬇️ casework@sinema.senate.gov https://t.co/STtJiGXuWh,2020-04-24 20:39:01,TweetDeck,17,114
Nuestro tele-town hall con @AZ_AARP nos permitió escuchar de las personas mayores de AZ responder preguntas sobre el coronavirus dar consejos en cómo prevenir estafas y garantizar que las personas mayores tengan acceso al cuidado y apoyo necesario. https://t.co/wXGT3CHcSj,2020-04-24 20:19:00,TweetDeck,2,4
Our tele-town hall with @AZ_AARP allowed us to hear directly from Arizona seniors answer questions about coronavirus share tips on avoiding dangerous scams and ensure seniors have access to the care and support they deserve. https://t.co/wXGT3CHcSj,2020-04-24 20:19:00,TweetDeck,2,8
We hosted our weekly call with AZ mayors and county leaders to discuss their coronavirus-related concerns and provide an update on the recent Congressionally-approved coronavirus relief package. https://t.co/B8xJVO2G7a,2020-04-24 20:03:32,TweetDeck,12,48
Most Arizona utilities are maintaining service even if you are struggling to pay your bills due to coronavirus. More info at: https://t.co/zwAB9RFQ4b https://t.co/u6tlAlfiuu,2020-04-24 18:19:00,TweetDeck,8,22
.@USTreasury just announced that they will allow Tribal gaming operations to apply for and receive Paycheck Protection Program funding. https://t.co/OMguzUSBEa https://t.co/W1jFwRxxye,2020-04-24 17:37:48,TweetDeck,12,60
The federal government needs to give Tribal communities access to the Paycheck Protection Program. https://t.co/lYvDTGoAk3,2020-04-24 15:10:00,TweetDeck,17,66
Ramadan Mubarak to all Arizonans observing Ramadan!,2020-04-23 23:12:24,Twitter for iPhone,6,43
.@CDCgov needs to implement a contact tracing system to protect Arizonans from coronavirus spread. https://t.co/PYEHYCQyZj,2020-04-23 22:07:00,TweetDeck,17,70
We secured $142964 for a project to provide clean water to communities on the Navajo reservation. https://t.co/gVQiE5lpU0,2020-04-23 21:17:01,TweetDeck,28,215
This week’s Senate package invested $25B in coronavirus testing which is vital to turning the corner on this pandemic. https://t.co/ccVejnEpMU,2020-04-23 19:30:00,TweetDeck,8,55
https://t.co/aEdUxCUYK5,2020-04-23 17:58:05,TweetDeck,86,374
Update your direct deposit info. and check the status of your direct payment under the CARES Act:  https://t.co/6bdoxTPJeF,2020-04-23 17:30:00,TweetDeck,12,27
Actualice su información de depósito directo y revise el estatus de su pago directo brindado por el CARES Act: https://t.co/6bdoxTPJeF,2020-04-23 17:30:00,TweetDeck,1,3
We’ll continue to hear from AZ local leaders to help shape federal coronavirus response efforts. https://t.co/8PXxYU9nZv,2020-04-23 15:40:00,TweetDeck,4,38
Arizona homeowners: struggling to make mortgage payments because of the coronavirus pandemic?  Visit https://t.co/zwAB9RoeFB for helpful resources. https://t.co/hDidcTFAe7,2020-04-22 23:03:00,TweetDeck,11,26
We spoke with @NavajoCouncil Speaker Seth Damon about coronavirus relief efforts and resources the Navajo Nation needs to protect the health and safety of their community. https://t.co/zmMn8eMGKs,2020-04-22 22:45:27,TweetDeck,13,74
Expanding broadband for rural communities ensures every AZ student gets equal access to education during the coronavirus pandemic. https://t.co/W1lQv1CKPL,2020-04-22 18:30:00,TweetDeck,6,30
Expandiendo la banda ancha para las comunidades rurales garantiza que todo estudiante de AZ reciba el mismo acceso educativo durante la pandemia del coronavirus. https://t.co/W1lQv1l9rb,2020-04-22 18:30:00,TweetDeck,1,5
16 years ago we lost a hero. Today we remember Pat Tillman for his legacy of service honor and sacrifice.,2020-04-22 16:01:00,TweetDeck,36,382
The latest Senate package included $75B for health care. Health workers are working every day to fight the coronavirus pandemic. https://t.co/1PsVkRnhW8,2020-04-22 15:03:00,TweetDeck,4,44
While we eliminate barriers to direct payments Arizonans who get Social Security SSI or veterans benefits who don’t normally file taxes but claim eligible child dependents: enter info by 9am AZ time on Wed. 4/22 to get your full payment more quickly: https://t.co/TkUQu0SBpM. https://t.co/dzcW9qFLl8,2020-04-21 23:51:44,TweetDeck,15,39
The IRS and Treasury need to continue to eliminate barriers to Arizonans’ direct payments especially for federal beneficiaries with child dependents. https://t.co/9E20ydGFqu,2020-04-21 23:47:34,Twitter for iPhone,16,62
Today’s critical support for small businesses and hospitals is a necessary next step and more must be done. We’ll keep working across the aisle to get Arizona the support needed to save lives and livelihoods. https://t.co/6P6rE4Eick,2020-04-21 21:33:39,TweetDeck,12,79
Today’s Senate package includes $370B to support small businesses including funding for the Paycheck Protection Program so more employees can stay on payroll during the coronavirus crisis. https://t.co/ldcoCTbZ4G,2020-04-21 21:09:39,TweetDeck,14,110
Buenas noticias - @AmericanAir donó 26000 alimentos a @StMarysFoodBank para apoyar a las comunidades afectadas por el coronavirus. https://t.co/dS6EOg1b2p,2020-04-21 20:30:00,TweetDeck,1,2
Great news - @AmericanAir donated 26000 meals to @StMarysFoodBank to support communities affected by coronavirus. https://t.co/dS6EOgiLTX,2020-04-21 20:30:00,TweetDeck,5,36
We're ensuring Arizona hospitals get the resources needed to stay open continue caring for Arizonans and save lives. https://t.co/ppSe0Rfqec,2020-04-21 18:15:00,TweetDeck,5,27
Estamos garantizando que los hospitales de Arizona reciban los recursos necesarios para mantenerse abiertos continúen cuidando de los arizonenses y salven vidas. https://t.co/ppSe0QXPmE,2020-04-21 18:15:00,TweetDeck,1,1
The federal government needs to provide relief to Arizona’s AHCCCS providers during coronavirus. https://t.co/8cR9Q67u9g,2020-04-21 17:03:51,TweetDeck,15,56
