Congratulations to @Almagro_OEA2015 on his re-election as Secretary General of the @OAS. I value his continued leadership on democracy and human rights in the Western Hemisphere and look forward to working with him to address the unprecedented challenges facing the region.,2020-03-20 17:12:56,Twitter for iPhone,0,4
We are in a gobal pandemic-Congress should utilize modern technology to permit remote voting. Votes on spending &amp; response to the pandemic are critical &amp; will need quick action. Remote voting is a way to effectuate social distancing &amp; follow proper health procedures #RemoteVote,2020-03-18 22:49:34,Twitter for Android,11,30
The link below will direct you to a summary of what each federal agency and each individual state is doing to deal with COVID-19. We will continue to provide updates throughout the days and weeks to come. Please share this info with friends and family. https://t.co/cI4oU3vRik,2020-03-18 16:02:02,Twitter for iPhone,3,3
In addition to introducing the SHEET Act with @SenTedCruz I last week sent a letter to the @FBI asking for information on what resources may be needed to combat foreign influence in the United States. (2/2) https://t.co/GCABbDG0CY,2020-03-03 19:30:14,Twitter Web App,2,2
The United States must increase the resources we deploy to fight against subversive foreign influences at work in our country. (1/2),2020-03-03 19:29:37,Twitter Web App,2,5
Glad the NLRB published a new joint-employer rule to overturn the 2015 Obama NLRB decision which is grossly prejudicial to employers. By reinstating a long standing  interpretation local businesses will be re-empowered to create new jobs. https://t.co/wiRq4RxGhq,2020-02-26 16:09:38,Twitter Web App,1,0
Reports of armed police and soldiers entering #ElSalvador’s National Assembly are deeply concerning. I urge all sides to come together in a peaceful and constructive manner to address the needs of the Salvadoran people.  https://t.co/UjuFJq0hDn,2020-02-10 21:48:45,Twitter Web App,108,179
On this day in 1962 Pres. Kennedy expanded the embargo of goods to Cuba. Likewise the facilitation of 90% of #Venezuela’s oil production by #Russia about 400k bpd must be stopped whether through interdiction or embargo. (2/2),2020-02-07 19:14:06,Twitter Web App,1,1
This unjust imprisonment of US citizens by the #Maduro regime should be vigorously opposed by the US and our democratic partners. We must maintain pressure on the corrupt Maduro regime in order to facilitate a democratic transition in #Venezuela. (1/2) https://t.co/rwgr8BVQgS,2020-02-07 19:13:26,Twitter Web App,4,4
Employees deserve a voice that is reflective of today’s rapidly modernizing workplace. Though I do not support the PRO Act I am proud to offer a pro-worker amendment that would improve this bill. (2/2),2020-02-07 00:43:46,Twitter for iPhone,2,3
Today I offered an amendment to the PRO Act to empower current union employees who are locked into old and outdated union contracts. In 2016 NLRB data showed that only 6% of union members voted to be represented by their union. (1/2),2020-02-07 00:43:30,Twitter for iPhone,3,1
As a proud father and grandfather I am committed to protecting the sanctity of human life starting at conception. I will continue fighting for the rights of the unborn. I am proud to support today’s #marchforlife2020 https://t.co/gpcc65v3ox,2020-01-24 20:39:58,Twitter Web App,2,12
#PriceOnPollution https://t.co/1kBYAyCdN2,2020-01-24 19:22:40,Twitter Web App,28,84
The new standard is a common sense return to the traditional legal framework that will empower our local businesses and give them the ability to create new jobs. https://t.co/auIntw7IAc,2020-01-22 20:54:40,Twitter Web App,3,4
