Congratulations to @FGCU on being recognized as the top university in Florida for entrepreneurial studies. #FlyEaglesFly https://t.co/9f4UROVag1,2020-11-25 21:12:43,Twitter for Android,1,1
- that is how our system of government works. We have more that unite us than divide us and now that the heat of battle has drawn to a close we must come together for the betterment of all our citizens. (2/2),2020-11-08 17:09:35,Twitter for Android,103,1127
Congratulations to Pres-elect Biden on a successful campaign. All Americans need to come together to support Pres-elect Biden. Our nation will only be successful if the new admin is. We must work together to enact bipartisan legislation &amp; solve the problems our country faces 1/2,2020-11-08 17:09:04,Twitter for Android,1127,11785
Another improvement would be to hold social media outlets responsible for their content like a newspaper. The ultimate answer is term limits; public service as a temporary duty rather than a career as the Founders intended. (4/4),2020-11-07 14:39:32,Twitter for Android,23,356
We must all work together to overcome America’s challenges. A return to balanced Congressional Districts would be big help. Let the general election not the primary detetmine representation. (3/4),2020-11-07 14:39:10,Twitter for Android,9,122
Likewise Democrats will hopefully realize that all this talk about socialism defunding police and supporting violence is a losing proposition. (2/4),2020-11-07 14:37:08,Twitter for Android,9,89
The election is a wake up call for America: to prosper Republicans need a message which appeals to college educated &amp; suburban voters like we used to have &amp; we need to lead on solutions for legal &amp; orderly immigration and on the challenges presented by climate change. (1/4),2020-11-07 14:36:42,Twitter for Android,12,107
Congratulations to Judge Amy Coney Barrett on her confirmation as our newest Supreme Court Justice! I am confident that Justice Barrett will be a champion of Constitutional jurisprudence &amp; maintain a professionalism &amp; sound judicial temperament throughout her time on the Court.,2020-10-27 00:16:54,Twitter for Android,2,44
This is a historic day for the Catholic Church as Pope Francis has appointed Archbishop Wilton Gregory to the position of Cardinal becoming the first  black bishop to accede to this position in the U.S. Cardinal Gregory will excel in his new role. https://t.co/Kt0Xw3eJoo,2020-10-25 22:43:41,Twitter for Android,2,19
I am a strong believer in the principles of both judicial independence &amp; due process for accused persons in all cases. I have recently read reports about the Uribe case that raise serious questions about whether due process has been followed in the investigation and in his arrest https://t.co/ghXqoLwnMb,2020-10-14 19:07:56,Twitter Web App,390,520
Kathleen and I are hoping for a speedy and complete recovery  for the @POTUS and @FLOTUS at this time.,2020-10-02 12:39:22,Twitter for Android,1,14
Pleased that @NOAA will award over $2.2 Million in grants to universities across the U.S. to combat the overwhelming threat that rising sea levels have on coastal communities. @FGCU will benefit due to their outstanding work in developing a coupled coastal &amp; inland flooding model,2020-09-28 16:21:30,Twitter for Android,4,42
She was a champion of women's rights and had a love of our country that was unchallenged. Her passion and opinions will remain with us throughout history. May she rest in peace. (2/2),2020-09-19 00:14:53,Twitter for Android,3,20
It is a sad day for our nation. Kathleen &amp;  I offer our deepest sympathies on the passing of Justice Ruth Bader Ginsberg. The passing of Justice Ginsberg is a great loss for our highest court and for America. (1/2),2020-09-19 00:14:20,Twitter for Android,4,24
On this 19th anniversary of 9/11 we must #NeverForget the thousands of innocent lives we lost on that beautiful day in 2001 and we must continue to honor the brave first responders who saved lives and sacrificed their own. https://t.co/NqZzwCiujb,2020-09-11 13:44:31,Twitter for Android,3,10
Continued U.S. efforts to strengthen rule of law and respect for democratic institutions in #El Salvador are critical to addressing the serious challenges facing the country. The U.S. must maintain its leadership in these efforts. https://t.co/wBeTfnPPA8,2020-09-10 23:37:34,Twitter for Android,3,4
I hope that the Senate will now realize what the House of Representatives &amp; Pres. Trump realize-that FL needs to be protected from offshore drilling-&amp; act to convert this executive order into formal legislation like HR 205 so that it cannot be easily reversed by a future admin3/3,2020-09-08 20:41:17,Twitter for Android,1,5
I've worked tirelessly to unite FL Congressional delegation on this issue pass legislation to permanently extend the moratorium in the EGOM &amp; lobby this admin on the need to keep offshore drilling from being a potential danger to our economy ecology &amp; military readiness2/3,2020-09-08 20:38:02,Twitter for Android,1,7
By this Executive Order President Trump has taken an important action to protect Florida’s economy &amp; ecology from the threat of offshore drilling. (1/3) https://t.co/W70VkMXAyk,2020-09-08 20:31:14,Twitter for Android,2,10
As we celebrate the 75th anniversary of the end of the Second World War let us not forget the sacrifices our brave men and women of the American armed forces extended to free millions of innocent civilians across the globe from oppressive tyrannical governments.,2020-09-02 19:28:55,Twitter for Android,1,3
This is truly an unworkable  idea and can only result in more disastrous policy. Defered amounts will either be forgiven or reimbursed by the federal government or worse employers will be required to pay them. (2/2),2020-09-01 20:45:26,Twitter for Android,1,7
The employee portion payroll tax deferal is a reckless idea that will put many employees in jeopardy for the deferred liability when it becomes due  since  they will have already spent the deferred amounts.  (1/2) https://t.co/E6UCbXS2n5,2020-09-01 20:41:48,Twitter for Android,12,16
I am pleased to announce @marinesanctuary has received a grant from @NOAA to provide funding to the Clean Seas Florida Keys program. As a co-sponsor of the Save Our Seas Act I support grassroots efforts such as these to encourage communities to take action to clean our oceans,2020-09-01 20:31:01,Twitter for Android,1,11
This is the wrong move especially at a time when we are beginning to see Covid cases falling and social distancing/mask wearing working. It is critical for people to be tested if they have come in contact with a Covid positive person. https://t.co/5jgPziMf1M,2020-08-28 14:53:28,Twitter for Android,1,14
CNN you are better than this. What part of burning buildings rioting and shooting is peaceful? Now more than ever we need fair and honest journalism - and we need a return to law and order. https://t.co/polNZlS87i,2020-08-27 14:57:01,Twitter for Android,12,36
China wasted no time silencing free speech in Hong Kong &amp; arresting those such as Jimmy Lai that dissent from the communist message of Beijing. As I pointed out in my op-ed last month there are steps that can be taken to punish China for these actions. https://t.co/U8PzIIw3Wm,2020-08-11 22:16:24,Twitter for Android,845,937
Today @POTUS signed the Great American Outdoors Act into law. This legislation which I cosponsored will provide our national parks with badly needed upgrades tourism development and wildlife refuges.,2020-08-04 21:25:01,Twitter for Android,5,40
It is critical that we continue to build on the legacy of the USAGM and its subsidiaries as unbiased and nonpartisan voices of freedom democracy and human rights throughout the world. https://t.co/Zw3JRBKao0,2020-08-03 14:51:08,Twitter for Android,5,6
Remote voting effectuates social distancing and follows proper health procedures. The work of Congress must continue but it need not put people at risk unnecessarily. (3/3),2020-07-29 21:52:04,Twitter for Android,9,28
Votes have been occurring remotely for several months now with no adverse consequences. Given the recent COVID-19 positive test results for my colleagues including Louie Gohmert today this method of voting is the prudent and rational course of action. (2/3),2020-07-29 21:51:15,Twitter for Android,7,25
As I have said before Congress should utilize modern technology to permit remote voting. While I wanted to proxy vote as soon as the Speaker set it up I agreed to wait until the lawsuit challenging its legality had been heard which has now happened. (1/3),2020-07-29 21:50:23,Twitter for Android,8,36
I am pleased to report that 5000 pythons have been removed from the Florida Everglades and surrounding regions by the @SFWMD @MyFWC and @NatlParkService. This is a significant milestone in the fight to remove these harmful animals. https://t.co/TYmWS3YSrc,2020-07-29 17:57:59,Twitter Web App,17,56
The President’s executive order takes us one step closer in bringing prescription drug costs to a heel. I supported the End Price Gouging for Medications Act with this same goal in mind. Reigning in the pharmaceutical industry is long overdue. https://t.co/bOCZs2SYNc,2020-07-24 22:07:08,Twitter for iPhone,4,8
Crown Prince Mohammad Bin Nayef  has worked constructively with the United States for many years and was instrumental in providing counter terrorism intel in the aftermath of 9/11. We need to know right now where he is and if he is safe. https://t.co/HdqFkkZsxY,2020-07-16 16:45:39,Twitter for Android,27,27
I join @repsires in urging a transparent selection process for Guatemala’s judiciary in accordance with the rule of law. We should work w/Guatemala to strengthen their anti-corruption efforts. As they push for more direct foeign investment transparency &amp; rule of law are critical https://t.co/2EwXWxcjxD,2020-07-09 13:58:58,Twitter for iPhone,2,2
https://t.co/vuWVewzA35 (2/2),2020-07-07 21:16:05,Twitter for Android,0,0
@POTUS is right to push back on China’s hegemonic ambitions &amp; abusive authoritarian practices &amp; to call for reordering Western companies’ supply chains to reduce dependence on China. In the words of Lenin"The Capitalists will sell us the rope with which we will hang them"(1/2),2020-07-07 21:15:37,Twitter for Android,0,1
I strongly condemn the continued human rights abuses committed by the Castro regime in #Cuba. The Cuban people deserve access to independent information and the chance to speak freely without government repercussions. I continue to stand with them in their struggle for freedom. https://t.co/WQzxbBtOk4,2020-07-01 17:47:53,Twitter for iPhone,1,4
This move will reflect that Poland is a reliable security partner for the United States and will strengthen U.S. military capability to respond to any Russian aggression in the Baltics. (2/2),2020-06-24 19:01:26,Twitter for iPhone,2,4
With news this month that the U.S. will begin to decrease its permanently stationed forces in Germany — I hope earnestly that @POTUS will discuss a potential positioning of significant U.S. military in Poland in his meeting today with Polish President Andrzej Duda. (1/2),2020-06-24 19:01:10,Twitter for iPhone,2,3
Kathleen and I would like to extend our thoughts and prayers for @RepAndyBarr and his family over the unexpected loss of his wife Carol.,2020-06-17 17:17:27,Twitter for iPhone,2,6
I join my colleague @repsires in rejecting Maduro’s unconstitutional naming of a sham electoral council. We will continue to stand with @AsambleaVE and the Venezuelan people in demanding free and fair elections. https://t.co/K99aMiSvWl,2020-06-16 21:21:50,Twitter for iPhone,26,38
Today is #Flagday. Please join me in celebrating our Nation’s Flag and in honoring those who fought to protect the rights and freedoms that it symbolizes. https://t.co/eFiSzcVwhp,2020-06-14 23:35:11,Twitter for iPhone,4,13
Please join me in celebrating #worldoceansday. As an avid outdoorsman I am constantly reminded of how blessed we are to enjoy our oceans. We must continue to take significant steps to clean and preserve our oceans so future generations will also be able to share in their beauty,2020-06-08 21:27:29,Twitter for iPhone,2,12
We must hold corrupt actors accountable for their crimes and demonstrate that the U.S. continues to support the fight against corruption in #Guatemala. https://t.co/WL513btXYb,2020-06-08 19:45:44,Twitter for iPhone,2,6
This legislation will protect our intellectual property from theft by the Chinese government. Congress should pass the SHEET Act now. (2/2) https://t.co/fzS2plsQIc,2020-05-29 23:09:10,Twitter for iPhone,6,10
Today @POTUS announced restrictions on Chinese graduate students in the United States – a decision that I support &amp; one that both @tedcruz and I have addressed through the SHEET Act which we introduced in June 2019.  (1/2),2020-05-29 23:08:02,Twitter for iPhone,6,12
Florida’s Tax-Free Holiday for hurricane preparedness begins this Friday May 29th and runs through June 4th. Items such as batteries coolers flashlights generators radios and tarps will be available tax free. #BePrepared https://t.co/CcwkuYuYOu,2020-05-28 22:19:04,Twitter for iPhone,2,8
Today astronauts Bob Behnken &amp; Doug Hurley will reach for the stars as they take part in the first manned space flight from the U.S. in 9 years. In cooperation with NASA the Spacex’s Crew Dragon rocket will launch from the Kennedy Space Center at 4:33 PM https://t.co/2VO5WPDALY,2020-05-27 19:21:06,Twitter for iPhone,1,2
Reinstating the Fairness Doctrine which served us well for 48 years would recreate a climate in which all sides of an issue are equally presented and heard https://t.co/NdHOdIOVzV,2020-05-27 02:21:02,Twitter for Android,1,8
I’m deeply concerned the Ortega regime in #Nicaragua continues to cover up impact of COVID-19 within its borders. I urge full cooperation w/medical experts to mitigate the devastating effects of this virus &amp; support the well-being of the Nicaraguan people https://t.co/GUPO91YAQF,2020-05-21 18:24:18,Twitter for iPhone,56,76
Data clearly shows how normal modes of transp. contribute to carbon emissions. With social distancing in place carbon emissions have been reduced 17%. Moving forward we should enact a carbon tax at the source to lower output of these harmful chemicals https://t.co/bf5Nf9HjEM,2020-05-20 22:52:14,Twitter for Android,47,105
Cong. should utilize all options for conducting business. Proxy/remote voting allows for distancing/following of proper health procedures. We have important work to do over the coming months &amp; it cannot be delayed; however it isn’t necessary to put people at risk in the process,2020-05-18 19:16:30,Twitter for iPhone,5,11
The House was right to pass H.Res. 967 to allow for proxy and remote voting on a temporary basis to ensure the safety of its members staff &amp; support personnel that work within the Capitol Hill complex. We are still in the midst of a serious global pandemic. (1/2),2020-05-18 19:13:00,Twitter for iPhone,6,17
Welcome continued actions to hold the regime in #Cuba accountable for their destabilizing actions. We can’t stand by while they shelter terrorists responsible for violence in #Colombia harbor U.S. fugitives and continue to prop up the illegitimate #Maduro regime in #Venezuela https://t.co/0TOJZUwder,2020-05-15 21:44:54,Twitter for iPhone,1,2
The vast majority of Florida’s people live on our coasts. We should not victimize our coastal economies by artificially holding water in Lake Okeechobee to supply an industry (Sugar) that is kept in business through government assistance. https://t.co/Y9GkDKsPdW,2020-05-15 14:38:56,Twitter for iPhone,4,14
The Guyanese people deserve to have their voices heard through an efficient and transparent recount. While I welcome the ongoing process it is critical that the Government of #Guyana allow international representatives from @CarterCenter and @IRIGlobal to support it. https://t.co/Ud8y8kRyDx,2020-05-12 21:22:27,Twitter for iPhone,12,27
75 years ago today the Supreme Allied Commander General Dwight D. Eisenhower accepted the unconditional surrender of German forces which ended military conflict in Europe.  I am grateful for the sacrifices our servicemen and women gave in order to defeat fascism and tyranny. https://t.co/sxnbeWTNvU,2020-05-08 21:12:22,Twitter for iPhone,6,16
The EU “kowtows” emboldens China and threatens the world.  https://t.co/0A4tC6QyXE,2020-05-08 17:29:18,Twitter for Android,615,645
What are these schools thinking? Tax them. They should return these funds immediately.  https://t.co/5U6DqLiGX3,2020-05-06 21:13:02,Twitter for Android,1,2
It is encouraging to see this issue of Chinese infiltration gaining traction. @SenTedCruz and I sponsored the SHEET Act to address exactly this issue. It is time to pass this legislation in the House and Senate now. https://t.co/qJdFgPOvEO,2020-05-04 20:46:37,Twitter for iPhone,1,6
This evidence proves clearly that co2/no2 emission reductions work. The EPA sould not be relaxing these standards. https://t.co/MnpOyFrU3W,2020-05-01 18:28:29,Twitter for Android,3,13
Congress should get back to work on behalf of the American people when it can be done safely and securely. Right now remote or paired voting is the best safest alternative until the pandemic subsides and normal voting procedures can occur. https://t.co/QMDmLMlZvL,2020-04-29 21:06:02,Twitter for Android,0,7
Typical-Maduro regime places 1 of its most corrupt &amp; criminal officials in a critical leadership role as the economy collapses further amid the ongoing health crisis. The int’l community should soundly denounce this action &amp; stand with the Venezuelan people in demanding democracy https://t.co/zck25wUtBc,2020-04-28 18:18:37,Twitter for iPhone,8,5
Funds have now been replenished for the Paycheck Protection Program to aid our small business community. Please visit the SBA website linked here for information on PPP and other funding programs that are available. https://t.co/nIJnLuCTnL,2020-04-27 18:54:56,Twitter for iPhone,1,0
The WHO along with most of the UN is overdue for a cultural overhaul; the United States must protect its interests in these organizations. Are we done with allowing the corrupt CCP to control information to and from the international community? https://t.co/l5N1MBJyPr,2020-04-24 19:51:04,Twitter for iPhone,6,8
The postal service must adapt to changing markets. In 2019 the USPS lost over $8 billion dollars so COVID-19 is not the underlying problem for them. The USPS should adjust pricing eliminate o.t. adjust delivery schedules &amp; eliminate subsidies to compete https://t.co/nNDafbGTd1,2020-04-24 18:28:04,Twitter for iPhone,2,6
To limit future risk to lives to our economy &amp;ecology the senate should pass my bill HR205 to make permanent the ban on drilling in the Eastern Gulf East of the Military Mission Line &amp; the Interior Dept should stop undermining the post-Macondo well control regulations (2/2),2020-04-20 18:34:39,Twitter for iPhone,2,4
10 years ago today the Oil Rig Deepwater Horizon exploded  and a economic and ecological disaster ensued. This tragedy killed 11 crew members and caused over 200 Million gallons of oil to be spilled. (1/2) #DeepwaterHorizon,2020-04-20 18:31:37,Twitter for iPhone,6,9
3M is putting profits over patriotism at a time when Americans are in need.  https://t.co/9R0TV3L1P3,2020-04-20 18:21:24,Twitter for Android,1,1
This is a great step forward for restoring our Everglades and fixing our water. We need to continue to build upon the progress we’ve made over these last 4yrs. #EAAReservior https://t.co/SnaPg79HKK,2020-04-17 22:00:12,Twitter for iPhone,2,17
Both parties must come together and immediately replenish funds for the now depleted Paycheck Protection Program. https://t.co/xXpxnXJz1O,2020-04-17 20:58:02,Twitter for iPhone,2,5
If the Emirates can do it why can’t we?  https://t.co/geObISmXCf,2020-04-16 22:04:05,Twitter for Android,3,11
Close the national parks - save lives.  https://t.co/TDkuZNfgj1,2020-04-16 20:08:17,Twitter for Android,2,6
Small businesses are hurting and the original PPP funds have been exhausted. Hopefully leaders of both  parties will quickly work out an additional funding plan. https://t.co/f9V5FnOjiL,2020-04-16 17:27:31,Twitter for iPhone,4,6
Just as the States had the responsibility for determining the best way to close down activities to deal with COVID-19 they have the responsibility for determining when to reopen. https://t.co/SFwepsfEOF,2020-04-14 22:55:31,Twitter for iPhone,3,14
Our Nation faces an unexpected &amp; unprecedented challenge that has led to tremendous loss of life &amp; financial hardship in our community &amp; throughout America. As Americans we know that we will triumph over this deadly disease &amp; regain our economic momentum https://t.co/GcFVFv62i6,2020-04-13 17:34:30,Twitter for iPhone,2,4
Kathleen and I wish a happy and blessed Easter Sunday to all. Especially in these difficult days we find strength in our faith that we will defeat this deadly virus that plagues our Nation. https://t.co/nE7sHMt5WW,2020-04-12 14:55:59,Twitter for iPhone,2,11
Tide Loads of Hope Powered by Tide Cleaners launched 4 new areas offering free laundry services to the families of front line responders.  The services are now available in Naples Ft. Myers Sarasota and Palm Beach County.   Visit https://t.co/czRhx3nBHT to learn more.,2020-04-10 20:23:04,Twitter for Android,1,1
Like their authoritarian partners around the world the Cuban regime cannot be counted on as a reliable partner in fighting the coronavirus pandemic. https://t.co/dV48mmkLNP,2020-04-10 17:41:57,Twitter for iPhone,3,4
Today @FLDEO announced a new mobile-friendly online Reemployment Assistance application for new applicants and Floridians who have previously been unable to begin or complete an application available at https://t.co/OmTILRzNLZ. Read more here: https://t.co/qtHcF5zWcs,2020-04-09 20:00:43,Twitter for Android,3,0
We’ve updated our website with the latest information on; Individual Small Business and Healthcare relief during the Coronavirus pandemic. Continue to visit our site daily for additional updates. https://t.co/M6AVGdwraO,2020-04-08 17:08:42,Twitter for iPhone,3,4
Another example of why #Cuba cannot be trusted in the fight against #COVID19 as it aims to divide for political gain rather than work together with the int'l community to defeat this unprecedented health crisis. https://t.co/6Ug628XHSt,2020-04-07 20:40:20,Twitter for iPhone,2,3
Today @GovRonDeSantis signed Exec Order 20-95 which directs the FL Dept of Revenue to halt taxation on businesses receiving assistance from the #CARESACT. I appreciate Gov. DeSantis’ efforts to ensure Florida’s small businesses maintain financial stability during this crisis.,2020-04-06 21:08:57,Twitter for iPhone,2,5
We can’t lose sight of the fact that drilling in the Eastern Gulf east of the Military Mission Line is unnecessary &amp; threatens the economy &amp; ecology of FL. It’s time for the Senate to pass my bill HR 205 &amp; make permanent the ban on drilling in the EGOM https://t.co/02ros7ZRmp,2020-04-06 20:24:32,Twitter for iPhone,3,6
I condemn in the strongest terms the kidnapping of members from @jguaido's team by the illegitimate #Maduro regime. I urge the international community to demand their immediate release. https://t.co/7RBOzIIMI2,2020-04-03 00:26:06,Twitter for iPhone,11,59
Like its authoritarian partners throughout the world #Cuba cannot be counted on as a reliable partner in combating the #Coronavirus pandemic https://t.co/RDcun5nasm,2020-04-03 00:24:40,Twitter for iPhone,5,3
Effective at midnight on Thursday Florida will be under a statewide stay at home directive. The attached link lists the industries and occupations deemed essential. https://t.co/2M26BzPTkj,2020-04-01 18:31:37,Twitter for Android,1,4
To apply for SBA assistance visit the https://t.co/XrNC9UFoBu website for more information.,2020-03-31 20:19:53,Twitter for iPhone,2,5
For useful information on; aid for small businesses unemployment benefits and individual recovery checks visit the link below. Additional information can be found on our website. https://t.co/M6AVGdwraO,2020-03-31 12:55:45,Twitter for iPhone,83,185
Today is #nationaldoctorsday - I could not be more appreciative of our doctors and health care providers as they put their own health and safety at risk during this global pandemic to help people in need.,2020-03-30 18:16:22,Twitter for iPhone,4,16
Thank you @SpeakerPelosi for moving the CARES Act quickly and safely through the House of Representatives and for your work on this legislation. As Americans we must come together to defeat this virus. #Coronavirus,2020-03-27 22:42:56,Twitter for iPhone,3,31
I support this move to exert maximum pressure on the illegitimate #Maduro regime. Maduro’s gov’t relies on illicit activities/oppression of the Venezuelan people to maintain power. I urge all countries to join the US in taking necessary steps to hold the Maduro regime accountable https://t.co/huqVpLoUMy,2020-03-26 20:27:54,Twitter for iPhone,2,6
Is it any wonder why Congress has such low approval ratings?  Personally trading on inside info like Senator Burr is unacceptable. https://t.co/cFxhmk9abd,2020-03-21 19:59:47,Twitter for Android,3,10
Is it any wonder why Congress has such low approval ratings? Trading on inside info as appears has happened here is unacceptable. The behavior along with people who do it need to go.https://t.co/cFxhmk9abd,2020-03-21 19:50:10,Twitter for Android,6,22
Any recount in Guyana must be fully transparent and adhere to electoral law. https://t.co/rYShO03R9a,2020-03-20 22:01:39,Twitter for iPhone,2,4
