Estoy trabajando con @OrangeCoFL para arreglar este problema con informacion de #coronavirus en Español... https://t.co/Yh0ZcL6V7r,2020-04-22 23:15:30,Twitter for iPhone,8,9,corona; 
Yesterday I met with @FLCreditUnions to discuss Congress’ #coronavirus response like @SBA Paycheck Protection Program and Economic Injury Disaster Loans. #CARESAct Extension Package includes $60B to assist Credit Unions in helping our most vulnerable small businesses!,2020-04-22 22:16:56,Twitter for iPhone,5,14,corona; 
Even though we’re indoors this #EarthDay let's make time to celebrate &amp; take actions to protect our planet.  Try one of these ideas to engage with the natural world inside your home &amp; at a safe social distance. https://t.co/ZiX1QVLfBh,2020-04-22 19:45:23,Twitter for iPhone,6,10,social distance; 
The #coronavirus crisis is hitting communities of color especially hard. We need to offer support to local and ethnic media outlets that are best positioned to deliver #coronavirus news to our communities. https://t.co/fVyLELx5e3,2020-04-22 16:28:11,Twitter for iPhone,7,21,corona; 
Long term exposure to air pollution may be one of the leading factors contributing to #COVID19 related deaths. For the health and safety of communities worldwide we must #ActOnClimate! https://t.co/kzPcykFqd3,2020-04-21 18:54:37,Twitter for iPhone,10,13,covid; 
I will be first to agree that anyone coming into the country needs to be tested for #coronavirus. But this is just a blatant xenophobic response that leaves relatives of citizens in limbo and hurts Fla agriculture. https://t.co/XpmSMJF3fo,2020-04-21 14:02:29,Twitter for iPhone,10,18,corona; 
Bipartisan #CARESAct 3.5 deal emerges to increase #coronavirus testing and hospital funding and to extend Paycheck Protection Program to many vulnerable small biz left behind in last round! https://t.co/NmeIkVnwuU,2020-04-21 13:47:13,Twitter for iPhone,2,3,corona; 
Another reason to #ActOnClimate: To reduce air pollution and keep our families safe from the most severe outcomes of the #COVID19. #EarthDay https://t.co/0DGV004z6h,2020-04-21 00:01:04,Twitter for iPhone,4,7,covid; 
Pres Trump refused ⁦@WHO⁩ #coronavirus test and tasked @CDCgov⁩ to make our own under his America First policy. Those CDC tests became contaminated and America lost weeks in our fight against the pandemic. https://t.co/0H3B7FTvxD,2020-04-18 18:31:17,Twitter for iPhone,9,15,corona; 
Read about our real national reopen plan with @RepShalala @RepRaskin and others based upon science and safety not politics. #coronavirus https://t.co/gtI3f3ghVc,2020-04-18 17:46:42,Twitter for iPhone,16,33,corona; 
Communities of color are already bearing the harshest impacts of #COVID19 with higher levels of job loss and illness. Small businesses owned by people of color must receive their fair share of #PaycheckProtectionProgram relief and recovery! @fox35orlando https://t.co/JgbYT3KHIj,2020-04-17 19:57:02,Twitter for iPhone,7,9,covid; 
During the #COVID19 public health crisis the Trump administration rolled back ANOTHER key environmental safeguard working to keep mercury pollution out of our air. #ClimateFriday https://t.co/4koLB4CKVF,2020-04-17 16:12:59,Twitter for iPhone,11,11,covid; 
My district staff has helped so many constituents return home after being stuck overseas because of #coronavirus. Here are some photos they shared with our office when they were traveling to Central Florida or reuniting with loved ones! Welcome home 🇺🇸 https://t.co/xxtkKgW4Zw,2020-04-17 15:07:08,Twitter for iPhone,13,57,corona; 
Last week another 180000 workers in Florida filed claims with the state’s overwhelmed and struggling unemployment system.  Tune in TONIGHT at 8PM as I join @WESH for a conversation on unemployment Florida’s Bridge Loan Program the Payroll Protect Program and more. #COVID19 https://t.co/RQBUMEwOQK,2020-04-16 22:00:00,Twitter for iPhone,2,7,covid; 
Beware of #pricegouging! We’re co-sponsoring #COVID19 Price Gouging Prevention Act to fight these disgraceful practices. You can also report price gouging in Florida at 866-966-7226 or at https://t.co/0HO6MwEaAC https://t.co/nginhJP0Nb,2020-04-16 19:33:44,Twitter for iPhone,4,12,covid; 
Without essential employees like grocery workers &amp; first responders our country would be in complete disarray during the #coronavirus crisis. It only makes sense we provide them with hazard/overtime pay &amp; the same sense of security they give Americans every day. Our letter ⬇️ https://t.co/RCqMy2xpNm,2020-04-16 18:31:25,Twitter for iPhone,11,30,corona; 
Presidential malpractice. How could any President in their right mind cut off funding to the World Health Organization during a world #coronavirus pandemic? ⁦⁦ https://t.co/TpKlhqVoyB,2020-04-16 01:26:30,Twitter for iPhone,4,15,corona; 
Filed your 2018 / 2019 tax returns? Want to get your #stimuluspayment via direct deposit? There’s a new app  for that! #COVIDー19 #CARESAct https://t.co/7RRMG1OccY,2020-04-15 19:31:48,Twitter for iPhone,3,7,covid; 
Venezuela is undergoing a major human rights crisis which will be dramatically exacerbated by #COVID19. The Senate stalling on designating temporary protective status for Venezuelans in America is unacceptable. We need #VenezuelaTPSNow! https://t.co/cYhFf9IdBJ,2020-04-15 16:37:32,Twitter for iPhone,16,28,covid; 
As more construction workers face layoffs and uncertainty during the #coronavirus crisis access to healthcare should be the last thing on their mind. Our next relief package must ensure health coverage retirement and a bold investment in our workers. #WorkersFirst https://t.co/WcSuCuJoqx,2020-04-14 22:48:56,Twitter for iPhone,15,23,corona; 
TODAY: Questions about federal #coronavirus resources available to you and your family? Join me for a Facebook Live and Telephone Town Hall at 4 PM.   🗓 Today  ⏰ 4 PM ☎️ 929-436-2866 ID: 971 8921 3424 💻 https://t.co/rMTnVhZJ9J https://t.co/dBMgl4fcPB,2020-04-14 18:10:20,Twitter for iPhone,2,4,corona; 
Thanks Dr. Falconnetti &amp; the 75+ students &amp; administrators from @PolkState for joining me yesterday to discuss all of the pressing issues facing higher ed during #coronavirus. In these times of unprecedented adjustment my office will continue to serve as resource for you. https://t.co/HMtIyrCTu8,2020-04-14 15:02:16,Twitter for iPhone,6,14,corona; 
Day after day first responders put their lives on the line for our health &amp; safety during #coronavirus. I’m urging @stevenmnuchin1 &amp; @SBAJovita to allow local govts to use resources from the state stabilization fund to cover the overtime &amp; hazard pay of first responders. ⬇️ https://t.co/YMcRHR99db,2020-04-13 20:37:08,Twitter for iPhone,3,7,corona; 
Questions about federal #coronavirus resources available to you and your family? Join me for a Facebook Live and Telephone Town Hall TOMORROW at 4 PM.   🗓 Tuesday April 14th  ⏰ 4 PM ☎️ 929-436-2866 ID: 971 8921 3424 💻 https://t.co/rMTnVhZJ9J https://t.co/0gn5aJmhi2,2020-04-13 17:45:53,Twitter for iPhone,3,3,corona; 
Donning new patriotic face protection made by my wife Amanda for my morning commute! TODAY is start of #COVID19 mandatory masks in public in @OsceolaCountyFl. #FlattenTheCurve @STEMk5 https://t.co/gspJJz1PaO,2020-04-13 14:51:48,Twitter for iPhone,3,14,covid; 
With Orlando having 4th highest #COVID19 cases in the state we are pushing to ensure Central Florida gets its fair share of resources! https://t.co/OaISrW5lzw,2020-04-13 13:19:47,Twitter for iPhone,7,10,covid; 
During #coronavirus pandemic the Soto Family is spending this Easter making masks for neighbors and friends. Stay home be safe and healthy everyone! https://t.co/UGrmC2w74J,2020-04-12 17:08:38,Twitter for iPhone,10,54,corona; 
Estoy trabajando con Comisario ⁦@mayraspoint⁩ y @FLSenatorTorres traer un sitio para exámenes de #coronavirus en el Orlando Este! ⁦@citybeautiful⁩ ⁦@OrangeCoFL⁩  https://t.co/ertzrWq1L1,2020-04-11 17:32:28,Twitter for iPhone,2,4,corona; 
Aquí está el enlace a mi teleconferencia bilingual sobre la respuesta de #coronavirus y beneficios nuevos para ayudar nuestra comunidad! #Unidos https://t.co/RX1baKOPZG,2020-04-11 15:26:34,Twitter for iPhone,3,5,corona; 
Proud to announce $2B to Florida’s hospitals from the #CARESAct today! While this will great assist our #COVID-19 response it is not enough. We are pushing to better fund our Medicare Advantage Medicaid and children’s hospitals reimbursements. https://t.co/qKmJPVmWBR,2020-04-11 15:00:20,Twitter for iPhone,1,8,covid; 
During this difficult #coronavirus pandemic hoping for a moment of meaningful reflection and prayers on this #GoodFriday from our family to yours. https://t.co/XsKo4ai9RY,2020-04-10 22:40:53,Twitter for iPhone,7,30,corona; 
The COVID-19 pandemic has showed that #DACA recipients are an integral part of our nation as they work as first responders doctors and nurses for the health and safety of all. I’m fighting to #ProtectTheDream for all of the courageous #DACA recipients. #HomeIsHere,2020-04-10 19:12:06,Twitter for iPhone,26,34,covid; 
Black and brown communities are suffering from #coronavirus at alarming disproportionate rates. States from around the country have released a racial breakdown of their coronavirus cases and we need Florida do the same. https://t.co/afovMS01fB,2020-04-10 16:45:01,Twitter for iPhone,4,7,corona; 
Here’s my @wmfeorlando interview with @matthew_peddie about the #CARESAct a key part of our health and economic response to #coronavirus @NPR https://t.co/JEFmDRLg8v,2020-04-10 13:31:13,Twitter for iPhone,4,5,corona; 
I will be following up with @OSHA_DOL. We must be better than this especially considering the #coronavirus pandemic. https://t.co/RUnKFiaKVJ,2020-04-09 20:20:55,Twitter Web App,6,7,corona; 
Even amidst this #Coronavirus pandemic we are paying attention to #I4Ultimate delays and cost overruns. 👀 🚗 💰 https://t.co/HLgtzOUk2l,2020-04-09 14:59:07,Twitter for iPhone,3,9,corona; 
Educators in #FL09: You’re invited to my Education Teleconference TODAY at 1 PM! I’ll be joined by local elected officials administrators &amp; teachers to discuss the #coronavirus response distance learning school food assistance &amp; more.   💻 https://t.co/oqD4OARQtN https://t.co/7EsnUNp1mo,2020-04-09 14:36:39,Twitter Web App,1,2,corona; 
Despite the #CoronavirusPandemic completing the #2020Census is as important as ever. From Central Florida’s roads and schools to our environment and local agriculture the Census is critical to determining how much funding our community gets. #FL09 https://t.co/aRE8sFAm9P,2020-04-09 13:34:49,Twitter for iPhone,6,18,corona; 
.@HouseDemocrats pushed to include immigrant communities in the #CARESAct. @SenateGOP opposed it. One thing is clear: #COVIDー19 relief for Latinos in the next package is a MUST. @WFTV @ALorenzoTV https://t.co/HLyMsTTsOg,2020-04-08 19:21:50,Twitter for iPhone,10,16,covid; 
Thank you to everyone who joined my #Coronavirus Telephone Town Hall last night. My top priority continues to be ensuring you and your family have the necessary resources to get through this crisis. If you weren’t able to join listen here ⬇️ https://t.co/OhR2GoLOXp,2020-04-08 16:20:56,Twitter for iPhone,2,4,corona; 
Want to keep your workers on payroll during the #coronavirus crisis?   GREAT NEWS: The Small Business Administration Lender Gateway is now online! 💻 To get started go to https://t.co/i1ht62pnec https://t.co/1ShbItWPnP,2020-04-08 14:44:56,Twitter for iPhone,4,5,corona; 
On #WorldHealthDay I’d like to take a moment to applaud the heroes on the frontlines of the #COVIDー19 pandemic. To our nurses doctors and health care workers in #FL09 risking their lives to protect us we thank you! https://t.co/rVUgThCNpA,2020-04-07 20:19:41,Twitter for iPhone,9,16,covid; 
Getting out of an abusive home already poses incredible challenges for survivors. But now #COVID19 shelter-in-place orders could increase the amount of control wielded by abusers. It’s been a year since the House passed #VAWA. Now more than ever we need the Senate to act. https://t.co/irGa97FjZS,2020-04-07 18:38:05,Twitter for iPhone,54,105,covid; 
TODAY: You’re invited to a #Coronavirus Telephone Town Hall where I will be joined by @AmyMercado and @NikkiFriedFL to discuss unemployment and food resources!   🗓 April 7th   ⏰ 5 PM ☎️ 1-939-436-2866  📇 ID: 236 784 913 https://t.co/hr6nVL83TA,2020-04-07 17:41:29,Twitter for iPhone,11,13,corona; 
Thanks to @kissimmeepolice for your heroism and sacrifices to care for our constituents during the #coronavirus crisis. We pray for your quick recovery and have your backs! https://t.co/te28qwbMrc,2020-04-07 14:41:38,Twitter for iPhone,2,8,corona; 
Food insecurity is a reality for too many people in Central Florida as we fight this #coronavirus. Learn more about the resources available to you and your loved ones here ➡️ https://t.co/if2w1tPhss https://t.co/rPT1ktZ5mg,2020-04-06 16:33:11,Twitter for iPhone,4,5,corona; 
TOMORROW: Join me for a #Coronavirus Telephone Town Hall where I will be joined by community leaders to discuss unemployment and food resources!   🗓 April 7th   ⏰ 5 PM ☎️ 1-939-436-2866  📇 ID: 236 784 913 https://t.co/RfBJ7OXAT8,2020-04-06 14:27:04,Twitter for iPhone,3,4,corona; 
We spell out government's definition of "coronavirus recovery" ⁦@positiveosceola⁩  https://t.co/vEdaDIXW32,2020-04-04 00:39:18,Twitter for iPhone,1,2,corona; 
Central Floridians you are safer at home! Following the governors stay at home order please stay inside and immediately limit all non-essential movement to protect yourself and others from #coronavirus. Here’s what you can and can’t do ⬇️ https://t.co/DaOSxMCQjL,2020-04-03 18:47:27,Twitter for iPhone,4,9,corona; 
#HealthcareHeroes are keeping #COVIDー19 patients alive but across the country they’re running out of personal protective equipment (PPE) to keep themselves safe. They need President Trump to release this critical equipment from the national stockpile immediately! https://t.co/SYwkIboBax,2020-04-03 17:41:34,Twitter for iPhone,2,7,covid; 
Has your business suspended operation because of limited commerce due to #COVIDー19? An #IRS credit may help you keep your employees on your payroll! See FAQs on the Employee Retention Credit at https://t.co/avUpuNUxdo #COVIDreliefIRS https://t.co/kQFD6QQozZ,2020-04-03 14:33:42,Twitter for iPhone,2,4,covid; 
Honored to lead the charge to stop evictions &amp; foreclosures for the next 45 days during #coronavirus crisis. Thanks to all the members and non-profits who lent a hand! https://t.co/SjhtrjYxeo https://t.co/xNhN1bptzS,2020-04-03 13:20:15,Twitter for iPhone,4,13,corona; 
GREAT NEWS! If you’re a senior who receives Social Security benefits and did not file for taxes in 2018 and 2019 you will not need to file a tax return for a rebate. Instead $1200 will be automatically deposited into your bank account! #COVIDー19 https://t.co/0QVCl3ANB4,2020-04-02 20:36:03,Twitter for iPhone,10,3,covid; 
Small businesses are the backbone of our economy. Sadly we've see our small business sector suffer immeasurably as a result of #COVIDー19. Thankfully the #CARESAct offers Central Florida small businesses the support they need to get through this crisis. Here's how ⬇️ https://t.co/uez8jeCHDi,2020-04-02 15:59:32,Twitter for iPhone,4,4,covid; 
Interested in hearing about how the #CARESAct can help you and your family get through the #coronavirus crisis? Join me TODAY for a Facebook Live Town Hall!   ⏰ 2 PM  💻 https://t.co/Jy4TsKhqeV https://t.co/hnWYgzlDv9,2020-04-02 14:53:05,Twitter for iPhone,5,8,corona; 
To Central Floridians and Americans across the country help is on the way! Read my op-ed to see how our #CARESAct can help you and your family get through this #COVIDー19 crisis ⬇️ https://t.co/z3xHltw2mm,2020-04-01 16:27:07,Twitter for iPhone,6,7,covid; 
It’s #CensusDay &amp; just filled mine out! Our response rates in #FL09 are below nat’l avg with 34% in Orange 29.4% in Osceola &amp; 36% in Polk. Home due to #coronavirus crisis? Now is the perfect time to make sure #WeCount! Join me &amp; fill yours out today ➡️ https://t.co/0soXthzCLN https://t.co/O1TjcyMac9,2020-04-01 13:13:45,Twitter for iPhone,35,51,corona; 
This #EqualPayDay is more important than ever.   Right now there are women risking their lives while working on the frontlines of #COVIDー19. Yet they’re getting paid less than their male counterparts.   They deserve more. They deserve #EqualPay. https://t.co/gWV68ryKqa,2020-03-31 16:59:47,Twitter for iPhone,1,4,covid; 
During #COVID19 crisis a virus that attacks the lungs Pres Trump plans to weaken car and truck mileage standards. We need to strengthen air pollution protections for the health of the nation not weaken them! https://t.co/p2ZBFznglr,2020-03-31 13:18:10,Twitter for iPhone,14,17,covid; 
🚨 NO FORECLOSURES OR EVICTIONS!!! 🚨   We led bipartisan Fla Delegation letter to ask for no foreclosures or evictions during #coronavirus crisis. Proud to announce that Fla Supreme Ct just agreed! Now we need all @FloridaClerks &amp; @FLSheriffs to comply! https://t.co/JhvMCbylu8 https://t.co/30YNcTccHL,2020-03-31 00:11:16,Twitter for iPhone,12,19,corona; 
🚨 STOP EVICTIONS &amp; FORECLOSURES!!! 🚨   Led Bipartisan Letter requesting a moratorium on foreclosures and evictions in Florida. At a time when Floridians are asked to stay home to combat #Coronavirus homeowners &amp; renters deserve stability. Our letter ⬇️ https://t.co/ibecAiVP0u,2020-03-29 13:24:11,Twitter for iPhone,17,33,corona; 
Listen to Fritzi Bryant (106 yrs old) recall Americans coming together to combat the Spanish flu of 1918 our nation’s last major epidemic. #CoronavirusUSA #UnitedWeStand https://t.co/Dtdg1x79w9,2020-03-28 15:01:11,Twitter for iPhone,5,15,corona; 
Starting the morning by giving my profound &amp; complete gratitude to the frontline workers during this #CoronavirusPandemic. Without you it would be impossible for us to get through this crisis together. To our health care workers firefighters police officers &amp; more — THANK YOU! https://t.co/cf7s9Ql314,2020-03-28 13:03:16,Twitter for iPhone,11,26,corona; 
This coronavirus crisis is hard on everyone &amp; it’s showing how the actions of our community impact us all.  #Census2020 will determine the public health funding that our community gets for the next decade. Respond online now ⬇️ https://t.co/knnOS4XMnV https://t.co/Q43BJjpZQS,2020-03-27 20:30:18,Twitter for iPhone,6,6,corona; 
While we are all looking for answers to help protect ourselves during #coronavirus it is important to be mindful of fraudulent information and scams looking to profit on fear. For more information on what NOT to trust click here: https://t.co/nH2qejmNDH https://t.co/qnJ4S0UCla,2020-03-27 19:38:29,Twitter for iPhone,4,4,corona; 
Today I cast my vote for #CARES Act to combat this unprecedented #coronaviruspandemic. To Central Floridians and Americans across the country keep hope because HELP IS ON THE WAY! https://t.co/u9VY4L4KON,2020-03-27 17:29:07,Twitter for iPhone,20,49,corona; 
With unemployment claims reaching a record high it’s crucial we help those who need it during the #coronaviruspandemic. With the bipartisan #stimulusbill Floridians can get up to $600 per week in fed benefits on top of $275 per week from state benefits! https://t.co/JNqSdUIMQZ,2020-03-27 14:28:43,Twitter for iPhone,2,6,corona; 
Hospitals are reaching crisis levels as shortages of PPE continue due to #COVIDー19. Our bipartisan American-Made Protection for Healthcare Workers &amp; First Responders Act helps protect frontline workers &amp; ensure catastrophic shortages never happen again! https://t.co/rtInrGBmdM,2020-03-26 20:41:04,Twitter for iPhone,5,4,covid; 
Hard at work on #coronavirus response everyday for you. #TeamSoto is teleworking overtime as well. Getting ready to return to Washington to cast my vote for #StimulusPlan! https://t.co/yyf2tX8OnA,2020-03-26 19:22:39,Twitter for iPhone,4,17,corona; 
Key #studentloan relief in #coronavirus #StimulusPlan! Borrowers can get 6 month postponement of monthly payments until Sept. 30 2020 with accrued interest waived. https://t.co/4TaolY3FsW,2020-03-26 18:47:24,Twitter for iPhone,3,4,corona; 
Proud to announce $307053 in @HHSGov grant funding to Primary Medical Service of Poinciana and @CFLHealthcare in #FL09! In the midst of a global pandemic we must ensure our community health centers have the necessary funding to help fight the spread of #coronavirus. https://t.co/K3NSDYLD4d,2020-03-26 17:45:15,Twitter for iPhone,4,6,corona; 
🚨 NO UTILITY SHUTDOWNS!!! 🚨   We led bipartisan letter with majority of Fla Delegation to ask for no utility shutdowns during #coronavirus pandemic. Proud to announce that all major Fla’s utilities have just agreed! #UnitedWeStand https://t.co/5F6SemI4Wy,2020-03-26 16:02:44,Twitter for iPhone,71,207,corona; 
The Democrat improved #stimulusbill will help meet the needs of Florida’s Working Families and Small Biz during #coronavirus pandemic. Here’s what’s included ⬇️ https://t.co/AKOrhCguaW,2020-03-26 13:55:46,Twitter for iPhone,7,7,corona; 
The new and Democrat improved #stimulusbill:   ➡️ Fights #coronavirus ➡️ Protects our workers ➡️ Helps small businesses ➡️ Aides our students ➡️ Provides accountability &amp; oversight https://t.co/bSOVCpP8Nl,2020-03-25 20:51:51,Twitter for iPhone,7,17,corona; 
.@OrangeCoFL has opened a #coronavirus testing site! Be sure to meet the criteria before you go. For more information visit 💻 https://t.co/H3C6IpBIMZ  📍900 Universal Blvd Orlando FL 32819 https://t.co/p3xxI2RQCn,2020-03-25 13:50:27,Twitter for iPhone,8,8,corona; 
Led bipartisan majority of Fla Delegation to stop shutoffs of water power and waste svcs during #Coronavirus crisis! https://t.co/i84p7aPFBf https://t.co/vUaBpNAyf6,2020-03-24 19:25:44,Twitter for iPhone,3,10,corona; 
There is NO SUCH THING as the “Chinese Virus”. The global community is suffering together and we cannot heal each other through hatred and racism. #COVIDー19 https://t.co/UpCCxPMtAB,2020-03-24 17:46:17,Twitter for iPhone,24,51,covid; 
Does your small business need relief during the #coronavirus pandemic? @FloridaSBDCN is here to help! To apply for the Florida Small Business Emergency Bridge Loan program visit 💻 https://t.co/YDal1BtJrQ https://t.co/SXJnSOQL1F,2020-03-24 16:45:56,Twitter for iPhone,6,12,corona; 
Read about @HouseDemocrats’ new $2.5T #coronavirus Economic Plan! Includes major payroll help for large/small biz to keep people employed $1500 check for Americans earning &lt; $75K and my ideas to ban internet and utilities shutoffs during the crisis! https://t.co/OvIKKDXg4B,2020-03-24 13:41:07,Twitter for iPhone,9,14,corona; 
.@RedCross is facing a severe blood shortage due to blood drive cancellations during this #coronavirus outbreak. Healthy individuals are urged to donate to help patients counting on lifesaving blood. My wife donated this weekend in #FL09!  💻: https://t.co/2P0d560qJJ https://t.co/XTa6aSuzYj,2020-03-23 14:43:46,Twitter for iPhone,63,107,corona; 
No American should go bankrupt just because they’re sick. We see this now more than ever with #coronavirus.   On the 10th anniversary of the #AffordableCareAct @HouseDemocrats recommit ourselves to the fight that gave us the majority: the fight to #ProtectOurCare. https://t.co/I9CRjERZpK,2020-03-23 13:07:59,Twitter for iPhone,116,300,corona; 
Read about an estimated $2 Trillion #Coronavirus Economic Relief Package to assist millions of Americans affected by this national crisis. Stay safe. Help is on the way! https://t.co/irpkKBC4k2,2020-03-22 14:36:40,Twitter for iPhone,5,7,corona; 
In the middle of a public health crisis Floridians must be able to rely on consistent access to power in their homes. Proud to lead my Florida colleagues in calling for the temporary suspension of disconnections of utilities for 60 days during the #coronavirus pandemic. Read ⬇️ https://t.co/Oz3LcIWMsd,2020-03-21 13:27:48,Twitter for iPhone,43,99,corona; 
With more people being at home access to information &amp; communication services are fundamental. I led a letter urging @AjitPaiFCC to protect Americans from losing access to their cell phone landline &amp;  internet during the #COVID19 national emergency. Our letter ⬇️ https://t.co/tZTNYHuXZA,2020-03-20 19:22:43,Twitter for iPhone,10,22,covid; 
🚨TODAY: Join me for a Coronavirus Telephone Town Hall for seniors to learn about my work in Congress to fight this public health crisis.    ☎️ Dial 1-855-962-1174 at 1 PM to join us. https://t.co/rsHSv0WhQw,2020-03-20 13:47:42,Twitter for iPhone,4,5,corona; 
@Lightguy911 @IATSE Paul we are working to expand unemployment benefits in response to the #coronavirus to entertainment workers and others who currently don’t qualify. Thank you for your valuable input! @Lightguy911 @IATSE,2020-03-19 18:37:06,Twitter for iPhone,5,12,corona; 
As businesses shut down Florida workers need more than just $275 per week in unemployment benefits. Proud to work with @RepLoisFrankel to fight for all Floridians to have access to better financial assistance during the #coronavirus crisis. Our letter ⬇️ https://t.co/aCEgWbULsb,2020-03-19 17:36:58,Twitter for iPhone,18,37,corona; 
@Reyes_Carlos_ @CoachP_CHS @OCFLMayor @orlandomayor Hi Carlos. Please visit my website and click on COVID-19 for local resources: https://t.co/pVmI0mwQLn,2020-03-19 16:02:07,Twitter for iPhone,0,1,covid; 
TOMORROW: I’ll be hosting a Telephone Town Hall to give seniors in #FL09 an update on #coronavirus.   ☎️ 1-855-962-1174 🗓 Friday March 20th  ⏰ 1-2:30PM   Hope you can join me! https://t.co/j9HhoBVEaU,2020-03-19 13:51:58,Twitter for iPhone,7,8,corona; 
