US Senate is set to pass our bipartisan #FamiliesFirst #Coronavirus Response Act that provides free testing &amp; helps protect communities across America.  Read my op-ed on how we are delivering #ForThePeople during the coronavirus pandemic ⬇️ https://t.co/oMi5JPM2pB,2020-03-18 20:19:08,Twitter for iPhone,3,5,corona; 
My top priority in this public health emergency is providing support to you and your family. As the coronavirus pandemic continues to impact our communities visit my website for resources to help you get through this unsettling time: https://t.co/xUXeTmvk93 https://t.co/U5fIHNYo73,2020-03-18 16:54:44,Twitter for iPhone,3,3,corona; 
Workers impacted by #Coronavirus need paid leave! Our #FamiliesFirst #Coronavirus Response Act provides two weeks of paid sick leave and up to three months of paid family and medical leave. https://t.co/kD7CP3DPZm,2020-03-17 17:09:00,Twitter for iPhone,4,5,corona; 
Has your small business been impacted by #coronavirus? The Florida Small Business Loan Program has launched and is now accepting applications! For more information visit: https://t.co/93EqAJL8yZ. https://t.co/JNDoB6hjUU,2020-03-17 15:40:14,Twitter for iPhone,2,2,corona; 
Are you experiencing #coronavirus symptoms or having concerns that you may have been exposed to #coronavirus?   ☎️ PLEASE CALL the Florida Department of Health #COVID19 hotline or your local health department. https://t.co/KVPRZ1FLUK,2020-03-16 19:17:31,Twitter for iPhone,12,9,covid; corona; 
.@HouseDemocrats’ #FamiliesFirst #Coronavirus Response Act expands food assistance:   ✅$500M to help low-income pregnant women and mothers with young children ✅$400M to help local food banks ✅$250M to provide home-delivered and pre-packaged meals to low-income seniors https://t.co/sWpLBa2Pw5,2020-03-16 16:38:33,Twitter for iPhone,33,78,corona; 
Central Florida schools will still be providing meals to students while classes are canceled due to #coronavirus. Please visit your school district’s website for more info. We passed new emergency funding because no child should go hungry. #COVID19 https://t.co/OwxYLH7B1B,2020-03-16 13:46:28,Twitter for iPhone,13,17,covid; corona; 
Our country is taking aggressive steps to bend the curve on #Coronavirus. Here’s a tale of 2 cities: St Louis (who enacted social distancing measures) vs. Philadelphia (who didn’t). The results are stark. #COVIDー19 https://t.co/GWH7VyatN1,2020-03-15 13:38:21,Twitter for iPhone,17,26,covid; corona; 
Last night we passed our bipartisan #FamiliesFirst #Coronavirus Response Act that provides free testing &amp; helps protect communities across America.  Read my op-ed on how @HouseDemocrats are delivering #ForThePeople during the coronavirus pandemic ⬇️ https://t.co/oMi5JPM2pB,2020-03-14 12:10:52,Twitter for iPhone,9,23,corona; 
As #COVID19 spreads the impacts on our nation’s workers &amp; families deepen. @HouseDemocrats are set to pass the #FamiliesFirst #Coronavirus Response Act to help protect communities in Central Florida &amp; across America from the growing #pandemic. Here’s what our bill includes ⬇️ https://t.co/IpYHzSoiuI,2020-03-13 14:30:49,Twitter for iPhone,5,11,covid; corona; 
Great article by our @UCF Student Paper “Coronavirus: What is Next” https://t.co/Wm10WSpl8n,2020-03-11 18:49:13,Twitter for iPhone,2,5,corona; 
Want to help prevent the spread of #COVID19? Here’s what the CDC suggests ⬇️  For up to date information from @CDCgov on #coronavirus visit my website 💻 https://t.co/9hzkgV9A8k https://t.co/DMX6kCDb0E,2020-03-09 22:12:09,Twitter for iPhone,3,6,covid; corona; 
Americans need a fully-funded coordinated government-wide response to stay safe against coronavirus. Today we voted to pass a bipartisan robust spending package that fully addresses the #Covid19 with $8.3 billion in new funds. Our legislation will save lives! https://t.co/HHlHXXvtxs,2020-03-04 21:54:04,Twitter for iPhone,3,9,covid; corona; 
Here’s our @CDCgov briefing summary on what you need to know about the #coronavirus ⬇️ https://t.co/h9fYVISuSq,2020-02-28 14:52:38,Twitter for iPhone,9,15,corona; 
As the #TrumpBudget takes major cuts to both @CDCgov &amp; @NIH @HouseDemocrats are moving quickly to enact a strong strategic funding package that fully addresses the seriousness of the coronavirus epidemic. It's time we work to protect Americans not downplay the situation. https://t.co/j5h7tSxpsU,2020-02-26 21:44:31,Twitter for iPhone,4,6,corona; 
