Register for the 2019 Lung Force Walk in Phoenix on 11/16 and help defeat lung cancer. #LCAM ➡️ https://t.co/o01nVBzzIg,2019-11-06 19:32:18,Twitter for iPhone,1,11
Congratulations @TucsonRomero! So happy for you and for my hometown. 🌵 https://t.co/01BFgS5m7n,2019-11-06 11:56:11,Twitter for iPhone,14,306
We’re helping all Arizonans get a shot at the American dream - whether learning a trade or attending university. We’re ✅ making books more affordable ✅ protecting teachers from surprise loan charges ✅ eliminating fed student loan fees ✅ improving career &amp; technical education,2019-11-05 23:12:42,Twitter for iPhone,16,154
Visit Chandler's Arizona Harvest Fest this Sunday for shopping live shows and a salute to veterans. https://t.co/n0gKs4m18v,2019-11-05 19:31:02,Twitter for iPhone,3,25
This year we passed legislation protecting our public lands for future generations of Arizonans. https://t.co/cEf5HLvfjh,2019-11-05 00:00:56,Twitter for iPhone,17,151
Rodney White owner of Chicago's iconic Harold's Chicken Shack is moving to Phoenix and bringing his chicken with him. https://t.co/Twttp8Cz92,2019-11-04 20:53:50,Twitter for iPhone,23,189
🙋🏼‍♀️ https://t.co/nRmF1Vs5CP,2019-11-04 14:59:48,Twitter for iPhone,7,122
Our bipartisan Renewable Energy Extension Act saves Arizonans money and fuels jobs in the state's fast-growing solar industry. https://t.co/k2zyQR0KtU,2019-11-03 23:30:54,Twitter for iPhone,7,46
Women's health care decisions should be between them their doctors and their families. Join us in protecting women's health care: https://t.co/MSx3p3mfIK,2019-11-03 20:00:56,Twitter for iPhone,16,183
Great news: @AZCancerCenter will use $8.6 million in grant funding for cancer prevention. https://t.co/x7k1t2Hqaw,2019-11-02 21:02:03,Twitter for iPhone,6,97
Congratulations talented AZ musicians Caleb York Gracie Potter and Jonathan Salcedo for admission to the National Youth Orchestra! Check out these behind-the-scenes rehearsal videos: #NYOUSA https://t.co/bzLL837izu,2019-11-02 18:19:04,Twitter for iPhone,2,37
37 veterans whose identities remain unknown were laid to rest at the Arizona Veterans Memorial Cemetery. https://t.co/mui1Hs6NQO,2019-11-01 23:00:49,Twitter for iPhone,9,78
750000+ Arizonans live with diabetes. We need to lower costs and improve treatment options now. #NationalDiabetesMonth https://t.co/mBIAWwE2Ky,2019-11-01 20:31:12,Twitter for iPhone,8,46
Looking for outdoor fall fun in Tucson? Check out the Santa Catalina Mountains 🍂: https://t.co/04YifLCBRr,2019-11-01 19:28:14,Twitter for iPhone,1,38
Arizona's Fall Fest brings local businesses and families together for food and fun. https://t.co/2aB5SpX11C,2019-10-31 21:02:00,Twitter for iPhone,1,16
Wishing Arizona a #HappyHalloween Boo!,2019-10-31 17:10:25,Twitter for iPhone,15,263
Check out @NAU &amp; Arizona's Family College Savings Plan's annual AZ 529 Diaper Derby. These babies had the race of a lifetime: https://t.co/VfjaSVSME7,2019-10-30 21:22:37,Twitter for iPhone,4,29
Seniors deserve to retire with dignity. We're proud our Senior Safe and Senior Security Acts protect AZ seniors' financial security. https://t.co/0xY1kImvqa,2019-10-30 18:08:23,Twitter for iPhone,8,78
We've worked with Tempe's Fire Department to secure resources expanding their innovative use of telemedicine to get sick AZ veterans needed care. Learn more: https://t.co/itXZRNQy7D,2019-10-29 22:32:18,Twitter for iPhone,5,51
Check out #AZFallFest! https://t.co/mv1tF6Ckt6,2019-10-29 20:14:39,Twitter for iPhone,8,50
If you're driving AZ Route 264 you might spot these new highway signs honoring AZ's Native American veterans. https://t.co/hy6uoyVwuW,2019-10-29 18:00:19,Twitter for iPhone,16,100
Photos of past presidents taken by Pulitzer Prize winner David Hume are on display at @uarizona. Read about his life's work: https://t.co/4ujQbWZ1Co,2019-10-28 22:01:26,Twitter for iPhone,17,169
Congratulations @NAU Chemistry Chair Brandon Cruickshank this year's homecoming dedicatee! https://t.co/ffjwKk3U8e,2019-10-28 18:35:19,Twitter Web App,0,19
Happy #NationalAmericanBeerDay! Check out these AZ brewers: https://t.co/V7z5uf3PON https://t.co/6bkLWuPlqu,2019-10-28 01:16:59,Twitter Web App,25,261
Tucson opened a new housing community for veterans and their families experiencing homelessness: https://t.co/kamiLLaNQO,2019-10-27 18:45:21,Twitter for iPhone,39,256
Last year our Senior Safe Act became law. Now we're working with @SenSusanCollins to pass the Senior Security Act. Our bills protect AZ seniors’ savings from scammers.,2019-10-26 22:16:56,Twitter for iPhone,9,107
On #NationalDayoftheDeployed we honor the brave servicemembers who put their lives on the line to keep Arizona safe. https://t.co/SUPW4B3ut6,2019-10-26 18:29:57,Twitter for iPhone,23,130
The Violence Against Women Act gives law enforcement tools it needs to crack down on abusers. We need a long term extension of #VAWA. https://t.co/mbTraaHxkj,2019-10-25 22:01:52,Twitter for iPhone,14,114
So impressed with Rod Wellman - the Javelina Jundred is no joke! What a warrior. He’s fighting cancer and you can help read this article to be inspired plus see how you can support his charitable efforts too.   https://t.co/m4bnAgNLWE,2019-10-25 21:04:56,Twitter for iPhone,12,94
We'll keep working until every veteran has access to the care he or she has earned. https://t.co/tfPQZPrLUi,2019-10-25 19:16:56,Twitter for iPhone,23,369
October is Women's Small Business Month. We recently visited Copper State Bolt &amp; Nut Co a women-owned business relying on our work to renew the Export-Import Bank. https://t.co/S5iCHC1D2z,2019-10-25 00:31:01,Twitter for iPhone,9,102
Retirees at Tucson's Fountains at La Cholla use virtual reality to remember the past and visit new places.  https://t.co/ztBItjjEht,2019-10-24 23:45:57,Twitter for iPhone,22,116
Looking for health insurance? Review and select these coverage plans now. Open enrollment ends on 12/15. Learn more: https://t.co/5gN5d5gEmz,2019-10-23 23:34:24,Twitter for iPhone,9,36
Medicare open enrollment ends on 12/7! Read these tips for more info: https://t.co/sWhXZiTvFu https://t.co/kbx97y5R8n,2019-10-23 20:48:05,Twitter for iPhone,5,17
October is #BreastCancerAwarenessMonth: we're ensuring that Arizonans have affordable access to critical services. https://t.co/ae0ZTuExBF,2019-10-22 23:31:03,Twitter for iPhone,4,45
Arizonans visiting DC: the Washington Monument reopened. Spot the special AZ plaque made of petrified wood on the elevator ride down! https://t.co/qjAzcRjRh4,2019-10-22 21:48:49,Twitter for iPhone,3,39
Make sure you're registered to vote! ✅  Check your registration here: https://t.co/kShRXBbIvk,2019-10-22 00:32:08,Twitter for iPhone,87,321
Great teachers change students' lives. Read about five inspiring finalists for Arizona's 2020 Teacher of the Year: https://t.co/6fuJJxvAXc,2019-10-21 20:16:20,Twitter for iPhone,4,40
Our next generation of @NASA_Astronauts train on AZ's hiking trails. https://t.co/42gpZK6JyZ,2019-10-20 22:12:19,Twitter Web App,19,150
Cancer screenings save lives. For #BreastCancerAwarenessMonth Arizona providers are offering free mammograms. Read more: https://t.co/ZePTrV8RYn,2019-10-20 20:14:35,Twitter for iPhone,7,29
Check out this Arizonan's climb up Kendrick Mountain to the historic Lookout Cabin.  https://t.co/MSaUxaMy3J,2019-10-19 22:01:21,Twitter for iPhone,1,34
AZ seniors should be able to rely on their local doctors for end-of-life care. We're increasing access to hospice in rural communities. https://t.co/w4OUxpxXbN,2019-10-19 18:58:45,Twitter for iPhone,11,84
AZ college students! Financial aid applications for the 2020-2021 school year are open. Don't miss out. https://t.co/nwMjk2pURB,2019-10-18 23:45:52,Twitter for iPhone,8,42
We'll always stand up for victims and survivors of domestic violence. #DomesticViolenceAwarenessMonth https://t.co/uTOQEUVWya,2019-10-18 21:41:54,Twitter for iPhone,23,71
Arizona women still earn just 82 cents for every $1 men make. It's simple: equal work deserves equal pay. Are you with us? https://t.co/usIiXx1r4j,2019-10-17 21:01:38,Twitter for iPhone,30,246
Arizona small businesses create good jobs and grow our economy. We'll keep working to help small businesses thrive. https://t.co/ag5JFFqCCh,2019-10-17 00:22:52,Twitter for iPhone,13,127
These 10 innovative Chandler high schoolers are working to protect Arizonans from heat injuries. https://t.co/dO8LKMbtWE,2019-10-16 22:31:14,Twitter for iPhone,8,78
Spread the word: Medicare Open Enrollment starts today and ends on 12/7! Get more info: https://t.co/fZJcLj5oLo,2019-10-15 23:59:21,Twitter for iPhone,12,38
Seniors shouldn’t have to worry that their hard-earned savings are at risk of fraud. https://t.co/nkuQioRwSX,2019-10-15 20:47:35,Twitter for iPhone,13,57
Check out Celebrate Mesa a free fall festival on Oct. 19: https://t.co/DirgrTEIoo,2019-10-14 22:31:01,Twitter for iPhone,2,31
Our Senior Safe Act helps protect seniors' savings from fraudsters and identity thieves. We're ensuring Arizonans can retire with dignity after a lifetime of hard work.,2019-10-14 20:29:26,Twitter for iPhone,9,136
Happy Birthday @USNavy! I'm proud of my brother Gunner’s Mate 1st Class Petty Officer Sterling Sinema and his service to our country. #244NavyBday https://t.co/uSRyNhQlbL,2019-10-14 00:29:49,Twitter for iPhone,53,876
Student loan fees should never stand between AZ kids and the American Dream. https://t.co/SyLjaWv3Uo,2019-10-13 18:50:13,Twitter for iPhone,50,400
Register for the Out of the Darkness Phoenix Area Walk to help stop suicide: https://t.co/OS4cBcq7SJ,2019-10-13 00:31:43,Twitter for iPhone,6,27
Find fun new things in Phoenix including "Amazing Mexican food served in a hair salon an R&amp;B-funk dive bar and contemporary Native American art:" https://t.co/nEIWettZ5O,2019-10-12 20:01:32,Twitter for iPhone,12,124
New trails are open in Sedona! Read about the first phase of the Sedona Western Gateway Trails: https://t.co/xnn5yCzTKf,2019-10-12 00:29:51,Twitter for iPhone,15,104
In Arizona we 💜 our national parks and public lands. We're ensuring our parks stay accessible for all Arizonans. https://t.co/hxpPX21NyI,2019-10-11 23:00:27,Twitter for iPhone,44,528
Happy Birthday to the United States @NavalAcademy!,2019-10-11 00:45:19,Twitter for iPhone,13,183
Today is #WorldMentalHealthDay. We're working to make sure all Arizonans have access to mental health care. The National Suicide Prevention Lifeline offers 24/7 free confidential support prevention and crisis resources for you or your loved ones: 1-800-273-8255.,2019-10-10 23:15:46,Twitter for iPhone,45,174
We're working to ensure all Arizonans with pre-existing conditions including Arizonans fighting breast cancer have access to affordable health care. #BreastCancerAwarenessMonth,2019-10-10 01:00:37,Twitter for iPhone,21,241
Fall brings "an explosion of art" to Tucson — stop and see the exhibits: https://t.co/yN3yN78YrG,2019-10-09 22:40:11,Twitter for iPhone,1,40
Tzom Kal to everyone observing #YomKippur. https://t.co/iv5qaC4dpM,2019-10-09 00:00:29,Twitter Web App,2,42
We need a long-term reauthorization of the Violence Against Women Act. #ReauthorizeVAWA #DomesticViolenceAwarenessMonth https://t.co/z0yCMnRtxj,2019-10-08 22:25:04,Twitter for iPhone,21,117
Check out places to visit on your next AZ road trip: https://t.co/ruAVDaW69X,2019-10-08 01:40:22,Twitter Web App,82,611
SGT Daniel Somers lost his life to suicide after he was denied access to the VA care he needed. We're working with @danielsparents to strengthen servicemembers' "networks of support." WATCH: https://t.co/bd1Nauvlef,2019-10-07 19:45:29,Twitter Web App,20,114
Join hundreds of hikers runners mountain bikers and horseback riders in completing the spectacular Arizona National Scenic Trail (AZT) in 24 hours! Learn more and register: https://t.co/xBedhRJGkt,2019-10-06 21:57:42,Twitter Web App,10,74
October is #BreastCancerAwarenessMonth. We're protecting Arizonans' access to lifesaving screenings. Read about early detection: https://t.co/4XipNBaOJN,2019-10-06 18:32:59,Twitter Web App,1,39
We need a long-term extension of VAWA to protect women and families and give law enforcement the tools it needs to crack down on abusers. Let's get it done. #ReauthorizeVAWA #DomesticViolenceAwarenessMonth,2019-10-05 23:27:26,Twitter for iPhone,49,245
Moved recently? Make sure your voter registration is updated: https://t.co/MfpUNQ3LBH,2019-10-05 15:02:05,Twitter Web App,25,108
Seniors lose $36.5B each year to financial scams. Our #SeniorSafe Act identifies and stops financial fraud. https://t.co/EcqS8AEbIo,2019-10-04 20:34:36,Twitter Web App,11,61
Happy #NationalTacoDay Arizona! 🌮,2019-10-04 15:45:14,Twitter Web App,11,153
It's almost time to sign up for Medicare coverage! Open enrollment starts October 15. Visit https://t.co/4whDClxenZ,2019-10-03 22:03:24,Twitter Web App,10,43
The Arizona State Fair starts tomorrow! https://t.co/3XnECMT26y,2019-10-03 16:55:18,Twitter Web App,7,93
🔭 Join Huachuca's Astronomy Club tomorrow night to see planets stars and more through the 20-inch Patterson telescope! https://t.co/T0svjjsluA,2019-10-02 18:20:24,Twitter Web App,6,34
Tourism fuels Arizona jobs. We're supporting Arizona businesses and strengthening our economy. https://t.co/aGbGG2Y56f,2019-10-02 16:14:35,Twitter Web App,14,109
Congrats to Bisbee's historic Copper Queen Library for winning Best Small Library in America 2019! https://t.co/i2N5wgyLKV,2019-10-01 21:19:07,Twitter Web App,18,158
October is Domestic Violence Awareness Month. If you or someone you know needs help contact @ACESDV or call the National Domestic Violence Hotline: 1-800-799-7233 (SAFE) https://t.co/DSfQgzgoBy,2019-10-01 18:06:32,Twitter Web App,8,37
Seasons are changing! Check out these scenic fall drives near Phoenix: https://t.co/1NyF3GAIYh,2019-09-30 18:58:00,TweetDeck,15,115
The @AZStateFair is an Arizona tradition. This year it starts on Friday October 4th! 🎡 https://t.co/3XnECMT26y,2019-09-30 17:37:55,Twitter Web App,11,99
L'Shanah Tovah to Arizonans celebrating Rosh Hashanah!,2019-09-30 01:20:00,TweetDeck,21,260
On #GoldStarMothersDay we remember our fallen heroes and honor the sacrifices of #GoldStarMothers and families.,2019-09-29 20:01:00,TweetDeck,31,169
Today we celebrate our @VFWHQ. Thank you for supporting our veterans! #NationalVFWDay https://t.co/C3ixsVstIm,2019-09-29 17:31:13,TweetDeck,9,64
Education was my ticket to a better life. We're stopping student loan origination fees because we need to lower the cost of college.,2019-09-28 23:53:00,TweetDeck,62,922
#WhyILoveAZ: our incredible public lands! Check out a guided history tour of Red Rock: https://t.co/qQbytYWXhN,2019-09-28 23:31:47,TweetDeck,5,50
Sierra Vista: Check out the Patterson telescope for free on October 3rd! https://t.co/T0svjjsluA,2019-09-28 01:31:18,Twitter Web App,2,17
Equal work deserves equal pay. RT if you're with us!,2019-09-28 00:31:56,Twitter Web App,462,819
During #NationalSuicidePreventionMonth learn about actions we can take to prevent suicide: https://t.co/GZJh9BPCWW. If you're in crisis call 1-800-273-8255.,2019-09-27 14:00:01,TweetDeck,30,75
We're leading the bipartisan effort to renew the Ex-Im Bank supporting Arizona jobs and growing our economy. https://t.co/mnORj3PNYe,2019-09-27 01:24:53,Twitter Web App,36,316
24% of Arizona kids don't get enough to eat. We're working to protect #SNAP benefits for Arizona families. #HungerActionMonth https://t.co/bXs79cSlui,2019-09-25 23:01:00,TweetDeck,11,62
#OnThisDay Arizona's Sandra Day O'Connor became the first woman Supreme Court Justice. https://t.co/HiwttIa2PD,2019-09-25 22:38:05,Twitter Web App,115,823
How are you celebrating Hispanic Heritage Month? Check out events near you: https://t.co/2yufZeAS1e,2019-09-24 22:33:34,Twitter Web App,5,52
Today's National Voter Registration Day! Register to vote here ➡️ https://t.co/kShRXBbIvk https://t.co/pxSwtvxgqw,2019-09-24 14:37:41,Twitter Web App,24,59
September is Ovarian Cancer Awareness Month. Read about symptoms and early detection: https://t.co/GatyQEe8tX  #KnowOvarian,2019-09-23 18:12:02,Twitter Web App,3,44
September is #NationalServiceDogMonth! We're thankful for service and military working dogs supporting our heroes. https://t.co/ugMpgSnlHG,2019-09-23 01:01:15,Twitter Web App,23,246
Our TOWER Infrastructure Act creates educational opportunities to prepare more Arizonans for good-paying jobs in telecom.,2019-09-23 00:03:01,Twitter Web App,5,88
We're cracking down on animal abuse and trafficking with our RAWR Act. Read more: https://t.co/IEw41EkuH7,2019-09-22 21:07:57,Twitter Web App,18,201
This is 💯 Friendship doesn’t mean you agree or disagree politically.   It means you care about another human and value spending time together. https://t.co/6zpzFDDdyu,2019-09-22 17:05:02,Twitter for iPhone,1070,7003
We're protecting Arizonans from surprise medical bills. https://t.co/SUqyGe7jXc https://t.co/Bk5IvHDnnZ,2019-09-21 18:25:32,Twitter Web App,8,83
September is Blood Cancer Awareness Month. If you or someone you know is affected by leukemia lymphoma or myeloma find resources here: https://t.co/oafSXvG4HR,2019-09-21 17:18:42,Twitter Web App,22,66
Today is National #POWMIA Recognition Day. We will never forget our missing servicemembers. https://t.co/VgL8geFf68,2019-09-20 23:39:57,Twitter Web App,38,253
Happy #HispanicHeritageMonth! Latino Arizonans like César Chávez helped make our state #thegreat48. https://t.co/g0LIuiQLIl,2019-09-20 19:49:36,Twitter Web App,9,31
Education sets our veterans up for success. Our bipartisan Veteran STEM Scholarship Improvement Act expands veterans’ access to science technology engineering and math (STEM) scholarships. https://t.co/VOA2tV3qul,2019-09-19 22:37:00,TweetDeck,22,185
September is #SuicideAwarenessMonth: If you're struggling call the National Suicide Prevention Lifeline at 1-800-273 TALK (8255) or text NAMI to 741-741 to connect with a trained counselor.,2019-09-19 21:12:54,TweetDeck,78,223
Happy birthday @USAirForce! Thanks for keeping us safe for 72 years. https://t.co/bb3pHlmpqr,2019-09-18 23:17:00,TweetDeck,27,232
Happy Engineers Week! Find resources to teach your kids basic engineering skills here: https://t.co/csUrWpzJx7,2019-09-18 22:55:42,TweetDeck,17,96
We need a long term extension of the Violence Against Women Act to protect AZ women and families. Tell Congress: #renewVAWA ➡️ https://t.co/EmyBoTX2ph,2019-09-18 00:00:00,TweetDeck,29,185
On Constitution Day we commemorate the signing of the Constitution on September 17 1787. https://t.co/pQCk2GUYRo,2019-09-17 22:49:25,TweetDeck,15,149
💁🏼‍♀️ https://t.co/kkPwJ7CESf,2019-09-17 00:40:36,Twitter for iPhone,65,1148
2.8 million Arizonans live with pre-existing conditions. We can’t go back to a time when they could be overcharged or denied coverage.,2019-09-16 22:54:00,TweetDeck,75,530
.@uarizona researchers use supercomputer simulations to learn how galaxies are formed 🌌 #BearDown: https://t.co/WPS46e23TA,2019-09-16 19:10:54,Twitter Web App,11,48
Tucson: registration is open for 2019's Arizona STEM and Innovation Summit (September 17  9AM-4PM) https://t.co/pREmYAygHx,2019-09-16 01:30:00,TweetDeck,5,27
National Hispanic Heritage Month begins today! https://t.co/EYdMCmf2Y1,2019-09-16 00:41:28,TweetDeck,24,174
In February we passed protections to keep AZ's incredible #publiclands safe for future generations. Which is your favorite AZ National Park? https://t.co/Q4Iwfub16J,2019-09-14 19:44:00,TweetDeck,12,125
Our bill helps vets use their GI benefits to study STEM and get ahead: https://t.co/1FdWkmbBeZ,2019-09-14 18:23:03,TweetDeck,8,70
The Violence Against Women Act became law 25 years ago today — but it expires this month. We're calling on Congress to #reauthorizeVAWA combat domestic violence and stand up for AZ women. https://t.co/cTS8FNDIi2,2019-09-13 23:00:00,TweetDeck,37,162
Tucson: get your family and friends and walk for a hunger-free future on Saturday September 14 7– 11 AM: https://t.co/9sKKLjeTeX,2019-09-13 21:45:00,TweetDeck,4,22
👏#AZ innovates: An @NAU research team's technology speeds up wound healing to prevent infection. https://t.co/6GpPiTqBZf,2019-09-13 21:10:50,Twitter Web App,4,29
Everywhere I go in AZ I hear the same thing: health care is too expensive. We're working so Arizona has access to quality affordable care.,2019-09-12 20:16:04,Twitter Web App,34,512
#OnThisDay Mae Jemison became the first black woman in space. https://t.co/zNTCgXY3bi,2019-09-12 17:43:18,TweetDeck,16,89
I'm reaching across the aisle to help everyone get a shot at the American dream through education – by learning a trade or attending community college or university. Are you with me?,2019-09-11 23:14:00,TweetDeck,225,2931
Arizona: Check your voter registration status ➡️ https://t.co/kShRXBbIvk,2019-09-11 21:52:34,TweetDeck,23,56
On the anniversary of 9/11 we remember our brave first responders and all who lost their lives. #NeverForget https://t.co/EU3zC9f1ao,2019-09-11 14:00:00,TweetDeck,27,237
Today is #WorldSuicidePreventionDay. If you or someone you know needs help please contact @800273TALK: 1-800-273-8255,2019-09-10 22:49:00,TweetDeck,51,147
Visiting @GrandCanyonNPS for the first time? Here are tips to get the most out of your visit: https://t.co/EQD8sZ2GrL,2019-09-10 22:18:12,Twitter Web App,2,18
I am so excited. 🦄💙💛 https://t.co/BdXlBlyWFq,2019-09-10 21:56:24,Twitter for iPhone,2,121
It's pretty simple: Equal work deserves equal pay. https://t.co/mWzphWEzrK,2019-09-10 18:06:55,Twitter Web App,24,156
Happening now: @GrandCanyonNPS Celebration of Art! Details here: https://t.co/GDSr3GHy3q,2019-09-09 21:09:25,Twitter Web App,5,15
I’m working to make sure every Arizona veteran gets the benefits he or she has earned. We passed the VA MISSION Act to give vets access to high-quality care when and where they need it.,2019-09-08 19:03:00,TweetDeck,21,318
We’re ensuring Arizonans can get quality education:   ✅ protecting teachers from surprise loan charges ✅ making textbooks more affordable  ✅ eliminating federal student loan fees  ✅ improving career and technical education,2019-09-07 23:37:00,TweetDeck,18,166
Sign up for a 9/11 Day of Remembrance service project: https://t.co/WPfbn94WxG,2019-09-07 22:15:55,TweetDeck,7,34
Honor the legendary Navajo Code Talkers with a run on the last day of the Navajo Nation Fair Sunday September 8th! https://t.co/vEqQAPmY2p,2019-09-05 23:40:00,TweetDeck,20,139
.@NAU researchers create renewable energy projects with Salt River Project (@SRPconnect). Read more: https://t.co/5SXDftzjXG,2019-09-05 19:19:42,Twitter Web App,7,44
The Violence Against Women Act protects women and families and gives law enforcement the tools it needs to crack down on abusers. Let's get a long term extension of VAWA done. https://t.co/PQtDjtOJcV,2019-09-04 20:30:00,Twitter Web App,16,119
This weekend observe the night skies through the Patterson telescope — you might see craters on the moon gas giant planets and distant galaxies! https://t.co/UGFUkOhPdU,2019-09-04 16:43:00,Twitter Web App,6,48
Are you registered to vote? Check your status here ➡️ https://t.co/kShRXBbIvk,2019-09-03 18:42:57,Twitter Web App,34,70
#OnThisDay 74 years ago WWII ended. We're grateful to all Americans who fought to protect our freedom. https://t.co/SRT4MdxaF7,2019-09-02 19:14:00,TweetDeck,59,413
Thanks for protecting us for 154 years @AZNationalGuard! https://t.co/Vgja5n3y7D,2019-09-02 19:02:04,Twitter Web App,11,113
Happy Labor Day! We'll keep working to get every Arizona family a shot at the American Dream. https://t.co/jDeKNwZuEo,2019-09-02 16:36:33,Twitter Web App,11,122
Check out the 94th Annual White Mountain Apache Tribal Fair &amp; Rodeo 🐎➡️ https://t.co/zZNsRszqC5,2019-09-02 00:38:45,Twitter Web App,2,51
September is #SuicidePreventionAwarenessMonth — if you or a loved one needs help call 1-800-273-8255 or visit https://t.co/tU8APyOywn.,2019-09-01 19:42:20,Twitter Web App,47,108
The Apache County Fair starts on September 4th! Check out the schedule: https://t.co/KMWViReSvw,2019-08-31 18:10:42,Twitter Web App,3,32
Here's your chance to try green chile ice cream 🍦 — at the Green Chile Roast 2019 in Wilcox! https://t.co/ERxGAboIs9,2019-08-30 15:02:35,Twitter Web App,6,43
Arizona farmers produce some of the best sweet corn — visit the Sweet Corn Festival in Taylor this weekend 🌽 for a parade BBQ arts and crafts fair and softball tournament: https://t.co/eLnSl5GYjP,2019-08-29 18:10:17,Twitter Web App,11,83
We're working across the aisle to crack down on criminals behind spam robocalls. Here are some tips to protect yourself: https://t.co/ujzXfgTXk3,2019-08-29 15:30:25,Twitter Web App,24,166
Starting August 31: the 104th Annual Labor Day Rodeo in Sonoita! https://t.co/2w3ftCmgiV,2019-08-28 17:47:24,Twitter Web App,4,34
The Flagstaff-Coconino County Bookmobile is a library on wheels. Have you checked it out? https://t.co/BLguwB18v9,2019-08-27 20:35:36,Twitter Web App,14,112
#OnThisDay women were finally guaranteed the right to vote. Happy #WomensEqualityDay! https://t.co/YMjmZHjwym,2019-08-26 20:42:57,Twitter Web App,52,260
The 49th Annual @SaguaroNPS Labor Day Run on September 2 takes runners through the beautiful scenery of the Rincon Mountains. 🌵 🏃‍♀️ Details: https://t.co/iZDj1VRmcp,2019-08-26 15:35:28,Twitter Web App,4,38
Today we remember my friend Senator John McCain's incredible legacy of service for the state we love. Sending love to @cindymccain @MeghanMcCain and the entire McCain family today.,2019-08-25 23:13:07,Twitter for iPhone,105,1685
#DidYouKnow the saguaro cactus grows its first arm at 95-100 years old? Check it out at @SaguaroNPS  to celebrate @NatlParkService's birthday #FunFact #NPSBirthday https://t.co/qRCFVVd8GP,2019-08-24 14:48:20,Twitter Web App,24,170
