Congrats to Serrano’s Mexican Restaurant for 40 years in the Valley! This family business has been going strong for three generations: https://t.co/chbRYdnNeh,2019-08-24 01:08:31,Twitter for iPhone,27,390
People have lived in @PetrifiedNPS since 13500 BC: https://t.co/UlsnYcsQD6 https://t.co/m1E0nbhBjU,2019-08-22 16:55:00,Twitter Media Studio,8,58
"Basketball or Nothing" on Netflix tells the inspiring story of the boys' basketball team from Chinle AZ: https://t.co/LtseSKB5eV https://t.co/iQKzd1gw6b,2019-08-21 17:55:00,Twitter Media Studio,18,61
Did you know the tallest saguaro cactus measured more than 7 stories – *78* feet? #NPSBirthday https://t.co/qRCFVVd8GP https://t.co/8bujptEuhc,2019-08-21 14:53:00,Twitter Media Studio,13,123
Coming up: the Coconino County Fair on August 30th! https://t.co/GS2IzaQ5eN https://t.co/xnAw9fs40k,2019-08-20 21:52:00,Twitter Media Studio,4,28
#FunFact Petroglyph National Monument is made of volcanic rock with markings made by Native Americans and Spanish settlers 400-700 years ago! #NPSBirthday @NatlParkService https://t.co/2nNI49O4vo,2019-08-20 14:49:00,Twitter Media Studio,18,107
Criminals are finding new ways to steal seniors' hard-earned savings. Watch out for 10 common financial scams targeting seniors: https://t.co/JPDE6hFKVt https://t.co/QoGEvx93CC,2019-08-19 19:08:00,Twitter Media Studio,16,50
#DidYouKnow the Grand Canyon creates its own weather ☀️☁️? See it in person on @NatlParkService's birthday (Sunday 8/25) at @GrandCanyonNPS: https://t.co/cvO12SlsGR https://t.co/AgJHyTTYLY,2019-08-19 13:48:00,Twitter Media Studio,10,79
#DidYouKnow the AZ state flower (saguaro cactus bloom 🌵) can only be found in the Sonoran Desert? Visit @SaguaroNPS for #NationalParkBirthday on 8/25 for free! https://t.co/CQUw0AGMHV https://t.co/wKVySHYaxT,2019-08-18 22:44:00,Twitter Media Studio,29,319
We helped secure $90 million in @USDOT funds to expand I-17. We're investing in infrastructure to create jobs and make roads safer. https://t.co/ma9gSwmmiX https://t.co/xLa0KJbeHU,2019-08-18 17:02:00,Twitter Media Studio,16,143
A woman's health care decisions should be between her and her doctor. We'll always protect women’s access to health care. Sign on if you're with us! https://t.co/RFpckM3j1f,2019-08-16 23:01:49,Twitter Web App,51,419
We're cracking down on scammers targeting Arizonans. Scams to watch out for: https://t.co/nTFkd3cQPp,2019-08-16 13:13:27,Twitter Web App,21,71
We’re helping all Arizonans get a shot at the American dream:   ✅ making textbooks more affordable  ✅ protecting teachers from surprise loan charges  ✅ eliminating federal student loan fees   ✅ improving career and technical education,2019-08-15 23:08:40,Twitter for iPhone,29,249
President Franklin D. Roosevelt signed the #SocialSecurity Act #OnThisDay in 1935. We'll always protect benefits seniors earn over a lifetime of hard work. https://t.co/TPblzAs2fV,2019-08-14 21:36:00,Twitter Media Studio,24,201
Today is Navajo Code Talkers Day — we remember and honor the brave servicemembers whose commitment bravery and unbreakable codes helped us win WWII. https://t.co/9ByCDubP4S,2019-08-14 17:32:05,Twitter Web App,188,686
Check out tomorrow's full moon from Red Rock State Park mountain ⛰️🌙 https://t.co/yfweZbFjRk,2019-08-13 18:02:44,Twitter Web App,7,32
So proud our bill to help veterans get homes is now law. Read more: https://t.co/lUHBgWHtvx,2019-08-12 23:33:31,Twitter for iPhone,74,500
We're improving women veterans’ access to VA health care and sexual trauma support services. https://t.co/mKxdfCTsQj,2019-08-11 17:12:42,Twitter for iPhone,14,149
Our LEGION Act - signed into law last week! - ensures thousands more veterans can access resources through @AmericanLegion membership: https://t.co/4UKIYwrmTl,2019-08-10 22:22:40,Twitter for iPhone,13,86
Proud to have helped secure funding for I-17 expansion bringing jobs and development to our state. https://t.co/U55fMwX6G1,2019-08-09 19:35:18,Twitter Web App,19,169
Robocalls are more than a nuisance. We're cracking down on criminals who scam seniors out of hard-earned savings with illegal robocalls. https://t.co/TP4gaTJxg8,2019-08-09 14:30:19,Twitter Web App,37,267
#OnThisDay Sonia Sotomayor became the first Latina Supreme Court Justice. Grateful to her and countless other women who paved the way. https://t.co/Bkr0Es10Gj,2019-08-08 20:11:07,Twitter Web App,124,990
Thank you to the American heroes who sacrificed so much in service to our country. #NationalPurpleHeartDay https://t.co/cD0qw5DZbn,2019-08-08 02:01:33,Twitter Web App,32,251
Protect yourself and your family from fraud with tips from @FBI: https://t.co/tc17Ktk2k9,2019-08-08 00:56:34,Twitter for iPhone,11,62
@mistyhyman @swimply This is a game-changer!!!,2019-08-07 18:21:15,Twitter for iPhone,0,1
Earlier this week I visited @nike headquarters in Portland OR to learn about the AMAZING new Nike facility that’s coming to Goodyear Arizona in January 2020. 500 new jobs for our West Valley! 🙌🏻🙌🏻🙌🏻  I also got… https://t.co/5YO4Vl9lMU,2019-08-07 17:55:49,Instagram,16,246
54 years ago the #VotingRightsAct was signed into law. Voting rights are fundamental to our democracy -- I'm working to restore the VRA and I encourage my colleagues to put aside partisan politics and protect the right to vote. https://t.co/WzZd1TLptR,2019-08-06 21:40:00,Twitter Media Studio,35,205
Arizona has one of the fastest-growing Alzheimer’s rates in the country. We're helping seniors and their families access care and resources.,2019-08-06 20:41:00,Twitter Web App,8,106
High rental costs hurt Arizonans. We're expanding affordable housing so AZ families can get ahead. https://t.co/xTOWzO6owk,2019-08-06 20:24:03,Twitter Web App,20,118
Happy birthday @USCG! Semper Paratus. https://t.co/honm9djbbg,2019-08-04 15:17:00,Twitter Media Studio,16,136
My heart is with the people of El Paso today. Thinking of all the first responders victims and families affected by this senseless act of violence.,2019-08-03 23:20:11,Twitter for iPhone,67,895
ICYMI: We're improving veterans' mental health care and creating support networks with @danielsparents. https://t.co/nx0lQGoogo,2019-08-03 21:38:55,Twitter for iPhone,31,244
It's #NationalBacktoSchoolMonth! We're protecting Pell Grants eliminating federal student loan fees and lowering interest rates for AZ students.,2019-08-02 20:14:18,Twitter Web App,12,145
It's pretty simple: equal work deserves equal pay. Are you with us? https://t.co/NrKd0nEx9d,2019-08-02 17:28:49,Twitter Web App,21,229
Arizonans earn Social Security and Medicare benefits over a lifetime of hard work. We're committed to protecting those benefits for our seniors and future generations. Sign our petition &gt;&gt; https://t.co/e3JOw99tFE https://t.co/o576WtLw8i,2019-08-01 20:28:00,Twitter Media Studio,14,63
Today's the last day of #NationalParkandRecreationMonth — which AZ parks have you visited? Reply with your favorite ⬇️ https://t.co/iNttbXhF0k,2019-07-31 21:29:59,Twitter Web App,6,91
Porter Pollard from Kingman is kayaking 500+ miles to raise money to support veterans and first responders 👏https://t.co/A7wH1MC6DZ,2019-07-31 16:04:18,Twitter Web App,10,90
54 years ago Medicare and Medicaid were signed into law expanding health care access to millions of American seniors veterans and families. We'll keep protecting and strengthening Medicare and AHCCCS. https://t.co/Z7zWXvxRzF,2019-07-30 20:50:43,Twitter Web App,14,101
.@ASUPolice is part of an international program to change how officers respond to people experiencing mental illness. Read more: https://t.co/irYSRp0eeF,2019-07-29 22:56:07,Twitter Web App,15,65
Happy birthday @NASA! https://t.co/TlJBHgn816,2019-07-29 21:17:00,Twitter Media Studio,29,287
Did you know Arizona played a crucial role in the #Apollo11 mission? Read more: https://t.co/QbLEVQftI2,2019-07-29 19:51:57,Twitter Web App,6,41
Phoenix - looking for ways to get outside while avoiding the heat? Check out these 10 hikes: #NationalParkandRecreationMonth https://t.co/DbLaj09FKA,2019-07-28 19:32:30,Twitter for iPhone,8,63
The #Apollo11 astronauts trained in Arizona — now @NASA's newest astronauts head to Flagstaff. Proud of our state's long history of leadership in space. https://t.co/vMoyoE5pxe,2019-07-27 20:02:29,Twitter for iPhone,13,134
Are you visiting @PetrifiedNPS for #NationalParkandRecreationMonth? Check out these amazing highlights: https://t.co/lM6qDKBTCH,2019-07-27 19:14:21,Twitter for iPhone,5,21
Kids in Maricopa are having fun learning how to build computers: 🖥️ https://t.co/xTPehYeyI0,2019-07-26 21:00:13,Twitter Web App,14,91
.@USWNT players deserve equal pay. We're proud @ProcterGamble is stepping up - and putting money where its mouth is. https://t.co/9GxjybHVsi,2019-07-26 20:37:31,Twitter Web App,42,329
Arizona families shouldn’t have to worry about losing health care coverage — including Medicare and Medicaid. Add your name to protect health care &gt;&gt; https://t.co/ae0ZTumWd5,2019-07-25 18:53:18,Twitter Web App,16,91
What's the best picture you've taken of the Grand Canyon? We're celebrating the 100th anniversary of @GrandCanyonNPS this year — check out more photos from @Forbes: https://t.co/XgTpiXZ04l #100YearsofGrand,2019-07-24 18:33:44,Twitter Web App,17,206
All Arizonans deserve access to affordable quality health care — including the 2.8 million Arizonans with pre-existing conditions. Sign on if you agree &gt;&gt; https://t.co/ae0ZTuExBF https://t.co/hsfcgZ6OsP,2019-07-24 15:39:46,Twitter Web App,8,52
Arizona seniors have earned the right to retire with dignity. We'll always work to protect and strengthen Medicare and Social Security - and keep seniors' savings safe from scams.,2019-07-23 19:20:56,Twitter Web App,29,311
#OnThisDay: the Space Shuttle Columbia lifted off for its 26th flight 🚀: https://t.co/AJ3GvfUv1r,2019-07-22 22:34:28,Twitter Web Client,7,47
The women of @NASA are so inspiring. Holly Ridings Anne McClain and Nujoud Merancy are helping put the first woman on the moon - by 2024! https://t.co/8X0lLrRiHt,2019-07-22 17:10:38,Twitter Web Client,14,141
We can’t go back to a time when Arizonans with pre-existing conditions were overcharged or denied coverage. We're fighting to protect coverage. Are you with us? https://t.co/ae0ZTuExBF https://t.co/FwFZ6FoQs1,2019-07-21 18:55:00,Twitter Media Studio,25,162
Headed to @UArizona in the fall? Check out their fun guide to my hometown Tucson: https://t.co/JQ3R5RWM4p https://t.co/f76M5R9IE9,2019-07-21 17:53:00,Twitter Media Studio,17,84
Happy Birthday @SpecialOlympics! Here's to 51 incredible years. https://t.co/oBlXHvFUgj,2019-07-20 20:38:00,Twitter Media Studio,90,1050
#OnThisDay we celebrate the landing of Apollo 11! At 8:17 PM on July 20 1969 Commander Neil Armstrong and lunar module pilot Buzz Aldrin (@TheRealBuzz) landed on the moon. Here's how Arizona helped get them there: https://t.co/fuaiejZ7tk https://t.co/osGQIhKGrS,2019-07-20 15:38:00,Twitter Media Studio,17,138
'Tis the season to celebrate Arizona's outdoors... with a swim! Check out these 5 "secret" swimming holes during National Park and Recreation Month: https://t.co/1VSEWd5XKv https://t.co/NhpqLFLspJ,2019-07-19 23:32:00,Twitter Media Studio,14,89
Nearly 2.8 million Arizonans live with pre-existing conditions and they ALL deserve quality affordable health care. Sign on if you agree &gt;&gt; https://t.co/ae0ZTuExBF https://t.co/ADniz7Gnqv,2019-07-19 22:43:00,Twitter Media Studio,14,84
In Arizona women *still* make just 83 cents for every $1 the average man makes -- the gap is even greater for women of color.    It’s pretty simple: equal work deserves equal pay. Sign your name &gt;&gt; https://t.co/NrKd0nEx9d,2019-07-19 20:45:27,Twitter Web Client,45,180
We’re helping everyone get a shot at the American dream – whether that’s learning a trade or attending university. We're ✅making textbooks more affordable   ✅ eliminating federal student loan fees   ✅ improving career &amp; technical education,2019-07-19 20:26:33,Twitter Web Client,28,261
.@uarizona professor Michael Marty's Science Engineering and Math Scholar Veterans program supports veteran students who are pursuing STEM degrees: https://t.co/5OJnUi3U6s,2019-07-19 20:00:43,Twitter Web Client,5,28
Under their current deal (even after their historic win!) @USWNT players are paid less than 1/4 of what players on the US men’s team make. That’s wrong. We're working to make equal pay for equal work a reality -- are you with us? https://t.co/NrKd0nEx9d https://t.co/5X1yBSLxtW,2019-07-18 23:35:00,Twitter Media Studio,69,554
Once again protections for people with pre-existing conditions are at risk. Add your name to demand Washington protect access to affordable health care &gt;&gt; https://t.co/ae0ZTuExBF,2019-07-18 21:08:19,Twitter Web Client,19,79
ICYMI: Our first Senate bill will soon be signed into law! It helps more veterans achieve the dream of homeownership. https://t.co/z4Ti13P8H6,2019-07-17 22:19:55,Twitter Web Client,30,272
Gretchen is a trailblazer - congratulations on 26 years with the Tempe Fire Department! https://t.co/b6VOsjLroE,2019-07-17 18:22:24,Twitter Web Client,14,111
Rising rental costs are hurting Arizona families. We're working to fix it - creating more affordable housing *and* supporting jobs for thousands of Arizonans. https://t.co/8FM6hppk9I,2019-07-17 00:04:00,Twitter Media Studio,14,56
July is Medicare's birthday - we're committed to protecting Medicare and Social Security and ensuring seniors can retire with dignity. https://t.co/7djb8RywRI,2019-07-16 21:57:05,Twitter Media Studio,21,111
Our brave servicemembers and veterans put their lives on the line to protect us. We're stepping up to help them achieve the American Dream. https://t.co/Bl2oVaGXJ1,2019-07-16 14:26:16,Twitter Web Client,38,236
Calling all Tucsonans: volunteer to help build trails to celebrate #NationalParkandRecreationMonth! https://t.co/EnSBzBFKBk,2019-07-15 20:18:04,Twitter Web Client,27,205
The Violence Against Women Act protects women and families and gives law enforcement tools to crack down on abusers. We need a long term extension of #VAWA. Let's get it done. #ReauthorizeVAWA https://t.co/wC8sefGHoi,2019-07-14 23:07:00,Twitter Media Studio,53,252
New jobs for AZ mean more families can get ahead. We'll keep working to support our local economy and bring jobs to our state. https://t.co/aWevqgXblD,2019-07-14 19:24:47,Twitter for iPhone,6,95
Part 2 of the birthday swim is done!!! Thanks adamdeguire  and penelopepreston for the open water swim; bonus to have janloh19 all smiles as we finished the swim.   #teambsc #bettysquad19 #sharksquad https://t.co/guPZIUnrWy,2019-07-13 21:23:49,Instagram,3,63
Our bipartisan bill helps vets use their GI benefits to study science technology engineering and math: https://t.co/1FdWkmbBeZ,2019-07-13 21:18:06,Twitter for iPhone,15,99
Part 1 of my first-ever birthday swim complete!!! so grateful to spend this morning with some of my favorite girls (and Adam) lots of chlorinated water coffee and brunch! Thank you 🦄🦄🦄!!!   #teambsc #squad… https://t.co/Tf27WX2RXQ,2019-07-12 21:22:14,Instagram,4,105
Doing my best to take care of the men and women who’ve given it all for us. 🇺🇸 🌵 https://t.co/TDpm2iJhIo,2019-07-12 21:10:58,Twitter for iPhone,158,2805
In February we passed protections to keep our state's incredible #publiclands safe for future generations. How are you celebrating #NationalParkandRecreationMonth? https://t.co/McZs4VHhuO,2019-07-12 21:03:00,Twitter Media Studio,8,41
"On a typical day in Arizona this year more than 3 million robocalls were made to phone numbers in the state." Our TRACED Act cracks down on dangerous illegal robocalls. Read more: https://t.co/fifvjn4BjN https://t.co/zXCHinaqHx,2019-07-12 20:03:00,Twitter Media Studio,8,79
Education was my ticket to a better life. I'm reaching across the aisle to help everyone get their shot at the American dream – whether by learning a trade attending community college or university. https://t.co/ayQXLXBsAD,2019-07-12 17:54:18,Twitter for iPhone,20,133
For too long families on the Navajo Nation had to travel outside their communities for cancer treatment. Now the tribe's first cancer treatment center offers chemotherapy and screenings: https://t.co/iJZYPxq0r1,2019-07-12 15:20:30,Twitter Web Client,59,329
.@ASU psychology researchers use tech to heal trauma and build new patient support systems. Read more: https://t.co/8BXUWPpCA7,2019-07-11 20:41:16,Twitter Web Client,3,30
I come from a military family - so supporting our veterans is personal for me. I’m working to help Arizona vets get homes. https://t.co/LfzcNmOxs1,2019-07-11 17:02:04,Twitter Web Client,118,1103
Which #AZ parks are you visiting during National Park and Recreation Month? https://t.co/IP9kxP1HZz,2019-07-09 21:39:39,Twitter Web Client,5,59
The Violence Against Women Act protects women and families and gives law enforcement the tools to crack down on abusers. We need a long term extension of #VAWA. Let's get it done. https://t.co/YJ0nORP7sW,2019-07-08 21:16:37,Twitter Web Client,46,187
Not even these beautiful photos do Havasupai Falls justice - it's a stunning natural and cultural site. https://t.co/V5eHrRADUA,2019-07-08 18:27:23,Twitter Web Client,19,182
Student loan fees shouldn't stand between an Arizona student and the American Dream. https://t.co/SyLjaWdsvO,2019-07-07 23:14:20,Twitter Web Client,56,436
This is wrong and we all know it. Equal pay! #USWMNT https://t.co/EPId3vyZLp,2019-07-07 22:01:54,Twitter for iPhone,193,1221
#USWMNT #USAwomenssoccer #WWC2019   🇺🇸🇺🇸🇺🇸🇺🇸🇺🇸🇺🇸🇺🇸🇺🇸🇺🇸🇺🇸🇺🇸🇺🇸 https://t.co/9U8IM3gFdR,2019-07-07 21:50:15,Twitter for iPhone,29,408
It's time to renew the Violence Against Women Act. #ReauthorizeVAWA https://t.co/z0yCMnRtxj,2019-07-06 21:45:01,Twitter for iPhone,82,377
Researchers at @NAU are working on a vaccine to protect Arizonans from opiate addiction: https://t.co/K7X1NgvD8w,2019-07-06 20:36:10,Twitter for iPhone,16,109
We'll always protect Arizona's amazing public lands. @GrandCanyonNPS is the newest - and largest - International Dark Sky site 🌌! Check out what that means: https://t.co/iSYo6hZOVw,2019-07-06 00:46:36,Twitter for iPhone,28,244
Friends! Our Team Sinema custom cycling/triathlon/run gear shop closes on July 7th midnight Az time. If you haven’t ordered your gear DM me ASAP for details!!! Hurry because we won’t open the custom shop again -… https://t.co/0mJWnLO5Of,2019-07-05 14:52:34,Instagram,0,21
Happy Independence Day Arizona! https://t.co/E8IHIEG2Io,2019-07-04 16:03:38,Twitter for iPhone,21,303
The Grand Canyon is stunningly beautiful - here are tips for taking amazing pictures: https://t.co/pFYohNkJHu,2019-07-03 15:37:38,Twitter Web Client,20,139
Today is the 55th anniversary of the Civil Rights Act a landmark civil rights victory for all Americans. #OnThisDay https://t.co/dmqtAWMyei,2019-07-02 19:18:14,Twitter Media Studio,27,177
Tucson is expanding economic opportunities for local Arizona businesses: https://t.co/xSND56M46v,2019-07-02 18:47:47,Twitter Web Client,3,34
On #NationalPostalWorkerDay thank your local letter carrier! We're proud to support 6-day delivery. https://t.co/jHIeeHCwDE,2019-07-01 23:15:00,Twitter Media Studio,7,55
#OnThisDay in 1966 #Medicare benefits first became available. I'm committed to protecting and strengthening Medicare for seniors now and for generations to come. https://t.co/PGZJZ3DJXA,2019-07-01 21:45:00,Twitter Media Studio,4,62
Arizona is the best place to live and work - and @uarizona was rated one of the best employers: https://t.co/kOH06fXvD0,2019-07-01 20:07:38,Twitter Web Client,7,50
Today marks the 6th anniversary of the Yarnell Hill Fire. We remember the brave first responders we lost that day. https://t.co/Mw7sT6W4Ka,2019-06-30 15:18:00,Twitter Media Studio,45,353
We helped secure more funding to support Arizona's senior veterans - now new facilities are being built across AZ. https://t.co/JUPkHgQtrU,2019-06-29 18:47:09,Twitter for iPhone,22,152
Some of my favorite moments of triathlon!!   - my PR ironmannz  - Watching glitteral_kitten PR ironmannz  - that time janloh19 qualified for worlds at im703puertorico - racing IM70.3 Boulder with penelopepreston who… https://t.co/AKSpxtp4Bw,2019-06-28 22:07:20,Instagram,0,41
After a lifetime of hard work Arizona seniors count on Medicare and Social Security for retirement. We'll always protect Arizona seniors’ hard-earned benefits. https://t.co/csXvV8bZhB,2019-06-28 20:15:00,Twitter Media Studio,15,113
Flagstaff General Store carries pretty much everything: stop by for a "kaleidoscope of vintage furniture signs home décor art kitchen stuff jewelry candles kitsch..." https://t.co/EDvNgFSz8I,2019-06-28 17:14:19,Twitter Web Client,2,41
Our legislation to help more veterans achieve the dream of homeownership passed the Senate! https://t.co/LfzcNmOxs1,2019-06-28 15:25:41,Twitter Web Client,30,217
SGT Daniel Somers lost his life to suicide after he was denied access to VA care he needed. We worked with @danielsparents to improve care for veterans with classified status - now we're working to expand servicemembers' networks of support. https://t.co/IVVCv3sL7r,2019-06-27 17:46:47,Twitter Web Client,24,95
June is #PTSDAwarenessMonth. We passed legislation to help veterans with traumatic brain injuries and #PTSD. We'll keep working to improve mental health services for #Arizona veterans. Find resources: https://t.co/xpS2P9J7JX https://t.co/OLSDdislAW,2019-06-26 23:33:00,Twitter Media Studio,10,47
Every Arizonan deserves a shot at the American dream. We’re  ✅ making textbooks more affordable   ✅ protecting teachers from surprise loan charges  ✅ eliminating federal student loan fees    Are you with us?,2019-06-26 18:57:41,Twitter Web Client,31,436
#RunDay - my favorite part of #nationaltriathlonweek!!!  Started today with a run to the Lincoln Memorial with adamdeguire - it was gorgeous!  Running is my favorite of the three disciplines because there’s no better… https://t.co/N3edeJ3Mtn,2019-06-26 14:07:27,Instagram,5,64
We love you @ohsobrewery — congrats on your *new* @PHXSkyHarbor airport location! https://t.co/4S26FqhggZ,2019-06-25 22:59:36,Twitter Web Client,3,66
Equal work deserves equal pay. Are you with us? https://t.co/BqTbMoLcDS,2019-06-25 19:03:46,Twitter Web Client,20,169
Today is #bikeday! #nationaltriathlonweek  I love playing bikes with friends in the hot sunny Arizona desert - can’t wait for the weekend to get out there again!   @bettydesigns @cervelo @rudyprojectna @rokasports… https://t.co/xVSx3ODCcf,2019-06-25 16:39:56,Instagram,1,35
Kicking off #nationaltriathlonweek with Swim Day!  I don’t love the swim and I’m not that great at it but if you gotta swim swim with friends  🙌🏻🙌🏻🙌🏻   P.S. I did my swim  #bettysquad19 #asfastasican @bettydesigns… https://t.co/GiWo4Ot6H1,2019-06-24 20:09:35,Instagram,1,76
Extreme summer heat can be especially dangerous for those living in homelessness. Check out how you can help in Tucson: https://t.co/MxKdZAvWUR,2019-06-24 15:07:13,Twitter Web Client,6,54
We're working across the aisle to make college more affordable. https://t.co/VObknRX50w,2019-06-23 19:03:49,Twitter Web Client,49,457
#TitleIX became law #OnThisDay 47 years ago. Today #TitleIX promotes equal opportunities for women &amp; girls in education. We're grateful for the progress that's been made -- let's make sure gender never stands in the way of anyone getting her shot at the American Dream. https://t.co/dhbiUSxJT8,2019-06-23 15:34:00,Twitter Media Studio,40,246
#OnThisDay: The #GIBill was signed into law. Since then it's helped millions of veterans get a college education and achieve the American Dream. So proud of this moment in our country’s history. https://t.co/mA0CavAls3,2019-06-22 14:30:00,Twitter Media Studio,18,182
Happy first *official* day of summer Arizona! ☀️ https://t.co/qQaytZC8Nc,2019-06-22 00:23:42,Twitter Web Client,89,1402
Looking for a fun 5k? Check out the Round Up at The Ranch 5K Run/Walk in Oro Valley on Sunday June 23: https://t.co/g7q9Xr9lm3,2019-06-21 15:52:22,Twitter Web Client,2,20
Arizonans are getting more robocalls than ever. We're fixing it with our bill to crack down on scammers. https://t.co/P1TVsgwOm6,2019-06-20 19:54:06,Twitter Web Client,31,244
Making sure veterans get the benefits they've earned is personal to me. Our bill just passed the Senate — making homeownership possible for more veterans and cracking down on predatory lenders. We'll keep working until it becomes law. https://t.co/LfzcNmOxs1,2019-06-20 16:56:54,Twitter Web Client,20,169
The GREAT STATE 48!!!! https://t.co/l2tbnORkln,2019-06-20 15:16:23,Twitter for iPhone,1,43
That feeling when you score one for the team! @CWSoftballGame    Grateful for this bicameral bipartisan team of women who cross the aisle to #playball and #beatcancer every year. Bad News Babes we’re coming for you next year! #getready https://t.co/POj111t94R,2019-06-20 13:44:56,Twitter for iPhone,5,107
NEWS ALERT: Two of our bills giving veterans the support they deserve just PASSED the Senate! Sign on if you support our efforts to take care of ALL our veterans → https://t.co/8hKKMi4qcG https://t.co/AJUsTSG6pZ,2019-06-19 21:37:01,Twitter Web Client,20,153
Arizona summer is in full swing. Check out tips to stay safe and healthy in extreme heat: https://t.co/wqS3ISWmGZ,2019-06-19 19:39:09,Twitter Web Client,7,29
Hey Bad News Babes you delivered these batteries to the wrong office. I don’t need them. 💨🏃🏼‍♀️💨   @CWSoftballGame https://t.co/M4l6TCNrLl,2019-06-19 15:06:39,Twitter for iPhone,11,121
