Good news from Israel this afternoon – Prime Minister @netanyahu and Chairman @gantzbe have announced the formation of a unity government. I wish our friends in Israel the best as they continue to combat the coronavirus outbreak. https://t.co/jNAl7dtq8F,2020-04-20 22:11:56,Twitter Web App,6,23,corona; 
Like the Apollo 13 rescue mission 50 years ago the #coronavirus outbreak is bringing out the best in American ingenuity and resolve. #WickerReport https://t.co/OvjuImDPwC,2020-04-20 18:06:07,Twitter Web App,5,14,corona; 
Mississippi’s health care workers are working every day to address the #coronavirus outbreak.  People across our state have found ways to say thanks.  @beaurivage_official joined other businesses to share messages of appreciation.  #MississippiMonday https://t.co/Di1wsomqmM,2020-04-20 16:38:39,Twitter for iPhone,4,15,corona; 
The #coronavirus outbreak has required us all to think in new ways. Kudos to Gulfport High for finding a creative way for students to enjoy this rite of passage safely. https://t.co/Ruf97TOsE6,2020-04-17 20:17:04,TweetDeck,14,52,corona; 
President Trump’s bold actions to slow the spread of the #coronavirus are working and have saved countless lives. Now we need to plan how to re-open the economy.  https://t.co/1hVnlDKEFA,2020-04-16 17:28:54,Twitter Web App,6,14,corona; 
This week President @realDonaldTrump asked me to join a task force on economic recovery.   I am grateful for the opportunity to advise the President on policies to get Americans back to work without sacrificing the hard-fought gains we have made against the #coronavirus.,2020-04-16 17:28:54,Twitter Web App,13,48,corona; 
President @realDonaldTrump has been a bold advocate for life.  This week I joined 35 other senators urging him to stand strong against those who want to exploit the #coronavirus crisis.  Fetal tissue research is NOT the answer to curing #COVIDー19. https://t.co/AuBm9q9W0A,2020-04-15 20:32:21,Twitter for iPhone,46,102,covid; corona; 
.@realDonaldTrump has made bold &amp; consistent efforts to defend the sanctity of all human life.   Today I led a group of senators urging him to reject attempts to exploit the current #coronavirus crisis to fund aborted fetal tissue research. https://t.co/vdETOs1rGY,2020-04-14 23:44:55,Twitter for iPhone,16,36,corona; 
✅Mississippi airports awarded $35M to respond to #COVIDー19.   ✅Major airlines agreed to accept the #PayrollSupportProgram &amp; retain their employees.  ✅Small businesses are getting help to keep Mississippians employed.  All because of the #CARESAct and there's more to come. https://t.co/nhs70lJWv7,2020-04-14 21:41:46,Twitter for iPhone,8,24,covid; 
Today @SenHydeSmith and I announced nearly $35M in grants for Mississippi airports to respond to the #coronavirus outbreak. This emergency funding will help our airports so they can continue to support air travel after this crisis has ended. https://t.co/lCvLml5JVZ,2020-04-14 18:22:27,Twitter Web App,4,15,corona; 
Mississippi health providers will be receiving nearly $375M in immediate aid to help combat the coronavirus outbreak. This aid is part of the Senate’s recently passed #CARESact. See more via @HHSgov here⤵ https://t.co/amTQSQ3I52,2020-04-10 17:30:47,Twitter Web App,2,7,corona; 
Great news for local businesses and governments. Today the @federalreserve &amp; @USTreasury announced new actions that will provide up to $2.3T in financing for businesses states counties and cities impacted by the coronavirus pandemic. https://t.co/zn3ozexmOL,2020-04-09 21:50:05,Twitter Web App,2,13,corona; 
Great information for Mississippians considering donating blood during the #coronavirus pandemic. https://t.co/fufAdakX6z,2020-04-09 16:07:46,Twitter Web App,2,3,corona; 
Mississippi will be receiving $1.25B in emergency federal funding to respond to the #coronavirus outbreak. Today I joined a letter asking @USTreasury to preserve flexibility for our state to assist local communities with the impacts of this virus. https://t.co/4efG6kgl9L,2020-04-09 02:30:00,TweetDeck,5,26,corona; 
Congress and this Administration are doing everything in their power to help Americans respond to the #coronavirus outbreak. Check out my interview with @WLOX here https://t.co/KhR9VChDNV,2020-04-09 00:59:00,TweetDeck,5,12,corona; 
States know their local communities best. Today I joined a letter to @USTreasury asking the department to preserve flexibility for state governments as they use Coronavirus Relief Funds to respond to the outbreak in their state. See the letter here ⤵ https://t.co/4efG6kgl9L,2020-04-08 21:59:00,TweetDeck,2,9,corona; 
In case you missed it I joined @DaveWLOX on @WLOX  to discuss the federal government’s response to the #coronavirus outbreak. You can visit my website https://t.co/vWOTTWu5RH for more information. https://t.co/KhR9VC02pl,2020-04-08 21:39:00,Twitter Web App,1,2,corona; 
Thank you @realDonaldTrump for approving @tatereeves's request for a major disaster declaration for the #coronavirus outbreak in Mississippi. This designation will help our state deal with the impact of this disease. https://t.co/hW5K5pdQTh,2020-04-06 20:03:36,Twitter Web App,9,18,corona; 
In the midst of an unprecedented global health and economic crisis brought on by the #coronavirus pandemic Mississippians from all walks of life have stepped up to meet the needs of our neighbors and communities. #WickerReport https://t.co/dVwhDH6iBX,2020-04-06 17:55:26,TweetDeck,17,58,corona; 
It was good to join @paulgalloshow this morning from my home in Tupelo to discuss how the federal government is responding to the #coronavirus outbreak. Listen in here ⤵️ https://t.co/2S4C6wOvL3,2020-04-06 17:18:32,Twitter Web App,1,0,corona; 
The talented tradespeople @HIIndustries have been continuing the fight to get our @USNavy the ships it needs even in the midst of great uncertainty from #coronavirus. This award will give the shipyard the stability it needs to protect its workers.  https://t.co/5p6f2MVuBH,2020-04-03 21:48:12,Twitter Web App,8,13,corona; 
A great example of what can happen when everyone does their part. @msstate engineers are helping to convert ventilators for use in our state’s #coronavirus response. https://t.co/UuUF8UQal5,2020-04-02 20:24:01,Twitter Web App,17,43,corona; 
Excellent news for social security recipients - today @USTreasury announced that recipients will not need to file a tax return to receive coronavirus-related economic impact payments. See more here⤵️ https://t.co/IEU4tvaLuc,2020-04-02 19:29:15,Twitter Web App,3,13,corona; 
In case you missed it I launched a new #coronavirus resources web page to provide Mississippians quick access to information on the outbreak. Check it out at https://t.co/Cy7HLe67kG https://t.co/SzIMMEudqw,2020-04-02 17:08:37,Twitter Web App,7,27,corona; 
Today I launched a coronavirus resources page to provide Mississippians quick access to the many federal state and local resources available to help combat the effects of the coronavirus outbreak.  Check it out at https://t.co/vWOTTWcv09. https://t.co/P3NNPBsPLh,2020-04-01 21:44:30,Twitter Web App,6,14,corona; 
Extreme measures are necessary to help our nation weather this #coronavirus crisis. However no amount of federal action can solve this problem alone. We all need to do our part. #WickerReport https://t.co/poiYrxl05T,2020-03-31 14:14:00,TweetDeck,9,30,corona; 
On #NationalDoctorsDay we take time to celebrate the brave men and women who have dedicated their lives to healing and caring for others.   As our nation faces an unprecedented public health challenge we are especially thankful for their work to battle the coronavirus pandemic.,2020-03-30 21:06:58,TweetDeck,3,22,corona; 
Protecting public health during the coronavirus outbreak has required steps that were unimaginable only weeks ago. Last week Congress passed extraordinary measures to save our economy from collapse and provide health care workers the resources they need. https://t.co/poiYrxl05T,2020-03-30 15:53:35,TweetDeck,2,15,corona; 
The coronavirus pandemic requires innovative solutions. These products meet an immediate public health need while allowing Mississippians to stay employed. @bluedeltajeans https://t.co/AfkqxoqlGa,2020-03-27 16:09:13,Twitter Web App,5,16,corona; 
The economic crisis caused by the coronavirus is like nothing we have ever seen. Last night the Senate voted on the third major piece of legislation in response to this crisis.  The bipartisan #CARESAct will provide immediate relief to the American people. https://t.co/RlBtmdHY8m,2020-03-26 22:27:57,Twitter for iPhone,7,27,corona; 
.@tvanews is taking action to ensure customers continue to receive electricity through the duration of the #coronavirus pandemic. Along with actions by @tatereeves no Mississippian should fear losing power. https://t.co/3TWXrT2FJU,2020-03-26 21:36:51,Twitter for iPhone,8,28,corona; 
See what the #CARESAct will do to help address the #coronavirus pandemic here ⤵ https://t.co/ukn1HJdh8a,2020-03-26 18:14:26,Twitter Web App,3,4,corona; 
This is exactly why I voted last night to pass emergency coronavirus relief. The legislation will provide direct assistance to prevent layoffs and keep businesses from shutting down. For those who have already lost their job we are significantly increasing unemployment checks. https://t.co/GM1ZLcP8K4,2020-03-26 15:52:35,Twitter Web App,10,23,corona; 
The House of Representatives should act without delay because the American people need support now. See my full statement on the Senate’s coronavirus relief package here ⤵ https://t.co/SiFswLgmj9 #CARESact,2020-03-26 15:35:09,Twitter Web App,1,2,corona; 
This plan will also help contain the #coronavirus by supporting hospitals and giving Americans certainty as they comply with public health guidelines. #CARESAct,2020-03-26 13:27:10,Twitter Web App,2,9,corona; 
Today I took a few moments to speak to @USACEHQ chief R.D. James about two flood control projects in Mississippi. Even as I work to negotiate the final details of a coronavirus relief package I am continuing to push these long-delayed efforts forward. https://t.co/ocp5zfSuex,2020-03-24 22:01:17,Twitter Web App,3,11,corona; 
On #NationalAgDay I am reminded of the many contributions of America’s agricultural producers. But today as our nation deals with the #coronavirus pandemic I am especially thankful that our agricultural system remains strong and will continue to provide through this crisis.,2020-03-24 13:50:46,Twitter for iPhone,2,21,corona; 
Americans need accurate information during this pandemic to make decisions about their health and safety. In this week's #WickerReport I debunk some of the most common #coronavirus myths. https://t.co/WuvvPgE2rs,2020-03-23 21:19:13,Twitter Web App,2,13,corona; 
Last night I took to the Senate floor to call for passage of the Coronavirus Aid Relief and Economic Security Act. Senate Democrats blocked the #CARESact from advancing. https://t.co/rAoVz5jflC,2020-03-23 16:12:04,Twitter Web App,4,16,corona; 
Today @UMMCnews and @CSpire announced they would be providing a free mobile telehealth application to allow users to undergo online screenings and schedule in-person #coronavirus testing appointments. #InThisTogether https://t.co/aa9MvjDrtH,2020-03-20 20:31:11,Twitter Web App,8,17,corona; 
Mississippi news organizations like the @clarionledger @hburgamerican @sunherald and @DJournalnow are ensuring that Mississippians have access to information on the #coronavirus outbreak. They will be providing access to their sites without a subscription. #InThisTogether,2020-03-20 20:30:01,Twitter Web App,12,15,corona; 
Mississippi’s manufacturers are also working to provide needed resources for the #coronavirus pandemic. @bluedeltajeans has announced they will be manufacturing medical masks in their Tupelo facility. #InThisTogether https://t.co/GYVbRhfyfS,2020-03-20 20:26:28,Twitter Web App,2,11,corona; 
Yesterday I introduced legislation to provide support for industries vital to the transportation of passengers and supplies during this #coronavirus crisis. It will take work from both parties to provide the most effective efficient and bold relief package possible. https://t.co/3Qjcsim7lf,2020-03-20 17:15:23,Twitter Web App,5,12,corona; 
Today I spoke from the Senate floor in support of the #Coronavirus Aid Relief and Economic Security (CARES) Act of 2020. This legislation would support the hard-hit workers and businesses who bear no responsibility for this crisis. Watch here ⤵ https://t.co/WsSUbqrPu8,2020-03-19 22:48:33,Twitter Web App,5,28,corona; 
The global #coronavirus outbreak is unlike any crisis this nation has ever faced. Soon I will be speaking from the Senate floor in support of the Coronavirus Aid Relief and Economic Security Act. Watch live here ➡ https://t.co/DQ6BPTYyu8,2020-03-19 21:36:49,Twitter Web App,3,15,corona; 
The Senate has now passed its second #coronavirus relief package. I am working with President @realDonaldTrump to craft an economic rescue package to help our nation recover quickly from this natural disaster. https://t.co/P97CfgD2yB,2020-03-18 22:24:58,Twitter for iPhone,10,60,corona; 
I encourage all Americans to do their part to slow the spread of #coronavirus.   Heed the advice of healthcare professionals.  Together we can flatten the curve and beat this virus.  https://t.co/CW0bNqUtgU,2020-03-17 19:05:00,Twitter Web App,6,16,corona; 
I appreciate the @nationalguardMS for their work to support #coronavirus response efforts. https://t.co/Gn5PCuoqk3,2020-03-16 21:56:57,Twitter Web App,3,18,corona; 
If someone in your household has tested positive for coronavirus every person in the household should STAY HOME.,2020-03-16 21:44:07,Twitter Web App,6,11,corona; 
Today President @realDonaldTrump announced stronger guidelines for the American public to help slow the spread of #coronavirus and reduce the impact on our nation’s health-care system. Do your part to help #SlowTheSpread. https://t.co/02t96HVyPS,2020-03-16 21:42:42,Twitter Web App,54,170,corona; 
Here are 5 ways you can stop the spread of #coronavirus:  📏Stay 6 feet away from others.  🖐️Wash your hands frequently.  🏡Stay home if you feel sick.  🤧Cover coughs and sneezes.  🧽Disinfect frequently touched surfaces daily.  Check out https://t.co/ONiScyPpjF for more.,2020-03-15 16:02:59,Twitter for iPhone,13,27,corona; 
See my full statement on President @realDonaldTrump's new actions to fight #coronavirus here ⤵ https://t.co/5Gq76vMkiY,2020-03-13 21:28:04,Twitter Web App,2,8,corona; 
By bringing together our country’s biggest tech retail and health-care companies more Americans will be able to get tested sooner. Stopping the spread of the coronavirus is a serious effort and these steps will help turn the tide.,2020-03-13 21:25:55,Twitter Web App,3,17,corona; 
Do your part to #StopTheSpread. Visit @cdcgov’s #COVID19 website for the latest information: https://t.co/HsbX4VZi1O https://t.co/PNKtklgOQx,2020-03-12 21:46:23,Twitter Web App,4,10,covid; 
Help prevent the spread of #coronavirus. Wash your hands regularly with soap use alcohol-based hand sanitizer cover your coughs avoid touching your face and mouth keep surfaces sanitized and stay home if you feel sick. #WickerReport https://t.co/7qUamGUeWt,2020-03-10 13:22:00,TweetDeck,12,20,corona; 
Congress is providing additional resources to support the #Coronavirus response. The funding package passed by the House and Senate will give health-care workers the tools to treat patients safely. #WickerReport https://t.co/7qUamGUeWt,2020-03-09 18:22:00,TweetDeck,7,15,corona; 
Americans are right to be concerned about the #coronavirus. However as our country deals with a very real threat it is important for us not to allow emotion to obscure the facts. #WickerReport https://t.co/7qUamHbQl3,2020-03-09 15:59:15,Twitter Web App,5,24,corona; 
President @realdonaldtrump &amp; Congress are working with health professionals on necessary precautions to contain the spread of the coronavirus and minimize the risks to our country. The Senate approved resources today to boost the measures already in place. https://t.co/Ao8s2ecI3K,2020-03-05 21:09:57,Twitter Web App,3,19,corona; 
