Did you see this? I just wanted them to have to answer an honest question but instead they tried to steal a moment of reflection about our fallen service members because it didn't fit their political agenda. That's what's wrong with DC right now. https://t.co/riOPfDzAWx https://t.co/XqhhvaY2g9,2020-01-18 17:30:26,Buffer,7,32
@RobJonesVA @JasonChurchWI Will you help me elect these veterans to Congress with a donation? https://t.co/G4nYMbrRnJ,2020-01-17 16:07:37,Twitter Web App,3,8
For those that want to serve our country I always tell them: you have to do it the way people do it in combat...without regard for personal gain and without regard for personal sacrifice. @RobJonesVA &amp; @JasonChurchWI know this. https://t.co/cJit01uxFs,2020-01-17 16:07:06,Buffer,6,28
We are just barely into 2020 and the far-left is already attacking me for standing in defense of President Trump's decision to eliminate the terrorist Soleimani. This month will set the pace for the rest of the year so will you consider pitching in? https://t.co/pKFzRzu0pz https://t.co/0FjJWDG6E7,2020-01-16 22:21:41,Buffer,6,14
From the bottom of my heart thank you for your service to #FL18 and this country 🇺🇸 #LawEnforcementAppreciationDay https://t.co/b7bbSF6afq,2020-01-09 15:00:09,Buffer,21,88
As we start the new year what issues are most important to you? Let me know below: https://t.co/lfirzjMGUR,2020-01-03 19:30:04,Buffer,5,18
Happy New Year! I hope you have a wonderful holiday and that 2020 is your best year yet! https://t.co/ulYwup5O5Q,2020-01-01 17:01:06,Buffer,2,13
Today is the last day to meet our 2019 fundraising goal and we are still behind. Can you give a last minute donation to help us get across the finish line? https://t.co/97GVHgONOA https://t.co/6UTGdkmoU7,2019-12-31 19:32:02,Buffer,4,12
There's only 2 days left until 2020 and I really need your help to hit my fundraising goal for 2019. Can you chip in $20.20 for 2020 today? https://t.co/r4id2ve9Ps https://t.co/UV80QEUAIw,2019-12-30 17:31:01,Buffer,2,3
In many ways 2019 has been a spectacle. We accomplished a lot for our waterways but the rampant partisan games in Washington also prevented even more progress. As we head into 2020 what issues are most important to you? https://t.co/Hz9gp9HrHH https://t.co/5otPOvtDXQ,2019-12-28 22:32:03,Buffer,4,7
Check out this interview with my friends &amp; double amputee veterans @JasonChurchWI &amp; @RobJonesVA. They both want to keep serving our country &amp; are running for Congress so if you like what you hear please consider donating:  https://t.co/30hrKvj9N1 https://t.co/Lj246RWMDo https://t.co/SugDJM0RPC,2019-12-26 14:24:50,TweetDeck,4,9
Wishing everyone a very Merry Christmas from the Mast family! https://t.co/VxXjvu2zGg,2019-12-25 16:21:02,Buffer,4,17
Wishing a happy Hanukkah to all those celebrating in #FL18! https://t.co/hoLvjeVImK,2019-12-22 16:20:02,Buffer,3,9
These painful and deadly tests have gone on far too long! We've been fighting to stop them and this is a huge victory! https://t.co/XdMzdfOBET https://t.co/YdnyV5kU4G,2019-12-21 22:22:02,Buffer,7,8
Florida is leading the way to lower prescription drug prices!  This is great work from @RonDeSantisFL and @realDonaldTrump! https://t.co/l5vnlezuDq https://t.co/ReRLqwbOCh,2019-12-20 20:17:02,Buffer,3,9
|This is the conservative SQUAD we need in Congress! With @RobJonesVA &amp; @jasonchurchwi - both double amputee combat vets &amp; true patriots running to bring veteran leadership to DC. Check them out please share &amp; donate if you can: https://t.co/EiomOAYVmX ||  https://t.co/H1oj6bQosd https://t.co/lRUDsH1OUS|,2019-12-19 22:13:02,TweetDeck,152,605
We've been fighting all year to secure full funding for Everglades restoration and now we've got an agreement to get it done! A big win for efforts to #SendTheWaterSouth! https://t.co/9M5PZ2jibQ https://t.co/lXfA2eGMTM,2019-12-19 17:30:34,Buffer,3,5
This hasn’t been a pursuit for justice. It’s been a pursuit for injustice. Facts be damned they've been trying to impeach President Trump since before he even took office. I was and am a strong NO.  RT if you agree Nancy Pelosi should be removed as Speaker!,2019-12-19 02:59:06,TweetDeck,30,39
No discharges + a booming economy = great news for the Treasure Coast! https://t.co/syF9ouv0bP https://t.co/X8B7OFH395,2019-12-18 00:29:02,Buffer,4,7
@healingrev That bill would result in less research on cures for serious diseases - cancer Alzheimer's ALS etc. (studies show approx. 100 less cures in next decade). I absolutely agree we need to lower drug prices &amp; I think we can find solution that doesn't hurt efforts to save lives,2019-12-17 14:28:30,TweetDeck,0,0
I am working with @EliseStefanik to make sure the will of the American people is not overturned by politicians in Washington D.C. She's been under attack for her role in the impeachment proceedings so please donate now to show your support! https://t.co/KkX1Y9uWCl,2019-12-04 22:33:01,Buffer,1,2
There are just 11 months until Election Day 2020. Can you donate $11 today to show your support? https://t.co/XWgCMgadIb https://t.co/PVfSX5nxOS,2019-12-03 23:30:05,Buffer,2,2
Did you know that today is #SmallBusinessSaturday? Are there any local businesses on your schedule for today? https://t.co/zZmyd94AUo,2019-11-30 14:43:01,Buffer,1,5
Today I am grateful for all those still fighting overseas who cannot be with their loved ones. From the bottom of our hearts Brianna and I thank you for your sacrifice and your service today and every day. #Thanksgiving https://t.co/gP2ZFbsKmM,2019-11-28 17:33:02,Buffer,2,10
There is just under one week left until December and I need your help to meet our budget goals. We're preparing for an all-out fight against the millions earmarked to be spent in FL promoting an anti-American socialist agenda. Will you help? Donate here: https://t.co/a3wYo0dfDk https://t.co/StGUJkcfrb,2019-11-25 22:02:02,Buffer,2,1
The end of the month is just one week from today and DC Democrats are continuing to target us. Can you chip in to help us fight back? #FL18 https://t.co/t8NuwZvEPK,2019-11-23 16:06:02,Buffer,1,1
Last week on Veteran's Day @GovRonDeSantis and @VISITFLORIDA launched a new military-friendly travel section to take steps to make FL the most veteran-friendly state in the nation. Read more about it here --&gt; https://t.co/L686iZrtRC,2019-11-21 22:05:00,Buffer,1,2
@KamalaHarris just said @realDonaldTrump got nothing from North Korea I don’t call our returned MIA nothing they are our heroes. She is a disgrace https://t.co/Utg2pPCfc5,2019-11-21 03:18:44,Twitter for iPhone,0,1
Improving water quality in FL is my top priority and I'm proud of our work with @GovRonDeSantis As I've said before if we wouldn't put it in our bathtub with our children we shouldn't put it in our waterways. Go to this new website for more info --&gt; https://t.co/ssvVzmXM86,2019-11-20 20:05:41,Buffer,1,2
Poll Results: The top response from our poll was protecting our environment! This has been my #1 priority since I was elected and together we've made a lot of progress but our fight is far from over so we must keep up the fight to #SendTheWaterSouth and ensure #ZeroDischarges https://t.co/eOTxTH7ud9,2019-11-19 19:00:20,Buffer,1,0
To all my brothers and sisters who have served in the Armed Forces thank you for your love of our country your dedication to our freedom and your courage on behalf of every American.  Happy Veterans Day! Thank you! https://t.co/Zrs9iwinIr,2019-11-11 18:27:21,Buffer,2,10
Happy 244th Birthday to the US @USMC. Thank you for all that you do for our country. https://t.co/pnJmqfF683,2019-11-10 16:20:05,Buffer,1,6
Today is a day of conversation about inspiring and encouraging kids to reach their full potential in areas such as science technology engineering art and math. #STEM #STEAM https://t.co/UE5Edpt1Pj,2019-11-08 17:16:02,Buffer,1,0
.@GovRonDeSantis and I are working hard to expedite the EAA Southern Storage Reservoir to help improve water quality in our communities. In case you missed it here's the clip from @winknews https://t.co/q6R1lvaBCQ,2019-11-07 19:14:23,Buffer,0,1
One of the most disappointing things about Washington is how much time people spend talking and how little time they spend listening. I won't fall into that trap. So will you spend just a minute to let me know what issues are most important to you? https://t.co/cmCp6IJBWC https://t.co/8jm2XeRUXi,2019-11-06 00:50:58,Buffer,0,2
Under the leadership of Governor @RonDeSantisFL the State of Florida has been doing an amazing job to expedite the Southern Storage Reservoir project.  I will keep fighting to get the Army Corps to match our state's dedication! https://t.co/ZipXbcRIWt,2019-11-01 15:19:00,Buffer,0,3
DC Democrats are targeting our race with big money so with the end of October just 2 days away we need your help! Will you help us reach our fundraising goal so that we can compete against this influx of special interest money? #FL18 https://t.co/aK5zuDHQPE,2019-10-30 21:44:02,Buffer,0,1
We're working to help fishermen and promote healthier ecosystems for many generations to come. Read more about it on @TCPalm: https://t.co/mzGQRWIjXN https://t.co/M7tCzuRmPr,2019-10-25 11:36:02,Buffer,0,2
Thank you Governor @RonDeSantis for your leadership in working to improve our waterways! https://t.co/Bv5xQ2rHGl https://t.co/qQxvn2sNHJ,2019-10-24 15:50:02,Buffer,0,1
A summer without discharges has made a huge difference.  This is what we're fighting for and why we must keep up the pressure! via @WPTV #SendTheWaterSouth #FL18 https://t.co/TnVZiolEPh https://t.co/9gtxjcTfsl,2019-10-22 22:32:03,Buffer,0,2
Last week we passed the "Homeless Veteran Family Act" to provide services to veterans and their families ensuring they have a safe place to stay. Let's get the Senate to pass this ASAP! https://t.co/4FGKOTLOlu,2019-10-21 21:25:57,Buffer,2,6
One of the greatest American statements ever from JFK “ask not what your country can do for you ask what you can do for your country” #DemDebate Not one of your presidential candidates can or want run on that!  @ewarren  @CoryBooker  @BernieSanders @BetoORourke @TomSteyer,2019-10-16 03:05:12,Twitter for iPhone,6,11
Happy birthday to the US Navy! To the men and women who serve to keep our waters safe we thank you. https://t.co/yYUilgIh7v,2019-10-13 18:39:20,TweetDeck,35,120
It's absolutely absurd that a federal program designed specifically to combat harmful algal blooms has never tackled our crisis in Florida.  My bill will change that and demand action: https://t.co/VyDDvXTW8o,2019-10-12 13:17:42,Buffer,2,12
I'm honored to speak at the Wings of Hope Luncheon benefitting the Salvation Army. The money raised from this event goes to programs to help homeless and struggling families in Martin St. Lucie and Okeechobee counties. Get your tickets today! https://t.co/lNT9hUpuuO https://t.co/6InrME7JpL,2019-10-11 13:50:03,Buffer,0,4
Rarely does a week go by that I don't hear from a veteran who is struggling with their own self worth after coming back from overseas.  On this #WorldMentalHealthDay let's #EndTheStigma around mental health. It's always OK to reach out and ask for help. https://t.co/tqHfcgluWk,2019-10-10 12:49:02,Buffer,1,11
Our bipartisan bill will combat harmful algal blooms specifically in Florida and is a huge step forward in demanding protection for our waterways! https://t.co/1mi3aS79IH https://t.co/vepWg3BeqD,2019-10-09 20:48:02,Buffer,1,7
This is a huge improvement from last year and a strong step in the right direction long-term thanks to efforts to #LowerLakeO this year!  Let’s keep up the fight! https://t.co/TnVZiolEPh https://t.co/j6JSf8fwxH,2019-10-08 21:25:44,Buffer,1,4
Today is a special day for all our Jewish friends the beginning of #RoshHashanah! Join me in wishing them a Happy New Year #ShanaTova! https://t.co/eEPisC3eJZ,2019-09-29 12:00:16,Buffer,5,13
Coral reefs are more than just fish nurseries. They provide cultural ecological &amp; economic benefits. In fact #FL relies on them for vital shoreline protection. With the #ReefRestorationBill our coral reefs would be properly funded and taken care of. https://t.co/CxxwOddhIP,2019-09-28 14:30:10,Buffer,5,6
Socialist government-run healthcare. Firearm confiscation. Encouraging illegal immigration. These are the priorities of the Democrats running for president. If you agree we must STOP socialism before it ruins the United States please sign our petition: https://t.co/bYDaLyGcva https://t.co/3nS1uPvBxl,2019-09-27 20:14:58,Buffer,3,9
We're just one week away from our end-of-quarter fundraising deadline and we're still short of our budget goal.  Will you help us get there and join the fight to put people ahead of partisan politics?  https://t.co/oDjrDXaaIQ https://t.co/SIBL37vaun,2019-09-23 20:35:44,Buffer,1,2
Now that it has been a week...what are your thoughts on the 3rd democrat presidential debate? https://t.co/UmW8Oehb3I https://t.co/BNeufmO0pz,2019-09-20 17:59:16,Buffer,1,1
#OTD back in 1947 the @usairforce officially became a branch of our Armed Forces. Let's celebrate all the brave men and women who serve our country in the Air Force! https://t.co/MlnXII5jUt,2019-09-18 16:43:57,Buffer,2,11
Did you know that September is #AnimalPainAwarenessMonth? This month I've been thinking about how much we've accomplished at the VA Department of Agriculture EPA and NIH to stop painful animal testing! But we still have a lot of work to do so let's keep it up! https://t.co/n0a7yMahN4,2019-09-16 21:05:34,Buffer,1,4
Join me in wishing our very own Gov. @RonDeSantisFL a #HappyBirthday! Sign his card below to show him your support and best wishes: https://t.co/LKBm5FVFHb https://t.co/VUGhxflL2N,2019-09-14 14:00:15,Buffer,1,2
Efforts to #LowerLakeO prior to wet season have worked which is why we have received #ZeroDischarges from Lake O this summer (even in the days before and after #HurricaneDorian).  Smart operational change makes a huge difference! https://t.co/P80IYfy4XK https://t.co/HW4AH6bu4h,2019-09-13 15:53:43,Buffer,0,5
Today we honor and remember the fallen - our heroes. #NeverForget #remember911 https://t.co/X0APkSKeMU,2019-09-11 14:14:21,Buffer,4,12
We are only a few days away from the third Democrat debate. What do you think is going to be their next hot topic? https://t.co/dhc6ZPZm4L https://t.co/2U84223lUJ,2019-09-10 15:40:14,Buffer,1,2
Watching our community rally to help the Bahamas has been amazing! If you're looking for resources to help check this out: https://t.co/CLDfIsVqvW https://t.co/lnst7wyIEH,2019-09-09 20:11:58,Buffer,2,7
As we resume our regular ever day lives please remember that not all were so lucky and consider making a donation to help our friends in the Bahamas: https://t.co/zmVhRWLAlc https://t.co/i3IPvrqTnR,2019-09-04 15:08:51,Buffer,0,7
Do not wait to have a plan in place and a supplies kit ready. Heavy rains and strong winds will begin this weekend. Continue to monitor local news and @FLSERT to stay up-to-date. #Dorian,2019-08-30 17:30:22,Buffer,1,2
Hurricane #Dorian is now expected to become a Cat 4 hurricane when it hits our coast. Please have a plan in place and follow @GovRonDeSantis @FLSERT and our local news stations to stay updated.,2019-08-29 20:30:00,Buffer,0,2
For far too long politicians in Washington have ignored the crisis at the border or haven't had the will to fix it.  If you agree that we must secure the border then you can sign up for news alerts here: https://t.co/QYOOee1vCu https://t.co/yXE1sPu2NZ,2019-08-28 15:47:34,Buffer,0,3
Which issues impact your day to day life the most? Will you take this quick survey to help me set our agenda: https://t.co/Hz9gp9HrHH https://t.co/eTCRP0gKGg,2019-08-27 19:54:56,Buffer,0,1
Sadly suicide among police officers is rising across the country. That's why we recently passed the Supporting and Treating Officers in Crisis Act to support mental health and help reduce suicide in our law enforcement community. https://t.co/HyJXwkoVnO https://t.co/eB7ASj0lKX,2019-08-25 17:30:16,Buffer,1,4
The future of our country is at stake. Sign here if you agree: we must prevent socialism in the United States! https://t.co/49SWd0GnFS https://t.co/fjFJQ6L0gK,2019-08-23 14:15:01,Buffer,0,1
We are nearing the end of August and I need your help! Nancy Pelosi is targeting our race and is better funded than us...so please can you donate $10 to help us defend our conservative values? https://t.co/sSdYh0ut8h https://t.co/hyeWj2Ssyw,2019-08-21 16:30:45,Buffer,2,1
I want to hear from you: what are your top issues? Take the survey and let me know what YOU want Congress to focus on ---&gt; https://t.co/7hYDsnjmuV https://t.co/DO9wxArGmQ,2019-08-17 14:00:33,Buffer,0,0
Can you believe we're half-way through August? Will you help us reach our fundraising goal by chipping in $20.20? Only a few hours left until the deadline! https://t.co/p8hTMke9mW https://t.co/RyWuqAiVpg,2019-08-15 16:07:59,Buffer,3,3
We need Americans everywhere to get involved in the movement to defend our democracy! If you agree please sign our petition to oppose socialism: https://t.co/XWT8InjMVI https://t.co/ucjF9BrQGu,2019-08-12 16:06:22,Buffer,1,3
Today we celebrate Spirit of '45 Day to commemorate the end of WWII and the nation's all-out effort to support our servicemen and women. Thank you to the Greatest Generation!  #Spiritof45Day https://t.co/LARYt2b9KR,2019-08-11 12:30:06,Buffer,2,9
It's so important to me that we defend the men and women who selflessly defended our country.  Our bill would support homeless and at-risk veterans with legal assistance.  cc: @NLIHC https://t.co/jXV7HEaR1t https://t.co/7j1gYjkTQx,2019-08-10 14:30:12,Buffer,2,4
Now that the Army Corps has admitted to knowingly discharging toxic water we can't let up the fight for clean water! #SendTheWaterSouth #ZeroDischarges https://t.co/wLOytXPeKk,2019-08-08 19:30:34,Buffer,0,11
After serving in the Army I volunteered alongside the IDF in Israel.  It's disgusting to see Members of Congress like Ilhan Omar spread anti-Semitic lies. Sign the petition if you oppose this kind of bigotry!  https://t.co/IWaIe7oLmo https://t.co/KwzLltPVo3,2019-08-08 13:30:10,Buffer,3,16
The bipartisan Palestinian International Terrorism Support Prevention Act which I introduced passed the House on July 23rd. The U.S. must not tolerate anybody who supports these radical Islamic terrorists! https://t.co/wfFADAOWYl https://t.co/ATDZYpg1eh,2019-08-07 19:45:01,Buffer,3,7
On this #PurpleHeartDay please join me in thanking those who have sacrificed for our freedom! https://t.co/Js75WjwplY,2019-08-07 13:15:24,Buffer,6,13
I want to wish our Coasties a Happy 229th Birthday (well the Coast Guard anyway)! Thank you for keeping our country safe! https://t.co/vIHcRk2eOE,2019-08-04 12:00:03,Buffer,2,7
I will always work to strengthen our country's relationship with Israel - our greatest ally in the Middle East! https://t.co/WaGAc6C8Jn https://t.co/46Esd5KLYl,2019-08-02 13:05:07,Buffer,1,4
It's been a little over 24 hours since the 2nd Democrat Debate and I want to know your thoughts. Which moments had you shaking your head in disappointment? Tell me here --&gt; https://t.co/XcfcKhA9rk https://t.co/WeDm4JMHQG,2019-08-01 19:30:01,Buffer,1,0
The clock is ticking! ⏰After the second round of the Democrat debates it is of essence that we keep conservative values in Congress. Will you help me reach my goal? https://t.co/AcmIKfuweR https://t.co/a4d4kd0GvS,2019-07-31 20:00:15,Buffer,0,0
Are you ready for round 2? The #DemocratDebate Bingo was a huge success! For this round of debates we want to invite you to join us in a game of Word Search! Download your own here: https://t.co/XIDdgazqk7 https://t.co/Ne43sI5fKx,2019-07-30 15:30:58,Buffer,0,1
We are only 2 days away from the end of the month - can you believe it? Thank you for all the support I've received from you thus far! Will you chip in once more to help me reach my goal? https://t.co/22Gg4Oym1v https://t.co/LBOfTfewHI,2019-07-29 17:28:46,Buffer,1,0
Today we honor the brave patriots who defended the Korean Peninsula. These brave men gave their lives for freedom! #NationalKoreanWarVeteransArmisticeDay https://t.co/lM17GcrBA8,2019-07-27 14:55:25,Buffer,3,10
The first step in fixing the crisis at the border is to #FinishTheWall - do you agree? Sign my petition: https://t.co/YY0C8fNqEg https://t.co/fuXwau4lDZ,2019-07-26 18:56:22,Buffer,5,9
All the unnecessary testing on puppies - like induced heart attacks - are inhumane and completely disgusting. We have made great advances in STOPPING animal testing and we will keep fighting until we make sure safe and alternative methods are implemented! https://t.co/I5UpPViurg https://t.co/3U2OZJQgTY,2019-07-25 14:44:12,Buffer,37,58
We must not tolerate anybody who supports these radical Islamic terrorists! Read the full @FL_Daily article here: https://t.co/ddlTGoO5je https://t.co/xXjyHL8gHM,2019-07-24 14:34:20,Buffer,4,8
Today my good friend Sgt Rob Jones announced he is running for Congress in Virginia. It is the 9th anniversary of his "Alive Day" when an IED exploded beneath him in Afghanistan and tore both of his legs to shreds.   Watch and share this AWESOME video!  https://t.co/IW0UKY5Iby https://t.co/PCNNgLqqXe,2019-07-22 14:00:45,TweetDeck,12,12
I joined a group of veterans and their caregivers this week for the @YRFund's 12th Annual Golf Classic. Thank you to everyone who participated and helped honor those who served our nation. https://t.co/BM2rlDEnRJ,2019-07-21 12:30:18,Buffer,4,17
Today we celebrate the 50th anniversary of the landing of Apollo 11 that made Neil Armstrong and Buzz Aldrin the first humans to ever land on the moon! #Apollo50th https://t.co/jS9Ki5Ghns,2019-07-20 12:30:24,Buffer,1,11
Socialism does not work. Period.  https://t.co/zXv6IPKPjH https://t.co/yvHG5hiHjA,2019-07-19 13:45:07,Buffer,1,7
We know that conservation and clean water are not partisan issues. If we want to make progress we need to engage the entire political spectrum! That's why I'll keep fighting with Governor @RonDeSantisFL and others to protect our community! https://t.co/KMsXWktoyd https://t.co/TTaNc9e5AN,2019-07-18 13:04:16,Buffer,2,4
The Democrat's DC political machine has named our community one of their TOP targets for this election. That means I need your support now more than ever! Will you help me fight to make sure people come before politics by chipping in $10? https://t.co/Gd27q5jJK8 https://t.co/yiAtCalmse,2019-07-17 15:54:17,Buffer,5,4
When working with Governor @RonDeSantisFL on the need to replace the old South Florida Water Management District Board I recommended Jacqui Thurlow-Lippisch to serve on the new board - she is an advocate for clean water!   Watch her interview with @WPTV: https://t.co/Tgw0WNIdGG https://t.co/xnKwNgfOhD,2019-07-15 16:27:43,Buffer,1,5
The stakes are higher than ever! Can we count on your support? https://t.co/Gd27q5jJK8 https://t.co/YqqF6ycmrF,2019-07-13 14:30:23,Buffer,2,3
This summer has shown that operational changes by the Army Corps can make a huge difference for our water!  My PROTECT Florida Act would mandate that human health becomes the priority when making these decisions. https://t.co/qMTJTpK7Hy https://t.co/HYRv39YTcQ,2019-07-12 17:11:21,Buffer,1,3
Now that the Army Corps acknowledges that the water they are discharging is toxic they cannot continue to poison our communities. Our government has an obligation to be fully transparent about the deadly risk of reckless discharges! https://t.co/yI5skxf1st https://t.co/ectES8mZEQ,2019-07-11 20:40:21,Buffer,3,5
Brian - you almost made the ultimate sacrifice while serving in battle and you continue to serve your country and Florida. The kids and I couldn’t be more proud of you! #HappyBirthday Brian! Love Brianna &amp; the kids.  SIGN BRIAN’S BIRTHDAY CARD! https://t.co/LbSegHFr6A https://t.co/vb5WLqpcRP,2019-07-10 17:34:36,Buffer,1,10
It's been about 10 days since the Democrat debate. Now that the dust has settled I want to know what your thoughts were on the debate. Let me know by clicking on the link: https://t.co/mH9efKfdjw https://t.co/LoxF1sPvhQ,2019-07-10 00:45:47,Buffer,0,0
Thank you to Michael from Jupiter for writing this Letter to the Editor in @TCPalm. It is our duty to look after our environment and protecting Florida's environment health and economy will always be my priority! https://t.co/dCuf8BURxL,2019-07-09 15:11:46,Buffer,2,2
Thank you @RonDeSantisFL for making our waterways a priority during your first term in office!  Together we are making real progress! https://t.co/eYZqa9xTdV https://t.co/IQeLRsL9Ds,2019-07-06 12:32:07,Buffer,5,19
Today we celebrate our freedom because of brave patriots who wore the uniform with pride. God bless America and I hope everyone has a #HappyIndependenceDay! https://t.co/olXZiYLrqj,2019-07-04 11:17:50,Buffer,11,35
Candidates for president are now openly campaigning on decriminalizing illegal border crossings. How is that a serious proposal? We need more border security not less!  #BuildTheWall https://t.co/bsT1chniGy,2019-07-02 16:17:31,Buffer,13,15
If you're a dog owner or have ever worked with dogs this is fantastic news (actually it's great news regardless). Our work to end deadly experiments on dogs is paying off and reports indicate the tests are nearing the end! https://t.co/9NbB9LXSdF https://t.co/sDjQkRw0hu,2019-07-01 13:09:42,Buffer,8,12
The end of the quarter is TODAY and I really need your help because we are still just short of our fundraising goal! Will you help me fight for Florida in 2020 by chipping in $20.20 now to help us meet our goal? https://t.co/fDUzEBSjlw https://t.co/cM3Qw2Qo8g,2019-06-30 14:01:39,Buffer,7,4
Thank you Governor DeSantis for your support!  With our major FEC fundraising deadline this week please donate here to support united conservative leadership for Florida: https://t.co/fDUzEBSjlw https://t.co/42j2pve7ry,2019-06-29 12:34:07,Buffer,4,9
