I’m here in Washington preparing for a vote on the coronavirus relief bill. Let’s get it done. https://t.co/iI3WyGvz1I,2020-03-27 14:46:02,Twitter for iPhone,6,28,corona; 
Took a 6am flight back to DC this morning with @RodneyDavis to help pass the coronavirus relief bill. https://t.co/HsWV1Ny1y5,2020-03-27 13:30:11,Twitter for iPhone,32,261,corona; 
Earlier today I joined my Illinois House colleagues in supporting Illinois’ request for a major disaster declaration. Thank you @POTUS for quickly approving the request. This will allow Illinois to apply for individual &amp; public assistance through @FEMA as we fight COVID-19. https://t.co/fp86pkxgyG,2020-03-27 01:34:49,Twitter Web App,4,15,covid; 
Since our Congressional Art Competition awards reception was canceled because of COVID-19 concerns I wanted to share the winning submission from @BEaLancer201's Thomas Jackson with you. His artwork shows how Southern Illinois is truly “More Than Just Corn.” Congrats Thomas! https://t.co/3ccCS1QdZx,2020-03-25 21:20:29,Twitter Web App,3,8,covid; 
Unfortunately due to COVID-19 we had to cancel this year's Congressional Art Competition awards reception. However I wanted to announce this year's winner – make sure you watch until the end! Thanks to our judges the folks at @SWICedu &amp; the students who participated this year! https://t.co/oxGcWg1rju,2020-03-25 20:09:56,Twitter for iPhone,1,7,covid; 
Across the US folks are stepping up to help in the fight against COVID-19. In Southern IL @biofuelresearch &amp; Stumpy's Spirits Distillery are producing hand sanitizer. Southern Illinoisans know that we are stronger when we work together. #InItTogether ⬇️ https://t.co/iVQriaqnu5 https://t.co/kZkBRWDnch,2020-03-25 18:02:42,Twitter Web App,2,9,covid; 
We all play an important role in stopping the spread of COVID-19 – whether you’re a doctor grocer restaurant owner or even a brewer. Anheuser-Busch is producing and distributing hand sanitizer around the U.S.  https://t.co/HQtZFNIOHc,2020-03-25 01:58:48,Twitter Web App,8,27,covid; 
First responders risk their lives to keep us safe &amp; many don't have the personal protective equipment needed to protect themselves against COVID-19. I urged House leaders to include grants for firefighters &amp; first responders for PPE to prevent infection in the next COVID-19 bill. https://t.co/WYD00G0jap,2020-03-23 19:00:35,Twitter Web App,1,6,covid; 
Important COVID-19 information for service members and their families stationed at @ScottAFB → https://t.co/b7mn7AUxqj,2020-03-22 17:45:28,Twitter Web App,3,7,covid; 
The @FHFA is working to help folks whose ability to pay their mortgages has been impacted by COVID-19. If your loan is owned by @FannieMae or @FreddieMac you may be eligible to delay payments w/o late fees or fear of foreclosure. More information ↓ https://t.co/LYUjLUkrDm,2020-03-21 17:40:00,TweetDeck,6,6,covid; 
🚨Important info from the @FTC about how to protect yourself from coronavirus scammers. 🚨https://t.co/7P8FfG3pYs,2020-03-21 13:18:50,Twitter Web App,2,0,corona; 
Many of our small businesses have had to temporarily close their doors or adapt their services in order to keep our communities safe from COVID-19. These shops restaurants and bars employ our families neighbors and friends.,2020-03-19 20:37:54,Twitter Web App,3,6,covid; 
Over 45% of our nation’s vets are 60 years or older – the age group that's most at risk of contracting a serious case of COVID-19. My @HouseVetAffairs &amp; @VetAffairsDems colleagues &amp; I are working w/ @DeptVetAffairs to identify their readiness &amp; keep vets &amp; their loved ones safe. https://t.co/J0UvrCrTAO,2020-03-19 00:12:51,Twitter Web App,6,20,covid; 
In order to do our part to limit the spread of coronavirus many of my meetings have turned into conference calls. Today I’m talking with local hospital administrators to get a status report from our healthcare professionals on the ground and update them on the federal response. https://t.co/GshPfNhkTm,2020-03-18 20:44:37,Twitter for iPhone,3,22,corona; 
The state of Illinois has launched a website with up-to-date information about our state's efforts to combat coronavirus. It includes important resources for prevention as well as information for businesses hospitals and schools. → https://t.co/BrXXgj1v4u,2020-03-18 17:13:56,Twitter Web App,1,7,corona; 
.@SIHealthcare has a 24-hour hotline for folks who believe they may have been exposed to coronavirus. Anyone in IL can call – even if SIH isn’t your normal healthcare provider. Visit their website for more information or give them a call at 844-988-7800. https://t.co/PywOE680jq,2020-03-17 17:49:52,Twitter Web App,4,5,corona; 
We must all do our part to slow the spread of coronavirus. Please visit https://t.co/32LaH0hQG0 to stay updated on the latest guidance and suggestions from the @WhiteHouse and @CDCgov. https://t.co/HNfbM6Ji7S,2020-03-17 15:35:23,Twitter Web App,2,6,corona; 
A good read from @TheHill about how social distancing will help #FlattenTheCurve and limit the spread of coronavirus. ↓ https://t.co/yPVqsJEiFH,2020-03-16 19:05:17,TweetDeck,2,1,corona; 
Southern Illinois veterans: To learn more about the steps the VA is taking to protect veterans from coronavirus please visit their website ↓ https://t.co/Tiy37ziosi,2020-03-16 17:28:50,Twitter Web App,0,0,corona; 
Important info for St. Clair &amp; Madison Cos: As a precaution against the spread of coronavirus local officials limited events to fewer than 50 people for the next 8 weeks. Please continue to follow CDC recommendations to keep yourself &amp; loved ones healthy. https://t.co/GGD9PGcjsF,2020-03-16 01:29:44,Twitter Web App,3,4,corona; 
In the early hours of the morning Republicans &amp; Democrats put the health &amp; safety of Americans above politics &amp; came together to increase access to coronavirus test kits &amp; ease the burden on families &amp; job creators as we continue to fight this pandemic. https://t.co/RUn3dKQ1L9,2020-03-14 05:07:45,Twitter Web App,4,14,corona; 
This afternoon I spoke with the emergency management coordinators for our Southern Illinois counties to update them on efforts in Congress to stem the spread of coronavirus talk about preparations on the ground in IL12 and offer any assistance I can from the federal level. https://t.co/GAwnUpaADR,2020-03-12 21:54:33,Twitter Web App,9,26,corona; 
Tonight President Trump laid out a decisive plan to fight the spread of coronavirus and help families and businesses impacted by this illness. We must work together to keep Americans safe and healthy. https://t.co/yl22PIovVy,2020-03-12 01:40:06,Twitter for iPhone,3,22,corona; 
Helpful info from the White House Coronavirus Task Force on ways you can help keep businesses schools and homes safe from the spread of coronavirus ↓ https://t.co/omaZRKPfng,2020-03-11 15:32:54,Twitter Web App,5,6,corona; 
Older adults and those with serious chronic medical conditions like heart lung or kidney disease are at higher risk of contracting coronavirus. Here is some helpful information from the CDC on how to protect yourself and your loved ones. https://t.co/RKpA3Q2fmU,2020-03-09 23:54:02,Twitter for iPhone,7,7,corona; 
How can my bill the VA COST SAVINGS Enhancements Act help the VA limit the spread of coronavirus? The answer lies among the used needles bandages and surgeons’ gloves at the bottom of a medical waste container. https://t.co/wyLBGsLJkf,2020-03-05 15:36:08,Twitter Web App,5,9,corona; 
It’s critical we do all we can to prepare for and prevent a major novel coronavirus outbreak in the U.S. Both @POTUS and Congress have made this our top priority. We voted today to give the CDC and state and local agencies the tools they need. https://t.co/kpwMXmfOWo https://t.co/YKFjHHYhsj,2020-03-04 21:58:02,Twitter Web App,4,6,corona; 
Carbondale’s Illinois Department of Public Health Lab is one of three labs in Illinois designated as a state testing location for the novel coronavirus. More from @thesouthern about the testing process ↓ https://t.co/dlpUVawOzh,2020-03-03 23:43:00,TweetDeck,10,8,corona; 
As the number of cases of the novel coronavirus in the U.S. increase the best defense is to be informed and prepared. Make sure you visit my website for up-to-date information from @CDCgov. ↓   https://t.co/dGyAaDeE9l,2020-03-03 21:25:23,Twitter Web App,9,6,corona; 
It’s critically important that we act quickly to prevent the spread of coronavirus and keep Americans safe which is why @POTUS and @VP have announced a White House Coronavirus Task Force and Congress is looking to fast track funding to combat and research the virus.,2020-02-27 18:14:36,Twitter Web App,1,2,corona; 
The @bellevillenewsd is reporting that a patient at Belleville Memorial Hospital is being screened for coronavirus. Not a confirmation or affirmative diagnosis but I am monitoring the situation closely. https://t.co/NSpj2IkPRS,2020-02-27 18:14:36,Twitter Web App,6,8,corona; 
