Today is the one-year anniversary of @realDonaldTrump  signing my bill the SUPPORT for Patients and Communities Act into law. This law provided the largest Congressional effort in history to combat the opioid crisis and has led to great progress across our nation. https://t.co/NGsVixvMu4,2019-10-24 13:53:42,Twitter Web App,22,59
Today I penned an op-ed ahead of the one-year anniversary of @POTUS signing the SUPPORT Act into law. We have made progress in part due to the law but as we approach this anniversary it’s clear the great battle of addiction and drug overdose continues. https://t.co/1qJ6O1dLHX,2019-10-23 19:46:02,Twitter Web App,3,16
The deadline to apply for a service academy nomination is this Friday Oct. 25. If a student is interested in pursuing a nomination to a Service Academy they should visit my website &amp; fill out the “Request a Service Academy Nomination" form. https://t.co/g271CqLk6R,2019-10-23 18:25:11,Twitter Web App,2,7
Thank you @FLOTUS for hosting the #BeBest roundtable today to celebrate the one-year anniversary of @realDonaldTrump signing the SUPPORT Act into law. We have made great progress in our fight to combat the opioid crisis but more work remains and we must lean #ForwardWithSUPPORT. https://t.co/ImPiD0m761,2019-10-23 18:17:33,Twitter Web App,5,34
There is still time to apply to the 2019 Congressional App Challenge! I look forward to seeing the digital expertise of students in the 2nd Congressional District. Submissions are due Friday November 1 2019 at 9:00am PT. Learn more here: https://t.co/SU9PolCJVU,2019-10-23 14:14:47,Twitter Web App,1,5
Saturday October 26th is National Prescription Drug Take Back Day. This is a great opportunity for people all across the country to help address opioid abuse in their communities. Learn when where and how you can participate here: https://t.co/EGRa8r6hNu  @HouseCommerce https://t.co/2K4oRchG2n,2019-10-22 22:03:47,Twitter Web App,7,19
The addition of high-speed wi-fi to Celilo Village will help shrink the urban/rural digital divide and bring residents greater access to telemedicine remote learning news next generation emergency services video streaming and more. https://t.co/nAeqY9uCba https://t.co/E1parnGcU0,2019-10-21 22:00:56,Twitter for iPhone,3,10
On Saturday I joined Dufur School District &amp; Google at Celilo Village to celebrate the village receiving access to high-speed wi-fi. Kudos to @Google for making this possible &amp; helping the families in Celilo get access to high-speed internet. https://t.co/CNzZIEWIgt,2019-10-21 22:00:53,Twitter for iPhone,10,29
And thanks to Phil Fogg and his foundation for helping to make this journey possible.,2019-10-21 16:33:43,Twitter for iPhone,1,4
“Journey of Heroes” veterans are on their way to Washington DC this morning.  Here are 99-year-old Navy veteran Rocky Lessard &amp; his son; &amp; the original Rosie the Riveter Ada Wyn Parker of The Dalles! Thanks to all our our veterans for giving us the freedom we do cherish 🇺🇸🙏. https://t.co/1sldTcRLxN,2019-10-21 16:33:41,Twitter for iPhone,15,58
Sco’ Ducks! https://t.co/3LkwPdoCUq,2019-10-19 23:04:42,Twitter for iPhone,4,36
It’s wrong to turn our back on those who trusted us. This decision only benefits bad actors &amp; threatens our nation’s security interests.,2019-10-18 19:24:45,Twitter Web App,4,39
The Kurds have fought side-by-side w/ U.S. troops against ISIS &amp; other bad actors. We let them down by standing aside in Syria &amp; giving Turkey the opening to go on the attack.,2019-10-18 19:04:30,Twitter Web App,8,65
Incredibly proud of the eight men and women who graduated from the Josephine County Drug Court last week! Thank you for inviting me to celebrate the achievement. More here: https://t.co/DuYr80VeFS https://t.co/kFGncR7saZ,2019-10-16 21:33:27,Twitter Web App,1,7
God bless the 450 National Guard Soldiers from the 1-186 Infantry Battalion who departed recently in support of Combined Joint Task Force-Horn of Africa. https://t.co/sKMCQBVGMi,2019-10-15 20:13:22,Twitter for iPhone,7,54
Fair winds and following seas to all the incredible members past and present of the @USNavy and Happy Birthday! https://t.co/36MWWu1iwM,2019-10-13 14:00:00,TweetDeck,9,43
I sent a letter w/ @RepMcKinley  &amp; @RepGuthrie pressing the Admin &amp; opioid distributors for an update on report recommendations made last year. More here:  https://t.co/h8DZtZjWt2,2019-10-11 17:53:33,Twitter Web App,1,7
The SUPPORT for Patients &amp; Communities Act that @POTUS signed into law almost a year ago has made progress on the fight to combat the opioid epidemic but more remains to be done. https://t.co/m4U6nR1jEI,2019-10-11 17:53:33,Twitter Web App,3,13
Today I had lunch w/ a diverse group of LaPine Community Leaders - including locally elected officials vets business owners &amp; hunters. From forest management to hearing firsthand stories about the opioid crisis it was great to get input on such a variety of important issues. https://t.co/TGbtcEz12S,2019-10-09 22:36:47,Twitter for iPhone,3,25
Yesterday afternoon I had a great conversation with the Central Oregon Submarine Group. Thanks for stopping by my office! https://t.co/7UGQ2k9Tqj,2019-10-09 17:10:28,Twitter for iPhone,0,13
It was great to join the Redmond Band of Brothers for lunch yesterday. Thanks for having me and for the discussion on how we can better serve our nation’s veterans. https://t.co/8ZFx8vfuge,2019-10-09 17:10:07,Twitter for iPhone,1,22
It was a true honor to deliver the keynote speech at the christening of PCU Oregon which will become USS Oregon upon commissioning next year. PCU Oregon and her crew will be a symbol of freedom and democracy to all who encounter her. https://t.co/BDpDjyytvl https://t.co/K2ivmbYAjd,2019-10-08 14:21:01,Twitter Web App,3,24
Proud to speak at the christening of PCU Oregon. Fair winds and following seas to her and her crew. https://t.co/26n4OjhJkh,2019-10-05 15:38:10,Twitter for iPhone,0,23
Tune in at 10 a.m. ET to watch the Christening of the U.S.S. Oregon the U.S. Navy’s newest attack sub! Watch it here: https://t.co/TcJFBWVnhv,2019-10-05 12:30:00,TweetDeck,5,14
BIG news – America’s unemployment rate dropped to its lowest rate in 50 years!,2019-10-04 18:00:00,TweetDeck,10,79
This week I joined @RepGuthrie and @michaelcburgess in launching a new phase in the patient brokering investigation. This is a part of our continued effort to combat the opioid epidemic. More here: https://t.co/prxCpi03MC,2019-10-04 14:32:02,Twitter Web App,0,10
Thank you @POTUS for signing the Autism CARES Act into law. This legislation will extend funding for the interagency task force dedicated to advancing Autism science which will help support Oregonians and all Americans affected by Autism. https://t.co/A0NX4TPYXT,2019-10-02 20:33:11,Twitter Web App,4,24
The removal of sludge from the K-Basin at the @HanfordSite is a win for all who live along or near the Columbia River. I want to reiterate @SecretaryPerry's sentiments – thank you to all who completed this difficult task. https://t.co/xclxYC9keF,2019-10-02 19:31:42,Twitter Web App,1,16
Plenty of work remains to clean up the waste at Hanford and store it in a safe permanent location but this progress is welcome news for the Northwest. More: https://t.co/kYxbpI6dob,2019-10-01 21:04:45,Twitter Web App,1,4
Today I visited the Hanford Site w/ @SecretaryPerry &amp; @RepNewhouse. We were there to commemorate the completion of the K-Basin sludge transfer away from the Columbia River. This transfer occurred under budget ahead of schedule &amp; reduces the environmental risk to the river! https://t.co/eeMGZlHpVc,2019-10-01 21:04:44,Twitter Web App,2,17
Recent estimates show that we are seeing a drop in opioid overdose rates and an increase in those seeking treatment for addiction. This is good progress but we must continue our work to fight the opioid epidemic. Learn more about my efforts here: https://t.co/KP4bfoGfjl,2019-10-01 17:58:45,Twitter Web App,2,12
Today is Gold Star Mother’s Day! Let’s honor and remember all our Gold Star Mothers and their heroic sons and daughters who served our nation and gave the ultimate sacrifice on our behalf. God bless you all.,2019-09-29 17:48:51,Twitter for iPhone,12,40
This week I spoke at the @HouseCommerce subcommittee hearing on the public health threats of E-Cigarettes. The trends we are seeing surrounding this issue are concerning but there is also a lot left to learn. More here: https://t.co/XNa7eyy1zV,2019-09-27 14:43:25,Twitter Web App,1,9
The trade deal made between Japan &amp; the U.S. is a win for Oregon farmers &amp; ranchers. It is expected to have a significant benefit for Oregon wheat wine potatoes &amp; beef.  This deal will help level the playing field for American agriculture. https://t.co/87QEtrQbnj,2019-09-26 20:50:40,Twitter Web App,11,72
… Americans deserve to get all of the facts - including seeing both the report from the whistleblower and the transcripts of the conversations former Vice President Joe Biden has had.,2019-09-25 20:45:47,Twitter Web App,4,37
I’ve now read the transcript of the phone conversation between President Trump and President Zelensky and while it wasn’t President Trump’s finest moment from what I’ve seen so far it certainly does not rise to ‘high crimes and misdemeanors’...,2019-09-25 20:45:47,Twitter Web App,16,70
20 veterans die by suicide a day – a rate that veterans in Oregon face at twice the national average. We all need to #bethere for our nation’s heroes. I encourage you to visit https://t.co/bfCscB6Axf to learn more. #SuicidePreventionMonth @HouseVetAffairs @DeptVetAffairs https://t.co/P5GBQsOsuP,2019-09-25 18:09:19,Twitter Web App,9,19
I recently published an op-ed in Modern Healthcare on the opioid epidemic. It highlights both the historic achievements we’ve already made and the continued work that needs to be done to combat the #opioidcrisis. Read it here: https://t.co/UFx1aR7NV7,2019-09-25 15:01:49,Twitter Web App,0,11
47.8 billion - that is how many robocalls Americans received last year. As the Republican Leader of @HouseCommerce I am working hard to put an end to these pesky calls. The House already passed the Stopping Bad Robocalls Act - now it's the Senate's turn.  https://t.co/TxGuWP3L2C,2019-09-23 20:34:45,Twitter Web App,2,43
I can think of no better way to spend a Friday afternoon than welcoming home southern Oregon WWII Korean War and Vietnam War Veterans! Thank you for your service patriots. I hope you enjoy the rest of your time in D.C.  @HouseVetAffairs https://t.co/EUV67gJCIe,2019-09-20 20:24:55,Twitter for iPhone,6,22
Today we remember all the brave men and women who were prisoners of war and those who have yet to return home. Let us never forget these patriotic men and women may their sacrifice be forever remembered. #POWMIARecognitionDay https://t.co/S7F31GZR1N,2019-09-20 13:56:50,Twitter Web App,6,18
Last week I spoke on @am860TheAnswer's User Friendly 2.0 about my efforts to stop illegal robocalls. Listen to it here: https://t.co/OKX7NCaVyy https://t.co/aIkX7J00GB,2019-09-19 13:38:02,Twitter Web App,2,11
Today I discussed privacy and data security with @bloomberglaw. Thanks for conducting the thought-provoking discussion. https://t.co/R1tY0vbB41,2019-09-18 20:37:32,Twitter Web App,0,8
I want to give a special shoutout to Dr. Jeremy Gregory who is from Bend Oregon and testified today at the @HouseCommerce Subcommittee on the Environment and Climate Change hearing. https://t.co/dzCnFEgCVp,2019-09-18 15:21:40,Twitter for iPhone,3,20
Today let's thank all the incredible men and women who serve or have served in the @usairforce. Happy birthday! https://t.co/NikjA3p7Ph,2019-09-18 13:48:45,Twitter Web App,4,25
For 232 years our Constitution has been the foundation of our great democracy. The Constitution has protected our individual rights and stood strong against the test of time. #ConstitutionDay #WeThePeople https://t.co/KbkDIHYgGu,2019-09-17 18:42:01,Twitter Web App,3,16
The @US_EDA just announced a $3 million grant to the City of Pendleton to support the expansion of the Eastern Oregon Regional Airport’s UAS Range. I look forward to seeing it pay off for the City of Pendleton and all of eastern Oregon. https://t.co/OFckKxj1Uo,2019-09-17 18:29:48,Twitter Web App,0,7
Mylene and I had a blast at the Pendleton Round-Up this past weekend. Thanks to everyone who worked so hard to make it a successful fun event! https://t.co/eTwM0Vqi1g,2019-09-16 22:55:56,Twitter for iPhone,0,19
Today @FrankPallone &amp; I launched a bipartisan investigation into private equity practices around surprise billing. Surprise billing is on the rise in the U.S. and it is time to put an end to this practice. https://t.co/cdLAeFTOMW,2019-09-16 20:11:08,Twitter Web App,2,13
Last week I joined @FrankPallone on @MSNBC to discuss our legislation to protect patients from surprise medical bills. We need to put an end to this unfair practice. Watch my interview here: https://t.co/f3lfSqm9h9 https://t.co/cCiL70mumQ,2019-09-16 19:30:34,Twitter Web App,10,30
Starting the Pendleton Round-Up off right with Cowboy Breakfast and coffee! https://t.co/WnWMQkYuJ9,2019-09-14 17:41:55,Twitter for iPhone,2,27
It was great to meet with so many of the County Commissioners from across the Second District in Washington D.C. this week! I enjoyed our thought-provoking productive conversation and I hope you all did as well. https://t.co/Ouae88D0Ci,2019-09-13 17:09:32,Twitter Web App,0,15
Today @EPA announced they have repealed the Obama-era rules concerning WOTUS. Farmers and ranchers across Oregon have expressed their concerns with the overreaching Obama-era definition of WOTUS. Thank you @POTUS for listening to our farmers &amp; ranchers. https://t.co/b453ZzcdfA,2019-09-12 18:37:18,Twitter Web App,14,35
It’s past time to get accurate broadband mapping data. Take the community of Weston in eastern OR as an example. Mayor Spurgeon describes their internet service as dial up just w/out the modem noise but the FCC map claims they have 100-megabit service. https://t.co/bwMMQAso0z,2019-09-12 17:11:24,Twitter Web App,0,9
This morning I had the chance to visit @Wawa and celebrate @NACSonline’s 100th In-Store event with @PeterWelch and @PaulTonko. We spoke with employees and discussed the convenience store industry. #NACSinstore https://t.co/QZBx5LboOV,2019-09-12 14:29:59,Twitter for iPhone,0,14
We must never forget what happened on September 11th and we must double down on our efforts to make sure it never happens again. God bless our first responders our active duty men and women and the veterans who have served this country. (4/4),2019-09-11 21:18:53,Twitter Web App,2,7
There was a lot of loss of life that day. Our hearts and prayers go out to those who survived and the families of the victims and certainly to our first responders. (3/4),2019-09-11 21:18:53,Twitter Web App,1,6
As we were beginning the news conference an officer on a motorcycle drove by right here stopped saw us and said 'get out of here they just hit the Pentagon!' and pointed to the sky. (2/4),2019-09-11 21:18:53,Twitter Web App,1,0
September 11th. We all remember where we were what we were doing where our family was. For me it was right here on the House Triangle. We were about to do a news conference on an issue affecting the west. The Capitol is obviously right behind me. (1/4) https://t.co/imyeVRIAyx,2019-09-11 21:18:53,Twitter Web App,2,18
Connecting Americans to high speed broadband especially in rural areas is the goal of our hearing on broadband mapping that’s underway in the Energy and Commerce Committee. https://t.co/F4LDWtgoZm,2019-09-11 15:08:41,Twitter for iPhone,5,30
Josephine County is now a HIDTA-listed county. This gives me hope that we will see greater success in combating the foreign cartels &amp; the drug trafficking throughout our state. This program has already produced successful results throughout Oregon. https://t.co/1WM7IWqcgY,2019-09-11 13:49:56,Twitter Web App,0,9
Thanks for stopping by @ACSCANOregon! https://t.co/oVWK3s3VYR,2019-09-11 01:23:56,Twitter for iPhone,0,7
Today @HouseCommerce held a hearing on maternal health. Despite innovation in health care recent reports have indicated the number of women dying due to pregnancy complications has increased in recent years. Listen to my full remarks on the topic here: https://t.co/X961aw0FGd https://t.co/PRByrRx1Zn,2019-09-10 20:38:41,Twitter Web App,1,3
Thanks to our servicemembers we are blessed with great freedoms like the freedom to assemble and the freedom of speech. We might disagree w/ fellow Americans on various issues but I think we can all agree that it is great to live in a free country. https://t.co/DFBjdhWBB2,2019-09-10 19:47:32,Twitter Web App,1,8
This year I have held 40 town halls - more than any other member of the Oregon Congressional Delegation and more than most members of the House of Representatives. Traveling the district to hear from Oregonians is one of the best and perhaps most important parts of my job! https://t.co/wKlr45GU6G,2019-09-10 19:47:31,Twitter Web App,4,33
This week is Opioid Crisis Awareness Week. This deadly epidemic has touched every corner of our great nation and combating it will require everyone. I encourage you to join me in working to stop this crisis &amp; raise awareness. Together we will continue to  make a difference. https://t.co/4NUMmzqTnc,2019-09-09 20:35:29,Twitter Web App,21,84
If a student is interested in pursuing a nomination to a Service Academy they should start by visiting the below link and filling out the “Request a Service Academy Nomination.”  https://t.co/Di0uSAFyof https://t.co/PjormZCTDd,2019-09-09 18:15:38,Twitter Web App,0,2
Currently Amy serves as a Lieutenant Junior Grade (LTJG) aboard the USS Paul Hamilton (DDG-60) out of San Diego CA. In speaking about the USNA today Amy says “The experiences I have gained through this opportunity are immeasurable and priceless.” https://t.co/hV7qgAHD7S,2019-09-09 18:15:37,Twitter Web App,0,6
Meet Amy Krick from Medford Oregon. I nominated Amy for the United States Naval Academy in 2012. Amy graduated in May 2017 w/ a Bachelor’s degree in Chemistry and was awarded the Military Outstanding Volunteer Service Medal. https://t.co/Up6jbRKe9A,2019-09-09 18:15:36,Twitter Web App,2,32
Last week I had the chance to visit Crooked River Ranch to talk fire safety &amp; celebrate @POTUS signing into law the Crooked River Ranch Fire Protection Act which is critical for the safety of the more than 5000 people living in the area. More here: https://t.co/qvTjVRxdUb https://t.co/gvgDXHY4XG,2019-09-06 20:20:20,Twitter Web App,0,8
The nomination packets and all requested items must be submitted to the Medford office by Friday October 25th 2019.,2019-09-06 15:28:33,Twitter Web App,0,5
Thank you McKenzie and all servicemembers for your service to this nation!   Students interested in pursuing a nomination to a Service Academy should start by visiting the below link and filling out the “Request a Service Academy Nomination.” https://t.co/Di0uSAFyof https://t.co/5CAnEKQJyi,2019-09-06 15:28:32,Twitter Web App,1,9
Currently she is attending the Army’s BOLC at Fort Leonard Wood Missouri. Following her completion of BOLC she will attend the Army Airborne School at Fort Benning Georgia before heading to her duty station with the 82nd Airborne Division at Fort Bragg North Carolina. https://t.co/VQMh7V506B,2019-09-06 15:28:30,Twitter Web App,0,7
Meet McKenzie Bell from Bend Oregon. I nominated McKenzie for the United States Military Academy at West Point in 2014. McKenzie graduated in 2019 as the Brigade Adjutant leading the entire Corp of Cadets in all parades including their Graduation. https://t.co/4ZBYWHVelW,2019-09-06 15:28:28,Twitter Web App,8,80
If you are in middle school or high school I encourage you to apply to the Congressional App Challenge. Good luck to all who enter! Submissions are due by November 1. Apply here:  https://t.co/SU9PolCJVU https://t.co/w2cdmeiWOH,2019-09-05 16:19:32,Twitter Web App,0,5
I am glad to announce the @FCC has awarded $67.6 million to expand rural broadband in Oregon. I look forward to continuing to work alongside Chairman @AjitPaiFCC and my colleagues in Congress to ensure all Americans are connected to high speed broadband.,2019-09-05 15:17:46,Twitter Web App,7,47
.@RepBillFlores is a serious legislator – tireless thoughtful and passionate about advancing conservative solutions for hardworking families in Central Texas and across the country. Thank you Bill for your service. I wish you and your family the very best. https://t.co/tUiZPSnXkl,2019-09-04 19:52:18,Twitter Web App,0,11
The combined efforts of @uoregon OHSU and @NIH will expand our understanding of treatment recovery and prevention of opioid use among women who are parenting young children and will bring us one step closer to ending this crisis. https://t.co/cJh0vhrAbF,2019-09-04 15:06:14,Twitter Web App,1,14
Happy Labor Day to all the hardworking men and women in Oregon and across this nation. Enjoy a safe and fun day with friends and family. https://t.co/h5v0v9ivkr,2019-09-02 15:40:00,Twitter for iPhone,1,20
John is one of the most genuine people you will meet in the halls of Congress. His respect for everyone from the staff to the members has made him a friend &amp; partner to many. I  know John will continue the mission for the next 16 months. I wish you and your family well John. https://t.co/tBypn8CH9g,2019-08-31 01:33:40,Twitter for iPhone,3,26
I just finished my 40th town hall of the year! Thanks to everyone who came out today in Tygh Valley. According to @townhallproject I’ve done more town halls this year than most Members of the House of Representatives! https://t.co/NCII88dqNa,2019-08-30 19:17:45,Twitter for iPhone,2,24
Thanks to the great group of scouts who joined me at my town hall today in Tygh Valley. You did a great job posting the colors. https://t.co/aS6Yv4zYu5,2019-08-30 18:52:58,Twitter for iPhone,0,10
It was a pleasure to have Oregon State Senator Bill Hansell join me for 3 town halls yesterday. Oregon is lucky to have you Bill. Thank you @Hansell4Senate keep up the good work! https://t.co/46lfnk4qrD,2019-08-29 21:55:56,Twitter for iPhone,0,15
@KirstenBarnes Glad you had a great trip!,2019-08-29 21:30:05,Twitter for iPhone,0,0
Happy birthday to the U.S. Marine Corps Reserve! Thank you all for your selfless service. https://t.co/8vHqTWzA0l,2019-08-29 21:21:29,Twitter for iPhone,3,15
Just wrapped up my 39th town hall of the year! Thank you everyone who showed up in Burns Oregon. https://t.co/fvcOouxsm5,2019-08-29 20:52:48,Twitter for iPhone,0,8
Great meeting so many young ambitious scouts in Harney County! Thanks for all your help today. https://t.co/yCTtHzxDxD,2019-08-29 20:39:24,Twitter for iPhone,0,4
This morning I held a round table discussion @ Community Counseling Solutions in John Day. We talked about substance use CCBHCs &amp; veterans’ health care. It was great to hear from the people on the frontlines of these issues &amp; I appreciate all the insight they provided. https://t.co/sgFqJ7phxj,2019-08-29 17:39:39,Twitter for iPhone,3,5
Thank you everyone in Morrow County who came to my town hall today. It was my 38th town hall of the year. Tomorrow I’ll be in Harney County at 11am for another! https://t.co/6yI0rz2Zkt,2019-08-29 00:41:49,Twitter for iPhone,0,15
Thank you to everyone who joined me in Arlington for my second town hall of the day! https://t.co/EdFaUDzLeg,2019-08-28 21:34:06,Twitter for iPhone,0,7
Just finished my 36th town hall of the year! Thanks to everyone who joined me today in Sherman County. Now on to Gilliam County for my next town hall. https://t.co/JHAcO40qW6,2019-08-28 17:44:22,Twitter for iPhone,0,5
Thank you American Legion Post 49 for posting the colors at my town hall in Rufus Oregon! https://t.co/EWDC7OpeYw,2019-08-28 17:34:08,Twitter for iPhone,1,6
About to start the town hall swing at Bob’s Texas T-Bone in Sherman County! https://t.co/CiwedSWuOz,2019-08-28 15:56:56,Twitter for iPhone,0,13
LIVE now on @1190KEX! https://t.co/0N4vktKjVv,2019-08-27 19:08:39,Twitter for iPhone,1,9
Tune in to @1190KEX today at 12:00 pm PT to hear me talk about fire season robocalls and more on the @MarkMasonPDX show!,2019-08-27 16:34:29,Twitter for iPhone,1,5
Happy #NationalDogDay to my furry friend Ted! https://t.co/OzMP3XFE9i,2019-08-27 00:24:05,Twitter Web App,7,46
.@HHSGov just authorized over $800000 to 10 community health centers in the 2nd District. CHCs serve more than 240000 Oregonians in the 2nd District of Oregon. This money will allow centers in Oregon to provide quality care for rural communities.   https://t.co/D37J9NyazG,2019-08-22 23:10:22,Twitter Web App,2,10
Happy anniversary to my beautiful wife Mylene. Thanks for being by my side for the past 37 years I can’t wait to see what adventures the future holds for us. https://t.co/2p1lXvdmq1,2019-08-21 20:02:16,Twitter for iPhone,8,182
For nearly 20 years I worked in the radio business with my wife Mylene. We owned radio stations in the beautiful Columbia River Gorge. In fact my first job was working for my dad at KIHR in Hood River. Join me in celebrating #NationalRadioDay. https://t.co/kzLXXcNaWl,2019-08-20 20:47:16,Twitter Web App,1,28
I am looking forward to hearing from people throughout the 2nd District next week at my town halls in Sherman Gilliam Morrow Harney and Wasco counties! Check out my website for the details: https://t.co/1bMXhBBaUG,2019-08-19 21:00:41,Twitter Web App,0,10
If a student is interested in pursuing a nomination to a Service Academy they should start by visiting the below link and filling out the “Request a Service Academy Nomination.”   https://t.co/Di0uSAFyof  The packets must be submitted to the Medford office by  October 25 2019. https://t.co/eHGYHTOwrO,2019-08-16 14:00:02,Twitter Web App,0,5
