Thank you Zed and Samantha for your service to this nation! And thank you to all our brave men and women in uniform. https://t.co/m14LyBqcyO,2019-08-16 14:00:00,Twitter Web App,0,7
In the following years Zed trained as a Naval Flight Officer at Naval Air Station Pensacola in Florida and afterwards attended pilot training in Columbus Mississippi. Today he is stationed with his wife and 4 kids in Geilenkirchen Germany serving as a NATO Aircraft Commander. https://t.co/n985sT4E7R,2019-08-16 13:59:58,Twitter Web App,0,6
Every year I nominate a few individuals from the 2nd district for Service Academies.  I nominated Steven “Zed” Davies for the United States Air Force Academy in 2005.  Zed married his wife Samantha the day after they both graduated the USAFA in May 2012. https://t.co/1GoJ9489lQ,2019-08-16 13:59:56,Twitter Web App,1,14
Patients shouldn’t be penalized for following a doctor’s orders. The House needs to pass my bill the No Surprises Act and stop surprise medical billing. https://t.co/ZEN8tGmIUQ,2019-08-15 20:04:48,Twitter for iPhone,2,11
This summer my office was lucky to have 2 incredible legal fellows. Thank you for your hard work and dedication it is evident that you will both go far in life. I wish you the best as you continue your journeys at University of Oregon School of Law &amp; Lewis &amp; Clark Law School. https://t.co/AZpgwxQGJh,2019-08-14 18:36:24,Twitter Web App,0,25
The @CDCgov awarded $3 million in federal funds to the Oregon Health Authority Public Health Division to help combat the opioid crisis! This grant dovetails with specific provisions in the SUPPORT Act a bill I authored to tackle the opioid crisis. https://t.co/lx3BgHtdtq,2019-08-13 20:58:43,Twitter Web App,2,11
.@HHSGov awarded grant money to 9 different health centers in the 2nd district to help combat opioid addiction. The opioid epidemic has hit every community across our great state and nation and combating it requires an all-hands-on-deck approach. https://t.co/I9TFkJnu3P,2019-08-09 17:42:25,Twitter Web App,2,7
Yesterday was @smokey_bear's 75th Birthday. Cheers to your 75 years of work preventing wildfires and here is to 75 more years! Take a second to celebrate Smokey's birthday by learning how you can help prevent wildfires https://t.co/ywXxwj5M28 https://t.co/hwDjNYhiad,2019-08-09 14:33:57,Twitter Web App,5,12
Which is why I recently wrote to the Chairman of the @NRDems urging him to move the Resilient Federal Forests Act towards a vote. How much more dirty air and killer fires must people in the West have to endure? It’s time to get these common-sense policies into law.,2019-08-08 20:50:07,Twitter Web App,1,8
We must do more to get our forests back into balance reduce the risk of wildfire help them recover quicker after fires and help our forested communities thrive. The Resilient Federal Forests Act will help accomplish those goals.,2019-08-08 20:50:07,Twitter Web App,0,5
Another wildfire season is already upon us. While we have luckily seen a slow start this year the Milepost 97 fire has consumed more than 13000 acres and sent smoke into the Rogue Valley. https://t.co/eMT1Ieek8K,2019-08-08 20:50:06,Twitter Web App,0,5
Today on #PurpleHeartDay we honor the brave Purple Heart recipients who selflessly served our great nation. Thank you for your patriotic service and sacrifice. https://t.co/ls1dAX0cWw,2019-08-07 19:52:32,Twitter Web App,3,31
I’m thrilled to hear that the Housing Stability Council approved funding for 311 affordable homes across the 2nd district of Oregon. The housing developments will be in Stanfield Bend Redmond White City Eagle Point and Ashland.,2019-08-06 18:32:28,Twitter Web App,0,27
ICYMI - The Port of Morrow received Marine Highway Designation. This is going to help decrease traffic reduce transportation costs and bring additional jobs and growth to the area. You can learn more about what this means for the region here: https://t.co/N7dsoSMZTF,2019-08-05 20:54:18,Twitter Web App,0,7
This can't keep happening and we must work to put an end to these horrid senseless crimes. https://t.co/F8manNS0Nx,2019-08-04 16:29:56,Twitter Web App,1,11
We must all stand in solidarity against acts of white supremacy racism and discrimination and the evil nature of its manifestation in violence. Mylene and I send our prayers and condolences to the people of El Paso Texas and Dayton Ohio.,2019-08-04 14:10:14,Twitter Web App,4,39
Once again hate and violence have stricken innocent people going about their everyday lives. The murderer in El Paso should receive quick and certain justice including any added penalties as a result of his hateful atrocity.,2019-08-04 14:10:03,Twitter Web App,3,31
Thanks to @USDOT the Port of Morrow has received a Marine Highway Project Designation. This designation and the additional funding opportunities will help decrease traffic reduce transportation costs and bring additional jobs and growth to the area! https://t.co/N7dsoSMZTF,2019-08-02 15:00:51,Twitter Web App,0,3
ICYMI - Last week I spoke with @MarkMasonPDX on @1190KEX's the Mark Mason Show. We spoke about robocalls my trip to the border and wildfire prevention. Listen to my full interview here: https://t.co/t8iaaNKuyY,2019-08-01 18:26:32,Twitter Web App,0,5
We need to stop illegal robocalls! In the 541-area code  there were 11.5 million robocalls calls in June alone. Read my op-ed to learn more about what we are doing in Congress to put an end to them once and for all. https://t.co/MbhTNAZJr9,2019-08-01 15:59:22,Twitter Web App,11,76
Recent data from the BEA shows that the vast majority of Americans are benefiting from our continued economic growth. In the first 6 months of 2019 employee compensation increased by $150 billion more than in the entirety of 2016! https://t.co/1turk18qnS,2019-07-31 19:59:12,Twitter Web App,3,11
When it comes to lowering drug prices I've never seen a president more engaged than @POTUS. I look forward to continuing to work with @HHSGov  &amp; @US_FDA  as we explore these paths to lower drug prices for American consumers. https://t.co/jYUTTK2A8L,2019-07-31 18:17:09,Twitter Web App,4,19
Incredible news for the state of Oregon! Thank you @NIH for investing in our state. https://t.co/725w6vpvsk,2019-07-31 15:06:39,Twitter Web App,1,10
It’s great to see that the @washingtonpost Editorial Board supports stopping surprise medical billing. Patients should not be punished with a surprise medical bill simply for following their doctor’s orders. #nosurprisesact https://t.co/h9uN2W4Hm3,2019-07-30 20:02:44,Twitter Web App,4,17
Thank you @POTUS for signing into law the permanent extension of the September 11th Victim Compensation Fund. Now we can rest assured that our brave first responders who selflessly ran towards danger on 9/11 receive full compensation for the sacrifices they made. #Neverforget,2019-07-29 20:40:25,Twitter Web App,2,29
Interested in learning the day-to-day workings of a congressional office while gaining valuable professional experience? My offices in Medford Bend La Grande and Washington D.C. are currently accepting Fall 2019 interns. Learn how to apply here: https://t.co/V6GQ4oaDeT,2019-07-29 15:50:51,Twitter Web App,4,9
It’s finally Friday and Ted is tired after a long productive week! The House passed legislation to stop bad #robocalls the Second District of Oregon received 2 big infrastructure grants from @USDOT and much more. https://t.co/lpND1ExSaV,2019-07-26 14:35:28,Twitter for iPhone,4,34
Tune in to @1190KEX today at 12:15 p.m. PT to hear me talk with @MarkMasonPDX  about stopping bad robocalls! 🤖☎️,2019-07-26 14:15:08,Twitter Web App,1,8
Thank you @SecElaineChao &amp; @USDOT for awarding an INFRA grant of $60 million to help reroute Hwy. 97. The problem area of the Hwy. is congested over 45% of the time &amp; if we don't do anything the average speed is projected to be reduced to &lt; 5 mph during the most congested time! https://t.co/zURG1P4vfJ,2019-07-25 23:34:10,Twitter Web App,6,24
Tune in to the @LarsLarsonShow today at 2:45pm PT to hear me talk about my recent trip to the border robocalls and much more.,2019-07-25 21:19:22,Twitter for iPhone,2,9
Great news the Department of Transportation is awarding a grant to help improve the Eastern Oregon Regional Airport. Not only does the airport help with the flow of goods and people in the area but it supplies many local jobs and fuels the economy. https://t.co/71zNe6TD3n,2019-07-25 18:28:02,Twitter for iPhone,3,14
Great news! https://t.co/ha8MWjGDtb,2019-07-25 12:05:38,Twitter for iPhone,2,10
Great news today the House passed the bipartisan Stopping Bad Robocalls Act! Last month Oregonians in the 541 area code received an estimated 11.5 million robocalls. I look forward to working with the Senate to quickly get this to @POTUS's desk. 🤖☎️ https://t.co/CR0TLxjMmw,2019-07-24 22:02:40,Twitter Web App,3,25
.@Interior's decision to move the @BLMNational is welcome news for the West. Since it is our rural communities that are most affected by the agencies’ decisions and regulations it makes sense to have their HQ closer to the land it manages and those whom its decisions impact.,2019-07-24 20:28:03,Twitter Web Client,9,23
Yesterday I joined @RonWyden and @SenJeffMerkley in urging the feds to ensure that our local fire departments are able to fight fire on federal lands. You can read more here: https://t.co/s9Zrx9JTHN,2019-07-23 22:08:15,Twitter Web Client,10,50
I’m thrilled to announce that DOT is awarding a grant for $60.4 million to the Oregon DOT to help reroute Highway 97 on the north end of Bend. This project will significantly improve freight mobility and help reduce traffic congestion and dangers to drivers.,2019-07-22 22:22:48,Twitter for iPhone,2,60
Here are some photos from my trip to the southern border that capture the desert and mountainous terrain in the Yuma Sector. You can read more about it here: https://t.co/NgPszcJCeX https://t.co/Vo0XRXv2OW,2019-07-19 15:43:33,Twitter Web Client,2,17
ICYMI - Last weekend I discussed the top issues raised at my 13 town halls on @KATUNews's "Your Voice Your Vote." Watch it here: https://t.co/LPVQtYEB7q,2019-07-18 19:56:45,Twitter Web Client,0,4
The Raise the Wage Act isn’t the answer to improving the lives of Oregonians. We need a bipartisan solution that will not reverse our country’s recent economic progress. https://t.co/OJWmqiK6JI,2019-07-18 14:30:25,Twitter Web Client,34,93
We all know how pesky robocalls can be. I am thrilled to announce that today we took steps to stop illegal robocalls from burdening Oregonians and Americans at large. More here: https://t.co/G7ohLrawT1,2019-07-17 22:28:17,Twitter Web Client,3,23
Patients should not be penalized for following a doctor’s orders. This is not fair and it should not happen. I am pleased the Committee took steps to stop this preposterous problem and I will work hard to ensure that this bill makes it to the President’s desk. https://t.co/S6WmeJnqpb,2019-07-17 19:33:14,Twitter for iPhone,1,18
Great news! The Stopping Bad Robocalls Act has passed the Committee. We are now one step closer to stopping these pesky calls. https://t.co/cubkoJ3w3J,2019-07-17 14:57:40,Twitter Web Client,7,25
Hearing on deadly fentanyl is underway.  Read my opening statement here: https://t.co/dAnaVhRyZY https://t.co/2LsCK6gKov,2019-07-16 14:23:48,Twitter for iPhone,3,15
Today I attended “Made in America Day” at the White House. The Northwest was well represented with apples and cherries from Washington Knives from Idaho and wines from Oregon. https://t.co/eMRrbjGlDF,2019-07-15 18:25:02,Twitter for iPhone,5,39
This past weekend I went on a trip to the border. My trip was a fact-finding mission with a clear objective: get answers so Congress can work toward a solution. You can read more about my trip here: https://t.co/NgPszcJCeX https://t.co/TpQ14tTAEO,2019-07-15 17:29:38,Twitter Web Client,5,21
Check out these highlights from the 4th of July break to see the great work that @HouseGOP members were doing all across America. https://t.co/Q73BsnA2jr,2019-07-13 14:00:00,TweetDeck,5,19
Today I was proud to vote for the permanent extension of the 9/11 Victims’ Compensation Fund. The brave First Responders who selflessly ran towards danger on one of our nation’s darkest days deserve to receive full compensation for the sacrifices they made.,2019-07-12 21:30:36,Twitter Web Client,4,65
Robocalls are a menace. When you receive a call from a familiar area code you should be confident that there is a legitimate reason for the call. https://t.co/cls4VQK2pw,2019-07-12 19:45:56,Twitter Web Client,3,13
The Special Diabetes Program has a lifesaving impact on Americans living with Diabetes. Today @HouseCommerce advanced the reauthorization of the program which has support from prominent groups like @AmDiabetesAssn. Let’s keeping fighting for Americas’ Public Health Programs.,2019-07-12 00:24:05,Twitter for iPhone,2,8
Did you know that Community Health Centers serve more than 240000 Oregonians in my district? Today I helped push forward the four-year reauthorization for our CHCs. This is critical to ensure patients can access health care in their community. #communityhealth,2019-07-11 22:53:44,Twitter Web Client,0,10
Patients should not be penalized for following the doctor’s orders. I’m glad that today @HouseCommerce advanced legislation to #protectpatients and #stopsurprisemedicalbilling.,2019-07-11 22:39:47,Twitter Web Client,4,9
Last Congress I helped secure the passage of the RAY BAUM’S Act which provided the FCC with new tools to protect consumers from illegal robocalls. I am pleased with the FCC's proposal to implement these tools &amp;  their commitment to stop robocalls. https://t.co/ldGqKa55My,2019-07-11 20:00:19,Twitter Web Client,2,6
I am thrilled to see @POTUS sign an executive order on kidney health - the first in more than 40 years. This will help the millions of Americans who suffer from a kidney disease. https://t.co/WHPZo5kU5w,2019-07-10 22:54:02,Twitter Web Client,3,23
.@POTUS prioritized the safety and livelihood of Oregonians by approving the Oregon Disaster Declaration. It will provide federal assistance to areas impacted by recent storms in Curry Douglas Grant Linn Umatilla and Wheeler County. More here: https://t.co/28GY5XIOAM,2019-07-10 20:40:48,Twitter Web Client,3,13
Thank you to the @girlscouts who helped post the colors at my town hall in Hood River County last week. Job well done! https://t.co/NyxPmP4XVM,2019-07-10 18:43:07,Twitter for iPhone,1,11
Democrats’ proposal to raise the minimum wage would ELIMINATE as many as 3.7 million jobs according to @USCBO. This would hurt small business owners hurt families and hurt our economy. Instead Democrats should work with Republicans to grow our economy and increase jobs. https://t.co/KI2vW5J0wR,2019-07-09 23:30:02,Twitter for iPhone,46,83
Congrats to the @USWNT for winning the  #worldcup &amp; all the Oregon based @ThornsFC players who helped deliver this win for #USA!,2019-07-07 19:32:35,Twitter for iPhone,4,42
Thank you veterans. Thank you active duty. Happy birthday America.,2019-07-04 16:59:56,Twitter for iPhone,1,18
Happy 4th of July! As we celebrate our nation’s independence &amp; our freedoms let’s remember our veterans &amp; active duty military personnel &amp; thank them for their service. They’ve given us the freedoms that we cherish &amp; enjoy so much on this great day America’s #IndependenceDay. https://t.co/XXEylLZxu3,2019-07-04 16:59:55,Twitter for iPhone,7,50
Thank you to everyone who showed up and helped make this possible. I also want to thank all our veterans and active duty military your selfless service is the reason why we are able hold events like these!,2019-07-04 03:13:52,Twitter for iPhone,2,13
Today I finished my 35th town hall of the year! We traveled 942 miles over 6 days and held 13 town halls all across the 2nd District. According to @townhallproject  I’ve held the most town halls of anyone in the House this year. https://t.co/7aRtsftH01,2019-07-04 03:13:50,Twitter for iPhone,3,37
Thank you to the members of the VFW who posted the colors at my Jefferson County town hall! https://t.co/XULuCUeVZW,2019-07-04 01:13:36,Twitter for iPhone,0,10
What a great turnout in Culver Oregon! Thank you to everyone who shared your thoughts and concerns with me today. https://t.co/1Al21EJXZk,2019-07-03 23:26:20,Twitter for iPhone,1,14
This is why I voted for the bipartisan humanitarian aid package Congress approved last week.  Now Congress needs to step up and address the problems identified in the report and support enhanced border security too.,2019-07-03 21:40:09,Twitter for iPhone,1,20
The recent Inspector General’s report details conditions at the border that are completely unacceptable.  Our facilities are overcrowded overrun and kids and their families are suffering the consequences.,2019-07-03 21:39:11,Twitter for iPhone,6,25
This is why I voted for the bipartisan humanitarian aid package Congress approved last week.  Now Congress needs to step up and address the problems identified in the report and support enhanced border security too.,2019-07-03 21:08:25,Twitter for iPhone,0,8
Thanks to everyone from Deschutes County that came out this morning to my town hall. I want to especially thank the members of the Oregon Band of Brothers who posted the colors. https://t.co/Xvmz9Dh2S4,2019-07-03 20:44:55,Twitter for iPhone,1,9
The #townhall in Jefferson County is off to a great start! 🚒🇺🇸 https://t.co/G7rsyXYS8Q,2019-07-03 18:14:50,Twitter for iPhone,1,7
Update from Culver Oregon ahead of my 34th #townhall: https://t.co/IR1wB0CCFy,2019-07-03 17:34:31,Twitter for iPhone,8,43
Just arrived in Culver! My next #townhall starts at 11 a.m. at the Culver Fire Station. https://t.co/N1pEPA3vj7,2019-07-03 17:12:53,Twitter for iPhone,2,8
Getting ready for my town hall at the Deschutes County Fairgrounds this morning at 8 a.m. https://t.co/afm7ZvMZrt,2019-07-03 14:11:06,Twitter for iPhone,4,8
Hood River County I will see you Wednesday July 3 at 4:00 p.m. PT at Port of Cascade Locks Marine Park Pavilion Building 395 Portage Road Cascade Locks OR 97014,2019-07-03 01:03:47,Twitter for iPhone,0,4
Jefferson County I will see you Wednesday July 3 at 11:00 a.m. PT at Culver Fire Station 200 1st Ave. Culver OR 97734.,2019-07-03 01:03:47,Twitter for iPhone,0,5
Deschutes County I will see you Wednesday July 3 at 8:00 a.m. PT at Deschutes County Fairgrounds Middle Sister Room 3800 SW Airport Way Redmond OR 97756.,2019-07-03 01:03:47,Twitter for iPhone,1,1
Just finished my 32nd #townhall of the year! Thanks to everyone from Crook County who showed up. Tomorrow I’m holding 3 more in Deschutes Jefferson and Hood River County! https://t.co/Foh7v5FUpX,2019-07-03 01:02:41,Twitter for iPhone,0,10
Here’s a recap of what I’ve been hearing on my town hall tour. I just finished my 32nd town hall of the year - the most town halls of anyone in the House according to @townhallproject. https://t.co/bsVGmmFwOm,2019-07-03 00:15:37,Twitter for iPhone,2,30
Today I had a great time talking to the people of Wheeler County in Mitchell Oregon. #townhall https://t.co/KsftXjZWB9,2019-07-02 23:20:33,Twitter for iPhone,0,10
Thank you to everyone who showed up to my town hall this morning in Grant County! https://t.co/pUKxs2BZUV,2019-07-02 22:54:00,Twitter for iPhone,0,9
Driving through the Ochocos on way to Powell Butte #townhall. How sad to see all of these dead trees from the fire. This is why the House needs to pass my legislation that would allow us to harvest burned dead trees while they still have value &amp; plant a green new forest. https://t.co/AsD4iSuzDw,2019-07-02 22:12:22,Twitter for iPhone,11,50
Walking around Mitchell Oregon before today’s second #townhall. https://t.co/MkKGeF48RP,2019-07-02 21:34:23,Twitter for iPhone,1,9
Great to have @AmericanLegion Post 106 77 and 115 post the colors at my Grant County #townhall. Thank you for your service to this nation. https://t.co/aSu1SmxvDd,2019-07-02 17:07:43,Twitter for iPhone,3,19
HAPPENING NOW: I’m taking questions at my #townhall in Mt. Vernon Oregon. https://t.co/zWOPrsnHqw,2019-07-02 16:02:36,Twitter for iPhone,1,12
@joefranell Thanks for coming Joe!,2019-07-02 02:26:52,Twitter for iPhone,0,1
Crook County I will see you Tuesday July 2 at 3:30 p.m. PT at Powell Butte Community Center 8404 SW Reif Rd. Powell Butte OR 97753.,2019-07-02 02:20:45,Twitter for iPhone,0,7
Wheeler County I will see you Tuesday July 2 at 12:15 p.m. PT at Mitchell Community Center 106 S Nelson Street Mitchell OR 97750.,2019-07-02 02:20:45,Twitter for iPhone,0,5
Grant County I will see you Tuesday July 2 at 8:30 a.m. PT at Mt. Vernon Community Building 64 Ingle Street Mt Vernon OR 97865.,2019-07-02 02:20:45,Twitter for iPhone,0,1
Thank you to everyone who joined me in Union Baker and Malheur County today. Tomorrow I’ll be holding 3 more town halls in Grant Wheeler and Crook County.,2019-07-02 02:20:45,Twitter for iPhone,1,7
I just finished my 3rd #townhall of the day. It was great to meet with the people of Malheur County. https://t.co/x4V6nzAsqr,2019-07-02 01:39:37,Twitter for iPhone,1,8
Hey Salem liberals don’t upend our jobs in eastern Oregon. We are doing our part on the environment. We need these jobs we need this tax revenue for basic services. @AshGroveCement  #bakercounty #durkee https://t.co/1j1e4u0Hv6,2019-07-02 01:35:24,Twitter for iPhone,54,148
As a former Eagle Scout myself it was an honor to have Cub Scout Pack 467 post the colors in Vale Oregon this afternoon! https://t.co/JjZ6uAc9lG,2019-07-01 23:07:53,Twitter for iPhone,5,27
Underway at Vale! https://t.co/XqZSRNUTRa,2019-07-01 22:49:56,Twitter for iPhone,1,8
It’s a great day for town halls! Thanks to everyone who stopped by in Durkee Oregon. Next stop —&gt; Vale Oregon. https://t.co/FeDTeMSOEh,2019-07-01 22:33:19,Twitter for iPhone,2,5
Thank you Union County for coming to my 175th town hall since 2012! https://t.co/RTwNdSdqVf,2019-07-01 19:14:24,Twitter for iPhone,1,7
@Drzgoo July 3rd at 8:00 a.m. PT at the Deschutes County Fairgrounds Middle Sister Room 3800 SW Airport Way Redmond OR 97756.,2019-07-01 01:35:08,Twitter for iPhone,0,0
Malheur County I will see you Monday July 1 at 4:15 p.m. MDT at Vale Senior Center Main Hall 100 S Longfellow Street Vale OR 97918.,2019-07-01 01:29:17,Twitter for iPhone,1,8
Baker County I will see you Monday July 1 at 12:00 p.m. PT at Durkee Community Center Gymnasium 1912 Oxman Ranch Road Durkee OR 97905.,2019-07-01 01:29:16,Twitter for iPhone,1,8
Union County I will see you Monday July 1 at 8:30 a.m. PT at Elgin Community Center Main Hall 260 N 10th Street Elgin OR 97827.,2019-07-01 01:29:16,Twitter for iPhone,1,1
Thank you to everyone who joined me in Umatilla and Wallowa County today. Tomorrow I’ll be holding 3 more town halls in Union Baker and Malheur County.,2019-07-01 01:25:07,Twitter for iPhone,2,13
I just finished another town hall in Wallowa County. Now I’m enjoying the beautiful drive to La Grande! https://t.co/ZcRt0c8EcJ,2019-07-01 01:22:18,Twitter for iPhone,1,12
One more town hall down!  Thanks for such a warm welcome Wallowa County. https://t.co/j3QMcZNGwz,2019-07-01 01:19:50,Twitter for iPhone,1,8
This afternoon I met with members of @VFWHQ Post 4307 in Wallowa County! Thanks for your selfless service. https://t.co/mauyROZu8J,2019-07-01 00:46:36,Twitter for iPhone,1,10
It was great to stop by Athena! https://t.co/n2YipIR0YH,2019-06-30 23:33:39,Twitter for iPhone,1,7
I just finished my 25th town hall of the year! Thank you to everyone in Umatilla County who came out today. Now I’m off to Wallowa County for another town hall. https://t.co/gaj3Nn9NWy,2019-06-30 22:32:41,Twitter for iPhone,1,18
Thank you VFW Post 922 for posting the colors at my town hall in Umatilla County. I’m so glad you could attend and am grateful for your service to this nation! https://t.co/ehJTXoDHlN,2019-06-30 21:12:54,Twitter for iPhone,2,18
Wallowa County I will see you Sunday June 30 at 3:45  p.m. PT at Wallowa Senior Center Dining Room 204 E 2nd Street Wallowa OR 97885.,2019-06-29 18:57:56,Twitter for iPhone,0,7
Umatilla County I will see you Sunday June 30 at 12:00  p.m. PT at Athena Elementary School Cafeteria 375 S 5th Street Athena OR 97813.,2019-06-29 18:57:35,Twitter for iPhone,0,6
2 town halls down and 11 to go! Tomorrow I will be in Umatilla and  Wallowa County. For a full list of the 13 town halls check here: https://t.co/oK8z3YfDCL,2019-06-29 18:57:09,Twitter for iPhone,3,13
I just completed my 24th town hall of 2019. Thank you to everyone in Jackson and Josephine County who came to today’s town halls and shared your thoughts and concerns with me. https://t.co/9wxABZDqkc,2019-06-28 20:31:46,Twitter for iPhone,2,25
HAPPENING NOW: Jackson County town hall at Eagle Point High School. https://t.co/aPBOIoMlNX,2019-06-28 18:48:21,Twitter for iPhone,0,7
It was great to meet with members of Grants Pass @VFWHQ Post 2302 before my Jackson County town hall. Thank you for your service! https://t.co/2m6NBVfrxf,2019-06-28 18:44:54,Twitter for iPhone,1,3
Today I had the pleasure of speaking with Josephine County veterans. I’m so grateful for their selfless service to our nation! https://t.co/LktdrAEKGj,2019-06-28 17:46:42,Twitter for iPhone,1,7
It was great to meet with Josephine County Rogue Valley Young Marines today! https://t.co/h5Vsed6lzd,2019-06-28 16:07:31,Twitter for iPhone,2,18
Jackson County I will see you Friday June 28 at 11:30 a.m. PT at Eagle Point High School Cafeteria 203 N Platt Ave. Eagle Point OR 97524.,2019-06-28 01:01:16,Twitter for iPhone,1,5
Josephine County I will see you Friday June 28 at 9:00  a.m. PT at Grants Pass High School  Performing Arts Center 830 NE 9th Street Grants Pass OR 97526.,2019-06-28 01:00:35,Twitter for iPhone,1,4
