The dangerous stimulant epidemic has hit OR &amp; our nation hard. A 2017 survey placed OR as 2nd in the U.S. for methamphetamine use. I was glad to join a bipartisan group of lawmakers requesting proactive action from @HHSGov @DHSgov &amp; the @DEAHQ. More: https://t.co/mLc8SIwXRM,2020-01-17 20:14:39,Twitter Web App,3,10
Don't forget to join me Tuesday January 21st for my first town hall meeting of 2020 in Harney County. Details here: https://t.co/u4zSeVAKEm https://t.co/csvJSJ2YZ1,2020-01-17 18:33:35,Twitter Web App,2,7
Americans are consuming more cannabis &amp; policy decisions on this substance have been made in a virtual information vacuum. States that have legalized marijuana like OR have done so with far less info than they have on legal substances that are easily abused such as alcohol.,2020-01-15 19:39:02,Twitter Web App,2,7
This morning I handed out (normal) cookies in a @HouseCommerce hearing to raise awareness of the need for cannabis research. In OR you can purchase a range of THC-infused products but the standards for such products are largely arbitrary. We need more research and better data. https://t.co/pkLq9SgQzc,2020-01-15 19:39:02,Twitter Web App,3,11
I’m proud to have hosted more town halls in the last year than any other member of the Oregon House Delegation. Join me for my first town hall of 2020 next Tuesday January 21st in Harney County. Details here: https://t.co/u4zSeVAKEm https://t.co/6RAg8KKXe6,2020-01-15 16:32:54,Twitter Web App,5,14
The next step in responding to the #opioidcrisis is holding top opioid manufacturers responsible – I am proud to be joined by @RepGuthrie and @RepMGriffith on @HouseCommerce to reactivate our investigation. Learn more here: https://t.co/7AXwoAEQed,2020-01-14 22:37:25,Twitter Web App,5,12
I just spoke at a @HouseCommerce hearing on the opioid crisis. As I was preparing for this hearing I noticed that Jackson County has a ‘Yellow Alert’ up for opioids. They have 2 overdoses on average per-week in the county and they had 7 last week – fortunately no deaths. https://t.co/0Kzy8h6BRv,2020-01-14 16:10:47,Twitter Web App,8,18
The action of the House today plays into the hands of the Iranians who want us to leave the Middle East to them. B/c we voted on a House concurrent resolution it could never have the force of law &amp; could never reach POTUS's desk. That makes it little more than a press release.,2020-01-09 23:32:02,Twitter Web App,4,21
Even President Obama’s former Secretary of DHS said he was ‘...a lawful military objective.’ I can only imagine what the political narrative would be today if the President had not acted based on the intelligence data we had and the terrorists had carried out their plans.,2020-01-09 23:32:02,Twitter Web App,5,23
Soleimani was directly responsible for the deaths of 100s of American military members &amp; the maiming of many more. He was the mastermind of terrorist activities often through surrogate organizations all across the region.,2020-01-09 23:32:02,Twitter Web App,1,7
I came away from yesterday’s classified briefing more convinced than ever that @realDonaldTrump as Commander in Chief was right to protect American troops and diplomats in Iraq - and to prevent terrorist attacks there and elsewhere - by taking out Qassem Soleimani.,2020-01-09 23:32:01,Twitter Web App,14,70
Today is #nationallawenforcementappreciationday. Thank you to all the incredible men and women who serve in law enforcement and keep our communities in Oregon and all across this nation safe! https://t.co/QO0oo6tAoU,2020-01-09 22:11:10,Twitter for iPhone,2,12
This morning I spoke at a @HouseCommerce hearing on improving public health and wellness services in Oregon and across the nation. Learn more here: https://t.co/699w1Izi03,2020-01-08 22:52:41,Twitter Web App,2,8
It is an honor to nominate 13 outstanding young Oregonians to our nation’s services academies. These young leaders have earned these well-deserved nominations through years of hard work dedication and commitment to character. https://t.co/0S0vhwhoyj,2020-01-07 22:40:28,Twitter Web App,2,12
Congratulations to Rogelio Laine Adamaryz and John from Hermiston High School for winning the 2019 Congressional App Challenge for Congressional District 2! They designed an app called Finana that will help non-profit organizations manage their fundraising. 📱🎉,2020-01-07 21:37:05,Twitter Web App,3,8
It’s obvious Iran will respond and America must be vigilant. It’s important that Congress gets a full briefing on the situation and the Administration’s strategy going forward.,2020-01-03 21:11:02,Twitter Web App,3,24
General Qassem Soleimani was the mastermind behind some of the deadliest terrorist attacks on American men &amp; women who wore our nation’s uniform. The commander of Iran's secretive Quds Force spread violence across the Middle East &amp; was intent to cause more destruction &amp; death.,2020-01-03 21:11:02,Twitter Web App,5,36
Thank you @realDonaldTrump for signing the TRACED Act into law this week. This bipartisan law that I helped author will put consumers first and protect the American people from illegal robocalls. It was great to close out 2019 with another win for the American people!,2020-01-02 20:43:47,Twitter Web App,8,59
Go ducks! A great start to the new year. 🌹🏈 #RoseBowlChampions https://t.co/nWPUolpst3,2020-01-02 01:54:27,Twitter for iPhone,7,32
I look forward to continuing that good work into the new year. I hope everyone has the best year and best decade yet! #2020,2020-01-01 17:20:49,Twitter for iPhone,0,19
Happy New Year! As we enter this new decade I reflect on the progress we’ve made over the last decade to reduce the threat of wildfires in our forests improve access to health care in rural communities &amp; combat the opioid crisis.,2020-01-01 17:20:49,Twitter for iPhone,3,43
Mylene &amp; I want to wish everyone a Merry Christmas! We hope your holiday is spent w/ your loved ones &amp; filled with lots of laughter &amp; joy. Let us also thank our brave servicemembers who are unable to be home this Christmas. May you all have a Merry Christmas &amp; a Happy New Year!,2019-12-25 20:42:40,Twitter for iPhone,9,77
Merry Christmas and a Happy New Year from my staff and I! https://t.co/BPBkszMrXD,2019-12-20 20:36:08,Twitter for iPhone,7,83
I am glad that the House came together today to pass the bipartisan #USMCA and I applaud @realDonaldTrump for working hard to negotiate this deal. Today is a big win for Oregon's businesses and ag producers.,2019-12-19 21:36:24,Twitter Web App,5,64
Today the Senate passed legislation I helped author that will put a stop to illegal robocalls. Now the bill is headed to @realDonaldTrump’s desk and I look forward to him signing it into law! https://t.co/z00fFF4IPg,2019-12-19 17:40:19,Twitter Web App,6,29
Overturning the vote of the American people demands 2 things: a bipartisan/fair process to determine wrong doing &amp; a criminal offense worthy of overturning the outcome of the voters’ will. But neither threshold has been met in this case. More here: https://t.co/gTqoGbjFis,2019-12-19 01:46:06,Twitter Web App,20,68
With a clear conscience I voted today against both articles of impeachment.,2019-12-19 01:46:06,Twitter Web App,61,372
On Monday I enjoyed having @NuScale_Power &amp; DR Johnson Lumber out in D.C. for @HouseCommerce’s innovation showcase. Thank you to everyone who came out for the showcase and made it such a success. #InnovatEandC https://t.co/GugH6995QN,2019-12-13 20:46:30,Twitter Web App,7,22
Unfortunately today the House voted to pass legislation that would provide #FewerCures and lessen the chance of people like Carol ever having a cure for their disease. I promise to continue to fight for Carol and all Americans who deserve both lower drug prices AND #MoreCures!,2019-12-12 21:47:21,Twitter Web App,2,8
I support H.R. 19 the Lower Costs #MoreCures Act because of people like my friend Carol from Central Oregon who has MS. This bill would’ve given Carol and many others hope for a cure and lower drug prices. https://t.co/otJfziuchZ,2019-12-12 21:47:20,Twitter Web App,21,79
HAPPENING NOW - I’m live on  @1190KEX’s the @MarkMasonPDX show! I’ll be talking about surprise medical billing and the Lower Costs #MoreCures Act.,2019-12-12 20:08:11,Twitter for iPhone,2,3
I also introduced H.R. 19 this week which would help lower the price of insulin and prescription drugs! #LowerCostsMoreCures,2019-12-12 19:03:01,Twitter Web App,1,5
The rising cost of insulin prices over the past decade is troubling. That is why I recently sent a letter with @michaelcburgess to insurance companies asking for answers as to their role on the rising cost of insulin.,2019-12-12 19:03:01,Twitter Web App,11,50
USMCA provides improved market access for our farmers &amp; is particularly good news for OR 🍷 🌾 &amp; 🥛 producers. The time is now for @SpeakerPelosi to bring this trade agreement to the House floor for a vote.,2019-12-10 18:45:12,Twitter Web App,1,15
The agreement reached between @realDonaldTrump &amp; House Democrats on USMCA is welcome news for OR’s businesses farmers &amp; ranchers. This trade agreement modernizes our trade policies w/ Mexico &amp; Canada where OR businesses export $3.7 billion in goods supporting 7421 jobs in OR.,2019-12-10 18:45:12,Twitter Web App,9,33
Today I introduced the Lower Costs More Cures Act of 2019 to lower drug prices. The legislation would:  ⬇️lower drug prices 💊protect access to new cures 🔍increase transparency  🩺encourage medical innovation 💸 make insulin more affordable https://t.co/JnIFg0WZjD,2019-12-09 22:21:28,Twitter Web App,172,581
This legislation hopefully will move through the process soon before the end of the year and we can give certainty and protection to consumers and stop the rip-offs that are occurring today in the healthcare system.,2019-12-09 16:06:31,Twitter Web App,0,7
Congress has stepped up to do something about it in a bipartisan way Republicans and Democrats House and Senate have come together in an effort that I have led to stop surprise billing.,2019-12-09 16:06:31,Twitter Web App,1,7
One out of five Americans according to some studies get a surprise bill that they have to pay out of pocket when they go to the emergency room.,2019-12-09 16:06:31,Twitter Web App,0,2
We’ve made real progress on stopping surprise billing. This is where you follow the rules pay your insurance premium and think you’re covered in your hospital or ER only to find out somebody has contracted something out and it’s no longer in the network that has to stop. https://t.co/wmPZx1I1a4,2019-12-09 16:06:30,Twitter Web App,4,23
Today we remember the brave men and women who paid the ultimate price 78 years ago at #pearlharbor. We will never forget the heroes that lost their lives that day in the name of freedom. God bless all our veterans and military members who have selflessly served our county. https://t.co/IrpNRkOVq8,2019-12-07 17:38:51,Twitter for iPhone,8,27
I smell roses!  Go Ducks! https://t.co/MUmV04qBbJ,2019-12-07 04:45:48,Twitter for iPhone,2,33
20-0. ‘Sco Ducks! https://t.co/I7j3Vg0V7V,2019-12-07 02:40:44,Twitter for iPhone,1,18
GO DUCKS!! https://t.co/YvQ6A1a69O,2019-12-07 01:33:16,Twitter for iPhone,4,20
Did you know that last month alone Oregonians living in the 541 area code received an estimated 14.1 million robocalls?! Thankfully this week the House did something about it &amp; passed a bill I’ve been working on to put an end to these menacing callers!☎️🤖https://t.co/3CCKH2wEhi,2019-12-06 20:15:00,TweetDeck,7,37
I’m excited to have two innovative Oregon companies NuScale and DR Johnson Lumber here in D.C. on Monday for @HouseCommerce's Energy and Environment Innovation Showcase. #Innovateandc https://t.co/3YUNJZpbjw,2019-12-06 19:00:03,Twitter Web App,4,10
Another month another great #JobsReport for America! The new report shows: 👷‍♀️266000 more jobs 💰higher wages ⬇️50 year low unemployment This is great news for Oregonians and all Americans!,2019-12-06 18:52:29,Twitter Web App,38,148
Far too many Oregonians still lack access to reliable broadband internet service. While we have seen progress – like the grant @USDA awarded to John Day this week &amp; the  broadband mapping bills @HouseCommerce passed last month more work remains. https://t.co/dDGq5VyXVP,2019-12-05 18:49:12,Twitter Web App,3,8
This Christmas let’s not forget the brave members of the military who aren’t able to be home w/ their loved ones this holiday season. Thank you for your service and I wish you all a Merry Christmas and pray for your safe and speedy return! @RedCross #holidaymailforheroes https://t.co/MNgBCf9GRQ,2019-12-04 21:46:36,Twitter for iPhone,4,13
🚨🤖☎️🚨Today Congress listened to the American people &amp; passed legislation to hang-up on menacing robocalls! This builds upon the great progress we made last year w/ my bill the RAY BAUM’s Act that reauthorized the FCC for the first time in 2 decades. https://t.co/yIArMNv6wK,2019-12-04 21:06:42,Twitter Web App,6,22
This is expected to have a significant benefit for Oregon wheat🌾 wine🍷 potatoes🥔 and beef🥩. https://t.co/iHxAbme9A6,2019-12-04 19:22:30,Twitter Web App,1,9
Great news for Oregon's farmers &amp; ranchers➡️Japan’s parliament has approved the trade deal with the U.S. that will help level the playing field for American agriculture and provide both certainty and a needed boost for our farmers ranchers and their local communities.,2019-12-04 19:22:30,Twitter Web App,5,23
...and don’t worry –  I got my flu shot did you?💉,2019-12-04 15:54:47,Twitter for iPhone,1,6
Those who do not get vaccinated are increasing the risk that individuals who cannot be vaccinated including young children who are not old enough to get the flu vaccine will get the flu. Today we will dive into what impact the flu vaccine has &amp; what we can do to improve it.,2019-12-04 15:54:47,Twitter for iPhone,2,8
Currently discussing U.S. preparedness for this year’s flu season &amp; the importance of vaccinations @ today’s @HouseCommerce O &amp; I sub. hearing. Every year millions of Americans put themselves at an increased risk of getting the flu because they do not get the flu vaccine. https://t.co/uMwxd0XW4m,2019-12-04 15:54:47,Twitter for iPhone,3,12
HAPPENING SOON➡️ Tune into @FoxBusiness’s @Varneyco at 9:45 am ET today to hear me talk with Stuart Varney about our efforts to stop robocalls! ☎️🤖 https://t.co/o8mIfJw64N,2019-12-04 14:39:32,Twitter for iPhone,5,11
I want to thank @SecretarySonny and the Trump Administration for recognizing the importance of expanding rural broadband in Oregon.,2019-12-03 23:16:32,Twitter Web App,0,5
I also met with stakeholders in John Day who have been working to bring this funding to eastern Oregon and I am pleased to see our efforts paid off. This funding will help ensure Oregonians can participate in the 21st Century economy regardless of where they live.,2019-12-03 23:16:32,Twitter Web App,0,4
Today @USDA announced $6 million in funding to expand rural broadband in Wheeler and Grant counties. The money comes from the ReConnect Pilot program which I helped secure funding for last March. https://t.co/OVHFXAJUwD,2019-12-03 23:16:31,Twitter Web App,6,14
The participants are working to reduce emissions power the economy of tomorrow and provide greater value to American consumers! Learn more here: https://t.co/9wnhmGg8nN,2019-12-02 22:32:37,Twitter Web App,0,6
Next Monday I am hosting @HouseCommerce’s Energy &amp; Environment Innovation showcase. This event will highlight innovative energy &amp; environment solutions from companies across the country including 2 from Oregon – NuScale &amp; DR Johnson Lumber.,2019-12-02 22:32:37,Twitter Web App,4,16
Today Ted is wearing his @uoregon hat to remind everyone who won the Civil War this past weekend. Go Ducks! 💚💛 https://t.co/v6UnEkYjE4,2019-12-02 22:21:46,Twitter for iPhone,3,32
Enjoyed talking with @realDonaldTrump yesterday about how to change laws and lower drug costs for Americans. We are committed to delivering for the American people at the pharmacy counter. https://t.co/myeXgG4YZE,2019-11-22 20:18:21,Twitter Web App,49,360
Yesterday I lead @HouseCommerce in advancing legislation to protect communities in the Pacific Northwest and all over the country from nuclear waste. You can learn more about the progress and read my joint statement with @RepShimkus here: https://t.co/7eksg3oB5P,2019-11-21 20:57:14,Twitter Web App,1,10
Over the past few years I’ve worked hard to secure record funding for medical research at the @NIH &amp; I promise to continue to support efforts to find new treatments &amp; cures for patients. And to all the patients and families fighting pancreatic cancer please know we are with you.,2019-11-21 18:13:38,Twitter Web App,1,9
Today my staff &amp; I wore purple in honor of #WorldPancreaticCancerDay. On this day I am thinking of my friends Linda Sindt &amp; Margaret Grubb &amp; all those across the country fighting for a cure for pancreatic cancer. Join us in shining a light on one of the deadliest cancers. https://t.co/oc1C9rFbMe,2019-11-21 18:13:37,Twitter Web App,6,86
Yesterday @HouseCommerce advanced legislation I co-sponsored to help improve maternal health care. These bills now await a vote by the full House of Representatives and I look forward to  working to move these bills forward. More: https://t.co/EY7vQdwMhL,2019-11-21 14:37:53,Twitter Web App,4,7
November is #MilitaryFamilyAppreciationMonth. It is a time to recognize the many sacrifices that our military families make on behalf of our nation.  Please join me in thanking all our military and their families! https://t.co/U4NUoe5nwK,2019-11-15 21:12:23,Twitter Web App,14,36
Andi has led the charge to end human trafficking for years. Both Oregon and America are lucky to have people like her dedicating their lives to end human trafficking.,2019-11-15 20:12:36,Twitter for iPhone,4,15
It was an honor to introduce Redmond’s own Andi Buerger at the event to launch the Alliance to End Human Trafficking. Andi is a co-founder for the Alliance &amp; founder of Beuhlah’s place a shelter in central Oregon for at-risk homeless teens. https://t.co/MmPHIt5muM,2019-11-15 20:12:33,Twitter for iPhone,6,23
You know – if you come to the 2nd District you can ski in the morning wind surf in the afternoon and finish your day with tasty local food and beverage. I’d call that a day well spent so come on down. ⛷️🌊🌲#traveloregon,2019-11-14 17:05:13,Twitter Web App,4,24
I provided a little shameless promotion of the great attractions OR's 2nd District has to offer in today’s @HouseCommerce #CPACSub markup. Brand USA has helped @TravelOregon bring folks to experience some of OR's many wonders - like Crater Lake the Painted Hills &amp; the Wallowas. https://t.co/hufffz5qec,2019-11-14 17:05:13,Twitter Web App,7,43
Each year almost 700 women in the U.S. die as a result of pregnancy or delivery complications. Today the @HouseCommerce Subcommittee on Health advanced bipartisan legislation to address maternal mortality &amp; help improve health outcomes for expectant &amp; new moms.,2019-11-13 18:59:59,Twitter Web App,5,29
It’s great to see the House come together today to take care of our nation’s veterans by passing nine veterans bills. The bills would do a number of things including saving military enlistees hundreds of dollars on education benefits and advancing VA care for women veterans.,2019-11-13 00:27:44,Twitter for iPhone,5,38
It was an honor to attend and speak at the 244th @USMC ball in Bend Oregon on Sunday. I also had the chance to meet with the young and inspiring Redmond Marine Corps JROTC. God bless all our United States Marines! https://t.co/DD1ieKqnYx,2019-11-12 20:57:00,TweetDeck,4,23
The @uoregon Women’s basketball team deserves a huge round of applause for beating Team USA! It’s no wonder that they are ranked number one. Keep up the good work and go Ducks!  #goducks https://t.co/jHhlEVCMHi,2019-11-12 20:37:00,TweetDeck,4,46
On Veterans Day I had the privilege of enjoying coffee and conversation with many central Oregon veterans. It is always humbling to be around our nation’s veterans. Thank you for your service! https://t.co/hNYxPEn99A,2019-11-12 19:07:10,Twitter for iPhone,3,15
Happy Veterans Day to all the incredible men and women who have selflessly served our great nation. God bless you all and thank you for your service. #veteransday2019 https://t.co/6Va4eYYRak,2019-11-11 15:00:00,TweetDeck,4,36
Happy 244th Birthday @USMC! Thank you to all the brave Marines who have been always faithful to our nation. Semper Fi! https://t.co/YtCjBazoj8,2019-11-10 15:00:00,TweetDeck,8,33
We must continue to stand up for our nation’s veterans! Read my op-ed in the @EastOregonian on my efforts to ensure veterans receive the services and support they deserve. #VeteransDay @HouseVetAffairs  https://t.co/BWfUx0lO8K,2019-11-08 17:00:20,Twitter Web App,26,103
These local businesses have shown great commitment to hiring and retaining our nation’s #veterans. As we approach Veterans Day this is a great reminder of how we can honor our nation’s veterans by ensuring we provide economic opportunities for vets throughout our communities.,2019-11-07 17:57:12,Twitter Web App,1,9
Congratulations to Bullet Rentals and Sales in Klamath Falls Energyneering Solutions in Sisters and the Umatilla Tribes’ Cayuse Holdings in Pendleton for receiving this year’s @USDOL HIRE Veterans Award. https://t.co/ggRcNz0TOD,2019-11-07 17:57:12,Twitter Web App,5,18
I’m very appreciative of Secretary Chao and the Trump Administration’s support for improving transportation infrastructure in our part of Oregon. https://t.co/BJaQGu8jG7,2019-11-06 21:37:20,Twitter Web App,4,12
Thank you @SecElaineChao &amp; @USDOT for awarding $15.5 million to the City of Medford to help rebuild Foothill Road! This will allow for better flow of traffic &amp; safer conditions for those traveling along Foothill Road while simultaneously providing jobs &amp; fueling the economy.,2019-11-06 21:37:20,Twitter Web App,3,16
Congratulations Kourtney Lehman from Baker City Oregon on being elected as @NationalFFA Secretary! Great things are ahead for you. https://t.co/kMukCDMkuO,2019-11-06 16:50:52,Twitter Web App,3,25
Gert Boyle embodied boldness. A pioneer entrepreneur who shattered one glass ceiling after another she knew how to keep her cool overcome challenges &amp; inspire others. Tough fair &amp; funny she leaves a wonderful legacy. My prayers are w/ her family during this difficult time.,2019-11-05 17:05:54,Twitter Web App,3,35
I look forward to all that we will achieve the rest of the 116th Congress and I plan to continue to work hard every day on behalf of the 2nd District. Thank you.,2019-11-01 17:32:25,Twitter Web App,1,24
Thank you for all the kind words &amp; wishes you all have shared w/ me since I announced I won't be running for re-election. I am grateful for the opportunity to serve the great 2nd District of OR &amp; for all the incredible men &amp; women I have worked w/ over my years of public service.,2019-11-01 17:32:25,Twitter Web App,5,86
Happy Halloween and Go Ducks! https://t.co/ghMeUOWcoI,2019-10-31 20:06:50,Twitter for iPhone,4,33
If you are going to overturn a vote of the American people it must be a fair and just process. This investigation has been neither and this resolution is just another step in the overly partisan effort to impeach the President that started the day he was elected.,2019-10-31 16:18:53,Twitter Web App,15,57
H. Res. 660 falls short of addressing the inequities in this partisan process and departs significantly from past resolutions on impeachment inquiries by failing to give both sides an equal role in the investigation.,2019-10-31 16:18:52,Twitter Web App,3,40
Regarding my vote on H. Res. 660: This has been a flawed process all along. It has lacked transparency and barred most Members of Congress myself included from being able to access testimony from witnesses.,2019-10-31 16:18:52,Twitter Web App,10,79
Today I joined my colleagues in assembling 2000 USO care packages  for our deployed military service members. Thank you to all our brave members of the military for your selfless service and thank you @the_USO for your continued efforts to serve our military. https://t.co/cVp944xxn7,2019-10-30 20:20:07,Twitter for iPhone,4,33
Currently at the @HouseCommerce hearing where we are discussing concerns over our nation’s growing dependence on foreign drug manufacturing. The United States’ reliance on overseas manufacturing not only raises quality concerns but it also poses national security risks as well. https://t.co/j7m2OCWbxT,2019-10-30 15:16:26,Twitter for iPhone,2,16
About to go live on @Varneyco to discuss my retirement and other news!,2019-10-30 13:43:21,Twitter for iPhone,3,21
One again our men &amp; women in uniform have displayed great courage &amp; strength &amp; protected both Americans &amp; the world from one of the most wanted terrorists on this planet. God bless our troops!,2019-10-27 22:58:36,Twitter for iPhone,11,59
Join me in thanking the brave men &amp;  women in the U.S. Military who have eliminated ISIS leader Abu Bakr al-Baghdadi.,2019-10-27 22:58:36,Twitter for iPhone,19,114
Thank you @realDonaldTrump  for signing the SUPPORT Act into law and for your steadfast commitment to combat this deadly crisis. More work still remains but I know that the Administration will join me in leaning #ForwardWithSupport as we continue to fight this battle. https://t.co/bCImvYmgE5,2019-10-24 13:53:43,Twitter Web App,7,19
