In 1995 the #OklahomaStandard was the man who donated the shoes off his feet the people who stood in line for hours to donate blood. Today it's the health care worker who shows up every day for work risking their own well-being to care for patients. #WeRemember https://t.co/1em2Rf9QAa,2020-04-25 00:30:00,TweetDeck,8,27
During #COVID19 many of us myself included are now connecting virtually. The heroes among us—health care workers truckers delivery &amp;postal workers food service professionals and countless others—are braving the front lines of the battle. Read more about OK's resilience. ⬇️ https://t.co/1em2ReSfIC,2020-04-24 23:30:00,TweetDeck,6,14
Great news – Oklahoma’s 43 public trust hospitals now have access to resources from the CARES Act! Thank you @realdonaldtrump for making sure Oklahoma’s rural hospitals can access the #PaycheckProtectionProgram &amp; other tools as we battle the coronavirus.  https://t.co/E1VGlH0MJa,2020-04-24 22:30:15,TweetDeck,13,32
In rural Oklahoma local radio and TV broadcasters as well as rural newspapers are relied upon to  provide local and national news emergency alerts educational programs and more. I sent a letter to OMB urging them to support these vital organizations during #COVID19. https://t.co/vYacvYGcZZ,2020-04-24 19:43:15,TweetDeck,6,11
#COVID19 does not discriminate in terms of whom it sickens. Working w/ government &amp; military leaders I will do everything I can to prioritize the health of our DOD personnel - and I urge you to follow official guidance to protect yourselves as well. God bless you all.,2020-04-24 18:11:23,Twitter for iPhone,5,8
Kay and I are keeping our brave service men and women and their families especially those who are sick or have a sick loved one in our prayers. We also pray for the families and friends of all @DeptofDefense personnel who have lost their lives to #COVID19.,2020-04-24 18:10:51,Twitter for iPhone,12,36
.@realDonaldTrump has signed CARES 2.0 funding to combat #COVID19 into law! This 2nd relief package will ensure Oklahoma families small businesses and health care providers are taken care of during this crisis. Thank you President Trump for your leadership in this trying time. https://t.co/kE5pJ6Uyvj,2020-04-24 16:49:37,TweetDeck,27,75
I appreciate the tireless work of Lt. General Semonite and the @usacetulsa Office staff and appreciate all they did to make this project a priority.,2020-04-23 23:59:36,TweetDeck,6,9
We’re now ready to move to the preconstruction engineering and design (PED) phase bringing us a critical step closer to protecting the lives of the people and the hundreds of homes and businesses that rely on the levees.,2020-04-23 23:58:57,TweetDeck,3,10
🚨 GREAT NEWS 🚨  The Tulsa Levees have been rated unacceptable and high risk for far too long and today we finally have the necessary approval to begin modernizing and upgrading the levees.   https://t.co/WiyCZ8ebhF,2020-04-23 23:58:41,TweetDeck,8,15
As many of us adapt to working remotely for the time being extra stress has been put on students teachers and parents as they navigate at home learning. I hope this funding will help ease some of their burdens.,2020-04-23 23:32:43,TweetDeck,3,4
Oklahoma teachers have been working overtime to ensure our students receive a valuable education in these tough conditions. This funding will allow teachers to address immediate needs associated with #COVID19 and enable them to better plan for the upcoming school year. https://t.co/pRWJS2Jgn5,2020-04-23 23:32:18,TweetDeck,4,11
The House just passed CARES 2.0 funding to combat #COVID19 and now it is headed to @realDonaldTrump’s desk for signature! https://t.co/ynUCxTJnY5,2020-04-23 21:29:22,TweetDeck,69,197
I'm not the only one who thinks @FCC’s decision on Ligado is a bad deal. Gen. Selva former Vice Chair of @thejointstaff lays it out clearly: This one limited business opportunity compromises countless communications functions Americans use daily. https://t.co/IktGM4W6Bf,2020-04-23 21:05:10,Twitter for iPhone,8,15
🚨 BREAKING 🚨  I joined in sending a letter to AG Barr with serious concerns about the release of potentially dangerous individuals into communities during this crisis. Law enforcement is already trying to prevent other crimes like cybercrime and other scams related to #COVID19. https://t.co/XxoPCrIDcM,2020-04-23 20:27:07,TweetDeck,12,37
The @FCC’s decision on Ligado has vast implications. That’s why nearly a dozen federal agencies are against it. I’m committed to working with @DeptofDefense and the rest of the government to find a path forward. Thanks for sharing our op-ed @EsperDoD! https://t.co/dGwn2ISVkg https://t.co/jdKPoI4yVx,2020-04-23 18:37:07,Twitter for iPhone,5,11
#Onthisdate in 1908 the @USArmyReserve was founded as the Medical Reserve Corps. Today the #USArmyReserve is mobilized in the fight against #COVID19. Thank you to all who have served in the Army Reserve for the last 112 years! https://t.co/k9uBXNwy1L,2020-04-23 14:25:22,Twitter for iPhone,10,24
@okfarmbureau @OKCattlemen @realDonaldTrump It was great to have Oklahoma Secretary and Commissioner of Agriculture Blayne Arthur on the call as well. Proud to have outstanding state leadership as we combat this crisis.,2020-04-23 00:58:45,TweetDeck,3,10
I held virtual town halls with @okfarmbureau and @OKCattlemen on #COVID19 today as we continue through this crisis. We specifically discussed a recent announcement from @realDonaldTrump that will go a long way in helping the ag community.    More here ⬇️ https://t.co/9sHFX0wGYO https://t.co/jRdk5WFian,2020-04-23 00:56:18,TweetDeck,8,23
Throughout the #COVID19 crisis I have been focused on the health of our service members &amp; their families. Today in our 4th weekly briefing from @DeptofDefense I asked for more info on plans for testing &amp; how they are maintaining resiliency. More ➡️ https://t.co/6smlD42nf0,2020-04-22 22:31:50,Twitter for iPhone,9,13
I want to take a moment to say thank you to all of the men and women who make up the Oklahoma manufacturing industry. Your hard work is getting us one day closer to flattening the curve of #COVID19. I am grateful for each of you. https://t.co/m7Q52cO0Wz,2020-04-22 19:49:02,TweetDeck,10,36
ICYMI: The @FCC has used the #COVID19 crisis under the cover of darkness to approve a long-stalled application by Ligado Networks — threatening to undermine our GPS capabilities and with it our economic and national security. My op-ed: https://t.co/dGwn2ISVkg,2020-04-22 19:08:43,Twitter for iPhone,5,13
Have questions about #COVID19? Follow the link to my website below for answers to many frequently asked questions. You can also contact my offices in OKC Tulsa or D.C. for more information or assistance. We will get through this together.  https://t.co/irkUrNmqVX,2020-04-22 16:48:39,TweetDeck,4,6
The @FCC’s Ligado decision poses great danger to our economy public safety and national security.  @SenJackReed @RepAdamSmith @MacTXPress &amp; I are calling on the @FCC to withdraw its approval of Ligado’s application and find a better solution. https://t.co/dGwn2ISVkg,2020-04-22 14:11:15,Twitter for iPhone,10,14
JUST PASSED - Legislation that will fully replenish the #PaycheckProtectionProgram and provide needed funding to health care providers:  +$310 billion for small businesses and their employees +$100 billion for hospitals and testing  Read more: https://t.co/WbJqSw99bp,2020-04-21 22:09:48,TweetDeck,10,27
There's still more work to do and I’m anticipating the Corp’s Chief Report on the modernization of the levee system. The swift consideration of the EDA application &amp; the Chief’s report show that the @POTUS continues to prove investment in Oklahoma infrastructure is a priority.,2020-04-21 20:27:22,Twitter Web App,5,8
ICYMI: the Levee District will receive $3mil to modernize two existing pump stations. This funding will go a long ways towards repairing and modernizing the Tulsa levees to ensure the system can continue to protect families businesses &amp; property in the future. https://t.co/4MD8zPjB9s,2020-04-21 20:26:20,TweetDeck,6,13
The #PaycheckProtectionProgram is working in Oklahoma saving jobs and helping families stay afloat. More than 35000 loans have been approved in our state alone! Dems must vote to continue funding this vital program. We are fighting #COVID19 together.   https://t.co/30DvDUrJ9m,2020-04-21 15:27:45,Twitter for iPhone,36,122
I joined a letter today asking SBA to let lenders continue to submit apps for the #PaycheckProtectionProgram even with the funding lapse. This would help alleviate the growing backlog and help Oklahoma small businesses keep utilizing this vital program once funding is approved. https://t.co/jD830eUclR,2020-04-20 23:00:00,TweetDeck,20,40
Our farmers and ranchers are instrumental to Oklahoma’s economy and they’ve been hit hard by #COVID19. This funding will bring some much needed relief and provide certainty for Oklahoma ag producers. I am proud of @realDonaldTrump's continued dedication to our farmers. https://t.co/25xPEctPX0,2020-04-20 22:09:05,TweetDeck,6084,23642
Russia and Saudi Arabia continue to flood the global oil market - what I view as an effort to crush American oil and gas producers. I sent a letter to Secretary Ross today requesting he continue to investigate their anticompetitive practices.   Read the full letter below ⬇️ https://t.co/XVagaxCITi,2020-04-20 17:57:27,TweetDeck,90,144
If you are awaiting a stimulus check and are unsure of the status please follow the link below. If you have questions or need further assistance my office is here to help.   https://t.co/cztxwfqp4Z,2020-04-20 15:49:18,TweetDeck,8,14
It’s hard to imagine 25 years have passed since the tragedy in Oklahoma City that shaped the people and character of our state. We remember the 168 lost and pray for their families loved ones and the first responders who risked their lives for us all. https://t.co/iqcx64vLSN,2020-04-19 13:30:00,TweetDeck,127,418
This is good news. Under the direction of @realDonaldTrump CMS announced that Medicare will nearly double reimbursement for clinical laboratories doing high-volume testing in an effort to increase the number of Americans eligible for coronavirus testing. https://t.co/xlyujAVmBn,2020-04-18 14:00:00,TweetDeck,19,40
#COVID19 has caused unprecedented economic hardship on refineries across the nation. Demand for petroleum products is down &amp;RFS compliance costs are up. I support @GovStitt’s request for EPA to waive biofuel obligations so refiners can stay in business and protect jobs.,2020-04-17 22:00:00,TweetDeck,22,48
35557 loans approved in Okla. totaling $4.6 b—a staggering amount of aid for small businesses. I’ve heard from Okla. bankers who are eager to continue lending. They can't understand why Dems are blocking a clean extension of funding for the bipartisan #PaycheckProtectionProgram.,2020-04-17 21:04:32,TweetDeck,23,79
The revised Performance Incentive Fee plan is a key step in the right direction and rightly prioritizes resident satisfaction and empowers the chain of command. I urge other military housing partners to follow in Corvias’ footsteps. https://t.co/wDnI3isJQe,2020-04-17 18:28:33,Twitter for iPhone,5,8
While we wait for the Department of Defense to update the Tenant Bill of Rights I’m glad the @usairforce is making progress with housing companies to give our military families the housing they deserve by updating their Performance Incentive Fee plan.,2020-04-17 18:27:29,Twitter for iPhone,5,16
It is an honor to be named to @realDonaldTrump’s Task Force on Economic Recovery and I look forward to working with him and the other members on reopening the economy and getting Americans back to work school church and normal life.    Full Statement ⬇️ https://t.co/PVoagnKy2j,2020-04-17 14:37:11,TweetDeck,22,150
Keeping a close eye on how @DeptofDefense is responding to #COVID19 &amp; taking care of our troops w/ regular briefings. Glad to hear DOD &amp; our defense industrial base are stepping up in our nation’s time of need &amp; learn how we can support them. Read more ➔ https://t.co/MdGhOFFec1,2020-04-16 21:25:28,Twitter for iPhone,8,10
I know the Oklahoma cotton industry has particularly felt the impact of #COVID19. That's why I signed a letter led by @JohnBoozman to the USDA to urge them to assist our cotton growers producers merchandisers and distributors during this trying time. https://t.co/5tnMY8Rwel,2020-04-16 19:05:30,TweetDeck,7,14
The @FCC should not approve Ligado’s request for bandwidth – it’s a bad deal for our national and economic security and could cost taxpayers billions. With my Armed Services colleagues @SenJackReed &amp; @MacTXPress I am asking @realDonaldTrump to intervene. https://t.co/nXa7TGdol8,2020-04-16 16:49:08,TweetDeck,30,49
BREAKING – Funds have officially run out for the #PaycheckProtectionProgram. This program has helped so many in Oklahoma and across America during this #COVID19 crisis. This didn’t have to happen. Senate Democrats BLOCKED $251 b to replenish the program just last week.,2020-04-16 14:57:57,TweetDeck,5679,16279
Great news! With this $198 million investment in Oklahoma’s educational institutions authorized by the CARES Act we're equipping schools &amp; universities with the funding and flexibility to continue their great work—providing the best possible education to our future generations. https://t.co/aRzZp6FTGm,2020-04-15 22:01:51,TweetDeck,7,28
#COVID19 has prompted abortion advocates to try to weaken or overturn FDA regs to broaden access to chemical abortions further risking the health &amp;safety of both women and babies. I joined lawmakers in urging the FDA to enforce restrictions already in place and stand for life. https://t.co/KE4JSQt5EK,2020-04-15 18:34:03,TweetDeck,15,45
The #PaycheckProtectionProgram is working in Oklahoma. Thus far $4 billion has been approved in loans supporting more than 25000 Oklahoma companies. Now we just need Democrats to stop playing political games so we can ensure Oklahomans continue to get this #COVID19 relief. https://t.co/1UdvXU6pN5,2020-04-15 15:36:36,TweetDeck,69,190
The @realDonaldTrump administration has continually protected faith-based entities especially during this time of need. @SenatorLankford and I led a letter today commending SBA and the Treasury on this and urged them to continue to protect faith-based entities during #COVID19. https://t.co/pwa4gkQhky,2020-04-15 01:39:23,TweetDeck,24,71
Today I sent a letter with @JohnCornyn @TomCottonAR @MikeCrapo @marcorubio and @SenToddYoung urging administration officials to ensure domestic companies don’t get boxed out of 5G standards where China seeks control.   Read the full letter below ⬇️ https://t.co/RxyY8rax71,2020-04-14 20:56:10,TweetDeck,28,68
I am proud to have @realDonaldTrump leading our country during this time. The administration will require insurers to provide free antibody tests. Americans can feel safer knowing cost isn't an obstacle for #COVID19 testing in this crisis. https://t.co/FDf8JgD9hM,2020-04-14 16:25:05,TweetDeck,125,374
For 72 years @USAFReserve has been providing combat-ready reserve forces to fly fight and win. Right now the Reserve is showing their resiliency &amp; readiness by supporting the fight against #COVID19.   Thank you to all #CitizenAirmen for answering the call to serve our nation. https://t.co/YAg2AMXgFz,2020-04-14 14:05:48,Twitter for iPhone,8,23
Please stay informed and avoid a scam during this #COVID19 crisis.   Some steps you can take below ⬇️ https://t.co/HdTwOoRKwa,2020-04-13 22:27:32,TweetDeck,9,12
While we face the greatest public health crisis in over 100 years last week Senate Dems decided to once again play partisan games and block the advancement of legislation that would provide more desperately needed #COVID19 relief to our small businesses and their employees. https://t.co/HraK6xcPWe,2020-04-13 20:06:56,TweetDeck,116,274
Lt. General Semonite and the Corps recognize just how important the Tulsa-West Tulsa levees are to the well-being of our state. The fact that they are prioritizing this report for completion as quickly as possible shows their commitment.   Full Statement⬇️ https://t.co/rcB9Ilg8lU,2020-04-13 18:25:35,TweetDeck,6,7
Extremely glad to continue seeing the positive impact of the #PaycheckProtectionProgram on small businesses across Oklahoma including Owasso Auto Care.   To apply for relief through the program follow the link below.  https://t.co/lKTe7zLGah https://t.co/yMN7sNA4Ju,2020-04-13 16:44:12,TweetDeck,31,73
Today we celebrate our Lord Christ’s resurrection from death to life. Happy Easter everyone from the Inhofe family to yours. https://t.co/wrbEpUTgXi,2020-04-12 14:00:00,TweetDeck,31,222
Today I am reflecting on the life of Sarkis Tatigian the longest serving civil servant in the history of the @DeptofDefense and the federal workforce’s last WWII veteran who died earlier this week. His legacy of service is an inspiration. https://t.co/3ZgXsS8XiF,2020-04-11 16:00:01,TweetDeck,5,33
Good news from @USNavy. This unit-level guidance that I’ve been calling for will help the Navy deal with #COVID19 going forward better protect and inform Sailors Marines and their families and help prevent another USS Theodore Roosevelt situation. https://t.co/G9MUeQNU7h,2020-04-10 21:00:00,TweetDeck,9,13
I led a letter to @realDonaldTrump encouraging the administration to continue to aggressively use the CFIUS authorities to scrutinize any transaction or investment by People's Republic of China during #COVID19.   Read the letter at the link here and below. https://t.co/QGUXFWppyF https://t.co/wskffzI8V2,2020-04-10 20:00:01,TweetDeck,10,13
HHS will provide hospitals and medical providers in Oklahoma $489 million in funds as authorized by the CARES Act. This investment in Oklahoma health care will help us weather the crisis but will also ensure our medical system can operate at full strength once this has passed.,2020-04-10 19:00:01,TweetDeck,4,23
I talked with 450 OKC residents this week via a virtual town hall. One woman asked how to retool her business to make Personal Protective Equipment. Oklahomans are stepping up in this #COVID19 crisis.    If you're a small business looking to help please contact my office.,2020-04-10 18:00:00,TweetDeck,9,34
Glad to see @LockheedMartin leading by example - paying subcontractors/suppliers faster for work already done and passing along $ @DeptofDefense is advancing thanks to the CARES Act. This helps small businesses and communities across the nation including in OK hit by #COVID19. https://t.co/ma6ljbYNDr,2020-04-10 16:00:01,TweetDeck,11,23
I hope you are staying home and safe today. Amidst this crisis let's remember what is truly important. #GoodFriday https://t.co/6EYwNNU11r,2020-04-10 15:07:50,Twitter for iPhone,19,82
Held a virtual town hall with McAlester residents yesterday. We talked about a number of things including #COVID19 relief for the defense community and small business owners.  If you or someone you know has questions amidst #COVID19 please go to ⬇️ https://t.co/SSYPQMAFoY https://t.co/la9TE9oJUO,2020-04-09 20:16:49,TweetDeck,8,27
🚨 Oklahoma Ag Producers  🚨  The USDA just announced you have more time to repay Marketing Assistance Loans as part of the implementation of the CARES Act.  For more information on the announcement ⬇️  https://t.co/e0XHtL1IJz,2020-04-09 19:24:57,TweetDeck,6,12
Glad to see HRSA is prioritizing Oklahoma Community Health Centers w/ this funding. In addition to supporting CHCs I joined a letter to HHS to prioritize funding for rural hospitals.    Read about the funding at the link here &amp;read the full letter below. https://t.co/lXAu9KdrkX https://t.co/vvD8XnfGij,2020-04-09 18:00:00,TweetDeck,6,6
Small businesses are the lifeline of Oklahoma’s economy and jobs are being saved by the Paycheck Protection Program. This is not the time to block additional resources to maintain employment levels at our small businesses.  My full statement ⬇️ https://t.co/1H3S8NSh0s,2020-04-09 16:55:38,TweetDeck,20,59
Had an informative call this afternoon with @DeptofDefense officials about what they are doing to protect the health of our force during the #COVID19 crisis. This is our shared priority. My full statement on the @SASCmajority briefing: https://t.co/QzaIZ7AtKD,2020-04-08 21:12:42,Twitter for iPhone,4,8
Have questions about the #PaycheckProtectionProgram? Please follow the @SmallBizCmte link below for answers to many frequently asked questions. In addition never hesitate to contact my offices in OKC Tulsa or D.C. for more information or assistance.   https://t.co/C4wYg5HZX5,2020-04-08 20:27:24,TweetDeck,7,8
.@DoD_USD_PR is right - Our resilience will get us through this pandemic and we will come out of it stronger than before. I hope you all will read Under Secretary Donovan’s important message: https://t.co/9QeiT70V6p,2020-04-08 16:23:10,Twitter for iPhone,7,18
I hosted two virtual town halls yesterday with the Lawton and Enid communities on the #COVID19 response and resources available to all Oklahomans in this time of need.   Have questions about #COVID19? For answers to many of your FAQs go to ⬇️ https://t.co/SSYPQMAFoY https://t.co/2LhPsorEfQ,2020-04-08 14:54:14,TweetDeck,9,36
I join Rwanda and the world in marking #Kwibuka26 —a time to honor and remember the victims and survivors of the genocide.   Last year I had the honor to visit one of the genocide memorials and present a wreath. https://t.co/iG9M3W46if,2020-04-07 22:31:40,Twitter Web App,100,525
.@EsperDOD has my support for personnel decisions he deems necessary to provide stability and strong leadership at @DeptofDefense – especially now. I will work w/ @SASCMajority &amp; @SASCDems to consider the nomination of the next #SECNAV ASAP. My statement: https://t.co/9IFCZoTH1T,2020-04-07 21:40:47,Twitter for iPhone,8,16
I will continue fighting for Oklahoma farmers and ranchers especially in the midst of #COVID19. You can read more below about two letters I signed recently urging Secretary Perdue to provide #COVID19 relief to the agricultural community. ⬇️  https://t.co/kxrLt1YpbN,2020-04-07 18:00:19,TweetDeck,8,41
Great news for Oklahoma banks and small businesses! The Federal Reserve announced they would launch a program to buy loans from the original lender helping local banks offer more emergency small business loans.   https://t.co/CMhbboMQah,2020-04-07 14:16:06,TweetDeck,12,29
Thank you @SenKevinCramer @MikeCrapo @SenatorRounds @SenatorBraun @SenRickScott @SenatorEnzi @HawleyMO @SenJoniErnst @SenatorTimScott @SenatorLankford and @SenTedCruz for joining me on this.,2020-04-06 21:34:53,TweetDeck,12,33
Americans are rightly concerned about this #COVID19 crisis and it's essential that law-abiding Americans are freely able to exercise their Second Amendment rights so that they are able to hunt to provide for their families and defend themselves their families and their property.,2020-04-06 21:33:48,TweetDeck,24,53
Today I led the below letter to @realDonaldTrump with many of my Republican colleagues. Thank you President Trump for understanding that the Second Amendment is one of Americans’ most valued rights and deeming firearm businesses essential. https://t.co/qAGuMPhORS,2020-04-06 21:32:17,TweetDeck,167,417
Check the chart – If your symptoms match those of #COVID19 please visit https://t.co/FBWDuDLEDV to find your closest testing location. https://t.co/BZFqLdNPj9,2020-04-06 19:22:46,TweetDeck,5,5
Glad to see @realDonaldTrump continue to prioritize Oklahomans during this time of need.   This funding will go a long way in helping us continue the fight against #COVID19. We will get through this. https://t.co/AHnwGDVEuK,2020-04-06 16:00:34,TweetDeck,11,35
The Pentagon’s research agency @DARPA's innovative technological breakthroughs protect our nation in times of war and peace. Right now its technologies are fighting our most pressing battle against #COVID19. Here's how some of the technologies are being used: https://t.co/1Kw5LD1GAG,2020-04-05 00:00:00,TweetDeck,16,33
Oklahomans know how to weather a storm. We’re not through this yet but I'm confident together we can overcome the #COVID19 crisis. We may be standing apart responsibly social distancing but we’ve never been more united as a state or nation.  https://t.co/LmABPaQ1OP,2020-04-04 22:00:00,TweetDeck,13,39
We’re particularly blessed that because of @realDonaldTrump we entered the crisis with the best economy of my lifetime. With his leadership the economic recovery will happen fast once we win the war against the virus.   My @MuskogeePhoenix op-ed ⬇️ https://t.co/LmABPayqXh,2020-04-04 20:00:00,TweetDeck,52,213
Businesses are provided with tax credits for employee retention &amp;delays in when taxes must be paid. This is done w/ the intention of keeping a max number of workers on the job so when the economy reopens our companies &amp;small businesses roar back to life. https://t.co/LmABPayqXh,2020-04-04 18:00:00,TweetDeck,11,24
For those who have already lost their jobs the legislation expands unemployment benefits and extends the program for up to 39 weeks.  Read my full thoughts in the @MuskogeePhoenix below. https://t.co/LmABPaQ1OP,2020-04-04 16:00:00,TweetDeck,5,14
An Oklahoma family of four should expect to receive $3400 and seniors vets and those on disability aren’t left out. And those under the income threshold should expect to receive a check in a few weeks.   Read my op-ed in the @MuskogeePhoenix below. https://t.co/LmABPaQ1OP,2020-04-04 14:00:00,TweetDeck,13,29
Companies and self-employed individuals automatically qualify for loans if they have fewer than 500 employees.  Read my op-ed on #COVID19 at the link here and learn more about the #PaycheckProtectionProgram below. https://t.co/LmABPayqXh https://t.co/4Rjx3xo2ou,2020-04-04 00:00:00,TweetDeck,42,80
