Adoption is a wonderful blessing to children families &amp; their communities. It's been an issue close to my heart for many years &amp; I'm glad to bring attention to such a worthy cause during National Adoption Month.  Thank you to these Oklahomans &amp; all families who choose adoption. https://t.co/aVlXdl5djV,2020-11-28 17:00:00,TweetDeck,4,19
Today is #SmallBusinessSaturday! Right now more than ever small businesses need our support. I encourage each of you to take the time to show your support to one of our many wonderful Oklahoma small businesses.   Watch my full thoughts below. ⬇ https://t.co/jYzHDlBDYw,2020-11-28 15:59:43,Twitter for iPhone,7,40
.@CCAInstitute's Angels in Adoption® Program honors a wide spectrum of individuals &amp; organizations making extraordinary contributions in adoption permanency &amp; child welfare.   Thank you @CCAInstitute for your hard work &amp; activism on behalf of adoption.   #NationalAdoptionMonth,2020-11-28 07:00:00,TweetDeck,2,19
As @SASCMajority Chairman it is my privilege &amp; responsibility to provide for our military families – ensuring our service members receive the pay they are due that their spouses are supported and that their children have access to quality education and child care. #FY21NDAA,2020-11-27 19:14:01,Twitter for iPhone,1,8
Thanksgiving looked different for many of us this year – but for our military families celebrating holidays away from those they love is just part of the job. Throughout November and all year long we are grateful for the selflessness &amp; sacrifice of America’s military families. https://t.co/hz9z52nMzB,2020-11-27 19:13:35,Twitter for iPhone,8,30
This year I was proud to virtually congratulate the Bay family from Woodward Okla. When Brady and Angela adopted little Sawyer from Ethiopia they made a decision that would grow their family and their hearts forever. It was such a joy to talk and pray together.  Their story ⬇️ https://t.co/aVlXdkNCsn https://t.co/8IUNuR9tgu,2020-11-27 17:09:29,Twitter Web App,4,19
No matter what you choose to be thankful for this year from the Inhofe family to yours we wish you a very happy Thanksgiving.,2020-11-26 15:02:00,TweetDeck,5,82
I am incredibly thankful for my wife Kay and our family. I am also thankful for the men and women overseas who defend our freedoms every day but especially on Thanksgiving. Thank you and your families for giving up your holiday for all of us.,2020-11-26 15:01:00,TweetDeck,3,42
Today we should give thanks we live in a country where we can celebrate freely. No matter what that looks like for you &amp; your family let us pause to remember what we have to be thankful for. This has been a tough year but let us give thanks to Jesus as he continues to provide. https://t.co/lhRlyz2Kto,2020-11-26 15:00:01,TweetDeck,4,18
Last year I welcomed the Ausbrooks family of Glenpool Okla. to D.C. They have three children two of whom are adopted from Ethiopia. I was proud to play a small role in their story as it is a shining example of the good in this world.   More on the Ausbrooks family. ⬇️ https://t.co/aVlXdkNCsn https://t.co/XownDwseve,2020-11-25 17:01:26,Twitter Web App,2,16
The Belts of McAlester Okla. adopted Addi May from Ethiopia—a place close to my heart as I have a beautiful granddaughter adopted from Ethiopia. Their journey was full of hurdles and challenges but they persevered.  More on the Belt family's story. ⬇️ https://t.co/aVlXdkNCsn https://t.co/VbGBwjxGk5,2020-11-24 15:37:43,Twitter Web App,3,14
In 2017 I welcomed Poteau Police Officer Jody Thompson and his family to Washington. The Thompson’s compassion along with their son John’s resilience and courage is truly amazing and inspiring.  Read more about the Thompson family.⬇️ https://t.co/aVlXdkNCsn https://t.co/2HE8GpolHP,2020-11-23 20:09:00,Twitter Web App,4,9
I welcomed the Gibsons of Guthrie Okla. to D.C. in 2016. The Gibsons adopted eight children from foster care over four years. Their story exemplifies family values as they willingly took in siblings and sought to keep them together through the adoption process.   Their story⬇️ https://t.co/aVlXdkNCsn https://t.co/4MPifyYIwK,2020-11-21 17:42:14,Twitter Web App,1,12
Happy National Adoption Day—a day that has always meant so much to me. 18 years ago adoption changed my own life and is another reason why I will always advocate for it.   Watch more of my story. ⬇ https://t.co/MKWVbvfOrr,2020-11-21 16:04:10,Twitter for iPhone,9,49
Those who know me know how important the blessing of adoption is to me. During #NationalAdoptionMonth I’d like to take the time to acknowledge some of the wonderful families involved in adoption with whom I have crossed paths over the years.   Read their stories. ⬇️ https://t.co/aVlXdkNCsn,2020-11-20 16:34:12,TweetDeck,5,22
I salute my friends and colleagues @senrobportman and @SteveDaines for enrolling in #COVID19 vaccine trials. Volunteers like them are vital to finding more options for beating this pandemic. To enroll in a vaccine trial visit: https://t.co/wDbTsUzAKd,2020-11-19 18:37:46,Twitter for iPhone,9,26
Happy National Rural Health Day Oklahoma! https://t.co/sem3me3MI1,2020-11-19 16:37:33,TweetDeck,6,45
Happy to join my colleagues @JerryMoran @SenDuckworth and @SenCapito in applauding @SenateCommerce's inclusion of our bill the PARTT 147 as a part of S. 3969 the Aircraft Safety and Certification Reform Act of 2020 to improve education and training curriculum. https://t.co/T2kPWWxPey https://t.co/pxnBKKm2Ud,2020-11-18 22:35:41,Twitter Web App,2,15
This year’s NDAA in particular as I’ve said before is very much a Member-led bill. Now we’ve got to keep on working find agreement on our remaining issues and finalize this conference report. I’m confident we can get this done for the good of our troops and our nation. https://t.co/OAERiU7Gy1,2020-11-18 18:39:17,Twitter for iPhone,3,12
Today we moved a step closer to enacting a National Defense Authorization Act for the 60th year in a row. The “pass the gavel” meeting continues the bipartisan bicameral spirit that has long been a trademark of the NDAA &amp; allows us to hear from the conferees as we negotiate. https://t.co/b1rDtshq9v,2020-11-18 18:37:42,Twitter for iPhone,8,26
Read my full statement on today’s announcement regarding U.S. Forces in Afghanistan and Iraq. https://t.co/fL1ZXWhUbo,2020-11-17 22:03:06,Twitter for iPhone,4,12
I look forward to receiving detailed briefings on the plan from the Pentagon and General Miller. As we evaluate the situation in Afghanistan and coordinate with our allies we must ensure that our strategy and posture reflect the conditions on the ground.,2020-11-17 22:02:42,Twitter for iPhone,2,15
I have been assured by Acting SecDef Miller &amp; Ambassador O’Brien that with their plan we will be able to carry out our mission of protecting the American people from terrorist attacks originating in Afghanistan safeguarding Afghan gains &amp; supporting our partners &amp; allies.,2020-11-17 22:02:17,Twitter for iPhone,6,35
I commend the Missile Defense Agency and @USNavy for reaching this important milestone. Learn more here: https://t.co/Z31rKPI4hR,2020-11-17 18:59:14,Twitter for iPhone,1,20
A U.S. Aegis Ballistic Missile Defense System destroyer successfully intercepted and destroyed an intercontinental ballistic missile class target in a test conducted earlier today. This capability will play a critical future role in deterring and defending against our adversaries https://t.co/ffrJI4jM7J,2020-11-17 18:58:45,Twitter for iPhone,6,36
Wishing a very happy birthday to our favorite Senator and the Mountain himself @JimInhofe! — from Team Inhofe! ⛰⛰⛰   Here are some of our favorite photos of Sen. Inhofe through the years doing one of the things he does best—serving the people of Oklahoma! https://t.co/ojmgibgstn,2020-11-17 17:16:56,Twitter Web App,16,93
Congratulations to @NASA and @SpaceX on a historic and successful launch to @Space_Station. Here’s to the future of human spaceflight! #LaunchAmerica https://t.co/e2hZSv3OAu,2020-11-16 23:00:01,TweetDeck,4,30
This is great news for Oklahoma’s farmers ranchers homebuilders and developers who have been plagued by decades of burdensome permitting requirements as they work around the habitat of this thriving species.,2020-11-16 21:24:32,Twitter Web App,1,21
Effective today the American Burying Beetle has now been officially downlisted from endangered to threatened under the Endangered Species Act.   More information. ⬇️ https://t.co/dleNSKIBlz,2020-11-16 21:24:31,Twitter Web App,3,15
Another incredible step forward in the fight against #COVID__19. Extremely proud of the medical research industry and all of its partners for their continued efforts and hard work.   https://t.co/bCY4Rhmbhi,2020-11-16 19:24:52,Twitter Web App,5,35
Happy 113th birthday to the great state of Oklahoma! 113 years of growth achievement and prosperity—and so much more to come. Let’s keep it up it Okies! #StatehoodDay https://t.co/kDbLG1YMDd,2020-11-16 18:22:08,TweetDeck,9,52
Incredibly proud of the work we have accomplished under @realDonaldTrump and his administration. https://t.co/ecnpf5CUtp,2020-11-14 20:00:00,TweetDeck,211,725
The federal government should seek to reduce burdensome fees and complicated processes to assist families looking to adopt. I will keep fighting in Washington to ensure that is the case and that every child is placed in a loving home.  #NationalAdoptionMonth,2020-11-14 15:05:04,Twitter Web App,4,31
I was proud to join my colleagues in sending a letter to @StateDept urging them to prioritize policies to promote international adoption as the department searches for new accrediting entities for intercountry adoption service providers.      Read our letter below. ⬇️ https://t.co/ZUJvTFOUIH,2020-11-14 15:05:04,Twitter Web App,5,31
As COVID-19 has shifted needs in our current workforce @UofOklahoma’s WorkSooner will open the door for Oklahomans looking to change their career or gain more expertise in efforts to build a better future for themselves and their families.  More info. ⬇️ https://t.co/qCKiu1VbeL,2020-11-13 20:25:43,Twitter Web App,2,17
Proud to see @UofOklahoma launch WorkSooner a ground-breaking workforce development program in the U.S. This affordable online learning platform will allow individuals to gain high-skilled training in industries such as health computer programming cybersecurity and more.,2020-11-13 20:25:43,Twitter Web App,6,45
Great to speak with @tulsarotary this week as we discussed the importance of providing OK veterans with the care and quality of life they have earned.   I look forward to passing the #FY21NDAA so we can ensure our national armed forces &amp; veterans receive the resources they need. https://t.co/jGS9yYVFGq,2020-11-13 18:17:14,Twitter Web App,7,21
It is with great sorrow that I learned of this morning’s @MFOsinai accident in which six Americans were killed while performing the important mission of observing the implementation of the Israeli-Egyptian peace treaty. My sincere condolences to their families and loved ones.,2020-11-12 17:58:35,Twitter for iPhone,43,127
At the end of the day this comes back to our veterans—and making sure they have the care they have earned; it’s just one way of saying ‘thank you.’ I am honored to work with @realDonaldTrump and @SecWilkie to help bring this project across the finish line.,2020-11-12 16:45:14,Twitter Web App,7,25
The final piece will be to increase the mission in Muskogee by repurposing the portion of this facility that was used for inpatient services into a Department of Veterans’ Affairs Behavioral Health Center of Excellence &amp;utilize the space to address additional needs in the region.,2020-11-12 16:05:59,Twitter Web App,4,25
First step will be to build a new hospital in Tulsa. @SecWilkie &amp; @POTUS prioritized this project by including the first round of funding in the FY2020 budget.   Second will be to shift the inpatient mission from Muskogee to Tulsa while continuing outpatient care at Muskogee.,2020-11-12 16:05:58,Twitter Web App,7,15
With the help of state and local leaders we crafted a plan to meet both goals: increase the care provided at @EasternOKVA in Muskogee by adding a first of its kind regional behavioral health center but also to open a brand new state of the art inpatient facility in Tulsa.,2020-11-11 22:44:02,Twitter Web App,5,21
In Eastern Oklahoma it became clear that we needed additional updated infrastructure for our vets. Nationally the need for a state of the art modern behavioral health center was clear. I then began work with the @SecWilkie to support our vets by utilizing the CHIP-IN Act.,2020-11-11 22:44:01,Twitter Web App,2,11
I believe it's vital to give local communities the power to make their own decisions—they know what's best for their citizens. The Communities Helping Invest through Property &amp; Improvements Needed for Veterans Act or CHIP-IN Act provides communities the ability to do just that.,2020-11-11 22:44:01,Twitter Web App,2,9
It became clear that we needed to provide authority for VA directors to fire poorly performing employees extend the Veterans Choice program and allow independent third-party oversight at VA facilities. With @POTUS' signature in 2017 we enacted each of those reforms into law.,2020-11-11 19:34:14,Twitter Web App,4,28
I was shocked when I read a USA Today article published in 2015 about the Oklahoma VA facilities—the conditions and situation were truly horrendous. After this was brought to my attention I fought to ensure that our VA facilities were brought up to the highest standards of care.,2020-11-11 19:34:14,Twitter Web App,3,23
As we honor those who have served this Veterans Day it’s important to remember how much our nation’s vets have sacrificed. They deserve the highest level of care &amp; thanks to @POTUS we have come a long way on that promise especially in Oklahoma. More.⬇️ https://t.co/1r9hhNz4iF https://t.co/tyMQYVgYDp,2020-11-11 18:09:16,Twitter Web App,54,336
The HIRE Vets Medallion Program honors employers that see the value veterans provide to the workforce and prioritize hiring and retaining them. I’m pleased—but certainly not surprised—that so many Oklahoma companies are being recognized for their commitment to veterans today.,2020-11-10 21:09:04,Twitter Web App,5,29
As we mark Veterans Day it's an important reminder of everything our military sacrifices to serve our nation. When men &amp; women leave the Armed Forces we need to make sure their experiences are transferrable to civilian life with high-paid skilled jobs.  https://t.co/Hx73OvlYz2,2020-11-10 21:09:04,Twitter Web App,16,61
To those #Marines serving today to our #USMC veterans and to those no longer with us – thank you for your service and everlasting faith!,2020-11-10 18:06:01,Twitter for iPhone,6,28
As the @USMC celebrates 245 years of service we commemorate their legacy of honor courage and commitment. From the land to the air to the sea our Marines never waver in their defense of our American values of freedom and democracy. #marinecorpsbirthday https://t.co/dFJiWZBmfI,2020-11-10 18:05:26,Twitter for iPhone,9,40
Despite the risks to women’s safety the abortion industry has pushed to remove commonsense in-person dispensing requirements.   Proud to join @SenHydeSmith &amp; 102 other members of Congress to urge the 4th Circuit to reinstate these important regulations.  https://t.co/hbEbeuQitl,2020-11-10 16:01:41,Twitter Web App,5,21
The abortion industry continues to forgo basic protections in the name of widespread access to the chemical abortion pill which not only kills babies but also has two decades of recorded complications.,2020-11-10 16:01:41,Twitter Web App,23,59
I just spoke with Acting Secretary of Defense Miller and I look forward to working with him to ensure that these priorities remain paramount and to working with President Trump to maintain stability at the Pentagon particularly as we work to enact the 60th annual NDAA.,2020-11-09 22:12:02,Twitter for iPhone,6,47
I want to thank Secretary @EsperDoD for his service – for prioritizing implementation of the National Defense Strategy for thinking critically about how the Pentagon operates and for always putting our service members first.,2020-11-09 22:10:50,Twitter for iPhone,9,54
Great to see @pfizer and @BioNTech_Group develop a #Covid vaccine with a very impressive 90% effective rate &amp; plan to file for @US_FDA approval in the coming weeks. In the words of Dr. Albert Bourla this is indeed a “great day for science and humanity.”  https://t.co/8rZ9ZVx7TE,2020-11-09 21:01:41,Twitter Web App,4,19
While there are many challenges and hardships ahead for Tulsa and the nation within this tragedy is a story of optimism and faith in our community and the future. Both Officer Zark and Sgt. Johnson are American heroes. https://t.co/EYxwGh3PRt,2020-11-07 19:56:05,Twitter Web App,2,14
Zark wanted people to understand what law enforcement risk every day—a sacrifice too many take for granted. He wanted people to know the stories of good honorable police officers. While this tragedy is a reminder of the threats our communities face it is also a story of hope. https://t.co/C8BPdURFAx,2020-11-07 18:51:39,Twitter Web App,7,27
Unlike Portland Oregon Oklahomans have great respect and admiration for our men and women in blue. We know that law enforcement are our neighbors our friends and our family. They have a dangerous job – one that many take for granted.  My recent speech on the Senate floor. ⬇️ https://t.co/Gk0ntzldfm,2020-11-07 17:05:06,Twitter Web App,8,34
Officer Zark embodies everything that makes Oklahoma great. Zark wanted to give back to his community and he delivered. October 15th will always hold a special place in the hearts of the thousands of people that call Tulsa home. https://t.co/EJANxabzq6,2020-11-06 23:25:43,Twitter Web App,2,26
Officer Zark’s progress is truly remarkable and as Tulsa Police Captain Kimberly Lee put it “He really is an example for all of us.” https://t.co/jFypkL5ivs,2020-11-06 22:13:12,Twitter Web App,2,32
At the end of June with only six weeks on patrol Officer Zark and Sgt. Craig Johnson pulled over a car for a routine traffic stop. But as we all know nothing is routine for law enforcement.  More. ⬇️ https://t.co/IlJvPwIEs5,2020-11-06 19:03:01,Twitter Web App,2,24
Honored to share the story of Officer Aurash Zarkeshan of the Tulsa Police Dept. recently on the Senate floor. He is a hero— bright engaged and committed to public service.,2020-11-06 19:02:52,Twitter Web App,20,123
.@DARPA - the @DeptofDefense agency that helped bring you the Internet and GPS - is driving innovative research that will build safer communities strengthen our military and keep American families secure. https://t.co/r28aA6eXF0,2020-11-05 21:41:50,Twitter for iPhone,6,27
I’m proud to see this strong partnership between @FAANews and @choctawnationOK as the Choctaw Nation works to stay ahead of the competition in emerging aviation technologies and aviation education.,2020-11-05 16:10:28,Twitter Web App,2,12
ICYMI: @USDOT and @FAANews announced @choctawnationOK has been selected for participation in the FAA’s Unmanned Aircraft Systems (UAS) BEYOND program as a follow-on effort to the FAA’s Integration Pilot Program.   More info. ⬇️ https://t.co/lIC0bMc3vY,2020-11-05 16:10:27,Twitter Web App,5,12
This would be devastating to the Philly community and exacerbate the current #FosterCare crisis. Governments can and should make space for foster agencies with different specialties to serve kids in need.,2020-11-04 23:20:37,Twitter Web App,1,15
These two incredible women have helped over 45 foster children many of whom come from disadvantaged communities yet Philadelphia has forced CSS to either close its doors or change its religious beliefs.,2020-11-04 23:20:37,Twitter Web App,4,16
Today #SCOTUS heard oral arguments for Fulton v. Philadelphia where foster parents like Sharonell Fulton and Toni Simms-Busch are fighting to keep foster agency Catholic Social Service's doors open. https://t.co/5eY8WJaxYi,2020-11-04 23:18:51,TweetDeck,4,15
Great to see rural counties such as Beckham Cherokee Lincoln and Wagoner &amp; the town of Carney Tahlequah Wagoner and Elk City secure nearly $18M in loans and over $6M in grants! Thankful to work alongside @POTUS as we cont. to bring positive economic impact to rural Oklahoma.,2020-11-04 21:09:51,Twitter Web App,4,15
Last week the @realDonaldTrump admin announced @USDA is investing $891M to modernize rural drinking water and wastewater infrastructure in 43 states including Oklahoma.   https://t.co/MGWBk8U8cM,2020-11-04 21:09:51,Twitter Web App,4,25
In a 2017 letter a bipartisan group of law professors called Justice Barrett’s work “rigorous fair-minded respectful and constructive.” I couldn’t agree more.  Watch below for more on what I had to say before her confirmation vote. https://t.co/YFUOG3Jfpv,2020-11-03 15:00:00,TweetDeck,9,41
.@LigadoNetworks is a threat to national security and I urge my Senate colleagues and the @FCC to take swift and necessary action to protect and prioritize our security and the American people.    https://t.co/DPE8a7oYDq,2020-11-02 19:11:19,Twitter Web App,6,11
I’m disappointed in the FCC’s inaction to rescind its Ligado order despite concerns addressed in a letter to @SenateCommerce from 80 organizations including @AOPA and other aviation industries.,2020-11-02 19:11:18,Twitter Web App,9,21
It's simply false to say that Senate Republicans went against precedent to confirm ACB. As a matter of political convenience Dems flip-flopped from what they said in 2016 &amp; were adamantly opposed to a vote during an election year.   Watch my speech prior to her confirmation. ⬇️ https://t.co/8RkOazuBp0,2020-11-02 15:00:00,TweetDeck,39,139
If you support the right to life of our friends in the Down syndrome community I urge you to contact your Senators &amp; Representatives to say you support S. 2745 the Down Syndrome Discrimination by Abortion Prohibition Act.   More on this legislation. ⬇️ https://t.co/nvVU4HsFpe,2020-10-31 20:48:41,Twitter Web App,4,18
I want to wish all of our friends in the Down syndrome community a happy Down Syndrome Awareness Month. You have allies here in Congress who are fighting for you.,2020-10-31 20:48:41,Twitter Web App,3,35
I’m pleased with the successful hostage rescue mission in Nigeria to protect American lives. This only highlights the importance of our ongoing presence and partnership in West Africa. I commend @POTUS @EsperDoD our service members &amp; our intl partners for a job well done. https://t.co/k7Dbv20HIJ,2020-10-31 17:11:41,Twitter for iPhone,122,363
We’re going to keep fighting to protect every unborn child &amp; individuals with Down syndrome. I’m also happy to see @POTUS issue the “Born Alive” Executive Order to ensure that vulnerable newborn babies receive medical care &amp; are not discriminated against. https://t.co/bNjnpXcx4d,2020-10-31 16:06:51,Twitter Web App,6,34
That’s why I introduced a bill last year to prohibit abortion based on a Down syndrome diagnosis. The Down Syndrome Discrimination by Abortion Prohibition Act would prohibit a doctor from performing an abortion being sought because the unborn child has Down syndrome,2020-10-31 16:06:51,Twitter Web App,4,28
Justice Barrett is not and has never advocated in favor of taking away anyone’s health care. Period.  See what I had to say on the Senate floor ahead of her confirmation vote. ⬇️ https://t.co/6LvDILtSBE,2020-10-31 14:00:01,TweetDeck,14,59
Taking away the precious life of any unborn baby is murder but specifically denying a child the chance at life because of his or her chromosome count is a heinous effort to eliminate a vibrant community through abortion.   My full thoughts. ⬇️ https://t.co/dcc3KrdfSn,2020-10-30 19:51:35,Twitter Web App,22,79
Sadly not everyone sees it the same way. It’s really upsetting but studies show that over two-thirds of unborn babies diagnosed with Down syndrome are aborted in the U.S. and Iceland has nearly eliminated Down syndrome in their society through abortion.,2020-10-30 19:51:34,Twitter Web App,19,81
I am proud to continue to fight for the precious lives of the most vulnerable among us. Since Roe v. Wade over 60 million babies’ lives have been tragically cut short.   Read more here. ⬇️   https://t.co/dcc3KrdfSn,2020-10-30 17:07:22,Twitter Web App,34,109
When you are pro-life like I am you believe that life begins at conception. Our government has both a moral and a constitutional obligation to protect the sanctity of human life—especially the unborn.,2020-10-30 17:07:22,Twitter Web App,542,2483
Liberals cont. recycling their same stale tactics in an attempt to tarnish another exceptional #SCOTUS nominee without any basis in fact or truth. They've even attacked her for adopting children from Haiti–I’m not kidding.   For more watch my speech ahead of her confirmation. ⬇️ https://t.co/JqrCCCBnBs,2020-10-30 14:00:01,TweetDeck,17,30
To say Judge Barrett is qualified to serve on #SCOTUS is an understatement. Justice Barrett is the definition of a leader and her record of accomplishment is second to none.  Watch below to get to know more about our newest Justice from my speech ahead of her confirmation. ⬇️ https://t.co/G9HF5j5oM2,2020-10-29 19:30:00,TweetDeck,9,51
The sad reality today is that prevailing negative attitudes low expectations misinformation and bias can mean those with Down syndrome are discriminated against. Some aren’t even given the chance to live &amp; are aborted in the womb.   My full thoughts.⬇️  https://t.co/dcc3KrdfSn,2020-10-29 18:16:28,Twitter Web App,4,9
