A month later this still holds true as many of these leaders continue crumbling to the demands of the far left mob by refusing to support our law enforcement and allowing violence to run unchecked. https://t.co/I9vrHx0Mhk,2020-09-08 20:17:09,Twitter Web App,19,37
Last month I gave a speech on the senate floor discussing the defund the police movement and how the 20 most dangerous cities in America are run by Democrats. https://t.co/CwcFlEZvQP,2020-09-08 20:16:42,TweetDeck,141,252
This will provide relief to Oklahoma farmers ranchers home builders developers and energy industry that have long been plagued by the unneeded endangered listing of this species. Thanks to @POTUS’ @USFWS they will be operating with less red tape and unnecessary obstacles.,2020-09-08 18:45:53,Twitter Web App,2,12
Great to see this long-fought battle come to a close as the American Burying Beetle has made a strong resurgence and is officially downlisted. https://t.co/tKqssG25CC,2020-09-08 18:30:08,Twitter Web App,4,17
Putin is a thug and tries to stand against our interests at every turn. How do we send a message? With a strong #FY21NDAA that emphasizes our long-term priority of strategic competition with Russia and enhances deterrence to counter Russian aggression. https://t.co/4sXSCftSOq,2020-09-07 19:59:30,Twitter for iPhone,23,55
Our economy is recovering! Grateful to have a president like @realDonaldTrump that fights for the American worker at every turn. https://t.co/PYTXZwMhyZ,2020-09-07 17:00:00,TweetDeck,156,377
Happy #LaborDay2020 Okla.! As we recognize this day we see small businesses getting back on their feet &amp; job numbers rising. This has been a challenging year but under @realDonaldTrump I’m looking forward to our country emerging stronger &amp; more effective than ever before. https://t.co/pUOnxAOpWU,2020-09-07 14:00:01,TweetDeck,60,192
@OESCnews says jobless claims declined for the 10th week in a row. The Oklahoma workforce is regaining its strength and I look forward to seeing this trend continue.  https://t.co/Dmu4YYahgN,2020-09-05 20:00:00,TweetDeck,0,0
During difficult times brought on by #COVID-19 many Oklahomans filed claims to receive benefits. Unfortunately this increased fraudulent activity and identity theft. Thanks to @USDOL OK secured nearly $1.8M to combat fraud &amp; recover improper payments. https://t.co/SXTCek5OiX,2020-09-05 17:00:00,TweetDeck,10,23
Abortion is not healthcare. No person should have the “right” to take another life &amp; the federal govt should not endorse or allow this behavior. That’s why I and 19 of my colleagues have requested that the @US_FDA remove the dangerous abortion pill Mifeprex from the U.S. Market.,2020-09-05 14:00:00,TweetDeck,215,702
This is a dangerous drug that should have never been approved—much less allowed to be taken at home without supervision. https://t.co/2y0sjm01oI,2020-09-04 23:33:27,Twitter for iPhone,14,16
According to the @US_FDA the abortion pill Mifeprex has killed over 3.7 million preborn lives and caused 24 maternal deaths along with thousands of adverse maternal reactions. https://t.co/2y0sjm01oI,2020-09-04 23:33:27,Twitter for iPhone,62,74
"It is by now nakedly obvious that the abortion industry &amp; its allies...have wanted an unregulated and demedicalized abortion pill since the moment the FDA first approved it in 2000…We believe this deadly pill should never have been approved...”   More.⬇️ https://t.co/2y0sjm01oI,2020-09-04 17:38:17,Twitter Web App,7,16
Very proud to join my Senate Republican colleagues in standing up for innocent lives &amp; maternal health in our letter to @US_FDA requesting they classify the abortion pill Mifeprex as an "imminent hazard to the public health" and remove this dangerous drug from the U.S. Market.,2020-09-04 17:38:17,Twitter Web App,38,105
Mental health isn’t a battle that needs to be fought alone. Learn how you can identify warning signs and support your friends teammates and loved ones: https://t.co/z0ZtH8fqw5 https://t.co/U5C86W5MXp,2020-09-04 15:06:44,Twitter for iPhone,21,41
Great to see @USFWS announce they are downlisting the American burying beetle under the Endangered Species Act from endangered to threatened.   My full statement and more information.⬇️  https://t.co/wZaCo6Qzxu https://t.co/RQXQZojO4t,2020-09-03 23:05:22,Twitter Web App,5,21
Proud to work hand-in-hand with @AOPA as we advocate for pilots and the aviation community throughout Oklahoma and the U.S.   Thankful for their input in the recent letter @ChrisVanHollen and I sent to @USDOT and @FAANews. ⬇️   https://t.co/daTclgCSjC https://t.co/N6RpQnuJE6,2020-09-03 18:00:00,TweetDeck,4,10
Thankful for the assistance and input of @HeliAssoc in the recent letter @ChrisVanHollen and I sent to @USDOT and @FAANews on aviation workforce grants. These grants will support education curriculum and technical training for America’s aerospace sector. https://t.co/wqAeFuLNm3,2020-09-03 16:56:19,TweetDeck,5,15
Schools in Oklahoma and around America will look different this year as they adjust to their unique reality. Following a letter my colleagues and I sent to @SecretarySonny I'm proud to see @USDA extend flexible lunch programs until the end of December.  https://t.co/fBNz8EpZl2,2020-09-02 21:00:00,TweetDeck,4,8
Oklahoma tribes have secured $14.2M in grant funding thanks to @realDonaldTrump Administration’s @HUDgov. These funds will help support several projects in tribal communities including new housing upgrades to medical clinic facilities and emergency food supplies for rural areas. https://t.co/XBE24LAq2v,2020-09-02 18:30:00,TweetDeck,74,103
75 years ago today #WW2 came to an end when Japan officially surrendered aboard the USS Missouri. This victory would not have been possible without the Greatest Generation – whose remarkable service and sacrifice resulted in the triumph of freedom and democracy around the world. https://t.co/YFwtXbUuzN,2020-09-02 15:50:00,Twitter for iPhone,22,62
I am glad to hear @EPA has added the Henryetta Iron and Metal in Henryetta Okla. to its Superfund National Priorities List (NPL).   Read below for my full statement and more information on this critical project. ⬇️  https://t.co/vbP3hJrfC4 https://t.co/EkALqE17Bn,2020-09-01 19:00:00,TweetDeck,2,7
These programs will help develop needed workforce training in the aviation industry helping the industry to partner with local governments schools &amp; labor groups to provide training and close the current skills-gap to allow access to these good-paying jobs.   Read out letter.⬇️ https://t.co/8eiGWF3ktu,2020-09-01 17:28:17,Twitter Web App,4,10
Proud to join @ChrisVanHollen to lead 26 of our colleagues in sending a bipartisan letter to @USDOT &amp; @FAANews to request they implement two authorized grants to expand the development of the next generation of aircraft pilots and maintenance technicians. https://t.co/daTclgUtIc,2020-09-01 17:28:16,Twitter Web App,7,12
Great to see @OKCattlemen celebrate the 36th-annual Ranch Rodeo with twelve Oklahoma ranch partners competing to raise money for @okchf! What an incredible event and a true example of the #OklahomaStandard. https://t.co/c6cfjNamD2,2020-08-31 21:00:00,TweetDeck,6,15
Proud to join @SenPatRoberts in sending a letter to @USDA requesting they continue providing meals to school children through the Dept.'s child nutrition programs. This will ensure children in Okla. &amp; around the country do not go hungry while states continue to battle #COVID19. https://t.co/k3YEYjV5nQ,2020-08-31 18:00:01,TweetDeck,2,12
I’m praying for the loved ones of Staff Sgt. Vincent Marketta of Brick N.J. and Sgt. Tyler Shelton of San Bernardino Calif. We will remember and honor their bravery service and sacrifice. https://t.co/FikW0jmIE7,2020-08-31 15:22:04,Twitter for iPhone,103,225
Tulsa couple Mark and Mona Whitmire committed an incredible act of service and kindness for Oklahomans this week by spending $28 million to wipe out medical debt for 28321 families. This is the #OklahomaStandard.  https://t.co/orqP43t7bZ,2020-08-29 20:00:00,TweetDeck,275,617
The Oklahoma Standard is neighbors helping neighbors–and each of the organizations receiving a grant will demonstrate that Standard to families and small businesses across OK. I’m grateful for the @realDonaldTrump Administration’s recognition of that in awarding these grants.,2020-08-29 16:10:11,Twitter Web App,7,11
The additional $1.9 million in community grants from the CARES Act announced this week by @US_EDA is welcome news. I am proud to have an administration working hard for Oklahomans as our communities work to recover from the continued effects of COVID-19. https://t.co/lr617e5Nqe,2020-08-29 16:10:11,Twitter Web App,8,15
I’m proud of the work Oklahoma’s communities &amp; small businesses are doing to not only re-open safely but find unique ways to prosper amid this pandemic. Unemployment claims have dropped 22% &amp; I look forward to seeing that trend continue in our great state. https://t.co/DlWvT4fYX0,2020-08-28 21:22:29,TweetDeck,11,38
If you don’t think China is a problem here’s an example of the serious threat they pose: their military scholars are coming to the U.S. and stealing our cutting-edge research. We’re obviously missing a lot of things – and we need to fix that. https://t.co/mIkI6lvaza,2020-08-28 17:34:10,Twitter for iPhone,708,719
The #FY21NDAA will accelerate @DeptofDefense’s efforts – equipping our military with the resources needed to take on a modern PLA strengthening our alliances and partnerships in the Indo-Pacific and addressing our own vulnerabilities.,2020-08-28 17:33:41,Twitter for iPhone,38,59
Thanks to @RealDonaldTrump &amp; @EsperDOD we’ve made great strides in our ability to take on China’s rapidly modernizing military. The only thing they got wrong here is the title—because we still have a long way to go until our military is fully prepared. https://t.co/e2VJ9kcloT,2020-08-28 17:33:13,Twitter for iPhone,402,454
I'm pleased to see Taiwan announce they will be lifting their bans on Oklahoma pork and beef. As one of our key allies this is an important step in securing a strong bilateral trade agreement that will benefit Oklahoma farmers and the economy of Taiwan. https://t.co/0fly3qTiNo,2020-08-28 13:37:59,TweetDeck,47,164
My full statement on Russian forces’ breach of the deconfliction arrangement in Syria ⬇️ https://t.co/4uSF7FZQJK,2020-08-27 23:35:57,Twitter for iPhone,8,20
Russia on the other hand is continuing its reckless pattern of provocation &amp; Putin is accountable for the actions of Russian forces. Make no mistake: President Trump will defend our troops any time they are put in a position of danger just like he did in eastern Syria in 2018.,2020-08-27 23:34:40,Twitter for iPhone,7,34
I’m very proud of the professionalism and bravery of the U.S. soldiers on the ground in Syria for the restraint they showed when confronted by aggressive and reckless Russian forces and I’m praying for those who were injured.,2020-08-27 23:34:03,Twitter for iPhone,73,244
Very proud to see the @DeptVetAffairs award Oklahoma more than $1mil to support housing &amp; outreach programs for our OK veterans. These men &amp; women have fought hard for our great country &amp; it’s an honor to fight for them. Looking forward to seeing the impact these funds will have. https://t.co/9boBYYtH79,2020-08-27 19:00:01,TweetDeck,5,18
.@TheJusticeDept granted Oklahoma $8mil to be shared between @cityoftulsagov non-profits &amp; tribes that work to combat domestic violence &amp; seek justice for victims. This funding will play a major role in holding abusers accountable &amp; establishing more protection for individuals. https://t.co/8NM2zcTUvF,2020-08-27 17:24:06,TweetDeck,4,17
This funding will work to support projects of local governments and organizations as they respond to the impact of #COVID__19 within their communities. I’m looking forward to seeing Oklahoma continue to regain strength and prosper amid this pandemic. https://t.co/TLUwFUl8zN,2020-08-26 19:24:47,Twitter Web App,2,12
Very grateful to see Oklahoma businesses &amp; communities: The Fairview Regional Medical Center Authority @MainStreetEnid Indian Nations Council of Governments (INCOG) in Tulsa and the City of Grove secure funding from @AARP’s Community Challenge Grant Program!,2020-08-26 19:24:47,Twitter Web App,5,35
.@UofOklahoma is doing great work to advance AI research &amp; today’s announcement of $20mil in federal funds proves that. I'm glad to see @NSF &amp; OU work to establish a top-notch AI institute &amp; I look forward to seeing their future scientific advancements. https://t.co/ue8ZAqg9Q8,2020-08-26 16:58:50,TweetDeck,5,23
Proud to have @SenatorLankford @SenJohnBarrasso and @SenKevinCramer join me in fighting for small oil and gas producers in Oklahoma and around the country.   Read our letter below.⬇️ https://t.co/JgUsHh9ykX,2020-08-25 21:40:17,Twitter Web App,7,19
Today I sent a letter to @USGAO requesting a report on @EPA's regulatory process for methane emissions from oil &amp; gas. As small producers face higher regulatory burdens I want to highlight the disproportionate impact these regulations have on small producers compared to large.,2020-08-25 21:40:17,Twitter Web App,9,29
I was very proud to join a round table discussion with our Tulsa police officers last week. These local heroes work hard to not only protect our citizens but establish good relations with those in our communities. I have always and will always stand up for all Oklahoma LEOs. https://t.co/sMsGA5UtJS,2020-08-25 17:25:36,TweetDeck,8,38
Every state has unique needs in battling #COVID19 &amp; we must remember the federal government should not make nationwide mandates in a country as diverse as ours. Grateful to see @POTUS work hard to support our states &amp; their own specialized plans of action. https://t.co/pdPTeom7gs,2020-08-24 23:50:28,TweetDeck,52,87
I’m proud to cosponsor the Paycheck Protection Small Business Forgiveness Act to streamline the forgiveness process for smaller loans which represent 89% of all the loans in Oklahoma—to provide certainty to our local businesses. https://t.co/gKWj776EBQ,2020-08-24 20:28:16,Twitter Web App,3,12
The PPP is working. In OK the program has helped thousands of employees retain their jobs through loans to small businesses but expensive &amp; time consuming paperwork still looms. I want our small businesses to be able to focus on safely reopening not govt paperwork &amp; red tape.,2020-08-24 20:27:43,TweetDeck,6,35
Very proud to see @CitizensEdmond work with @rfbo to provide food security to Oklahoma children. Follow their progress and learn how you can help below! https://t.co/t0wMe9ANNl,2020-08-24 19:00:28,TweetDeck,9,27
Scenes like we see in Portland won’t happen in Oklahoma but they could happen in other cities where lawlessness is pervasive. Thankfully @realDonaldTrump stands up for law and order – and for our law enforcers. https://t.co/nVhOhCRGbp,2020-08-22 16:00:02,TweetDeck,219,580
The reality of this left-wing cancel culture mob is that there is no goal of debate – the goal is to shame humiliate and ridicule into conformity through a vicious attack reminiscent of a Chinese Communist Party struggle session. Liberty is under siege. https://t.co/23SpDHRoWh,2020-08-22 14:00:00,TweetDeck,198,345
Like others I watch with shock as this emotional mob moves towards a Cultural Revolution takeover. Does our nation have flaws? Of course. But what is perhaps the most beautiful part of our nation is that we have the ability to see those flaws to change them and to grow. https://t.co/jyfAZr1SPd,2020-08-21 16:00:01,TweetDeck,65,156
Last month two Tulsa Police officers were conducting a routine traffic stop. But as any veteran officer will tell you there is no such thing as a routine anything in law enforcement. I want to make it clear that some of us are standing up against defunding police. See why⬇️ https://t.co/zRrgLBI9da,2020-08-21 14:00:01,TweetDeck,77,163
Thankfully our economy is already making a comeback and this $4.2 mil in grants from the CARES Act is an important part of community-driven efforts to recover from the virus. @realDonaldTrump is working hard to ensure funds I voted for are made available to our local communities. https://t.co/K5he2o7Pkc,2020-08-20 16:00:01,TweetDeck,67,111
I joined @SenPatRoberts and a group of our colleagues in urging the @USDA to continue providing flexibilities to schools and sponsoring organizations for school meals and child nutrition.   Read the full letter below. https://t.co/4GN1P4zo5R,2020-08-20 14:00:01,TweetDeck,4,11
I am glad to further aviation and aerospace investment in OK such as with improvements like Bristow Airport’s new runway or supporting the Federal Contract Tower Program—to ensure aviation continues to play such a strong role in Oklahoma’s economy.,2020-08-19 23:17:00,Twitter Web App,5,17
As a proud pilot I have spent my career empowering &amp; supporting our aviation and aerospace industry an industry that contributes $44 billion to the Oklahoma economy annually—creating jobs and economic opportunity across the state.,2020-08-19 23:16:00,Twitter Web App,14,70
Today is #NationalAviationDay a day to celebrate the pilots maintenance professionals flight crews and air traffic controllers integral to our national airspace. Along with the families they connect through each &amp; every flight.,2020-08-19 23:15:00,Twitter Web App,5,20
Today I stopped in McAlester to discuss how they will benefit from the #FY21NDAA &amp; the support it provides the McAlester Army Ammunition Plant. I also had the opportunity to speak with community leaders about policing in OK the status of #USPS &amp; how these issues impact OK.,2020-08-19 21:17:39,Twitter Web App,6,31
While OK continues to safely reopen we need to continue to help those seeking unemployment. After Senate Dems blocked the extension of UI benefits @realdonaldtrump took action. Leadership of @POTUS @GovStitt made sure Oklahoma was quickly approved to help struggling families. https://t.co/akMDqHb2TO,2020-08-19 19:11:17,TweetDeck,30,81
If you haven't already you can subscribe to my newsletter at https://t.co/zRMlVEyaeQ to stay up-to-date on my latest travels and news from Washington. Read my latest newsletter below—a round up of some of my meetings in Altus Tulsa and Canadian County.  https://t.co/t94AbZXTXa,2020-08-19 14:00:01,TweetDeck,4,15
Even amidst the #COVID-19 pandemic we are seeing our economy make a comeback under the direction of @realDonaldTrump. Less Americans are requesting aid and more are returning to work as states transition into their re-opening phases.  https://t.co/ut8iOZc9vg,2020-08-18 21:00:01,TweetDeck,10,41
Enjoyed my time at @MetaSpecialAero today where we had a very important discussion about the current challenges our local businesses are facing during this #COVID19 pandemic. https://t.co/xtBbcEaHxx,2020-08-18 18:32:06,TweetDeck,4,15
Portland alone three officers are facing possible permanent blindness after having high intensity lasers shone into their eyes. Other officers have been hit with bricks fireworks &amp; endured verbal assaults. At least 30 officers have been victims of doxing. https://t.co/H23kuSQAOE,2020-08-17 16:00:01,TweetDeck,106,107
Sadly the defund the police movement is having a real negative impact.  Shootings in New York ⬆️ 277% Shootings in Chicago ⬆️ 50% https://t.co/J51poWcpvF,2020-08-17 14:00:00,TweetDeck,358,580
Important piece by Dr. @SenJohnBarrasso. The @us_FDA commits to approve a #COVID19 vaccine only if safe and effective. Operation Warp Speed is making impressive progress - critical to our overall response. https://t.co/paRCeQ5b4T,2020-08-17 00:15:40,Twitter for iPhone,33,105
I'm proud to see our bipartisan legislation pass the Senate and I look forward to its passage in the House soon. Together we can continue efforts to establish a commission that will help us best celebrate 2026 as the centennial anniversary of America’s first all-weather highway.,2020-08-15 19:21:35,Twitter for iPhone,4,18
Route 66 is iconic in Oklahoma. Reaching more than 400 miles through Tulsa Oklahoma City and countless other towns in between our state is home to the longest drivable stretch of Route 66 also known as the Will Rogers Highway. https://t.co/xGzqwGpNys,2020-08-15 19:20:23,Twitter for iPhone,21,78
The response from local leaders? They have caved to the mob and won’t allow local law enforcement to protect federal property. So that leaves us with two options. ⬇️ https://t.co/CNXOBBMhUR,2020-08-15 14:05:00,TweetDeck,76,134
For over 60 days violent demonstrators have laid siege to Portland. These are not peaceful protesters. Everyone agrees in the 1st Amendment &amp; support for peaceful demonstrations. Fires lasers bricks Molotov cocktails &amp; sledgehammers are not used in peaceful demonstrations. https://t.co/qnzWqIZERt,2020-08-15 14:00:01,TweetDeck,71,125
Proud of the joint work between @OSUMedicine &amp;the Zarrow Foundation as the vision of the new VA hospital in Tulsa and transition of the facility in Muskogee becomes a reality. It’s great to see our veterans health &amp; well-being prioritized in Eastern Okla.  https://t.co/4Sl1V5lbbm,2020-08-14 16:18:53,TweetDeck,8,18
To our nation’s police sheriffs and all law enforcement state and federal – thank you. I appreciate you and am grateful for your service. Now why has that become controversial? Watch below. ⬇️ https://t.co/NuKbtCQUR9,2020-08-14 14:00:01,TweetDeck,51,142
Congratulations to my friends -- President @realDonaldTrump PM @netanyahu &amp; Crown Prince @MohamedBinZayed -- on this historic agreement. Peace will pave the way for greater prosperity -- for Israelis Emiratis and the region at large. https://t.co/2ljiMbtLv3,2020-08-13 20:39:16,TweetDeck,59,182
It was a pleasure to sit down with Oklahoma City business leadership at @Team_Tinker this week. We discussed job growth the future B-21 maintenance mission and the benefits the #FY21NDAA will bring to Tinker Air Force Base. https://t.co/4S4P3pyK3H,2020-08-13 16:36:35,TweetDeck,8,21
Had a great afternoon discussing the new Tulsa VA hospital and Muskogee’s transition into a behavioral health center of excellence. I’m looking forward to seeing both be a source for top of the line care for our veterans in Eastern Oklahoma. https://t.co/fpvQOHXF1n,2020-08-12 23:00:00,TweetDeck,5,19
Today I met with Oklahoma cotton farmers to discuss the impact of #COVID19 benefits of CARES Act funding &amp; what options Congress needs to include moving forward. As a top 10 cotton producing state—I will work to ensure OK is provided with the necessary resources to stay on top. https://t.co/ZuJmIbsb1D,2020-08-12 21:30:58,TweetDeck,11,36
It was good to meet with @138thFW yesterday morning to discuss their exciting future. We talked about how they will benefit from the #FY21NDAA and their progress on their bid to host the F35. https://t.co/38A1J4wEUr https://t.co/NrDLpmKrpo,2020-08-12 18:15:41,Twitter Web App,4,23
Kay and I send our deepest condolences to the family and friends of @K101online's famous radio personality J. Douglas. He was a pillar in the Woodward community beloved entertainer and a dear friend. He will be greatly missed and always remembered. https://t.co/t2Qsoh4Exi,2020-08-11 23:10:00,TweetDeck,3,20
I also had the pleasure to meet with advocates from @MarsysLawforOK an organization that works to ensure victims of crimes have enforceable constitutional rights in the criminal justice system. Grateful for these individuals that work to protect and represent our communities. https://t.co/gyLiYOA9w6,2020-08-11 22:01:56,Twitter Web App,2,13
Great to meet with @Canadian_Co_SO today to discuss the status of policing and morale throughout the department. I’m so thankful for the sheriffs and officers that put their lives on the line every day to keep our great state safe! https://t.co/aJggWoyiGT,2020-08-11 22:01:55,Twitter Web App,6,19
I'm grateful for my Senate colleagues who refuse to allow this organization to run unchecked. I have and will always fight for the right to life that Planned Parenthood constantly works to eradicate.   Read our letters urging investigations.⬇️ https://t.co/9wz1Dk46KN,2020-08-11 17:05:27,Twitter Web App,5,13
I was proud to join @SenatorLoeffler in sending letters to the @USTreasury &amp; @TheJusticeDept supporting investigations into Planned Parenthood for its criminal activity including its abuse of PPP funds and involvement in fetal tissue trafficking. https://t.co/1ValMAjusM https://t.co/o06r6zUCDf,2020-08-11 17:04:00,TweetDeck,11,23
I appreciate @realdonaldtrump’s commitment that commercial use of mid-band spectrum will never compromise the needs of our warfighters military preparedness or national security.,2020-08-11 14:21:01,Twitter for iPhone,4,16
Glad DOD is working with the Administration to provide commercial spectrum to improve rapid 5G access - great news for our economy and rural communities - while preserving warfighter requirements. This sensible balance is how 5G rollout should work. https://t.co/sP87pQ2bSr,2020-08-11 14:20:20,Twitter for iPhone,10,23
The @SpaceForceDoD's decision to launch critical national security missions on the @ulalaunch #VulcanCentaur will make America safer. We must continue to strengthen our capabilities and not let our adversaries take the lead.,2020-08-10 23:30:00,TweetDeck,19,136
For 71 years @DeptofDefense has defended our national security and supported the most capable lethal fighting force in the world - and we’re grateful for it. https://t.co/f5p3OTGWGv,2020-08-10 21:25:38,Twitter for iPhone,10,27
